organization,scholar_id,affiliation,id_institucion,email_domain,citedby,interests
9232372474901008384,_dRgKD8AAAAJ,Universidad de Chile,uchile,@dcc.uchile.cl,97887,"Neurobiology, Cognition, Autopoiesis, Language, Education"
9232372474901008384,pSY7g_YAAAAJ,"Research Institute of Dental Science  Faculty of Dentistry, University of Chile",uchile,@u.uchile.cl,32863,"Cellular Biology, Cancer"
9232372474901008384,9EwBymgAAAAJ,"Profesor de Astronomía, Universidad de Chile",uchile,@u.uchile.cl,29927,
9232372474901008384,_fx52FkAAAAJ,University of Chile,uchile,@dcc.uchile.cl,28529,"algorithms and data structures, text searching, compression, similarity search"
9232372474901008384,SJUEA8uk4iYC,Profesor de Economía Universidad de Chile,uchile,@fen.uchile.cl,26512,"Macroeconomics, International Economics, International Finance, Economic Development"
9232372474901008384,_07ZLa4AAAAJ,"Professor, Molecular & Clinical Pharmacologt, Faculty of Medicine, University of Chile",uchile,@med.uchile.cl,20822,"neuroscience, toxicology, biochemistry, molecular biology, stem cells"
9232372474901008384,l2TIoXkAAAAJ,Universidad de Chile,uchile,@ciq.uchile.cl,20054,Cardiovascular Disease Inflammation
9232372474901008384,HmELI5UAAAAJ,"Professor, Geophysics Department, Universidad de Chile",uchile,@uchile.cl,19030,Atmospheric Sciences
9232372474901008384,tFVzdokAAAAJ,Universidad de Chile,uchile,@uchile.cl,16489,"Alpine ecology, pollination, biogeography, conservation"
9232372474901008384,GTiVKRcAAAAJ,Universidad de Chile,uchile,@med.uchile.cl,15397,"cardiovascular, calcium signaling"
9232372474901008384,cgjx6tMAAAAJ,"Profesor de Bioquímica, Facultad de Medicina, Universidad de Chile",uchile,@med.uchile.cl,15072,"Estrés oxidativo, mecanismos de daño y protección hepáticos"
9232372474901008384,lu8PRvkAAAAJ,"Profesor de Astronomía, Universidad de Chile",uchile,@das.uchile.cl,14700,"Radioastronomía, Instrumentación Astronómica"
9232372474901008384,Xf_ulNAAAAAJ,universidad de chile,uchile,@uchile.cl,14656,urbanismo
9232372474901008384,BgkzLTUAAAAJ,Faculty of Dentistry. University of Chile,uchile,@odontologia.uchile.cl,13019,"Cellular and Molecular Biology, Autophagy, Neurodegenerative Diseases, Obesity and derived affections, Oral diseases"
9232372474901008384,R86WqdoAAAAJ,Universidad de Chile,uchile,@inta.uchile.cl,11839,"Obesity, adipose tissue dysfunction, calcium sensing receptor"
9232372474901008384,cxaipVoAAAAJ,Universidad de Chile,uchile,@uchile.cl,11729,"Biología celular, Biología del Desarrollo, Biología Molecular"
9232372474901008384,1g7H4ToAAAAJ,"Department of economics, University of Chile",uchile,@fen.uchile.cl,11081,"Economic development, environmental economics"
9232372474901008384,WboqEP8AAAAJ,"Professor of Cell and Molecular Biology, University of Chile",uchile,@med.uchile.cl,11002,"signal transduction, cancer, cell death"
9232372474901008384,v1yWwKUAAAAJ,"Assistant Professor of Astronomy, Universidad de Chile",uchile,@das.uchile.cl,10813,"Planet Formation, Protoplanetary Disks"
9232372474901008384,yoH4l0UAAAAJ,Universidad de Chile,uchile,@das.uchile.cl,10556,astrophysics
9232372474901008384,BgXxxS8AAAAJ,"Programa de Farmacología Molecular y Clínica, Instituto de Ciencias Biomédicas, Facultad de Medicina, Universidad de Chile",uchile,@med.uchile.cl,10469,Estrés Oxidativo
9232372474901008384,bmtKa3sAAAAJ,"departamento de geografia, universidad de chile",uchile,@uchile.cl,10340,glaciology
9232372474901008384,ecwhM0oAAAAJ,"Electrical Engineering Department, University of Chile",uchile,@ing.uchile.cl,10070,"Power Electronics, Electric Drives, Wind Energy, Renewable Energy"
9232372474901008384,2BLPkosAAAAJ,"Industrial Engineering, Universidad de Chile",uchile,@dii.uchile.cl,9999,"operations research, optimization"
9232372474901008384,jzeqUi4AAAAJ,"Computer Science Department, Universidad de Chile",uchile,@dcc.uchile.cl,10031,"Data, Knowledge Graphs, Databases, Semantic Web, RDF"
9232372474901008384,xXkuYEEAAAAJ,"University of Chile, Karolinska institutet, Manheim",uchile,@med.uchile.cl,9845,"Neuroscience, Pharmacology"
9232372474901008384,zugBuscAAAAJ,"Assistant Professor, Astronomía, Universidad de Chile",uchile,@das.uchile.cl,9795,"Active Galactic Nuclei, blazars, radio astronomy, time domain astronomy, time series analysis"
9232372474901008384,gOj959UAAAAJ,"Full Professor, Universidad de Chile",uchile,@u.uchile.cl,9731,Astronomy
9232372474901008384,-8-ZtOEAAAAJ,Professor of Learning Technologies and Human-Computer Interaction at the University of Chile,uchile,@uchile.cl,9643,"Learning Technologies, Computers in Education, Human-Computer Interaction, Technology for People with Disabilities"
9232372474901008384,5ntc1PMAAAAJ,Universidad de Chile,uchile,@cec.uchile.cl,9613,"Power Systems, Renewables, Solar Energy, Microgrids, Energy Markets"
9232372474901008384,sSEH1OAAAAAJ,Profesora Universidad de Chile,uchile,@uchile.cl,9592,"Educación, Politicas"
9232372474901008384,PWLh77oAAAAJ,"Professor of Economics, University of Chile.",uchile,@fen.uchile.cl,9416,"economics, statistics"
9232372474901008384,EqeZJ10AAAAJ,University of Chile,uchile,@uchile.cl,9203,"Soil-Plant-Water Relations, Plant Breeding, Agronomy"
9232372474901008384,tTMtjNUAAAAJ,Universidad de Chile,uchile,@uchile.cl,8666,Quaternary paleoecology paleoclimatology
9232372474901008384,UeodjIAAAAAJ,Universidad de Chile: Centro de Investigación Avanzada en Educación y Departamento de Sociología,uchile,@ciae.uchile.cl,8657,"Educación, Política Educacional, Sociología de la Educación"
9232372474901008384,KWObrhMAAAAJ,"Professor, University of Chile",uchile,@uchile.cl,8416,Functional genomics
9232372474901008384,uByOqqwAAAAJ,"Dept. Neurosciences, BNI, CEMC, ICBM, F. Medicine, Universidad de Chile",uchile,@med.uchile.cl,8338,"Calcium signaling, calcium release channels, redox regulation"
9232372474901008384,Ru_N1TkAAAAJ,"Profesor Titular, Universidad de Chile",uchile,@uchile.cl,8045,Fisiología Muscular
9232372474901008384,KhO5OwkAAAAJ,"Professor of Geology, Universidad de Chile",uchile,@ing.uchile.cl,7950,"Economic Geology, Geochemistry, Earth Science"
9232372474901008384,8nL6ZKsAAAAJ,Universidad de Chile,uchile,@u.uchile.cl,7806,química
9232372474901008384,mYN1dVQAAAAJ,"Center for Mathematical Modeling, University of Chile",uchile,@dim.uchile.cl,7861,"Ergodic Theory, Topological Dynamics, Symbolic Dynamics, Bioinformatics"
9232372474901008384,2_o6_SkAAAAJ,"Profesor de Nutrición, Universidad de Chile",uchile,@inta.uchile.cl,7809,micronutrients
9232372474901008384,MJ8rA_8AAAAJ,Universidad de Chile,uchile,@inta.uchile.cl,7865,"Nutrition, Public Health, Growth"
9232372474901008384,bILoTH4AAAAJ,"Full Professor, Facultad de Medicina, Universidad de Chile",uchile,@med.uchile.cl,7690,"immunology, inflammation"
9232372474901008384,F77BFPkAAAAJ,"Full Professor, Universidad de Chile",uchile,@inta.uchile.cl,7483,"Antioxidants, Polyphenols, Oxidative stress"
9232372474901008384,sv8m9q4AAAAJ,Universidad de Chile,uchile,@dii.uchile.cl,7428,"Operations Research, Logistics, Integer Programming, Transportation, System Analysis"
9232372474901008384,cgxUZv0AAAAJ,"Professor of Transport Economics, Universidad de Chile",uchile,@ing.uchile.cl,7396,Transport Economics
9232372474901008384,jTWJYbEAAAAJ,Universidad de Chile,uchile,@das.uchile.cl,7392,"Exoplanets, Astrophysics"
9232372474901008384,RRxHKGMAAAAJ,"Professor, Universidad de Chile, Advanced Center for Chronic Diseases (ACCDiS)",uchile,@ciq.uchile.cl,7193,"nanomedicine, drug delivery, peptides, Chronic diseases"
9232372474901008384,WzCAULkAAAAJ,"Professor of Industrial Engineering, Universidad de Chile",uchile,@dii.uchile.cl,7090,"Operations Research, Data Mining, Business Analytics, Data Science"
9232372474901008384,gGy4EK8AAAAJ,"Professor, Universidad de Chile. Director, Center for Genome Regulation",uchile,@uchile.cl,7077,"Genomics, Developmental Biology, Regeneration"
9232372474901008384,Qk3qyJEAAAAJ,Universidad de Chile,uchile,@uchile.cl,7155,"Forest ecology, Biogeography, Forest dynamics, Nature conservation, Global Change"
9232372474901008384,OM6_4PQAAAAJ,Universidad de Chile,uchile,@uchile.cl,6942,"Neurology, neuroscience, cognitive neurology"
9232372474901008384,zstvWCgSQ8YC,"DCC, Universidad de Chile; IMFD",uchile,@dcc.uchile.cl,6980,"semantic web, linked data, knowledge graphs"
9232372474901008384,x3EwWlgAAAAJ,"Professor of Astronomy, Universidad de Chile",uchile,@das.uchile.cl,6843,"Astrophysics, intergalactic medium, gravitational lensing"
9232372474901008384,ht2jo50AAAAJ,"Dpt. of Nutrition, Fac. of Medicine, University of Chile",uchile,@med.uchile.cl,6923,"Human Nutrition, Digestive physiology"
9232372474901008384,ejYvw6AAAAAJ,"Professor Astronomy Department, Universidad de Chile",uchile,@das.uchile.cl,6747,"star formation, Interstellar medium, molecular clouds, Magellanic Clouds, low metallicity galaxies"
9232372474901008384,EnWls0AAAAAJ,Universidad de Chile,uchile,@uchile.cl,6705,"radicales libres, antioxidantes, ESR, quimica medica"
9232372474901008384,ca_qTCkAAAAJ,Universidad de Chile,uchile,@inta.uchile.cl,6690,"biotecnología, alimentos, microbiota, enzibióticos, fagos"
9232372474901008384,eZBFWGEAAAAJ,"Associate Professor Department of Computer Science, University of Chile - Amazon Visiting Academic",uchile,@dcc.uchile.cl,6552,"Social Networks, Data Mining, Web, Information Retrieval, Machine Learning"
9232372474901008384,slfQrd0AAAAJ,Universidad de Chile,uchile,@dgf.uchile.cl,6543,"atmospheric sciences, climate, geology"
9232372474901008384,GIB2jSAAAAAJ,"Instituto de Nutrición y Tecnología de los Alimentos, Universidad de Chile",uchile,@inta.uchile.cl,6410,"Microbiología, evolución"
9232372474901008384,hMBHGzUAAAAJ,"Professor of Economics, FEN, Universidad de Chile",uchile,@fen.uchile.cl,6357,"Economic development, international economics, macroeconomics"
9232372474901008384,LRFxpc0AAAAJ,Universidad de Chile,uchile,@ing.uchile.cl,6417,"heterogeneous Catalysis, Photocatalysis, hydrogen, CO2, energy"
9232372474901008384,P4MWRFEAAAAJ,Universidad de Chile,uchile,@uchile.cl,6336,Conservación biológica
9232372474901008384,BUc-k1MAAAAJ,Departamento de Economía -  Universidad de Chile,uchile,@econ.uchile.cl,6310,"pobreza, desigualdad, mercados laborales, economía de la educación, evaluación de impacto"
9232372474901008384,U_df6NEAAAAJ,Universidad de Chile,uchile,@uchile.cl,6387,"cytoskeleton, neuronal differentiation, neurodegenerative disorders, aging, geroscience"
9232372474901008384,Xfl5QmAAAAAJ,"Professor of Anatomy and Developmental Biology, Universidad de Chile",uchile,@uchile.cl,6106,"Development, Tissue Morphogenesis, Mechanics, Left-Right Asymmetry, Fish Embryos"
9232372474901008384,Mo_WXS4AAAAJ,Universidad de Chile,uchile,@inta.uchile.cl,6073,"obesidad infantil, actividad física"
9232372474901008384,gEnD2_cAAAAJ,Universidad de chile,uchile,@ciq.uchile.cl,6041,"Neuroendocrinologia, neurofarmacologia"
9232372474901008384,qabycucAAAAJ,"INTA, Universidad de Chile",uchile,@inta.uchile.cl,5851,"Validación de instrumentos, modelación, análisis multivariados, envejecimiento"
9232372474901008384,kXJYk20AAAAJ,Universidad  de Chile,uchile,@odontologia.uchile.cl,5768,"Oral Pathology, Periodontitis Biomarkers, Endodontics, Systemic inflammation"
9232372474901008384,ce1kvYUAAAAJ,"Departamento de Astronomía, Universidad de Chile",uchile,@das.uchile.cl,5639,"Astronomy, Star Formation, Astrochemistry, Astroinformatics"
9232372474901008384,KLpE0k0AAAAJ,"Profesor titular, Universidad de Chile",uchile,@inta.uchile.cl,5636,
9232372474901008384,UwNv9B0AAAAJ,Universidad de Chile,uchile,@ing.uchile.cl,5659,Petrology and Geochemistry
9232372474901008384,SM1ghUEAAAAJ,"Department of Electrical Engineering, University of Chile",uchile,@cec.uchile.cl,5659,"Neural Networks, Clustering, Feature Selection, Big Data, Computational Intelligence"
9232372474901008384,FjUdU10AAAAJ,Universidad de Chile,uchile,@dii.uchile.cl,5553,"Industrial organization, trade theory, regulation, corporate finance"
9232372474901008384,wQUy7CAAAAAJ,University of Chile,uchile,@fen.uchile.cl,5561,"International Trade, Productivity, Innovation"
9232372474901008384,1SHHThYAAAAJ,University of Chile,uchile,@ing.uchile.cl,5580,"Fault diagnosis, Failure prognosis, Bayesian state estimation"
9232372474901008384,psy143EAAAAJ,Universidad de Chile,uchile,@med.uchile.cl,5465,
9232372474901008384,i2TCCA4AAAAJ,Profesor titular Universidad de Chile,uchile,@uchile.cl,5438,Inmunología
9232372474901008384,qst2D-gAAAAJ,Profesor Titular Neurologia Hospital Clinico Universidad de Chile,uchile,@uchile.cl,5417,"Neurología, demencias, Alzheimer, neurociencias"
9232372474901008384,ACrUb6MAAAAJ,Universidad de Chile,uchile,@uchile.cl,5469,Food Science and Technology
9232372474901008384,d0Dk7hMAAAAJ,"Facultad de Medicina, Universidad de Chile",uchile,@uchile.cl,5340,Infectologia
9232372474901008384,SkRSKBIAAAAJ,"Full Professor, University of Chile",uchile,@ciq.uchile.cl,5228,"Electrochemistry, Bioelectrochemistry, Electroanalytical"
9232372474901008384,U0XHBs8AAAAJ,Universidad de Chile,uchile,@ing.uchile.cl,5187,"Mobile Robotics, Computer Vision, Face Analysis"
9232372474901008384,J14cEJEAAAAJ,University of Chile,uchile,@ciq.uchile.cl,5144,Chemistry
9232372474901008384,3iH2LfsAAAAJ,Universidad de Chile,uchile,@inta.uchile.cl,5205,"diabetes, autoinmunidad, epigenética"
9232372474901008384,sLVFni0AAAAJ,"Professor, Universidad de Chile",uchile,@med.uchile.cl,5150,Cell  and Molecular Biology
9232372474901008384,aUtukf4AAAAJ,"Computer Science Department, University of Chile",uchile,@dcc.uchile.cl,5108,"Mobile and Ubiquitous Computing, Socio-technical Systems, Software Engineering"
9232372474901008384,aWUFM5sAAAAJ,"Full Proffesor, Human Nutrition Unit. INTA, University of Chile",uchile,@inta.uchile.cl,5109,"Micronutrients, Cardiovascular disease, Diabetes"
9232372474901008384,iq-QblMAAAAJ,"Profesor Titular, Universidad de Chile",uchile,@uchile.cl,5057,"Procesamiento de alimentos, especies de zonas áridas, compuestos bioactivos"
9232372474901008384,sQbSxDoAAAAJ,"Professor, U. Chile",uchile,@ing.uchile.cl,5087,"Fuzzy systems, Predictive Control"
9232372474901008384,kNh7fPsAAAAJ,"Associate Professor, Faculty of Dentistry, University of Chile",uchile,@uchile.cl,5089,"Oral Mucosal Immunology, Periodontology"
9232372474901008384,GyiegqsAAAAJ,"Profesor, Universidad de Chile",uchile,@uchile.cl,4941,"Canales de iones, estructura e proteínas de membrana"
9232372474901008384,4n42PKoAAAAJ,"ACCDiS, Advanced Center for Chronic Diseases. Universidad de Chile.",uchile,@ciq.uchile.cl,4977,"Cell Biology, Signal Transduction, Mitochondria, Metabolism"
9232372474901008384,AWe-qKcAAAAJ,"Profesor de Inmunología, Universidad de Chile",uchile,@u.uchile.cl,4948,"Inmunología, cáncer, inmunoterapia"
9232372474901008384,JdXR024AAAAJ,"Profesor de Farmacología y Neurociencias, Facultad de Medicina, Universidad de Chile",uchile,@med.uchile.cl,4936,"farmacología, comportamiento, aprendizaje, ansiedad, depresión"
9232372474901008384,fCJZmKwAAAAJ,Universidad de Chile,uchile,@uchile.cl,4931,Ecology and Evolution
9232372474901008384,oX4KpNQAAAAJ,Universidad de chile,uchile,@u.uchile.cl,4848,
9232372474901008384,0lczYtMAAAAJ,"INTA, Universidad de Chile",uchile,@inta.uchile.cl,4747,
9232372474901008384,A2WD03UAAAAJ,"Profesor, Universidad de Chile",uchile,@hcuch.cl,4701,"Fetal Medicine, Maternal Fetal Medicine, Fetal Therapy, Obstetrics Ultrasound, Obstetrics and Gynecology"
9232372474901008384,9eI25jMAAAAJ,"Professor of Physics, FCFM, Department of Physics, University of Chile",uchile,@dfi.uchile.cl,4602,"Nonlinear Physics, Non-equilibrium Physics, Nonlinear dynamics, Nonlinear optics"
9232372474901008384,_O0imNsAAAAJ,"Profesor Asociado Facultad de Medicina, Universidad de Chile",uchile,@uchile.cl,4603,
9232372474901008384,ii7ImRwAAAAJ,"Departamento de Fisica, Facultad de Ciencias, Universidad de Chile",uchile,@macul.ciencias.uchile.cl,4529,"Dynamics of Complex systems, Astrophysical Plasmas, Nanoscience"
9232372474901008384,kdP_2ZQAAAAJ,"Departamento de Geofísica, Universidad de Chile",uchile,@dgf.uchile.cl,4477,"Sismología, Peligro y Riesgo Sísmico, Geodinámica, Sismotectónica"
9232372474901008384,jQoTB-gAAAAJ,Universidad de Chile,uchile,@antar.uchile.cl,4474,"ecología de ecosistemas, moderación numérica"
9232372474901008384,bbZWdFUAAAAJ,"Department of Computer Science, University of Chile",uchile,@dcc.uchile.cl,4446,"Similarity search, Content-based multimedia information retrieval, Multimedia Indexing, 3D model retrieval"
9232372474901008384,LZd9fu8AAAAJ,"Full Professor, Universidad de Chile",uchile,@uchile.cl,4432,"Plant Ecology, Plant invasion Biology, Biodiversity Coservation"
9232372474901008384,kpdsKYwAAAAJ,Universidad de Chile,uchile,@uchile.cl,4343,neuroscience
9232372474901008384,dmj_gE4AAAAJ,"Professor of Computer Science, Universidad de Chile",uchile,@dcc.uchile.cl,4354,"Human-Computer Interaction, Process Modeling, Expert Systems"
9232372474901008384,d0LISE4AAAAJ,"Professor of Computer Science, University of Chile",uchile,@dcc.uchile.cl,4342,"Programming Languages, Software Engineering"
9232372474901008384,GGi4-2QAAAAJ,"Department of Geology, Universidad de Chile",uchile,@ing.uchile.cl,4332,"Geochemistry, Isotope geochemsitry, Geochronology, Economic geology, Metallogenesis"
9232372474901008384,-JSkVSQAAAAJ,"Department of Economics, Universidad de Chile",uchile,@fen.uchile.cl,4303,"Macroeconomics, International Finance, Economic Development"
9232372474901008384,zmrNJHEAAAAJ,"Médico Especialista en Medicina Intensiva; Profesor Titular, Universidad de Chile",uchile,@hcuch.cl,4280,"Ventilación Mecánica, Sindrome de Distrés Respiratorio Agudo, Sepsis"
9232372474901008384,Kk6Y__gAAAAJ,"Professor of Microbiology, University of Chile",uchile,@uchile.cl,4255,"Microbiology, Biotechnology"
9232372474901008384,v6qgA4EAAAAJ,"Profesor de Geología, Facultad de Ciencias Físicas y Matemáticas, Universidad de Chile",uchile,@uchile.cl,4214,"Geología y geomorfología cuaternaria, geología marina, peligros geológicos, paleosismología, paleoclima"
9232372474901008384,bvtMvBUAAAAJ,"Associate Professor, INTA, University of Chile",uchile,@inta.uchile.cl,4282,"microbiology, microbiota, probiotics"
9232372474901008384,9at1wjkAAAAJ,University of Chile,uchile,@ing.uchile.cl,4156,geostatistics
9232372474901008384,njP0LAwAAAAJ,Universidad de Chile,uchile,@ciq.uchile.cl,4128,Polymer and Materials Science
9232372474901008384,wnolr9sAAAAJ,Universidad de Chile,uchile,@u.uchile.cl,4171,"Botany, Biogeography"
9232372474901008384,0eZSQEkAAAAJ,UNIVERSIDAD DE CHILE,uchile,@uchile.cl,4129,
9232372474901008384,Oi3Phu8AAAAJ,"Associate Professor, Departamento de Física, FCFM, Universidad de Chile",uchile,@ing.uchile.cl,4091,"condensed matter physics, quantum transport, driven systems and Floquet theory, graphene, topological quantum matter"
9232372474901008384,vnH5v4oAAAAJ,"INTA, Universidad de Chile",uchile,@inta.uchile.cl,4086,"Osteoporosis, Mesenchymal stem cells"
9232372474901008384,Kq4dWnoAAAAJ,"Profesor de la Facultad de Derecho, Universidad  de Chile",uchile,@derecho.uchile.cl,4048,"política comparada, regímenes autoritarios, bases económicas de la democracia"
9232372474901008384,QKniBGwAAAAJ,Professor E.E. Dept. University of Chile,uchile,@ing.uchile.cl,4001,"Automation, Energy, Wine Industry"
9232372474901008384,pkfRv9YAAAAJ,"Prof. Titular, Universidad de Chile",uchile,@u.uchile.cl,3972,"Ecología, conservación de biodiversidad en agroecosistemas"
9232372474901008384,6i0W62wAAAAJ,"Department of Geophysics, Universidad de Chile; Center for Climate and Resilience Research, Chile",uchile,@dgf.uchile.cl,4004,Climate Variability
9232372474901008384,h2F8sjEAAAAJ,"Professor of Mathematics, University of Chile",uchile,@dim.uchile.cl,3886,"Applied Mathematics, Partial Differential Equations, Inverse Problems, Fluid Mechanics"
9232372474901008384,Kali-yUAAAAJ,Universidad de Chile,uchile,@uchile.cl,3845,Physics
9232372474901008384,0U7P56IAAAAJ,Universidad de Chile,uchile,@u.uchile.cl,3855,"snow hydrology, mountain hydrology, water resources"
9232372474901008384,qvCkUSkAAAAJ,"Profesor Asociado, Facultad de Medicina, Universidad de Chile",uchile,@uchile.cl,3800,"Fisiología renal, Fisiología cardiovascular, Insuficiencia Renal, Hipertensión Arterial"
9232372474901008384,i6_OY98AAAAJ,Profesor de Bioética Universidad de Chile/ Researcher Sloan Kettering Cancer Institute,uchile,@u.uchile.cl,3737,"genética, bioética, ética de investigación"
9232372474901008384,OP0ZdHUAAAAJ,"Profesor Titular, Universidad de Chile",uchile,@u.uchile.cl,3690,"energetics, physiological ecology, isotopic ecology, zoology"
9232372474901008384,YcXCdwMAAAAJ,Laboratorio para el Análisis de la Biósfera (LAB) / Universidad de Chile      Laboratorio de,uchile,@uchile.cl,3750,Teledetección Cuantitativa y Energías Eólica Marina
9232372474901008384,GVmLpu0AAAAJ,Universidad de Chile,uchile,@ing.uchile.cl,3707,"engineering, social sciences, transportation"
9232372474901008384,90tOwg8AAAAJ,Professor Universidad de Chile,uchile,@uchile.cl,3654,"Developmental biology, Cancer, Regenerative Medicine, Stem cells, Shh signaling neurodevelopmental disorders"
9232372474901008384,Zh4GpigAAAAJ,Universidad de Chile,uchile,@cec.uchile.cl,3641,"Geology, engineering, oceanography, paleontology"
9232372474901008384,P-sMWA0AAAAJ,"Full Professor, University of Chile",uchile,@ciq.uchile.cl,3627,"Analytical Chemistry, Environmental Chemistry"
9232372474901008384,K9WCXwUAAAAJ,"Departamento de Economía, Universidad de Chile",uchile,@fen.uchile.cl,3664,"Economía Ambiental, Economía de los RR.NN., Desarrollo Económico"
9232372474901008384,B-wHfIEAAAAJ,Universidad de Chile,uchile,@ing.uchile.cl,3621,"Cosmology, Cosmic Inflation, CMB"
9232372474901008384,NKC3t5sAAAAJ,"Full Professor, Universidad de Chile",uchile,@uchile.cl,3632,"DOHaD, hypoxia oxidative stress, cardiovascular, high altitude, animal models"
9232372474901008384,EWN2nZgAAAAJ,"Professor, Geophysics Department, Universidad de Chile",uchile,@u.uchile.cl,3661,"atmospheric modeling and data assimilation, air quality in mega cities, and aerosol-cloud-climate interactions."
9232372474901008384,QP1aKqcAAAAJ,Universidad de Chile,uchile,@uchile.cl,3610,"Operations Research, Market Design, Algorithmic Game Theory, Mechanism Design"
9232372474901008384,5TouOMAAAAAJ,"INTA, Universidad de Chile",uchile,@inta.uchile.cl,3626,"Nutrition, Obesity"
9232372474901008384,fLUHNZUAAAAJ,Universidad de Chile,uchile,@uchile.cl,3533,Neuroscience
9232372474901008384,LUdizE8AAAAJ,"Profesor Titular, Facultad de Ciencias, Universidad de Chile",uchile,@uchile.cl,3542,"Phylogeny, Comparative Method, Evolutionary Biology, Conservation Genetics"
9232372474901008384,Qzl7WeYAAAAJ,"Department of Management Control and Information Systems, University of Chile & ISCI",uchile,@fen.uchile.cl,3587,"Business Analytics, Machine Learning, Pattern Recognition"
9232372474901008384,3ELxF3YAAAAJ,"Associate Professor, Faculty of Dentistry, Universidad de Chile",uchile,@med.uchile.cl,3483,Tumor Cell Biology
9232372474901008384,NK44AZoAAAAJ,Professor of Immunology at University of Chile,uchile,@med.uchile.cl,3444,"Immunology, Autoimmunity, Tolerance, Autoantibodies"
9232372474901008384,BSxQQbUAAAAJ,"Universidad de Chile, Facultad de Ciencias Quimicas y Farmaceuticas",uchile,@ciq.uchile.cl,3466,"Food Science, Food Engineering, Food Innovation, Dehydration, Functional Foods"
9232372474901008384,iD_GfsoAAAAJ,Universidad de Chile (INTA),uchile,@inta.uchile.cl,3403,"Public Health Nutrition, Human Nutrition, Epidemiology & Biostatistics, Multidisciplinary Science"
9232372474901008384,Ar7FIkYAAAAJ,"Facultad de medicina, Universidad de Chile",uchile,@med.uchile.cl,3379,"farmacología, comportamiento, estrés, aprendizaje"
9232372474901008384,eyTYloUAAAAJ,Universidad de Chile,uchile,@inta.uchile.cl,3461,"Agro-industry, Food Science, Food Innovation, Food Irradiation, Functional Foods"
9232372474901008384,XkHMNP8AAAAJ,Universidad de Chile,uchile,@ing.uchile.cl,3367,"Environmental Hydrodynamics, Sediment Transport, Granular Flows, Geophysical Flows."
9232372474901008384,iFqdx5IAAAAJ,Universidad de Chile,uchile,@uchile.cl,3430,"Quantitative genetics, genomics, fish breeding"
9232372474901008384,XvUFRcgAAAAJ,"Instituto de Nutrición y Tecnología de los Alimentos, Universidad de Chile",uchile,@inta.uchile.cl,3378,"cell metabolism, mitochondria, endoplasmic reticulum, aging"
9232372474901008384,Ug4b1XQAAAAJ,"Full Professor, DCS Department, Universidad de Chile",uchile,@fen.uchile.cl,3346,"Collaborative Information Systems, Collaborative Learning, Technology Enhanced Learning, CSCL"
9232372474901008384,JaW8L3cAAAAJ,"INTA, Universidad de Chile",uchile,@inta.uchile.cl,3346,
9232372474901008384,WHuuVSEAAAAJ,Universidad de Chile,uchile,@dim.uchile.cl,3346,"Probability, Linear algebra, Forestry, Astroinformatics"
9232372474901008384,3AClnpcAAAAJ,Universidad de Chile,uchile,@ing.uchile.cl,3326,"Transport demand, smart card data, public transport"
9232372474901008384,YWg1LsAAAAAJ,Universidad de Chile,uchile,@uchile.cl,3261,microbiología
9232372474901008384,I6nS61cAAAAJ,"Professor of Electrical Engineering, Universidad de Chile",uchile,@ing.uchile.cl,3793,"Robotics, navigation, tracking, data fusion, random finite sets"
9232372474901008384,aCoZKyAAAAAJ,Profesor Facultad de Ciencias Químicas y Farmacéuticas; Universidad de Chile,uchile,@ciq.uchile.cl,3207,"Química Inorgánica, Materiales Inorgánicos, Magnetismo Molecular"
9232372474901008384,GpaP6JUAAAAJ,"Facultad de Ciencias Agronómicas, Universidad de Chile",uchile,@uchile.cl,3226,"Postcosecha, IV gama, Postharvest, fresh cut, Minimally processed"
