organization,scholar_id,affiliation,id_institucion,email_domain,citedby,interests
9232372474901008384,8bKPnZ0AAAAJ,"Sociólogo, Universidad de Chile",uchile,@veterinaria.uchile.cl,30,"Educacion, Movilidad social, Urbanismo, Economia"
9232372474901008384,c0XcNysAAAAJ,Universidad de Chile,uchile,@u.uchile.cl,27,
9232372474901008384,bgXY858AAAAJ,"Universidad de Chile, Facultad de  Comunicación e Imagen",uchile,@uchile.cl,29,"Comunicación, Internet, tecnologias digitales, data, tecnofeminismo"
9232372474901008384,7VngT_EAAAAJ,"Mathematical Modeling Assistant, CIAE IE, University of Chile",uchile,@ug.uchile.cl,31,"Machine Learning, Deep Learning, Audio Processing, Natural Language Processing, Approximation Algorithms"
9232372474901008384,jBqrVnQAAAAJ,"Profesor Asistente, Departamento de Arquitectura de la Universidad de Chile",uchile,@uchilefau.cl,29,"arquitectura, cultura urbana, representación arquitectónica, fotografía urbana, fotografía del paisaje"
9232372474901008384,hX52neoAAAAJ,Universidad de Chile,uchile,@ug.uchile.cl,27,Robotics
9232372474901008384,trOK6okAAAAJ,"PhD Student in Electrical Engineering, Universidad de Chile",uchile,@ing.uchile.cl,30,"Reliability and resilience, Operation and planning of electric power systems"
9232372474901008384,-81iEcYAAAAJ,"Asesor de estudios, Universidad de Chile",uchile,@uchile.cl,29,"Measurement, Evaluation, Education, Psychometrics"
9232372474901008384,pj-D9-oAAAAJ,Universidad de Chile,uchile,@uchile.cl,30,"Sociología del Trabajo, Economía Laboral"
9232372474901008384,bFMXjBQAAAAJ,Universidad de Chile,uchile,@ug.uchile.cl,29,"Memorias colectivas, Psicología social, Derechos Humanos"
9232372474901008384,wBYf6mwAAAAJ,"Bioestadístico, Académico, Universidad de Chile",uchile,@med.uchile.cl,27,Bioestadística
9232372474901008384,L1NrDucAAAAJ,Universidad de Chile; University of Edinburgh,uchile,@derecho.uchile.cl,29,"constitutional law, public law, political participation, access to justice, legal aid"
9232372474901008384,UBpVYHkAAAAJ,"Centro de Modelamiento Matemático (CNRS IRL2807), Universidad de Chile",uchile,@dim.uchile.cl,29,"Geometric Analysis, Partial Differential Equations"
9232372474901008384,DInThXEAAAAJ,Universidad de Chile,uchile,@ug.uchile.cl,30,"Genetics, Genomics"
9232372474901008384,IcSUJa8AAAAJ,Universidad de Chile,uchile,@ciq.uchile.cl,26,"Medicinal Chemistry, Pharmacology, Drug Design, Oncology, Clinical Pharmacy"
9232372474901008384,Lp4T6j0AAAAJ,"Académica Derecho Público, Facultad de Derecho, Universidad de Chile",uchile,@derecho.uchile.cl,29,"Medio Ambiente, Derecho Ambiental, Derecho Público, Derecho Administrativo."
9232372474901008384,DjS1tgcAAAAJ,University of Chile,uchile,@ing.uchile.cl,26,"Machine learning, Digital image processing, Biometrics"
9232372474901008384,Y5rOV5sAAAAJ,Universidad de Chile,uchile,@ug.uchile.cl,29,"electrochemistry, semiconductor, chemical engineering"
9232372474901008384,CnR-FDgAAAAJ,Universidad de Chile,uchile,@ug.uchile.cl,24,"Geomechanics, Rock mechanics, Mining engineering, Fracture Mechanics"
9232372474901008384,-Avh_f8AAAAJ,Universidad de Chile,uchile,@uchile.cl,25,"Educación, TIC, Informática Educativa, Saber Pedagógico"
9232372474901008384,ooGdzMwAAAAJ,"Doctorando en Nutrición y Alimentos, Universidad de Chile",uchile,@hcuch.cl,24,"Nutrición, Obesidad, Antioxidantes"
9232372474901008384,lCHQGJoAAAAJ,"Facultad de Odontología, Universidad de Chile",uchile,@odontologia.uchile.cl,24,"Salud pública, odontología, caries dental, psicología de la salud"
9232372474901008384,84sQv9cAAAAJ,"Instituto de Estudios Internacionales, Universidad de Chile",uchile,@uchile.cl,28,política comercial
9232372474901008384,JzmrAoMAAAAJ,Universidad de Chile,uchile,@veterinaria.uchile.cl,30,"Farmacología Veterinaria, Inocuidad de Alimentos, Alternativas Terapéuticas, Terapéutica Veterinaria"
9232372474901008384,isoiL04AAAAJ,Universidad de Chile,uchile,@ug.uchile.cl,32,"Nonlinear physics, pattern formation, liquid crystals"
9232372474901008384,-I0PBhUAAAAJ,"Profesor de Teatro, Universidad de Chile",uchile,@uchile.cl,25,"Nuevos medios, Actuación, Dirección escénica"
9232372474901008384,8GXDBYMAAAAJ,Ph.D. Candidate Universidad de Chile,uchile,@dcc.uchile.cl,23,"Data Mining, Natural Language Processing, Neural Networks, Artificial Intelligence, Machine Learning"
9232372474901008384,qw_v8EwAAAAJ,Universidad de Chile y Universidad de los Andes (Chile),uchile,@derecho.uchile.cl,23,Derecho del trabajo e historia del derecho
9232372474901008384,nrTPAYQAAAAJ,"Estudiante Doctorado en Nutrición y Alimentos, Universidad de Chile",uchile,@ug.uchile.cl,22,"Alimentos, procesamiento de alimentos, compuestos bioactivos, Agronomía, postcosecha de frutas"
9232372474901008384,s3I_pFYAAAAJ,"Magíster en Ciencias Sociales, Universidad de Chile",uchile,@ug.uchile.cl,23,"Economía Política, Metodología de la Investigación"
9232372474901008384,j9NL-DkAAAAJ,"Faculty of Law, Universidad de Chile",uchile,@derecho.uchile.cl,25,"Derecho, Derecho Procesal, Evidence, Civil Process"
9232372474901008384,kpZOCQ0AAAAJ,University of Chile,uchile,@inta.uchile.cl,22,"Health outcomes, child development, epidemiology"
9232372474901008384,CrJZ1zIAAAAJ,"Profesor Asistente en Docencia, Universidad de Chile",uchile,@uchile.cl,24,"Tecnología Asistiva, Razonamiento Profesional, Neurorehabilitación, Terapia Ocupacional, Deporte Adaptado"
9232372474901008384,66i6MscAAAAJ,Universidad de Chile,uchile,@ug.uchile.cl,24,"Educación, Diversidad"
9232372474901008384,CcLJiL8AAAAJ,"Assistant Professor, Faculty of Dentistry, University of Chile",uchile,@odontologia.uchile.cl,23,dental periodontics education
9232372474901008384,6q_yVTIAAAAJ,"Instituto de Asuntos Públicos, Universidad de Chile",uchile,@iap.uchile.cl,22,"movimientos sociales, etnografía, antropología urbana"
9232372474901008384,C0YaZ9cAAAAJ,"Professor of Biostatistics, Universidad de Chile",uchile,@uchile.cl,20,"statistical inference, machine learning"
9232372474901008384,QIPT-2kAAAAJ,"Departamento de Geofísica, Universidad de Chile",uchile,@uchile.cl,21,
9232372474901008384,XshkYUgAAAAJ,Universidad de Chile,uchile,@ug.uchile.cl,20,Derecho Ambiental
9232372474901008384,rMTLXYoAAAAJ,University of Chile,uchile,@ug.uchile.cl,20,"Archaeology, Zooarchaeology, Taphonomy"
9232372474901008384,elCE2koAAAAJ,Researcher at University of Chile,uchile,@fen.uchile.cl,20,"Quality Management, Benchmarking metrics, management control, process innovation, organized crime"
9232372474901008384,0eyT1qQAAAAJ,"Postdoctoral Fellow, University of Chile",uchile,@uchile.cl,27,"Latin American History, sports history, mass culture and media, masculinities"
9232372474901008384,53JwNRgAAAAJ,Universidad de Chile,uchile,@ug.uchile.cl,21,"Microbiomes, aquaculture, genomic prediction"
9232372474901008384,drHKlTAAAAAJ,Universidad de Chile,uchile,@uchile.cl,23,"antropología, etnografía, tecnofeminismo, salud, Estudios de CTS"
9232372474901008384,atQV7cIAAAAJ,"Estudiante de Doctorado, Universidad de Chile",uchile,@ug.uchile.cl,21,"Química Analítica, Química Ambiental"
9232372474901008384,6Em-N4IAAAAJ,Universidad de Chile,uchile,@ug.uchile.cl,19,
9232372474901008384,-iGqylEAAAAJ,University of Chile (UChile) & Pontifical Catholic University of Chile (PUC),uchile,@uchile.cl,19,"Machine learning, Statistics data analysis, Time series Forecasting, Modeling and simulation of communication networks"
9232372474901008384,6raNaEgAAAAJ,Universidad de Chile,uchile,@fen.uchile.cl,22,"Human resources, Gender and work, non profit organizations, work inclusion"
9232372474901008384,_c9Y_FIAAAAJ,"Profesora Asistente, Departamento de Estudios Pedagógicos, Universidad de Chile",uchile,@uchile.cl,19,"Multimodalidad, literacidad digital, clásicos grecolatinos, Literatura, hipertexto didáctico"
9232372474901008384,NP_ptNcAAAAJ,Universidad de Chile,uchile,@uchile.cl,20,"desarrollo rural, cohesión territorial, conflictos socioecológicos, economías alternativas"
9232372474901008384,mlQLNC0AAAAJ,Doctorando Universidad de Chile,uchile,@ug.uchile.cl,22,"Historia de Chile, estudios afrolatinamericanos"
9232372474901008384,cMCFvUoAAAAJ,"Profesor Asociado, Universidad de Chile",uchile,@uchile.cl,19,"Clínica Psicoanalítica, Clínica de lo traumático, transformaciones socio-culturales, subjetividades contemporáneas"
9232372474901008384,AKvAPLQAAAAJ,"PhD in Physics, Universidad de Chile",uchile,@ug.uchile.cl,18,"Complex Networks, Dynamics Systems, Nonlinear Physics"
9232372474901008384,WR-02CEAAAAJ,Universidad de Chile,uchile,@uchile.cl,18,"Química de Alimentos, materias grasas, antioxidantes"
9232372474901008384,LlvbtQ0AAAAJ,Universidad de Chile,uchile,@dcc.uchile.cl,19,"Information Retrieval, Data Mining, Crisis Informatics, Social Network Analysis"
9232372474901008384,XM4TnPsAAAAJ,Universidad de Chile,uchile,@uchile.cl,19,"Sociología, Ciencia Política, Ciencias Sociales"
9232372474901008384,XgYLJIUAAAAJ,Académico Departamento de Enfermería Universidad de Chile,uchile,@med.uchile.cl,18,"gestión en salud, cuidados del niño y adolescente, informática en salud"
9232372474901008384,c_Ix534AAAAJ,"Postdoctorante, Universidad de Chile",uchile,@uchilefau.cl,19,"sociología urbana, policy mobility, movilidad urbana, ciudad y tecnología"
9232372474901008384,sH1Pl7MAAAAJ,"Profesora Asistente, Universidad de Chile",uchile,@derecho.uchile.cl,18,"Derecho Civil, Políticas Públicas, Educación"
9232372474901008384,IGmlLY0AAAAJ,Universidad de Chile,uchile,@dcc.uchile.cl,20,Web of Data
9232372474901008384,IPp4wb8AAAAJ,Universidad de Chile,uchile,@fen.uchile.cl,19,
9232372474901008384,VM8xvCoAAAAJ,"Phd Computer Science, University of Chile",uchile,@dcc.uchile.cl,17,"Multimedia Retrieval, Data Mining"
9232372474901008384,TFLd2O8AAAAJ,"M.Sc. (c) of Computer Science, Universidad de Chile",uchile,@dcc.uchile.cl,17,"Social Network Analysis, Data Mining"
9232372474901008384,7hrgrG4AAAAJ,Universidad de Chile,uchile,@uchile.cl,17,
9232372474901008384,UlURy8oAAAAJ,"Investigador, Universidad de Chile, Universidad Católica de Chile",uchile,@ug.uchile.cl,17,Neurociencia
9232372474901008384,VSEKKdcAAAAJ,University of Chile,uchile,@ug.uchile.cl,20,"Medical Education, Gastrointestinal diseases"
9232372474901008384,OeM5H_MAAAAJ,Universidad de Chile,uchile,@ug.uchile.cl,17,"Humanidades ambientales, filosofía ambiental, Teología latinoamericana, pensamiento ecológico, posthumanismo"
9232372474901008384,k-INGGcAAAAJ,University of Chile,uchile,@dim.uchile.cl,18,"Graph Theory, Combinatorics"
9232372474901008384,SOQy3jYAAAAJ,"Profesor e Investigado, Universidad de Chile",uchile,@uchile.cl,16,"Macroeconomía y salud, Estadística, Epidemiología Ambiental"
9232372474901008384,kW_gupMAAAAJ,"Software Engineer, Microsoft. PhD Graduate of Computer Science, University of Chile",uchile,@dcc.uchile.cl,16,"Programming Languages, Information flow control"
9232372474901008384,Ray03aUAAAAJ,Universidad de Chile,uchile,@ug.uchile.cl,16,"Machine Learning, Deep Learning, e-Health, Blockchain"
9232372474901008384,y5dry1IAAAAJ,"Investigador, Laboratorio de Análisis Territorial, Universidad de Chile",uchile,@uchile.cl,17,"Gobernanza del agua e indígena, análisis territorial, derecho ambiental"
9232372474901008384,ZYe6caMAAAAJ,"Departamento de Ingeniería Mecánica, Universidad de Chile",uchile,@uchile.cl,18,"stratocumulus clouds, fluid dynamics, renewable energy"
9232372474901008384,E27171EAAAAJ,Universidad de Chile,uchile,@u.uchile.cl,19,"Psicología, ética, bioética, biopolítica"
9232372474901008384,-kX6lC8AAAAJ,Universidad de Chile,uchile,@uchile.cl,16,
9232372474901008384,g33z0VMAAAAJ,"PhD student-Mathematical Modeling, University of Chile.",uchile,@ug.uchile.cl,16,"Partial Differential Equations, Mathematic General Relativity"
9232372474901008384,USOtgdcAAAAJ,Phd. (c) Universidad de Chile,uchile,@ug.uchile.cl,16,"evolución, ecología de poblaciones, contaminación, expresión génica"
9232372474901008384,HEN4bXwAAAAJ,"Departamento de Arquitectura, Universidad de Chile",uchile,@uchile.cl,15,"Design cognition, Design computing"
9232372474901008384,al63S_4AAAAJ,"Departament of Electrical Engineering, Universidad de Chile",uchile,@ing.uchile.cl,16,Robótica
9232372474901008384,pLVnNzgAAAAJ,Universidad de Chile,uchile,@ing.uchile.cl,17,"Artificial Intelligence, Optimization algorithms, Machine Learning"
9232372474901008384,_i1VEsIAAAAJ,Universidad de Chile,uchile,@fen.uchile.cl,15,"Econometrics, Development economics"
9232372474901008384,oPD-KkkAAAAJ,"Estudiante de Doctorado, Universidad de Chile",uchile,@wic.uchile.cl,18,"Data Science, Artificial Intelligence, Health Engineering, Deep Learning"
9232372474901008384,MpWhMQ8AAAAJ,"Estudiante de Economía, Universidad de Chile",uchile,@fen.uchile.cl,15,
9232372474901008384,Q_meFFkAAAAJ,Hospital San Juan de Dios - Universidad de Chile - Clínica BUPA Santiago,uchile,@ug.uchile.cl,15,Cirugía de Tórax
9232372474901008384,iyI0dF8AAAAJ,Universidad de Chile,uchile,@ug.uchile.cl,15,Estudiante de Doctorado en Ingeniería Civil
9232372474901008384,uQ1dZWQAAAAJ,Universidad de Chile - Universidad Complutense de Madrid,uchile,@dim.uchile.cl,15,Análisis funcional
9232372474901008384,cKSEa0YAAAAJ,Universidad de Chile,uchile,@ug.uchile.cl,21,"Historia cultural, historia del deporte, historia de Chile"
9232372474901008384,Mooq9c0AAAAJ,"Profesora asistente, Facultad de Derecho, Universidad de Chile",uchile,@derecho.uchile.cl,15,
9232372474901008384,FWlAVKMAAAAJ,Académico Facultad de Arquitectura y Urbanismo. Universidad de Chile,uchile,@uchilefau.cl,17,"Historia de la arquitectura y la ciudad. Modernidad arquitectónica y vivienda. Estudio, conservación y gestión del paisaje"
9232372474901008384,WLxVQdgAAAAJ,Universidad de Chile,uchile,@uchile.cl,16,
9232372474901008384,R33F1rIAAAAJ,"Universidad de Chile, Facultad de Derecho",uchile,@derecho.uchile.cl,18,"contratos, consumo, consumidores, competencia, antitrust"
9232372474901008384,d05Q07cAAAAJ,"Académica, Departamento de Diseño, Universidad de Chile; Académica, Escuela de Diseño, Pontificia",uchile,@uchilefau.cl,14,"Diseño, Historia, Patrimonio, Cultura Material y Visual, Identidad"
9232372474901008384,dTJvzlcAAAAJ,Universidad de Chile,uchile,@uchile.cl,14,"orientación, psicología, pedagogía, evaluación"
9232372474901008384,tvkDv2YAAAAJ,Universidad de Chile,uchile,@uchile.cl,14,"Diseño, Informática educativa"
9232372474901008384,Z0cwrykAAAAJ,"Assistant Professor, Department of Industrial Engineering, University of Chile",uchile,@uchile.cl,15,"Political Economy, Microeconomic Theory"
9232372474901008384,r_QDAIQAAAAJ,University of Chile,uchile,@odontologia.uchile.cl,15,"Dental, Immunology, Periodontics"
9232372474901008384,8RCip14AAAAJ,"Estudiante Doctorado, Universidad de Chile",uchile,@ug.uchile.cl,15,
9232372474901008384,Fkwi46cAAAAJ,"Ph.D student, Universidad de Chile - Université de Lorraine",uchile,@ug.uchile.cl,15,"Geology, Remote sensing, Teledetection, Gis science"
9232372474901008384,IMYmLW8AAAAJ,"Profesora Asistente, Universidad de Chile - Estudiante Doctorado en Ciencia de enfermería",uchile,@uchile.cl,19,Cuidado perioperatorio y salud sexual y reproductiva
9232372474901008384,WeGYhaYAAAAJ,Faculty of Architecture and Urbanism - University of Chile,uchile,@uchile.cl,13,"Architecture, Representation, Embodied, Manuage, Hands"
9232372474901008384,MR_wKV0AAAAJ,Universidad de Chile,uchile,@ug.uchile.cl,13,"Associative Learning, Pavlovian Conditioning, Cognition"
9232372474901008384,DjYkFNkAAAAJ,"Magíster (c) en Historia, Universidad de Chile",uchile,@ug.uchile.cl,13,"historia de la medicina, estudios sociales de ciencia y tecnología, apropiación tecnológica, cáncer"
9232372474901008384,etN48ZMAAAAJ,Universidad de Chile,uchile,@ug.uchile.cl,13,"territorios, comunicación social, análisis de discursos, prácticas de resistencias, memorias colectivas"
9232372474901008384,mqStkW0AAAAJ,"Docente, Instituto de la Comunicación e Imagen (ICEI), U. Chile",uchile,@uchile.cl,13,"Movimientos sociales e indígenas, Racismo Discursivo, Comunicación Intercultural, Radiodifusión indígena y ciudadana"
9232372474901008384,_PXqGlkAAAAJ,Universidad de Chile,uchile,@uchile.cl,14,
9232372474901008384,oxbr3VQAAAAJ,Universidad de Chile,uchile,@ug.uchile.cl,14,"Epistemología, Filosofía Política Contemporánea, Psicoanálisis"
9232372474901008384,VGMOjQIAAAAJ,"Research Assistant, Universidad de Chile",uchile,@uchile.cl,16,"Immunology, Autoimmunity"
9232372474901008384,g3rCW0kAAAAJ,"E.E. and C.S Student, University of Chile",uchile,@ing.uchile.cl,12,"Artificial Intelligence, Computer Vision, Robotics"
9232372474901008384,V02K-FwAAAAJ,"Estudiante de Doctorado, Universidad de Chile",uchile,@ug.uchile.cl,12,"Paleoecología, Botánica, Conservación y Biodiversidad"
9232372474901008384,B1s8Q38AAAAJ,University of Chile,uchile,@uchile.cl,12,"Landscape ecology, Nature Conservation, Zoology, Botany and Environmental Education."
9232372474901008384,CYv43xgAAAAJ,Universidad de Chile,uchile,@uchile.cl,12,Musicología
9232372474901008384,bJuGXCEAAAAJ,Universidad de Chile,uchile,@ug.uchile.cl,12,Mecánica Estadística
9232372474901008384,d-zKXegAAAAJ,"Magíster en Historia, Universidad de Chile",uchile,@ug.uchile.cl,13,Historia de la ciencia y tecnología
9232372474901008384,2uLzZnkAAAAJ,Universidad de Chile,uchile,@uchilefau.cl,13,"colour, colour design, colour education, colour training, design education"
9232372474901008384,ebv87WQAAAAJ,"Profesor Asistente, Universidad de Chile",uchile,@unegocios.cl,15,Contabilidad
9232372474901008384,riuRvaoAAAAJ,Universidad de Chile,uchile,@ug.uchile.cl,13,
9232372474901008384,M3plJ9gAAAAJ,"Académica, Departamento de Derecho Internacional, Universidad de Chile",uchile,@derecho.uchile.cl,12,"Derecho Internacional Público, Derecho Internacional Humanitario, Derecho Penal Internacional, Derecho Internacional de los Derechos Humanos"
9232372474901008384,4fJt5rEAAAAJ,profesor Universidad de Chile,uchile,@uchile.cl,11,"Trabajo social, Participación ciudadana, ordenamiento territorial, ciencia politica"
9232372474901008384,aadO0P0AAAAJ,Universidad de Chile,uchile,@ug.uchile.cl,11,"Derecho penal, derecho procesal penal, decolonialidad, southern theory"
9232372474901008384,v_N5y_AAAAAJ,Profesor Adjunto - Universidad de Chile,uchile,@uchile.cl,12,"gestión y administración universitaria, gobernanza universitaria, formación de directivos públicos, competencias directivas"
9232372474901008384,w4qENQwAAAAJ,Universidad de Chile,uchile,@ug.uchile.cl,11,
9232372474901008384,E3ygC-AAAAAJ,"Facultad de Ciencias Veterinarias y Pecuarias, Universidad de Chile",uchile,@uchile.cl,11,Ecología
9232372474901008384,-xHxTvQAAAAJ,Académica UChile. Pedagoga Educadora Inicial..Lic. en Sociología.,uchile,@uchile.cl,12,"Infancia, protección, género, contextos de encierro, cuerpos y emociones"
9232372474901008384,auRdHFcAAAAJ,Universidad de Chile,uchile,@u.uchile.cl,11,"Psicología, Criminología, Feminismo"
9232372474901008384,UBkTAwYAAAAJ,Universidad de Chile,uchile,@uchile.cl,10,Estudios de géneros y violencias. Estudios sobre arte y cultura
9232372474901008384,JXWHI0sAAAAJ,"Computer Science Department, University of Chile",uchile,@dcc.uchile.cl,10,"Topological Data Analysis, Computational Geometry and Topology, Machine Learning"
9232372474901008384,VPqzZY8AAAAJ,Universidad de Chile,uchile,@uchile.cl,10,Derecho Administrativo
9232372474901008384,W4vki0QAAAAJ,University of Chile,uchile,@dcc.uchile.cl,10,"Education, Image Processing, Data Mining, Robotics"
9232372474901008384,VzG-teEAAAAJ,"Estudiante de Doctorado, Universidad de Chile",uchile,@ug.uchile.cl,11,Ciencia de Materiales
9232372474901008384,_K2gduAAAAAJ,Universidad de Chile,uchile,@ug.uchile.cl,10,biotecnología
9232372474901008384,yN689cUAAAAJ,Universidad de Chile,uchile,@ug.uchile.cl,11,"juventudes, educación, medios de comunicación, movimientos sociales"
9232372474901008384,Z69lpKAAAAAJ,Universidad de Chile,uchile,@renare.uchile.cl,12,
9232372474901008384,TJ_6LDMAAAAJ,Universidad de Chile,uchile,@ing.uchile.cl,13,"LPWAN, IoT, Wireless Communication, SCHC, LEO"
9232372474901008384,mupxXZYAAAAJ,"Estudiante de Doctorado, Universidad de Chile",uchile,@u.uchile.cl,11,"ciencias sociales, vida cotidiana, psicoanálisis, cine documental"
9232372474901008384,qUbjRz8AAAAJ,Universidad de Chile,uchile,@ug.uchile.cl,10,"Micología, Conservación, Botánica, Biogeografía, Taxonomía"
9232372474901008384,5beEwioAAAAJ,"Universidad de Chile, Departamento de Ingeniería Industrial",uchile,@dii.uchile.cl,10,"Organizational Studies, Business Administration, Economic Sociology"
9232372474901008384,dkqXDokAAAAJ,"Ph.D. student, University of Chile",uchile,@ug.uchile.cl,13,"molecular biology, phenolic compounds, genomic regulations"
9232372474901008384,999qUxkAAAAJ,Universidad de Chile,uchile,@dcc.uchile.cl,9,"Software engineering, Software process lines"
9232372474901008384,aIwL6-wAAAAJ,"Associate Professor, Facultad de Arquitectura y Urbanismo, Universidad de Chile",uchile,@uchilefau.cl,9,"History and Theory of Architecture, Urban History, Modern Architecture"
9232372474901008384,F69SFQIAAAAJ,Universidad de Chile,uchile,@ug.uchile.cl,9,"Philosophy of law, Cultural rights"
9232372474901008384,0-NeiOoAAAAJ,Universidad de Chile,uchile,@ug.uchile.cl,9,Ingeniería Mecánica
9232372474901008384,DvJNXEsAAAAJ,Universidad de Chile,uchile,@uchile.cl,12,"Elección de escuela, Migración, Educación Superior"
9232372474901008384,nMKoeYgAAAAJ,Universidad de Chile,uchile,@ug.uchile.cl,12,"Tissues, Biomechanics, Active matter"
9232372474901008384,d-inoIoAAAAJ,Universidad de Chile,uchile,@uchile.cl,9,"urban planning, urban governance, urban regeneration"
9232372474901008384,J25V_CoAAAAJ,"Departamento de Fonoaudiología, Universidad de Chile",uchile,@uchile.cl,11,"Fonoaudiología Social, Salud colectiva, Antropología de la salud, Atención Primaria de Salud, Discapacidad"
9232372474901008384,ux_phJwAAAAJ,Universidad de Chile,uchile,@ug.uchile.cl,12,ecology urban ecosystems conservation
9232372474901008384,yDxTFMEAAAAJ,"Research Assistant FONDECYT, Department of Geophysics, Universidad de Chile",uchile,@ug.uchile.cl,10,geophysics
9232372474901008384,12NAtpgAAAAJ,"profesor de Filosofía, Universidad de Chile",uchile,@uchile.cl,10,"fenomenología, hermenéutica, historia de la filosofía"
9232372474901008384,sv2IYxQAAAAJ,"Ph D (c) Mining Engineering, University of Chile",uchile,@ing.uchile.cl,9,"Hydrometallurgy, electrometallurgy, mineral processing, chloride leaching, chemical engineering"
9232372474901008384,_SeFuo8AAAAJ,Universidad de Chile,uchile,@uchile.cl,10,"Language Development, Word Learning"
9232372474901008384,Z82j16UAAAAJ,Universidad de Chile,uchile,@ing.uchile.cl,9,"Machine Learning, Computer Vision"
9232372474901008384,hasIcIgAAAAJ,"Profesor de ética y filosofía política, Universidad de Chile",uchile,@uchile.cl,8,"Filosofía política, ética, ética profesional"
9232372474901008384,edqD-OAAAAAJ,Laboratorio de Ergonomía. Departamento de Kinesiología. Facultad de Medicina. Universidad de Chile,uchile,@uchile.cl,8,"Ergonomía, Salud Ocupacional, Rehabilitación Laboral."
9232372474901008384,zAUew6AAAAAJ,"Faculty of Economics and Business, Universidad de Chile",uchile,@fen.uchile.cl,8,Strategic Management
9232372474901008384,egx_7VIAAAAJ,"Facultad de Comunicación e Imagen, Universidad de Chile",uchile,@ug.uchile.cl,8,"Non-Photorealistic Rendering, Virtual Reality, Immersion, Motion Sickness"
9232372474901008384,Chn0be0AAAAJ,Universidad de Chile,uchile,@ing.uchile.cl,8,
9232372474901008384,PJX0DrUAAAAJ,universidad de chile,uchile,@uchile.cl,8,"integración, regionalismo, relaciones chile-peru"
9232372474901008384,Ea4ATzAAAAAJ,University of Chile,uchile,@dcc.uchile.cl,11,"combinatorics on words, data compression, formal languages"
9232372474901008384,OEJRUvMAAAAJ,University of Chile,uchile,@ug.uchile.cl,8,"Fault Diagnosis, Prognostics, Planning"
9232372474901008384,JJevH-QAAAAJ,University of Chile,uchile,@ug.uchile.cl,8,"Oral Implantology, Human Anatomy"
9232372474901008384,o1SiVhoAAAAJ,"Facultad de Ciencias, Universidad de Chile",uchile,@ug.uchile.cl,10,Biología
9232372474901008384,dBnE-0MAAAAJ,Universidad de Chile,uchile,@ug.uchile.cl,13,
9232372474901008384,FJW-7WwAAAAJ,Universidad de Chile,uchile,@uchile.cl,13,Obstetricia y Ginecología
9232372474901008384,3bsLQbwAAAAJ,"Investigador, Universidad de Chile",uchile,@uchilefau.cl,9,"Diseño urbano, Morfología urbana, Urbanismo informal, Infraestructura verde"
9232372474901008384,NYg_qQQAAAAJ,Universidad de Chile,uchile,@fen.uchile.cl,8,
9232372474901008384,Siqpe2cAAAAJ,"Programa de Bioestadística, Escuela de Salud Pública, Universidad de Chile",uchile,@uchile.cl,12,
9232372474901008384,2WFECXQAAAAJ,Universidad de Chile,uchile,@uchile.cl,7,"Information sciences, Information technology, Libraries, Bibliometrics, Publishing"
9232372474901008384,UAn0ZiEAAAAJ,MSc of Electrical Engineering at the University of Chile,uchile,@ing.uchile.cl,7,"Power System Planning, Power Systems Economics, Renewable Energy, Smart Grid, Electricity Market"
9232372474901008384,GnytFBQAAAAJ,"Profesor Asistente, Departamento de Diseño, Universidad de Chile",uchile,@uchilefau.cl,8,"didáctica proyectual, tecnología"
9232372474901008384,3IAllykAAAAJ,"MSc. student, DFI, FCFM, Universidad de Chile",uchile,@ing.uchile.cl,8,
9232372474901008384,w4R7TuwAAAAJ,Universidad de Chile,uchile,@ug.uchile.cl,7,"Linguistics, cognition, cognitive linguistics, cognitive science"
9232372474901008384,e0KpTS8AAAAJ,"Computer Science Engineer, Universidad de Chile",uchile,@dcc.uchile.cl,7,"deep learning, computer vision, big data"
