organization,scholar_id,affiliation,id_institucion,email_domain,citedby,interests
9232372474901008384,wcTynZkAAAAJ,Profesora Asociada. Universidad de Chile,uchile,@uchile.cl,1582,Sustentabilidad agrícola en ambientes de secano mediterráneo
9232372474901008384,QEJxyH0AAAAJ,"Computer Science Department, Universidad de Chile",uchile,@dcc.uchile.cl,1564,"model driven engineering, software processes, software engineering"
9232372474901008384,y9Oh9SUAAAAJ,Universidad de Chile,uchile,@uchilefau.cl,1563,"medioambiente, ecología urbana, climatología, cambio climático, riesgos"
9232372474901008384,YrNqhkYAAAAJ,universidad de chile,uchile,@unegocios.cl,1556,
9232372474901008384,T_dpe84AAAAJ,Universidad de Chile,uchile,@uchile.cl,1580,"Computational Systems Biology, Comparative Genomics, Non-Coding RNAs, Bioinformatics, Science Outreach"
9232372474901008384,iLWArf0AAAAJ,"Professor of Economics, University of Chile",uchile,@fen.uchile.cl,1507,"Macroeconomics, Econometrics"
9232372474901008384,njaa_hsAAAAJ,"Depto. de Ingeniería Química Biotecnología y Materiales, FCFM, Universidad de Chile",uchile,@ing.uchile.cl,1534,"Materiales dieléctricos, nanotecnología, perovsquitas"
9232372474901008384,j1uFR-gAAAAJ,"Profesor Asociado. Departamento de Geografía, Universidad de Chile",uchile,@uchilefau.cl,1548,"Geografía Física, Climatología, clima urbano, Incendios forestales, Riesgos"
9232372474901008384,RPUTBZYAAAAJ,Universidad de Chile,uchile,@uchile.cl,1527,"Neuroscience, Otolaryngology, Biology"
9232372474901008384,dmafYYgAAAAJ,"Full Professor at the Computer Science Department, University of Chile",uchile,@dcc.uchile.cl,1509,"Mesh generation, Meshing tools, GPU-computing, Computational science and engineering"
9232372474901008384,yS63quIAAAAJ,Profesora Asociada Facultad de Odontología Universidad de Chile,uchile,@odontologia.uchile.cl,1531,"Salud Pública, Epidemiología de las enfermedades periodontales"
9232372474901008384,U4RsKWQAAAAJ,"Profesor de Física, Universidad de Chile",uchile,@uchile.cl,1488,"Geofísica, Inteligencia Artificial, Big Data"
9232372474901008384,0HdH52gAAAAJ,Universidad de Chile,uchile,@uchile.cl,1487,Plant biology and biotechnology
9232372474901008384,IBvwwusAAAAJ,"Associated Professor, Faculty of Medicine, University of Chile",uchile,@uchile.cl,1458,"Oxidative stress, endothelial dysfunction, RAGE Receptor, Phytopharmacology"
9232372474901008384,3LteHHYAAAAJ,"Académico del Departamento de Sociología, Facultad de Ciencias Sociales, Universidad de Chile",uchile,@uchile.cl,1470,"América Latina, Clases sociales, Conflicto social, Chile, Estado"
9232372474901008384,Ll1oxsUAAAAJ,"School of Public Health, University of Chile",uchile,@uchile.cl,1458,"linear models, longitudinal analysis, statistical computing, survival analysis"
9232372474901008384,3t8nxJIAAAAJ,"Facultad de Economía y Negocios, Universidad de Chile",uchile,@fen.uchile.cl,1463,"low price strategies, promotion tools, marketing metrics"
9232372474901008384,uwVKal0AAAAJ,"Postdoc, Center of Mathematical Modeling, University of Chile",uchile,@ing.uchile.cl,1436,"User Behavior, Web User Mining, Neurocomputing, Astroinformatics, Mathematical Modeling"
9232372474901008384,n5grhS4AAAAJ,Universidad de Chile,uchile,@uchile.cl,1459,Transporte
9232372474901008384,Q1ICzqAAAAAJ,Departamento de Física - Universidad de Chile,uchile,@dfi.uchile.cl,1437,"quantum thermodynamics, nonequilibrium statistical mechanics"
9232372474901008384,4WL7BFEAAAAJ,"Profesor Estadística, Universidad de Chile",uchile,@u.uchile.cl,1420,estadística aplicada
9232372474901008384,0rAebMEAAAAJ,"Profesor Adjunto, Departamento de Biología, Facultad de Ciencias, Universidad de Chile",uchile,@uchile.cl,1423,"Neurobiología, Transducción sensorial, Función  sinaptica"
9232372474901008384,QTdKy5gAAAAJ,Universidad de Chile,uchile,@dcc.uchile.cl,1407,"Software Engineering, Verification and Validation, Computer Science Education"
9232372474901008384,mSQUBH8AAAAJ,"Associate Professor, Universidad de Chile",uchile,@ing.uchile.cl,1418,"OFDM-based systems, Nyquist Pulses, Visible light communications, V2X Communications"
9232372474901008384,A48L9BMAAAAJ,"Facultad de Economía y Negocios, Universidad de Chile",uchile,@unegocios.cl,1425,"Corporate Governance, Corporate Finance"
9232372474901008384,i5Slv0sAAAAJ,Universidad de Chile,uchile,@uchile.cl,1402,
9232372474901008384,RhKvvOYAAAAJ,"Professor, University of Chile",uchile,@inta.uchile.cl,1408,"inborn errors of metabolism, neonatal screening, nutrition in metabolic disease"
9232372474901008384,31O19YkAAAAJ,University of Chile,uchile,@med.uchile.cl,1428,"HIV, Infectious Diseases"
9232372474901008384,Iq61R2kAAAAJ,Universidad de Chile,uchile,@uchile.cl,1378,Arqueologia
9232372474901008384,GQ6m1poAAAAJ,"Profesora Asistente, Universidad de Chile",uchile,@uchile.cl,1390,
9232372474901008384,cP-xtKkAAAAJ,Universidad de Chile,uchile,@ciae.uchile.cl,1399,"Sociología de la Educación, Política Pública, Estructura Social, Desigualdad"
9232372474901008384,_87Kn0AAAAAJ,"Associate Professor, Depto. Producción Animal, Universidad de Chile",uchile,@uchile.cl,1368,"Genetics, Animal Breeding, QTL Mapping, Aquaculture, Food Quality"
9232372474901008384,WsEchrQAAAAJ,"Laboratory for Research in Environmental Sciences (LARES), University of Chile",uchile,@renare.uchile.cl,1355,"Agrometeorology, Climatology, Remote Sensing, Environmental Modeling"
9232372474901008384,CGzO3AwAAAAJ,University of Chile,uchile,@uchile.cl,1345,
9232372474901008384,1GQ2sTAAAAAJ,"Profesor de Geografía, Universidad de Chile",uchile,@u.uchile.cl,1354,
9232372474901008384,gvI2dIkAAAAJ,"Laboratorio de lípidos, INTA, Universidad de Chile",uchile,@inta.uchile.cl,1368,
9232372474901008384,zSGV5t4AAAAJ,"Profesor Asociado, Depto. Quimica Organica y Fisico quimica, Fac. Cs. Químicas y farmaceuticas, Universidad de Chile",uchile,@ciq.uchile.cl,1328,"Quimica Organica, quimica supramolecular, espectroscopia, complejación"
9232372474901008384,0IYUvGYAAAAJ,"Médico, Profesor de gastroenterologia, Universidad de Chile, Santiago",uchile,@hcuch.cl,1327,"gastroenterologia, pancreatologia"
9232372474901008384,pRk6_hcAAAAJ,"Laboratorio Mecanismos de Adaptación y Estrés Vascular, Universidad de Chile, Programa",uchile,@uchile.cl,1329,"Hypoxia, Vascular Stress and Adaptation, Perinatal Physiology, Vascular development"
9232372474901008384,XLEmq1sAAAAJ,"Associate Professor, Industrial Engineering, University of Chile",uchile,@dii.uchile.cl,1330,"Artificial Intelligence, Data Mining, Pattern Recognition, Business Intelligence"
9232372474901008384,Rbu0KEoAAAAJ,Universidad de Chile,uchile,@uchile.cl,1311,"Cell and Molecular Biology, Chemical genetics"
9232372474901008384,SagWOMUAAAAJ,Universidad de Chile,uchile,@med.uchile.cl,1318,
9232372474901008384,Lp0q30QAAAAJ,Profesora de Física y  paleobotánica Universidad de Chile Facultad de Agronomía,uchile,@u.uchile.cl,1299,"física, paleobotánica, paleoxylología, flora fósil, antártica"
9232372474901008384,pM28qdcAAAAJ,Universidad de Chile,uchile,@ing.uchile.cl,1292,"Artificial intelligence and signal processing applied to HRI, speech processing and seismology."
9232372474901008384,bMjCzEkAAAAJ,Universidad de Chile,uchile,@uchile.cl,1282,
9232372474901008384,h5lwVDUAAAAJ,"Instituto de Nutrición y Tecnología de los Alimentos (INTA), Universidad de Chile",uchile,@inta.uchile.cl,1300,"Iron, neuron, neurodegeneration, neuroinflammation"
9232372474901008384,6_355KcAAAAJ,"Assistant Professor, Physics Department - University of Chile",uchile,@uchile.cl,1287,"Astrophysical and space plasmas, high energy astrophysics"
9232372474901008384,tKfPcAkAAAAJ,University of Chile,uchile,@dii.uchile.cl,1307,"Revenue Management, Assortment Planning"
9232372474901008384,Ilo_1KcAAAAJ,"Titular  Professor of Education, Universidad of Chile",uchile,@u.uchile.cl,1281,"Teacher Training, evaluating program of education, educational policy"
9232372474901008384,Z2787BMAAAAJ,"Full Professor University of Chile, Head of Endocrinology and Biology Reproduction Laboratory",uchile,@hcuch.cl,1263,"Ovarian cancer, neuroendocrinology of the ovary, biology of reproduction"
9232372474901008384,eU41CdMAAAAJ,Universidad de Chile,uchile,@uchile.cl,1307,Ciencias Sociales y Cambio Climático
9232372474901008384,HHZjN7wAAAAJ,University of Chile,uchile,@dgf.uchile.cl,1256,meteorology
9232372474901008384,1-06wnQAAAAJ,Universidad de Chile,uchile,@uchile.cl,1288,Vejez y envejecimiento
9232372474901008384,RYG4FRoAAAAJ,"Associate Professor of Conservative Dentistry, University of Chile",uchile,@odontologia.uchile.cl,1276,"dentistry, periodontics, immunology, genetics"
9232372474901008384,mnsc-80AAAAJ,University of Chile,uchile,@med.uchile.cl,1251,"Medical Mycology, General Mycology, mycology, aspergillus, dermatophytes"
9232372474901008384,nWzmqycAAAAJ,Universidad de Chile,uchile,@uchile.cl,1257,"psicología evolutiva y de la educación, inclusión educativa"
9232372474901008384,VbaZ2XUAAAAJ,University of Chile,uchile,@odontologia.uchile.cl,1262,"Nanobiomaterials, tissue engineering, dental materials"
9232372474901008384,m6BJ7UoAAAAJ,Universidad de Chile,uchile,@med.uchile.cl,1254,"skeletal muscle, Cav1.1, Panx, plasticity"
9232372474901008384,6m3sR_oAAAAJ,"Profesor Asistente (Facultad de Economía y Negocios, Universidad de Chile)",uchile,@fen.uchile.cl,1252,"business intelligence, service analytics, finance, environmental information management"
9232372474901008384,QMna86wAAAAJ,Profesor Universidad de Chile,uchile,@uchile.cl,1212,"Bioclimatologia, modelacion sistemas ecologicos, cambio climatico"
9232372474901008384,Q5KS1wMAAAAJ,"Professor of Evolution, University of Chile",uchile,@uchile.cl,1214,"Morphology, Evolution and Development, Paleontology"
9232372474901008384,_BLLLlIAAAAJ,"Associate Professor, Faculty of Economics and Bussines, University of Chile",uchile,@unegocios.cl,1219,"Organizational Behavior, Human Resource Management, Teamwork, Work Family Conflict"
9232372474901008384,5i57myYAAAAJ,"Profesor asistente, Hospital Clínico Universidad de Chile",uchile,@uchile.cl,1236,"intrauterine growth restriction, preeclampsia, echocardiography, doppler"
9232372474901008384,fna_YjwAAAAJ,Universidad de Chile / Hospital de Niños Roberto Del Río,uchile,@uchile.cl,1243,"Pediatric Surgery, Anorectal Malformations"
9232372474901008384,o4_3t_4AAAAJ,"Associate Professor of Economics, University of Chile",uchile,@fen.uchile.cl,1204,
9232372474901008384,fW4nqvAAAAAJ,"Parasitology, Faculty of Medicine, Universidad de Chile",uchile,@med.uchile.cl,1202,Parasitology
9232372474901008384,RRCqUogAAAAJ,Universidad de Chile,uchile,@ing.uchile.cl,1192,"Metallic Thin films, nanostructures, self-assembled monolayers"
9232372474901008384,bJxogC4AAAAJ,Universidad de Chile      Facultad de Ciencias Sociales      Departamento de Trabajo Social,uchile,@uchile.cl,1169,Innovación Social en Políticas Públicas     Trabajo Social      Epistemologia de Ciencias Sociales
9232372474901008384,eED62hwAAAAJ,University of Chile,uchile,@dii.uchile.cl,1167,"Marketing, Empirical Operations Management, Bayesian Statistics, Game Theory, Econometrics"
9232372474901008384,mo9FitwAAAAJ,"Profesor Titular, Universidad de Chile",uchile,@uchile.cl,1181,"Geografía, Geografía Social, Geografía Cultural, Sustentabilidad, Estudios socioambientales"
9232372474901008384,9xiMwSAAAAAJ,Universidad de Chile,uchile,@uchile.cl,1173,"epidemiology, infectious disease, microbiome, community ecology, paleontology"
9232372474901008384,jPsYze4AAAAJ,University of Chile,uchile,@fen.uchile.cl,1157,"Financial Economics, Risk and Uncertainty, Economics of Entrepreneurship"
9232372474901008384,bXWXXvQAAAAJ,profesora titular Universidad de Chile,uchile,@uchile.cl,1168,"grupos económicos, medios comunicación, universidades, religión"
9232372474901008384,uF_kFzYAAAAJ,Universidad de Chile,uchile,@dfi.uchile.cl,1146,
9232372474901008384,2G5e0DQAAAAJ,"Centro de Investigación Avanzada en Educación, Universidad de Chile",uchile,@ciae.uchile.cl,1162,STEM Education
9232372474901008384,_tGqLIEAAAAJ,"Maquintel Robotics / Associate Prof. Mech. Eng., University of Chile",uchile,@ing.uchile.cl,1141,"Pipe Inspection, Robotic Inspection, Robotics, Soft Robotics, 3D Printing"
9232372474901008384,RbbokdkAAAAJ,Universidad de Chile,uchile,@macul.ciencias.uchile.cl,1129,
9232372474901008384,DYZQLqkAAAAJ,Universidad de Chile,uchile,@u.uchile.cl,1137,"Astronomical Instrumentation, Solid State Physics"
9232372474901008384,kXCQPiYAAAAJ,INTA - Universidad de Chile,uchile,@inta.uchile.cl,1150,"Plant Genetics, Genomics, Fruit Phenotyping, Quantitative Genetics, Healthy Compounds"
9232372474901008384,8piFE0wAAAAJ,"Discrete Mathematics, Universidad de Chile",uchile,@dim.uchile.cl,1127,"Discrete Mathematics, Distributed Computing, Theory of Computing, Cellular Automata"
9232372474901008384,D1tmMfMAAAAJ,Universidad de Chile,uchile,@med.uchile.cl,1135,
9232372474901008384,XjOo4HcAAAAJ,Universidad de Chile,uchile,@uchile.cl,1130,"Mineral Processing, Geometallurgy, Renewable Energies"
9232372474901008384,NQFomY8AAAAJ,"Department of Civil Engineering, Universidad de Chile",uchile,@uchile.cl,1142,"Hydrological modeling, climate change, streamflow forecasting, hydroclimatology, snow hydrology"
9232372474901008384,ZcIH7msAAAAJ,Universidad de Chile,uchile,@uchile.cl,1137,"Polímeros, polielectrolitos, físico química, modificación de superficies, biomoléculas"
9232372474901008384,XdIxuAYAAAAJ,Universidad de Chile,uchile,@dim.uchile.cl,1110,Probability Theory
9232372474901008384,Kk4DnQcAAAAJ,University of Chile,uchile,@dii.uchile.cl,1117,"Decision Making, Prosocial Behavior, Consumer Behavior, Behavioral Economics"
9232372474901008384,AW8WVGcAAAAJ,"Departamento de Biología, Facultad de Ciencias, Universidad de Chile",uchile,@uchile.cl,1102,Inmunologia
9232372474901008384,0qO1fiQAAAAJ,Universidad de Chile,uchile,@uchile.cl,1108,
9232372474901008384,MwdLctAAAAAJ,"Associate Professor of Economics, University of Chile",uchile,@fen.uchile.cl,1128,"Health Economics, Development Economics, Applied Econometrics"
9232372474901008384,uZu1O1cAAAAJ,Universidad de Chile,uchile,@uchile.cl,1096,
9232372474901008384,WTIlYucAAAAJ,Universidad de Chile,uchile,@u.uchile.cl,1075,microbiologia y biotecnologia enológica
9232372474901008384,50b9WpUAAAAJ,"DIM - CMM, Universidad de Chile",uchile,@dim.uchile.cl,1073,"Applied Math, Inverse Problemas, Control Theory, PDE"
9232372474901008384,zRuYYrwAAAAJ,"Profesor Asistente, Universidad de Chile",uchile,@uchile.cl,1088,"soil science, soil conservation, forest science"
9232372474901008384,ltsTTI4AAAAJ,"Department of Computer Science, Universidad de Chile",uchile,@dcc.uchile.cl,1084,"urban mobility, information visualization, data science"
9232372474901008384,2gI4XwcAAAAJ,"Advanced Materials Laboratory (AmLab), Department of Mechanical Engineering,University of Chile",uchile,@uchile.cl,1101,"Structural, Mechanical and Electrical Properties of Materials for SOCs"
9232372474901008384,t5-vJa8AAAAJ,"Assistant Professor of Psychiatry, University of Chile / Research Fellow, MGH - Harvard University",uchile,@hcuch.cl,1064,"Clinical Psychiatry, Bipolar Disorder, Personality Disorders, Prevention in Mental Health"
9232372474901008384,JsM8ploAAAAJ,"School of Public Health, Faculty of Medicine, University of Chile",uchile,@med.uchile.cl,1054,"Social determinants of health, equity in health, child mortality, avoidable mortality"
9232372474901008384,izAdafwAAAAJ,"Universidad de Chile, San Diego State University",uchile,@uchile.cl,1066,"urban pollution, environmental chemistry, public health"
9232372474901008384,BIsq4V0AAAAJ,CNRS and Universidad de Chile,uchile,@dim.uchile.cl,1056,"Dispersive equations, Solitons, Stability, Asymptotic Stability, Long time asymptotics"
9232372474901008384,z-KDCxQAAAAJ,University of Chile,uchile,@dim.uchile.cl,1037,"Theory of computation, Random Structures and Algorithms"
9232372474901008384,f9lhmwUAAAAJ,"Profesor Asociado. ICBM. Facultad de Medicina.Universidad de Chile,",uchile,@u.uchile.cl,1039,"Gene regulation, tRNA modification, pathogenesis"
9232372474901008384,y8bQi0AAAAAJ,Universidad de Chile,uchile,@uchile.cl,1054,Biomaterials
9232372474901008384,QCnt_nUAAAAJ,Universidad de Chile,uchile,@u.uchile.cl,1020,Inmunología
9232372474901008384,rtEZdK4AAAAJ,"Department of Computer Science, University of Chile",uchile,@dcc.uchile.cl,1010,"Distributed Systems, Computer Networks, Programming Languages"
9232372474901008384,-GORChcAAAAJ,"Department of Ecological Sciences, Faculty of Sciences, Universidad de Chile",uchile,@uchile.cl,1032,"Microbial Ecology, Soil Microbiology, Lichen Ecology"
9232372474901008384,5DL9KekAAAAJ,"Profesor Asistente, Universidad de Chile",uchile,@hcuch.cl,1012,"Biobank, craneofacial development, cancer"
9232372474901008384,Wvo5eEEAAAAJ,"Profesor Asociado, Departamento de Biología, Facultad de Ciencias, Universidad de Chile",uchile,@u.uchile.cl,1019,"Microbiología, Patógenos, Microbioma, Omicas"
9232372474901008384,8YWebSoAAAAJ,"Departamento de Trabajo Social, Universidad de Chile",uchile,@uchile.cl,1021,"Trabajo, Sindicatos, Salarios, Desigualdad, Negociación Colectiva"
9232372474901008384,1V9d67kAAAAJ,"Seismologist, Operations Manager at National Seismological Center, University of Chile",uchile,@dgf.uchile.cl,1002,"Earthquakes, Tsunamis, Seismogeodesy, Early Warning"
9232372474901008384,l-ZJJFgAAAAJ,University of Chile,uchile,@fen.uchile.cl,1009,"Business Process Management, Optimization"
9232372474901008384,dfnRrZkAAAAJ,"Associate Professor, University of Chile",uchile,@dim.uchile.cl,988,Mathematical models of Fluid-Structue interaction
9232372474901008384,64rifYwAAAAJ,"Profesora Asociada Departamento de Geografía, Universidad de Chile",uchile,@uchilefau.cl,1013,"Migración, Gentrificación, Geografía Humana, Geografía Urbana"
9232372474901008384,CPJ0qfQAAAAJ,"Departamento de Sociología, Universidad de Chile",uchile,@uchile.cl,1014,
9232372474901008384,JcNbcMEAAAAJ,"Department of Economics, University of Chile",uchile,@fen.uchile.cl,995,"Labor Economics, Micro Entrepreneurship, Household Finance"
9232372474901008384,airlFmQAAAAJ,Universidad de Chile,uchile,@uchile.cl,1005,"psychometrics, social movements, teacher assessment"
9232372474901008384,gcw5EdQAAAAJ,"Director, Center for Bioethics, University of Chile",uchile,@uchile.cl,988,"Psychiatry, Mental Health, Bioethics, History"
9232372474901008384,5XHRNwYAAAAJ,Universidad de Chile,uchile,@dim.uchile.cl,1005,"Signal Processing, Machine Learning"
9232372474901008384,klAKNOcAAAAJ,"Dept. of Computer Science, University of Chile",uchile,@dcc.uchile.cl,982,"Cryptography, Computer Security"
9232372474901008384,85Ubr4wAAAAJ,"Associated Professor, Departement of Neurociencias, University of Chile",uchile,@uchile.cl,978,"learning and memory, Motivated behavior, Neural dynamics"
9232372474901008384,i6Yr5GgAAAAJ,"Profesor Asistente, Departamento de Sociología, Universidad de Chile",uchile,@u.uchile.cl,992,"Clases sociales, conflicto social, trabajo, América Latina, Chile"
9232372474901008384,GWJS62wAAAAJ,"profesor de Economia Agraria, Universidad de Chile",uchile,@uchile.cl,968,"cadenas de valor, economía y salud animal"
9232372474901008384,cDGHCcwAAAAJ,University of Chile,uchile,@dim.uchile.cl,972,"Graph theory, Combinatorics"
9232372474901008384,9IW7ysgAAAAJ,"Profesora Asistente INTA, Universidad de Chile",uchile,@inta.uchile.cl,967,Entornos escolares saludables
9232372474901008384,Uchi7TgAAAAJ,"Facultad de Odontología, Universidad de Chile",uchile,@u.uchile.cl,978,
9232372474901008384,Vze5x18AAAAJ,"Depto Ingeniería Matemática & Centro de Modelamiento Matemático, Universidad de Chile",uchile,@dim.uchile.cl,935,"Continuous optimization, fisheries managment, control and optimization of bioprocesses"
9232372474901008384,Ctf1qpAAAAAJ,"Associate Professor, Institute for Maternal and Child Research, University of Chile",uchile,@uchile.cl,956,"Biology of Reproduction, uterine biology, embryo implantation"
9232372474901008384,PrpjOXQAAAAJ,Universidad de Chile,uchile,@u.uchile.cl,988,"psicología social, psicología política, medición"
9232372474901008384,X6SuHwwAAAAJ,Universidad de Chile,uchile,@uchile.cl,961,"Immunology, parasitology"
9232372474901008384,1uKRTBAAAAAJ,Profesor asistente Universidad de Chile,uchile,@inta.uchile.cl,963,"Aquaculture, Molecular Biology, Omics technologies"
9232372474901008384,ycn8lj4AAAAJ,"profesora de Psicología Social, Universidad de Chile",uchile,@uchile.cl,987,"Psicología Social, Memoria colectiva. Violencia política"
9232372474901008384,lso0gIYAAAAJ,University of Chile,uchile,@u.uchile.cl,968,"Rhinology, Staphylococcus aureus, chronic rhinosinusitis, sinusitis, endoscopic sinus surgery"
9232372474901008384,axQ_tCEAAAAJ,"Lab. Bronchovascular Dynamics & Lung Damage, ICBM, Fac of Medicine, University of Chile",uchile,@uchile.cl,946,"Purinergic signalling, Lung Physiology"
9232372474901008384,0g9vuRYAAAAJ,"Departamento de Medicina Preventiva Animal, Facultad de Ciencias Veterinarias y Pecuarias, Universidad de Chile",uchile,@uchile.cl,960,"microbiology, infectious diseases, zoonotic diseases, salmonellosis, tuberculosis"
9232372474901008384,t0DCuEYAAAAJ,"Universidad de Chile, Centro de Análisis Cuantitativo en Antropología Dental y Dpto Antropología",uchile,@odontologia.uchile.cl,941,"Evolution, Morphometrics, Statistics, Dental Anthropology"
9232372474901008384,QvQytBoAAAAJ,Universidad de Chile,uchile,@u.uchile.cl,974,
9232372474901008384,t6jfUSUAAAAJ,"Assistant Professor of Geology, Departamento de Geología, Universidad de Chile",uchile,@ing.uchile.cl,947,"geochemistry, fluid inclusions, melt inclusions, mineral deposits"
9232372474901008384,adpWVWsAAAAJ,University of Chile,uchile,@uchile.cl,947,Neuroscience
9232372474901008384,iBW6M4gAAAAJ,Universidad de Chile,uchile,@uchile.cl,962,"Diversidad, inmigración, políticas públicas, intervención social, LGTBI"
9232372474901008384,vqRBSs0AAAAJ,Profesor in University of Chile Clinical Hospital,uchile,@hcuch.cl,929,Hepatology
9232372474901008384,YD1vmF8AAAAJ,"Centro de Investigación Clínica Avanzada, HCUCH; Instituto de Neurociencia Biomedica, Fac. Medicina",uchile,@ciq.uchile.cl,924,"Synaptic plasticity, spine remodeling, learning and memory, Calcium signaling, Neurodegenerative disease"
9232372474901008384,VyGa1PMAAAAJ,"Assistant Profesor, Universidad de Chile",uchile,@fen.uchile.cl,944,"Management Control, Innovation, Bibliometrics, Higher Education"
9232372474901008384,0syb6wsAAAAJ,Universidad de Chile,uchile,@u.uchile.cl,952,bienestar animal
9232372474901008384,1bzmmc0AAAAJ,"Assistant Professor, Faculty of Sciences, Department of Physics, University of Chile",uchile,@uchile.cl,929,"Plasma Physics, Astrophysical plasma, Space Plasma Physics, Solar wind, Statistical Mechanics"
9232372474901008384,a1IKJKEAAAAJ,"Postdoctoral, Universidad de Chile",uchile,@ug.uchile.cl,942,"photonic lattices, flat bands, exciton-polaritons, topological photonics"
9232372474901008384,t6B1cxEAAAAJ,"Professor of Sociology, Universidad de Chile",uchile,@u.uchile.cl,920,"gender, history, feminism"
9232372474901008384,b0IQkk8AAAAJ,Universidad de Chile,uchile,@uchile.cl,929,"soil sciences, soil fertility, water quality, nitrogen leaching"
9232372474901008384,HmrKwHcAAAAJ,Universidad de Chile,uchile,@u.uchile.cl,933,
9232372474901008384,kh8Gm_EAAAAJ,Departamento de Psicología Universidad de Chile,uchile,@uchile.cl,922,"Healthy coping in old age, Social inclusion/exclusion of the elderly, Psychosocial factors associated with healthy aging"
9232372474901008384,mPFQzLMAAAAJ,"Red Paleontológica U-Chile, Depto. de Biología, Facultad de Ciencias, Universidad de Chile",uchile,@ug.uchile.cl,910,"Paleontología de vertebrados, Evolución"
9232372474901008384,fsuH32gAAAAJ,Universidad de Chile,uchile,@uchile.cl,945,Child and Adolescent Psychiatry and Mental Health
9232372474901008384,Kbn-4bMAAAAJ,Facultad de Medicina.Universidad de Chile,uchile,@uchile.cl,910,Nefrologia Pediatrica
9232372474901008384,aNh8zSkAAAAJ,Universidad de Chile,uchile,@uchile.cl,915,Hunters-gatherers Archaeology - Lithic Technology - Geoarchaeology
9232372474901008384,N-ZnXtoAAAAJ,"Assistant professor, University of Chile",uchile,@ing.uchile.cl,926,"Power Engineering, Energy, Power Systems, Microgrids, Renewable Energies"
9232372474901008384,hQCJJ5MAAAAJ,"Department of Nutrition, University of Chile",uchile,@med.uchile.cl,911,"Public Health, Nutrition"
9232372474901008384,W7iCaHUAAAAJ,"Associate Professor, Anesthesiology and Perioperative Medicine, University of Chile.",uchile,@uchile.cl,928,"Regional Anesthesia, Anesthesia."
9232372474901008384,NWWmUJQAAAAJ,"Assistant Professor, University of Chile",uchile,@ing.uchile.cl,893,"mathematical modeling, biology, proteins, chromatography"
9232372474901008384,C1JXrV8AAAAJ,Universidad de Chile,uchile,@uchile.cl,922,
9232372474901008384,Kw-9h4AAAAAJ,"Raincode Labs, previously DCC - Universidad de Chile",uchile,@dcc.uchile.cl,891,"Programming Languages, Source code analysis and manipulation"
9232372474901008384,87haJpoAAAAJ,Universidad de Chile,uchile,@uchile.cl,923,"Comunicación, cultura, industrias culturales, libertad de expresión, economía política"
9232372474901008384,_TCefG4AAAAJ,Universidad de Chile,uchile,@uchile.cl,879,Plasticidad sináptica en el cerebro de roedores. Resonancia neuronal en cerebro de roedores
9232372474901008384,HKbXyuYAAAAJ,Profesor Asociado (O); Depto. de Terapia Ocupacional y Ciencia de la Ocupación. Universidad de Chile,uchile,@uchile.cl,885,"Occupational Therapy, Occupational Science, LGBTQ studies, Meditation, Pragmatism"
9232372474901008384,aBaIKeAAAAAJ,Universidad de Chile,uchile,@uchile.cl,877,Etnohistoria. Antropologia Histórica
