organization,scholar_id,affiliation,id_institucion,email_domain,citedby,interests
9232372474901008384,Mn1y-vYAAAAJ,"Assistant Professor, Universidad de Chile",uchile,@uchile.cl,274,"Ecofisiología, Relaciones hídricas, hidráulica de plantas, agricultura de zonas áridas"
9232372474901008384,EiymWMgAAAAJ,Universidad de Chile,uchile,@uchile.cl,273,"Antropología Médica, Salud Colectiva, Salud Pública"
9232372474901008384,k-xcBMsAAAAJ,University of Chile,uchile,@u.uchile.cl,270,"Biomaterials, Electroactive Biomaterials"
9232372474901008384,Q6IrWnAAAAAJ,"Assistant Professor, CIAE, Instituto de Estudios Avanzados en Educación (IE), Universidad de Chile",uchile,@ciae.uchile.cl,275,"equity in education, educational effectiveness, quantitative research, multilevel models, social network analysis"
9232372474901008384,ZDaX238AAAAJ,"Universidad de Chile & CMM, Universidad de Chile - UMI CNRS 2807",uchile,@uchile.cl,263,"Mathematical physics, PDE"
9232372474901008384,DLfLETQAAAAJ,Universidad de  Chile,uchile,@ug.uchile.cl,264,"Biología Celular, Fisiología, Neurociencia"
9232372474901008384,bJDTXDcAAAAJ,Universidad de Chile,uchile,@ug.uchile.cl,276,
9232372474901008384,Z__wlMAAAAAJ,"Centro de Investigación Avanzada en Educación, Universidad de Chile",uchile,@ciae.uchile.cl,275,
9232372474901008384,GxBX_0oAAAAJ,University of Chile,uchile,@u.uchile.cl,262,"popular music, sociology, cultural policy, migration"
9232372474901008384,2KSiMeoAAAAJ,"Instituto de la Comunicación e Imagen, Universidad de Chile",uchile,@ug.uchile.cl,253,comunicación
9232372474901008384,TKYdFK0AAAAJ,Universidad de Chile,uchile,@ug.uchile.cl,267,"gastric cancer, pharmacology"
9232372474901008384,7cx89-4AAAAJ,"Center for Advanced Research in Education-CIAE, Institute of Education, Universidad de Chile",uchile,@ciae.uchile.cl,252,"Psycholinguistics, Statistics"
9232372474901008384,7aPNHhUAAAAJ,Universidad de Chile,uchile,@fen.uchile.cl,263,"Economía de la Educación, Economía Laboral, Microeconometría, Organización Industrial Empírica"
9232372474901008384,1-9JzEkAAAAJ,"Professor of Administrative Law, University of Chile, Chile",uchile,@derecho.uchile.cl,251,"Administrative Law, Constitutional Law, Legal Theory"
9232372474901008384,H9xW-0YBB3oC,Facultad de Medicina. Universidad de Chile,uchile,@uchile.cl,247,"Exercise physiology, Physical fitness and Physical activity in patients with non-communicable diseases"
9232372474901008384,_Ig5x_4AAAAJ,"Assistant professor, University of Chile",uchile,@uchile.cl,256,Occupational health psychology
9232372474901008384,nokAcbcAAAAJ,Universidad de Chile,uchile,@uchile.cl,272,
9232372474901008384,CkB3cnMAAAAJ,"Académica, Instituto de la Comunicación e Imagen, Universidad de Chile.",uchile,@uchile.cl,250,"Antropología del Cine y los Medios, Cine Chileno y Latinoamericano, Festivales de Cine, Cine Documental, Exhibición y Distribu"
9232372474901008384,3V9HPHAAAAAJ,Universidad de Chile,uchile,@uchile.cl,249,"Learning Analytics, Higher Education, Process Mining"
9232372474901008384,YnAMsq0AAAAJ,Universidad de Chile,uchile,@ug.uchile.cl,239,"Biomechanics, Biomimetics"
9232372474901008384,K44P1PEAAAAJ,"Profesor de la Facultad de Ciencias, Universidad de Chile",uchile,@u.uchile.cl,232,Algebra y Teoría de Números
9232372474901008384,k8E9ISMAAAAJ,Universidad de Chile,uchile,@ug.uchile.cl,250,"Ecology, Evolution, Conservation Genetics, Genomics, Geometric morphometrics"
9232372474901008384,vnHQdFgAAAAJ,Universidad de Chile,uchile,@uchile.cl,232,Reproducción y Biología Molecular de Peces
9232372474901008384,kz06lVMAAAAJ,"Profesor de Literatura, Universidad de Chile",uchile,@uchile.cl,242,"Literatura chilena, edición crítica"
9232372474901008384,uBM0o8cAAAAJ,"Posdoctoral Researcher, Centro de Modelamiento Matemático, Universidad de Chile",uchile,@cmm.uchile.cl,256,"Statistical Ecology, Biodiversity, Ecological niche modeling"
9232372474901008384,Kat4eD8AAAAJ,Universidad de Chile,uchile,@derecho.uchile.cl,231,"Derecho penal, Derecho penal juvenil, Justicia juvenil, Sentencing, Criminología"
9232372474901008384,EvFSvhsAAAAJ,Universidad de Chile,uchile,@uchile.cl,228,"Education, Institutional Ethnography, Intercultural Education"
9232372474901008384,q0wjxoQAAAAJ,"Investigador, Universidad de Chile",uchile,@ing.uchile.cl,233,Geotermia
9232372474901008384,oUG1ln4AAAAJ,Departamento de Diseño Universidad de Chile,uchile,@uchilefau.cl,227,"historia del diseño, estudios visuales, cultura material"
9232372474901008384,boisKzwAAAAJ,"Department of Industrial Engineering, Universidad de Chile",uchile,@uchile.cl,231,"Labor Economics, Political Economy"
9232372474901008384,LWexJXAAAAAJ,"Estadística, INTA, Universidad de Chile",uchile,@inta.uchile.cl,225,"nutrición, actividad física y estadística"
9232372474901008384,x3boCyQAAAAJ,"Department of Economics, Faculty of Economics and Business, University of Chile",uchile,@fen.uchile.cl,227,"optimization, mathematical economics, growth theory, sustainability"
9232372474901008384,85IqlQ8AAAAJ,"PhD Nutrición y Alimentos, Universidad de Chile. Docente Cátedra Universidad de Antioquia",uchile,@inta.uchile.cl,230,"Vitamin B12, Folate, Fetal Programming, Maternal and Child Nutrition, Double Burden Of Malnutrition"
9232372474901008384,vJZBSKEAAAAJ,Universidad de Chile,uchile,@uchile.cl,230,Acoustics / Soundscape
9232372474901008384,9mAm1D8AAAAJ,University of Chile,uchile,@iap.uchile.cl,222,"comparative politics, latin america, political parties, presidentialism"
9232372474901008384,tLdkM3kAAAAJ,"Academica, Departamento de Enfermeria, Universidad de Chile",uchile,@uchile.cl,234,"Enfermeria, Investigacion cualitativa, nefrologia"
9232372474901008384,DYe1aFkAAAAJ,Universidad de Chile,uchile,@uchile.cl,235,Integro-differential equations
9232372474901008384,3LQeN-kAAAAJ,Universidad de Chile,uchile,@uchile.cl,223,Cirugia
9232372474901008384,vXAdkuwAAAAJ,Universidad de Chile,uchile,@derecho.uchile.cl,221,"Teoría del Derecho, Teoría Política, Teoría Social"
9232372474901008384,9gqjsEwAAAAJ,UNIVERSIDAD DE CHILE,uchile,@uchilefau.cl,223,"Arquitectura, teoría y práctica del proyecto arquitectónico"
9232372474901008384,Bu4kjhIAAAAJ,"University of Chile, School of Law",uchile,@uchile.cl,221,"Cyber Law, Privacy, Copyright, Cyber-security, Encryption"
9232372474901008384,MbKkUJkAAAAJ,"Académico Universidad de Chile, Departamento de Fonoaudiología",uchile,@uchile.cl,210,"Educación superior, intervención en voz, análisis acústico de la voz, la voz en los/as docentes"
9232372474901008384,Nio-K8QAAAAJ,"prof. Odontología Restauradora ,Fac. Odontología , Universidad de Chile",uchile,@odontologia.uchile.cl,220,"Odontologia Restauradora, Epidemiología, Alteraciones estructura del diente"
9232372474901008384,ZT9v16oAAAAJ,Universidad de Chile,uchile,@uchile.cl,228,"complex geometry, algebraic geometry, abelian varieties, jacobian varieties, Riemann surfaces"
9232372474901008384,kkRqhecAAAAJ,Universidad de Chile,uchile,@ug.uchile.cl,218,"Nanotecnología, drug delivery"
9232372474901008384,8CMzV2MAAAAJ,Universidad de Chile,uchile,@ug.uchile.cl,221,Neuroplasticity
9232372474901008384,7HgXTgpJXyAC,"Profesor Asistente, Universidad de Chile",uchile,@uchile.cl,227,
9232372474901008384,IRZOBlkAAAAJ,Universidad de Chile,uchile,@uchile.cl,208,
9232372474901008384,ZVSmRYwAAAAJ,"University of Chile, Cornell University",uchile,@uchile.cl,215,"Geochemistry, Reactive Transport Models, Critical Zone"
9232372474901008384,xwVLXRQAAAAJ,"Académico Facultad de Gobierno, Universidad de Chile/Research Fellow CLALS American University",uchile,@u.uchile.cl,210,"Política Comparada, Seguridad y Defensa, Política Exterior"
9232372474901008384,0Xjk9agAAAAJ,"Profesora Asistente, Universidad de Chile",uchile,@uchile.cl,217,"Envejecimiento, delirium, cuidados paliativos, salud pública"
9232372474901008384,nFXqfxgAAAAJ,Universidad de Chile,uchile,@uchile.cl,216,
9232372474901008384,niWJFnQAAAAJ,Universidad de Chile,uchile,@u.uchile.cl,214,
9232372474901008384,I-bh4HoAAAAJ,"Profesor asistente, Universidad de Chile / Investigador COES",uchile,@uchile.cl,213,"Sociología, clases sociales, sociología del trabajo, sociología política"
9232372474901008384,QkrmzHsAAAAJ,"Assistant Professor, Department of Physics, FCFM, Universidad de Chile",uchile,@uchile.cl,224,"Physical biology, non-linear phenomena, pattern formation, out-of-equilibrium physics"
9232372474901008384,BcOlgNIAAAAJ,UNIVERSIDAD DE CHILE. LABORATORIO DE INCENDIOS FORESTALES,uchile,@uchile.cl,215,"INCENDIOS FORESTALES, MODELACIÓN ESPACIAL"
9232372474901008384,LXcZhvAAAAAJ,"ICBM, Facultad de Medicina, Universidad de Chile",uchile,@ug.uchile.cl,230,"Epigenetica, Autoinmunidad, Ciencias Biomédicas"
9232372474901008384,N6oMB9AAAAAJ,"Ingeniería Química Biotecnología y Materiales, Universidad de Chile",uchile,@ing.uchile.cl,228,Organic synthesis and biotechnology engineering
9232372474901008384,uY9C2GYAAAAJ,Clinical Hospital University of Chile,uchile,@hcuch.cl,217,
9232372474901008384,gyRjrTMAAAAJ,Universidad de Chile,uchile,@uchile.cl,213,auditory neurosciences
9232372474901008384,tcoirIgAAAAJ,"Departamento de Enfermería, Universidad de Chile",uchile,@uchile.cl,207,"enfermería, salud pública, epidemiología, pediatría"
9232372474901008384,SdJVdfEAAAAJ,Universidad de Chile,uchile,@uchile.cl,214,"discapacidad, feminismo, ocupación, gubernamentalidad, subjetividad."
9232372474901008384,Yv0S2jgAAAAJ,Business Department Head Universidad de Chile,uchile,@fen.uchile.cl,206,Marketing and Strategy
9232372474901008384,YqHQUqEAAAAJ,"Department of Electrical Engineering, Universidad de Chile",uchile,@ing.uchile.cl,203,"Decentralized Reinforcement Learning, Robotics, Type-2 Fuzzy Systems"
9232372474901008384,zrst-oIAAAAJ,Universidad de Chile,uchile,@uchile.cl,209,"Chile, Intellectuals, Business groups, Social classes, Latin America"
9232372474901008384,ZlgjeT0AAAAJ,"Profesor Asistente, Departamento de Biología, Facultad de Ciencias, Universidad de Chile",uchile,@uchile.cl,213,"Molecular evolution, Enzymology, Structural Biology, X-ray Crystallography, Structural Bioinformatics"
9232372474901008384,MC4I5MAAAAAJ,Universidad de Chile,uchile,@uchile.cl,198,"Educación Superior, Autorregulación Académica, Psicopedagogía"
9232372474901008384,0nHLHCQAAAAJ,"Centro de Enseñanza y Aprendizaje, Facultad de Economía y Negocios, Universidad de Chile",uchile,@fen.uchile.cl,205,"Educación Superior, Aseguramiento de la Calidad, Innovación."
9232372474901008384,UG0w-4QAAAAJ,Universidad de Chile,uchile,@ing.uchile.cl,205,"Chemical Engineering, Biomass, Gasification, Fast Pyrolysis, Catalysis"
9232372474901008384,d4uZJ_oAAAAJ,Universidad de Chile,uchile,@uchile.cl,202,
9232372474901008384,68UzBT8AAAAJ,"Research Engineer, Speech Processing and Transmission Laboratory, Universidad de Chile",uchile,@uchile.cl,205,
9232372474901008384,I4_Kc-IAAAAJ,Universidad de Chile,uchile,@uchile.cl,206,"estudios curriculares, formación inicial, investigación cualitativa"
9232372474901008384,hCcAcx8AAAAJ,"PhD (c) Ecología y Biología Evolutiva, Universidad de Chile",uchile,@ug.uchile.cl,200,"Ecología, Fisiología, Toxicología"
9232372474901008384,TtACwrEAAAAJ,University of Chile,uchile,@uchile.cl,204,"Dynamic of Structures, Blast Design, System identification of Structures, Impact loads, Bridges"
9232372474901008384,wxJy6_YAAAAJ,"postdoctorado,  Departamento Ingeneria Industrial Universidad de Chile",uchile,@dii.uchile.cl,205,"organización industrial, microeconometría, educación"
9232372474901008384,_9yfpykAAAAJ,"Universidad de Chile , Center for climate and resilience research (CR2)",uchile,@uchile.cl,207,"Machine Learning, Artificial intelligence, Atmospheric chemistry"
9232372474901008384,M50ZyugAAAAJ,"Facultad de Odontologia, Universidad de Chile.",uchile,@odontologia.uchile.cl,207,Patologia y Medicina Oral
9232372474901008384,YwllwC4AAAAJ,"Assistant Professor, Universidad de Chile Law School",uchile,@derecho.uchile.cl,201,Law & Economics
9232372474901008384,SSSfK8gAAAAJ,"Professor of Civil Engineering, University of Chile",uchile,@ing.uchile.cl,197,"Urban Economics, Transport"
9232372474901008384,bU0GgSkAAAAJ,Académico Universidad de Chile,uchile,@odontologia.uchile.cl,207,Envejeciimiento humano
9232372474901008384,it_WTZsAAAAJ,"IE & CIAE, Universidad de Chile",uchile,@ciae.uchile.cl,203,"Mathematics Education, Problem Solving, Professional Development"
9232372474901008384,7lJkH3kAAAAJ,"Facultad de Gobierno, Universidad de Chile",uchile,@gobierno.uchile.cl,198,"science and technology policy, history of science and technology, climate change, climate governance, science policy interface"
9232372474901008384,MBpnYwEAAAAJ,"Facultad de Derecho, Universidad de Chile",uchile,@derecho.uchile.cl,196,Derecho administrativo
9232372474901008384,Uiyy6AwAAAAJ,Universidad de Chile,uchile,@ciq.uchile.cl,212,"Pharmaceutical technology, Drug Delivery, 3D printing, Nanomedicine"
9232372474901008384,6Gfj1A0AAAAJ,"Académica, Universidad de Chile",uchile,@uchilefau.cl,190,"clima urbano, cambio climático"
9232372474901008384,R84mfaoAAAAJ,"Profesora de Filosofía del Departamento de Filosofía, Universidad de Chile",uchile,@uchile.cl,192,"Filosofía ambiental, metafísica, filosofía moderna, filosofía contemporánea"
9232372474901008384,6fbnHhQAAAAJ,"Profesora Asociada, Facultad de Ciencias Sociales Universidad de Chile",uchile,@uchile.cl,191,"prácticas y relaciones económicas, procesos de endeudamiento, financiarización de la vida cotidiana y desigualdad socioeconómica."
9232372474901008384,xl3lvzcAAAAJ,"Instituto de Ecología y Biodiversidad, Facultad de Ciencias, Universidad de Chile",uchile,@ug.uchile.cl,191,"Geographical Ecology, Population Ecology, Invasion Ecology, Disease Ecology, Biodiversity"
9232372474901008384,9hrniuoAAAAJ,"Magíster en Ciencias Sociales, mención Sociología de la Modernización, Universidad de Chile",uchile,@uchile.cl,196,"Estudios laborales y organizacionales, regulación, políticas sociales"
9232372474901008384,OAEeTlYAAAAJ,"Faculty of Economics and Business, Universidad de Chile",uchile,@fen.uchile.cl,192,"Management Decision Making, Business Intelligence Use / Effectiveness / Development, Digital Marketing & CRM"
9232372474901008384,xFa_q7MAAAAJ,Universidad de Chile,uchile,@u.uchile.cl,187,
9232372474901008384,r49tU-8AAAAJ,"Traslational Psychiatry Laboratory, University of Chile",uchile,@uchile.cl,193,"Cognitive neuroscience, Clinical high risk states, Psychosis, Social cognition"
9232372474901008384,s-2CFoYAAAAJ,"Departamento de Trabajo Social, Universidad de Chile",uchile,@uchile.cl,195,"Trabajo Social, Pobreza, sistemas de protección social"
9232372474901008384,nfnihPsAAAAJ,Universidad de Chile,uchile,@ug.uchile.cl,189,"Políticas Públicas, Historia de la Psicología y Educación, Educación y Economía Popular"
9232372474901008384,KSPlrmoAAAAJ,Universidad de Chile,uchile,@ing.uchile.cl,183,"Mobile Robotics, Electronics"
9232372474901008384,fJbvIm4AAAAJ,Universidad de Chile,uchile,@uchile.cl,186,legislative politics parties politics
9232372474901008384,xX2qZgIAAAAJ,University of Chile,uchile,@ug.uchile.cl,204,"machine learning, astrophysics, deep leaarning"
9232372474901008384,GiuG9gQAAAAJ,University of Chile,uchile,@uchile.cl,182,"Ecology, Forest ecophysiology, Phenology, Climate Change, Sustainable forest operations"
9232372474901008384,862YBDwAAAAJ,University of Chile; Caltech; University of Cambridge,uchile,@uchile.cl,185,"behavior, learning, decision neuroscience, neuroeconomics"
9232372474901008384,rdgol-wAAAAJ,"M.Sc. in Computer Science, Department of Computer Science, University of Chile",uchile,@dcc.uchile.cl,179,"IT Solutions, Human Computer Interaction"
9232372474901008384,xICqzg4AAAAJ,"Doctoral student, Universidad de Chile",uchile,@ug.uchile.cl,182,"Paleoclimate, geomorphology, glaciology, geology"
9232372474901008384,t5OBn-kAAAAJ,Universidad de Chile,uchile,@bq.uchile.cl,182,Microbiology - Extremophiles - Biomining - Biocorrosion- Biochemestry
9232372474901008384,AsJYMyQAAAAJ,Universidad de Chile,uchile,@ing.uchile.cl,185,
9232372474901008384,_1RSXNsAAAAJ,"Universidad de Chile, Departamento de Lingüística",uchile,@uchile.cl,177,"Lingüística, sociolingüística, planificación lingüística, lingüística aplicada"
9232372474901008384,R3rrehoAAAAJ,University of Chile,uchile,@uchile.cl,185,"socio-ecological systems, land-water adaptation, knowledge co-production"
9232372474901008384,WH6C9v0AAAAJ,Médico Pediatra Infectólogo. Universidad de Chile,uchile,@uchile.cl,178,"Salud de inmigrantes, infecciones en pediatría"
9232372474901008384,R3R3lEMAAAAJ,"Advanced Mining Technology Center (AMTC), Universidad de Chile",uchile,@amtc.uchile.cl,174,"seismology, earthquakes, seismic tomography, subduction processes, Vp/Vs ratio"
9232372474901008384,3QQq1jkAAAAJ,"PhD Student, Universidad de Chile",uchile,@ing.uchile.cl,185,"Algorithmic Game Theory, Mechanism Design, Approximation Algorithms"
9232372474901008384,UhUQ2O8AAAAJ,Environmental Engineer. Master of Public Health. University of Chile. School of Public Health,uchile,@med.uchile.cl,176,"Public health, epidemiology, environmental health, occupational health, environmental exposure"
9232372474901008384,CHdUOaQAAAAJ,"Researcher, Speech Processing and Transmission, Universidad de Chile",uchile,@u.uchile.cl,178,"Speech Processing, Deep Learning"
9232372474901008384,SfpysSYAAAAJ,"INTA, Universidad de Chile",uchile,@inta.uchile.cl,175,
9232372474901008384,VbE3-M8AAAAJ,Universidad de Chile,uchile,@dcc.uchile.cl,174,Algorithms
9232372474901008384,YE2czi8AAAAJ,"Departamento de Física, Facultad de Ciencias, Universidad de Chile",uchile,@uchile.cl,181,"microswimmers, active matter, hydrodynamic interactions"
9232372474901008384,OHYw-HgAAAAJ,"profesor de Derecho penal, Universidad de Chile",uchile,@derecho.uchile.cl,175,"Derecho penal, filosofía"
9232372474901008384,j-XKifMAAAAJ,"Assistant Professor, Universidad de Chile",uchile,@uchile.cl,176,"Clinical Psychology, Lacaniana Psychoanalysis"
9232372474901008384,4ey4H4sAAAAJ,"Centro de Informática Médica y Telemedicina, Facultad de Medicina, Universidad de Chile",uchile,@ug.uchile.cl,177,"Procesamiento del Lenguaje Natural, Epidemiología, Enfermedades Crónicas, Cáncer, Genética"
9232372474901008384,oTrZxa0AAAAJ,"Profesora Asistente, Facultad de Derecho, Universidad de Chile",uchile,@derecho.uchile.cl,173,"legal history of Chile, legal profession, access to justice, middle class, human rights"
9232372474901008384,ap9839UAAAAJ,Universidad de Chile,uchile,@ug.uchile.cl,179,"memoria, arqueología, historia contemporánea"
9232372474901008384,hL67HScAAAAJ,Universidad de Chile,uchile,@ug.uchile.cl,174,"Salud Pública, Economía de la salud"
9232372474901008384,4pxrXUwAAAAJ,Universidad de Chile,uchile,@bq.uchile.cl,177,"Biomaterials, nanomaterials"
9232372474901008384,hRPJ-ZIAAAAJ,Assistant Professor at University of Chile,uchile,@dcc.uchile.cl,170,Programming Languages
9232372474901008384,KUCoMkcAAAAJ,University of Chile,uchile,@dcc.uchile.cl,185,"semantic web, linked data, knowledge graphs"
9232372474901008384,FoTKJ2sAAAAJ,Universidad de Chile,uchile,@ing.uchile.cl,170,"Operations Research, Optimization Theory"
9232372474901008384,z-DwysAAAAAJ,"Post doctoral research, Hospital clínico Universidad de Chile",uchile,@uchile.cl,173,"Immunology, Cellular and molecular biology, Gut mucosa, Liver diseases, ALD"
9232372474901008384,VGc17ZYAAAAJ,"Institute of Argumentation, Faculty of Law, University of Chile",uchile,@derecho.uchile.cl,177,
9232372474901008384,LLDd29sAAAAJ,Universidad de Chile,uchile,@ug.uchile.cl,167,Skeletal muscle
9232372474901008384,FAyLX1cAAAAJ,Universidad de Chile,uchile,@ug.uchile.cl,192,"Artificial Intelligence, Wildfire Management, Operation Research, Ecology"
9232372474901008384,uXdvqYsAAAAJ,Universidad de Chile,uchile,@odontologia.uchile.cl,170,Oral and Maxillofacial Surgery
9232372474901008384,Mxnz9t4AAAAJ,"Investigador, Centro de Regulacion y Competencia (RegCom), Universidad de Chile",uchile,@derecho.uchile.cl,167,"Derecho Ambiental, Regulacion, Environmental Law, Water Law, Regulation"
9232372474901008384,0ksIKQkAAAAJ,Facultad de Derecho Universidad de Chile,uchile,@derecho.uchile.cl,164,"Filosofía Moral y Política, Liberalismo, Igualitarismo"
9232372474901008384,Rm7ODwkAAAAJ,Universidad de Chile,uchile,@uchile.cl,162,Salud sexual y reproductiva
9232372474901008384,zkaaoXsAAAAJ,Universidad de Chile,uchile,@derecho.uchile.cl,162,"Human rights, legal philosophy, constitutionalism, cosmopolitanism"
9232372474901008384,w_i16zoAAAAJ,Universidad de Chile,uchile,@uchile.cl,176,"Fluid Mechanics, Dynamical Systems, Machine Learning"
9232372474901008384,OUCV1hoAAAAJ,"Electrical Engineering Department, Universidad de Chile",uchile,@ing.uchile.cl,158,
9232372474901008384,0Mju1rcAAAAJ,Universidad de Chile,uchile,@dcc.uchile.cl,158,
9232372474901008384,dE0rAKUAAAAJ,Universidad de Chile,uchile,@ug.uchile.cl,182,"Materials science, Microstructural characterization, Mechanical and tribology properties"
9232372474901008384,BGGvRF4AAAAJ,"Profesor asociado, Departamento de Música, Universidad de Chile",uchile,@uchile.cl,158,"Etnomusicología, ecomusicología, estudios de música popular"
9232372474901008384,keBLZm8AAAAJ,Universidad de Chile,uchile,@uchile.cl,162,"Neuromorphic Computing, Condensed Matter Physics, Nanomagnetism, Complex Networks"
9232372474901008384,dlu6tHAAAAAJ,Universidad de Chile,uchile,@ing.uchile.cl,160,"Data mining, Machine learning, healthcare management"
9232372474901008384,FN2rymMAAAAJ,"Profesor Asistente, Facultad de Odontología Universidad de Chile",uchile,@odontologia.uchile.cl,155,"Antropología médica, salud pública"
9232372474901008384,QuBWy5EAAAAJ,"Departamento de Física, Facultad de Ciencias, Universidad de Chile",uchile,@uchile.cl,159,"Sistemas complejos, Física del estado Sólido"
9232372474901008384,0Fu4x2MAAAAJ,Universidad de Chile | Instituto de Salud Pública de Chile,uchile,@ug.uchile.cl,156,"public health, spatial epidemiology, climate change, species distribution modeling"
9232372474901008384,4eDE0DsAAAAJ,"Sociólogo, Mg. Sociología, Universidad de Chile",uchile,@fen.uchile.cl,160,"sociología, género, políticas públicas, LGBT+, diversidad sexual"
9232372474901008384,z75HX7AAAAAJ,Universidad de Chile - Technische Universität Berlin,uchile,@ing.uchile.cl,155,"Power system planning, Power system optimization, Demand Response, Stochastic Optimization, Decomposition Methods"
9232372474901008384,25gSFH8AAAAJ,Universidad de Chile,uchile,@uchile.cl,166,Structural Biology
9232372474901008384,UbBAn7oAAAAJ,"Facultad de Economía y Negocios, Universidad de Chile",uchile,@fen.uchile.cl,156,
9232372474901008384,0zsqC0sAAAAJ,Universidad de Chile,uchile,@ug.uchile.cl,151,
9232372474901008384,_5vW_A8AAAAJ,Universidad de Chile,uchile,@amtc.uchile.cl,164,
9232372474901008384,zPEZL74AAAAJ,"Department of Economics, University of Chile",uchile,@fen.uchile.cl,159,"Environmental Economics, Energy Economics, Extractive Industries, Applied Micro"
9232372474901008384,6e6ab_QAAAAJ,"Ph.D., Research Engineer, Speech Processing and Transmission Laboratory, University of Chile",uchile,@ug.uchile.cl,156,"Robust Speech Recognition, Deep Learning, Pattern Recognition"
9232372474901008384,MsFkGkYAAAAJ,"Departamento de Enfermería, Universidad de Chile",uchile,@uchile.cl,157,"Enfermería, Salud Ocupacional, Cuidados Paliativos, Epidemiología, Calidad de Vida"
9232372474901008384,g-yIdlAAAAAJ,Universidad de Chile,uchile,@dcc.uchile.cl,161,Machine Learning
9232372474901008384,UycoT0YAAAAJ,"Biomedical sciences PhD, Universidad de Chile",uchile,@ug.uchile.cl,153,"Biomedical sciences, Neurobiologie, Physiollogy, Genetics, Drosophila"
9232372474901008384,lKa52N8AAAAJ,Universidad de Chile,uchile,@ug.uchile.cl,152,"Food safety, Nutrition, Functional foods"
9232372474901008384,4VqWDLgAAAAJ,"Profesor titular, Facultad de Derecho, Universidad de Chile",uchile,@derecho.uchile.cl,153,"Política comparada, regímenes autoritarios y democratizaciones"
9232372474901008384,fsDBec0AAAAJ,"Professor of Economics, Universidad de Chile",uchile,@uchile.cl,161,Economics
9232372474901008384,AUiNgVcAAAAJ,Universidad de Chile,uchile,@uchilefau.cl,150,"Arquitectura, Urbanismo, Ciencias Sociales"
9232372474901008384,Wu6sqA8AAAAJ,"Professor of Law, Universidad de Chile",uchile,@derecho.uchile.cl,145,"Criminal Law, Political Philosophy, Legal Theory"
9232372474901008384,Nol8sjgAAAAJ,Universidad de Chile,uchile,@uchile.cl,148,"Estudios griegos, Estudios bizantinos, Estudios neohelénicos"
9232372474901008384,njCCkM4AAAAJ,Universidad de Chile,uchile,@UG.uchile.cl,145,"Operations Research, Engineering Asset Management, Maintenance and Reliability, Data Science, Business Intelligence"
9232372474901008384,45712_IAAAAJ,Universidad de Chile,uchile,@u.uchile.cl,148,"Centroamérica, Literatura Latinoamericana, Caribe, Modernismo, Vanguardia"
9232372474901008384,83ihU2IAAAAJ,"Universidad de Chile, Facultad de Ciencias Agronómicas",uchile,@uchile.cl,155,"agroecology, conservation biology, landscape planning"
9232372474901008384,FCgESIIAAAAJ,"Universidad de Chile, Facultad de Economía y Negocios",uchile,@fen.uchile.cl,149,
9232372474901008384,tijWyGkAAAAJ,"Universidad de Chile, Facultad de Ciencias, Depto. Matemáticas",uchile,@uchile.cl,147,Dynamical Systems
9232372474901008384,5IRZuhIAAAAJ,Departamento  de Diseño Universidad de Chile,uchile,@uchilefau.cl,143,"color, perception. color difference formulae, textiles, dyeing and finishing"
9232372474901008384,1gwPAeMAAAAJ,"Departamento de Ciencias de la Computación, Universidad de Chile",uchile,@dcc.uchile.cl,152,
