id_institucion_gs,id_autor_gs,autor,cargo,id_institucion,email,citaciones,intereses
14018219609791295521,QIHKy1UAAAAJ,Fabio A. Labra R.,"Professor, Facultad de Ciencias, Universidad Santo Tomás, Santiago, Chile",santotomas,santotomas.cl,1266,Macroecology Complexity Theory Conservation Biology Ecophysiology Climate Change 
14018219609791295521,iITBNAcAAAAJ,Vilma Quitral,Académico de Universidad Santo Tomás,santotomas,santotomas.cl,1216,Alimentos Análisis sensorial Algas 
14018219609791295521,ewkobLAAAAAJ,Hugo Ochoa-Acuña,Universidad Santo Tomás,santotomas,santotomas.cl,1207,
14018219609791295521,LEEYFekAAAAJ,César Marín,"Full Professor, Facultad de Ciencias, Universidad Santo Tomás, Chile",santotomas,santotomas.cl,1149,Ecology Soil Ecology Mycorrhizas Evolution Biogeochemistry 
14018219609791295521,pAqfjfsAAAAJ,Miguel Castro Retamal,Universidad Santo Tomás,santotomas,santotomas.cl,1031,
14018219609791295521,KRpmq6EAAAAJ,Juan Jose Negroni Vera,Universidad Santo Tomás,santotomas,santotomas.cl,986,Power electronics Control Electrónica 
14018219609791295521,hrJ2XYsAAAAJ,Alejandro Reyes-Reyes,"Profesor de Psicología, Universidad Santo Tomás, Concepción, Chile.",santotomas,santotomas.cl,897,Empatía Psicometría Metodología de la investigación 
14018219609791295521,sZNkVQ4AAAAJ,exequiel r. gonzalez,"universidad santo tomas, chile",santotomas,santotomas.cl,852,amphipoda taxonomy 
14018219609791295521,X4JpgYwAAAAJ,Guillermo Mendez-Rebolledo,Universidad Santo Tomás,santotomas,santotomas.cl,814,Muscle Strength Motor Control Physiotherapy Sport Science. 
14018219609791295521,wOnfkSYAAAAJ,Héctor J Pavés,"Departamento de Ciencias Básica, Universidad Santo Tomas",santotomas,santotomas.cl,773,Conservation Biology in Marine Top Predator … 
14018219609791295521,Zb2h_xAAAAAJ,Paula Díaz,"Faculty of Health, Universidad Santo Tomás",santotomas,santotomas.cl,766,
14018219609791295521,v_zvgWgAAAAJ,Rodrigo A. Moreno,"Full Professor, Universidad Santo Tomás",santotomas,santotomas.cl,755,Biodiversity Biogeography Ecology Evolution 
14018219609791295521,lNlzaIsAAAAJ,Yeny Concha- Cisternas,Universidad Santo Tomás,santotomas,santotomas.cl,671,Rehabilitación Envejecimiento Actividad Física Salud 
14018219609791295521,gj4M9X8AAAAJ,Pamela Caro,Universidad Santo Tomás,santotomas,santotomas.cl,647,género familia y trabajo 
14018219609791295521,2B6_y20AAAAJ,Victor Eduardo Cancino Cancino,"Universidad Santo Tomás (UST), Chile",santotomas,santotomas.cl,595,Politica educativa gestión educativa planificación estratégica gestión universitaria gestión de calidad 
14018219609791295521,rTOdPc0AAAAJ,Javier Torres-Vallejos,Universidad Santo Tomas,santotomas,santotomas.cl,532,Deserción escolar Convivencia escolar Violencia escolar Bienestar 
14018219609791295521,v1S3-soAAAAJ,Annia Rodríguez-San Pedro (https://orcid.org/0000-0002-2615-7669),"Associate Professor, Facultad de Ciencias, Universidad Santo Tomás",santotomas,santotomas.cl,513,Ecology Conservation biology Bioacoustics Bats 
14018219609791295521,rRpnAgkAAAAJ,Eduardo Ravanal Moreno,Universidad Santo Tomás,santotomas,santotomas.cl,474,… y Desarrollo Profesional del Profesor de … 
14018219609791295521,bVWIFcEAAAAJ,Francisco Cuevas,"Profesor Asociado Universidad Santo Tomás, Viña del Mar",santotomas,santotomas.cl,397,biophisics biochemistry 
14018219609791295521,jlpbJJYAAAAJ,Luis Cottet Bustamante,Universidad Santo Tomas,santotomas,santotomas.cl,369,Microbiología 
14018219609791295521,liMAoV0AAAAJ,Tamara Bruna Larenas,"Centro de Investigación Austral Biotech, Facultad de Ciencias, Universidad Santo Tomás …",santotomas,santotomas.cl,329,Nanotecnologia 
14018219609791295521,kxPA_igAAAAJ,Victor Felipe Castillo Riquelme,Universidad Santo Tomás,santotomas,santotomas.cl,265,Educación Superior Estadística TICs 
14018219609791295521,EgT_3ckAAAAJ,Alexis Espinoza-Salinas,Laboratorio de Fisiología del Ejercicio - Escuela de Kinesiología -Universidad Santo Tomás,santotomas,santotomas.cl,262,Fisiología clínica del ejercicio 
14018219609791295521,ai3xkzMAAAAJ,Daniela Haro,"Centro Bahía Lomas, Universidad Santo Tomas",santotomas,santotomas.cl,252,Marine mammals Trophic ecology 
14018219609791295521,BiejoiYAAAAJ,Andrés Moltedo,"Docente de Psicología, Universidad Santo Tomás",santotomas,santotomas.cl,249,Psicología 
14018219609791295521,sX0h9rEAAAAJ,Carolina Silva Parejas,Universidad Santo Tomás,santotomas,santotomas.cl,249,Volcanología peligros volcánicos petrología ígnea 
14018219609791295521,MtnRhqUAAAAJ,Marcelo Bobadilla,universidad santo Tomás,santotomas,santotomas.cl,238,
14018219609791295521,qhvtS1IAAAAJ,Liliana Manzano Chávez,"Investigadora Postdoctoral, Centro Cielo, Universidad Santo Tomás",santotomas,santotomas.cl,236,cárceles punitivismo violencia criminalidad exclusión social 
14018219609791295521,3x3B4fAAAAAJ,Felipe Tello-Navarro,Universidad Santo Tomás,santotomas,santotomas.cl,202,Sociología relaciones sexo-afectivas interacciones digitales juventud 
14018219609791295521,m9Sy2F0AAAAJ,Alvaro Opazo,"Associate Professor, PhD, Universidad Santo Tomas",santotomas,santotomas.cl,202,biomedicine veterinary parasitology 
14018219609791295521,W3ROKzMAAAAJ,Hugo Segura,Universidad Santo Tomás,santotomas,santotomas.cl,183,desarrollo del lenguaje discurso narrativo trastornos del espectro autista 
14018219609791295521,-2Ks5O0AAAAJ,Jaime Aedo-Saravia,"Psychologist. Associate Professor, Universidad Santo Tomás, Chile",santotomas,santotomas.cl,179,Psychometrics Psychological Trauma PTSD Higher education 
14018219609791295521,rl6UuJYAAAAJ,José Díaz Nieva,"Profesor de Derecho Político, Universidad Santo Tomas (Chile)",santotomas,santotomas.cl,172,derecho historia politica 
14018219609791295521,JCMwnNcAAAAJ,Manuel Roberto Garcia-Huidobro Moreno,Universidad Santo Tomás,santotomas,santotomas.cl,166,host-parasite relationship and biological … Conservation medicine intertidal ecology 
14018219609791295521,kz5VqIQAAAAJ,Daniela Oyarce Cádiz,Universidad Santo Tomás,santotomas,santotomas.cl,166,Psicología infantil y  parentalidad 
14018219609791295521,ttwY0R0AAAAJ,Andres Villegas R.,Profesor Universidad Santo Tomás,santotomas,santotomas.cl,165,Microeconomía Econometría Eficiencia Técnica Modelos Dinámicos. 
14018219609791295521,dBfb_BEAAAAJ,Miguel Angel Ramos-Henderson,"Centro de Investigación e Innovación en Gerontología Aplicada CIGAP, Universidad Santo …",santotomas,santotomas.cl,163,Neuropsicología Gerontología Demencia Deterioro Cognitivo 
14018219609791295521,kF7MJKAAAAAJ,Genevieve Merabachvili,"Profesor Bioquimica y Biologia Molecular, Universidad Santo Tomas",santotomas,santotomas.cl,134,Microbiologia Biologia Molecular salud 
14018219609791295521,-OBRzbUAAAAJ,Joaquín Araya-Arriagada,"Profesor Asistente, Universidad Santo Tomás",santotomas,santotomas.cl,110,Physiology of visual system Alzheimer's disease Complexity analysis 
14018219609791295521,W3dQzqUAAAAJ,Alvaro Reyes Duarte,Universidad Santo Tomas,santotomas,santotomas.cl,108,Rural financial market technology trasfer develoment economics 
14018219609791295521,XowH8MMAAAAJ,Verónica Rubio Aguilar,"Facultad de Ciencias Sociales y Comunicaciones, Universidad Santo Tomás",santotomas,santotomas.cl,106,Diversidades sexo genéricas … 
14018219609791295521,-KychSwAAAAJ,Enrique Díaz Bravo,Universidad Santo Tomás; Universidad de Sevilla; UNIR,santotomas,santotomas.cl,101,derecho administrativo contratación pública public procurement contratti pubblici public law 
14018219609791295521,S2UarykAAAAJ,Paulina Pacha,UNIVERSIDAD SANTO TOMAS,santotomas,SANTOTOMAS.CL,95,MICROBIOLOGÍA VETERINARIA 
14018219609791295521,FcRHcdoAAAAJ,Nelson Hun Gamboa,"Escuela de Nutrición y Dietética, Universidad Santo Tomás, Chile.",santotomas,santotomas.cl,86,Comportamiento alimentario Psicología de la salud Inmigración. 
14018219609791295521,SJuVbHoAAAAJ,Diana Marcela Gomez Gallo,Universidad Santo Tomás,santotomas,santotomas.cl,80,Desarrollo infantil parentalidad psicoterapia 
14018219609791295521,erGthQEAAAAJ,Felipe Nesbet,Universidad Santo Tomás,santotomas,santotomas.cl,74,Estudios Latinoaméricanos nuevas tecnologias militarismo 
14018219609791295521,3DD0HlsAAAAJ,Franco Cruz-Jofré,Universidad Santo Tomás,santotomas,santotomas.cl,70,Evolución 
14018219609791295521,f5qWgn8AAAAJ,Juan Carlos Armijos,"Profesor Asistente, Escuela de Auditoría y Control de Gestión, Universidad Santo Tomás",santotomas,santotomas.cl,64,Gestión de la Calidad Gestión Hospitalaria Calidad de la Educación Superior Planificación Estratégica 
14018219609791295521,aN8IbCMAAAAJ,Jesus Juyumaya,"Research Professor, Faculty of Economics and Business, Universidad Santo Tomás",santotomas,santotomas.cl,61,Organizational behavior Neuroscience Engagement Digital transformation Human–robot interaction 
14018219609791295521,_YLcFIEAAAAJ,Dr. Marcial Sánchez Gaete,Universidad Santo Tomas,santotomas,santotomas.cl,56,Historia 
14018219609791295521,Cr-4uosAAAAJ,Consuelo Cruz Riveros,Universidad Santo Tomás; Universidad Católica del Norte,santotomas,santotomas.cl,56,psicología social cuidado humanizado Relaciones interpersonales en contextos de … 
14018219609791295521,mACalrMAAAAJ,Byron Droguett,UNIVERSIDAD SANTO TOMAS,santotomas,santotomas.cl,55,General Relativity Quantum field theory 
14018219609791295521,bVido7MAAAAJ,Sergio Sazo Rodríguez,"Kinesiólogo, Universidad Santo Tomás",santotomas,santotomas.cl,54,Actividad Física y Salud 
14018219609791295521,bd5CqeUAAAAJ,Ignacio Serrano del Pozo,"Universidad Santo Tomás, Doctor en Filosofía",santotomas,santotomas.cl,47,Tomás de Aquino tomismos contemporáneos secularización racionalización 
14018219609791295521,dDxsl4YAAAAJ,Gonzalo Chávez Contreras,Universidad Santo Tomás - Universidad Andrés Bello,santotomas,santotomas.cl,46,Medicina Veterinaria Comportamiento animal Vínculo Humano Animal Etología Clínica 
14018219609791295521,XuON7ZMAAAAJ,Mario Torres Echeverría,Escuela de Kinesiología - Universidad Santo Tomás,santotomas,santotomas.cl,46,Salud 
14018219609791295521,6-QYlMMAAAAJ,María Soledad Fernández Murillo,Universidad Santo Tomás,santotomas,santotomas.cl,45,Ciencias Sociales Museos Arqueología Feminismos 
14018219609791295521,OvfJf0YAAAAJ,Leonardo Rodriguez-Cordova,"Escuela de Ingeniería Civil Industrial, Universidad Santo Tomás",santotomas,santotomas.cl,44,medio ambiente sustentabilidad procesos complejos en ingeniería 
14018219609791295521,ajL_dRYAAAAJ,Giovanny Arenas Sánchez,"Laboratorio de Fisiología del Ejercicio, Escuela de Kinesiología, Universidad Santo Tomás …",santotomas,santotomas.cl,38,
14018219609791295521,FTiJIakAAAAJ,Roberto Álvarez San Martín,Universidad Santo Tomás,santotomas,santotomas.cl,38,Antropología Interculturalidad 
14018219609791295521,8-YaNKkAAAAJ,Angélica Silva-Ríos,Universidad Santo Tomás,santotomas,santotomas.cl,33,Salud Pública - Fonoaudiología - Innovación … 
14018219609791295521,iWpl8twAAAAJ,Vivian Neumann,Universidad Santo Tomás,santotomas,santotomas.cl,32,
14018219609791295521,y96eicoAAAAJ,Esther Gómez de Pedro,"Directora nacional de Formación e Identidad, Profesora Asociada, Filosofía, Universidad …",santotomas,santotomas.cl,32,antropología ética formación integral virtudes 
14018219609791295521,6wUDd3gAAAAJ,Elia Sepúlveda,Académica e Investigadora  Universidad Autónoma de Barcelona  - Universidad Santo …,santotomas,santotomas.cl,30,Cambio ambiental global pedagogía social trabajo social desastres naturales 
14018219609791295521,IH7S-soAAAAJ,Sebastián Rivera R,"Escuela de Fonoaudiología, Universidad Santo Tomás",santotomas,santotomas.cl,25,Audiología otoneurología 
14018219609791295521,zmFS7b8AAAAJ,Patricio Andrés Pino Castillo,"Universidad Santo Tomás, Chile",santotomas,santotomas.cl,22,psycholinguistics metacognition literacy teacher education phonetics 
14018219609791295521,ilgDOCoAAAAJ,Esteban Saavedra Vallejos,Universidad Santo Tomás,santotomas,santotomas.cl,21,Educación - formación docente - gamificación … 
14018219609791295521,S31l9G0AAAAJ,Yerko Muñoz-Salinas,Universidad Santo Tomás,santotomas,santotomas.cl,20,teacher emotion practicum teacher identity 
14018219609791295521,7Bu45vkAAAAJ,Fabiola Moreno,Universidad Santo Tomás,santotomas,alumnos.santo,18,
14018219609791295521,GYSTl7kAAAAJ,Nicolás Vidal-Seguel,"Escuela de Enfermería, Universidad Santo Tomás, Chile.",santotomas,santotomas.cl,18,Human anatomy Skeletal muscle physiology immune responses 
14018219609791295521,QfseitcAAAAJ,María de los Angeles Oyarzún-Farías,"Académica Trabajo Social, Facultad de Ciencias Sociales y Comunicaciones, Universidad …",santotomas,santotomas.cl,18,Paternidad Parentalidad Bienestar 
14018219609791295521,CdPE7FsAAAAJ,Marco Braghetto,"Profesor de Ciencias Sociales y Humanidades, Universidad Santo Tomás",santotomas,santotomas.cl,17,Ciencias Sociales Humanidades 
14018219609791295521,H3S8NIUAAAAJ,LUIS CHANCI,"Universidad Santo Tomás, Santiago de Chile",santotomas,santotomas.cl,16,Productivity + Econometrics Macroeconomics + Labor 
14018219609791295521,6bdxPdsAAAAJ,Pedro Mayorga Cordero,Universidad Santo Tomás,santotomas,santotomas.cl,13,Filosofía - Educación - Formación Ciudadana 
14018219609791295521,zXwrXmAAAAAJ,Rodrigo Barraza Alonso,Universidad Santo Tomás,santotomas,santotomas.cl,13,Circular Economy Sustainability Operations Management 
14018219609791295521,VKo_Hw8AAAAJ,Francisco Araya Carrasco,Universidad Santo Tomás,santotomas,santotomas.cl,7,Psicología Educacional y Comunitaria 
14018219609791295521,Ad7TwLoAAAAJ,Héctor Rivera Vergara,"Docente Universidad Santo Tomás. Sede Santiago, Chile",santotomas,santotomas.cl,6,Estratificación Social: Movilidad Social 
14018219609791295521,d9nQs6kAAAAJ,Manuel Salinas,"Psicólogo. Escuela de Psicología, Facultad de Ciencias Sociales y Comunicaciones …",santotomas,alumnos.santo,5,psychologist 
14018219609791295521,ovZumtMAAAAJ,Miguel Rodríguez-Altamirano,"Académico Adjunto, Universidad Santo Tomás",santotomas,santotomas.cl,5,Educación Trabajo Social 
14018219609791295521,s3ZqoF0AAAAJ,Francino Barrera G,"Académico de Kinesiología, Universidad Santo Tomás",santotomas,santotomas.cl,4,Medicina Deportiva Rehabilitación Física Fisiología del Deporte Biomecánica Clínica y del Deporte 
14018219609791295521,1-WTyiQAAAAJ,Cedric Steinlen Cuevas,"Docente, Universidad Santo Tomás",santotomas,santotomas.cl,4,Historia Filosofía Estudios Internacionales 
14018219609791295521,HEJYwUwAAAAJ,Ruth Paz,"Profesora adjunta curso de Estadística para ciencias de la salud, Universidad Santo Tomás",santotomas,santotomas.cl,3,Desarrollo de productos saludables investigación de mercados agroalimentarios 
14018219609791295521,M_WGx8UAAAAJ,Miguel Alarcón Rivera,"Licenciado en Ciencias del deporte y Actividad Física, Universidad Santo Tomás",santotomas,santotomas.cl,3,resistance training Strength and conditioning muscle hypertrophy 
14018219609791295521,UvP6MEgAAAAJ,Jean Paul Rannau,Universidad Santo Tomás,santotomas,santotomas.cl,1,Educación 
14018219609791295521,O5QAJckAAAAJ,Katherine Mora Pino,"Docente Fonoaudiología, Universidad Santo Tomas",santotomas,santotomas.cl,,
14018219609791295521,sYv3IEEAAAAJ,Hector Gerardo Herrera Latorre,Profesor Facultad de Salud Universidad SANTO TOMAS,santotomas,santotomas.cl,,salud publica epidemiologia administracion y gestion en salud 
14018219609791295521,B7ql-DIAAAAJ,Luis Alberto Urzua Alul,Universidad Santo Tomas,santotomas,santotomas.cl,,Administración educativa fisiología del ejercicio prescripción del ejercicio en adultos y adultos … rehabilitación deportiva 
14018219609791295521,vnKKBFUAAAAJ,Ricardo Ulloa-Jimenez,"Escuela de kinesiología, Universidad Santo Tomás, Santiago, Chile",santotomas,santotomas.cl,,Biomecánica Control Motor Ciencias del deporte 
14018219609791295521,CJV9_WwAAAAJ,Marcelo Zúñiga Herrera,Universidad Santo Tomás,santotomas,santotomas.cl,,Educación Educación Física Formación docente 
14018219609791295521,_VAz4BoAAAAJ,Patricia Aravena Perez,Enfermera docente Universidad Santo Tomas,santotomas,santotomas.cl,,genero 
14018219609791295521,L2ScivwAAAAJ,Alan Faune,"Tecnico agricola, Universidad Santo Tomas",santotomas,alumnos.santo,,agricultura 
14018219609791295521,hBd-94YAAAAJ,Loreto Miroslava Valenzuela Torres,"Profesora Derecho Administrativo, Universidad Santo Tomás",santotomas,santotomas.cl,,Derecho Administrativo Derecho Ambiental Gestión de riesgos Obras y Empresas Públicas. 
14018219609791295521,sjJ0m9oAAAAJ,Eloy Oliva-Vásquez,Universidad Santo Tomás,santotomas,santotomas.cl,,
