id_institucion_gs,id_autor_gs,autor,cargo,id_institucion,email,citaciones,intereses
10448777709790852446,s112cUYAAAAJ,Daniel Brieba,"School of Government, Universidad Adolfo Ibáñez",uadolfoi,uai.cl,138,Political Science 
10448777709790852446,pKQJTvUAAAAJ,Thomas Clément Mercier,Universidad Adolfo Ibáñez,uadolfoi,edu.ua,137,deconstruction international studies decolonial thought queer theory Marxism and materialism 
10448777709790852446,LaExd9MAAAAJ,Esteban Pereira Fredes,"Profesor de Teoría del Derecho y Derecho Privado, Universidad Adolfo Ibáñez",uadolfoi,uai.cl,135,Teoría del derecho filosofía del derecho privado derecho privado 
10448777709790852446,vtxmrfsAAAAJ,Jaime F. Lavin,"Associate Professor of Finance, Universidad Adolfo Ibañez",uadolfoi,uai.cl,134,Behavioral Finance Consumer Financial Behavior Financial Networks 
10448777709790852446,90oOWM4AAAAJ,Rachel Herdy,"Profesora Asociada, Universidad Adolfo Ibáñez",uadolfoi,uai.cl,130,Filosofia do Direito Epistemologia Jurídica Argumentação Jurídica 
10448777709790852446,jpHae6AAAAAJ,Diego Moran,Assistant Professor in the School of Business at Universidad Adolfo Ibañez,uadolfoi,uai.cl,128,Operations Research Optimization Mixed-integer Programming 
10448777709790852446,-CZLlJAAAAAJ,Diego Rossello,Associate Professor-Universidad Adolfo Ibáñez,uadolfoi,uai.cl,127,political philosophy - critical animal studies … 
10448777709790852446,QCKisAoAAAAJ,Nieves Valdés,Universidad Adolfo Ibáñez,uadolfoi,uai.cl,125,Applied Microeconometrics Health Economics Labor Economics Economics of Education 
10448777709790852446,szJ2XywAAAAJ,Pablo Castañeda,Universidad Adolfo Ibanez,uadolfoi,uai.cl,123,finance 
10448777709790852446,mkr0tB0AAAAJ,Francisco V. Ramirez-Cuevas,"Assistant Professor, Universidad Adolfo Ibáñez",uadolfoi,uai.cl,121,Nanophotonics Thermal Radiation Solar Energy Conversion 
10448777709790852446,8L8S57cAAAAJ,Cristóbal Bellolio B.,"Profesor Asociado, Escuela de Gobierno Universidad Adolfo Ibáñez",uadolfoi,uai.cl,119,Political Theory 
10448777709790852446,PBdqH0MAAAAJ,Max Colodro,"Doctor en Filosofía, Universidad Adolfo Ibáñez",uadolfoi,uai.cl,117,filosofía ciencia política comunicación política 
10448777709790852446,ZWAPzecAAAAJ,Carla Bustamante,Universidad Adolfo Ibáñez,uadolfoi,uai.cl,114,strategy entrepreneurship international startups accelerators venture capital 
10448777709790852446,Uqkv2roAAAAJ,Florencia Borrescio-Higa,"Associate Professor, Business School, Universidad Adolfo Ibañez",uadolfoi,uai.cl,111,Health Economics Development Applied Microeconomics 
10448777709790852446,CwYC-P4AAAAJ,Nathalie Casanova-Morales,Universidad Adolfo Ibañez,uadolfoi,uai.cl,110,Física biofísica microfluídica nanotecnología 
10448777709790852446,6XZ9G68AAAAJ,Harry Oviedo,Universidad Adolfo Ibáñez,uadolfoi,uai.cl,110,Numerical Optimization Numerical Analysis 
10448777709790852446,yOFH2dMAAAAJ,Alberto Pino Emhart,"Profesor Asociado, Universidad Adolfo Ibáñez",uadolfoi,uai.cl,109,Derecho civil Teoría del derecho Responsabilidad extracontractual 
10448777709790852446,ZL4uEsQAAAAJ,Verónica Ramírez Errázuriz,Universidad Adolfo Ibáñez,uadolfoi,uai.cl,107,Historia de la ciencia literatura y ciencia mujeres y ciencia prensa y ciencia 
10448777709790852446,pQuMmXYAAAAJ,Pablo I Escribano,Universidad Adolfo Ibáñez,uadolfoi,uai.cl,103,work-family discretionary behavior relationships at work socialization of newcomers 
10448777709790852446,NMAPo30AAAAJ,jorge niño,profesor de contabilidad Universidad Adolfo Ibáñez,uadolfoi,uai.cl,101,contabilidad finanzas control de gestión 
10448777709790852446,WjvdhEMAAAAJ,Cedric Little,"Professor, Faculty of Engineering and Sciences, Universidad Adolfo Ibáñez",uadolfoi,uai.cl,101,biological engineering sustainability biomaterials bioremediation numeric simulation 
10448777709790852446,MuAn7LkAAAAJ,Vicente Medel,"BrainLat, Universidad Adolfo Ibáñez",uadolfoi,uai.cl,100,Computational Neuroscience Cognitive Neuroscience Attention Consciousness 
10448777709790852446,XXMX8CIAAAAJ,Gonzalo Serrano del Pozo,"Director de Postgrado, Facultad de Artes Liberales, Universidad Adolfo Ibáñez",uadolfoi,uai.cl,99,Historia de Chile Historia del fútbol Guerra de Chile contra la Confederación Santiago Wanderers 
10448777709790852446,Ecaht-AAAAAJ,Paola Corti,"Professor of History, Universidad Adolfo Ibañez",uadolfoi,uai.cl,97,Medieval History Devotion and Spirituality in Late Medieval … History and Images Medieval Art Colonial Art 
10448777709790852446,vyjD1P4AAAAJ,Susana Espada Mallorquín,Profesora de Derecho civil. Universidad Adolfo Ibáñez,uadolfoi,uai.cl,95,Derecho de familia Derecho sucesorio 
10448777709790852446,w9HQGoMAAAAJ,Veronica Undurraga,"Profesora de Derecho, Universidad Adolfo Ibáñez",uadolfoi,uai.cl,95,derecho constitucional derecho internacional de los derechos … género 
10448777709790852446,biXYHf8AAAAJ,nicolas alejandro trujillo osorio,"Lecturer, Universidad Alberto Hurtado / Lecturer, Universidad Adolfo Ibañez",uadolfoi,edu.ua,95,epistemology philosophy of science science policy organizational studies aesthetics 
10448777709790852446,k3OJMTgAAAAJ,Pilar Jano,Universidad Adolfo Ibáñez,uadolfoi,uai.cl,94,wine economics economics of contracting and organizations agribusiness 
10448777709790852446,xkzAIz0AAAAJ,Alejandra Abufhele,"Profesora Asistente, Escuela de Gobierno, Universidad Adolfo Ibáñez",uadolfoi,uai.cl,86,Social demography early childhood development poverty inequality 
10448777709790852446,wRusJS0AAAAJ,caterina guidi,"Profesora Derecho del Trabajo, Universidad Adolfo Ibáñez",uadolfoi,uai.cl,84,derecho del trabajo seguridad social 
10448777709790852446,pJn6H7UAAAAJ,Luis E. Santana,Universidad Adolfo Ibañez,uadolfoi,uai.cl,83,Communication technologies communication collective action digital communication 
10448777709790852446,hl2f0BkAAAAJ,Alejandra Montecinos,Universidad Adolfo Ibañez,uadolfoi,uai.cl,78,
10448777709790852446,elrvFjwAAAAJ,"Valentina Rozas-Krause, Ph.D.",Universidad Adolfo Ibáñez,uadolfoi,uai.cl,77,Architecture Urbanism Memory Heritage Monuments 
10448777709790852446,cLI_3bYAAAAJ,Mauricio Mittelman,Universidad Adolfo Ibáñez,uadolfoi,uai.cl,77,judgment and decision making consumer psychology marketing 
10448777709790852446,UdUbGjMAAAAJ,Javier Echenique,Universidad Adolfo Ibañez,uadolfoi,uai.cl,76,Philosophy 
10448777709790852446,T0yHon4AAAAJ,Osvaldo Lagos Villarreal,"Profesor Facultad de Derecho, Universidad Adolfo Ibáñez",uadolfoi,uai.cl,76,derecho de sociedades derecho de seguros gobiernos corporativos derecho del consumo 
10448777709790852446,alr-eKkAAAAJ,mauro senatore,Universidad Adolfo Ibáñez,uadolfoi,uai.cl,76,philosophy 
10448777709790852446,kOpIGEIAAAAJ,Lorenzo Reus,"Associate Professor, Universidad Adolfo Ibañez",uadolfoi,uai.cl,74,Financial Engineering Operations Research 
10448777709790852446,mbis5vsAAAAJ,Pedro Eduardo Moscoso-Flores,"Profesor asistente, Universidad Adolfo Ibáñez",uadolfoi,uai.cl,73,
10448777709790852446,VqZ7S2cAAAAJ,Alejandro Montecinos-Pearce,Universidad Adolfo Ibáñez,uadolfoi,uai.cl,72,Economic Theory Economics of Networks Empirical Network Analysis 
10448777709790852446,eCFFb14AAAAJ,María Paz Oliver,Universidad Adolfo Ibáñez,uadolfoi,uai.cl,72,Literatura 
10448777709790852446,BCSzqvUAAAAJ,Mayra Feddersen,Universidad Adolfo Ibañez,uadolfoi,uai.cl,70,immigration bureaucracies law 
10448777709790852446,A3a6WNIAAAAJ,Elvira López Taverne,Universidad Adolfo Ibáñez,uadolfoi,uai.cl,68,History Chilean History Economic History State Building 
10448777709790852446,bTmJp1kAAAAJ,Carlos Yushimito,Universidad Adolfo Ibáñez,uadolfoi,uai.cl,67,Literatura Latinoamericana Contemporánea 
10448777709790852446,CztAwuUAAAAJ,juan pablo cox leixelard,"académico Facultad de Derecho, Universidad Adolfo Ibáñez",uadolfoi,uai.cl,66,derecho penal historia del derecho teoría del derecho 
10448777709790852446,5hQbp5UAAAAJ,David Rex Galindo,"Assistant Professor, Universidad Adolfo Ibáñez",uadolfoi,uai.cl,62,Latin American History Borderlands History 
10448777709790852446,7Y9wlT0AAAAJ,Rodrigo Rivero-Cantillano,Universidad Adolfo Ibañez,uadolfoi,uai.cl,61,Historia Económica 
10448777709790852446,1MyqMS4AAAAJ,Guido Lagos,"Assistant Professor, Universidad Adolfo Ibáñez",uadolfoi,uai.cl,59,Applied Probability Stochastic Programming Operations Research 
10448777709790852446,s2ZJS7IAAAAJ,Gonzalo Iberti Bozo,"PhD. Finance Student, Adolfo Ibañez University",uadolfoi,edu.ua,59,Finanzas Economía Financiera Finanzas Internacionales. 
10448777709790852446,k_24DbEAAAAJ,Christian Anwandter,Universidad Adolfo Ibáñez,uadolfoi,uai.cl,58,cultura impresa poesía lectura 
10448777709790852446,ZJUvXxUAAAAJ,Pablo Paredes Navarro,Universidad Adolfo Ibáñez,uadolfoi,edu.ua,57,Institutional history Regional history Public Policy Technology Studies 
10448777709790852446,wxfUiiUAAAAJ,Carlos Correa Robles,Universidad Adolfo Ibañez,uadolfoi,uai.cl,56,Criminal procedure procedural law evidence 
10448777709790852446,WXDZlA8AAAAJ,Flor Toledo Sandoval,English Language Programme Director at Universidad Adolfo Ibáñez,uadolfoi,uai.cl,54,Second language instruction EFL materials development Teacher training English as a second language Young learners 
10448777709790852446,-jUmtdwAAAAJ,Felipe Lagos,"Faculty of Engineering and Sciences, Universidad Adolfo Ibañez",uadolfoi,uai.cl,53,
10448777709790852446,O2Jpi6sAAAAJ,Alessandra Caputo Jaffe,Universidad Adolfo Ibáñez,uadolfoi,uai.cl,51,arte amerindio antropología historia del arte Caribe Amazonas 
10448777709790852446,AwMCJRkAAAAJ,Carlos Armando Mejía Vega,"Finance PhD student, Adolfo Ibañez University",uadolfoi,alumno,50,Commodities Mathematical finance Parameters estimation Portfolio choice 
10448777709790852446,vBgTDvoAAAAJ,Danilo Bórquez-Paredes,Universidad Adolfo Ibañez,uadolfoi,uai.cl,49,Simulation Optical Networks Complex Systems 
10448777709790852446,9WFV0UQAAAAJ,Fernando Guzmán Schiappacasse,Universidad Adolfo Ibañez,uadolfoi,uai.cl,48,Historia del arte latinoamericano 
10448777709790852446,nZ3aRccAAAAJ,Francisco Javier Salinas Lemus,"Escuela de Gobierno, Universidad Adolfo Ibáñez",uadolfoi,edu.ua,47,Sociology Social theory Actor-network theory Academic Life Sociology of Knowledge 
10448777709790852446,HvVUdPYAAAAJ,María Angélica Franken,Universidad Adolfo Ibáñez,uadolfoi,uai.cl,47,cine y literatura migraciones Chile y Alemania intermedialidad infancia y filiaciones 
10448777709790852446,eeVQ7kQAAAAJ,Maxwell Woods,Universidad Adolfo Ibáñez,uadolfoi,uai.cl,45,Comparative Literature Urbanism Environmentalism Decoloniality Literary Urban Studies 
10448777709790852446,i3HhEesAAAAJ,Paul Escapil-Inchauspé,Universidad Adolfo Ibáñez,uadolfoi,edu.ua,43,Numerical Methods Uncertainty Quantification BEM Applied Mathematics 
10448777709790852446,OWqoc7IAAAAJ,Emiliano Javier Cuccia,"Doctor en Filosofía, Universidad Adolfo Ibáñez",uadolfoi,uai.cl,41,Filosofía Medieval Tomás de Aquino Metafísica Filosofía Escolástica 
10448777709790852446,6Q1MqmYAAAAJ,Tomas Trewhela,"Assistant Professor, Universidad Adolfo Ibañez",uadolfoi,uai.cl,41,Granular flows 
10448777709790852446,yGI4yLMAAAAJ,Francisco Saffie,"Profesor de Derecho, Universidad Adolfo Ibáñez",uadolfoi,uai.cl,40,Teoría del Derecho Filosofía del Derecho Derecho Tributario Filosofía Política 
10448777709790852446,sojH5YMAAAAJ,Héctor Araya,Universidad Adolfo Ibañez,uadolfoi,uai.cl,40,Stochastic processes Statistics Mathematical statistics 
10448777709790852446,78jXSAEAAAAJ,Omar Matus,Universidad Adolfo Ibáñez,uadolfoi,uai.cl,39,Operation research 
10448777709790852446,Gw2pqW4AAAAJ,Saeed Farhang Sahlevani,Universidad Adolfo Ibáñez,uadolfoi,edu.ua,38,Semiconductor Core@Shell Photocatalyst 
10448777709790852446,RrzlOTIAAAAJ,Pedro Fierro,"Business School, Universidad Adolfo Ibáñez",uadolfoi,uai.cl,35,Digital Politics Local Government Local and Urban Politics 
10448777709790852446,UwHQBXAAAAAJ,Constanza Baquedano,Universidad Adolfo Ibañez,uadolfoi,uai.cl,34,Neurosciences Neurophenomenology 
10448777709790852446,sJ3zaGEAAAAJ,Rodrigo Escribano Roca,"Profesor, Facultad de Artes Liberales, Universidad Adolfo Ibáñez",uadolfoi,uai.cl,33,Historia intelectual de Europa y América Culturas Políticas Nacionalismo Historia Imperial de España y Reino Unido Teoría de la Historia 
10448777709790852446,urdoEmwAAAAJ,Rodrigo P. Correa G.,Universidad Adolfo Ibáñez,uadolfoi,uai.cl,32,Law 
10448777709790852446,k20i9TMAAAAJ,Marcela Drien,"Profesora Asociada, Departamento de Historia y Ciencias Sociales, Universidad Adolfo …",uadolfoi,uai.cl,30,Coleccionismo Exposiciones Circulación 
10448777709790852446,DD-iNJsAAAAJ,Mary Mac-Millan,"Profesora de Literatura, Universidad Adolfo Ibáñez",uadolfoi,uai.cl,30,intermedialidad representación ética 
10448777709790852446,TObTJYAAAAAJ,Guillermo Jiménez,"Profesor de Derecho Público, Universidad Adolfo Ibáñez",uadolfoi,uai.cl,30,Law 
10448777709790852446,H-zLts0AAAAJ,Juan José Price,Universidad Adolfo Ibanez (UAI),uadolfoi,uai.cl,30,
10448777709790852446,EQrjT5sAAAAJ,Nicole Darat,Universidad Adolfo Ibáñez,uadolfoi,uai.cl,29,
10448777709790852446,SqpNqCUAAAAJ,Ruth Murrugarra,Profesor asistente Universidad Adolfo Ibañez,uadolfoi,uai.cl,29,Estadística aplicada análisis de datos ética y educación en ingeniería 
10448777709790852446,aX2R-soAAAAJ,Javier Bronfman H.,"School of Government, Universidad Adolfo Ibáñez",uadolfoi,uai.cl,28,Poverty Development Social Policy 
10448777709790852446,fLrAAbwAAAAJ,Paola Benavides Bermúdez,Universidad Adolfo Ibáñez,uadolfoi,uai.cl,28,Desarrollo de materiales sostenibles Nuevos materiales biobasados Aleación mecánica y sinterización 
10448777709790852446,zwZrVnwAAAAJ,Juan Pablo Contreras,Universidad Adolfo Ibáñez,uadolfoi,alumno,28,convex optimization fixed-point methods mathematical programming 
10448777709790852446,LxotMu8AAAAJ,Samuel Tschorne,"Professor of law, Universidad Adolfo Ibáñez",uadolfoi,uai.cl,27,constitutional theory jurisprudence public law constitutional law 
10448777709790852446,nCM0luEAAAAJ,Gustavo Genoni,"Profesor of Finance, Universidad Adolfo Ibáñéz, Universidad Torcuato Di Tella",uadolfoi,uai.cl,26,Corporate Finance Corporate Governance Debt Restructuring Industrial Organization of Financial Markets 
10448777709790852446,vGdjGdMAAAAJ,G Bustamante Kuschel,Universidad Adolfo Ibáñez,uadolfoi,uai.cl,26,Conceptual History Political Theory Hobbes Machiavelli Political Representation 
10448777709790852446,YRGsiT0AAAAJ,"Pilar Gardiazabal, Ph.D.",Adolfo Ibañez University,uadolfoi,uai.cl,21,Transformative Services 
10448777709790852446,598ClpMAAAAJ,Francisca Rengifo Streeter,"Profesora asociada Escuela de Gobierno, Universidad Adolfo Ibáñez",uadolfoi,uai.cl,21,historia política y social educación políticas sociales y de familia género 
10448777709790852446,Xuv2aWkAAAAJ,Martín Ríos-Wilson,Universidad Adolfo Ibáñez,uadolfoi,uai.cl,20,Complex Systems Discrete Dynamical Systems Theory of Computing Automata Networks 
10448777709790852446,6vtN6JgAAAAJ,Cynthia Francica,"Profesora de Literatura, Universidad Adolfo Ibáñez",uadolfoi,uai.cl,19,literatura y artes visuales latinoamericanos estudios de género teoría de afectos 
10448777709790852446,hBZGG9QAAAAJ,Eduardo Court,Profesor Facultad de Derecho Universidad Adolfo Ibáñez,uadolfoi,uai.cl,18,Derecho Civil 
10448777709790852446,r8bEn9oAAAAJ,José Antonio Valdivia Fuenzalida,Universidad Adolfo Ibáñez,uadolfoi,uai.cl,17,Filosofía 
10448777709790852446,SWjpsbgAAAAJ,Martina Bortignon,Universidad Adolfo Ibáñez,uadolfoi,uai.cl,17,Comparative Literature 
10448777709790852446,3RH7TuMAAAAJ,Jose A. Carrasco,Universidad Adolfo Ibañez,uadolfoi,uai.cl,17,Economics Search & Matching Game Theory Dynamic Programming 
10448777709790852446,21LprJQAAAAJ,Naim Bro,"Assistant Professor, School of Government, Adolfo Ibáñez University & IMFD Chile",uadolfoi,uai.cl,17,computational social sciences social stratification political sociology 
10448777709790852446,ymkHBykAAAAJ,Juan Cristobal Karich,"Diseñador Industrial, Universidad Adolfo Ibañez",uadolfoi,uai.cl,16,Design technology 3dprinting interaction 
10448777709790852446,oG19zLoAAAAJ,Daniel Ovalle Pastén,Universidad Adolfo Ibáñez,uadolfoi,edu.ua,14,Teoría de la Historia filosofía de la historia Paul Ricoeur historiografía historia de la muerte 
10448777709790852446,BplW1w0AAAAJ,Julio I Gutiérrez García-Huidobro,Universidad Adolfo Ibáñez,uadolfoi,uai.cl,14,Teoría de la adaptación cómics apropiación Parodia ecología de medios 
10448777709790852446,5t6FgO4AAAAJ,Paula Lam Tapia,Universidad Adolfo Ibáñez,uadolfoi,edu.ua,13,services marketing behavioral economics microeconomics education 
10448777709790852446,knUy7tsAAAAJ,Nicolás Del Fierro,Universidad Adolfo Ibañez,uadolfoi,edu.ua,13,Criminal Law Criminal Justice Policing Legal theory 
10448777709790852446,HUcxkg4AAAAJ,Cristian Ramírez-Pico,Universidad Adolfo Ibáñez,uadolfoi,edu.ua,11,Stochastic programming Operations Research Supply Chain 
10448777709790852446,uOZlAwUAAAAJ,marcelo somarriva,Profesor Facultad de Artes Liberales Universidad Adolfo Ibáñez,uadolfoi,uai.cl,11,Historia de América y Chile siglos XVIII y XIX 
10448777709790852446,vpusqLAAAAAJ,Nicolas Camus-Fullerton,"Estudiante, Universidad Adolfo Ibañez",uadolfoi,alumno,11,Space science Aging BioInformatics Optimization Problems 
10448777709790852446,Uwmelw4AAAAJ,Maurice Poirrier,Alumni Universidad Adolfo Ibáñez,uadolfoi,alumno,10,Machine learning Data operations 
10448777709790852446,bySLeisAAAAJ,Diego Pinochet,"Massachusetts Institute of Technology, Adolfo Ibanez University",uadolfoi,uai.cl,9,computational design Digital fabrication Human Machine Interaction programming artificial intelligence 
10448777709790852446,3Hc70r4AAAAJ,hugo finola,"Profesor de Filosofía, Universidad Adolfo Ibáñez y Universidad de Valparaíso",uadolfoi,edu.ua,9,Filosofía y Humanidades 
10448777709790852446,d_M2kncAAAAJ,Nicolas Marchant,Universidad Adolfo Ibañez,uadolfoi,alumno,9,Cognitive Science Categorization 
10448777709790852446,Qo3hEG8AAAAJ,Diego Pardo-Alvarez,Law Professor at Adolfo Ibáñez University,uadolfoi,uai.cl,8,Constitutional law legal theory 
10448777709790852446,YdjpsGAAAAAJ,Cristina Crichton,"Profesora de artes liberales, Universidad Adolfo Ibáñez",uadolfoi,uai.cl,7,Filosofía y Fenomenología 
10448777709790852446,z_WwMnUAAAAJ,Jorge Cid,"Departamento de Literatura, Facultad Artes Liberales, Universidad Adolfo Ibáñez",uadolfoi,uai.cl,7,Literatura latinoamericana Crítica genética y Educación Superior 
10448777709790852446,EiLaPMUAAAAJ,Pablo Javier González López,Universidad Adolfo Ibañez,uadolfoi,uai.cl,7,Difference Equations Dichotomies Nonautonomous Dynamical System 
10448777709790852446,S7PV9RcAAAAJ,Bárbara Barraza Uribe,"Estudiante de Doctorado, Universidad Adolfo Ibáñez",uadolfoi,alumno,7,Género criminología América Latina Chile 
10448777709790852446,zts4MjsAAAAJ,Nicolas Anich Gutierrez,Universidad Adolfo Ibañez,uadolfoi,edu.ua,6,Supply chain management and Operation … 
10448777709790852446,VNYrw60AAAAJ,Dusan Cotoras Straub,Universidad Adolfo Ibáñez,uadolfoi,edu.ua,6,
10448777709790852446,Y8XurTwAAAAJ,Francisco J. Alonso,"Profesor de Literatura, Universidad Adolfo Ibáñez",uadolfoi,uai.cl,5,Classics Latin Literature Greek Literature Roman Poetry Intertextuality 
10448777709790852446,bGOOQzYAAAAJ,Pablo Concha-Vega,Universidad Adolfo Ibañez,uadolfoi,alumno,5,Theoretical Computer Science 
10448777709790852446,FqaUJl8AAAAJ,Tomas Villarroel,"Universidad Adolfo Ibáñez, Departamento de Historia y Ciencias Sociales",uadolfoi,uai.cl,5,Relaciones internacionales siglo XX historia global relaciones transnacionales historia contemporánea de Chile historia eur 
10448777709790852446,25DmFW4AAAAJ,Niels Rivas Nielsen,"Profesor Departamento de Literatura, Universidad Adolfo Ibáñez, Chile",uadolfoi,uai.cl,4,Crítica del lenguaje literatura del absurdo poesía hispanoamericana 
10448777709790852446,pWaeTSIAAAAJ,Arturo Ibanez Leon,"Profesor Facultad de Derecho, Universidad Adolfo Ibáñez",uadolfoi,uai.cl,3,Derecho privado historia del derecho derecho romano filosofía del derecho 
10448777709790852446,HGDKJl8AAAAJ,Tania Martina Roa Rojas,Universidad Adolfo Ibáñez,uadolfoi,uai.cl,3,Procesos estocásticos matemática aplicada Simulaciones Genética de poblaciones 
10448777709790852446,mwpU8t8AAAAJ,Manuel Matas,Universidad Adolfo Ibáñez,uadolfoi,alumno,2,Information Technologies Education and Technology 
10448777709790852446,mQwDWagAAAAJ,Andrés Stark Azocar,Universidad Adolfo Ibáñez (Chile),uadolfoi,uai.cl,2,Filosofía Política Ética Historia de las Ideas Políticas Religión y Política Filosofía de la Economía 
10448777709790852446,WCX90BoAAAAJ,Danilo Santiago Torres Manrique,Universidad Adolfo Ibáñez,uadolfoi,alumno,2,Labor Economics Economics of Education Higher Education 
10448777709790852446,Kry0tAMAAAAJ,Valentina Vallejo-Correa,Professor and Researcher. Universidad Adolfo Ibañez,uadolfoi,uai.cl,2,Child Abuse Children Participation Care and parenting Public policies 
10448777709790852446,fYx5JocAAAAJ,Dora Mariela Jiménez Álvarez,Universidad Adolfo Ibáñez,uadolfoi,edu.ua,1,Applied Mathematics Optimization reliability 
10448777709790852446,wTiBVIIAAAAJ,Bárbara Fuentes,"profesora escuela de periodismo, directora de docencia, Universidad Adolfo Ibáñez",uadolfoi,uai.cl,1,prensa pluralismo crónica latinoamericana ética periodística 
10448777709790852446,5qrWzL8AAAAJ,Alvaro Muñoz Ferrer,Universidad Adolfo Ibáñez,uadolfoi,edu.ua,1,Filosofía Política Filosofía de la Economía 
10448777709790852446,ZYXyp4kAAAAJ,Lia Karmelic,Universidad Adolfo Ibáñez,uadolfoi,uai.cl,1,Patrimonio Cultural Patrimonio Arquitectónico Arquitectura de tierra Patrimonio Arqueológico Patrimonio Histórico Arquite 
10448777709790852446,n1P_aMkAAAAJ,Sebastián Uriarte Candón,Universidad Adolfo Ibañez,uadolfoi,uai.cl,1,Emprendimiento 
10448777709790852446,m2Dxjz8AAAAJ,Andrea Leyton Beltrán,Universidad Adolfo Ibañez,uadolfoi,edu.ua,,Literatura latinomericana 
10448777709790852446,L58Sz9cAAAAJ,Ricardo Loyola,"Profesor Invitado, Universidad Adolfo Ibáñez",uadolfoi,edu.ua,,historia derecho 
10448777709790852446,uRxDH6oAAAAJ,Lorena Vasquez Castro,Estudiante Doctorado. Universidad Adolfo Ibañez,uadolfoi,alumno,,patrimonio monumentos públicos museos ciencias sociales. 
10448777709790852446,F2DLqk8AAAAJ,Veronika Wegner A.,Profesora Facultad de Derecho Universidad Adolfo Ibáñez,uadolfoi,uai.cl,,Derecho civil derecho de familia derecho patrimonial de familia 
10448777709790852446,g0ltTY8AAAAJ,Karin Usach Franck,Universidad Adolfo Ibañez,uadolfoi,uai.cl,,Marketing 
10448777709790852446,5x1N0ZEAAAAJ,Verónica Díaz,Universidad Adolfo Ibáñez,uadolfoi,uai.cl,,Marketing cuantitativo Comportamiento del consumidor Machine Learning 
