id_institucion_gs,id_autor_gs,autor,cargo,id_institucion,email,citaciones,intereses
10448777709790852446,8XKXZJUAAAAJ,Giovanna Cottin,Universidad Adolfo Ibañez,uadolfoi,uai.cl,143326,Particle Phenomenology Beyond the Standard Model Long-Lived Particles Higgs 
10448777709790852446,OKfYDv0AAAAJ,Andrés Jordán,Universidad Adolfo Ibáñez,uadolfoi,uai.cl,19378,Exoplanets protoplanetary and debris disks early-type galaxies globular clusters 
10448777709790852446,RfGKP34AAAAJ,José Luis Campos,"Facultad de Ingeniería y Ciencias, Universidad Adolfo Ibáñez",uadolfoi,uai.cl,12406,Wastewater treatment 
10448777709790852446,aShVsHsAAAAJ,Sandra Milberg,"Professor of Marketing, Universidad Adolfo Ibañez",uadolfoi,uai.cl,10242,Consumer Behavior Branding Decision Making Information Privacy 
10448777709790852446,Js0nhfIAAAAJ,Bernardo R. Broitman,"Professor, Departamento de Ciencias, Facultad Artes Liberales, Universidad Adolfo Ibáñez",uadolfoi,uai.cl,7138,Biophysical forcing Coastal ecosystems Biogeography 
10448777709790852446,ZxW_BhoAAAAJ,"Constanza Bianchi, PhD",Universidad Adolfo Ibañez - Queensland University of Technology,uadolfoi,uai.cl,5950,International marketing 
10448777709790852446,S2EpBmkAAAAJ,Tito Homem-de-Mello,Professor. School of Business. Universidad Adolfo Ibañez.,uadolfoi,uai.cl,5874,Optimization under uncertainty. 
10448777709790852446,w742qQgAAAAJ,Daniel Olivares Quero,"Associate Professor, Faculty of Engineering and Sciences, Universidad Adolfo Ibañez",uadolfoi,uai.cl,5390,Power & Energy Systems Smartgrids Microgrids Applied Optimization. 
10448777709790852446,3aaunA0AAAAJ,Jorge Cuadra,Universidad Adolfo Ibáñez,uadolfoi,uai.cl,5327,Astrophysics Galactic Centre Protoplanetary Discs Super-Massive Black Hole Binaries 
10448777709790852446,724ME-oAAAAJ,Gijs D Mulders,"Assistant Professor, Universidad Adolfo Ibáñez",uadolfoi,uai.cl,5165,exoplanet astronomy 
10448777709790852446,lSbD6y8AAAAJ,Bernardo González,Universidad Adolfo Ibáñez. Universidad Católica de Chile,uadolfoi,uai.cl,4942,
10448777709790852446,0ibegmYAAAAJ,Jacques Dumais,"Professor of Bioengineering, Universidad Adolfo Ibáñez",uadolfoi,uai.cl,4641,cell mechanics cell morphogenesis cell division fog collection 
10448777709790852446,zmkA7uwAAAAJ,Andrea Repetto,Universidad Adolfo Ibañez,uadolfoi,uai.cl,4555,Applied Economics 
10448777709790852446,xd4Wp9wAAAAJ,Gary O'Donovan,"BrainLat, Universidad Adolfo Ibáñez",uadolfoi,uai.cl,4251,Physical activity and health 
10448777709790852446,VQchlPYAAAAJ,joris van de klundert,"School of Business, Universidad Adolfo Ibanez",uadolfoi,uai.cl,4241,Operations Health Services 
10448777709790852446,3ZKkR_gAAAAJ,Marco A Lardies,Universidad Adolfo Ibañez,uadolfoi,uai.cl,4010,ecology evolution environmental sciences evolutionary ecology marine biology 
10448777709790852446,3ut4Mn0AAAAJ,Roberto Cominetti,Universidad Adolfo Ibáñez (Chile),uadolfoi,uai.cl,3864,Convex Analysis Optimization Game Theory Transportation 
10448777709790852446,jGAelSwAAAAJ,Rafael Brahm,Universidad Adolfo Ibañez,uadolfoi,uai.cl,3766,Astronomía 
10448777709790852446,Z8zHERAAAAAJ,Claudio Bravo Ortega,"Escuela de Negocios, Universidad Adolfo Ibañez",uadolfoi,uai.cl,3159,Innovación Crecimiento Economico y Economía Politica 
10448777709790852446,6wMud9YAAAAJ,David Huepe,Center for Social and Cognitive Neuroscience (CSCN) School of Psychology - Adolfo Ibañez …,uadolfoi,uai.cl,3144,Social Neuroscience Social Cognition Psychology 
10448777709790852446,QASCP9kAAAAJ,Daniel Chernilo,Universidad Adolfo Ibáñez,uadolfoi,uai.cl,2938,philosophical sociology social theory sociology cosmopolitanism nationalism 
10448777709790852446,Qlo5BzAAAAAJ,Viviana Fernandez,Universidad Adolfo Ibañez,uadolfoi,uai.cl,2524,Financial Econometrics Mineral economics Innovation Entrepreneuship 
10448777709790852446,RG9y4EQAAAAJ,Mauricio Galleguillos,"Universidad Adolfo Ibañez, Facultad de Ingeniería y Ciencias",uadolfoi,uai.cl,2322,Remote Sensing Ecosystems Hydrology 
10448777709790852446,7H4k-70AAAAJ,Aldo Mascareño,Universidad Adolfo Ibáñez,uadolfoi,uai.cl,2242,Teoría social 
10448777709790852446,V2IQltIAAAAJ,Jordi Pereira,Universidad Adolfo Ibáñez,uadolfoi,uai.cl,2210,Combinatorial Optimization Assembly line balancing Network Design Scheduling 
10448777709790852446,Q6u9Jr8AAAAJ,Guillermo Paraje,Universidad Adolfo Ibañez,uadolfoi,uai.cl,2146,Health Economics Development Economics 
10448777709790852446,KbhBu5IAAAAJ,Claudio A. Agostini,Universidad Adolfo Ibañez,uadolfoi,uai.cl,1996,Tax Policy Antitrust Energy Economics 
10448777709790852446,jBBm2o0AAAAJ,Andrea Vega,"Faculty of Engineering and Science, Adolfo Ibañez University",uadolfoi,uai.cl,1958,Plant molecular biology 
10448777709790852446,seFxmwsAAAAJ,Hernán A. Gonzalez,Universidad Adolfo Ibáñez,uadolfoi,uai.cl,1900,black holes classical and quantum gravity 
10448777709790852446,SAU_hdkAAAAJ,Marcos Goycoolea,"Professor of Operations Research, Universidad Adolfo Ibañez",uadolfoi,uai.cl,1832,Optimization Integer Programming 
10448777709790852446,TzPYdWsAAAAJ,Arturo Arriagada,"Associate Professor | School of Communications, Universidad Adolfo Ibáñez | Chile",uadolfoi,uai.cl,1829,Social Media Cultural Industries Consumer Culture Cultural Production Political Communication 
10448777709790852446,jVs_cZAAAAAJ,Ricardo Seguel,Universidad Adolfo Ibáñez,uadolfoi,uai.cl,1738,Information Systems 
10448777709790852446,_GtUFsUAAAAJ,Andres Anabalon,Universidad Adolfo Ibañez,uadolfoi,uai.cl,1705,General Relativity Supergravity Black Holes Wormholes 
10448777709790852446,mZKDqM8AAAAJ,Daniel F. Leite,"Associate Professor, Universidad Adolfo Ibáñez, Chile",uadolfoi,uai.cl,1694,Computational Intelligence Machine Learning Control Theory Granular Computing 
10448777709790852446,vtAzpf4AAAAJ,Andrés Scherman,Universidad Adolfo Ibáñez,uadolfoi,uai.cl,1658,
10448777709790852446,Qt720VgAAAAJ,Eduardo Barros,Universidad Adolfo Ibáñez,uadolfoi,uai.cl,1592,Organizational Psychology Organizational Behavior Human Resources Industrial Psychology 
10448777709790852446,FQoz_SIAAAAJ,César González-Lagos,"Departamento de Ciencias, Facultad de Artes Liberales, Universidad Adolfo Ibáñez",uadolfoi,uai.cl,1589,Evolutionary Ecology Behavioral Ecology Global Change 
10448777709790852446,8H0vpvIAAAAJ,María Josefina Poupin,"Associate Professor, Facultad de Ingeniería y Ciencias, Universidad Adolfo Ibañez",uadolfoi,uai.cl,1555,Plant Physiology Plant-Microbe Interaction Molecular Biology 
10448777709790852446,0rCZXakAAAAJ,Andres Gomberoff,Universidad Adolfo Ibañez,uadolfoi,uai.cl,1539,Física teórica 
10448777709790852446,jkovdhYAAAAJ,Gonzalo A. Ruz,Universidad Adolfo Ibáñez,uadolfoi,uai.cl,1507,Machine Learning Bayesian Networks Boolean Networks Gene Regulatory Networks 
10448777709790852446,8kN25_QAAAAJ,Michelle Sadler,"Facultad de Artes Liberales, Universidad Adolfo Ibáñez",uadolfoi,uai.cl,1501,Gender and health reproductive health birth 
10448777709790852446,Bys2da0AAAAJ,Gorka Navarrete,Universidad Adolfo Ibañez,uadolfoi,edu.ua,1495,Bayesian Reasoning Medical Decision Making Metascience 
10448777709790852446,6rm3S60AAAAJ,Prof. Jorge E. Hernández,"Professor at Univ'ersidad Adolfo Ibañez, Chile & Honorary Professor at University of …",uadolfoi,uai.cl,1413,Decision Support Systems Operations Management Supply Chain Management Simulation Optimisation 
10448777709790852446,c6KQyWDQuJ4C,Felipe Aquea,Universidad Adolfo Ibañez.,uadolfoi,edu.ua,1401,Biología Molecular y Biotecnología Vegetal 
10448777709790852446,u8aaETQAAAAJ,Claudio Aqueveque,Universidad Adolfo Ibañez,uadolfoi,uai.cl,1375,
10448777709790852446,tKZTb6kAAAAJ,FC Antico,"Associate Professor, Facultad de Ingeniería y Ciencias, Universidad Adolfo Ibáñez",uadolfoi,uai.cl,1360,fracture mechanics solid mechanics cementitious materials waste valorization durability 
10448777709790852446,5MjpjFIAAAAJ,Diana Kruger,Professor of Economics Universidad Adolfo Ibañez,uadolfoi,uai.cl,1346,Human capital labor economics development economics 
10448777709790852446,tJ2-GdgAAAAJ,Juan Pablo Medina,Universidad Adolfo Ibáñez,uadolfoi,uai.cl,1341,Macroeconomics International Finance Monetary and Fiscal Policies 
10448777709790852446,hJpGLI4AAAAJ,Rodrigo Wagner,"Business School - Universidad Adolfo Ibañez (Chile) &  Growth Lab ( CID, Harvard)",uadolfoi,uai.cl,1317,international economics financial economics entrepreneurial finance growth emerging markets 
10448777709790852446,OJgAafoAAAAJ,Leonidas Montes,"Professor, Universidad Adolfo Ibañez",uadolfoi,uai.cl,1277,History of Economic Thought History of Economics Political Economy Political Theory and Economics 
10448777709790852446,Mm1CJHEAAAAJ,Eduardo Moreno,"Faculty of Engineering and Sciences, Universidad Adolfo Ibañez",uadolfoi,uai.cl,1276,Optimization Stochastic Programming Operations Research Mine Planning Network Design 
10448777709790852446,c5dg4R8AAAAJ,Francisco D. Muñoz,"Director of Research, Generadoras de Chile | Adjunct Professor, UAI",uadolfoi,uai.cl,1190,Electricity Markets Market Design Energy Economics Industrial Organization Operations Research 
10448777709790852446,8nUNv-QAAAAJ,Matias Berthelon,Universidad Adolfo Ibáñez,uadolfoi,uai.cl,1165,Development Economics Economics of Education Labor Economics International Trade 
10448777709790852446,_B0nizsAAAAJ,Moreno Bevilacqua,Universidad Adolfo Ibañez,uadolfoi,uai.cl,1121,Spatio-temporal Statistics likelihood approximations covariance models Environmental Statistics 
10448777709790852446,6Uy9Bt8AAAAJ,Thomas Ledger,"Associate Professor of Bioengineering, Universidad Adolfo Ibáñez",uadolfoi,uai.cl,1115,microbiology molecular biology biochemistry 
10448777709790852446,xSlVrwEAAAAJ,Pablo Benítez Llambay,Universidad Adolfo Ibáñez,uadolfoi,uai.cl,1108,Computational Astrophysics Planet Formation Accretion Disks 
10448777709790852446,JRMCEqIAAAAJ,Felipe A. Asenjo,Universidad Adolfo Ibáñez,uadolfoi,uai.cl,1092,Physics Plasma Physics Astrophysics General Relativity Quantum mechanics 
10448777709790852446,-Z8b4PQAAAAJ,Osvaldo Chandia,Universidad Adolfo Ibañez,uadolfoi,uai.cl,1081,theoretical physics string theory 
10448777709790852446,66uZn_wAAAAJ,Paula Mellado,Universidad Adolfo Ibáñez,uadolfoi,uai.cl,1043,Condensed Matter Physics 
10448777709790852446,IOHeQ9EAAAAJ,"Hector Madrid, PhD","Universidad Adolfo Ibáñez, Business School",uadolfoi,uai.cl,1018,Work and Organizational Psychology Organizational Behavior 
10448777709790852446,gBKpvbEAAAAJ,Carola Millan,"Profesor Facultad de Artes Liberales, Universidad Adolfo Ibañez",uadolfoi,uai.cl,996,glucosensing células madre y medicina regenerativa cronobiología educación científica 
10448777709790852446,SXlLUvkAAAAJ,Wilfredo Yushimito,Universidad Adolfo Ibáñez,uadolfoi,uai.cl,984,Transportation analytics freight and logistics network modeling humanitarian logistics transportation policy 
10448777709790852446,WYz_08AAAAAJ,Miguel Carrasco,"Associate Professor, Universidad Adolfo Ibañez",uadolfoi,uai.cl,977,Image Processing Human-Computer Interaction 
10448777709790852446,KKTR6XsAAAAJ,Paula Rojas S.,Universidad Adolfo Ibañez,uadolfoi,uai.cl,934,Ciencia e Ingeniería de Materiales/ Science … 
10448777709790852446,lSCYs20AAAAJ,Roberto Aristegui,Profesor de Psicología  Universidad Adolfo Ibáñez,uadolfoi,uai.cl,928,Filosofía de la Psicología Psicología Clínica Mindfulness Relacional 
10448777709790852446,GVx_nSAAAAAJ,Sergio Gamonal C.,Universidad Adolfo Ibáñez,uadolfoi,uai.cl,922,Derecho del Trabajo 
10448777709790852446,Q8gupOsAAAAJ,Gonzalo Huerta-Canepa,Universidad Adolfo Ibáñez,uadolfoi,uai.cl,907,IoT Distributed systems 
10448777709790852446,xzD91mEAAAAJ,Claudia Cruzat-Mandich,"Escuela de Psicología, Universidad Adolfo Ibáñez",uadolfoi,uai.cl,899,trastornos alimentarios obesidad imagen corporal cirugía bariátrica 
10448777709790852446,7MnmVNMAAAAJ,C Jerez-Hanckes,Universidad Adolfo Ibáñez,uadolfoi,uai.cl,852,Numerical Methods Boundary Integral Methods BEM Uncertainty Quantification Applied Mathematics 
10448777709790852446,oL7PWxkAAAAJ,Stefano Novellani,"Assistant Professor of Operations Research at  Universidad Adolfo Ibáñez, Chile",uadolfoi,uai.cl,846,Operations Research Combinatorial Optimization Vehicle Routing 
10448777709790852446,Soqg7kIAAAAJ,Juan F. Vivanco,"Associate Professor, Faculty of Engineering and Sciences, Adolfo Ibáñez University - Chile",uadolfoi,uai.cl,827,bioengineering biomaterials bone biomechanics bone scaffold nanoindentation 
10448777709790852446,gHr5WkYAAAAJ,Rolando de la Cruz,Universidad Adolfo Ibáñez,uadolfoi,uai.cl,825,Statistics Biostatistics Bayesian Statistics Machine Learning 
10448777709790852446,oesPCToAAAAJ,María Josefina Escobar,Profesora de Psicología - Universidad Adolfo Ibáñez,uadolfoi,uai.cl,813,apego neurodesarrollo adopción institucionalización burnout parental 
10448777709790852446,w-0YGM4AAAAJ,Sergio Chaigneau,Profesor Titular Psicología UAI,uadolfoi,uai.cl,809,cognición clasificación categorización 
10448777709790852446,rGjdpBMAAAAJ,Emilio J. Compte,"Assistant Profesor, Universidad Adolfo Ibáñez",uadolfoi,uai.cl,806,Clinical Psychology Applied Statistics Eating Disorders 
10448777709790852446,DYlZQ4cAAAAJ,Pedro Reszka,Universidad Adolfo Ibañez,uadolfoi,uai.cl,789,Fire Safety Combustion Heat Transfer 
10448777709790852446,5tMzkdYAAAAJ,Alvaro Rivera-Rei,Universidad Adolfo Ibañez,uadolfoi,uai.cl,788,
10448777709790852446,Ja_jV8sAAAAJ,CP Pabón Pereira,"Assistant Professor, Universidad Adolfo Ibáñez",uadolfoi,uai.cl,754,urban metabolism circular economy anaerobic digestion biomass valorization 
10448777709790852446,F8FeULMAAAAJ,Shahriyar Nasirov,Associate Professor at the Universidad Adolfo Ibañez,uadolfoi,uai.cl,750,Energy Markets Energy Transition Energy Policy 
10448777709790852446,-7Mu6T4AAAAJ,Eduardo Fajnzylber,"Profesor, Escuela de Gobierno, Universidad Adolfo Ibáñez",uadolfoi,uai.cl,743,Social Security Unemployment insurance Impact Evaluation 
10448777709790852446,DFRheTkAAAAJ,Hervé Roche,Universidad Adolfo Ibáñez,uadolfoi,uai.cl,719,Financial Economics Asset Pricing Investment under Uncertainty Speculation 
10448777709790852446,SihJl3UAAAAJ,Felipe A. Larrain,Assistant Professor at Universidad Adolfo Ibáñez,uadolfoi,uai.cl,686,Solar energy Sensors CO2 capture and utilization 
10448777709790852446,3gs_8dQAAAAJ,Wenceslao Unanue,"Profesor Asociado, Escuela de Negocios, UAI",uadolfoi,uai.cl,683,Felicidad y Bienestar Psicología Económica Políticas Públicas 
10448777709790852446,sysQUHsAAAAJ,Javier Lopatin,Universidad Adolfo Ibáñez,uadolfoi,uai.cl,677,Remote Sensing of Vegetation plant strategies plant traits 
10448777709790852446,bpFKSw8AAAAJ,Pablo Pincheira Brown,School of Business Adolfo Ibáñez University,uadolfoi,uai.cl,643,Time Series Forecasting Macroeconometrics Monetary Policy 
10448777709790852446,7GxmDM4AAAAJ,Jacopo Seccatore,Universidad Adolfo Ibañez,uadolfoi,uai.cl,640,
10448777709790852446,UHM12b0AAAAJ,Javier Wilenmann,Universidad Adolfo Ibáñez,uadolfoi,uai.cl,591,Derecho Derecho Penal Teoría social Filosofía 
10448777709790852446,FD40SMIAAAAJ,MAGDALENA Pereira,"Facultad Artes Liberales, Universidad Adolfo Ibáñez",uadolfoi,uai.cl,588,Historia del arte andina 
10448777709790852446,zHBuWngAAAAJ,Salvador Zurita,Universidad Adolfo Ibañez,uadolfoi,uai.cl,571,Finance 
10448777709790852446,gazPkREAAAAJ,Juan Pablo Pavissich,"Associate Professor, Universidad Adolfo Ibáñez",uadolfoi,uai.cl,566,Biofilms Wastewater Treatment 
10448777709790852446,gU6u5fEAAAAJ,Jorge Villalon,"Director of Online Learning, Universidad Adolfo Ibáñez",uadolfoi,uai.cl,551,Educational Technology Artificial Intelligence 
10448777709790852446,1pEtteIAAAAJ,Sebastian Moreno,Universidad Adolfo Ibañez,uadolfoi,uai.cl,551,Data Mining Machine Learning Statistical Network Analysis 
10448777709790852446,B7J_S_sAAAAJ,Karin Maldonado,"Profesor Asociado, Universidad Adolfo Ibáñez",uadolfoi,uai.cl,550,Animal ecophysiology evolutionary biology Population ecology 
10448777709790852446,UWS2YecAAAAJ,Akira Otsuki,Universidad Adolfo Ibáñez,uadolfoi,uai.cl,546,
10448777709790852446,e7nVdFQAAAAJ,Manuel Llorca Jaña,Universidad Adolfo Ibáñez,uadolfoi,uai.cl,545,Economic History Business History Anthropometry Welfare-Inequality 
10448777709790852446,U_rkAw0AAAAJ,Luis Aburto Lafourcade,"Assistant Professor, Universidad Adolfo Ibañez",uadolfoi,uai.cl,504,Data Science Recommendation system Retail Management Forecasting Pricing 
10448777709790852446,ePDfbqIAAAAJ,Dafne Crutchik,Universidad Adolfo Ibáñez,uadolfoi,uai.cl,501,Resources recovery wastewater treatment 
10448777709790852446,8w-NnvMAAAAJ,Enrique Canessa,"Associate Professor, Universidad Adolfo Ibáñez, Facultad Ingeniería y Ciencias",uadolfoi,uai.cl,501,agent-based modelling conceptual agreement theory genetic algorithms 
10448777709790852446,9P14_lYAAAAJ,Felix Raspall,"Associate Professor, DesignLab, Adolfo Ibanez University",uadolfoi,uai.cl,491,
10448777709790852446,wG3Spr8AAAAJ,Esteban Koberg de la Cruz,"Universidad Adolfo Ibañez, Business School",uadolfoi,uai.cl,487,Sustainability Supply Chain Management 
10448777709790852446,-xw1DFQAAAAJ,Pedro Moscoso Flores,Universidad Adolfo Ibáñez,uadolfoi,uai.cl,487,
10448777709790852446,zK7Tk5gAAAAJ,Felipe Uribe-Saavedra,"Professor of Digital Marketing, Universidad Adolfo Ibáñez",uadolfoi,uai.cl,464,Digital marketing social media marketing internet marketing e-marketing 
10448777709790852446,HCN1ZeEAAAAJ,Romina Torres,Universidad Adolfo Ibáñez,uadolfoi,uai.cl,445,cybersecurity characterizing ctf using data science decision making support systems using … 
10448777709790852446,yCePkkQAAAAJ,Pedro Montealegre,Universidad Adolfo Ibáñez,uadolfoi,uai.cl,440,Algorithms Distributed Computing Automata Networks Discrete Mathematics Theory of Computing 
10448777709790852446,Q1pUdbkAAAAJ,"Tatiane Marin, PhD.","Post-doctoral Researcher - Adolfo Ibáñez University, Chile",uadolfoi,edu.ua,437,Mining Engineering 
10448777709790852446,xv6OTQYAAAAJ,Néstor Sepúlveda,Universidad Adolfo Ibáñez,uadolfoi,uai.cl,410,Physics Biophysics Statistical mechanics 
10448777709790852446,LAmF-ZYAAAAJ,Fernanda Diaz-Castrillón,"Profesora de psicología,Universidad Adolfo Ibáñez",uadolfoi,uai.cl,403,Trastornos alimentarios obesidad e imagen corporal 
10448777709790852446,NFNyaIAAAAAJ,Miguel Romero Orth,"Faculty of Engineering and Science, Universidad Adolfo Ibáñez",uadolfoi,uai.cl,390,Algorithms Databases Logic in Computer Science Constraint Satisfaction 
10448777709790852446,QsVD1VwAAAAJ,Claudio Araya-Véliz,"Escuela de Psicología, Universidad Adolfo Ibañez",uadolfoi,uai.cl,387,common humanity relational enaction relational mindfulness compassion self-compassion 
10448777709790852446,bb4EWb0AAAAJ,Marcos E Gomez,"Associate Professor, Business School, Adolfo Ibáñez University",uadolfoi,uai.cl,375,Labor and unemployment dynamic modeling in macroeconomics Economics of Happiness and Well Being. 
10448777709790852446,Xx0b8R0AAAAJ,Francisca Sinn,"Associate Professor of Strategy and Family Business, Universidad Adolfo Ibañez",uadolfoi,uai.cl,374,strategy family business consumer behavior marketing 
10448777709790852446,Tv0U3ocAAAAJ,Michael Pedersen,"Academic Researcher, Business School, Universidad Adolfo Ibañéz",uadolfoi,uai.cl,368,Applied Macroeconomics Expectations Forecasting International Economics Monetary Economics. 
10448777709790852446,MrFi22oAAAAJ,Andres Peters,"Faculty of Engineering and Sciences, Universidad Adolfo Ibáñez",uadolfoi,uai.cl,364,Control Theory Performance Bounds String Stability Control of Multi-agent Systems 
10448777709790852446,dHfzR4IAAAAJ,Bernardo Lara E.,"School of Government, Universidad Adolfo Ibáñez",uadolfoi,uai.cl,362,Economics of education Public Economics 
10448777709790852446,iyabw8EAAAAJ,Francisco Parro,Universidad Adolfo Ibáñez,uadolfoi,uai.cl,346,Labor Economics\Human Capital … 
10448777709790852446,wye0yxsAAAAJ,Todd Pezzuti,Universidad Adolfo Ibañez,uadolfoi,uai.cl,343,Consumer Behavior International Marketing 
10448777709790852446,G8gvf14AAAAJ,David Martínez-Pernía,Centro de Neurociencia Social y Cognitiva (CSCN). Facultad de Psicología. Universidad …,uadolfoi,uai.cl,332,Empathy Enaction Embodied emotion Experimental phenomenology Neurophenomenology 
10448777709790852446,ZwAk9WMAAAAJ,Gianni Tallarita,Universidad Adolfo Ibáñez,uadolfoi,uai.cl,326,High Energy Theoretical Physics Vortices Solitons 
10448777709790852446,6ajqDZIAAAAJ,Rodrigo Hernández,Universidad Adolfo Ibáñez,uadolfoi,uai.cl,319,
10448777709790852446,fXywRK4AAAAJ,Javiera Barrera,Universidad Adolfo Ibáñez,uadolfoi,uai.cl,304,Stochastic Models Reliability Network Design Markov Chains 
10448777709790852446,CDjgEGIAAAAJ,Antonio Bascuñán Rodríguez,"Profesor de Derecho Penal y Teoría del Derecho, Universidad Adolfo Ibáñez",uadolfoi,uai.cl,299,Derecho Penal Filosofía del Derecho Teoría del Derecho Historia del Derecho Derecho Constitucional 
10448777709790852446,CIxiHJMAAAAJ,Maria Thomsen Solis,"Faculty of Engineering and Sciences, Universidad Adolfo Ibáñez",uadolfoi,uai.cl,285,Fire Science and Combustion 
10448777709790852446,kRDR_A4AAAAJ,Cristian Martinez-Villalobos,Universidad Adolfo Ibáñez,uadolfoi,uai.cl,281,Climate Science Tropical Climate Precipitation Ocean-Atmosphere coupling Stochastic modeling 
10448777709790852446,h-fiG1AAAAAJ,Alejandro Pereira,Universidad Adolfo Ibáñez,uadolfoi,uai.cl,280,Nanotechnology Material science Magnetism 
10448777709790852446,nfXZjscAAAAJ,Oscar Franchi,Universidad Adolfo Ibañez,uadolfoi,edu.ua,275,Biotechnology 
10448777709790852446,GJl7uesAAAAJ,Ariel A. Casarin,Universidad Adolfo Ibanez,uadolfoi,uai.cl,274,Industrial economics nonmarket stratategy 
10448777709790852446,AMAOzzsAAAAJ,Francisca Pérez,Universidad Adolfo Ibañez,uadolfoi,uai.cl,271,Psicología 
10448777709790852446,WGhKeO0AAAAJ,Rodrigo Ortega,"BrainLat, Universidad Adolfo Ibañez",uadolfoi,uai.cl,266,Cognitive Neuroscience Experimental Psychology 
10448777709790852446,UJqvdaoAAAAJ,Pablo Fernando Parra Torres,Universidad Adolfo Ibáñez,uadolfoi,uai.cl,254,Reinforced Concrete Structures Seismic Engineering 
10448777709790852446,ptsY5KsAAAAJ,Marco Montalva-Medel,"Profesor Asistente, Universidad Adolfo Ibáñez",uadolfoi,uai.cl,250,Sistemas dinámicos discretos redes booleanas autómatas teoría de grafos 
10448777709790852446,hTni7C0AAAAJ,Matias Garreton,Universidad Adolfo Ibanez,uadolfoi,uai.cl,234,urban studies 
10448777709790852446,SpYh8J0AAAAJ,Ricardo González,"Director LEAS, Universidad Adolfo Ibañez",uadolfoi,uai.cl,232,survey methods public opinion cross-cultural research 
10448777709790852446,kMqn6IYAAAAJ,Vicente Soto,Assistant Professor in Psychology Universidad Adolfo Ibañez,uadolfoi,uai.cl,227,Mobile EEG EEG Neuroimaging Cognitive Neuroscience Psychology 
10448777709790852446,OjZeQpUAAAAJ,Rodrigo Moreno Jeria,Universidad Adolfo Ibáñez,uadolfoi,uai.cl,224,Historia de la Cartografía viajes y exploraciones misiones jesuitas 
10448777709790852446,FSov1akAAAAJ,Antonia Viu,"Profesora Titular Facultad de Artes Liberales, Universidad Adolfo Ibáñez",uadolfoi,uai.cl,216,cultura impresa revistas latinoamericanas nuevos materialismos literatura latinoamericana Arqueología de los medios 
10448777709790852446,5iO4PYEAAAAJ,Claudia Darrigrandi N.,Universidad Adolfo Ibáñez,uadolfoi,uai.cl,199,literatura latinoamericana crónica latinoamericana revistas culturales 
10448777709790852446,5AQlC4EAAAAJ,Cristóbal Hernández,Universidad Adolfo Ibáñez,uadolfoi,edu.ua,199,Psychopathology Statistical Analyses Phenomenology 
10448777709790852446,O3DhVXMAAAAJ,Rodolfo Carvajal,"Escuela de Negocios, Universidad Adolfo Ibañez",uadolfoi,uai.cl,196,Mixed Linear Integer Programming Combinatorial Optimization Operations Research 
10448777709790852446,-bhakXkAAAAJ,David Choque,"Postdoc, Universidad Adolfo Ibañez",uadolfoi,edu.ua,188,Física de agujeros negros Astronomia 
10448777709790852446,hSvlZUkAAAAJ,Constanza Salgado,"Profesora de derecho, Universidad Adolfo Ibáñez",uadolfoi,uai.cl,165,teoría del derecho derecho constitucional filosofía política 
10448777709790852446,mvuFO5EAAAAJ,Claudia Arellano,Universidad Adolfo Ibañez,uadolfoi,uai.cl,165,Computer Vision Artificial Intelligence Pattern Recognition Robust Statistics 
10448777709790852446,2Eu1FocAAAAJ,Julio Riutort,"Assistant Professor of Finance, Universidad Adolfo Ibáñez",uadolfoi,uai.cl,159,Corporate Finance Corporate Investments Corporate Governance Individuals Financial Decisions 
10448777709790852446,XiWzEMQAAAAJ,Carla Ugarte,Universidad Adolfo Ibáñez,uadolfoi,uai.cl,157,Psicoterapia obesidad trastornos alimentarios cirugía bariátrica 
10448777709790852446,67k5XqMAAAAJ,Tamara Fernandez,"Assistant Professor, Adolfo Ibanez University",uadolfoi,uai.cl,156,Kernel methods non-parametric statistics 
10448777709790852446,F3rWBf4AAAAJ,Félix Villatoro,"Assistant Professor, Adolfo Ibáñez University",uadolfoi,uai.cl,151,Banking Economics Delegated Portfolio Management Pensions Reputation Household Finance 
10448777709790852446,G7jEmSoAAAAJ,Diego Melo Carrasco,Universidad Adolfo Ibáñez,uadolfoi,uai.cl,148,islam clásico al-Andalus Magreb Medieval Historia Medieval 
10448777709790852446,1MYxuQYAAAAJ,Manuel Délano,Profesor Universidad Adolfo Ibáñez,uadolfoi,uai.cl,142,Periodismo comunicaciones poder democracia 
10448777709790852446,MEuKp04AAAAJ,CT Rodriguez Hidalgo,Universidad Adolfo Ibañez,uadolfoi,uai.cl,141,Social network sites social robots emotion. 
10448777709790852446,_SUZL6QAAAAJ,Luis Caminos,Universidad Adolfo Ibañez,uadolfoi,uai.cl,140,Ingeniería mecanica 
