scholar_id_autor_gs,scholar_id_gs_coauthor,nombre_coauthor,cargo
X5xPjmkAAAAJ,-sul52cAAAAJ,Leopoldo García Franquelo,"Professor Dept. of Electronics Engineering, Universidad de Sevilla (University of Seville) …"
X5xPjmkAAAAJ,c9ql-BAAAAAJ,Marcelo A. Perez,Universidad Tecnica Federico Santa Maria
X5xPjmkAAAAJ,3itZwbsAAAAJ,Patricio Cortes,"Universidad Tecnica Federico Santa Maria, Chile"
X5xPjmkAAAAJ,7kF1RSMAAAAJ,Sebastian Rivera,Technische Universiteit Delft
X5xPjmkAAAAJ,9WeLp14AAAAJ,Venkata Yaramasu,"Associate Professor of Electrical Engineering, SICCS, Northern Arizona University, Flagstaff …"
X5xPjmkAAAAJ,h9hPvFMAAAAJ,Sergio Vazquez,Associate Professor (Universidad de Sevilla)
X5xPjmkAAAAJ,nv4fvLcAAAAJ,Mariusz Malinowski,Warsaw University of Technology (Politechnika Warszawska)
X5xPjmkAAAAJ,U1_r_C4AAAAJ,Christian Rojas,Universidad Tecnica Federico Santa Maria
X5xPjmkAAAAJ,-m31jK4AAAAJ,Ramon Portillo,Universidad de Sevilla
X5xPjmkAAAAJ,I2XhAOsAAAAJ,Navid Zargari,Rockwell Automation
X5xPjmkAAAAJ,w2atQtwAAAAJ,Dmitri Vinnikov,"Research Professor, Head of Power Electronics Group at TalTech, IEEE Fellow"
X5xPjmkAAAAJ,iAaZ5igAAAAJ,MEYNARD Thierry,Laboratoire LAPLACE - Université de Toulouse
X5xPjmkAAAAJ,uQ16sMcAAAAJ,Ricardo Lizana,Universidad Catolica de la Santisima Concepción
X5xPjmkAAAAJ,DevuWQQAAAAJ,Salvador Alepuz,Tecnocampus Mataró-Maresme (Universitat Pompeu Fabra)
X5xPjmkAAAAJ,TnbzESMAAAAJ,Maria Angeles Martin Prats,Associate Professor at University of Seville (Spain)
X5xPjmkAAAAJ,gggnQKsAAAAJ,Haithem Abu-Rub,"Professor, IEEE Fellow"
X5xPjmkAAAAJ,ImrRuDsAAAAJ,Pablo Lezana,Universidad Técnica Federico Santa Maria
X5xPjmkAAAAJ,04ViXpUAAAAJ,Nicolás Müller,"Assistant Professor, Universidad Austral de Chile"
X5xPjmkAAAAJ,zvLGLNgAAAAJ,Jaime Zapata Amores,Infineon Technologies
X5xPjmkAAAAJ,nTjCGdsAAAAJ,Josep Pou,Nanyang Technological University
X5xPjmkAAAAJ,onKbDaIAAAAJ,Margarita Norambuena,"Research-Professor, Universidad Tecnica Federico Santa Maria"
X5xPjmkAAAAJ,-0gRNgsAAAAJ,Cesar Silva,"Departamento de Electrónica, Universidad Técnica Federico Santa María, Chile"
X5xPjmkAAAAJ,innpWecAAAAJ,Freddy Flores-Bahamonde,Assistant Professor at Universidad Andrés Bello
X5xPjmkAAAAJ,0pPswyQAAAAJ,Apparao Dekka,"Assistant Professor, Lakehead University, Thunder Bay, Canada"
X5xPjmkAAAAJ,Ki0RnYIAAAAJ,Mario Duran,Universidad de Malaga
X5xPjmkAAAAJ,22sNqagAAAAJ,Gopakumar K,"Professor, Indian Institute of Science"
X5xPjmkAAAAJ,M-z9y1gAAAAJ,Mokhtar Aly,"Faculty of Engineering, Aswan University, 81542 Aswan, Egypt"
X5xPjmkAAAAJ,j-jb_N4AAAAJ,Juan Manuel Carrasco Solís,"Profesor Ingeniería Electrónica, Universidad de Sevilla"
X5xPjmkAAAAJ,Absa1W8AAAAJ,Alan Hjalmar Wilson Veas,Ph.D. student at Dresden University of Technology
X5xPjmkAAAAJ,YWNVjugAAAAJ,Carlos Fuentes,Technische Universität Dresden
X5xPjmkAAAAJ,KPeDsikAAAAJ,Mehdi Narimani,"Associate Professor and Canada Research Chair, McMaster University"
X5xPjmkAAAAJ,ux9B8SoAAAAJ,Sergio Busquets-Monge,Associate Professor - Electronic Engineering Dept. - UPC
X5xPjmkAAAAJ,_D9Deh8AAAAJ,Diana Lopez-Caiza,Universidad Andrés Bello
X5xPjmkAAAAJ,_9S74dUAAAAJ,Andrii Chub,Tallinn University of Technology
X5xPjmkAAAAJ,4SUUMGIAAAAJ,Hector Young,"Universidad de La Frontera, Temuco, Chile"
X5xPjmkAAAAJ,FOKLmaQAAAAJ,Marco Esteban Rivera Abarca,"Full Professor, Universidad de Talca - University of Nottingham UK"
X5xPjmkAAAAJ,4ZLhMR8AAAAJ,C. Restrepo,Universidad de Talca
X5xPjmkAAAAJ,oBfUNSYAAAAJ,CARLOS ALBERTO REUSSER FRANCK,"Profesor Asociado, Pontificia Universidad Católica de Valparaíso"
X5xPjmkAAAAJ,Wk2naEgAAAAJ,José R. Espinoza,"Professor, Electrical Engineering Department, Universidad de Concepción"
X5xPjmkAAAAJ,ewH61t8AAAAJ,Alejandro Calle-Prado,Universitat Politècnica de Catalunya
X5xPjmkAAAAJ,YdxlCSEAAAAJ,Catalina González Castaño,Universidad Andrés Bello Santiago-Chile
X5xPjmkAAAAJ,-cOE0hUAAAAJ,Tomislav Dragičević,"Professor, Technical University of Denmark"
X5xPjmkAAAAJ,8z38R2MAAAAJ,Pat Wheeler,University of Nottingham
X5xPjmkAAAAJ,EwIjpU4AAAAJ,Luis Morán,Concepcion University
X5xPjmkAAAAJ,vhdo2f8AAAAJ,FERNANDA CARNIELUTTI,Universidade Federal de Santa Maria
X5xPjmkAAAAJ,vtzf90EAAAAJ,Oleksandr Korkh,Tallinn University of Technology
X5xPjmkAAAAJ,I4xv9R8AAAAJ,Josep Bordonau,UPC-BarcelonaTech
X5xPjmkAAAAJ,s3Pw1nEAAAAJ,Enrique Romero-Cadaval,"School of Industrial Engineering. University of Extremadura. Badajoz, Spain"
X5xPjmkAAAAJ,z6F1QaoAAAAJ,Frede Blaabjerg,"Professor in Power Electronics, Villum Investigator, Aalborg University, Denmark"
X5xPjmkAAAAJ,kYH1O6kAAAAJ,Cristian Verdugo,Siemens Energy
X5xPjmkAAAAJ,DzYBPjoAAAAJ,Elena Villanueva,Trama TecnoAmbiental
X5xPjmkAAAAJ,XqAblVUAAAAJ,Oswaldo Menéndez,"Assistant Professor, Engineering Faculty, Universidad Andrés Bello"
X5xPjmkAAAAJ,SyIr8FUAAAAJ,Pericle Zanchetta,"Professor, University of Nottingham, UK"
X5xPjmkAAAAJ,9uW3Cv8AAAAJ,Peter Lehn,University of Toronto
X5xPjmkAAAAJ,LAt-hLgAAAAJ,Elizaveta Liivik,Tallinn University of Technology
X5xPjmkAAAAJ,B4ouwAgAAAAJ,Federico Barrero,"Electronic Engineering Department, Universidad de Sevilla (University of Seville), Spain"
X5xPjmkAAAAJ,0HM4KnQAAAAJ,Emil Levi,"Professor of Electric Machines and Drives, Liverpool John Moores University"
X5xPjmkAAAAJ,z2n3ZPcAAAAJ,Tobias Geyer,Corporate Executive Engineer ABB
X5xPjmkAAAAJ,GQrwseQAAAAJ,Daniel Pesántez,Universidad Técnica Fedérico Santa María
X5xPjmkAAAAJ,ecwhM0oAAAAJ,Roberto Cardenas,"Electrical Engineering Department, University of Chile"
X5xPjmkAAAAJ,4pWM03cAAAAJ,"Himanshu Aggrawal, Ph.D.",Apple Inc.
X5xPjmkAAAAJ,QF7PpzIAAAAJ,"Akshay Rathore, IEEE Fellow","Singapore Institute of Technology (SIT), Singapore"
X5xPjmkAAAAJ,vo65-zEAAAAJ,Marek Jasinski,Warsaw University of Technology
X5xPjmkAAAAJ,010wbxAAAAAJ,Pedro E. Melín C.,Department of Electrical and Electronic Engineering - University of Bío-Bío
X5xPjmkAAAAJ,ki2DjVkAAAAJ,Carlos R. Baier,"Departamento de Ingeniería Eléctrica, Universidad de Talca"
X5xPjmkAAAAJ,YwQuZr0AAAAJ,Javier Munoz,Universidad de Talca
X5xPjmkAAAAJ,BxOUKJoAAAAJ,Gustavo Bittner,Universidad Técnica Federico Santa María
X5xPjmkAAAAJ,tq6ihy0AAAAJ,Cristian Garcia,Universidad de Talca
X5xPjmkAAAAJ,71pwBGoAAAAJ,Martinez-Salamero L*,URV
X5xPjmkAAAAJ,xCs_TNIAAAAJ,Ottorino Veneri,National Research Council of Italy
X5xPjmkAAAAJ,h3DG6CcAAAAJ,Alvaro Liendo,Universidad de Talca
X5xPjmkAAAAJ,KZ5TMuAAAAAJ,Jose Rodriguez,"Professor, Engineering Faculty, Universidad San Sebastian"
X5xPjmkAAAAJ,VK95M7QAAAAJ,Jose I. Leon,University of Seville
X5xPjmkAAAAJ,-VZ6814AAAAJ,Abraham M. Alcaide,"Universidad de Sevilla, Dept. of Electronics Engineering, PowerUS"
X5xPjmkAAAAJ,jkHEZuoAAAAJ,Alejandro Weinstein,"Professor of Biomedical Engineering, Universidad de Valparaíso"
X5xPjmkAAAAJ,Yew8fIkAAAAJ,Elena Lomonova,"Prof.dr. Chair of Electromechanics and Power Electronics group, Eindhoven University of …"
X5xPjmkAAAAJ,c1VhcpIAAAAJ,Marian P. Kazmierkowski,Profesor in Power Electronics and Drives
X5xPjmkAAAAJ,v8mtsBsAAAAJ,Clemente Capasso,CNR. Institute of Bioscience and Bioresources (IBBR)
X5xPjmkAAAAJ,glxar60AAAAJ,Fernando A. Auat Cheein,
X5xPjmkAAAAJ,1pJSaQYAAAAJ,Ricardo P. Aguilera,"Associate Professor, University of Technology Sydney, Australia"
X5xPjmkAAAAJ,A-I5jcgAAAAJ,Giovanni Spagnuolo,"Professor, University of Salerno, Italy"
X5xPjmkAAAAJ,zKVI7EIAAAAJ,"Dixon, Juan W.","Ingeniería Eléctrica, Pontificia Universidad Catolica de Chile"
c9ql-BAAAAAJ,X5xPjmkAAAAJ,Samir Kouro,Universidad Técnica Federico Santa María
c9ql-BAAAAAJ,Wk2naEgAAAAJ,José R. Espinoza,"Professor, Electrical Engineering Department, Universidad de Concepción"
c9ql-BAAAAAJ,nv4fvLcAAAAJ,Mariusz Malinowski,Warsaw University of Technology (Politechnika Warszawska)
c9ql-BAAAAAJ,-sul52cAAAAJ,Leopoldo García Franquelo,"Professor Dept. of Electronics Engineering, Universidad de Sevilla (University of Seville) …"
c9ql-BAAAAAJ,uQ16sMcAAAAJ,Ricardo Lizana,Universidad Catolica de la Santisima Concepción
c9ql-BAAAAAJ,nTjCGdsAAAAJ,Josep Pou,Nanyang Technological University
c9ql-BAAAAAJ,4SUUMGIAAAAJ,Hector Young,"Universidad de La Frontera, Temuco, Chile"
c9ql-BAAAAAJ,22sNqagAAAAJ,Gopakumar K,"Professor, Indian Institute of Science"
c9ql-BAAAAAJ,ki2DjVkAAAAJ,Carlos R. Baier,"Departamento de Ingeniería Eléctrica, Universidad de Talca"
c9ql-BAAAAAJ,U1_r_C4AAAAJ,Christian Rojas,Universidad Tecnica Federico Santa Maria
c9ql-BAAAAAJ,0pPswyQAAAAJ,Apparao Dekka,"Assistant Professor, Lakehead University, Thunder Bay, Canada"
c9ql-BAAAAAJ,3itZwbsAAAAJ,Patricio Cortes,"Universidad Tecnica Federico Santa Maria, Chile"
c9ql-BAAAAAJ,ImrRuDsAAAAJ,Pablo Lezana,Universidad Técnica Federico Santa Maria
c9ql-BAAAAAJ,-m31jK4AAAAJ,Ramon Portillo,Universidad de Sevilla
c9ql-BAAAAAJ,gggnQKsAAAAJ,Haithem Abu-Rub,"Professor, IEEE Fellow"
c9ql-BAAAAAJ,1pJSaQYAAAAJ,Ricardo P. Aguilera,"Associate Professor, University of Technology Sydney, Australia"
c9ql-BAAAAAJ,iAaZ5igAAAAJ,MEYNARD Thierry,Laboratoire LAPLACE - Université de Toulouse
c9ql-BAAAAAJ,I2XhAOsAAAAJ,Navid Zargari,Rockwell Automation
c9ql-BAAAAAJ,010wbxAAAAAJ,Pedro E. Melín C.,Department of Electrical and Electronic Engineering - University of Bío-Bío
c9ql-BAAAAAJ,6O2aO7IAAAAJ,Miguel Torres,"Instituto de Ciencias de la Ingeniería, Universidad de O'Higgins"
c9ql-BAAAAAJ,XqAblVUAAAAJ,Oswaldo Menéndez,"Assistant Professor, Engineering Faculty, Universidad Andrés Bello"
c9ql-BAAAAAJ,aa-NCokAAAAJ,Jaime Addin Rohten,Universidad del Bío-Bío
c9ql-BAAAAAJ,YwQuZr0AAAAJ,Javier Munoz,Universidad de Talca
c9ql-BAAAAAJ,TnbzESMAAAAJ,Maria Angeles Martin Prats,Associate Professor at University of Seville (Spain)
c9ql-BAAAAAJ,zvLGLNgAAAAJ,Jaime Zapata Amores,Infineon Technologies
c9ql-BAAAAAJ,innpWecAAAAJ,Freddy Flores-Bahamonde,Assistant Professor at Universidad Andrés Bello
c9ql-BAAAAAJ,FOKLmaQAAAAJ,Marco Esteban Rivera Abarca,"Full Professor, Universidad de Talca - University of Nottingham UK"
c9ql-BAAAAAJ,s0MIz4sAAAAJ,Daniel E. Quevedo,Queensland University of Technology
c9ql-BAAAAAJ,EwIjpU4AAAAJ,Luis Morán,Concepcion University
c9ql-BAAAAAJ,c1VhcpIAAAAJ,Marian P. Kazmierkowski,Profesor in Power Electronics and Drives
c9ql-BAAAAAJ,xMmVZ4sAAAAJ,Johan Guzman,Profesor Asociado Departamento de Ingeniería Eléctrica Universidad del Bío Bío
c9ql-BAAAAAJ,-0gRNgsAAAAJ,Cesar Silva,"Departamento de Electrónica, Universidad Técnica Federico Santa María, Chile"
c9ql-BAAAAAJ,YWNVjugAAAAJ,Carlos Fuentes,Technische Universität Dresden
c9ql-BAAAAAJ,h9hPvFMAAAAJ,Sergio Vazquez,Associate Professor (Universidad de Sevilla)
c9ql-BAAAAAJ,SyIr8FUAAAAJ,Pericle Zanchetta,"Professor, University of Nottingham, UK"
c9ql-BAAAAAJ,1jf5n5wAAAAJ,Romeo Ortega,Full Professor at ITAM
c9ql-BAAAAAJ,wdTi3S0AAAAJ,Geza Joos,"Professor of Electrical Engineering, McGill University"
c9ql-BAAAAAJ,b1UsMiEAAAAJ,Daniel G. Sbarbaro-Hofer,Professor
c9ql-BAAAAAJ,8z38R2MAAAAJ,Pat Wheeler,University of Nottingham
c9ql-BAAAAAJ,NyG0GBgAAAAJ,Luca Tarisciotti,Universidad Andres Bello
c9ql-BAAAAAJ,9WeLp14AAAAJ,Venkata Yaramasu,"Associate Professor of Electrical Engineering, SICCS, Northern Arizona University, Flagstaff …"
c9ql-BAAAAAJ,ecwhM0oAAAAJ,Roberto Cardenas,"Electrical Engineering Department, University of Chile"
c9ql-BAAAAAJ,kYH1O6kAAAAJ,Cristian Verdugo,Siemens Energy
c9ql-BAAAAAJ,SlOD0lIAAAAJ,Maryam Saeedifard,"Associate Professor of Electrical Engineering, Georgia Institute of Technology"
c9ql-BAAAAAJ,zKVI7EIAAAAJ,"Dixon, Juan W.","Ingeniería Eléctrica, Pontificia Universidad Catolica de Chile"
c9ql-BAAAAAJ,mCvZPDn8heUC,Jon Clare,"Professor of Power Electronics, Nottingham University"
c9ql-BAAAAAJ,VK95M7QAAAAJ,Jose I. Leon,University of Seville
c9ql-BAAAAAJ,KZ5TMuAAAAAJ,Jose Rodriguez,"Professor, Engineering Faculty, Universidad San Sebastian"
c9ql-BAAAAAJ,PWvm-uEAAAAJ,Tim C Green,Imperial College London
c9ql-BAAAAAJ,67H3HyIAAAAJ,ruben pena,"university of nottingham, university of magallanes, university of concepcion"
c9ql-BAAAAAJ,glxar60AAAAJ,Fernando A. Auat Cheein,
c9ql-BAAAAAJ,-VZ6814AAAAJ,Abraham M. Alcaide,"Universidad de Sevilla, Dept. of Electronics Engineering, PowerUS"
3itZwbsAAAAJ,X5xPjmkAAAAJ,Samir Kouro,Universidad Técnica Federico Santa María
3itZwbsAAAAJ,-0gRNgsAAAAJ,Cesar Silva,"Departamento de Electrónica, Universidad Técnica Federico Santa María, Chile"
3itZwbsAAAAJ,-sul52cAAAAJ,Leopoldo García Franquelo,"Professor Dept. of Electronics Engineering, Universidad de Sevilla (University of Seville), Spain"
3itZwbsAAAAJ,h9hPvFMAAAAJ,Sergio Vazquez,Associate Professor (Universidad de Sevilla)
3itZwbsAAAAJ,s0MIz4sAAAAJ,Daniel E. Quevedo,Queensland University of Technology
3itZwbsAAAAJ,c1VhcpIAAAAJ,Marian P. Kazmierkowski,Profesor in Power Electronics and Drives
3itZwbsAAAAJ,c9ql-BAAAAAJ,Marcelo A. Perez,Universidad Tecnica Federico Santa Maria
3itZwbsAAAAJ,mfnr2oEAAAAJ,Juan I. Yuz,Universidad Tecnica Federico Santa Maria
3itZwbsAAAAJ,KZ5TMuAAAAAJ,Jose Rodriguez,"Professor, Engineering Faculty, Universidad San Sebastian"
3itZwbsAAAAJ,VK95M7QAAAAJ,Jose I. Leon,University of Seville
-0gRNgsAAAAJ,ImrRuDsAAAAJ,Pablo Lezana,Universidad Técnica Federico Santa Maria
-0gRNgsAAAAJ,3itZwbsAAAAJ,Patricio Cortes,"Universidad Tecnica Federico Santa Maria, Chile"
-0gRNgsAAAAJ,8oLJHBsAAAAJ,asher gm,professor university of nottingham
-0gRNgsAAAAJ,U1_r_C4AAAAJ,Christian Rojas,Universidad Tecnica Federico Santa Maria
-0gRNgsAAAAJ,Wk2naEgAAAAJ,José R. Espinoza,"Professor, Electrical Engineering Department, Universidad de Concepción"
-0gRNgsAAAAJ,fTrjc7kAAAAJ,Mark Sumner,"Professor of Electrical Energy Systems, University of Nottingham, UK"
-0gRNgsAAAAJ,X5xPjmkAAAAJ,Samir Kouro,Universidad Técnica Federico Santa María
-0gRNgsAAAAJ,DevuWQQAAAAJ,Salvador Alepuz,Tecnocampus Mataró-Maresme (Universitat Pompeu Fabra)
-0gRNgsAAAAJ,mfnr2oEAAAAJ,Juan I. Yuz,Universidad Tecnica Federico Santa Maria
-0gRNgsAAAAJ,8z38R2MAAAAJ,Pat Wheeler,University of Nottingham
-0gRNgsAAAAJ,SyIr8FUAAAAJ,Pericle Zanchetta,"Professor, University of Nottingham, UK"
-0gRNgsAAAAJ,s0MIz4sAAAAJ,Daniel E. Quevedo,Queensland University of Technology
-0gRNgsAAAAJ,tq6ihy0AAAAJ,Cristian Garcia,Universidad de Talca
-0gRNgsAAAAJ,udxw8eUAAAAJ,Antoni Arias,"Associate Professor, Universitat Politècnica de Catalunya"
-0gRNgsAAAAJ,c9ql-BAAAAAJ,Marcelo A. Perez,Universidad Tecnica Federico Santa Maria
-0gRNgsAAAAJ,ux9B8SoAAAAJ,Sergio Busquets-Monge,Associate Professor - Electronic Engineering Dept. - UPC
-0gRNgsAAAAJ,5lXOzcIAAAAJ,Sergio A. Diaz,Advanced Center of Electrical and Electronic Engineering
-0gRNgsAAAAJ,FOKLmaQAAAAJ,Marco Esteban Rivera Abarca,"Full Professor, Universidad de Talca - University of Nottingham UK"
-0gRNgsAAAAJ,010wbxAAAAAJ,Pedro E. Melín C.,Department of Electrical and Electronic Engineering - University of Bío-Bío
-0gRNgsAAAAJ,mCvZPDn8heUC,Jon Clare,"Professor of Power Electronics, Nottingham University"
-0gRNgsAAAAJ,ecwhM0oAAAAJ,Roberto Cardenas,"Electrical Engineering Department, University of Chile"
-0gRNgsAAAAJ,-Fkz0PwAAAAJ,Andrés Mora,"Associate Professor, Electrical Engineering Department, Universidad Técnica Federico …"
-0gRNgsAAAAJ,KZ5TMuAAAAAJ,Jose Rodriguez,"Professor, Engineering Faculty, Universidad San Sebastian"
-0gRNgsAAAAJ,nocN5IsAAAAJ,Esteban Fuentes,Widex A/S
-0gRNgsAAAAJ,_ZXZKREAAAAJ,Eduardo Espinosa Neira,Universidad Católica de la Santísima Concepción - Depto. de Ing. Eléctrica - Profesor …
KsLLafwAAAAJ,BQcTIkIAAAAJ,Beatriz Camara,Universidad Tecnica Federico Santa Maria
KsLLafwAAAAJ,dlddUx0AAAAJ,Marcela Hernández,"Royal Society Dorothy Hodgkin Research Fellow, University of East Anglia"
KsLLafwAAAAJ,nRaFayMAAAAJ,Sebastián Fuentes Alburquenque,Universidad Bernardo O'Higgins
KsLLafwAAAAJ,4IeelMIAAAAJ,Kenneth Timmis,"Professor of Microbiology, TU Braunschweig"
KsLLafwAAAAJ,BJ_0jToAAAAJ,Edward RB Moore,Sahlgrenska Academy of the University of Gothenburg and CCUG - Department of Clinical …
KsLLafwAAAAJ,G6WtoyYAAAAJ,Pamela Villegas-Pizarro,PhD student UTEM
KsLLafwAAAAJ,Kk6Y__gAAAAJ,Carlos A Jerez,"Professor of Microbiology, University of Chile"
KsLLafwAAAAJ,ak0cZtYAAAAJ,Francisca Acevedo,Universidad de La Frontera
KsLLafwAAAAJ,IJn0d1wAAAAJ,Roberto E. Durán,"Research Assistant, Universidad Técnica Federico Santa María"
KsLLafwAAAAJ,xPJ06aMAAAAJ,Danilo Pérez Pantoja,Universidad Tecnológica Metropolitana
KsLLafwAAAAJ,bCJzaJcAAAAJ,Agustina Undabarrena,Universidad Técnica Federico Santa María
KsLLafwAAAAJ,tMK_hX8AAAAJ,Francisco Salvà-Serra,University of Gothenburg
KsLLafwAAAAJ,lSbD6y8AAAAJ,Bernardo González,Universidad Adolfo Ibáñez. Universidad Católica de Chile
KsLLafwAAAAJ,qUMntLgAAAAJ,Roberto Orellana,Universidad de Playa Ancha
KsLLafwAAAAJ,BUZgFMUAAAAJ,Francisco Montero-Silva,ChemNanoChem SpA
KsLLafwAAAAJ,SenQVWoAAAAJ,Carolina Yáñez,Pontificia Universidad Católica de Valparaíso
KsLLafwAAAAJ,dh1EMl0AAAAJ,Daniel Jaén-Luchoro,"Department of Infectious Diseases, Institute for Biomedicine, Sahlgrenska Academy of the …"
KsLLafwAAAAJ,8tSFHHwAAAAJ,Patricia Aguila-Torres,"Escuela de Tecnología Médica, Universidad Austral de Chile"
KsLLafwAAAAJ,OvObWvMAAAAJ,Carolina Parra González,Universidad Técnica Federico Santa María
KsLLafwAAAAJ,7a4LCp4AAAAJ,Alejandro Dinamarca,"Director CMBi, Universidad de Valparaíso"
KsLLafwAAAAJ,Q2P4D4wAAAAJ,Francisco Cereceda-Balic,Professor Universidad Tecnica Federico Santa Maria
KsLLafwAAAAJ,nVZKx3QAAAAJ,Andrea Franzetti,University of Milano - Bicocca
KsLLafwAAAAJ,8BtP4gIAAAAJ,Mariella Rivas,Universidad de Antofagasta
KsLLafwAAAAJ,2mFt-0MAAAAJ,David Holmes,"Director, Center for Bioinformatics and Genome Biology, Fundacion Ciencia y Vida"
KsLLafwAAAAJ,ET-Zm3oAAAAJ,Laura Rodríguez-Castro,University of Wisconsin-Madison
KsLLafwAAAAJ,5p13znkAAAAJ,CANCHIGNIA MARTINEZ HAYRON FABRICIO,Universidad Técnica Estatal de Quevedo
KsLLafwAAAAJ,sa8zURMAAAAJ,Juan A. Ugalde,"Center for Bioinformatics and Integrative Biology, Universidad Andres Bello"
KsLLafwAAAAJ,BUliBqIAAAAJ,Erwin Strahsburger,"Assistant Project Scientist, Dr. Philip Felgner Laboratory, Physiology and Biophysics …"
KsLLafwAAAAJ,PUAhekgAAAAJ,Eduardo Castro-Nallar,Universidad de Talca
KsLLafwAAAAJ,Zt0QlJoAAAAJ,Raymond J. Turner,"University of Calgary, Alberta, Canada"
KsLLafwAAAAJ,gvhbe4UAAAAJ,David Jeison,"Department of Chemical Engineering, Universidad de La Frontera"
KsLLafwAAAAJ,FrKvNOYAAAAJ,Cristian Ramirez,"Académico, Universidad Tecnica Federico Santa María"
KsLLafwAAAAJ,RRCqUogAAAAJ,Marcos Flores,Universidad de Chile
KsLLafwAAAAJ,c_m4HpkAAAAJ,Carolina Garín Correa,"Profesora de Química, Universidad Técnica Federico Santa María"
KsLLafwAAAAJ,sOwQV4AAAAAJ,Mónica Vásquez,"Associate Professor, P. Universidad Catolica de Chile"
KsLLafwAAAAJ,0pbATbcAAAAJ,Ramon Rossello-Mora,IMEDEA (CSIC-UIB)
KsLLafwAAAAJ,8wv9sLkAAAAJ,J Gregory Caporaso,Northern Arizona University
KsLLafwAAAAJ,9OqZhQcAAAAJ,Manuela Giovannetti,"Professore ordinario di Microbiologia Agraria, Università di Pisa"
KsLLafwAAAAJ,yd51DLsAAAAJ,Claudio D'Onofrio,"Assistant professor, University of Pisa"
KsLLafwAAAAJ,QyCzrYcAAAAJ,MARA XIMENA CEA LEMUS,"Profesor Asistente, Universidad de La Frontera"
KsLLafwAAAAJ,lnDX_D8AAAAJ,Nicolas Guiliani,"Profesor of Microbiology and Biotechnology, Facultad de Ciencias, Universidad de Chile"
KsLLafwAAAAJ,jSCcUycAAAAJ,Ingrid Nicole Vasconez Hurtado,"Estudiante Doctorado en Biotecnología, Universidad Técnica Federico Santa María …"
KsLLafwAAAAJ,RfGKP34AAAAJ,José Luis Campos,"Facultad de Ingeniería y Ciencias, Universidad Adolfo Ibáñez"
KsLLafwAAAAJ,YmIVwwwAAAAJ,Carolina Mascayano Collado,"Profesor Química Orgánica y Bioinformática Estructural, Universidad de Santiago de Chile"
KsLLafwAAAAJ,KLpE0k0AAAAJ,Mauricio González,"Profesor titular, Universidad de Chile"
KsLLafwAAAAJ,UxUguEsAAAAJ,tomas arredondo,ncipher security
KsLLafwAAAAJ,jAaJQ1MAAAAJ,Lioubov Dombrovskaia,Universidad Técnica Federico Santa María
KsLLafwAAAAJ,C1aXAaIAAAAJ,Jonathan Correa Puerta,Universidad Técnica Federico Santa María
KsLLafwAAAAJ,844ShOYAAAAJ,Zhongjun Jia,"Institute of Soil Science, Chinese Academy of Sciences"
KsLLafwAAAAJ,mb_L_nwAAAAJ,Milko A. Jorquera,"Scientific and Technological Bioresource Nucleus (BIOREN), Universidad de La Frontera …"
KsLLafwAAAAJ,254iajwAAAAJ,Nelson Durán,"Instituto de Química, Universidade Estadual de Campinas,"
KsLLafwAAAAJ,e1aFSeoAAAAJ,Monica Agnolucci,"Researcher, Department of Agriculture, Food and Environment (DAFE) University of Pisa"
KsLLafwAAAAJ,JaW8L3cAAAAJ,Verónica Cambiazo,"INTA, Universidad de Chile"
KsLLafwAAAAJ,32PWKUQAAAAJ,"Alexis Gaete, PhD","Laboratorio de Bioinformática y Expresión Génica, Instituto de Nutrición y Tecnología de los"
KsLLafwAAAAJ,PC3P6PYAAAAJ,Dinka Mandakovic Seyler,"Assistant Professor, GEMA Center for Genomics, Ecology & Environment, Universidad …"
KsLLafwAAAAJ,Jbn8cyAAAAAJ,Mirian Domenech Lucas. ORCID:0000-0002-0942-8180,"Profesora de Microbiología, Universidad Complutense de Madrid"
KsLLafwAAAAJ,-Ckik0MAAAAJ,Felipe Aguilera Millacura,"PhD in Quantitative Biology, Biochemistry and Biotechnology"
KsLLafwAAAAJ,RSPoIt0AAAAJ,Alejandro Martín Madrid Villegas,"Academico, Departamento de Química, Universidad de Playa Ancha"
KsLLafwAAAAJ,t-ZJvWQAAAAJ,Jose L. Sericano,Geochemical and Environmental Research Group (GERG)
KsLLafwAAAAJ,WT3Z4BgAAAAJ,Mario Tello,USACH
KsLLafwAAAAJ,mWNe4AkAAAAJ,Humberto Prieto Encalada,INIA La Platina Chile
KsLLafwAAAAJ,psy143EAAAAJ,Arturo Ferreira,Universidad de Chile
KsLLafwAAAAJ,NK44AZoAAAAJ,Juan C. Aguillon,Professor of Immunology at University of Chile
KsLLafwAAAAJ,9kzuYf0AAAAJ,Verónica Morgante,
_6PE3GsAAAAJ,R5zOxJcAAAAJ,Luc Thévenaz,"Professor at EPFL Ecole Polytechnique Fédérale de Lausanne, School of Engineering …"
_6PE3GsAAAAJ,pRJpcPMAAAAJ,Gabriele Bolognini,"Research Director, Consiglio Nazionale delle Ricerche, Italy"
_6PE3GsAAAAJ,Q6jCbxsAAAAJ,Fabrizio Di Pasquale,Scuola Superiore Sant'Anna Pisa
_6PE3GsAAAAJ,c6SIO8sAAAAJ,Miguel Gonzalez-Herraez,"Professor of Electronics, Universidad de Alcala"
_6PE3GsAAAAJ,gigMq7UAAAAJ,Zhisheng Yang,Beijing University of Posts and Telecommunications
_6PE3GsAAAAJ,Zb16aUoAAAAJ,Sonia Martin-Lopez,"Associate Researcher, Electronics Department, Alcala University"
_6PE3GsAAAAJ,4fkw1A8AAAAJ,Mehdi Alem,Zurich Instruments
_6PE3GsAAAAJ,kAYqyfgAAAAJ,Andrey Denisov,
_6PE3GsAAAAJ,ZDzAUm0AAAAJ,Armand Vedadi,LyteLoop Technologies
_6PE3GsAAAAJ,ekPiTVcAAAAJ,Camille-Sophie Bres,"Professor of Electrical Engineering, EPFL"
_6PE3GsAAAAJ,6Gt7t9UAAAAJ,Mohammad Amin Shoaie,ABB
_6PE3GsAAAAJ,aiv2KiUAAAAJ,Thomas Schneider,"TU-Braunschweig, Braunschweig, THz-Photonics Group, IHF, Professor High Frequency …"
_6PE3GsAAAAJ,_w8bpncAAAAJ,Hugo F. Martins,CSIC
_6PE3GsAAAAJ,8msHZEkAAAAJ,Alejandro Dominguez-Lopez,InPhoTech Sp. z. oo
_6PE3GsAAAAJ,VjPS7wUAAAAJ,Stefano Faralli,Scuola Superiore Sant'Anna - Pisa
_6PE3GsAAAAJ,QOVkRLcAAAAJ,Desmond Chow Ming Chia (Desmond M. Chow),"Harvard Medical School, Massachusetts General Hospital"
_6PE3GsAAAAJ,oUMtkN4AAAAJ,Juan Diego Ania-Castanon,"Instituto de Óptica, CSIC"
_6PE3GsAAAAJ,eaGV99sAAAAJ,Ming Tang,Huazhong University of Science and Technology
_6PE3GsAAAAJ,cMFgp7wAAAAJ,Li Zhang,ISTITUTO ITALIANO DI TECNOLOGIA
_6PE3GsAAAAJ,0UVoDd0AAAAJ,Pedro Corredera,Investigador Cientifico (CSIC)
_6PE3GsAAAAJ,rKVIBDsAAAAJ,Javier Urricelqui,"Ph.D. student, Universidad Pública de Navarra"
_6PE3GsAAAAJ,J-YM4zIAAAAJ,Luis Costa,NASA Jet Propulsion Laboratory
_6PE3GsAAAAJ,yQN-jLgAAAAJ,Liang Zhang,"Department of Physics, University of Ottawa"
_6PE3GsAAAAJ,SAONF7QAAAAJ,Jean-Charles Beugnot,"Researcher, CNRS FEMTO-ST"
_6PE3GsAAAAJ,88GLpzgAAAAJ,Salvador Sales,"ITEAM Research Institute, Universitat Politecnica de Valencia"
_6PE3GsAAAAJ,zgO1NUwAAAAJ,David Barrera,Universitat Politècnica de València
_6PE3GsAAAAJ,NjubmPcAAAAJ,Amelia Lavinia Ricchiuti,Sant'Anna School of Advanced Studies - Turbomachinery Sensor Technology Lab - GE Oil & …
_6PE3GsAAAAJ,h-djikAAAAAJ,Alayn Loayssa,"Full Professor (Catedrático de Universidad), Universidad Pública de Navarra, Spain"
_6PE3GsAAAAJ,dAb4rGkAAAAJ,Kenny Hey Tow,Research Institutes of Sweden
_6PE3GsAAAAJ,R4CwaBAAAAAJ,Luca Palmieri,"Department of Information Engineering, University of Padova"
_6PE3GsAAAAJ,hXe2wUUAAAAJ,Thibaut Sylvestre,"CNRS, FEMTO-ST, Université Bourgogne Franche-Comté, Besancon, France"
_6PE3GsAAAAJ,_GB05BoAAAAJ,Miguel Llera,Haute Ecole Arc Ingénierie
_6PE3GsAAAAJ,iFCwKakAAAAJ,Martin Rochette,Professor
_6PE3GsAAAAJ,F71eBoUAAAAJ,Zinan Wang（王子南）,University of Electronic Science and Technology of China
_6PE3GsAAAAJ,4qQYONgAAAAJ,Xin Lu,Bundesanstalt für Materialforschung und -prüfung
fmh3SNcAAAAJ,ZB8zKToAAAAJ,Alexander I. Boldyrev,"Professor of Chemistry, Utah State University"
fmh3SNcAAAAJ,eQFN1ewAAAAJ,Lai-Sheng Wang,"Professor of Chemistry, Brown University"
fmh3SNcAAAAJ,ERMV-5YAAAAJ,Djamaladdin Musaev,"Director, Emerson Center, Emory University"
fmh3SNcAAAAJ,OaaEzqUAAAAJ,Geletii Y,"senior scientist, Emory university"
fmh3SNcAAAAJ,7KmC2BcAAAAJ,Craig L. Hill,"Goodrich C. White Professor of Science, Emory University"
fmh3SNcAAAAJ,I28RZQQAAAAJ,Hua-Jin Zhai,"Institute of Molecular Science, Shanxi University, Taiyuan 030006, China"
fmh3SNcAAAAJ,jklUYKAAAAAJ,Dr. Muhammad Nawaz Tahir,"Department of Physics, University of Sargodha, Pakistan"
fmh3SNcAAAAJ,GNHgeN4AAAAJ,Dr. Muhammad Ashfaq,"Mohi-ud-Din Islamic University MIU NS, AJK, PAKISTAN"
fmh3SNcAAAAJ,KgKFL7UAAAAJ,Akbar Ali,"Government College University Faisalabad, Pakistan"
fmh3SNcAAAAJ,YjeEt_kAAAAJ,ivan cole,RMIT
