scholar_id_autor_gs,scholar_id_gs_coauthor,nombre_coauthor,cargo
u9RxxCgAAAAJ,h9ECWD4AAAAJ,Carla Fardella,Universidad Andres Bello
u9RxxCgAAAAJ,FGQplIIAAAAJ,Guillermo Rivera-Aguilera,Pontificia Universidad Católica de Valparaíso
u9RxxCgAAAAJ,dkfTY7oAAAAJ,Nelson Lay Raby,Universidad Andrés Bello
u9RxxCgAAAAJ,nI9ka7MAAAAJ,"Arthur Arruda Leal Ferreira, Arthur Lea...","Programa de Pós-Graduação em Psicologia/UFRJ, Programa de Pós-Graduação em Psicologia/UFF, Programa"
u9RxxCgAAAAJ,SY_sh7MAAAAJ,Jorge Castillo Sepúlveda,Universidad de Santiago de Chile
u9RxxCgAAAAJ,BX9nOQgAAAAJ,Ozan Nadir Alakavuklar,"Associate Professor, Utrecht University, School of Governance"
zGp10LEAAAAJ,C1aXAaIAAAAJ,Jonathan Correa Puerta,Universidad Técnica Federico Santa María
zGp10LEAAAAJ,tT9xoAcAAAAJ,Pablo Ferrada,Universidad de Antofagasta
zGp10LEAAAAJ,gQGZILQAAAAJ,Tomas P. Corrales,Universidad Tecnica Federico Santa Maria
zGp10LEAAAAJ,FrKvNOYAAAAJ,Cristian Ramirez,"Académico, Universidad Tecnica Federico Santa María"
q5gQNvIAAAAJ,TP1lGM8AAAAJ,Daniel Sarabia,Universidad de Burgos (Área de Ingeniería de Sistemas y Automática)
q5gQNvIAAAAJ,nLqvy7EAAAAJ,gloria gutiérrez rodríguez,"Profesora Titular, Universidad de Valladolid"
q5gQNvIAAAAJ,1dp-SB4AAAAJ,Paulina Quintanilla,Imperial College London
q5gQNvIAAAAJ,GJfhGnkAAAAJ,Raquel Lebrero,"Profesora, Universidad de Valladolid"
q5gQNvIAAAAJ,bg290LcAAAAJ,Andrea Carvajal,Universidad Técnica Federico Santa María
q5gQNvIAAAAJ,DUKAx64AAAAJ,Raul Muñoz (ORCID:0000-0003-1207...,Universidad de Valladolid
q5gQNvIAAAAJ,6vyFk4YAAAAJ,Francisco Cubillos,Academico Departamento de Ingeniería Quimica
q5gQNvIAAAAJ,J7BYrD8AAAAJ,Rebeca Pérez,"Investigador Postdoctoral, Universidad de Valladolid"
q5gQNvIAAAAJ,wqiTfvkAAAAJ,İlker Akmirza,gebze technical university
q5gQNvIAAAAJ,ZcH_ZVYAAAAJ,Cesar  De Prada Moraga,Universidad de Valladolid
bZdX3swAAAAJ,mYWIQd4AAAAJ,Patricio Vargas,"Professor of Theoretical Physics, Universidad Tecnica Federico Santa Maria"
bZdX3swAAAAJ,k2oQ2A4AAAAJ,Carlos Garcia Garcia,"Universidad Tecnica Federico Santa Maria, Department of Physics, Chile"
bZdX3swAAAAJ,_NBjk50AAAAJ,Shyue Ping Ong,University of California San Diego
bZdX3swAAAAJ,6hb8uZQAAAAJ,J Mazo-Zuluaga,"Full Professor, Instituto de Física, Universidad de Antioquia"
bZdX3swAAAAJ,v2QWCzQAAAAJ,Mehmet Cengiz Onbasli,Massachusetts Institute of Technology
bZdX3swAAAAJ,ouI_OfgAAAAJ,Nicolas Aimon,Massachusetts Institute of Technology
bZdX3swAAAAJ,IyLcfaQAAAAJ,Mario N. Baibich,Instituto de Fisica UFRGS
bZdX3swAAAAJ,JWhuEBoAAAAJ,Johans Restrepo Cárdenas,"Professor, Instituto de fisica, Universidad de Antioquia"
bZdX3swAAAAJ,96J6vbAAAAAJ,Gerbrand Ceder,Professor of Materials Science and Engineering
bZdX3swAAAAJ,tVPKxHYAAAAJ,Dong Hun Kim,Myongji University
bZdX3swAAAAJ,LphcJRUAAAAJ,Alvaro S.  Nunez,Universidad de Chile
bZdX3swAAAAJ,mvF864kAAAAJ,Gerardo Martinez,"Professor de Física, Universidade Federal do Rio Grande do Sul"
bZdX3swAAAAJ,sKyeMmUAAAAJ,Oscar Negrete,Universidad Técnica Federico Santa María
bZdX3swAAAAJ,4369OH0AAAAJ,Andrea León,Technische Universität Dresden
bZdX3swAAAAJ,Bl6zhuYAAAAJ,Taichi Goto,Tohoku University
bZdX3swAAAAJ,6z12KzAAAAAJ,JMD Coey,"Professor Emeritus, Trinity College Dublin"
bZdX3swAAAAJ,QlI2LbgAAAAJ,Éver Alberto Velásquez Sierra,"Profesor Titular, Universidad de Medellín"
bZdX3swAAAAJ,khHrYvkAAAAJ,Francisco J. Peña,"Young Researcher, Universidad Técnica Federico Santa María"
bZdX3swAAAAJ,zA1CzoQAAAAJ,Herley Fernando Casanova Yepes,"Instituto de Química, Universidad de Antioquia"
bZdX3swAAAAJ,W_-UyZ8AAAAJ,Eric Suarez Morell,"Professor at Univ. Técn. Federico Santa María/ Recipient M. Zambrano at EPS, Univ. Sevilla"
bZdX3swAAAAJ,lw5h5JMAAAAJ,Rodrigo Soto Garrido,"Assistant Professor of Physics, Pontificia Universidad Católica de Chile"
V7Q4D2AAAAAJ,_lYdXdgAAAAJ,Eduardo Miranda,"Professor, Dept. of Civil and Environmental Engineering, Stanford University"
V7Q4D2AAAAAJ,dfl1iTIAAAAJ,Ricardo A Herrera,Universidad de Chile
V7Q4D2AAAAAJ,8zJ8hAYAAAAJ,Juan Felipe Beltran,"Profesor Asociado, Ingeniería Civil, Universidad de Chile"
V7Q4D2AAAAAJ,JqQ4lBEAAAAJ,Héctor Dávalos,Universidad Panamericana
V7Q4D2AAAAAJ,XqLySqoAAAAJ,James Bantis,"PhD Student, Stanford University"
-FeCQt8AAAAJ,NPhP5QUAAAAJ,Pedro Albertos,Prof. Emérito Universitat Politecnica Valencia
-FeCQt8AAAAJ,GgXFiOcAAAAJ,Antonio Sala,"Universitat Politecnica de Valencia, Inst. U. Automatica Informatica Indust. (AI2), Dept. Syst. Eng"
-FeCQt8AAAAJ,-0gRNgsAAAAJ,Cesar Silva,"Departamento de Electrónica, Universidad Técnica Federico Santa María, Chile"
-FeCQt8AAAAJ,fTjgkH0AAAAJ,Miguel A. Solis,Universidad Andrés Bello ; Centro de Innovación y Robótica
-FeCQt8AAAAJ,9dFsZkIAAAAJ,Jan Jantzen,"Adjunct Professor at the University of the Aegean, Chios, Greece"
-FeCQt8AAAAJ,T6e3MokAAAAJ,Juan Yianatos,Universidad Técnica Federico Santa María
-FeCQt8AAAAJ,rSW5suMAAAAJ,Sergey Kuleshov,"Universidad Andrés Bello, Santiago, Chile"
-FeCQt8AAAAJ,gFwCXWzPVoMC,Pedro García,Universitat Politècnica de València
-FeCQt8AAAAJ,Q7L1Fk8AAAAJ,Ricardo Sanz Díaz,"PhD Student, Universitat Politècnica de València"
-FeCQt8AAAAJ,x0RNc14AAAAJ,Jose Luis Diez,Associate Professor - Universitat Politécnica de Valencia
-FeCQt8AAAAJ,Oj0F9AkAAAAJ,Ricardo Sanz,"Professor of Systems Engineering, Universidad Politecnica de Madrid"
RcA5LWUAAAAJ,t0-RzjEAAAAJ,Mauricio Marin,"University of Santiago, Chile"
RcA5LWUAAAAJ,hwXEZ0IAAAAJ,Veronica Gil-Costa,UNSL - CONICET
RcA5LWUAAAAJ,yib0GbMAAAAJ,Olivier Marin,NYU Shanghai
RcA5LWUAAAAJ,GgMuBjwAAAAJ,Luciana Arantes,"Associate Professor, Sorbonne University, CNRS, LIP6"
RcA5LWUAAAAJ,vzHhJRoAAAAJ,Hermes Senger,"Professor of Computer Science, Federal University of Sao Carlos, Brazil"
RcA5LWUAAAAJ,6G03sDsAAAAJ,Pierre Sens,LIP6 / CNRS / UPMC / INRIA
NKweiVUAAAAJ,U_9AGB0AAAAJ,Mario Toledo Torres,"Departamento de Ingeniería Mecánica, Universidad Técnica Federico Santa María"
NKweiVUAAAAJ,51SRwcwAAAAJ,Nicolás Ripoll Kameid,"Investigador, Universidad Técnica Federico Santa María"
NKweiVUAAAAJ,0EUiosEAAAAJ,Ariel A. Muñoz,"Profesor Instituto de Geografía, Pontificia Universidad Católica de Valparaiso"
NKweiVUAAAAJ,FumnNdUAAAAJ,Violeta Mugica,UNIVERSIDAD AUTONOMA METROPOLITANA
NKweiVUAAAAJ,mihiOi8AAAAJ,Jan Bergmann,Pontificia Universidad Católica de Valparaíso
NKweiVUAAAAJ,bg290LcAAAAJ,Andrea Carvajal,Universidad Técnica Federico Santa María
NKweiVUAAAAJ,WrD3PxEAAAAJ,Pilar Lisbona Martín,Universidad de Zaragoza
NKweiVUAAAAJ,cQLJYugAAAAJ,German Amador Diaz,"Professor, Universidad Tecnica Federico Santa Maria"
tYkSQiQAAAAJ,tRxVpaUAAAAJ,Miguel Figueroa,"Professor of Electrical Engineering, Universidad de Concepcion"
tYkSQiQAAAAJ,Y7-gCmAAAAAJ,Andres Fuentes,Universidad Técnica Federico Santa María
tYkSQiQAAAAJ,VlAjEYEAAAAJ,Waldo Valenzuela,Inselspital - Universitätsspital Bern
tYkSQiQAAAAJ,b1UsMiEAAAAJ,Daniel G. Sbarbaro-Hofer,Professor
tYkSQiQAAAAJ,-WpYAIwAAAAJ,Hugo O. Garcés,"Computer Science Department, Universidad Católica de la Santísima Concepción"
tYkSQiQAAAAJ,i0ylj1UAAAAJ,Mahmoud Salem,University of Waterloo
tYkSQiQAAAAJ,rcOhpJ0AAAAJ,Akramul Azim,"Associate Professor, Ontario Tech University, Canada"
tYkSQiQAAAAJ,-RP1pvgAAAAJ,Nirmal Benann,"Masters Student, University of Waterloo"
tq0WtUYAAAAJ,Elk-cbYAAAAJ,Eduardo Cerpa,"Institute for Mathematical and Computational Engineering, Pontificia Universidad Católica de Chile"
tq0WtUYAAAAJ,bWlhWm8AAAAJ,Bianca Calsavara,"Instituto de Matemática, Estatística e Computação Científica, Universidade Estadual de Campinas"
QUb6y7sAAAAJ,h-oGBzsAAAAJ,francois bremond,INRIA
QUb6y7sAAAAJ,E620Q44AAAAJ,Shengfeng  Qin,Northumbria University
QUb6y7sAAAAJ,Fth-DtwAAAAJ,Gualtiero Fantoni,Department of Civil and Industrial Engineering
BapV8TMAAAAJ,YlV0HYoAAAAJ,María Elena Truyol,Universidad Andres Bello
1i1ScxEAAAAJ,MrFi22oAAAAJ,Andres Peters,"Faculty of Engineering and Sciences, Universidad Adolfo Ibáñez"
1i1ScxEAAAAJ,kov68wMAAAAJ,Alejandro I. Maass,FONDECYT Postdoctoral Fellow at Universidad Tecnica Federico Santa Maria
1i1ScxEAAAAJ,bKWlH0sAAAAJ,Marco Anthony Gordón Almeida,PhD(c) at Federico Santa María Technical University
1i1ScxEAAAAJ,IIuxXr0AAAAJ,Jie Chen,"Chair Professor of Electronic Engineering, City University of Hong Kong"
3sIDVwkAAAAJ,_lYdXdgAAAAJ,Eduardo Miranda,"Professor, Dept. of Civil and Environmental Engineering, Stanford University"
3sIDVwkAAAAJ,JqQ4lBEAAAAJ,Héctor Dávalos,Universidad Panamericana
3sIDVwkAAAAJ,Ypz8LbsAAAAJ,Francisco Galvis,"Project Engineer, Thornton Tomasetti"
3sIDVwkAAAAJ,dfl1iTIAAAAJ,Ricardo A Herrera,Universidad de Chile
rMvQeLcAAAAJ,5pr5DG4AAAAJ,Salvador Enrique Puliafito,CONICET / UTN
rMvQeLcAAAAJ,e7ptPAEAAAAJ,María Florencia Ruggeri,Universidad Técnica Federico Santa maría
rMvQeLcAAAAJ,9mWsubcAAAAJ,Yiniva Camargo Caicedo,Universidad Magdalena
rMvQeLcAAAAJ,Q2P4D4wAAAAJ,Francisco Cereceda-Balic,Professor Universidad Tecnica Federico Santa Maria
rMvQeLcAAAAJ,5qFZiUwAAAAJ,Ana Isabel Lopez-Noreña,"Ingeniera Ambiental, Universidad Nacional de Colombia. Estudiante doctoral"
rMvQeLcAAAAJ,WPA82vMAAAAJ,Gabriela Lakkis,"Pontificia Universidad Católica Argentina, Facultad de Ciencias Agrarias"
rMvQeLcAAAAJ,lbiPSjIAAAAJ,Olga L. Mayol-Bracero,Brookhaven National Laboratory
rMvQeLcAAAAJ,6ULOSnUAAAAJ,Andrés M. Vélez-Pereira,"Departamento de Ingeniería Mecánica, Facultad de Ingeniería, Universidad de Tarapacá"
qzUiwgMAAAAJ,hXYgAmEAAAAJ,Kaoru Sezaki,"Director, Professor, Center for Spatial Information Science, University of Tokyo"
qzUiwgMAAAAJ,ttPoZhEAAAAJ,Rosa  M Benito,"Professor of Physics, Universidad Politecnica de Madrid"
qzUiwgMAAAAJ,uiyQqxAAAAAJ,Juan Carlos Losada González,Universidad Politécnica de Madrid
qzUiwgMAAAAJ,UxUguEsAAAAJ,tomas arredondo,ncipher security
qzUiwgMAAAAJ,ReQMnTAAAAAJ,Alfredo J. Morales-Guzman,MIT Media Lab
qzUiwgMAAAAJ,6ForcPMAAAAJ,Javier Borondo,"Grupo de Sistemas Complejos, Universidad Politécnica de Madrid"
qzUiwgMAAAAJ,DAw0TdgAAAAJ,Patricio Olivares Roncagliolo,"PhD.,Universidad Técnica Federico Santa María"
qzUiwgMAAAAJ,LCtZk1UAAAAJ,Jorge Alfredo Ardila Rey,Universidad Técnica federico anta Maria
qzUiwgMAAAAJ,kP8pBuEAAAAJ,Alejandra Beghelli,University College London
qzUiwgMAAAAJ,mfnr2oEAAAAJ,Juan I. Yuz,Universidad Tecnica Federico Santa Maria
qzUiwgMAAAAJ,wwDBa-oAAAAJ,Christopher  Nikulin,"Facultad de Ingenieria, Universidad Alberto Hurtado"
qzUiwgMAAAAJ,fGoYA64AAAAJ,Christian Pablo Romero Vieyra,UTFSM
qzUiwgMAAAAJ,7g3r_ykAAAAJ,Rodrigo Carvajal,Pontificia Universidad Católica de Valparaíso
qzUiwgMAAAAJ,wSXnYFYAAAAJ,Juan C. Agüero,Universidad Tecnica Federico Santa Maria (Chile)
TQZelUgAAAAJ,Y7-gCmAAAAAJ,Andres Fuentes,Universidad Técnica Federico Santa María
TQZelUgAAAAJ,LDB4AkUAAAAJ,Fengshan Liu,"Measurement Science and Standards, National Research Council Canada"
TQZelUgAAAAJ,nzPZGyYAAAAJ,Juan José Cruz Villanueva,Universidad Técnica Federico Santa María
TQZelUgAAAAJ,d2-UjMwAAAAJ,Jérôme Yon,"Normandie Univ, INSA Rouen Normandie, UNIROUEN, CNRS, CORIA, 76000 Rouen, France"
TQZelUgAAAAJ,ZNISpB8AAAAJ,José Morán,"Mechanical Engineering, University of Minnesota"
TQZelUgAAAAJ,8C2p824AAAAJ,Jean-Louis Consalvi,"Universtité d'Aix-Marseille, IUSTI UMR 7343"
TQZelUgAAAAJ,tYkSQiQAAAAJ,Gonzalo Carvajal,Universidad Técnica Federico Santa María
TQZelUgAAAAJ,QmP0ggQAAAAJ,A. Carlos FERNANDEZ-PELLO,"Professor of Mechanical Engineering, University of California, Berkeley"
TQZelUgAAAAJ,HkS11HsAAAAJ,Ignacio VERDUGO,Universidad Técnica Federico Santa Maria
TQZelUgAAAAJ,b-Mv58UAAAAJ,Marek Mazur,"UMR 6618 CORIA, INSA Rouen Normandie"
TQZelUgAAAAJ,CIxiHJMAAAAJ,Maria Thomsen Solis,"Faculty of Engineering and Sciences, Universidad Adolfo Ibáñez"
TQZelUgAAAAJ,2lVy214AAAAJ,Florian Lespinasse,CORIA UMR6614 CNRS
TQZelUgAAAAJ,nZ4opqQAAAAJ,gilles godard,
TQZelUgAAAAJ,NokbgloAAAAJ,Nicolas Gutierrez,"Combustion Science, Universidad de La Frontera"
TQZelUgAAAAJ,DYlZQ4cAAAAJ,Pedro Reszka,Universidad Adolfo Ibañez
TQZelUgAAAAJ,rP7HPv8AAAAJ,Juan I. Cuevas Rodriguez,"Worcester Polytechnic Institute, Department of Fire Protection Engineering"
TQZelUgAAAAJ,ZfmmFGoAAAAJ,Alexandre Poux,CORIA
HYfOE0gAAAAJ,K2LmXRwAAAAJ,Yong Hu,Kyoto University
HYfOE0gAAAAJ,zOpvvwsAAAAJ,Christian Hasse,"TU Darmstadt, Simulation of reactive Thermo-Fluid Systeme"
HYfOE0gAAAAJ,wRNWWWkAAAAJ,Arne Scholtissek,TU Darmstadt
HYfOE0gAAAAJ,x3jPvtsAAAAJ,Ryoichi Kurose,"Professor of Mechanical Engineering and Science, Kyoto University"
HYfOE0gAAAAJ,g1q2D9sAAAAJ,Matthias Ihme,Stanford University
HYfOE0gAAAAJ,kGwX1F4AAAAJ,Luc Vervisch,INSA Rouen Normandie & IUF
HYfOE0gAAAAJ,uCd9XpkAAAAJ,Pascale Domingo,Directrice de Recherche CNRS CORIA
HYfOE0gAAAAJ,ujDTg7kAAAAJ,Andrea Giusti,Imperial College London
r5oRQroAAAAJ,M-jJTmAAAAAJ,YueYue Fan,"University of California, Davis"
r5oRQroAAAAJ,SP0ni6kAAAAJ,Zhaomiao (Walter) Guo,University of Central Florida
r5oRQroAAAAJ,9ZHI8bgAAAAJ,Robert Bassett,Naval Postgraduate School
r5oRQroAAAAJ,yhYHHhoAAAAJ,Jean-Paul Watson,"Lawrence Livermore National Laboratory, Livermore, California, USA"
r5oRQroAAAAJ,0G2t-6sAAAAJ,David L Woodruff,"Professor of Management, University of California Davis"
r5oRQroAAAAJ,V9yRcAwAAAAJ,Cesar A. Silva-Monroy,Sandia National Laboratories
r5oRQroAAAAJ,RL6AprQAAAAJ,Andrea Staid,Electric Power Research Institute
r5oRQroAAAAJ,tDzKF-AAAAAJ,Alejandro Jofre,Professor Universidad de Chile
r5oRQroAAAAJ,V31S0pYAAAAJ,R. Wets,"Professor Mathematics, University of California, Davis"
r8LRzMIAAAAJ,bCe4Dt8AAAAJ,Cristhian Perez-Villalobos,Universidad de Concepción
r8LRzMIAAAAJ,20Btg2UAAAAJ,Bélgica Pacheco-Blanco,Universitat Politécnica de Valéncia
r8LRzMIAAAAJ,TSqWTigAAAAJ,Isabel Leal,Docente Departamento de Comunicación Visual. Universidad del Bío Bío
r8LRzMIAAAAJ,qB4Y24MAAAAJ,Bernabe Hernandis Ortuño,Full Professor at Universitat Politècnica de València
r8LRzMIAAAAJ,ZV8NNskAAAAJ,Marianela Luzardo Briceño,Universidad de Medellín
r8LRzMIAAAAJ,1AZC-zsAAAAJ,Sandor Vajna,Professor emeritus für Maschinenbauinformatik / Information Technologies in Mechanical Engineering
r8LRzMIAAAAJ,tK6dlTIAAAAJ,Stig Ottosson,Professor emeritus
r8LRzMIAAAAJ,XmbDdZIAAAAJ,Sergio Eduardo Contreras Espinoza,"Profesor de Estadística, Universidad del Bío-Bío"
r8LRzMIAAAAJ,FhH7H6sAAAAJ,Julie Stal-Le Cardinal,CentraleSupelec
r8LRzMIAAAAJ,3bKwL7gAAAAJ,Alexander Atzberger,Universität der Bundeswehr München
r8LRzMIAAAAJ,5Ztirb8AAAAJ,Kristin Paetzold,"TU Dresden, Professor for Virtual Product Development"
r8LRzMIAAAAJ,X_51qGIAAAAJ,Prieto Pablo,University of Brighton
r8LRzMIAAAAJ,kP8pBuEAAAAJ,Alejandra Beghelli,University College London
r8LRzMIAAAAJ,8w-NnvMAAAAJ,Enrique Canessa,"Associate Professor, Universidad Adolfo Ibáñez, Facultad Ingeniería y Ciencias"
r8LRzMIAAAAJ,Jhg3gmAAAAAJ,Giulietta Vaccarezza Garrido,Universidad San Sebastian
if12A0EAAAAJ,qeibqDUAAAAJ,Camila Cociña,International Institute for Environment and Development
if12A0EAAAAJ,qgU2EK4AAAAJ,Sebastián Dávila-Gálvez,Universidad de Santiago de Chile
if12A0EAAAAJ,OPjFnzIAAAAJ,Ricardo Hurtubia,Associate Professor at Pontificia Universidad Católica de Chile
if12A0EAAAAJ,6lhrINgAAAAJ,Juan Carlos Munoz,Profesor Ingeniería de Transporte y Logística (PUC Chile). CEDEUS
if12A0EAAAAJ,4D36wvkAAAAJ,Tomás Echiburú Altamirano,Pontificia Universidad Católica de Chile
if12A0EAAAAJ,AOwoCQ0AAAAJ,Sebastian Rodríguez Leiva,Pontificia Universidad Católica de Chile
if12A0EAAAAJ,lLzsS2UAAAAJ,Andres Señoret,"Ayudante de Investigación, CEDEUS, Instituto de Estudios Urbanos Pontificia Universidad Católica de"
if12A0EAAAAJ,Mu5pd3kAAAAJ,Maria Abreu,"Professor of Economic Geography, University of Cambridge"
_o2E2IkAAAAJ,gES82lYAAAAJ,Peter Dusicka,"Professor of Civil and Environmental Engineering, Portland State University"
_o2E2IkAAAAJ,GLwW01cAAAAJ,Rodrigo Astroza,"Associate Professor, Universidad de los Andes - Chile"
_o2E2IkAAAAJ,TtACwrEAAAAJ,Francisco Hernández Prado,University of Chile
_o2E2IkAAAAJ,pg8VJIAAAAAJ,Patricio Quintana Gallo,Czech Technical University in Prague
_o2E2IkAAAAJ,3sIDVwkAAAAJ,Pablo Heresi,"Assistant professor, Universidad Técnica Federico Santa María"
3hJ6L_4AAAAJ,FPfLp-MAAAAJ,reinaldo vallejos,utfsm
3hJ6L_4AAAAJ,QmtY9h0AAAAJ,Ariel Leiva Lopez,"School of Electrical Engineering, Pontificia Universidad Católica de Valparaíso"
3hJ6L_4AAAAJ,ZuDKipwAAAAJ,Gerardo Rubino,Inria/Irisa
3hJ6L_4AAAAJ,kP8pBuEAAAAJ,Alejandra Beghelli,University College London
3hJ6L_4AAAAJ,x5HOolYAAAAJ,Gabriel Saavedra,Universidad de Concepción
3hJ6L_4AAAAJ,vBgTDvoAAAAJ,Danilo Bórquez-Paredes,Universidad Adolfo Ibañez
3hJ6L_4AAAAJ,wmzkJOoAAAAJ,Felipe Calderón,Pontificia Universidad Católica de Valparaíso
3hJ6L_4AAAAJ,hX9KTOoAAAAJ,Enrique Davalos,Facultad Politécnica - Universidad Nacional de Asunción
A1t0akQAAAAJ,V9BgXgMAAAAJ,Maria Cristina Riff,Universidad Técnica Federico Santa María
A1t0akQAAAAJ,Ke-tzn4AAAAJ,Elizabeth Montero,Universidad Técnica Federico Santa María
A1t0akQAAAAJ,oJMnjNYAAAAJ,Carlos A. Coello Coello,"Professor of Computer Science, CINVESTAV-IPN"
A1t0akQAAAAJ,U-8SITsAAAAJ,Bertrand Neveu,LIGM Ecole des Ponts Paristech
A1t0akQAAAAJ,SjkNsk8AAAAJ,German Treimun-Costa,MSc. Student at Universidad Técnica Federico Santa María
A1t0akQAAAAJ,9jBS1tEAAAAJ,Gabriela Ochoa,"Professor of Computer Science, University of Stirling"
A1t0akQAAAAJ,_q2B3aUAAAAJ,Xavier Bonnaire,Universidad Técnica Federico Santa María
A1t0akQAAAAJ,scSVCioAAAAJ,Marcel Minutolo,Robert Morris University
A1t0akQAAAAJ,1vhDro8AAAAJ,Werner Kristjanpoller,Universidad Técnica Federico Santa María
A1t0akQAAAAJ,tQVYKucAAAAJ,Leslie Perez Caceres,"Associate Professor, Escuela de Ingeniería Informática, Pontificia Universidad Católica de"
LENSfWgAAAAJ,-cCH8bkAAAAJ,Ion Tutanescu,"Associate Professor, PhD, University of Pitesti - Romania"
LENSfWgAAAAJ,Q2bv8ywAAAAJ,Charles A. Shoniregun,Professor of Interent Security
LENSfWgAAAAJ,rIpg3aMAAAAJ,Bassem Bakhache,Lebanese University - Engineering Faculty
LENSfWgAAAAJ,s5CNRVIAAAAJ,Anca Livia Radu,"University of Trento, Italy; University Politehnica of Bucharest, Romania"
LENSfWgAAAAJ,oK0JPuYAAAAJ,Vladeanu Calin,"Telecommunications Department, University Politehnica of Bucharest"
LENSfWgAAAAJ,6xTouw8AAAAJ,maryline chetto,Université de Nantes
LENSfWgAAAAJ,eKT-3PwAAAAJ,Hassan Noura,Aix-Marseille University / Laboratoire d'Informatique et Systèmes
PCui8-QAAAAJ,ujYnnDUAAAAJ,Christian Ihle,"Associate Professor, Department of Mining Engineering, Universidad de Chile"
PCui8-QAAAAJ,OJcK5CAAAAAJ,SB Dalziel,University of Cambridge
l-AttlIAAAAJ,Vj4mHpEAAAAJ,Matías Zañartu,"Department of Electronic Engineering, Universidad Técnica Federico Santa María"
l-AttlIAAAAJ,qjzRrxAAAAAJ,Sean D. Peterson,"Professor of Mechanical Engineering, University of Waterloo"
l-AttlIAAAAJ,r9we4h4AAAAJ,Byron D. Erath,"Associate Professor of Mechanical and Aeronautical Engineering, Clarkson University"
l-AttlIAAAAJ,mfnr2oEAAAAJ,Juan I. Yuz,Universidad Tecnica Federico Santa Maria
l-AttlIAAAAJ,ph4hKC0AAAAJ,Kyle Daun,University of Waterloo
l-AttlIAAAAJ,mWEybjUAAAAJ,Paul Hadwin,University of Waterloo
8YJJjQIAAAAJ,WV31q0cAAAAJ,Prof Peter Knights,The University of Queensland
51SRwcwAAAAJ,U_9AGB0AAAAJ,Mario Toledo Torres,"Departamento de Ingeniería Mecánica, Universidad Técnica Federico Santa María"
51SRwcwAAAAJ,NKweiVUAAAAJ,Fabián Guerrero C.,Universidad Tecnica Federico Santa Maria
51SRwcwAAAAJ,i7AoRxEAAAAJ,Antonio Delgado,"Professor für Strömungsmechanik, FA Universität Erlangen-Nürnberg"
51SRwcwAAAAJ,bg290LcAAAAJ,Andrea Carvajal,Universidad Técnica Federico Santa María
51SRwcwAAAAJ,WrD3PxEAAAAJ,Pilar Lisbona Martín,Universidad de Zaragoza
51SRwcwAAAAJ,XApGHh4AAAAJ,Ricardo Chacartegui,Professor Energy Engineering Department University of Seville
51SRwcwAAAAJ,0EUiosEAAAAJ,Ariel A. Muñoz,"Profesor Instituto de Geografía, Pontificia Universidad Católica de Valparaiso"
51SRwcwAAAAJ,gaVNgqcAAAAJ,Dr. M. Abdul Mujeebu,"Imam Abdulrahman Bin Faisal University, College of Architecture and Planning, Building Engineering"
_sAB1sAAAAAJ,djTaZ7UAAAAJ,Lorena A Barba,"Professor, Mechanical and Aerospace Engineering, George Washington University"
_sAB1sAAAAAJ,7ouqdToAAAAJ,N. C. Clementi,The George Washington University
_sAB1sAAAAAJ,limKJKsAAAAJ,Horacio V Guzman,"Department of Theoretical Physics, Institute Jozef Stefan"
_sAB1sAAAAAJ,issuF1cAAAAJ,Jay Bardhan,Computational Scientist at Pacific Northwest National Lab
_sAB1sAAAAAJ,v6aBSlEAAAAJ,Adolfo Poma,Group leader - Multiscale Modelling of Complex Systems at IPPT-PAN
_sAB1sAAAAAJ,OTRCYAgAAAAJ,Amirhossein Molavi Tabrizi,Applied Biomath
_sAB1sAAAAAJ,MtzzT2MAAAAJ,Matthew Knepley,"Computer Science and Engineering, University at Buffalo"
_sAB1sAAAAAJ,YiWa3b4AAAAJ,Ali Mehdizadeh Rahimi,
_sAB1sAAAAAJ,HCAkiTYAAAAJ,Timo Betcke,"Professor of Computational Mathematics, University College London"
_sAB1sAAAAAJ,8GhoYkUAAAAJ,"Carlos D. Garcia, FRSC","Department of Chemistry, Clemson University"
_sAB1sAAAAAJ,PJpxOVsAAAAJ,Perla Y. Sauceda-Oloño,Clemson University
_sAB1sAAAAAJ,EYOgO5MAAAAJ,Jehanzeb H Chaudhry,University of New Mexico
_sAB1sAAAAAJ,1soHe-gAAAAJ,Elwin van 't Wout,"Assistant Professor of Mathematical and Computational Engineering, Pontificia Universidad Católica"
_sAB1sAAAAAJ,NmoHoYYAAAAJ,Guido Raos (ORCID 0000-0001-7011-...,Politecnico di Milano
_sAB1sAAAAAJ,IXvgNjsAAAAJ,Walter Rocchia,Senior Researcher at Italian Institute of Technology
_sAB1sAAAAAJ,ezIDpQYAAAAJ,Felipe Cruz,ETHZ/CSCS
_sAB1sAAAAAJ,klw9KE0AAAAJ,Rio Yokota,"Associate Professor, Tokyo Institute of Technology"
ywU52hEAAAAJ,qgpudsIAAAAJ,Rodrigo F. Herrera,Pontificia Universidad Católica de Valparaíso
ywU52hEAAAAJ,fXhxN3AAAAAJ,Paz Arroyo,DPR Construction
ywU52hEAAAAJ,_vJSGrkAAAAJ,Glenn Ballard,"Researcher at the University of California, Berkeley"
ywU52hEAAAAJ,TvyCATYAAAAJ,Maria Calahorra-Jimenez,"Assistant Professor of Heavy Civil Construction, FresnoState"
ywU52hEAAAAJ,5F0hvEoAAAAJ,Adriana Gómez-Cabrera,"Profesor, Pontificia Universidad Javeriana (grid.41312.35 / ROR 03etyjw28)"
ywU52hEAAAAJ,BxT998AAAAAJ,Zulay Giménez,Profesor. Escuela de Construcción Civil. Pontificia Universidad Católica de Chile
jAaJQ1MAAAAJ,s23yhFcAAAAJ,Patricio Rodríguez,"Institute of Education, Universidad de Chile"
jAaJQ1MAAAAJ,INBSXpMAAAAJ,miguel nussbaum,Pontificia Universidad Catolica de Chile
jAaJQ1MAAAAJ,UxUguEsAAAAJ,tomas arredondo,ncipher security
jAaJQ1MAAAAJ,KsLLafwAAAAJ,Michael Seeger,Universidad Tecnica Federico Santa Maria
xIvsrzoAAAAJ,wwDBa-oAAAAJ,Christopher  Nikulin,"Facultad de Ingenieria, Universidad Alberto Hurtado"
xIvsrzoAAAAJ,QUb6y7sAAAAJ,Marcos D Zuniga,"Electronics Department, Universidad Tecnica Federico Santa Maria"
kov68wMAAAAJ,uw9SaUkAAAAJ,Dragan Nesic,"Professor, Department of Electrical and Electronic Engineering, University of Melbourne"
kov68wMAAAAJ,1i1ScxEAAAAJ,Francisco J Vargas,"Universidad Tecnica Federico Santa Maria, Chile"
kov68wMAAAAJ,7ezGVfYAAAAJ,Romain Postoyan,"CNRS, CRAN UMR 7039, Université de Lorraine"
kov68wMAAAAJ,4QeIFBUAAAAJ,Iman Shames,Australian National University
kov68wMAAAAJ,diB1WocAAAAJ,Chris Manzie,"Professor in Electrical and Electronic Engineering, University of Melbourne"
kov68wMAAAAJ,I42FdXUAAAAJ,Vineeth S Varma,"CRAN-Univ. of Lorraine (former: LSS-Supelec, SUTD)"
kov68wMAAAAJ,MrFi22oAAAAJ,Andres Peters,"Faculty of Engineering and Sciences, Universidad Adolfo Ibáñez"
kov68wMAAAAJ,e-tRuxIAAAAJ,Jonathan Manton,"Future Generation Professor, University of Melbourne"
kov68wMAAAAJ,ns9laTYAAAAJ,Robert Chin,The University of Melbourne & University of Birmingham
kov68wMAAAAJ,AnjqGroAAAAJ,Samson Lasaulce,CNRS Director of Research
kov68wMAAAAJ,bKWlH0sAAAAJ,Marco Anthony Gordón Almeida,PhD(c) at Federico Santa María Technical University
kov68wMAAAAJ,29I1fWAAAAAJ,wei wang,The University of Melbourne
kov68wMAAAAJ,M_hGdkoAAAAJ,Maurice Heemels,Full Professor Eindhoven University of Technology
kov68wMAAAAJ,Roz26cwAAAAJ,Saeed Ahmadizadeh,No Affiliation
kov68wMAAAAJ,7D5G7MEAAAAJ,Ying Tan,"Professor, University of Melbourne"
sEmXIH8AAAAJ,50b9WpUAAAAJ,Jaime H. Ortega,"DIM - CMM, Universidad de Chile"
sEmXIH8AAAAJ,_0DHzPQAAAAJ,Pedro Gajardo,Universidad Tecnica Federico Santa Maria
sEmXIH8AAAAJ,Vze5x18AAAAJ,Hector Ramirez C.,"Depto Ingeniería Matemática & Centro de Modelamiento Matemático, Universidad de Chile"
sEmXIH8AAAAJ,h2F8sjEAAAAJ,Carlos Conca,"Professor of Mathematics, University of Chile"
sEmXIH8AAAAJ,OKi8_J8AAAAJ,Gino I. Montecinos,Departamento de Ingeniería Matemática- Universidad de La Frontera
sEmXIH8AAAAJ,ZZi0m5QAAAAJ,Juan Carlos López Ríos,"Assistant Professor, Industrial University, Bucaramanga-Colombia"
sEmXIH8AAAAJ,deLqIscAAAAJ,Lionel ROSIER,"Professor, Université du Littoral Cote d'Opale"
sEmXIH8AAAAJ,Mo6A8CkAAAAJ,Sebastián Zamorano,Assistant Professor - Universidad de Santiago de Chile
sEmXIH8AAAAJ,t-IxzegAAAAJ,Enrique Zuazua,"Friedrich Alexander University, Erlangen-Nürnberg/Humboldt Professorship & Deusto Foundation-Bilbao"
sEmXIH8AAAAJ,4rJ9aLoAAAAJ,marco fontelos,"Instituto de Ciencias Matemáticas, CSIC, Spain"
sEmXIH8AAAAJ,6AGbV2QAAAAJ,Alberto Mercado,Universidad Técnica Federico Santa María
C1aXAaIAAAAJ,zGp10LEAAAAJ,Valeria del Campo,Universidad Técnica Federico Santa María
C1aXAaIAAAAJ,RRCqUogAAAAJ,Marcos Flores,Universidad de Chile
C1aXAaIAAAAJ,tT9xoAcAAAAJ,Pablo Ferrada,Universidad de Antofagasta
C1aXAaIAAAAJ,fwXghBYAAAAJ,carlos portillo,"Profesor Asociado, CDEA-UA, Universidad de Antofagasta"
C1aXAaIAAAAJ,KqHnyOcAAAAJ,Aitor Marzo,"Profesor asistente, Universidad de Antofagasta"
