scholar_id_autor_gs,scholar_id_gs_coauthor,nombre_coauthor,cargo
q9oUJekAAAAJ,t6ogwDYAAAAJ,Giovany Guevara Cardona,"Associate Professor, Universidad del Tolima (www.ut.edu.co)"
q9oUJekAAAAJ,r86bu1MAAAAJ,Pablo Díaz Siefer,Centro Ceres
q9oUJekAAAAJ,sdG0QscAAAAJ,Jeferson Vizentin-Bugoni,Professor of Ecology at Universidade Federal de Pelotas
q9oUJekAAAAJ,0H8jNBoAAAAJ,David M Watson,"Professor in Ecology, Gulbali Institute, Charles Sturt University"
q9oUJekAAAAJ,BxfM4mIAAAAJ,Antonio Mauro Saraiva,Universidade de São Paulo
q9oUJekAAAAJ,ypUifTAAAAAJ,Dario Acha,"Instituto de Ecología, Carrera de Biologia, Universidad Mayor de San Andres"
q9oUJekAAAAJ,NDtBvmsAAAAJ,Eduardo A. Silva-Rodríguez,"Med.Vet., PhD, Instituto de Conservación, Biodiversidad y Territorio, Universidad Austral de …"
q9oUJekAAAAJ,qRu4TCkAAAAJ,Sebastián Cordero,Pontificia Universidad Católica de Vaparaíso
q9oUJekAAAAJ,X4A3nzwAAAAJ,"Cattan, PE",universidad de chile
q9oUJekAAAAJ,jgevFXIAAAAJ,Juana P. Correa,Researcher at Universidad San Sebastián
q9oUJekAAAAJ,081-PZIAAAAJ,Aníbal Pauchard,Universidad de Concepción
q9oUJekAAAAJ,vI2dcjoAAAAJ,Antonella Bacigalupo,"PhD Student, University of Glasgow"
q9oUJekAAAAJ,Du21jO8AAAAJ,Mariano Rodriguez-Cabal,University of Vermont - Rubenstein School of Environment and Natural Resources
q9oUJekAAAAJ,xcI4UhgAAAAJ,María Daniela Rivarola,Regis University
q9oUJekAAAAJ,BxqMlr8AAAAJ,Alejandra Gonzalez Vasquez,Universidad de Chile
q9oUJekAAAAJ,--xVo3EAAAAJ,Carlos F. Pinto,Universidad de Chile
q9oUJekAAAAJ,lJViq6YAAAAJ,Julian F. Quintero-Galvis,Universidad Austral de Chile
q9oUJekAAAAJ,6GK26bsAAAAJ,GISELLE MUSCHETT,Macquarie University
q9oUJekAAAAJ,tOS9plIAAAAJ,Eduardo Zattara,"Adjunct Researcher, INIBIOMA, CONICET-Universidad Nacional del Comahue Argentina"
q9oUJekAAAAJ,JA6GahcAAAAJ,Blas Lavandero,Universida de Talca
q9oUJekAAAAJ,dYeZp8QAAAAJ,Antonio Lara,"Professor Facultad de Ciencias Forestales y Recursos Naturales, Universidad Austral de …"
q9oUJekAAAAJ,Qifw1fwAAAAJ,Christian Little,Instituto Forestal
q9oUJekAAAAJ,USOtgdcAAAAJ,Jorge Alejandro Cortés Miranda,Phd. (c) Universidad de Chile
q9oUJekAAAAJ,Sb2oKiMAAAAJ,R. Eduardo Palma,"Departamento de Ecología, Pontificia Universidad Católica de Chile"
q9oUJekAAAAJ,lrJ5Qz8AAAAJ,Jhoann Canto Hernández,Museo Nacional de Historia Natural
q9oUJekAAAAJ,LUdizE8AAAAJ,Marco A. Méndez,"Profesor Titular, Facultad de Ciencias, Universidad de Chile"
q9oUJekAAAAJ,lECHx2oAAAAJ,Pedro F. Victoriano,Associate Professor. Universidad de Concepción
q9oUJekAAAAJ,QRRSCXAAAAAJ,Jaime R. Rau,"Profesor Titular, Depto. de Ciencias Biológicas & Biodiversidad, Universidad de Los Lagos …"
q9oUJekAAAAJ,NEJdQnkAAAAJ,Guillermo D'Elía,Universidad Austral de Chile
q9oUJekAAAAJ,EWjCdo0AAAAJ,Juan C. Opazo,"Facultad de Medicina & Ciencia, Universidad San Sebastián"
q9oUJekAAAAJ,wehnRfwAAAAJ,Fabian M Jaksic,"Professor of Ecology, Catholic University of Chile"
q9oUJekAAAAJ,nlYoIBIAAAAJ,Enrique Rodriguez-Serrano,Universidad de Concepcion
q9oUJekAAAAJ,UFAZvboAAAAJ,Jaime Vicente Estévez Varón,Profesor asociado Universidad de Caldas
q9oUJekAAAAJ,2FR4VeUAAAAJ,Daniel Torrico-Bazoberry,"Centro de Investigación en Complejidad Social (CICS), Facultad de Gobierno, Universidad …"
q9oUJekAAAAJ,4XzVI1gAAAAJ,Christian Jofré-Pérez,Universidad de Playa Ancha
q9oUJekAAAAJ,NSeA66MAAAAJ,Tiago M. Francoy,"Escola de Artes, Ciências e Humanidades - Universidade de São Paulo"
q9oUJekAAAAJ,BHAuwwUAAAAJ,Juan Alejandro Morales Betancourt,"Universidad de los Andes (Bogotá, Colombia)"
q9oUJekAAAAJ,bNddsMMAAAAJ,Michael W Bruford,"Professor of Biodiversity, Cardiff University"
q9oUJekAAAAJ,n_6ZnroAAAAJ,Enrico L. Rezende,"Associate Professor, P. Universidad Católica de Chile"
q9oUJekAAAAJ,WMN-8SEAAAAJ,Fredy Arvey Rivera Paez,Profesor Titular Universidad de Caldas
q9oUJekAAAAJ,NmWyTbwAAAAJ,Carlos Esteban Lara,Profesor Asistente. Universidad Nacional de Colombia Sede de La Paz
q9oUJekAAAAJ,uNLzwJ4AAAAJ,Camila Tejo Haristoy,"Adjunct Professor, Universidad Austral de Chile"
q9oUJekAAAAJ,BevCyxkAAAAJ,Renzo Vargas-Rodríguez,Universidad de La Serena-ULS/ Instituto de Filosofía y Ciencias de la Complejidad-IFICC
q9oUJekAAAAJ,97HFWtMAAAAJ,Mauricio Soto Gamboa,"Professor , Universidad Austral de Chile"
q9oUJekAAAAJ,nEVwdxoAAAAJ,John R. Speakman,"Chinese Academy of Sciences, SIAT and IGDB and University of Aberdeen"
q9oUJekAAAAJ,xSCCTLgAAAAJ,Catherine Hambly,"Research Fellow, Aberdeen University"
q9oUJekAAAAJ,0DgzT5oAAAAJ,Leonardo D Bacigalupe,Universidad Austral de Chile
q9oUJekAAAAJ,BnDyiscAAAAJ,Fulgencio Lisón (ORCID: 0000-0003-1481-3750),"Assistant Prof. Dpt. Zoology, Universidad de Concepción (Chile; ROR 0460jpj73)"
q9oUJekAAAAJ,y4Y9o6sAAAAJ,Sara M. Rodríguez,Universidad Católica de la Ssma. Concepción (UCSC)
q9oUJekAAAAJ,fINjB4UAAAAJ,Dimas A Molina-Marin,"Estudiante de Maestría en Ecologia, Universidad Federal do Pará, PPGECO"
q9oUJekAAAAJ,auyTL1YAAAAJ,Patricio A. Camus,"Departmento de Ecologia, Facultad de Ciencias, Universidad Catolica de la Santisima …"
q9oUJekAAAAJ,uu39mwYAAAAJ,Richard McLellan,Postgraduate researcher
q9oUJekAAAAJ,SYyEz-0AAAAJ,M. Isidora Ávila-Thieme,Postdoctoral researcher
q9oUJekAAAAJ,zdIuFAUAAAAJ,Roberto Bastias Romo,Pontificia Universidad Católica de Valparaíso
q9oUJekAAAAJ,rDCx4NgAAAAJ,Carlos I. Molina A.,"Department of Biology, Ecology Institute, FCPN, UMSA"
q9oUJekAAAAJ,zlxVmHIAAAAJ,MARIA CRISTINA LOPEZ ROBERTS,"Docente e Investigadora asociada, UNIVERSIDAD MAYOR REAL Y PONTIFICIA DE SAN …"
q9oUJekAAAAJ,tsVTlZkAAAAJ,Juan C. Sanchez-Hernandez,Univ Castilla-La Mancha (Toledo)
q9oUJekAAAAJ,svclW9AAAAAJ,Pablo Saenz-Agudelo,Universidad Austral de Chile
q9oUJekAAAAJ,bPNGHw0AAAAJ,Rob Boyd,"Quantitative Ecologist, UK CEH"
q9oUJekAAAAJ,UL_jwxUAAAAJ,Carolina Laura Morales,"Grupo Ecología de la Polinización, INIBIOMA, CONICET-Universidad Nacional del …"
q9oUJekAAAAJ,PlIGRS0AAAAJ,Marcelo A Aizen,CONICET - Universidad Nacional del Comahue
q9oUJekAAAAJ,SVm6CkgAAAAJ,Schmucki Reto,UK Centre for Ecology & Hydrology
q9oUJekAAAAJ,aUBHmIQAAAAJ,Oliver L. Pescott,UK Centre for Ecology & Hydrology
q9oUJekAAAAJ,vYLMMY4AAAAJ,Gary D. Powney,Centre for Ecology & Hydrology
q9oUJekAAAAJ,pGS18ZgAAAAJ,Jeff Ollerton,Visiting Professor at The University of Northampton (UK) and the Kunming Institute of Botany …
q9oUJekAAAAJ,n8Q26G8AAAAJ,Matias Olea,Potificia Universidad Católica de Valparaíso
q9oUJekAAAAJ,0EUiosEAAAAJ,Ariel A. Muñoz,"Profesor Instituto de Geografía, Pontificia Universidad Católica de Valparaiso"
q9oUJekAAAAJ,134gvMcAAAAJ,Jonathan Barichivich,Climatic Research Unit
q9oUJekAAAAJ,jKkavvoAAAAJ,Christine M Lucas,University of the Republic of Uruguay
q9oUJekAAAAJ,xa0AyyEAAAAJ,Lican Martínez,"PhD Student, Universidad Nacional del Comahue - CONICET"
q9oUJekAAAAJ,TjTeeVwAAAAJ,Eugenia Gayo H.,"Universidad de Chile, Departamento de Geografía"
q9oUJekAAAAJ,YUzw84sAAAAJ,Sebastian Abades,"Associate Professor, GEMA Center for Genomics, Ecology & Environment, Universidad …"
q9oUJekAAAAJ,AeGEXeUAAAAJ,Nélida R. Villaseñor,"Assistant Professor, Universidad de Chile; Associate Professor, Universidad Bernardo O' …"
q9oUJekAAAAJ,75U3PgEAAAAJ,Filipi Miranda Soares,"Computer Engineering Ph.D Candidate, University of São Paulo, Brazil, & University of …"
q9oUJekAAAAJ,9Ulbz_UAAAAJ,Natalia Pirani Ghilardi-Lopes,"Professor de Biologia de Criptógamas, Universidade Federal do ABC"
q9oUJekAAAAJ,HpZ39G4AAAAJ,Felipe W. Amorim,Professor at São Paulo State University (UNESP)
q9oUJekAAAAJ,ayLP24gAAAAJ,Leandro Hachuy-Filho,Mestre em Ciências Biológicas
q9oUJekAAAAJ,W7I2h88AAAAJ,Caio S. Ballarin,"PhD student at UNESP, Botucatu, Sao Paulo state, Brazil"
q9oUJekAAAAJ,yRyd8ucAAAAJ,Pedro Mondaca,Universidad Federico Santa María
q9oUJekAAAAJ,fCJZmKwAAAAJ,Elie Poulin,Universidad de Chile
q9oUJekAAAAJ,dtfZ0wcAAAAJ,Derek Corcoran,Aarhus University
q9oUJekAAAAJ,cl7ccZQAAAAJ,Roberto O. Chávez,"Laboratorio de Geo-información y percepción remota, Instituto de Geografía, PUCV, Chile"
q9oUJekAAAAJ,VeJEo1AAAAAJ,Horacio Samaniego,"Associate Professor, Universidad Austral de Chile, Valdivia, Chile"
q9oUJekAAAAJ,xtfNt9IAAAAJ,Christian Salas-Eljatib,"Full Professor of Biometrics, Universidad Mayor"
q9oUJekAAAAJ,Vmip72MAAAAJ,Dante Travisany,Universidad de las Américas (CL)
q9oUJekAAAAJ,XEJinUMAAAAJ,Sheina Koffler,Universidade de São Paulo
q9oUJekAAAAJ,EJajBk4AAAAJ,Celso Barbieri,University of Sao Paulo
q9oUJekAAAAJ,PzzNcq0AAAAJ,Betina Blochtein,"Professora de Ciências Biológicas, Pontifícia Universidade Católica do Rio Grande do Sul"
q9oUJekAAAAJ,4xd-rdoAAAAJ,Kayna Agostini,Professor da Universidade Federal de São Carlos
q9oUJekAAAAJ,kfPBqaoAAAAJ,Pedro Ferrer Rosende,"POWAH-UAB, Universitat Autònoma de Barcelona. CIAPEC, INTA, Universidad de Chile."
q9oUJekAAAAJ,OgLD07gAAAAJ,Leydy Johana Cardona Salazar,"Investigadora, Universidad de Caldas"
q9oUJekAAAAJ,KcGep0YAAAAJ,Maria Florencia Tevy,Assistant Professor Universidad Mayor
q9oUJekAAAAJ,mYN1dVQAAAAJ,Alejandro Maass,"Center for Mathematical Modeling, University of Chile"
q9oUJekAAAAJ,Mv3Lrr0AAAAJ,Rosa A. Scherson,Associate Professor Universidad de Chile
3Bm3kF0AAAAJ,FaQmivgAAAAJ,David Santibáñez Gómez,"Profesor de Didáctica de las Ciencias, Universidad Finis Terrae"
3Bm3kF0AAAAJ,B0JgDB4AAAAJ,Pablo A. Marquet,"Professor of Ecology, Pontificia Universidad Catolica de Chile & The Santa Fe Institute"
3Bm3kF0AAAAJ,4S09yXQAAAAJ,Claudia Vergara,Universidad Alberto Hurtado
3Bm3kF0AAAAJ,UEZIAhQAAAAJ,Johanna Camacho González,Académica
3Bm3kF0AAAAJ,yZ0LpyIAAAAJ,Cintia Cornelius,"Professor, Universidade Federal do Amazonas, Brasil"
3Bm3kF0AAAAJ,VeJEo1AAAAAJ,Horacio Samaniego,"Associate Professor, Universidad Austral de Chile, Valdivia, Chile"
3Bm3kF0AAAAJ,J_mpNHsAAAAJ,Luis A. Ebensperger,P. Universidad Católica de Chile
3Bm3kF0AAAAJ,iwbIY3wAAAAJ,Katrin Böhning-Gaese,"Senckenberg Biodiversity and Climate Research Centre, Frankfurt (Germany)"
5y3VZUsAAAAJ,ls1tzNUAAAAJ,Álvaro Huerta Ojeda (ORCID: 0000-00...,"Núcleo de Investigación en Salud, Actividad Física y Deporte ISAFYD, Universidad de Las Américas"
5y3VZUsAAAAJ,vK1En8IAAAAJ,Sergio Galdames Maliqueo,Universidad de Playa Ancha
5y3VZUsAAAAJ,ewDJu18AAAAJ,Soledad Estrella,Pontificia Universidad Catolica de Valparaiso - CHILE
sa0Zrl8AAAAJ,YWuIl-kAAAAJ,MARIA JOSE FIGUERAS SALVAT,"PROFESSOR OF MICROBIOLOGY , UNIVERSITY ROVIRA I VIRGILI"
sa0Zrl8AAAAJ,EpkibjQAAAAJ,Luis Collado,UAM
sa0Zrl8AAAAJ,1T6x2tAAAAAJ,Stephen Forsythe,foodmicrobe.com
sa0Zrl8AAAAJ,fojm4DYAAAAJ,Jenny C. Fisher,Indiana University Northwest
sa0Zrl8AAAAJ,HC5W7swAAAAJ,Sandra L. Mclellan,"Professor, University of Wisconsin-Milwaukee"
sa0Zrl8AAAAJ,sR9ueg4AAAAJ,Susan Joseph,King's College London
sa0Zrl8AAAAJ,CKTD8kgAAAAJ,Jesus L. Romalde (ORCID: 0000-0003...,"Universidad de Santiago de Compostela, Spain"
sa0Zrl8AAAAJ,TwBw6SQAAAAJ,Ana L Diéguez,Universidade de Santiago de Compostela
sa0Zrl8AAAAJ,cji_BxcAAAAJ,Matías Poblete-Morales,Universidad Autónoma de Chile
sa0Zrl8AAAAJ,PeVPwHsAAAAJ,Jorge Levican Asenjo,Universidad de Chile
sa0Zrl8AAAAJ,b0Lvl7sAAAAJ,Evelyn Silva-Moreno,Universidad Mayor
sa0Zrl8AAAAJ,Uo8fkkgAAAAJ,Ignacio Ramos-Tapia,"Postdoctoral research in Gene2Dis, Universidad Andres Bello"
ymoqnSgAAAAJ,LibUSzoAAAAJ,Michael Gehm,"Professor of Electrical and Computer Engineering and Physics, Duke University"
ymoqnSgAAAAJ,2QFNPAkAAAAJ,Dathon Golish,University of Arizona
ymoqnSgAAAAJ,CcSZwTsAAAAJ,David J Brady,"J. W. and H. M. Goodman Endowed Chair in Optical Sciences, University of Arizona"
ymoqnSgAAAAJ,YPM6KxAAAAAJ,Sergio N. Torres,"Professor of Electrical Engineering, University of Concepcion"
ymoqnSgAAAAJ,X3UDDjoAAAAJ,Pablo Meza,Universida de La Frontera
ymoqnSgAAAAJ,3CSEswwAAAAJ,Daniel Marks,"Department of Electrical and Computer Engineering, Duke University"
ymoqnSgAAAAJ,4cGeq0AAAAAJ,Gonzalo Farias,"Pontificia Universidad Catolica de Valparaiso, UNED, CIEMAT"
ymoqnSgAAAAJ,Ubba3VMAAAAJ,Ryoichi HORISAKI,The University of Tokyo
ymoqnSgAAAAJ,u6K_sU8AAAAJ,Rafael Molina,"Professor of Computer Science, University of Granada"
ymoqnSgAAAAJ,aucB85kAAAAJ,Aggelos K Katsaggelos,"Joseph Cummings Professor of ECE (Courtesy CS and Radiology), Northwestern University"
ymoqnSgAAAAJ,fEK64woAAAAJ,Juan Pablo Staforelli Vivanco,Universidad de Concepción
ymoqnSgAAAAJ,MiN67sAAAAAJ,Rodrigo Reeves,"Associate Professor, CePIA, Astronomy Department, Universidad de Concepción, Chile"
ymoqnSgAAAAJ,6YDZBwgAAAAJ,Carlos Saavedra,"Center for Optics and Photonics, Universidad de Concepción"
ymoqnSgAAAAJ,fv8AKTEAAAAJ,S. Derin Babacan,Amazon
nw8TSuUAAAAJ,MHW0UdYAAAAJ,Jose Luis Martinez,Research professor CSIC
nw8TSuUAAAAJ,7x2N9moAAAAJ,Sergio H. Marshall,Profesor Pontificia Universidad Catolica de Valparaiso
nw8TSuUAAAAJ,wQywY-EAAAAJ,Robert E. W. Hancock,University of British Columbia
nw8TSuUAAAAJ,W5HauZoAAAAJ,Fernando Rojo,"Research Professor, Centro Nacional de Biotecnología, CSIC, Madrid (Spain)"
nw8TSuUAAAAJ,PbYnUCUAAAAJ,Felipe Lira,Institut de Recherche en Horticulture et Semences - IRHS
MKDk35YAAAAJ,9XtOaBUAAAAJ,Waldo Quiroz,Pontificia Universidad Católica de Vaparaíso
MKDk35YAAAAJ,lw0PhBgAAAAJ,Alejandro Olivieri,Profesor de Química Analítica
MKDk35YAAAAJ,h435Q34AAAAJ,Graciela Escandar,"Profesora Asociada de Química Analítica, Universidad Nacional de Rosario"
MKDk35YAAAAJ,ra_WwgsAAAAJ,Teresa Moreno,Investigador CSIC
MKDk35YAAAAJ,P-sMWA0AAAAJ,Pablo Richter,"Full Professor, University of Chile"
MKDk35YAAAAJ,CdhGscUAAAAJ,Luis Mercado Vianco,Pontificia Universidad Católica de Valparaíso
MKDk35YAAAAJ,MrRKO3MAAAAJ,Sébastien Sauvé,"Professeur titulaire de chimie environnementale, Université de Montréal"
MKDk35YAAAAJ,Q2P4D4wAAAAJ,Francisco Cereceda-Balic,Professor Universidad Tecnica Federico Santa Maria
MKDk35YAAAAJ,fI57bqcAAAAJ,Jörg Feldmann,"TESLA - Analytical Chemistry, University of Graz"
MKDk35YAAAAJ,hHBkWsgAAAAJ,Zoltan Mester,National Research Council Canada
MKDk35YAAAAJ,rWbAMccAAAAJ,Ítalo Braga Castro,Universidade Federal de São Paulo - Campus Baixada Santista
MKDk35YAAAAJ,S6EqbJUAAAAJ,Wolfgang Stotz,Universidad Católica del Norte
MKDk35YAAAAJ,qZkYQxIAAAAJ,Xavier Querol,"Research Professor at CSIC, IDAEA, Spanish Research Council"
MKDk35YAAAAJ,5_vp4DsAAAAJ,Eduardo Pinilla-Gil,University of Extremadura
MKDk35YAAAAJ,ohz0wccAAAAJ,Claudio A. Sáez,Universidad de Playa Ancha
MKDk35YAAAAJ,B_dv3uUAAAAJ,Héctor Mansilla,Professor of organic chemistry
MKDk35YAAAAJ,dTtnOeYAAAAJ,Jorge Yañez,University of Concepcion
MKDk35YAAAAJ,Qpgm5hkAAAAJ,Alexis A Gonzalez,Pontificia Universidad Católica de Valparaíso
MKDk35YAAAAJ,RRCqUogAAAAJ,Marcos Flores,Universidad de Chile
WB_qsXIAAAAJ,Sb2oKiMAAAAJ,R. Eduardo Palma,"Departamento de Ecología, Pontificia Universidad Católica de Chile"
WB_qsXIAAAAJ,5I-xlcAAAAAJ,Dusan Boric,"Temporal Researcher VRIEA, Lecturer Pontificia Universidad Católica de Valparaíso"
WB_qsXIAAAAJ,WSfSPbgAAAAJ,Joseph A. Cook,"Professor of Biology, University of New Mexico"
WB_qsXIAAAAJ,ejg43L8AAAAJ,Marcela Ferres,"Professor of Pediatrics, Pontificia Universidad Catolica de Chile"
WB_qsXIAAAAJ,X4A3nzwAAAAJ,"Cattan, P. E.",universidad de chile
WB_qsXIAAAAJ,aOmSM_4AAAAJ,Ricardo Campos-Soto,"Escuela de Ciencias Agrícolas y Veterinarias, Universidad Viña del Mar"
WB_qsXIAAAAJ,B0JgDB4AAAAJ,Pablo A. Marquet,"Professor of Ecology, Pontificia Universidad Catolica de Chile & The Santa Fe Institute"
WB_qsXIAAAAJ,9xWEVqwAAAAJ,Pablo Vial,Universidad del Desarrollo
WB_qsXIAAAAJ,vI2dcjoAAAAJ,Antonella Bacigalupo,"PhD Student, University of Glasgow"
WB_qsXIAAAAJ,GxRrR5sAAAAJ,Tony Schountz,Colorado State University
a6-oZHYAAAAJ,4cGeq0AAAAAJ,Gonzalo Farias,"Pontificia Universidad Catolica de Valparaiso, UNED, CIEMAT"
PbTuJx0AAAAJ,B5CQthsAAAAJ,Luiz Airton Consalter,"Professor de Engenharia Mecânica, Universidade de Passo Fundo"
PbTuJx0AAAAJ,TYnRaVkAAAAJ,Antonio Batocchio,"Professor of Manufacturing and Management Systems, State University of Campinas"
PbTuJx0AAAAJ,u1fE7loAAAAJ,Paulo Afonso,"Assistant Professor, Dep. of Production and Systems, University of Minho"
PbTuJx0AAAAJ,Gi--T7MAAAAJ,Luis Pérez Pozo,"Department of Mechanical Engineering, UTFSM, Chile"
PbTuJx0AAAAJ,sTZSdSUAAAAJ,Irene Roda,"Assistant Professor, Politecnico di Milano"
PbTuJx0AAAAJ,iC1zxr4AAAAJ,Ricardo Soto,Pontificia Universidad Catolica de Valparaiso
PbTuJx0AAAAJ,groCyV0AAAAJ,André J. Souza,Associate Professor at UFRGS
PbTuJx0AAAAJ,S-mmGIMAAAAJ,Adolfo Crespo Márquez,Prof. of the Dept. of Industrial Management. University of Sevilla
PbTuJx0AAAAJ,gwAvOIUAAAAJ,Antonio J. Guillén,University of Seville
UR6tfqAAAAAJ,iC1zxr4AAAAJ,Ricardo Soto,Pontificia Universidad Catolica de Valparaiso
UR6tfqAAAAAJ,5U09hmoAAAAJ,Francisco Altimiras,"Universidad de las Américas, Chile"
UR6tfqAAAAAJ,YSWMEeQAAAAJ,Oscar Peredo,Liberty Latin America (Telecom)
UR6tfqAAAAAJ,1ULUsmIAAAAJ,Eric Monfroy,"Professor of Computer Science, Université de Nantes"
UR6tfqAAAAAJ,ltsTTI4AAAAJ,Eduardo Graells-Garrido 🐦,"Department of Computer Science, Universidad de Chile"
UR6tfqAAAAAJ,IX3ElicAAAAJ,Christopher Pope,Telefónica I+D Chile
QbZkhhcAAAAJ,MHW0UdYAAAAJ,Jose Luis Martinez,Research professor CSIC
QbZkhhcAAAAJ,azuHLAEAAAAJ,Paula Blanco,PhD Student
QbZkhhcAAAAJ,nw8TSuUAAAAJ,Jorge Olivares Pacheco,"Porfesor Jerarquizado, Pontificia Universidad Católica de Valparaíso"
QbZkhhcAAAAJ,KI4HmC0AAAAJ,JOSE ANTONIO REALES-CALDERON,"Institute of Molecular and Cell Biology (IMCB) Agency for Science, Technology and Research (A*STAR)"
QbZkhhcAAAAJ,PbYnUCUAAAAJ,Felipe Lira,Institut de Recherche en Horticulture et Semences - IRHS
QbZkhhcAAAAJ,1a9oPXAAAAAJ,Teresa Gil,"CNB, Centro Nacional de Biotecnología"
QbZkhhcAAAAJ,1j1FAaYAAAAJ,Pablo Laborda Martínez,Postdoctoral researcher
QbZkhhcAAAAJ,8MzKskYAAAAJ,Fernando Sanz García,Postdoctoctoral researcher in Universidad de Zaragoza
QbZkhhcAAAAJ,MtE8qEEAAAAJ,Paula H Blanco-Sanchez,"CEAC, EBRI (Energy & Bioproducts Research Institute), Aston University"
tSRFmKEAAAAJ,GJZ1k1kAAAAJ,Debora Fino,"Professore di Impianti Chimici, Politecnico di Torino"
tSRFmKEAAAAJ,CTzAnu4AAAAJ,Guido Saracco,Politecnico di Torino - Department of Applied Science and Technology
tSRFmKEAAAAJ,TLV5YzIAAAAJ,Pablo Domínguez de María,"Founder & CEO at Sustainable Momentum, SL"
tSRFmKEAAAAJ,SvMw9GwAAAAJ,Giancarlo Richard Salazar Banda,Universidade Tiradentes
tSRFmKEAAAAJ,FMZ_1woAAAAJ,Dreidy Mercedes Vásquez Sandoval,Pontificia Universidad Católica de Valparaíso
tSRFmKEAAAAJ,WYlKQJ8AAAAJ,Jaime Morales Saavedra,Profesor Pontificia Universidad Católica de Valparaiso
tSRFmKEAAAAJ,QGnIJQona2sC,Danilo Carvajal,Universidad de La Serena
tSRFmKEAAAAJ,QtRlWdgAAAAJ,Carlos A Martinez Huitle,Federal University of Rio Grande do Norte
tSRFmKEAAAAJ,vymT7IIAAAAJ,Alessandro Monteverde Videla,Politecnico di Torino
QMQA218AAAAJ,RatiGiQAAAAJ,Scott Levin,"Sr. Director Research & Innovation, Beckman Coulter; Associate Professor, Johns Hopkins …"
QMQA218AAAAJ,pFQAKFYAAAAJ,Jeremiah S. Hinson,"Johns Hopkins University School of Medicine, Emergency Medicine"
QMQA218AAAAJ,XDaVfmEAAAAJ,Eili Klein,Johns Hopkins University
QMQA218AAAAJ,ZMI53EoAAAAJ,Kathleen R. Page,Johns Hopkins University School of Medicine
QMQA218AAAAJ,JgzLWYoAAAAJ,Alexandra T. Strauss,Johns Hopkins University
QMQA218AAAAJ,8EUeAxsAAAAJ,Gary Lin,Johns Hopkins University Applied Physics Laboratory
QMQA218AAAAJ,miCMtj4AAAAJ,Felipe Feijoo,"PUCV - Past: PNNL-JGCRI, JHU, MIT"
QMQA218AAAAJ,MTLzcdgAAAAJ,Aaron M Milstone,Johns Hopkins University
QMQA218AAAAJ,txkgbO0AAAAJ,Diana Prieto,Pontificia Universidad Católica de Valparaíso - Johns Hopkins University
QMQA218AAAAJ,fsbAW_YAAAAJ,James Fackler,The Johns Hopkins University School of Medicine
QMQA218AAAAJ,D7Ms9fIAAAAJ,Sauleh Siddiqui,"Professor of Environmental Science and Mathematics & Statistics, American University"
QMQA218AAAAJ,KAiSN1EAAAAJ,Cassandra Parent,Johns Hopkins University
QMQA218AAAAJ,lxBGmaQAAAAJ,Richard E. Rothman,"Professor, Johns Hopkins University, Emergency Medicine, Infectious Diseases"
QMQA218AAAAJ,7PeekG0AAAAJ,Simon Levin,"Professor of Ecology and Evolutionary Biology, Princeton University"
QMQA218AAAAJ,mp6FkGkAAAAJ,Shuai Huang,University of Washington
QMQA218AAAAJ,AZcprXQAAAAJ,Andrew Taylor,Yale University
QMQA218AAAAJ,xMgL3aYAAAAJ,Andrés Garcia-Arce,"Research Associate, Geisinger Health System"
QMQA218AAAAJ,3YZy5TwAAAAJ,Frederick Korley,University of Michigan
QMQA218AAAAJ,CYdYNl0AAAAJ,Kimia Ghobadi,Johns Hopkins University
QMQA218AAAAJ,inz7oWwAAAAJ,Heba Mostafa,Associate Professor of Pathology
QMQA218AAAAJ,lqtfycwAAAAJ,Karen Carroll,Johns Hopkins University School of Medicine
QMQA218AAAAJ,EMky6B4AAAAJ,Aria G. Smith,Johns Hopkins University
QMQA218AAAAJ,iso4_9MAAAAJ,James Benneyan,
QMQA218AAAAJ,Vq7h1uEAAAAJ,Laila Cure,Wichita State University
QMQA218AAAAJ,Ms5Q0F4AAAAJ,Benjamin Djulbegovic,"Professor, City of Hope"
QMQA218AAAAJ,KARO9RoAAAAJ,Cui Yang (she/her/hers),Rutgers School of Public Health
QMQA218AAAAJ,qhGbW2wAAAAJ,Sriram Sankaranarayanan,"Indian Institute of Management, Ahmedabad"
QMQA218AAAAJ,HFljdoEAAAAJ,Jorge A. Acuña,"Postdoctoral Scholar, University of South Florida"
QMQA218AAAAJ,Q_-ukSgAAAAJ,"Simon C. Mathews, MD",Johns Hopkins University School of Medicine
QMQA218AAAAJ,R6I47vYAAAAJ,Jimi Oke,University of Massachusetts Amherst
QMQA218AAAAJ,EO7XqlUAAAAJ,Lauren Gardner,"Associate Professor, Johns Hopkins University"
QMQA218AAAAJ,g2Whhq0AAAAJ,Takeru Igusa,Johns Hopkins University
QMQA218AAAAJ,ZX4YNysAAAAJ,Samantha P. Williams,Centers for Disease Control and Prevention
QMQA218AAAAJ,Q7uIlTcAAAAJ,Jong M. Shin,Johns Hopkins University
QMQA218AAAAJ,BbRu3i4AAAAJ,Lawrence CH Hsu,Johns Hopkins University
QMQA218AAAAJ,5exOyokAAAAJ,Manuel Hermosilla,Johns Hopkins University
QMQA218AAAAJ,d4bTy4kAAAAJ,Justin Lessler,"Professor, Department of Epidemiology, UNC Gillings School of Global Public Health"
QMQA218AAAAJ,p44km2cAAAAJ,Anne Marie Lennon,Johns Hopkins University
QMQA218AAAAJ,6DpF_8AAAAAJ,Andrew T Gaynor,US Army Research Laboratory
QMQA218AAAAJ,sAuq57EAAAAJ,Anindya Bhaduri,"Research Engineer, GE Research"
QMQA218AAAAJ,WAiFLlgAAAAJ,Ellen Stein,Johns Hopkins 
QMQA218AAAAJ,FRqBurUAAAAJ,Timothy Matis,"Department of Industrial, Manufacturing, and Systems Engineering"
QMQA218AAAAJ,k4L0SMsAAAAJ,ABHISHAKE KUNDU,Texas Tech University
QMQA218AAAAJ,zcEHDgQAAAAJ,Frederik Plesner Lyngse,University of Copenhagen
QMQA218AAAAJ,LgilJWEAAAAJ,Seun Anjorin,University of Warwick
QMQA218AAAAJ,IMV5E2IAAAAJ,Professsor Olalekan Uthman,University of Warwick
QMQA218AAAAJ,fhBFhagAAAAJ,Brian Lee,Allen Institute for Brain Science
QMQA218AAAAJ,cHXRCB4AAAAJ,Leonardo Martinez,"Assistant Professor, Boston University School of Public Health, Department of Epidemiology"
QMQA218AAAAJ,Xg07tEIAAAAJ,Jakob Jonnerby,Research associate
QMQA218AAAAJ,MrBHXhwAAAAJ,Trish Simner,"Associate Professor of Pathology, Johns Hopkins University"
QMQA218AAAAJ,m8Ru90cAAAAJ,Rajib Paul,UNC Charlotte
QMQA218AAAAJ,DP_t_ZYAAAAJ,Nicholas Risko,Johns Hopkins School of Medicine
QMQA218AAAAJ,o-N-uBkAAAAJ,Juliane Wurm,"Research Fellow, HFR Freiburg – Kantonsspital/ Luzerner Kantonsspital"
QMQA218AAAAJ,QdtYsl0AAAAJ,Ayse P Gurses,Johns Hopkins University
QMQA218AAAAJ,CWwXkxcAAAAJ,Tapas K. Das,"Professor and Chair of Industrial and Management Systems Engineering, University of …"
QMQA218AAAAJ,0Jm2ikEAAAAJ,Brian Lee,Centers for Disease Control and Prevention
ewDJu18AAAAJ,gmsJGrkAAAAJ,Pedro Vidal-Szabó,Pontificia Universidad Católica de Valparaíso
ewDJu18AAAAJ,c1VmKiMAAAAJ,Sergio Morales Candia,Universidad de Concepción
ewDJu18AAAAJ,rqNjbIYAAAAJ,Diana Zakaryan,Pontificia Universidad Católica de Valparaíso
ewDJu18AAAAJ,RuMejxoAAAAJ,Masami Isoda,"University of Tsukuba, Mathematics Education, Professor"
ewDJu18AAAAJ,-1yBhA0AAAAJ,Gonzalo Espinoza-Vásquez,Universidad Alberto Hurtado
ewDJu18AAAAJ,BcamrakAAAAJ,maritza galindo,Universidad San Sebastián
ewDJu18AAAAJ,5y3VZUsAAAAJ,Pablo Andres Caceres Serrano,Profesor asociado Escuela de Psicología Pontificia Universidad Católica de Valparaíso
ewDJu18AAAAJ,6VZeLXEAAAAJ,Eric Flores Medrano,Universidad Complutense de Madrid
ewDJu18AAAAJ,6WLN2H0AAAAJ,José Carrillo Yáñez,"Profesor de Didáctica de la Matemática, Universidad de Huelva"
ewDJu18AAAAJ,wwURSgUAAAAJ,Gloria Icaza,Universidad de Talca
ewDJu18AAAAJ,iq6x31kAAAAJ,Ernesto San Martin,"Full Professor of Statistics, Pontificia Universidad Católica de Chile"
ewDJu18AAAAJ,Dk_phhwAAAAJ,ximena galdames castillo,Universidad Diego Portales
ewDJu18AAAAJ,2G5e0DQAAAAJ,Roberto Araya,"Centro de Investigación Avanzada en Educación, Universidad de Chile"
ewDJu18AAAAJ,e7otmVcAAAAJ,Laura Leticia Ramos Rifo,"Instituto de Matemática, Estatística e Computação Científica, Unicamp"
ewDJu18AAAAJ,5dJaYflLtqwC,Raimundo Olfos,Pontificia Universidad Católica de Valparaiso
zdIuFAUAAAAJ,7mzmAsUAAAAJ,Katherine Garcia,Universidad Autónoma de Chile
zdIuFAUAAAAJ,GIB2jSAAAAAJ,Romilio Espejo,"Instituto de Nutrición y Tecnología de los Alimentos, Universidad de Chile"
zdIuFAUAAAAJ,W8THEBcAAAAJ,Nicolás Plaza Morales,Universidad Autónoma de Chile
zdIuFAUAAAAJ,6UknP20AAAAJ,Daniel Castillo,"Assistant Professor, Universidad SEK"
zdIuFAUAAAAJ,dC9ANWEAAAAJ,Diliana Pérez Reytor,Universidad Autónoma de Chile
zdIuFAUAAAAJ,MobzyWoAAAAJ,Jaime Romero,Profesor Asociado Biotecnología
zdIuFAUAAAAJ,ryWpeWIAAAAJ,Gino Corsini,Universidad Autónoma de Chile
zdIuFAUAAAAJ,Ukp9znUAAAAJ,Leonardo Pavez,"Universidad de Las Américas, Chile"
zdIuFAUAAAAJ,SNz4keUAAAAJ,Carlos J Blondel,Universidad Andres Bello
zdIuFAUAAAAJ,bvtMvBUAAAAJ,Paola Navarrete,"Associate Professor, INTA, University of Chile"
