scholar_id_autor_gs,scholar_id_gs_coauthor,nombre_coauthor,cargo
0ngEy-EAAAAJ,x2wtU-oAAAAJ,Patricia Palma,Profesora Asistente. Departamento de Ciencias Históricas y Geográficas. Universidad  de Tarapacá.
0ngEy-EAAAAJ,BhfArywAAAAJ,José Díaz-Bahamonde,"Profesor Docente Asociado, Pontificia Universidad Católica de Chile"
VhnImccAAAAJ,k1bclyIAAAAJ,Santiago Mingo,Pontificia Universidad Catolica de Chile
VhnImccAAAAJ,mrooqMQAAAAJ,Luis Alfonso Dau,Northeastern University
VhnImccAAAAJ,2EsTFjcAAAAJ,Seth Carnahan,Washington University
VhnImccAAAAJ,wtn2uVMAAAAJ,Exequiel Hernandez,"The Wharton School, University of Pennsylvania"
VhnImccAAAAJ,OCsqa58AAAAJ,Britta Glennon,Wharton School at the University of Pennsylvania
VhnImccAAAAJ,o4T-FWMAAAAJ,Jeffrey J. Reuer,University of Colorado
5Ck_XAcAAAAJ,Lv4KzjIAAAAJ,Peter Ditto,"Professor of Psychology & Social Behavior, UC Irvine"
5Ck_XAcAAAAJ,Mv8fFWQAAAAJ,Jake P. Moskowitz,University of Georgia
5Ck_XAcAAAAJ,Sf9WGKsAAAAJ,Shana Kushner Gadarian,"Merle Golberg Fabian Professor of Excellence in Citizenship and Critical Thinking, Political Science"
5Ck_XAcAAAAJ,wV2qA3YAAAAJ,Sara Wallace Goodman,"Professor of Political Science, University of California Irvine"
5Ck_XAcAAAAJ,kUbh19wAAAAJ,Thomas B. Pepinsky,"Walter F. LaFeber Professor of Government and Public Policy, Cornell University"
5Ck_XAcAAAAJ,srq2dq8AAAAJ,Megan M. Ringel,"Assistant Professor of Psychology, St. Edward's University"
aULqPXoAAAAJ,O3AGggMAAAAJ,Juan Pablo Torres-Martínez,"Full Professor, Department of Economics, University of Chile"
aULqPXoAAAAJ,zhJ_wAUAAAAJ,Esteban Puentes,Associate Professor
aULqPXoAAAAJ,tGeeikYAAAAJ,Carlos Hervés-Beloso,RGEAF-ECOBAS. Facultad de Económicas. Universidad de Vigo
aULqPXoAAAAJ,_NXK8IQAAAAJ,Alejandra Marinovic,"Assistant Professor, Pontificia Universidad Católica de Chile"
aULqPXoAAAAJ,-cwJBmwAAAAJ,Matias Fuentes.,Ph.D. in Theoretical Economics; Postdoc in Applied Mathematics.
aULqPXoAAAAJ,D78GgQ0AAAAJ,Claudia Martínez A.,Inter-American Development Bank
Sw8zFZ4AAAAJ,Ur0sEbAAAAAJ,Pedro Bouchon,"Professor of Chemical and Bioprocess Engineering, Pontificia Universidad Católica de Chile"
Sw8zFZ4AAAAJ,-VV8gBoAAAAJ,A Leiva,Pontificia Universidad Católica de Chile
Sw8zFZ4AAAAJ,YNGztWsAAAAJ,Manuel Villalon,"Profesor de Fisiología, Pontificia Universidad Catolica de Chile"
Sw8zFZ4AAAAJ,oEi88zsAAAAJ,Bryony James,University of Waikato
vdId4UIAAAAJ,kQu0FFYAAAAJ,German Scalzo,"Profesor investigador, Universidad Panamericana"
vdId4UIAAAAJ,JuMAllMAAAAJ,Ignacio Ferrero,School of Economics and Business. Universidad de navarra
vdId4UIAAAAJ,99XDkQUAAAAJ,Carlos Rodriguez-Lluesma,"Professor of Organizational Behavior, IESE Business School"
4nXXudYAAAAJ,wwf7ZOMAAAAJ,Enrique Guerrero Pérez (ORCID: 0000...,"Facultad de Comunicación, Universidad de Navarra, España"
4nXXudYAAAAJ,lLIaeqcAAAAJ,Cristina González-Oñate,Universidad Jaume I
4nXXudYAAAAJ,MJdlScEAAAAJ,Patricia Diego (ORCID: 0000-0002-76...,"Universidad de Navarra, Facultad de Comunicación, Dpto. de Cultura y Comunicación Audiovisual"
4nXXudYAAAAJ,giRtLnoAAAAJ,Cristóbal Benavides,Facultad de Comunicación Universidad de los Andes
4nXXudYAAAAJ,9HV0j14AAAAJ,Aldo van Weezel,Clientis
4nXXudYAAAAJ,0zbd_icAAAAJ,Leonardo Liberman,Libens R+D
4nXXudYAAAAJ,wwvxqlsAAAAJ,Maria Jose Bosch,"ESE Business School, Universidad de los Andes, Chile"
cn4QApIAAAAJ,awlMq2sAAAAJ,Manuel Salas Fernandez,Universidad de los Andes
B-QpibgAAAAJ,OigXnBwAAAAJ,Jaime Cubides-Cárdenas,Catedrático en Derecho Público. Universidad Católica de Colombia
B-QpibgAAAAJ,KC8FCFgAAAAJ,Édgar Hernán Fuentes-Contreras,"Universidad de los Andes, Chile"
B-QpibgAAAAJ,SrF_88EAAAAJ,Julian Pinilla,Profesor de Derecho Constitucional
n-P2-NwAAAAJ,0W-BzeAAAAAJ,Jaime A. Anguita,"Professor, Universidad de los Andes - Chile"
N9RWllQAAAAJ,YeVDxUIAAAAJ,Regina Vera Villas Bôas,Professora Bi-Doutora em Direito pela PUC-SP
N9RWllQAAAAJ,tBJYV6YAAAAJ,Elisaide Trevisam,"Professor de Direito, Universidade Federal de Mato Grosso do Sul - UFMS"
kfcBt4UAAAAJ,BqBjxd0AAAAJ,Cecilia Claro,"Profesora Facultad de Comunicación, Universidad de los Andes"
kfcBt4UAAAAJ,LQxDi30AAAAJ,Rubén Arnoldo González Macías,Benemérita Universidad Autónoma de Puebla
kfcBt4UAAAAJ,fIPQgywAAAAJ,Martín Echeverria,Benemerita Universidad Autónoma de Puebla
kfcBt4UAAAAJ,Y0C7fpcAAAAJ,ALEJANDRA JANS,"Universidad de La Frontera, Académico del Depto de Odontopediatría y Ortodoncia"
kfcBt4UAAAAJ,giRtLnoAAAAJ,Cristóbal Benavides,Facultad de Comunicación Universidad de los Andes
kfcBt4UAAAAJ,VCN9GTsAAAAJ,Julián Andrés Burgos Suárez,Universidad de Manizales
aM2aPlcAAAAJ,KudA36sAAAAJ,Maria Teresa Urrutia,Universidad Andres Bello
mQ9_m10AAAAJ,-5qMVbcAAAAJ,Christian Berger,Pontificia Universidad Católica de Chile
XU1_ERUAAAAJ,OiLzAL8AAAAJ,Andres Caicedo,"Universidad San Francisco de Quito USFQ, Colegio de Ciencias de la Salud COCSA, Escuela de Medicina"
XU1_ERUAAAAJ,nNg3HGIAAAAJ,Andrea C. Landázuri,Universidad San Francisco de Quito
XU1_ERUAAAAJ,dimgEVUAAAAJ,Ivonne Salinas Avalo,Universidad San Francisco de Quito
zd2Fg_wAAAAJ,umU2m0cAAAAJ,Oscar Jaramillo Castro,"Académico, Universidad Finis Terrae"
zd2Fg_wAAAAJ,V7777OoAAAAJ,Alejandro Vega,Universidad Autónoma de Chile
zd2Fg_wAAAAJ,I_k3TvoAAAAJ,Guido Salazar-Sepúlveda,Universidad Católica de la Santísima Concepción
zd2Fg_wAAAAJ,h-05BmsAAAAJ,Oscar Espiritusanto,Profesor en el Departamento de Periodismo y Comunicación Audiovisual de la Universidad Carlos III de Madrid
GmupiZIAAAAJ,nO41ZIsAAAAJ,Iván Pinto Veas,"Instituto de Comunicación e Imagen, Universidad de Chile"
eu6JAQUAAAAJ,UY5TDqEAAAAJ,Rodrigo Oyonarte,"Profesor Titular, Director Programa de Especialización en Ortodoncia, Universidad de los Andes"
eu6JAQUAAAAJ,wQwcHlAAAAAJ,Valeria Ramirez,Universidad de los Andes Chile
9BP2YJYAAAAJ,1L7XuNsAAAAJ,Tomas Rau,Pontificia Universidad Catolica de Chile
4o0tRRsAAAAJ,As3fty8AAAAJ,William Ellis Foster,"Professor of Agricultural and Resource Economics, Pontificia Universidad Católica de Chile"
4o0tRRsAAAAJ,GhUvakIAAAAJ,Oscar Melo,"Associate Professor. Agricultural and Resource Economics, Pontificia Universidad Catolica de Chile"
4o0tRRsAAAAJ,K9F7h2EAAAAJ,Rodrigo A Arriagada,Pontificia Universidad Catolica de Chile
zUoKAv0AAAAJ,LGe1Yu0AAAAJ,Niazur Rahim,
