scholar_id_autor_gs,scholar_id_gs_coauthor,nombre_coauthor,cargo
Nc4A2kQAAAAJ,fNw-xX4AAAAJ,Eduardo Sandoval-Obando,Académico en Universidad Autónoma de Chile
Nc4A2kQAAAAJ,s_zCIzAAAAAJ,Fernando Oyarce Ortuya,"Profesor, Universidad Autónoma de Chile"
Nc4A2kQAAAAJ,JudAH9QAAAAJ,Viviana Huiliñir-Curío,"Centro Internacional de Estudios de La Patagonia, Núcleo de Cs. Sociales y Humanidades, Universidad de La Frontera"
Nc4A2kQAAAAJ,uYeQ0b4AAAAJ,Felipe Saravia Cortés,"Departamento de Ciencias Sociales, Escuela de Trabajo Social - Universidad del Bio Bio"
Nc4A2kQAAAAJ,xEo5YdMAAAAJ,Matías,Universidad Mayor
U82L77MAAAAJ,BbRajoQAAAAJ,Cristián A. Amador,Universidad San Sebastian
U82L77MAAAAJ,jnEIqx4AAAAJ,Patricio Araos Salas,Universidad Autónoma de Chile
U82L77MAAAAJ,Qpgm5hkAAAAJ,Alexis A Gonzalez,Pontificia Universidad Católica de Valparaíso
U82L77MAAAAJ,y1Sq6MAAAAAJ,Javier Reyes,"Asistente de investigación, Universidad Autónoma de Chile"
smTgKnMAAAAJ,WXXKFawAAAAJ,Ignacio De los Ríos-Carmenado (ORC...,Catedrático de Proyectos. GESPLAN research group. Technical University of Madrid (UPM)
smTgKnMAAAAJ,ja6W4xcAAAAJ,José María Díaz Puente,Universidad Politécnica de Madrid (UPM)
smTgKnMAAAAJ,VoqJ_uIAAAAJ,Jose L. Yagüe,Universidad Politécnica de Madrid
smTgKnMAAAAJ,m7DLFK8AAAAJ,Dante A. Guerrero,"Profesor Principal de Proyectos, Universidad de Piura"
smTgKnMAAAAJ,g8Gaj0kAAAAJ,Susana Sastre-Merino,"PhD, Universidad Politécnica de Madrid"
smTgKnMAAAAJ,92CK-0AAAAAJ,Ana Afonso,Universidad Politécnica de Madrid
smTgKnMAAAAJ,TNBg2fAAAAAJ,Pablo Vidueira,Technical University of Madrid
smTgKnMAAAAJ,LzYxYboAAAAJ,Adolfo Cazorla,"catedratico de Proyectos, Universidad Politecnica de Madrid"
smTgKnMAAAAJ,-I9SRiMAAAAJ,Lorena Soto-Silva,Universidad Mayor
smTgKnMAAAAJ,SV8GS1QAAAAJ,Ricardo Fernandez,Universidad de Los Lagos
Cs5b1aAAAAAJ,6jbwqtcAAAAJ,Andrés Godoy Cumillaf,"Pedagogía en Educación Física, Facultad de Educación, Universidad Autónoma de Chile."
Cs5b1aAAAAAJ,RMkhDrEAAAAJ,JOSE GASTON BRUNEAU CHAVEZ,"Profesor de Educación Física, Universidad de la Fronera"
Cs5b1aAAAAAJ,d3s9pBwAAAAJ,Pilar Valenzuela Rettig,"Profesora e investigadora, Universidad Autónoma de Chile"
Cs5b1aAAAAAJ,NraL83YAAAAJ,Gerardo Fuentes Vilugron,Universidad Católica de Temuco
3xGDa2YAAAAJ,LFHP4R0AAAAJ,Marcelo Werneck Barbosa,Pontificia Universidad Católica de Chile
3xGDa2YAAAAJ,kU1YJPcAAAAJ,Carlos Francisco Simões Gomes,Universidade Federal Fluminense
3xGDa2YAAAAJ,ciaGSewAAAAJ,Marcos Paulo Valadares de Oliveira,Universidade Federal do Espírito Santo
3xGDa2YAAAAJ,fUFdOMEAAAAJ,Paulo Renato de Sousa,Fundação Dom Cabral FDC
3xGDa2YAAAAJ,6wO1Y1EAAAAJ,Rosley Anholon,Professor Universidade Estadual de Campinas
3xGDa2YAAAAJ,2FrGB3kAAAAJ,Tomas Vivanco Larrain,Pontificia Universidad Católica de Chile
3xGDa2YAAAAJ,adrmuM0AAAAJ,Alberto Eduardo Besser Freitag,Universidade Candido Mendes - Professor e Pesquisador do Mestrado em Economia e …
3xGDa2YAAAAJ,aEw5EAMAAAAJ,Julio  Domínguez Granda,Universidad Católica Los Ángeles de Chimbote
3xGDa2YAAAAJ,GRRsprMAAAAJ,Henry Chero-Valdivieso,Universidad Católica Los Ángeles de Chimbote
3xGDa2YAAAAJ,7ZQugUUAAAAJ,Luis Fernando Moreno Garzon,Profesor Universidad Santo Tomas Facultad de Administración de Empresas
3xGDa2YAAAAJ,7q2XqqwAAAAJ,Marta Gisela Durán Gamba,Universidad Santo Tomás Bogotá
3xGDa2YAAAAJ,ZGxwf1cAAAAJ,Claudia Duran San Martin,Universidad Tecnológica Metropolitana
3xGDa2YAAAAJ,PiMqj28AAAAJ,Manuel Eduardo Vargas Guzmán,Universidad de Santiago de Chile
3xGDa2YAAAAJ,D8a6nLEAAAAJ,Guillermo Fuertes,Universidad de Santiago de Chile
3xGDa2YAAAAJ,0zwnLpAAAAAJ,miguel domingo alfaro marchant,Universidad de Santiago de Chile
3xGDa2YAAAAJ,pEUpk_AAAAAJ,Jorge Zamorano Ford,Universidad de Santiago
3xGDa2YAAAAJ,TAEN_RsAAAAJ,"Silva, Fabio Aquino ou Aquino,F. ou Da Silva, FA","Proppi, uff"
3xGDa2YAAAAJ,Q-et41EAAAAJ,Vivian Aparecida Blaso Souza Soares César,Fundação Armando Àlvares Penteado
3xGDa2YAAAAJ,BF-m3fEAAAAJ,Oscar Licandro,Universidad CLAEH
3xGDa2YAAAAJ,AbUmKBYAAAAJ,Susana Herrero Olarte,"Universidad de Las Américas, Quito Ecuador"
3xGDa2YAAAAJ,-atXbP4AAAAJ,Silke Bustamante,Pofessor for Management
3xGDa2YAAAAJ,GLSDgvAAAAAJ,Nelson Stevenson Palamara,Ingeniero Comercial
FsJyqSwAAAAJ,J14cEJEAAAAJ,Squella JA,University of Chile
FsJyqSwAAAAJ,5Lz-0yAAAAAJ,Silvana Moris,Universidad Católica del Maule
TB7hVCoAAAAJ,i6_OY98AAAAJ,Eduardo Rodriguez/ Eduardo Rodrigu...,Profesor de Bioética Universidad de Chile/ Researcher Sloan Kettering Cancer Institute
TB7hVCoAAAAJ,7_Qo5mMAAAAJ,Natacha Salomé Lima,Research Assistant at the National Scientific and Technical Research Council - (CONICET) Argentina
TB7hVCoAAAAJ,LtbEtQMAAAAJ,Darryl R.J. Macer,"President, American University of Sovereign Nations"
U6RfDY4AAAAJ,lQ_eONgAAAAJ,Rodrigo Barcia Lehmann,Universidad Autónoma de Chile. Decano.
U6RfDY4AAAAJ,h8GI-OUAAAAJ,Mayra Cristina Mena Mena,Docente Titular Auxiliar PUCE Ambato
U6RfDY4AAAAJ,FlDZUowAAAAJ,Lescano-Galeas Nathalia,Pontificia Universidad Católica del Ecuador  Sede Ambato
jbjVapAAAAAJ,VWePAhoAAAAJ,Carlos Esse,Universidad Autónoma de Chile
jbjVapAAAAAJ,ICN5Xb8AAAAJ,Rodrigo Santander Massa,Escuela de Graduados UACH
jbjVapAAAAAJ,jajFVW8AAAAJ,Patricio De los Rios-Escalante [or Patri...,"Profesor Asistente, Universidad Catolica de Temuco"
XU5g31EAAAAJ,gvhbe4UAAAAJ,David Jeison,"Department of Chemical Engineering, Universidad de La Frontera"
XU5g31EAAAAJ,RfGKP34AAAAJ,José Luis Campos,"Facultad de Ingeniería y Ciencias, Universidad Adolfo Ibáñez"
XU5g31EAAAAJ,j7kFrjEAAAAJ,Fernando G. Fermoso,Instituto de la Grasa (C.S.I.C.)
XU5g31EAAAAJ,9jo45HEAAAAJ,Antonio Serrano,"Postdoctoral Research Fellow, School of Civil Engineering, The University of Queensland"
dW9JzxkAAAAJ,gPbH4D8AAAAJ,Luis Roa Oppliger,"University of Concepción, Chile"
dW9JzxkAAAAJ,RydjqDwAAAAJ,Andrei Klimov,Universidad de Guadalajara
dW9JzxkAAAAJ,3ufeWtMAAAAJ,Markus Grassl,"International Centre for Theory of Quantum Technologies (ICTQT) , University Gdansk"
iZRjzkEAAAAJ,DP6C6QUAAAAJ,Ramon Bosque,"Profesor de Química, Universitat de Barcelona"
iZRjzkEAAAAJ,ZX-UV5oAAAAJ,M Font-Bardia,associated professor
iZRjzkEAAAAJ,rnkCpP0AAAAJ,Mauricio Fuentealba,Pontificia Universidad Católica de Valparaíso
iZRjzkEAAAAJ,fFMqz54AAAAJ,Shane Robert Wilkinson,"Senior Lecturer, Queen Mary University of London"
iZRjzkEAAAAJ,dbWTBT8AAAAJ,Gabriel Aullón,"Facultad de Química, Universitat de Barcelona"
iZRjzkEAAAAJ,MDwSO5gAAAAJ,Gonzalo Buono-Core,"Professor of Chemistry, Pontificia Universidad Catolica de Valparaiso"
iZRjzkEAAAAJ,hP--SwMAAAAJ,César Zúñiga,"Instituto de Ciencias Naturales, Fac. de Medicina Veterinaria y Agronomía, Universidad de Las"
iZRjzkEAAAAJ,kK0b0NoAAAAJ,Diego Sierra Castro,Universidad de Valparaíso
OYEDuL0AAAAJ,Ao4ApqMAAAAJ,Prof. Sergio Olate,Universidad de La Frontera
OYEDuL0AAAAJ,_5NvaooAAAAJ,Giédre Berretin-Felix,Professora Titular do Departamento de Fonoaudiologia da FOB/USP
OYEDuL0AAAAJ,A7iMKC4AAAAJ,Mariano del Sol,Universidad de La Frontera
OYEDuL0AAAAJ,BxRuudAAAAAJ,"ZS Haidar, DDS, Cert Implantol, MSc,...","Chair of Excellence (Biomat & Tissue Eng) / Assoc. Prof. (BioHealth), LABEX, UoLimoges, FRANCE"
OYEDuL0AAAAJ,Lx4TqAkAAAAJ,Leonardo Alberto Brito Leal,"Universidad Autonoma de Chile, GIPO (grupo de investigacion en pregrado de odontologia) Universidad"
OYEDuL0AAAAJ,CDq9KTIAAAAJ,Víctor Adolfo Ravelo Salinas,"Universidad Autónoma de Chile,GIPO (grupo de investigación de pregrado en odontología)"
OYEDuL0AAAAJ,xzIQPmEAAAAJ,CARLOS ELIAS ZAROR SANCHEZ,Universidad de La Frontera
WxIwbvcAAAAJ,00nrzJ8AAAAJ,Eugenio Merellano-Navarro,Universidad Católica del Maule
WxIwbvcAAAAJ,1b_1DJQAAAAJ,Aquiles Alejandro Almonacid Fierro,Universidad Católica del Maule
WxIwbvcAAAAJ,6sCoQR0AAAAJ,Manuel Vizuete Carrizosa,Profesor Educación Física y Deportes
WxIwbvcAAAAJ,1o_V7uQAAAAJ,Sebastián Feu,Universidad de Extremadura
WxIwbvcAAAAJ,kOHmBxkAAAAJ,Olivier Brito,"MCF, Université Paris Ouest Nanterre la Défense, Sciences de l'éducation"
Xgy8fzgAAAAJ,8fuNPLIAAAAJ,Francisco Melo,Departamento de Física Universidad de Santiago
Xgy8fzgAAAAJ,HTbF7hYAAAAJ,jean-christophe Geminard,"Université de Lyon, Ecole Normale Supérieure de Lyon, CNRS"
Xgy8fzgAAAAJ,8xeXUY8AAAAJ,Frédéric Restagno,"Physics, Université Paris-Saclay, CNRS"
Xgy8fzgAAAAJ,Zl4OXt0AAAAJ,RAPHAEL Elie,"Directeur de Recherche CNRS, UMR GULLIVER, ESPCI"
Xgy8fzgAAAAJ,BeT9ZPAAAAAJ,Thomas Salez,CNRS
Xgy8fzgAAAAJ,wpzWFcUAAAAJ,Kari Dalnoki-Veress,"Physics & Astronomy, McMaster University, Canada"
Xgy8fzgAAAAJ,LxxO4CoAAAAJ,Leonardo Gordillo,Assistant Professor (Universidad de Santiago de Chile)
Xgy8fzgAAAAJ,uF_kFzYAAAAJ,Nicolas Mujica,Universidad de Chile
Xgy8fzgAAAAJ,EDLgiC4AAAAJ,David Espíndola,"Instituto de Ciencias de la Ingeniería, Universidad de O'higgins, Rancagua, Chile."
qL6Tbp8AAAAJ,W4jQCfsAAAAJ,Oscar Ovidio Calzadilla Perez,Doctor - Académico e Investigador
qL6Tbp8AAAAJ,NraL83YAAAAJ,Gerardo Fuentes Vilugron,Universidad Católica de Temuco
20BCx4kAAAAJ,fRmF1boAAAAJ,estibaliz ampuero,Universidad de Santiago de Chile
20BCx4kAAAAJ,6fnzIgwAAAAJ,Fabiola Sepúlveda,Universidad de Antofagasta
20BCx4kAAAAJ,VvNfA3kAAAAJ,MARIA TERESA GONZALEZ,UNIVERSIDAD DE ANTOFAGASTA
20BCx4kAAAAJ,hysL_o4AAAAJ,Carlos Riquelme,Universidad de Antofagasta Chile
20BCx4kAAAAJ,2m-ZrxcAAAAJ,Vilma Pérez Godoy,The University of Adelaide
20BCx4kAAAAJ,_-9D_40AAAAJ,Rommy von Bernhardi,Professor for Neuroscience; Faculty of Sciences for Health Care and Faculty of Medicine and Science
20BCx4kAAAAJ,LqPgcUkAAAAJ,Luis Constandil,"Professor Neuroscience, Universidad de Santiago de Chile"
20BCx4kAAAAJ,EAYkKy0AAAAJ,M.Teresa González,"Associate Professor, University of Antofagasta, Chile "
20DY31kAAAAJ,1u-wEb0AAAAJ,Enrique N. Cruz,Investigador adjunto del CONICET
20DY31kAAAAJ,yNd5pmsAAAAJ,Noemi Cinelli,"Docente investigadora de la Universidad Autónoma de CHile, Investigadora del Fondo Nacional De Desarrollo Científico y Tecnológico de Chile, Profesora Ayudante Doctora de la Universidad de LaLaguna"
20DY31kAAAAJ,hg2332sAAAAJ,Antonio Luis Rodriguez Ridao,Universidad Autónoma de Chile
20DY31kAAAAJ,u7JsofYAAAAJ,Inmaculada Simón Ruiz,Universidad de Sevilla
20DY31kAAAAJ,hg5duAEAAAAJ,Grit Kirstin Koeltzsch,UE-CISOR-CONICET  Universidad Nacional de Jujuy
20DY31kAAAAJ,T0q92uwAAAAJ,Carolina Valenzuela Matus,Universidad Autónoma de Chile
20DY31kAAAAJ,lrVHzUEAAAAJ,Antonio Marrero Alberto,Professor and researcher of Art
5LdAeUQAAAAJ,CONwJRsAAAAJ,Daniela Andrade Rebolledo,"Docente Obstetricia y Puericultura, Universidad Autónoma de Chile. Doctora en Salud Mental"
FysoiZgAAAAJ,2vAXZeUAAAAJ,Luis Pastenes Opazo,"Assistant Professor, Universidad Católica del Maule."
FysoiZgAAAAJ,BtePYlMAAAAJ,Vívian D'Afonseca,Universidad Catolica del Maule
FysoiZgAAAAJ,NMy_ASYAAAAJ,HERNÁN DARÍO TORO ZAPATA,Universidad del Quindío
FysoiZgAAAAJ,8uNTqnAAAAAJ,Fernando Córdova-Lepe,Universidad Católica del Maule (Director of DM2A-UCM)
FysoiZgAAAAJ,ViWUN7wAAAAJ,Karina Vilches Ponce,"Académica, Universidad Católica del Maule"
FysoiZgAAAAJ,GsbVJVIAAAAJ,Irene Duarte,Profesor de matemáticas
bS8DOnQAAAAJ,9XlvJEIAAAAJ,Eduardo Álvarez-Miranda,Universidad de Talca
bS8DOnQAAAAJ,3nSUa2sAAAAJ,Claudia Rahmann,"Department of Electrical Engineering, University of Chile"
bS8DOnQAAAAJ,BPVbhToAAAAJ,Mauricio Morales Quiroga,Universidad de Talca
bS8DOnQAAAAJ,V2IQltIAAAAJ,Jordi Pereira,Universidad Adolfo Ibáñez
gy9m39wAAAAJ,A3EUj6IAAAAJ,Roberto Lagos-Hernández,Universidad Autónoma de Chile
gy9m39wAAAAJ,BqwXQhYAAAAJ,Claudia Guajardo,Docente Universidad Autónoma de Chile
gy9m39wAAAAJ,l5mxwPkAAAAJ,Maria Victoria Díaz Franco,Universidad Autónoma de Chile
gy9m39wAAAAJ,OYEDuL0AAAAJ,María Paz Moya Daza,"Docente, Universidad Autónoma de Chile"
7U2KufQAAAAJ,-xw1DFQAAAAJ,Pedro Moscoso Flores,Universidad Adolfo Ibáñez
7U2KufQAAAAJ,wo4pep0AAAAJ,Adolfo Berrios,Universidad Autónoma de Chile
jGLRTV0AAAAJ,pKl_d2YAAAAJ,Ernesto Rubio,Universidad del Bío Bío
jGLRTV0AAAAJ,2ZjmjcgAAAAJ,Jandecy Cabral Leite,ITEGAM
jGLRTV0AAAAJ,vFr2yaEAAAAJ,Juan A. Pozo-Morejón,"Profesor de Tecnología de soldadura, Centro de Investigaciones de Soldadura, Universidad Central ""Marta Abreu"" de Las Villas"
jGLRTV0AAAAJ,zlK1v4EAAAAJ,Iván Santana Ching,Dpto. Control Automático. Universidad Central Marta Abreu de Las Villas.
jGLRTV0AAAAJ,17-euHoAAAAJ,Francisco Herrera,"Universidad Central ""Marta Abreu"" de Las Villas"
eS8lHPcAAAAJ,efyhtvMAAAAJ,Tomás S. Criado,"CareNet-IN3, Open University of Catalonia"
eS8lHPcAAAAJ,o0KEUFAAAAAJ,Karla Berrens,UB Barcelona
eS8lHPcAAAAJ,ahVAyRgAAAAJ,Juan Carlos Vidal Rojas,"Director de Carrera Ingeniería Civil Informática, Universidad Autónoma de Chile"
F3tdhyEAAAAJ,lTY4y3MAAAAJ,"Emmanuel E. Etim, Ph.D","Department of Chemical Sciences, Federal University Wukari, Nigeria"
F3tdhyEAAAAJ,pCD7QRMAAAAJ,Sulaiman Olagboye,"Ekiti State University, Ado Ekiti"
F3tdhyEAAAAJ,jV5FlooAAAAJ,Adelagun Ruth Olubukola Ajoke,"Associate Professor, Department of Chemical Sciences, Federal University Wukari"
F3tdhyEAAAAJ,LmRADykAAAAJ,Onumashi Ushie,Federal University Wukari
F3tdhyEAAAAJ,JnXp-pQAAAAJ,Govinda Prasad Khanal,"Research Scholar, Inorganic and Physical Chemistry Department, Indian Institute of Science"
F3tdhyEAAAAJ,iFdMDsQAAAAJ,Alfred I. Onen,"Professor of Physical Chemistry, Department of Chemical Sciences, Federal University Wukari, Nigeria"
F3tdhyEAAAAJ,ta71okMAAAAJ,Buhari Magaji,"Gombe State University, Nigeria"
6aG507YAAAAJ,BEHLt5kAAAAJ,PATRICIO ERNESTO ITURRIAGA VA...,"Academico, Depto de Cs Quimicas y RRNN, Universidad de La Frontera"
6aG507YAAAAJ,3uWBpdwAAAAJ,Miguel Reyes,"Profesor de Farmacologia, Universidad Autonoma de Chile y Universidad de Santiago de Chile"
6aG507YAAAAJ,gFM2B_AAAAAJ,Franco Viscarra,University of Oxford
6aG507YAAAAJ,vRYeFjkAAAAJ,Mario Rivera-Meza,"Profesor Asistente, Facultad de Ciencias Químicas y Farmacéuticas, Universidad de Chile"
doum6j8AAAAJ,hXv8VcoAAAAJ,Neus González-Monfort,Profesora agregada de Didáctica de la Ciencias Sociales (UAB)
doum6j8AAAAJ,TvmTqPAAAAAJ,Antoni Santisteban Fernández,Profesor de la Universidad Autónoma de Barcelona
doum6j8AAAAJ,b0_mJKwAAAAJ,Daniela Cartes Pinto,Universidad Autónoma de Barcelona
CONwJRsAAAAJ,5LdAeUQAAAAJ,DR. HÉCTOR BRITO CASTILLO,"Docente Asociado Kinesiología Universidad Autónoma de Chile, Doctor Universidad de Concepción"
a0OPl44AAAAJ,ehMuZhIAAAAJ,Noemi Salvador Soler,"Docente investigador, Universidad Autónoma de Chile"
a0OPl44AAAAJ,q8kFtcEAAAAJ,María Ines Carmona López,Universidad Autónoma de Chile
a0OPl44AAAAJ,6jbwqtcAAAAJ,Andrés Godoy Cumillaf,"Pedagogía en Educación Física, Facultad de Educación, Universidad Autónoma de Chile."
a0OPl44AAAAJ,DC-1QokAAAAJ,"Pablo Valdés-Badilla, Ph.D.",Universidad Católica del Maule
a0OPl44AAAAJ,l5mxwPkAAAAJ,Maria Victoria Díaz Franco,Universidad Autónoma de Chile
a0OPl44AAAAJ,WBQOnzYAAAAJ,KURT BUCHEGGER MENA,Universidad de La Frontera
a0OPl44AAAAJ,2EKT_ysAAAAJ,Carmen Gloria Ili,Universidad de La Frontera
a0OPl44AAAAJ,uCibJwIAAAAJ,Priscilla Brebi,Universidad de La Frontera
zzbeQmYAAAAJ,-1O2OPMAAAAJ,Dr. Aldo Rodrigo Martínez Araya,"Kinesiólogo, Universidad Autónoma de Chile"
zzbeQmYAAAAJ,ahPfeed41z8C,Sebastian Andres Astorga Verdugo,Universidad Autonoma De Chile
zzbeQmYAAAAJ,f0NmQ3EAAAAJ,Pablo Troncoso Galleguillos,"Carrera de Kinesiología Universidad Autónoma de Chile, sede Talca"
k38ZuWoAAAAJ,wWHDDvAAAAAJ,Marcelo Leiva-Bianchi,Universidad de Talca
ysN9x7cAAAAJ,gZOrGTgAAAAJ,Katherine Weinberger,"Profesor de Histología, Universidad San Sebastián"
ysN9x7cAAAAJ,Cm_MkxAAAAAJ,Carlos Rosas,"Profesor de Histología, Universidad San Sebastián"
ysN9x7cAAAAJ,SfiFpvMAAAAJ,Gareth Lemus,
ysN9x7cAAAAJ,psy143EAAAAJ,Arturo Ferreira,Universidad de Chile
ysN9x7cAAAAJ,NK44AZoAAAAJ,Juan C. Aguillon,Professor of Immunology at University of Chile
ysN9x7cAAAAJ,9ZYGlAoAAAAJ,MARIA CARMEN MOLINA SAMPAYO,"Profesor de Inmunología, Facultad de Medicina, Universidad de Chile"
ysN9x7cAAAAJ,X4A3nzwAAAAJ,"Cattan, P. E.",universidad de chile
ysN9x7cAAAAJ,axvvVBYAAAAJ,NORBERTO COLLAZO,"Business Developer, Fraunhofer Chile Research Foundation"
ysN9x7cAAAAJ,JYcf1M0AAAAJ,Alvaro Olivera-Nappa,University of Chile
ysN9x7cAAAAJ,QCnt_nUAAAAJ,Carolina Valck,Universidad de Chile
c_vcAfsAAAAJ,0yeU4pwAAAAJ,Loreto Fuenzalida,"Docente Investigador, Universidad Autónoma de Chile"
c_vcAfsAAAAJ,3YdZcRIAAAAJ,Daniela Toro-Ascuy,"PhD, ICB, Universidad Autonoma de Chile"
c_vcAfsAAAAJ,7PL6PkIAAAAJ,Nicolas Cifuentes Muñoz,Investigador Asociado. Universidad Autónoma de Chile
c_vcAfsAAAAJ,oQol0asAAAAJ,Francisco Zorondo Rodríguez,
c_vcAfsAAAAJ,6vlY1ugAAAAJ,Andrea Avaria,Universidad Autónoma de Chile
t79rXlgAAAAJ,uIWl1hwAAAAJ,Alexa Angélica Senior Naveda,Profesora Investigadora de la Universidad de la Costa
t79rXlgAAAAJ,L-4ukdUAAAAJ,Deisy del Carmen Pérez Hasbun,Universidad del Zulia
xlNX4ocAAAAJ,M1HHaLAAAAAJ,Juan Carlos Peña Axt,Universidad Autónoma de Chile
1cx_c4kAAAAJ,0RTkP8sAAAAJ,Ángel  Acevedo-Duque,Universidad Autónoma de Chile
1cx_c4kAAAAJ,vj2_nGcAAAAJ,Romel Ramón González-Díaz (Ph.D),Investigador del Centro Internacional de Investigaciones y Desarrollo
NrJSjBoAAAAJ,66yfZd4AAAAJ,Bertila Hernández Fernandez,Docente de investigación - Universidad César Vallejo
NrJSjBoAAAAJ,BMqp2zAAAAAJ,Antonio Mangione,Universidad Nacional de San Luis - IMIBIO - Conicet - San Luis
NrJSjBoAAAAJ,7plF4voAAAAJ,Reinier Jiménez Borges,Universidad de Cienfuegos
p4Vex5YAAAAJ,JY9vzicAAAAJ,"Barbosa-Herrera, Juan Carlos",Universidad Industrial de Santander
p4Vex5YAAAAJ,IRZOBlkAAAAJ,Rodrigo Sánchez Edmonson,Universidad de Chile
p4Vex5YAAAAJ,LJFl3SEAAAAJ,David Pavón-Cuéllar,Profesor de Psicología (UMSNH)
9Wg03wMAAAAJ,U2zDNT8AAAAJ,Luis Araya-Castillo,"Decano, Facultad de Ingeniería y Empresa, Universidad Católica Silva Henríquez (UCSH)"
9Wg03wMAAAAJ,BcamrakAAAAJ,maritza galindo,Universidad San Sebastián
5uNX9BgAAAAJ,sKxUIpUAAAAJ,María Elena Cazar-Ramírez,"Professor. Universidad de Cuenca, Ecuador"
D1SJ8qgAAAAJ,Xj906M4AAAAJ,Fernando Crespo,Universidad Alberto Hurtado
_EPOlUkAAAAJ,TBkYz2oAAAAJ,Ricardo Figueroa,Universidad de concepción
_EPOlUkAAAAJ,K27PPpMAAAAJ,Francisco Correa-Araneda,Universidad Autónoma de Chile
t490pBUAAAAJ,nLlEb78AAAAJ,Tamara Otzen,Universidad de La Frontera
t490pBUAAAAJ,skVwKzoAAAAJ,Guillermo Figueroa,Profesor de Microbiología
t490pBUAAAAJ,3cbgJmkAAAAJ,MONICA ELIZABETH ILLESCA PRETTY,"Académica, Universidad de La Frontera"
2v02XaYAAAAJ,Nc4A2kQAAAAJ,Hernán Joaquín Riquelme Brevis,Universidad Autónoma de Chile - Instituto Iberoamericano de Desarrollo Sostenible
2v02XaYAAAAJ,OTZ_YccAAAAJ,Javiera Azócar Weisser,Universidad Autónoma de Chile
Lx4TqAkAAAAJ,CDq9KTIAAAAJ,Víctor Adolfo Ravelo Salinas,"Universidad Autónoma de Chile,GIPO (grupo de investigación de pregrado en odontología)"
LAOTu7kAAAAJ,oDxz2rsAAAAJ,Sergio Pérez Morales,"Universidad Autónoma de Chile, Profesor de Filosofía"
pCzGbeYAAAAJ,HjoM2nQAAAAJ,Algeless Milka Pereira Meireles da Silva,"Professora de Psicologia da Universidade Federal do Piauí, Doutora em Psicologia da Educação pela"
AVvCYp0AAAAJ,00nrzJ8AAAAJ,Eugenio Merellano-Navarro,Universidad Católica del Maule
AVvCYp0AAAAJ,6jbwqtcAAAAJ,Andrés Godoy Cumillaf,"Pedagogía en Educación Física, Facultad de Educación, Universidad Autónoma de Chile."
AVvCYp0AAAAJ,wHoc3KsAAAAJ,Natalia Bustamante-Ara,Universidad Autónoma de Chile
AVvCYp0AAAAJ,39X907EAAAAJ,Javier Russell-Guzmán,"Docente Académico de Fisiología, Biología y Morfología, Universidad Autónoma de Chile."
AVvCYp0AAAAJ,3p_cKWsAAAAJ,Ignacio Santander Reveco,"Académico, Universidad Autónoma de Chile"
AVvCYp0AAAAJ,nl-GC4YAAAAJ,Pablo Gajardo Cáceres,Universidad Autónoma de Chile
AVvCYp0AAAAJ,lsysWvEAAAAJ,Jorge Ramírez Torrealba,UPEL IPMAR VENEZUELA
AVvCYp0AAAAJ,JpVH_AUAAAAJ,Carola Román Pérez,Universidad Autónoma de Chile
AVvCYp0AAAAJ,b88DpFUAAAAJ,Felipe Mujica Johnson,Universidad de Chile
y1Sq6MAAAAAJ,U82L77MAAAAJ,Stefanny M Figueroa,Universidad Autónoma de Chile
e0ZZ1z8AAAAJ,-K2aeaoAAAAJ,Pablo Müller Ferrés,Universidad Autónoma de Chile
e0ZZ1z8AAAAJ,xZ-xFyYAAAAJ,Juan Carlos Beltrán Véliz,Académico e investigador. Núcleo Científico Tecnológico en Ciencias Sociales y Humanidades
e0ZZ1z8AAAAJ,kMr_yuQAAAAJ,Bastian Carter-Thuillier,"Académico Departamento de Educación, Universidad de Los Lagos (Chile)"
e0ZZ1z8AAAAJ,G0lCpy0AAAAJ,MAURA KLENNER,Universidad de La Frontera
0GV23VrXP9wC,yx9TRrwAAAAJ,Miguel Lagos,Universidad de Talca
zsTQB1MAAAAJ,V8QMQoEAAAAJ,Isaac Ruiz Muñoz,Académico Universidad San Sebastián
zsTQB1MAAAAJ,YTOhUVUAAAAJ,Sonia Brito Rodríguez,Universidad Alberto Hurtado
zsTQB1MAAAAJ,TlS0fDoAAAAJ,Victor Yañez,Universidad Autónoma de Chile
-RGQ1t8AAAAJ,IDDq47oAAAAJ,Nilqger Garcia,universidad autonoma de chile
-RGQ1t8AAAAJ,ck-9NLYAAAAJ,Maria Gonzalez Yibirin,Laboratorios Leti S.A.V.
XZSAJL4AAAAJ,drLb9YEAAAAJ,Gabriel M. Fonseca,"Faculty of Dentistry, Universidad de La Frontera"
VIDyMeMAAAAJ,jimR0lYAAAAJ,Juan Jorge Faundes Peñafiel,UNIVERSIDAD AUTÓNOMA DE CHILE
-K2aeaoAAAAJ,e0ZZ1z8AAAAJ,Nathaly Vera Gajardo,"Directora de Carrera Pedagogía en Educación Diferencial. Universidad Autónoma de Chile, Chile."
-K2aeaoAAAAJ,xZ-xFyYAAAAJ,Juan Carlos Beltrán Véliz,Académico e investigador. Núcleo Científico Tecnológico en Ciencias Sociales y Humanidades
50Xu-b8AAAAJ,bvtMvBUAAAAJ,Paola Navarrete,"Associate Professor, INTA, University of Chile"
50Xu-b8AAAAJ,Ukp9znUAAAAJ,Leonardo Pavez,"Universidad de Las Américas, Chile"
50Xu-b8AAAAJ,7mzmAsUAAAAJ,Katherine Garcia,Universidad Autónoma de Chile
50Xu-b8AAAAJ,z0iM1NkAAAAJ,Alequis Pavón Oro,Universidad Autónoma de Chile
50Xu-b8AAAAJ,6xGtiOMAAAAJ,Sebastian Reyes-Cerpa,"Assistant Professor, Universidad Mayor"
-FBvXFYAAAAJ,tbfmfAkAAAAJ,LEONARDO JAVIER CASTILLO CAR...,"Academico, Departamento de Ciencias Jurídicas, Facultad de Ciencias Jurídicas y Empresariales, Universidad de La Frontera"
p6BoJIoAAAAJ,-hOcVU4AAAAJ,ricardo I castro,Universidad Autonoma de Chile
p6BoJIoAAAAJ,6Rs0hOcAAAAJ,ursula doll,
iiYspHAAAAAJ,A6ayiuoAAAAJ,David Contreras,"Full Professor, Universidad de Concepcion"
iiYspHAAAAAJ,AAn1WhkAAAAJ,Edgar Pastene,Universidad del Bío Bío
iiYspHAAAAAJ,wWhnScMAAAAJ,Carlos Gustavo Peña Farfal,Universidad Autónoma de Chile
uP_oIn4AAAAJ,4RSTe2oAAAAJ,Roberto Moreno G.,"Universidad de Córdoba, España"
uP_oIn4AAAAJ,fD8FEpoAAAAJ,José Manuel Cansino,Universidad de Sevilla y Universidad Autónoma de Chile
uP_oIn4AAAAJ,LZn0LHYAAAAJ,Rocio Román-Collado,Universidad de Sevilla
TBuha_cAAAAJ,q4atNYgAAAAJ,Marco Mora Cofre,"Laboratory of Technological Research in Pattern Recognition (LITRP), Universidad Católica del Maule"
TBuha_cAAAAJ,Q_N-ggQAAAAJ,Sergio Hernandez,Universidad Catolica del Maule
TBuha_cAAAAJ,8Ud8re0AAAAJ,Philip Sallis,"Professor in Computer Science, Auckland University of Technology"
TBuha_cAAAAJ,4XRkoC0AAAAJ,Jenny Morales,
TBuha_cAAAAJ,zPTah8IAAAAJ,Fabián Silva-Aravena,"Académico, Universidad Católica del Maule"
TBuha_cAAAAJ,ZFmGCNUAAAAJ,Yolanda Soledad Valdes Rodríguez,"Facultad de Ingeniería, Universidad Autónoma de Chile, Chile"
MBVizsAAAAAJ,kSbZjskAAAAJ,Juan Enrique Serrano Moreno,Universidad de Chile
_m8lHIAAAAAJ,F_6Pu0oAAAAJ,Mariana Sierra Murguía,Cancer Center Tec100
_m8lHIAAAAAJ,yV9vneoAAAAJ,Juan-Manuel Fraga-Sastrias,Director. Cancer Center Tec 100
_m8lHIAAAAAJ,YjNb2V8AAAAJ,Raquel Espejo,Facultad de Medicina Universidad San Sebastián
_m8lHIAAAAAJ,tY8xhUsAAAAJ,Nohora Bohórquez-Martínez,Docente Asociado. Corporación Universitaria Iberoamericana
M9LX5_AAAAAJ,oBbEY5UAAAAJ,Barbara Burgos,"Docente Carrera de Kinesiologia, Universidad Autónoma de Chile"
m8StE7MAAAAJ,kLqJUfsAAAAJ,Paulina Sepúlveda-Escobar,"Universidad Autonoma de Chile, sede Talca"
3p_cKWsAAAAJ,AVvCYp0AAAAJ,Natasha Uribe,Universidad Autónoma  de Chile
3p_cKWsAAAAJ,b88DpFUAAAAJ,Felipe Mujica Johnson,Universidad de Chile
e2jtxmUAAAAJ,ryWpeWIAAAAJ,Gino Corsini,Universidad Autónoma de Chile
e2jtxmUAAAAJ,z0iM1NkAAAAJ,Alequis Pavón Oro,Universidad Autónoma de Chile
e2jtxmUAAAAJ,wFpT-dQAAAAJ,Nancy Calisto,"Universidad de Magallanes, Universidad Autónoma de Chile"
e2jtxmUAAAAJ,WT3Z4BgAAAAJ,Mario Tello,USACH
e2jtxmUAAAAJ,24kpDhkAAAAJ,Alex Ricardo Gonzalez Perez,Universidad de los Lagos
CPCBp4MAAAAJ,k0bGblQAAAAJ,Antonio Munoz Aunion,Profesor Derecho Internacional Universidad autónoma de Tamaulipas
XfvITxcAAAAJ,YmLuE08AAAAJ,Alfredo Sierra-Cristancho,Profesor Asistente - Universidad Andrés Bello.
DyMJEdoAAAAJ,iEHBwx0AAAAJ,Abdul Hernandez,Investigador. Universidad Autonoma de Chile.
nl-GC4YAAAAJ,AVvCYp0AAAAJ,Natasha Uribe,Universidad Autónoma  de Chile
nl-GC4YAAAAJ,b88DpFUAAAAJ,Felipe Mujica Johnson,Universidad de Chile
HR5QGJoAAAAJ,RFLvMh0AAAAJ,Enzo Alarcón,"Docente Fonoaudiología, Universidad Autónoma de Chile"
HR5QGJoAAAAJ,gy9m39wAAAAJ,Carla Figueroa Saavedra,Universidad Autónoma de Chile
w1RFXDMAAAAJ,A1IrhjAAAAAJ,Miseldra Gil-Marín 0000-0003-2553-5...,Universidad Autónoma de Chile
