scholar_id_autor_gs,scholar_id_gs_coauthor,nombre_coauthor,cargo
0RTkP8sAAAAJ,1J2mcdwAAAAJ,Luiz Vicente Ovalles Toledo,Profesor Investigador de la Universidad Autónoma de Sinaloa
0RTkP8sAAAAJ,lkYvPFsAAAAJ,Khalid Mehmood (Ph.D.),"Professor of OB/HRM, Hubei Engineering University, Xiaogan, China"
0RTkP8sAAAAJ,sW1lU4EAAAAJ,Alejandro J. Argüello,Doctorando UNAH
0RTkP8sAAAAJ,r4u8BpMAAAAJ,Jessica Müller Pérez PhD,"Profesora Investigador SNI Nivel I, Universidad Popular Autónoma del Estado de Puebla"
0RTkP8sAAAAJ,Aqtyf1MAAAAJ,"Prateek Kalia, Ph.D.","Assistant Professor, Faculty of Economics and Administration, Masaryk University"
0RTkP8sAAAAJ,O2k66EAAAAAJ,Rina Maria Alvarez Becerra,Universidad Nacional Jorge Basadre Grohmann
0RTkP8sAAAAJ,kiaOGNoAAAAJ,Luis Armado Becerra Perez,Profesor de Economía
0RTkP8sAAAAJ,EgDKwVAAAAAJ,Jayakrishna Kandasamy,"Professor,  School of Mechanical Engineering, Vellore Institute of Technology"
0RTkP8sAAAAJ,ge6a3KEAAAAJ,"Dr. Vimal.KEK, Ph.D.","Professor (Assistant), Mechanical Engineering, National Institute of Technology …"
0RTkP8sAAAAJ,yaC_nr8AAAAJ,Yaser Iftikhar,"AFPGMI, National University of Medical Sciences"
0RTkP8sAAAAJ,yvoOis0AAAAJ,Jose Manuel Saiz-Alvarez (ORCID: 0000-0001-6435-9600),Universidad Católica de Santiago de Guayaquil (Ecuador)
0RTkP8sAAAAJ,l9zGlTYAAAAJ,Ho Kwong Kwan,China Europe International Business School
0RTkP8sAAAAJ,lGBZOcQAAAAJ,Frank E. Rivas Torres,Profesor de Estudios Organizacionales / Legislación Laboral
0RTkP8sAAAAJ,cOOw1F0AAAAJ,AGUSTIN  ALVAREZ-HERRANZ,Universidad de Castilla-La Mancha
0RTkP8sAAAAJ,Zd2Kg3EAAAAJ,Rashi Kohli,IEEE
0RTkP8sAAAAJ,zJa2I_YAAAAJ,José Gregorio Noroño Sánchez,"Profesor Facultad de Ciencias Jurídicas, Sociales y Educación. Facultad de Ciencias …"
0RTkP8sAAAAJ,1cx_c4kAAAAJ,Irma Yomara Verges,Universidad Autonoma de Chile
0RTkP8sAAAAJ,92wUztgAAAAJ,Efren Enrique Lobo Contreras,Centro Internacional de Investigaciones y Desarrollo
0RTkP8sAAAAJ,kRU66jcAAAAJ,"Garcia-Gordillo, MA","Facultad de Administración y Negocios, Universidad Autónoma de Chile"
0RTkP8sAAAAJ,AoxQhFsAAAAJ,Katiusca Cruz Ayala,Comité Iberoamericano de ética y bioética
0RTkP8sAAAAJ,j0DotYAAAAAJ,María Antonia García Martínez,"Profesora Titular de Historia, Cultura y Lengua Española, Universidad Tamkang de Taipei"
0RTkP8sAAAAJ,fZtQ_KsAAAAJ,Marìa Natalia Pachon Vargas,universidad santo tomas
0RTkP8sAAAAJ,Q6fZIGsAAAAJ,Jorge Suárez Campos,Universidad Autónoma de Chile
7mzmAsUAAAAJ,GIB2jSAAAAAJ,Romilio Espejo,"Instituto de Nutrición y Tecnología de los Alimentos, Universidad de Chile"
7mzmAsUAAAAJ,zdIuFAUAAAAJ,Roberto Bastias Romo,Pontificia Universidad Católica de Valparaíso
7mzmAsUAAAAJ,dC9ANWEAAAAJ,Diliana Pérez Reytor,Universidad Autónoma de Chile
7mzmAsUAAAAJ,W8THEBcAAAAJ,Nicolás Plaza Morales,Universidad Autónoma de Chile
7mzmAsUAAAAJ,Ukp9znUAAAAJ,Leonardo Pavez,"Universidad de Las Américas, Chile"
7mzmAsUAAAAJ,bvtMvBUAAAAJ,Paola Navarrete,"Associate Professor, INTA, University of Chile"
7mzmAsUAAAAJ,6UknP20AAAAJ,Daniel Castillo,"Assistant Professor, Universidad SEK"
eNJwvTwAAAAJ,OKMRuz0AAAAJ,Yedy Israel,Professor
eNJwvTwAAAAJ,RI5dKnMAAAAJ,ME Quintanilla,University of Chile
eNJwvTwAAAAJ,vRYeFjkAAAAJ,Mario Rivera-Meza,"Profesor Asistente, Facultad de Ciencias Químicas y Farmacéuticas, Universidad de Chile"
eNJwvTwAAAAJ,xXkuYEEAAAAJ,Mario Herrera-Marschitz,"University of Chile, Karolinska institutet, Manheim"
eNJwvTwAAAAJ,3qwlUBQAAAAJ,Rafael Vicuña E.,
eNJwvTwAAAAJ,ryWpeWIAAAAJ,Gino Corsini,Universidad Autónoma de Chile
eNJwvTwAAAAJ,_yrO6yQAAAAJ,Osvaldo Flores Bastias,Universidad Autónoma de Chile
eNJwvTwAAAAJ,BHoVdK4AAAAJ,Muñoz D.,
71Feq10AAAAJ,pz19DGQAAAAJ,Eduardo Fernández Godoy,Universidad de Chile and Universidad Autónoma de Chile
71Feq10AAAAJ,atKDSEkAAAAJ,Josefa Dolores Miranda Tarragó,"Profesora Titular y Consultante, Facultad ""ICBP Victoria de Girón"" Universidad de Ciencias Médicas"
71Feq10AAAAJ,p9gGYtgAAAAJ,Ibraín Enrique Corrales-Reyes,Universidad de Ciencias Médicas de Granma
71Feq10AAAAJ,6GwJM8sAAAAJ,Christian R. Mejia,Universidad Norbert Wiener
71Feq10AAAAJ,nvQ5c1MAAAAJ,Alberto Juan Dorta-Contreras,Profesor titular Universidad de Ciencias Médicas de La Habana. Catedrático Extraordinario de
71Feq10AAAAJ,oEWYQ3wAAAAJ,Yasmany Fornaris-Cedeño,Universidad de Ciencias Médicas de La Habana. Instituto de Neurología y Neurocirugía. La Habana
71Feq10AAAAJ,WzlpKhIAAAAJ,Matheus Coelho Bandéca,Universidade CEUMA
71Feq10AAAAJ,wezLN5QAAAAJ,Kelvin I. Afrashtehfar,"Ajman University, College of Dentistry"
71Feq10AAAAJ,bvPENqEAAAAJ,Teresita de Jesus Clavera Vázquez,"Profesora de estomatolgía, ICBP Victoria de Girón"
oW9WthgAAAAJ,fPOW8okAAAAJ,Andres F Olea,Universidad Autonoma de Chile
oW9WthgAAAAJ,RSPoIt0AAAAJ,Alejandro Martín Madrid Villegas,"Academico, Departamento de Química, Universidad de Playa Ancha"
oW9WthgAAAAJ,aJ_rxwUAAAAJ,Joan Villena,Universidad de Valparaiso
oW9WthgAAAAJ,b0Lvl7sAAAAJ,Evelyn Silva-Moreno,Universidad Mayor
oW9WthgAAAAJ,LMsJpQkAAAAJ,Laura Andrea Svetaz,
oW9WthgAAAAJ,dRZV34UAAAAJ,Julia Montserrat Rubio Astudillo,Meristem SpA
oW9WthgAAAAJ,bwARKEIAAAAJ,Alessandra Russo,"Pharmacognosy Professor, University of Catania"
oW9WthgAAAAJ,f9J2-zsAAAAJ,Allisson Astuya Villalón,Universidad de Concepción
oW9WthgAAAAJ,Nnx9DXAAAAAJ,Marco Mellado García,"Docente-Investigador, Universidad Central de Chile"
oW9WthgAAAAJ,1DSqyGQAAAAJ,Maximiliano Sortino,Facultad de Ciencias Bioquímicas y Farmacéuticas - Universidad Nacional de Rosario
oW9WthgAAAAJ,cji_BxcAAAAJ,Matías Poblete-Morales,Universidad Autónoma de Chile
oW9WthgAAAAJ,rd-IU0YAAAAJ,Claudia Rabert,Universidad Autonoma de Chile
oW9WthgAAAAJ,ryWpeWIAAAAJ,Gino Corsini,Universidad Autónoma de Chile
K27PPpMAAAAJ,b6HFfgwAAAAJ,Luz Boyero,University of the Basque Country (UPV/EHU)
K27PPpMAAAAJ,TBkYz2oAAAAJ,Ricardo Figueroa,Universidad de concepción
K27PPpMAAAAJ,BDTxtpAAAAAJ,Alan M. Tonin,University of Brasilia
K27PPpMAAAAJ,1MjshaIAAAAJ,Javier Pérez,Universidad del País Vasco (UPV/EHU)
K27PPpMAAAAJ,jajFVW8AAAAJ,Patricio De los Rios-Escalante [or Patri...,"Profesor Asistente, Universidad Catolica de Temuco"
K27PPpMAAAAJ,VWePAhoAAAAJ,Carlos Esse,Universidad Autónoma de Chile
K27PPpMAAAAJ,Jo-LOvUAAAAJ,"Aydeé Cornejo, PhD",Gorgas Memorial Institute for Health Studies
K27PPpMAAAAJ,t5frSGQAAAAJ,Jaime Bosch,"IMIB-Biodiversity Research Institute, CSIC-University of Oviedo"
K27PPpMAAAAJ,6L6zYowAAAAJ,Manuel Graca,"University of Coimbra, Portugal"
K27PPpMAAAAJ,lCpZq1EAAAAJ,Jesus Pozo,"Professor of Limnology, University of The Basque Country"
K27PPpMAAAAJ,28F711wAAAAJ,Núria Bonada,University of Barcelona
K27PPpMAAAAJ,8RjS6WYAAAAJ,Pablo Antonio Macchi,Research Institute in Paleobiology and Geology. National University of Río Negro
K27PPpMAAAAJ,Io0Xr_4AAAAJ,Roberto Urrutia,Profesor Universidad de Concepcion
K27PPpMAAAAJ,PX3j0uoAAAAJ,Evelyn Habit,Professor Universidad de Concepción
K27PPpMAAAAJ,VW-qd9EAAAAJ,Jaime Bosch (or Jaume Bosch),"Professor of Medicine. University of Barcerlona-IDIBAPS, and Guest Professor, Bern University."
K27PPpMAAAAJ,YB_4v6YAAAAJ,MANUEL CORDOBA-DIAZ,"Professor of Pharmaceutics, Complutense University, Madrid"
T0wzMgsAAAAJ,8E5eQekAAAAJ,Joan-Miquel Canals,Rovira i Virgili University
T0wzMgsAAAAJ,PFIvxeEAAAAJ,CRISTINA Ubeda Aguilera,"Personal Docente e Investigador, Universidad Autónoma de Chile"
T0wzMgsAAAAJ,Z-bXPb8AAAAJ,Isidro Hermosín-Gutiérrez,Profesor Titular (Universidad de Castilla-La Mancha; Área de Tecnolgía de Alimentos)
T0wzMgsAAAAJ,EHMqwtEAAAAJ,Mariela Assof,Investigador - Profesor de Química y Fisicoquímica
T0wzMgsAAAAJ,qyZfJXgAAAAJ,José Ignacio Covarrubias,Universidad de Chile
T0wzMgsAAAAJ,umsm2x4AAAAJ,Luis Alberto Morales Quintana,Universidad Autónoma de Chile
T0wzMgsAAAAJ,-hOcVU4AAAAJ,ricardo I castro,Universidad Autonoma de Chile
T0wzMgsAAAAJ,BBjnuD0AAAAJ,Albert Mas,"Facultad de Enologia. Universitat Rovira i Virgili (Tarragona, Spain)"
T0wzMgsAAAAJ,o-Y3ClQAAAAJ,Valentina Martin,"Asistente Laboratorio Enologia y Biotecnologia de las Fermentaciones, Facultad de Quimica de Uruguay"
T0wzMgsAAAAJ,o-fdTJIAAAAJ,Gemma Beltran,Associate professor URV
T0wzMgsAAAAJ,-I0-uyMAAAAJ,Felipe Laurie,"Professor of Enology, Universidad de Talca, Chile"
g72OEZ8AAAAJ,JWEvlzoAAAAJ,Guillermo Oliver,"Center for Vascular and Developmental Biology, Feinberg School of Medicine, Northwestern Medical"
g72OEZ8AAAAJ,0-5XivgAAAAJ,Andres Herrada,"Investigador Asociado, Universidad Autónoma de Chile"
g72OEZ8AAAAJ,4UJUMkwAAAAJ,Juan Larrain,P. Universidad Católica de Chile
g72OEZ8AAAAJ,EfFsG5QAAAAJ,Rosana Muñoz Videla,"Departamento de Tecnología Médica, Facultad de Medicina, Universidad de Chile"
g72OEZ8AAAAJ,NPYtqMAAAAAJ,Loreto Carvallo,Associate Scientist Mount Sinai
g72OEZ8AAAAJ,7hb_2SIAAAAJ,Sathish Srinivasan,Oklahoma Medical Research Foundation
g72OEZ8AAAAJ,1p3l_3wAAAAJ,PAULA BURGOS CANETE,
g72OEZ8AAAAJ,ucOmD4YAAAAJ,Sinem Karaman,"University of Helsinki and Wihuri Research Institute - Helsinki, Finland"
g72OEZ8AAAAJ,3kJbhqsAAAAJ,Steven T Proulx,"Theodor Kocher Institute, University of Bern"
g72OEZ8AAAAJ,UqYcYXQAAAAJ,Francisco Bustos,Sanford Research
g72OEZ8AAAAJ,4DxwE-sAAAAJ,Osvaldo Contreras,"Postdoctoral Scientist, Victor Chang Cardiac Research Institute, Conjoint Lecturer UNSW Sydney"
ryWpeWIAAAAJ,WT3Z4BgAAAAJ,Mario Tello,USACH
ryWpeWIAAAAJ,24kpDhkAAAAJ,Alex Ricardo Gonzalez Perez,Universidad de los Lagos
ryWpeWIAAAAJ,qY8itx8AAAAJ,Piedad Cortés,Universidad de Las Américas
ryWpeWIAAAAJ,eNJwvTwAAAAJ,Eduardo Karahanian,Universidad Autónoma de Chile
ryWpeWIAAAAJ,z0iM1NkAAAAJ,Alequis Pavón Oro,Universidad Autónoma de Chile
ryWpeWIAAAAJ,3qwlUBQAAAAJ,Rafael Vicuña E.,
ryWpeWIAAAAJ,XHIP2KYAAAAJ,Rosalba Lagos,"Profesor de Microbiología, Facultad de Ciencias, Universidad de Chile"
ryWpeWIAAAAJ,ShutzssAAAAJ,Octavio Hernan Monasterio Opazo,Universidad de Chile
ryWpeWIAAAAJ,W8THEBcAAAAJ,Nicolás Plaza Morales,Universidad Autónoma de Chile
ryWpeWIAAAAJ,6UknP20AAAAJ,Daniel Castillo,"Assistant Professor, Universidad SEK"
ryWpeWIAAAAJ,BUliBqIAAAAJ,Erwin Strahsburger,"Assistant Project Scientist, Dr. Philip Felgner Laboratory, Physiology and Biophysics …"
ryWpeWIAAAAJ,dC9ANWEAAAAJ,Diliana Pérez Reytor,Universidad Autónoma de Chile
ryWpeWIAAAAJ,7mzmAsUAAAAJ,Katherine Garcia,Universidad Autónoma de Chile
ryWpeWIAAAAJ,SNz4keUAAAAJ,Carlos J Blondel,Universidad Andres Bello
ryWpeWIAAAAJ,-fng7_sAAAAJ,Luis Larrondo,"Full Professor, DGMM, Pontificia Universidad Católica de Chile"
ryWpeWIAAAAJ,Mk3UEGQAAAAJ,Osmir Batista de Oliveira Junior,"Professor de Dentística, Universidade Estadual Paulista - Unesp, Faculdade de Odontologia …"
ryWpeWIAAAAJ,jlpbJJYAAAAJ,Luis Cottet Bustamante,Universidad Santo Tomas
ryWpeWIAAAAJ,Fu88dZwAAAAJ,Paris Leonardo Lavin,Universidad de Antofagasta
ryWpeWIAAAAJ,e2jtxmUAAAAJ,Laura Andrea Navarro Heredia,Universidad Autónoma de Chile
ryWpeWIAAAAJ,EZhL1_gAAAAJ,Armando Azua-Bustos,"Centro de Astrobiología, Consejo Superior de Investigaciones Científicas"
ryWpeWIAAAAJ,2pzJejsAAAAJ,Augusto Manubens,Bioquímico
duESZEQAAAAJ,gfFOyKoAAAAJ,Carlos Vanegas Ortega,"Académico, Universidad de Santiago de Chile (USACH)"
Lj_guSEAAAAJ,Mr19oawAAAAJ,Alvaro Muñoz-Castro,Universidad San Sebastián
Lj_guSEAAAAJ,GYbT_iIAAAAJ,Ramiro Arratia-Perez,Universidad Andres Bello
Lj_guSEAAAAJ,1RvEdlUAAAAJ,juan m.manriquez,"professor titular, universidad catolica de chile"
Lj_guSEAAAAJ,vecU3DIAAAAJ,Carlos Bustos,Universidad Austral de Chile
Lj_guSEAAAAJ,6FYqjJEAAAAJ,Eduardo Schott,Pontificia Universidad Catolica de Chile
Lj_guSEAAAAJ,VhGIqLkAAAAJ,Elies Molins,"Research Professor, CSIC"
Lj_guSEAAAAJ,qarTv4UAAAAJ,Ximena Zarate,"Universidad Autónoma de Chile, Instituto de Ciencias Químicas Aplicadas"
Lj_guSEAAAAJ,sGj8l0gAAAAJ,Cristina Aparecida Barboza,"Wroclaw University of Science and Technology, Department of Physical and Theoretical Chemistry"
Lj_guSEAAAAJ,jXtWpzEAAAAJ,John Jady Hurtado Belalcazar,Universidad de los Andes
Lj_guSEAAAAJ,vjUabgsAAAAJ,José H Zagal  FRSC,"Distinguished Professor, Director, Laboratory of Electrocatalysis, University of Santiago de Chile"
Lj_guSEAAAAJ,Qd5FKbAAAAAJ,Luminita Silaghi-Dumitrescu,Universitatea Babeş-Bolyai
Lj_guSEAAAAJ,wmY9LOQAAAAJ,Lucian Cristian Pop,"Babeș-Bolyai University, Faculty of Chemistry and Chemical Engineering"
Lj_guSEAAAAJ,a657lGAAAAAJ,Cristian Antonio Linares-Flores,Universidad Autonoma de Chile
Lj_guSEAAAAJ,WnMuQmUAAAAJ,Verónica Morales Sánchez,Profesora Universidad de Málaga
Lj_guSEAAAAJ,G_-vAEcAAAAJ,Diana Abril,Universidad Católica del Maule
Lj_guSEAAAAJ,rnkCpP0AAAAJ,Mauricio Fuentealba,Pontificia Universidad Católica de Valparaíso
kzv8gboAAAAJ,Ddem6g4AAAAJ,Juan C Saez,"Instituto de Neurociencias, Universidad de Valparaíso, Valparaíso, Chile (juancarlos.saez@uv.cl)"
kzv8gboAAAAJ,4qpaC-YAAAAJ,Agustin D Martinez,"Centro Interdisciplinario de Neurociencia de Valparaíso, Universidad de Valparaíso"
kzv8gboAAAAJ,-iq_ruQAAAAJ,Guillermo Altenberg,"Professor of Cell Physiology and Molecular Biophysics, Tecas Tech University Health Sciences Center"
kzv8gboAAAAJ,vMuDhMQAAAAJ,Oscar Jara,University of Chicago
kzv8gboAAAAJ,3qgZ6x4AAAAJ,Pablo J. SÁEZ,"Cell Communication and Migration Lab / University Medical Center Hamburg- Eppendorf (UKE), Hamburg"
umsm2x4AAAAJ,N_vYMiMAAAAJ,Patricio Ramos Campos,Universidad de Talca
umsm2x4AAAAJ,-UyB-FIAAAAJ,Felipe Valenzuela-Riffo,
umsm2x4AAAAJ,-hOcVU4AAAAJ,ricardo I castro,Universidad Autonoma de Chile
umsm2x4AAAAJ,8yZnJpIAAAAJ,Carlos R. Figueroa,"Laboratory of Plant Molecular Physiology, Institute of Biological Sciences, Universidad de Talca"
umsm2x4AAAAJ,ger0_fwAAAAJ,Carlos Gaete-Eastman,"Researcher at Institute of Biological Sciences, University of Talca"
umsm2x4AAAAJ,pP4YB5EAAAAJ,Stephan Pollmann,Centro de Biotecnología y Genómica de Plantas (UPM - INIA)
umsm2x4AAAAJ,pJo7O5MAAAAJ,Adrián Garrido,"Plant Epigenetics Lab, Faculty of Forest Science (University of Concepcion)"
umsm2x4AAAAJ,uiInv90AAAAJ,Oscar Forero Doria,"Ph.D. in science, with a focus in Research and Development of Bioactive Compounds. Universidad de"
umsm2x4AAAAJ,l2juzcMAAAAJ,Lida Fuentes-Viveros,Centro Regional de Estudios en Alimentos Saludables
umsm2x4AAAAJ,6O4JKokAAAAJ,Lee Kalcsits,Washington State University
umsm2x4AAAAJ,RL0HivoAAAAJ,Carolina A. Torres,"Associate Professor, Department of Horticulture, Washington State University"
umsm2x4AAAAJ,aoDa9A0AAAAJ,Juan Pablo Martínez,"Ayudante Rentado, Universidad Nacional de La Plata"
umsm2x4AAAAJ,T0wzMgsAAAAJ,Mariona Gil Cortiella,"Académico Docente Investigador, Universidad Autónoma de Chile"
umsm2x4AAAAJ,PFIvxeEAAAAJ,CRISTINA Ubeda Aguilera,"Personal Docente e Investigador, Universidad Autónoma de Chile"
umsm2x4AAAAJ,W7eYRaMAAAAJ,Pablo Figueroa,"Instituto de Ciencias Biológicas, Universidad de Talca"
umsm2x4AAAAJ,ZLm7c-8AAAAJ,Luis Inostroza F.,INIA Chile
umsm2x4AAAAJ,Som7kaQAAAAJ,Daniel Bustos,"Universidad de Católica del Maule, CIEAM."
umsm2x4AAAAJ,yPqRjs8AAAAJ,daniela urbina,Academico
umsm2x4AAAAJ,NEBJYOgAAAAJ,Mauricio González-Agüero,Investigador
wWhnScMAAAAJ,y4Kwx_gAAAAJ,Mario Aranda,Pontificia Universidad Católica de Chile
wWhnScMAAAAJ,Xf2VkgEAAAAJ,JOSE M. PINGARRON,"Professor of Analytical Chemistry (UCM, Spain)"
wWhnScMAAAAJ,lElRvVsAAAAJ,Paloma Yáñez-Sedeño Orive,Universidad Complutense de Madrid
wWhnScMAAAAJ,Rlyxs2IAAAAJ,Rodolfo Mundaca-Uribe,"Assistant Professor. School of Pharmacy, University of Concepcion"
wWhnScMAAAAJ,ATVqMpMAAAAJ,Pilar Bermejo-Barrera,"Professor of Analytical Chemistry, University of Santiago de Compostela"
wWhnScMAAAAJ,2GfpP70AAAAJ,Antonio Moreda Piñeiro,Universidad de Santiago de Compostela
wWhnScMAAAAJ,va6EsIkAAAAJ,Karem Henríquez Aedo,University of Concepcion
wWhnScMAAAAJ,uiBjQoAAAAAJ,claudio zaror,Universidad de Concepcion
wWhnScMAAAAJ,zzgcfZMAAAAJ,Karla Garrido-Miranda,"Centro de Genómica Nutricional Agroacuícola (CGNA), Temuco"
wWhnScMAAAAJ,s1SLhp0AAAAJ,Paloma Herbello,Universidad de Santiago de Compostela
wWhnScMAAAAJ,x83qlVYAAAAJ,Eugenio Sanfuentes,"Universidad de Concepción, Facultad de Ciencias Forestales, Centro de Biotecnologia"
wWhnScMAAAAJ,r04NbpwAAAAJ,Marcos Eguílaz,Instituto de Investigaciones en Fisico-química de Córdoba (INFIQC) - Universidad Nacional …
wWhnScMAAAAJ,9_-XOksAAAAJ,Ricardo Salazar,Universidad de Santiago de Chile
wWhnScMAAAAJ,gyyvx-EAAAAJ,silvia diaz-cruz,Associate Professor at CSIC
wWhnScMAAAAJ,1JjDyEUAAAAJ,Angelo Beratto Ramos,PhD University of Concepción
wWhnScMAAAAJ,hwt1VuYAAAAJ,Paola Méndez Muñoz,InterAmerican Development Bank
wWhnScMAAAAJ,mvkWAG4AAAAJ,Cristian Agurto Muñoz,Universidad de Concepcion
wWhnScMAAAAJ,WPy6YSsAAAAJ,Felipe Aravena,MSc Universidad de Concepción
wWhnScMAAAAJ,t-uGyw4AAAAJ,Juan Araya,Universidad de Concepcion
wWhnScMAAAAJ,DuYr90EAAAAJ,Nelson P Barrera,"Assistant Professor, Pontificia Universidad Catolica de Chile"
wWhnScMAAAAJ,wNkSGhwAAAAJ,Jessy Pavón Pérez,"Docente adjunto Universidad San Sebastian, Investigador asistente Centro de …"
wWhnScMAAAAJ,TQfQIqkAAAAJ,Raquel Dominguez González,"Profesora de Química, Universidad de Santiago de Compostela"
wWhnScMAAAAJ,qUz8PQ4AAAAJ,Juan P. Fernández Blázquez,Institute IMDEA Materials
wWhnScMAAAAJ,OpWuvyoAAAAJ,Miguel A. Monclus,Researcher
wWhnScMAAAAJ,oN6kf5wAAAAJ,Camila Rivera-Cárcamo,Laboratoire de Chimie de Coordination
wWhnScMAAAAJ,VylpM20AAAAJ,Carlos von Plessing,Profesor de Tecnologia Farmaceutica
wWhnScMAAAAJ,7HKnMuwAAAAJ,CRISTIAN FABIAN PAZ ROBLES,Academico Universidad de La Frontera
wWhnScMAAAAJ,ZAoDkJsAAAAJ,ANGELICA SANDOVAL-PINEDA,"Profesora de lingüística aplicada, Universidad Autónoma de Chihuahua"
AOqp3aQAAAAJ,vdF2kZcAAAAJ,Daniel Miranda,Pontificia Universidad Católica de Chile
AOqp3aQAAAAJ,QCzNHiEAAAAJ,Martín Bascope,"Assistant professor, Pontificia Universidad Católica de Chile"
AOqp3aQAAAAJ,9b8DoS8AAAAJ,Cristián Cox,"Professor, Universidad Diego Portales"
AOqp3aQAAAAJ,QkIdjasAAAAJ,Juan Carlos Castillo,Universidad de Chile
AOqp3aQAAAAJ,TzPYdWsAAAAJ,Arturo Arriagada,"Associate Professor | School of Communications, Universidad Adolfo Ibáñez | Chile"
AOqp3aQAAAAJ,vG8xgS4AAAAJ,"Mark Graham, Professor of Internet Ge...","Oxford Internet , University of Oxford"
AOqp3aQAAAAJ,uyqq2JsAAAAJ,Kelle Howson,"Oxford Internet Institute, University of Oxford"
AOqp3aQAAAAJ,sOu7MzsAAAAJ,Funda Ustek Spilda,"Oxford Internet Institute, University of Oxford"
AOqp3aQAAAAJ,PK6HCroAAAAJ,Rafael Grohmann,University of Toronto
AOqp3aQAAAAJ,JFvRc2sAAAAJ,Ernesto Trevino,"Facultad de Educación, Pontificia Universidad Católica de Chile"
AOqp3aQAAAAJ,TkuKxkUAAAAJ,Amaranta Alfaro,"Reseach professor, Universidad Alberto Hurtado"
AOqp3aQAAAAJ,4Q4p4EUAAAAJ,Pitso Tsibolane,"Information Systems, University of Cape Town"
eGSxsmIAAAAJ,KY62BoEAAAAJ,Jose A. Casaretto,University of Guelph
eGSxsmIAAAAJ,DJBFkSsAAAAJ,Ruben Almada,Centro de Estudios Avanzados en Fruticultura (CEAF)
eGSxsmIAAAAJ,poAg0JYAAAAJ,Aurelio Gómez Cadenas,Universitat Jaume I
eGSxsmIAAAAJ,TzKUHJwAAAAJ,Valerie J Smith,University of St Andrews
eGSxsmIAAAAJ,4eXnXkYAAAAJ,Simón Ruiz-Lara,Universidad de Talca
eGSxsmIAAAAJ,viANEScAAAAJ,"Roselló, Salvador",Universitat Jaume I
eGSxsmIAAAAJ,HVgKJBMAAAAJ,Sonia Osorio,"Instituto de Hortofruticultura Subtropical y Mediterranea (IHSM), Universidad de Málaga-Consejo"
eGSxsmIAAAAJ,q39xSvgAAAAJ,Vicent Arbona,"Departament de Ciències Agràries i del Medi Natural, Universitat Jaume I"
lQ_eONgAAAAJ,iyROdXkAAAAJ,José Maximiliano Rivera Restrepo,Universidad San Sebastian
lQ_eONgAAAAJ,Wvzz91AAAAAJ,Carolina Riveros,Universidad de Talca
lQ_eONgAAAAJ,U6RfDY4AAAAJ,"Prof. Dr. Ruben Mendez Reategui, LL...","Universidad Autonoma de Chile; Visiting (honorary) at U. Tecnologica del Peru, RENACYT CTI 41042222"
fNw-xX4AAAAJ,7i3-nJcAAAAJ,Claudio Marcelo Hernández-Mosqueira,"Departamento de Educación Física, Deportes y Recreación"
fNw-xX4AAAAJ,M1HHaLAAAAAJ,Juan Carlos Peña Axt,Universidad Autónoma de Chile
fNw-xX4AAAAJ,Nc4A2kQAAAAJ,Hernán Joaquín Riquelme Brevis,Universidad Autónoma de Chile - Instituto Iberoamericano de Desarrollo Sostenible
fNw-xX4AAAAJ,N5BXXVAAAAAJ,Cristian Orellana Fonseca,Universidad del Bío-Bío
fNw-xX4AAAAJ,bjoiCq4AAAAJ,David Cuadra Martínez,Universidad de Atacama
fNw-xX4AAAAJ,zvQvAusAAAAJ,Katherina Walper Gormáz,Universidad Austral de Chile
fNw-xX4AAAAJ,-dR-Sk8AAAAJ,Marta Alcaide,"Psychological Methods and Design of Research Studies, University of Valencia"
fNw-xX4AAAAJ,tOfXv4YAAAAJ,Miguel Salazar Muñoz,Facultad de Psicología Universidad San Sebastián
fNw-xX4AAAAJ,wKmaDr4AAAAJ,Dr. Esteban Ariel Aedo-Muñoz,"Physical Activity, Sport and Health Sciences Laboratory - Universidad de Santiago"
fNw-xX4AAAAJ,89rYLwoAAAAJ,Juan José Zacarés,"Profesor de Psicología, Universidad de Valencia"
fNw-xX4AAAAJ,BTfWUjAAAAAJ,Johan Rivas Valenzuela,PhD Student - Physical Education and Social Transformation Group. University of Granada.
fNw-xX4AAAAJ,0RTkP8sAAAAJ,Ángel  Acevedo-Duque,Universidad Autónoma de Chile
fNw-xX4AAAAJ,qSjoo3UAAAAJ,Alejandro Iborra; AI Cuéllar; A. Iborra...,Departamento de Ciencias de la Educación. Universidad de Alcalá
fNw-xX4AAAAJ,0VUckAcAAAAJ,Ana Belén García-Varela,"Profesora Titular de Psicología Evolutiva y de la Educación, Universidad de Alcalá"
fNw-xX4AAAAJ,rt78O5QAAAAJ,Emilia Serra,University of Valencia
fNw-xX4AAAAJ,iPEQsv4AAAAJ,Oscar F. Garcia,University of Valencia
fNw-xX4AAAAJ,758W3uYAAAAJ,Sergio Toro Arevalo,Universidad Austral de Chile
_iz0dBkAAAAJ,eYNtNNsAAAAJ,Thierry Stoecklin,research director at CNRS
_iz0dBkAAAAJ,O3EGjIMAAAAJ,François Lique,Université de Rennes
_iz0dBkAAAAJ,kMKmPeoAAAAJ,Dayán Páez-Hernández,Universidad Andres Bello
_iz0dBkAAAAJ,tUudkZgAAAAJ,M Meuwly,University of Basel
_iz0dBkAAAAJ,gE4aCtEAAAAJ,Natalia Inostroza Pino,Universidad Autónoma de Chile
_iz0dBkAAAAJ,crbugssAAAAJ,Trabelsi Tarek,University of pennsylvania department of earth and environmental science
_iz0dBkAAAAJ,YZPQTpcAAAAJ,Jesus Rubayo-Soneira,Professor of High Institute of Applied Science and Technology. University of Havana.
_iz0dBkAAAAJ,qSHS-XQAAAAJ,Juan Carlos Castro Palacio,"Associate Profesor (Physics), Universitat Politècnica de València, Spain"
_iz0dBkAAAAJ,SIWvZXUAAAAJ,Maykel Márquez-Mijares,Instituto Superior de Tecnologías y Ciencias Aplicadas. Universidad de La Habana.
Nd82EzsAAAAJ,p7_WRcAAAAAJ,"Fernando Danilo Gonzalez Nilo, PhD","Director Center for Bioinformatics and Integrative Biology, Universidad Andres Bello, Santiago"
Nd82EzsAAAAJ,b0qmbcEAAAAJ,Leonardo Silva Santos,"Full Professor (Profesor Titular), Instituto de Química de Recursos Naturales, Universidad de Talca"
Nd82EzsAAAAJ,kkA073MAAAAJ,Jeffrey Comer,Kansas State University
Nd82EzsAAAAJ,_zzvUDMAAAAJ,Ariela Vergara-Jaque,Universidad de Talca
Nd82EzsAAAAJ,YmIVwwwAAAAJ,Carolina Mascayano Collado,"Profesor Química Orgánica y Bioinformática Estructural, Universidad de Santiago de Chile"
Nd82EzsAAAAJ,iRc-CqIAAAAJ,Julio Caballero,Universidad de Talca
Nd82EzsAAAAJ,tNAnbF0AAAAJ,Fabian Avila-Salas,Centro de Nanotecnología Aplicada - Universidad Mayor
Nd82EzsAAAAJ,OtMR_tMAAAAJ,Juan J. Freire,Universidad Nacional de Educación a Distancia UNED
Nd82EzsAAAAJ,vBV0RRgAAAAJ,Nancy Alvarado Almonacid,"Académica, Universidad Autónoma de Chile"
Nd82EzsAAAAJ,ofMftfoAAAAJ,Mario Saavedra Torres,-
xFdr8CUAAAAJ,qarTv4UAAAAJ,Ximena Zarate,"Universidad Autónoma de Chile, Instituto de Ciencias Químicas Aplicadas"
xFdr8CUAAAAJ,QavRsWQAAAAJ,Carlos Cardenas,"Professor, Universidad de Chile"
xFdr8CUAAAAJ,GYbT_iIAAAAJ,Ramiro Arratia-Perez,Universidad Andres Bello
xFdr8CUAAAAJ,w2j8e90AAAAJ,Francesc Illas,"Departament de Ciència de Materials i Química Fisica & IQTCUB, Universitat de Barcelona"
xFdr8CUAAAAJ,-7gKQjYAAAAJ,Jose A Rodriguez,Brookhaven National Laboratory
xFdr8CUAAAAJ,s_HHciYAAAAJ,Jean Christophe Tremblay,"Professor, Theoretical and Physical Chemistry Lab, Université de Lorraine, France"
xFdr8CUAAAAJ,rL3N4l4AAAAJ,Jhon Fredy Pérez Torres,Universidad Industrial de Santander
xFdr8CUAAAAJ,Lj_guSEAAAAJ,Desmond MacLeod-Carey Castro,Universidad Autonoma de Chile
xFdr8CUAAAAJ,y4-rt68AAAAJ,Ping Liu,Brookhaven National Laboratory
xFdr8CUAAAAJ,vjUabgsAAAAJ,José H Zagal  FRSC,"Distinguished Professor, Director, Laboratory of Electrocatalysis, University of Santiago de Chile"
xFdr8CUAAAAJ,D-0_MGkAAAAJ,Dr. Gunter Hermann,Quantum Chemist | Entrepreneur | Scientific Researcher | AI Specialist
-hOcVU4AAAAJ,b0qmbcEAAAAJ,Leonardo Silva Santos,"Full Professor (Profesor Titular), Instituto de Química de Recursos Naturales, Universidad de Talca"
-hOcVU4AAAAJ,umsm2x4AAAAJ,Luis Alberto Morales Quintana,Universidad Autónoma de Chile
-hOcVU4AAAAJ,ADcHrz0AAAAJ,Adolfo Marican,Lecturer Professor
-hOcVU4AAAAJ,tNAnbF0AAAAJ,Fabian Avila-Salas,Centro de Nanotecnología Aplicada - Universidad Mayor
-hOcVU4AAAAJ,-I0-uyMAAAAJ,Felipe Laurie,"Professor of Enology, Universidad de Talca, Chile"
xmIk_7EAAAAJ,ppHtTBAAAAAJ,Conan K Wang,The University of Queensland
xmIk_7EAAAAJ,vTtG9nsAAAAJ,David J Craik,University of Queensland
xmIk_7EAAAAJ,26Loa-gAAAAJ,Ximena Valenzuela,Universidad Austral de Chile
xmIk_7EAAAAJ,arS62x4AAAAJ,Jans Alzate Morales,"Associate Professor, Centro de Bioinformática, Simulación y Modelado (CBSM), University of Talca"
xmIk_7EAAAAJ,iRc-CqIAAAAJ,Julio Caballero,Universidad de Talca
xmIk_7EAAAAJ,KGfUQsYAAAAJ,David Ramirez,Universidad de Concepción
xmIk_7EAAAAJ,5ibDJMgAAAAJ,Quentin Kaas,Syngenta Crop Protection
xmIk_7EAAAAJ,G4pdVO4AAAAJ,Wendy González,Universidad de Talca
xmIk_7EAAAAJ,7xxcOrsAAAAJ,Aaron Poth,IonOpticks
xmIk_7EAAAAJ,k8qawNcAAAAJ,Lai Yue Angeline Chan,University of Queensland
