scholar_id_autor_gs,scholar_id_gs_coauthor,nombre_coauthor,cargo
QIHKy1UAAAAJ,94JOMYcAAAAJ,Sergio A Estay,Universidad Austral de Chile
QIHKy1UAAAAJ,U2Dkd_kAAAAJ,Nelson A. Lagos,Profesor Titular UST
QIHKy1UAAAAJ,hZh94aEAAAAJ,Marcelo M. Rivadeneira,"Senior Researcher at Centro de Estudios Avanzados en Zonas Aridas (CEAZA), Coquimbo, Chile"
LEEYFekAAAAJ,Xvn25u8AAAAJ,Paula Aguilera,"Researcher in Universidad Católica de Temuco, Chile"
LEEYFekAAAAJ,40pIDYoAAAAJ,GEOMAR VALLEJOS TORRES,Universidad Nacional de San Martin
LEEYFekAAAAJ,QZtPCTcAAAAJ,Fritz Oehl,Agroscope - University of Basel - ETH Zürich - University of Hohenheim
LEEYFekAAAAJ,X3KNFNAAAAAJ,Evelin Fernández Cornejo,Student
LEEYFekAAAAJ,t3OG1lMAAAAJ,Jens Boy,"Institute of Soil Science, Leibniz University, Hannover"
LEEYFekAAAAJ,HsymLWMAAAAJ,Nery Gaona Jimenez,Universidad Nacional de San Martin
LEEYFekAAAAJ,ak0ofRMAAAAJ,goetz palfner,Profesor de Micología (Universidad de Concepción)
LEEYFekAAAAJ,7tP7ZvQAAAAJ,Jacob Weiner,University of Copenhagen
LEEYFekAAAAJ,zD59coAAAAAJ,Mike Anderson Corazon Guivin,Universidad Nacional de San Martín-Tarapoto
LEEYFekAAAAJ,MkS6D0AAAAAJ,Dr. Tesfaye Wubet,"Helmholtz Center for Environmental Research - UFZ, Department of Community Ecology"
LEEYFekAAAAJ,bmbJ0gQAAAAJ,Michael Schloter,Professor für Mikrobiologie
LEEYFekAAAAJ,0V9g7RAAAAAJ,Wagner Gonçalves Vieira Junior,"Doutorando, Universidade Estadual Paulista - UNESP"
LEEYFekAAAAJ,O2b5avQAAAAJ,Jadson Belem de Moura,"Professor Títular de Microbiologia do Solo, Coordenação de Pesquisa e Pós-Graduação"
LEEYFekAAAAJ,NEJdQnkAAAAJ,Guillermo D'Elía,Universidad Austral de Chile
LEEYFekAAAAJ,Qonu0doAAAAJ,JESSICA DUCHICELA,UNIVERSIDAD DE LAS FUERZAS ARMADAS - ESPE
LEEYFekAAAAJ,AN0UzIAAAAAJ,Daniela Santos carneiro Torres,Professora da UEFS
LEEYFekAAAAJ,CPztOSQAAAAJ,MARIA DEL MAR ALGUACIL,científica titular
LEEYFekAAAAJ,27BuF0gAAAAJ,Alejandra G. Becerra,IMBIV-CONICET-Universidad Nacional de Córdoba
LEEYFekAAAAJ,uQZ6keMAAAAJ,Jorge  Saavedra Ramírez,Universidad Nacional Autónoma de Alto Amazonas
LEEYFekAAAAJ,Vrt86egAAAAJ,Rodrigo Fernandes de Souza,"Professor, Faculdade Evangélica de Goianésia"
LEEYFekAAAAJ,nlHqs8gAAAAJ,Petr Kohout,Czech Academy of Sciences
LEEYFekAAAAJ,jdkZa1IAAAAJ,Gustavo Henrique Mendes Brito,Faculdade Evangélica de Goianésia
LEEYFekAAAAJ,kYrhqAgAAAAJ,Minerva García-Carmona,PhD soil science
LEEYFekAAAAJ,HWdyL1sAAAAJ,Fuensanta Garcia,Departamento de Agroquimica y Medio Ambiente UMH
LEEYFekAAAAJ,GvHbakYAAAAJ,Brajesh K. Singh,"Distinguished Professor, Western Sydney University, Macaulay Institute"
LEEYFekAAAAJ,Ud6dMd05veoC,Miguel Cooper,"Professor de Ciência do Solo, Universidade de São Paulo"
LEEYFekAAAAJ,l5r6nkgAAAAJ,Anne Winding,"Professor, Aarhus University"
LEEYFekAAAAJ,9_6av1IAAAAJ,Zoe Lindo,University of Western Ontario
LEEYFekAAAAJ,CoUkG74AAAAJ,Elizabeth M. Bach,"Research Scientist, The Nature Conservancy - Nachusa Grasslands"
LEEYFekAAAAJ,1qxpS-EAAAAJ,Pauline Mele,Associate Professor Agriculture Victoria Research
LEEYFekAAAAJ,oFVJMMsAAAAJ,Maria Alice Neves,"MICOLAB, Universidade Federal de Santa Catarina"
LEEYFekAAAAJ,poCAbWkAAAAJ,María Isabel Mujica P,"Instituto de Ciencias Ambientales y Evolutivas, Universidad Austral de Chile"
LEEYFekAAAAJ,bWRdgK8AAAAJ,SANDRO DUTRA E SILVA,Professor Titular Universidade Estadual de Goiás e Centro Universitário de Anápolis
LEEYFekAAAAJ,VCU1QwUAAAAJ,Victor Hugo Garcia Merchan,"Professor of Evolutionary Genetics, Quindio University"
LEEYFekAAAAJ,rc_A3kQAAAAJ,Francisco Calaça,Mykocosmos - Mycology and Science Communication
LEEYFekAAAAJ,MTAXk6oAAAAJ,Andrés Argüelles-Moyao,National Autonomous University of México
LEEYFekAAAAJ,tNdxmYUAAAAJ,Andrea C. Rinaldi,University of Cagliari
LEEYFekAAAAJ,uDdSHOUAAAAJ,Milagros Lovera,Investigación (IVIC) 
LEEYFekAAAAJ,O30Og-UAAAAJ,Aida M. Vasco Palacios,"Professor, School of Microbiology, Universidad de Antioquia UdeA"
LEEYFekAAAAJ,WHhLHmQAAAAJ,Guerra Sierra Beatriz Elena,Sciences and Applied microbiology researcher
LEEYFekAAAAJ,s18zSK4AAAAJ,Ana Aguilar-Paredes,Pontificia Universidad Católica de Valparaíso
LEEYFekAAAAJ,kIrX67AAAAAJ,VH (Víctor) Bonilla-Muñoz,Instituto de Investigaciones en Ciencias Naturales y Tecnología de la Universidad Rafael …
LEEYFekAAAAJ,0Pl8Q1EAAAAJ,Johan van den Hoogen,"Researcher, ETH Zürich"
LEEYFekAAAAJ,2QVHtgUAAAAJ,Matthias C. Rillig,"Professor of Ecology, Freie Universität Berlin, Germany"
LEEYFekAAAAJ,dvgoenoAAAAJ,María JI Briones,"Professor of Zoology, Universidad de Vigo"
LEEYFekAAAAJ,tNomWX0AAAAJ,Ika Djukic,Environment Agency Austria
LEEYFekAAAAJ,CdbeIqsAAAAJ,Antonis Chatzinotas,"Professor for Microbial Interaction Ecology, Helmholtz Centre for Environmental Research …"
LEEYFekAAAAJ,pimG8rwAAAAJ,Diana  H. Wall,CSU Distinguished Professor and Director of the School of Global Environmental …
LEEYFekAAAAJ,j9S3tqwAAAAJ,Simone Cesarz,German Centre for Integrative Biodiversity Research (iDiv)
LEEYFekAAAAJ,17SwCcQAAAAJ,Don A Cowan,"Centre for Microbial Ecology and Genomics, University of Pretoria"
LEEYFekAAAAJ,bPAx58UAAAAJ,Francois Buscot,Helmholtz Centre for Environmental Research - UFZ
LEEYFekAAAAJ,hgmc9vAAAAAJ,Fernando T. Maestre (ORCID: 0000-0002-7434-4856),"Distinguised Researcher, Universidad de Alicante (ROR 05t8bcz72)"
LEEYFekAAAAJ,QiDUyR8AAAAJ,Linnea Smith,
LEEYFekAAAAJ,BdpltZUAAAAJ,Adriana Corrales,Universidad del Rosario
LEEYFekAAAAJ,ZaVdr3YAAAAJ,Javier ORMENO-LUNA,Universidad Nacional de San Martín - Tarapoto
LEEYFekAAAAJ,y4UjpWgAAAAJ,Mailen Ortega,"Estudiante, Universidad de Antioquia"
LEEYFekAAAAJ,LM9gf5EAAAAJ,Juliana Estefania Arcila Galvis,"Biological Engineer, Msc. Genetics and Cell Biology, PhD student at Newcastle University"
LEEYFekAAAAJ,NWb0vdoAAAAJ,Jorge Muñoz,PhD student at University of São Paulo
LEEYFekAAAAJ,0cruz98AAAAJ,Tatiana Arias,Marie Selby Botanical Gardens
LEEYFekAAAAJ,zs2iHk0AAAAJ,Paula Marchelli,Investigadora Principal de CONICET IFAB (INTA Bariloche - CONICET)
LEEYFekAAAAJ,BEHxmbcAAAAJ,Denise Moguilevsky,"Becaria Doctoral, IPATEC (Universidad Nacional del Comahue - CONICET)"
LEEYFekAAAAJ,046pwMgAAAAJ,Emanuela WA Weidlich,Lecturer at Leuphana Universität Lüneburg
LEEYFekAAAAJ,PnzcMasAAAAJ,Maarja Öpik,University of Tartu
LEEYFekAAAAJ,oKzoAuEAAAAJ,Nancy Collins Johnson,"Regents' Professor of Ecology, Northern Arizona University"
LEEYFekAAAAJ,OW2oq2sAAAAJ,Milen Duarte,Universidad Austral de Chile
LEEYFekAAAAJ,Sg-yf84AAAAJ,C. Guillermo Bueno,"Ramon y Cajal researcher - Instituto Pirenaico de Ecologia, CSIC"
LEEYFekAAAAJ,Oe_CdBwAAAAJ,Kate Scow,Distinguished Professor Soil Science & Microbial Ecology
LEEYFekAAAAJ,VDb3PyAAAAAJ,Marcel GA van der Heijden,"1) Department of Agroecology & Environment, Agroscope, Zurich; 2) University of Zurich …"
LEEYFekAAAAJ,MMd0MnQAAAAJ,Richard Bardgett,"The University of Manchester, Manchester,  UK"
LEEYFekAAAAJ,QGUI4BoAAAAJ,Dan Pennock,"Professor of Soil Science, University of Saskatchewan"
LEEYFekAAAAJ,BYC9328AAAAJ,Adriano Sofo,"University of Basilicata, DiCEM, Matera, Italy"
LEEYFekAAAAJ,fXemWp4AAAAJ,Leho Tedersoo,"Researcher in Fungal Ecology and Biogeography, Tartu University"
LEEYFekAAAAJ,JrkHZmIAAAAJ,"Francisco José García García, MD PhD",Servicio de Geriatría CHT. Toledo
LEEYFekAAAAJ,P67qmjwAAAAJ,Bruno Fogliani,New Caledonian Agronomic Institute
LEEYFekAAAAJ,4Pcj_EIAAAAJ,Georg Guggenberger,Leibniz Universität Hannover
LEEYFekAAAAJ,_AVEpIoAAAAJ,Robert McCulloch,Centro de Investigación en Ecosistemas de la Patagonia
LEEYFekAAAAJ,91RfZugAAAAJ,Iskandar,"Dept. of Soil Science, Bogor Agricultural University"
LEEYFekAAAAJ,zuUfOPMAAAAJ,Carsten W Müller,University of Copenhagen
LEEYFekAAAAJ,3xNlkIUAAAAJ,Sebastian Veg,"Professor, EHESS Paris"
pAqfjfsAAAAJ,AQ7yOeIAAAAJ,Felipe Arenas,Universidad de Santiago de Chile
pAqfjfsAAAAJ,jlpbJJYAAAAJ,Luis Cottet Bustamante,Universidad Santo Tomas
KRpmq6EAAAAJ,hMnlOYAAAAAJ,Francisco Guinjoan,"Full Professor, UPC, Barcelona, Spain"
KRpmq6EAAAAJ,XN63d3kAAAAJ,Carlos Meza,Anhalt University of Applied Sciences
KRpmq6EAAAAJ,5kPvjUAAAAAJ,Guillermo Velasco,Professor Agregat. Universitat Politècnica de Catalunya
KRpmq6EAAAAJ,o3-Z6mQAAAAJ,Pablo Sanchis,Public University of Navarre
KRpmq6EAAAAJ,zGFZAE8AAAAJ,Antonio Carlos Zambroni de Souza,Universidade Federal de Itajubá
KRpmq6EAAAAJ,WNT_qXcAAAAJ,Dr. Miguel Castilla,"Professor, Technical University of Catalonia"
KRpmq6EAAAAJ,X-AeGdEAAAAJ,Mário Gomes,Instituto Politécnico de Tomar (IPT) / Centro de Investigação Cidades Inteligentes (Ci2.ipt)
KRpmq6EAAAAJ,xFbB7kcAAAAJ,Ralph Gottschalg,Director Fraunhofer CSP; Professor of Photovoltaic Energy Systems at Hochschule Anhalt
KRpmq6EAAAAJ,SZ9r1FgAAAAJ,Mario Rui Gomes,Inesc-id
hrJ2XYsAAAAJ,Zin3C7YAAAAJ,Víctor Patricio Díaz Narváez,"Profesor Investigador, Universidad Andrés Bello. Santiago. Chile."
hrJ2XYsAAAAJ,KusilLIAAAAJ,Felipe E. García,"Académico, Universidad de Concepción, Concepción, Chile."
hrJ2XYsAAAAJ,QmVSYyQAAAAJ,Pilar Torres,"Profesor asistente ,Universidad San Sebastián, Concepción. Chile"
hrJ2XYsAAAAJ,eYImzwsAAAAJ,Anna Marcelina Wlodarczyk,"Profesora Asociada, Universidad Católica del Norte"
hrJ2XYsAAAAJ,iZ-PiyUAAAAJ,Eugenia Smirna Gonzalez Diaz,"Profesor de epidemiologia, Universidad Central del Este"
hrJ2XYsAAAAJ,fhIr5TIAAAAJ,Camila Valenzuela-Moguillansky,Laboratorio de Fenomenología Corporal
hrJ2XYsAAAAJ,UL552pAAAAAJ,Natalia Fortich Mesa,Corporación Universitaria Rafael Nuñez
hrJ2XYsAAAAJ,KVva2AIAAAAJ,Dario Paez Rovira,"Profesor Catedratico (1984/2023 UPV), Invitado (UNAB,cl) y honorario (PUCP,pe) de …"
hrJ2XYsAAAAJ,_EXwDyIAAAAJ,Bernardo Riffo,"Profesor de Lingüística, Universidad de Concepción"
hrJ2XYsAAAAJ,WLPKlSIAAAAJ,Ximena Vélez Calvo,"Profesor Educación Inicial, Educación Básica y Educación Especial, Universidad del Azuay"
hrJ2XYsAAAAJ,IRf94m0AAAAJ,Dilia Aparicio Marenco,Corporación Universitaria Rafael Núñez
hrJ2XYsAAAAJ,kQWz5M0AAAAJ,Fernando  Reyes Reyes,Facultad de Psicología Universidad del Desarrollo. Instituto de Bienestar Socioemocional …
hrJ2XYsAAAAJ,iKilzjAAAAAJ,Claudia Arispe-Alburqueque,"Coordinadora de Investigación, Universidad Wiener"
hrJ2XYsAAAAJ,f8sMWagAAAAJ,Doris Carrasco Mardones,"Profesor Asistente, Facultad de Odontología, Universidad de Concepción"
hrJ2XYsAAAAJ,O8qrvmQAAAAJ,Maria Isabel Gaete Celis,"Investigadora Joven, Insituto Milenio para la Investigación en Depresión y Personalidad …"
hrJ2XYsAAAAJ,SLux9bQAAAAJ,Mariela Padilla,Herman Ostrow School of Dentistry of USC
hrJ2XYsAAAAJ,Y-0YDYUAAAAJ,"ROSARIO MARTINEZ ARIAS, Rosario Martínez",Psicologia
hrJ2XYsAAAAJ,lxERpKgAAAAJ,JORGE LUIS BILBAO RAMIREZ,Docente Metodología de la Investigación Científica
hrJ2XYsAAAAJ,ssknb1oAAAAJ,Elizabeth Fajardo Ramos,"Profesora Titular FCS, Universidad del Tolima"
hrJ2XYsAAAAJ,rM9i5k8AAAAJ,Fray MARTINEZ-REYES,"Profesor de Investigacion y Bioestadistica, Universidad del Azuay"
hrJ2XYsAAAAJ,oePza-8AAAAJ,Ana María Erazo Coronado,Universidad Metropolitana Universidad del Norte
hrJ2XYsAAAAJ,8aqtAIoAAAAJ,ANA LILIANA RIOS GARCIA,Docente Universidad del Norte
hrJ2XYsAAAAJ,Zx9GJQ4AAAAJ,ALBA XIMENA ZAMBRANO CONSTANZO,"Departamento de Psicología, Universidad de La Frontera"
X4JpgYwAAAAJ,Cwx71pYAAAAJ,Eduardo Guzmán Muñoz,"Escuela de Kinesiología, Universidad Santo Tomás, Talca, Chile"
X4JpgYwAAAAJ,DC-1QokAAAAJ,"Pablo Valdés-Badilla, Ph.D.",Universidad Católica del Maule
X4JpgYwAAAAJ,lNlzaIsAAAAJ,Yeny Concha- Cisternas,Universidad Santo Tomás
X4JpgYwAAAAJ,c9vCxn4AAAAJ,Rodrigo Ramirez-Campillo,Exercise and Rehabilitation Sciences Laboratory. School of Physical Therapy. Faculty of
X4JpgYwAAAAJ,bVido7MAAAAJ,Sergio Sazo Rodríguez,"Kinesiólogo, Universidad Santo Tomás"
X4JpgYwAAAAJ,lDg38rEAAAAJ,Marcelo Castillo-Retamal,Universidad Católica del Maule - Facultad de Ciencias de la Educación - GEEAFyS
X4JpgYwAAAAJ,3uvrmCYAAAAJ,Ricardo Cartes-Velásquez,Fundación Kimntrum
X4JpgYwAAAAJ,Qaik25EAAAAJ,Edith Elgueta Cancino,Universidad Andres Bello
X4JpgYwAAAAJ,SUKzSYQAAAAJ,Francisco José Berral de la Rosa,"Catedrático de Universidad, U. Pablo Olavide de Sevilla (ES). https://orcid.org/0000-0003 …"
X4JpgYwAAAAJ,e_D6W2MAAAAJ,Tomas Herrera-Valenzuela,"Laboratorio de Ciencias de la Actividad Física, el Deporte y la Salud, Facultad de Ciencias …"
X4JpgYwAAAAJ,WNcQdzMAAAAJ,Eduardo Martinez-Valdes,"School of Sport, Exercise and Rehabilitation Sciences, University of Birmingham …"
X4JpgYwAAAAJ,92jAdf4AAAAJ,igor cigarroa,"Escuela de kinesiología, Facultad de Salud, UST Los Ángeles Chile"
X4JpgYwAAAAJ,lvdJEy4AAAAJ,Carlos Cruz-Montecinos,Universidad de Chile. Departamento Kinesiología
X4JpgYwAAAAJ,IxhhJ9IAAAAJ,Pedro Delgado Floody,"Departamento de EF, Universidad de La Frontera"
X4JpgYwAAAAJ,hq3kfjUAAAAJ,Braulio Henrique Magnani Branco,UNICESUMAR
X4JpgYwAAAAJ,Qed4xmkAAAAJ,LUIS EDUARDO COFRÉ LIZAMA,"Research Fellow, Sport and Exercise Science, School of Allied Health, Human Services and …"
X4JpgYwAAAAJ,eWXIjwwAAAAJ,Carlos Cristi-Montero,Pontificia Universidad Católica de Valparaiso
X4JpgYwAAAAJ,DjLPCogAAAAJ,Antonio García-Hermoso (ORCID: 0000-0002-1397-7182),"Navarrabiomed, Universidad Pública de Navarra"
X4JpgYwAAAAJ,6FJnI74AAAAJ,Mikel Izquierdo (ORCID: 0000-0002-1506-4272),"Department of Health Sciences, Public University of Navarra (Full Professor)"
X4JpgYwAAAAJ,tmm2jdEAAAAJ,Jason Moran,"School of Sport, Rehabilitation and Exercise Sciences, University of Essex"
X4JpgYwAAAAJ,XR4vl8cAAAAJ,Carlos Celis-Morales,"Institute of Cardiovascular and Medical Science, Glasgow University, UK"
X4JpgYwAAAAJ,dj0hz_YAAAAJ,Alicia Mª Alonso Martínez,Universidad Pública de Navarra
X4JpgYwAAAAJ,TIug_BIAAAAJ,Hermann Zbinden-Foncea,"Profesor de Fisiología Molecular del Ejercicio, Universidad Finis Terrae"
X4JpgYwAAAAJ,nuCbGAQAAAAJ,Fernanda AP  Habechian,Universidad Católica del Maule
X4JpgYwAAAAJ,Z0_7pe0AAAAJ,hong-bo xie,queensland university of technology
X4JpgYwAAAAJ,m2OEYrgAAAAJ,"Rhodri S. Lloyd, PhD, ASCC, CSCS*D","Lecturer in Physiology & Health, Cardiff Metropolitan University"
X4JpgYwAAAAJ,mYCC_5oAAAAJ,Irineu Loturco,Director of Sport Science and Research Leader at Nucleus of High Performance in Sport …
X4JpgYwAAAAJ,pEq8FcgAAAAJ,Mauricio Castro Sepulveda,Pontificia universidad católica de chile
X4JpgYwAAAAJ,DrW-ktYAAAAJ,"David Cristobal Andrade, PhD","Biomedical Department, Facultad of Health Science, Universidad de Antofagasta"
X4JpgYwAAAAJ,olU3U_AAAAAJ,Felipe García-Pinillos,"Department of Physical Education and Sport, University of Granada, Spain"
X4JpgYwAAAAJ,CWvuLhgAAAAJ,Kohei Watanabe,"Professor, School of Health and Sport Sciences, Chukyo University"
X4JpgYwAAAAJ,gXV_JksAAAAJ,Antonio Jesús Berral Aguilar,Universidad Pablo de Olavide
X4JpgYwAAAAJ,dYBHgeMAAAAJ,Dr. Iván Suazo Galdames PhD.,Universidad Autónoma de Chile (ROR 010r9dy59) Chile
wOnfkSYAAAAJ,7_SsWD0AAAAJ,Mauricio Seguel,"Pathobiology Department, Ontario Veterinary College, University of Guelph"
wOnfkSYAAAAJ,JR4YufIAAAAJ,Nicole L. Gottdenker,University of Georgia
wOnfkSYAAAAJ,Y2RA_vMAAAAJ,Humberto González Estay,"Universidad Austral de Chile, Instituto de Ciencias Marinas y Limnológicas"
wOnfkSYAAAAJ,kNhzzGIAAAAJ,J. L. Iriarte,Universidad Austral de Chile
wOnfkSYAAAAJ,vr1VZh8AAAAJ,Sandro L. Bonatto,"Professor of Genetics and Evolutionary Biology, PUCRS, Brazil"
wOnfkSYAAAAJ,LZ3nvnAAAAAJ,Enrique Alberto Crespo,"Investigador Superior del Centro Nacional Patagónico, CONICET,Profesor Titular de Ecología"
wOnfkSYAAAAJ,ARB--7gAAAAJ,Lorena Rebolledo,Instituto Antártico Chileno
wOnfkSYAAAAJ,oq4KeeQAAAAJ,Ricardo Giesecke,Profesor Auxiliar Universidad Austral de Chile
wOnfkSYAAAAJ,rq30FOMAAAAJ,"Villy Christensen, FRSC","Professor, Institute for the Oceans and Fisheries, University of British Columbia"
wOnfkSYAAAAJ,cGpm35oAAAAJ,"Diego J. Perez-Venegas, Msc., Ph.D.","CIGREN, Instituto de Biología, Facultad de Ciencias, Universidad de Valparaíso, Valparaíso, Chile"
wOnfkSYAAAAJ,JtKFXhoAAAAJ,Jose Iriarte,"Professor, Archaeology, University of Exeter"
Zb2h_xAAAAAJ,WboqEP8AAAAJ,Andrew FG Quest,"Professor of Cell and Molecular Biology, University of Chile"
Zb2h_xAAAAAJ,jLe89w4AAAAJ,Thomas Jansson,"Department of Obstetrics & Gynecology,  University of Colorado Anschutz Medical Campus"
Zb2h_xAAAAAJ,-dsgiHoAAAAJ,Theresa Powell,"Professor Pediatrics and Obstetrics, University of Colorado"
Zb2h_xAAAAAJ,xAnpV2sAAAAJ,Sergio  Lavandero,"Profesor-Senador U Chile, Premio Nacional Cs Naturales 2022, Director ACDDiS, Adjunct Prof, UTSW"
Zb2h_xAAAAAJ,XvUFRcgAAAAJ,Roberto Bravo-Sagua,"Instituto de Nutrición y Tecnología de los Alimentos, Universidad de Chile"
Zb2h_xAAAAAJ,Yeoejj8AAAAJ,Jimena Bravo,Georg-Speyer-Haus institute für tumorbiologie und experimentelle therapie
Zb2h_xAAAAAJ,4n42PKoAAAAJ,Valentina Parra,"ACCDiS, Advanced Center for Chronic Diseases. Universidad de Chile."
Zb2h_xAAAAAJ,2qB9B8YAAAAJ,Camila Lopez-Crisosto,"Advanced Center for Chronic Diseases (ACCDIS), Facultad de Ciencias Químicas y Farmacéuticas & Facultad de Medicina, Universid"
Zb2h_xAAAAAJ,cMjAa3oAAAAJ,manue valenzuela-valderrama,"Associare Profesor, Universidad Central de Chle"
Zb2h_xAAAAAJ,Ag55rngAAAAJ,Colin Sibley,University of Manchester
Zb2h_xAAAAAJ,axQ_tCEAAAAJ,Mauricio Henriquez,"Lab. Bronchovascular Dynamics & Lung Damage, ICBM, Fac of Medicine, University of Chile"
Zb2h_xAAAAAJ,essAdqkAAAAJ,Alejandro Corvalan,Pontificia Universidad Catolica de Chile
Zb2h_xAAAAAJ,BC0HVooAAAAJ,Marçal Pastor-Anglada,"Professor of Biochemistry and Molecular Biology, University of Barcelona & CIBER EHD & IR SJD"
Zb2h_xAAAAAJ,utvt5zgAAAAJ,"Kris Genelyn Dimasuay, MS PhD",National Jewish Health
Zb2h_xAAAAAJ,iKdzu9EAAAAJ,Rebeca Caires,"Scientific Instructor, University of Tennessee Health Science Center"
Zb2h_xAAAAAJ,bLo0kh8AAAAJ,Maria Fernanda Gonzalez,Universidad de Chile
Zb2h_xAAAAAJ,4E2Y70EAAAAJ,Delia I Chiarello,Faculty of Medicine and Science
Zb2h_xAAAAAJ,mZJeAMcAAAAJ,Gonzalo Carrasco Aviño,Clínica Las Condes
v_zvgWgAAAAJ,7OUaTBEAAAAJ,Roger D. Sepúlveda,Ecología y Genética Ambiental SPA
v_zvgWgAAAAJ,hZh94aEAAAAJ,Marcelo M. Rivadeneira,"Senior Researcher at Centro de Estudios Avanzados en Zonas Aridas (CEAZA), Coquimbo …"
v_zvgWgAAAAJ,WB_qsXIAAAAJ,Fernando Torres-Perez,Pontificia Universidad Católica de Valparaiso
v_zvgWgAAAAJ,Ajt0dyoAAAAJ,Marcela Vidal Maldonado,"Laboratorio de Ecología y Evolución, Departamento de Ciencias Básicas, Facultad de …"
v_zvgWgAAAAJ,QIHKy1UAAAAJ,Fabio A. Labra R.,"Professor, Facultad de Ciencias, Universidad Santo Tomás, Santiago, Chile"
v_zvgWgAAAAJ,CZG0D0kAAAAJ,Sven Thatje,"University of Southampton, National Oceanography Centre Southampton"
v_zvgWgAAAAJ,fCJZmKwAAAAJ,Elie Poulin,Universidad de Chile
v_zvgWgAAAAJ,lECHx2oAAAAJ,Pedro F. Victoriano,Associate Professor. Universidad de Concepción
v_zvgWgAAAAJ,pszot3gAAAAJ,Guillermo Guzmán,Académico Universidad Arturo Prat
v_zvgWgAAAAJ,081-PZIAAAAJ,Aníbal Pauchard,Universidad de Concepción
v_zvgWgAAAAJ,LUdizE8AAAAJ,Marco A. Méndez,"Profesor Titular, Facultad de Ciencias, Universidad de Chile"
v_zvgWgAAAAJ,Sb2oKiMAAAAJ,R. Eduardo Palma,"Departamento de Ecología, Pontificia Universidad Católica de Chile"
v_zvgWgAAAAJ,m3Q4muoAAAAJ,Edgar Benavides,Yale University
v_zvgWgAAAAJ,v1S3-soAAAAJ,Annia Rodríguez-San Pedro (https://orcid.org/0000-0002-2615-7669),"Associate Professor, Facultad de Ciencias, Universidad Santo Tomás"
v_zvgWgAAAAJ,dKzw_s0AAAAJ,Juan Luis Allendes,Bioecos
v_zvgWgAAAAJ,0h2h9y4AAAAJ,Claudio Gonzalez-Wevar,"Profesor Asociado, Instituto de Ciencias Marinas (ICML), Universidad Austral de Chile …"
v_zvgWgAAAAJ,4Ns7QygAAAAJ,Ernesto Ivan Badano,"Instituto Potosino de Investigación Científica y Tecnológica, AC"
v_zvgWgAAAAJ,hWkdGo0AAAAJ,Nicol Fuentes,Depto. de Botánica. Universidad de Concepcion
v_zvgWgAAAAJ,rbm0YeIAAAAJ,Alfredo Saldaña,"Depto. de Botánica, Universidad de Concepción, Chile."
v_zvgWgAAAAJ,c7DM6fgAAAAJ,Paulina Sánchez González,Instituto de Ecología y Biodiversidad (IEB)
v_zvgWgAAAAJ,ak0ofRMAAAAJ,goetz palfner,Profesor de Micología (Universidad de Concepción)
v_zvgWgAAAAJ,hrRaIRwAAAAJ,Darko D. Cotoras,California Academy of Sciences
v_zvgWgAAAAJ,auyTL1YAAAAJ,Patricio A. Camus,"Departmento de Ecologia, Facultad de Ciencias, Universidad Catolica de la Santisima …"
v_zvgWgAAAAJ,IzWOnscAAAAJ,Daniel Zamorano Castillo,"Zoology department, University of Otago"
v_zvgWgAAAAJ,U2Dkd_kAAAAJ,Nelson A. Lagos,Profesor Titular UST
v_zvgWgAAAAJ,fkylJB0AAAAJ,Helen Diaz Paez,"Profesor Asociado, Universidad de Concepción"
v_zvgWgAAAAJ,94JOMYcAAAAJ,Sergio A Estay,Universidad Austral de Chile
2B6_y20AAAAJ,BCSv68EAAAAJ,Joaquin Gairín Sallán,Universitat Autónoma de Barcelona
2B6_y20AAAAJ,IukXT_gAAAAJ,Leopoldo Lopez,Universidad de Talca
2B6_y20AAAAJ,6UaHQvYAAAAJ,Oswaldo Leyva Cordero,"Universidad Autónoma de Nuevo León, Facultad de Ciencias Políticas y Relaciones Internacionales"
2B6_y20AAAAJ,-X5hg4YAAAAJ,Abraham Alfredo Hernández Paz,"Director de la Facultad de Ciencias Políticas y Relaciones Internacionales de la Universidad Autónoma de Nuevo León, Miembro del Sistema Nacional de Investigadores Nivel I, Miembro del Cuerpo Académico Gestión y Política Educativa"
2B6_y20AAAAJ,Zm6JHCsAAAAJ,Rodolfo Schmal,"Ingeniero Civil Industrial, Master en Informática; académico de la Universidad de Talca"
2B6_y20AAAAJ,h6upOf0AAAAJ,Óscar Arias-Rojas,Magíster Economía Aplicada (DII-Universidad de Chile)
2B6_y20AAAAJ,GaoxiDcAAAAJ,Tamara Márquez,"Professor, Universidad Santo Tomás, Talca, Chile"
2B6_y20AAAAJ,ATFF7ikAAAAJ,Francisco Ganga Contreras,Universidad de Tarapacá
2B6_y20AAAAJ,3AwIgy0AAAAJ,José Tejada Fernández,Universidad Autónoma de Barcelona
2B6_y20AAAAJ,u9nGDIYAAAAJ,Diego Castro,UAB
2B6_y20AAAAJ,C5rbflwAAAAJ,NIBALDO BENAVIDES MORENO,Universidad de Talca
rTOdPc0AAAAJ,UsXLvsEAAAAJ,Juan Carlos Oyanedel,"Facultad de Educación y Ciencias Sociales, Universidad Andrés Bello. Santiago de Chile"
rTOdPc0AAAAJ,-0WlOaYAAAAJ,Maria Angeles Bilbao,"Profesora, Facultad de Psicología, U. Alberto Hurtado"
rTOdPc0AAAAJ,YVBJgLwAAAAJ,Paula Ascorra,Pontificia Universidad Católica de Valparaíso
rTOdPc0AAAAJ,cUKJtaMAAAAJ,Verónica López,Pontificia Universidad Católica de Valparaíso
rTOdPc0AAAAJ,BaJ-vokAAAAJ,Xavier Oriol Granado,"""Beatriz Galindo"" Distinguished Research Professor, Department of Psychology at University …"
rTOdPc0AAAAJ,Jq1Bu_0AAAAJ,Rafael Miranda Ayala,Universidad Continental del Perú
rTOdPc0AAAAJ,KVva2AIAAAAJ,Dario Paez Rovira,"Profesor Catedratico (1984/2023 UPV), Invitado (UNAB,cl) y honorario (PUCP,pe) de …"
rTOdPc0AAAAJ,eO6VdggAAAAJ,Boris Villalobos Parada,Universidad de Playa Ancha
rTOdPc0AAAAJ,CVaKZGQAAAAJ,Jorge J. Varela,Universidad del Desarrollo
rTOdPc0AAAAJ,wu07OKAAAAAJ,Macarena Morales,Pontificia Universidad Católica de Valparaíso
rTOdPc0AAAAJ,KSQCg3gAAAAJ,Jaime Andrés Alfaro Inzunza,Universidad del Desarrollo
rTOdPc0AAAAJ,00qrF2UAAAAJ,Jonathan Martínez-Líbano,UNIVERSIDAD ANDRÉS BELLO
rTOdPc0AAAAJ,Tyt3cUEAAAAJ,Karen Cárdenas,Centro de Investigación para la Educación Inclusiva - Pontificia Universidad Católica de …
rTOdPc0AAAAJ,tLPdYwsAAAAJ,Hedy Acosta Antognoni -  ORCID: 0000-0002-8412-4128,Profesor Asistente - Universidad de Talca (Chile)
rTOdPc0AAAAJ,zTJz-t8AAAAJ,Alberto Amutio Careaga,UNIVERSIDAD DEL PAIS VASCO (UPV/EHU)
rTOdPc0AAAAJ,QMl7mgcA3uQC,Michelle Mendoza Lira,Universidad Andres Bello
rTOdPc0AAAAJ,L7bSpXUAAAAJ,Ferran Casas,Universitat de Girona
rTOdPc0AAAAJ,QtcPWdQAAAAJ,Joel Juarros Basterretxea,Universidad de Zaragoza
rTOdPc0AAAAJ,_R9XL_0AAAAJ,Ana Loreto Ditzel Lacoa,Universidad del Desarrollo
rTOdPc0AAAAJ,_p5cV-AAAAAJ,Denise Oyarzún Gómez,Universidad Central de Chile
rTOdPc0AAAAJ,JKt2cL8AAAAJ,Salvador Vargas Salfate,"University of Illinois, Urbana-Champaign"
v1S3-soAAAAJ,dKzw_s0AAAAJ,Juan Luis Allendes,Bioecos
v1S3-soAAAAJ,pkfRv9YAAAAJ,Audrey Grez,"Prof. Titular, Universidad de Chile"
v1S3-soAAAAJ,sfRXr4EAAAAJ,Gonzalo Ossa,ConserBat EIRL
v1S3-soAAAAJ,hHhpUB8AAAAJ,Silvio Macias,Texas A&M University
v1S3-soAAAAJ,0ZSa-l8AAAAJ,Tania Zaviezo,"Profesor of Entomology, Pontificia Universidad Católica de Chile"
v1S3-soAAAAJ,nPBY5u4AAAAJ,María Paz Acuña-Ruz,Csiro-Chile
v1S3-soAAAAJ,jVVj4VMAAAAJ,Andrea Silva,Universidad Austral de Chile
v1S3-soAAAAJ,H3JArYIAAAAJ,Rubén M Barquez,PIDBA
v1S3-soAAAAJ,acCkC6gAAAAJ,Danny Rojas,Department of Natural Sciences and Mathematics - Pontificia Universidad Javeriana Cali
v1S3-soAAAAJ,xl3lvzcAAAAJ,Francisco T. Peña-Gómez,"Instituto de Ecología y Biodiversidad, Facultad de Ciencias, Universidad de Chile"
jlpbJJYAAAAJ,bg7ViDUAAAAJ,Eva Vallejos-Vidal,Universidad Autónoma de Barcelona
jlpbJJYAAAAJ,Tdg4vkYAAAAJ,Miguel E Castro,"Professor of Chemistry, The University of Puerto Rico at Mayaguez"
kxPA_igAAAAJ,PQix8vkAAAAJ,Carlos René Rodríguez Garcés,Universidad del Bío-Bío
EgT_3ckAAAAJ,t7uOwVEAAAAJ,Cristian Cofre Bolados,Escuela de Ciencias de la Actividad Física Universidad de Santiago
EgT_3ckAAAAJ,ajL_dRYAAAAJ,Giovanny Arenas Sánchez,"Laboratorio de Fisiología del Ejercicio, Escuela de Kinesiología, Universidad Santo Tomás, Santiago"
EgT_3ckAAAAJ,qSBvfx8AAAAJ,Jose Antonio Gonzalez-Jurado (ORCI...,"Universidad Pablo de Olavide, Sevilla, España"
EgT_3ckAAAAJ,Lp_rQM0AAAAJ,Edgardo Molina Sotomayor,Universidad Metropolitana Cs. de la Educación
EgT_3ckAAAAJ,l1OX6bQAAAAJ,Claudio Farias-Valenzuela,Universidad de Santiago de Chile-UDLA
EgT_3ckAAAAJ,MtnRhqUAAAAJ,Marcelo Bobadilla,universidad santo Tomás
EgT_3ckAAAAJ,87WjJmoAAAAJ,"Alvarez-Arangua,  S.","Exercise and Rehabilitation Sciences Institute, School of Physical Therapy, Faculty of"
