scholar_id_autor_gs,scholar_id_gs_coauthor,nombre_coauthor,cargo
kRU66jcAAAAJ,j_RQI9wAAAAJ,"Adsuar, J.C.",Universidad de extremadura
EkOGlRoAAAAJ,lDcjUKIAAAAJ,Elpiniki Papageorgiou,"Professor in Artificial Intelligence, University of Thessaly"
EkOGlRoAAAAJ,KnfpKfcAAAAJ,Victor A. Bañuls,"Professor of Management Information Systems, Universidad Pablo de Olavide"
EkOGlRoAAAAJ,QIPvO0kAAAAJ,Wojciech Froelich,"Institute of Computer Science, University of Silesia, Poland"
EkOGlRoAAAAJ,jSVbbvIAAAAJ,Rosario Vidal,Universitat Jaume I
EkOGlRoAAAAJ,tmrQsSwAAAAJ,Florentin Smarandache,University of New Mexico
EkOGlRoAAAAJ,2ZhNZzkAAAAJ,Ester Gutierrez Moya,"Professor, Universidad de Sevilla (Spain)"
EkOGlRoAAAAJ,4Snp-IAAAAAJ,Ines Herrero,Catedrática de Universidad. Empresa. Management.
EkOGlRoAAAAJ,R9WyFxUAAAAJ,Samira A.Rahimi,"Assistant Professor, McGill University"
EkOGlRoAAAAJ,5N-8TY8AAAAJ,Pedro R. Palos-Sanchez (ORCID: 000...,Associate Professor. Universidad de Sevilla. Dept. Financial Economy and Operation Management
EkOGlRoAAAAJ,ARNmg6IAAAAJ,Gonzalo Nápoles,Assistant Professor at Tilburg University
EkOGlRoAAAAJ,fc-jiMIAAAAJ,Koen VANHOOF,
EkOGlRoAAAAJ,gQKtl8kAAAAJ,Jose Carlos Molina,Universidad de Sevilla
EkOGlRoAAAAJ,H3G5Ke8AAAAJ,Ignacio Eguia,Universidad de Sevilla
EkOGlRoAAAAJ,8J8ycaUAAAAJ,Vicente Chulvi,Universitat Jaume I
EkOGlRoAAAAJ,KgwanDEAAAAJ,David Cebrián Tarrasón,Knowledge & Engineering Design PhD
EkOGlRoAAAAJ,5NFe1csAAAAJ,Karel Mls,"odborný asistent, Univerzita Hradec Králové"
RDDQKZoAAAAJ,ctaapjIAAAAJ,Juan Andrés Orellana,Associate Professor. Departamento de Neurología. Pontificia Universidad Católica de Chile
RDDQKZoAAAAJ,ur_LhQEAAAAJ,Rodrigo A. Fuentealba,Assistant Professor - Universidad de los Andes
RDDQKZoAAAAJ,VftyRccAAAAJ,Felipe Barros,Centro de Estudios Científicos & Universidad San Sebastián
NXY-GuMAAAAJ,G1ZpVy4AAAAJ,Po Shan Poon,University of Concepcion
NXY-GuMAAAAJ,DimQJX4AAAAJ,Maibelin Rosales,University of Chile
NXY-GuMAAAAJ,lvbQED0AAAAJ,Joaquin L. Brito,"Docente-Investigador, Universidad Regional Amazónica IKIAM & Investigador Emérito, IVIC"
NXY-GuMAAAAJ,BSOw3qUAAAAJ,Jose Rene Rangel Mendez,Instituto Potosino de Investigación Científica y Tecnológica AC
NXY-GuMAAAAJ,v4hRgSMAAAAJ,Silvania Lanfredi,"Professor Assistente Doutor, Universidade Estadual Paulista, Faculdade de Ciências e …"
NXY-GuMAAAAJ,3Tp6YUwAAAAJ,Marcos Augusto Lima Nobre (MAL Nobre),"Prof. Dr., Departamento de Fisica, Univ Estadual Paulista, FCT, UNESP, Campus Presidente …"
NXY-GuMAAAAJ,nlsj4egAAAAJ,Teresa J. Bandosz,The City College of New York
NXY-GuMAAAAJ,d5fY-0sAAAAJ,Juan Carlos Hernandez Garrido,Departamento de Ciencia de los Materiales e Ingeniería Metalúrgica y Química Inorgánica …
NXY-GuMAAAAJ,ombeh9cAAAAJ,Magda Titirici,Imperial College London
NXY-GuMAAAAJ,UJC6DlYAAAAJ,sixto malato,Prof. of Research. Plataforma Solar de Almeria
NXY-GuMAAAAJ,aBUj0aEAAAAJ,Leonardo Palmisano,"Full Professor of Chemistry, FRSC - University of Palermo, Italy"
NXY-GuMAAAAJ,buP0argAAAAJ,Giuseppe Marcì,University of Palermo
NXY-GuMAAAAJ,gf3BTp8AAAAJ,Robert Pietrzak,"Professor of Chemistry, Adam Mickiewicz University in Poznań"
NXY-GuMAAAAJ,F5ZywcAAAAAJ,Alain CELZARD,"Université de Lorraine, Professor of Materials Science"
NXY-GuMAAAAJ,5FHZgnkAAAAJ,Fabiano Rafael Praxedes,"Doutorando em Química, Universidade Estadual Paulista ""Júlio de Mesquita Filho"""
NXY-GuMAAAAJ,l9wNywsAAAAJ,AVELINO CORMA CANOS,"Instituto de Tecnología Química, Universitat Politècnica de València-Consejo Superior de"
NXY-GuMAAAAJ,XnW2bgNfwdUC,Robert Hurt,Brown University
NXY-GuMAAAAJ,u_kBdzAAAAAJ,Litza Halla Velazquez-Jimenez,"Investigador Posdoctoral, Instituto de Ingenieria/UNAM"
NXY-GuMAAAAJ,c5pt62EAAAAJ,Mykola Seredych,"Research Associate, Drexel University"
NXY-GuMAAAAJ,_U7ZYooAAAAJ,Kilver J Campos,Ph.D. Student
NXY-GuMAAAAJ,yfvjUr8AAAAJ,Hermenegildo Garcia,Universitat Politecnica de Valencia
NXY-GuMAAAAJ,_bJUnL8AAAAJ,Vanessa Fierro,CNRS Institut Jean Lamour
NXY-GuMAAAAJ,8E8sR1EAAAAJ,Marc Florent,CUNY - City College of New York
NXY-GuMAAAAJ,EH7O9aMAAAAJ,Alfonso Policicchio,Physics Department - University of Calabria
NXY-GuMAAAAJ,n3Fzw1sAAAAJ,Robert R. Alfano,The City College of New York
NXY-GuMAAAAJ,M8-DAsMAAAAJ,Ximena Garcia,"Profesor Titular Universidad de Concepción, Chile"
NXY-GuMAAAAJ,20c9p3wAAAAJ,ISABEL OLLER,Plataforma Solar de Almería-CIEMAT
NXY-GuMAAAAJ,y3KJm2YAAAAJ,Ana Ruíz-Delgado,Plataforma Solar de Almería - Universidad de Almería
NXY-GuMAAAAJ,9QikXzcAAAAJ,Gema Gonzalez,"Yachay Tech University, Physics and Nanotechnology School &Venezuelan Institute for …"
NXY-GuMAAAAJ,Qf1MYBgAAAAJ,Cesar Nieto-Delgado,Instituto Potosino de Investigacion Cientifica y Tecnologica (IPICyT)
NXY-GuMAAAAJ,tX4aXC0AAAAJ,Mauricio Terrones,"Verne M. Willaman Professor of Physics, Penn State"
NXY-GuMAAAAJ,uBnab5IAAAAJ,Rodolfo Cruz-Silva,Shinshu University
NXY-GuMAAAAJ,JWUVLaoAAAAJ,Morinobu Endo,Shinshu University
NXY-GuMAAAAJ,yqpkkMwAAAAJ,Archi Dasgupta,"Defect Reduction Engineer, Intel Corporation"
NXY-GuMAAAAJ,73t6DNQAAAAJ,Kazunori Fujisawa,Shinshu University
NXY-GuMAAAAJ,iRP1ZcUAAAAJ,Javier Antonio Arcibar Orozco,CIATEC AC
NXY-GuMAAAAJ,S0O7nvoAAAAJ,Yoshio Hashimoto,Shinshu University
NXY-GuMAAAAJ,RakuXErdi7AC,Raffaele Molinari,University of Calabria
NXY-GuMAAAAJ,E2J0vGsAAAAJ,Tiziana Marino,Institute on Membrane Technology ITM-CNR
NXY-GuMAAAAJ,DHDjgmUAAAAJ,LÁSZLÓ Krisztina,Budapest Iniversity of Technology and Economics
NXY-GuMAAAAJ,BGDCg5wAAAAJ,Manuel Fernando R. Pereira,"Departamento de Engenharia Química, Faculdade de Engenharia da Universidade do Porto"
NXY-GuMAAAAJ,MzqQ_pUAAAAJ,François Béguin,Poznan University of Technology
NXY-GuMAAAAJ,KEmvDf4AAAAJ,"Martínez de Yuso, Alicia",R&D&I Consultant & Project manager - Researcher
NXY-GuMAAAAJ,3NONYU0AAAAJ,Ana S. Mestre,"Centro de Química Estrutural, Faculdade de Ciências, Universidade de Lisboa, 1749-016 …"
NXY-GuMAAAAJ,a1aD0jUAAAAJ,Joanna Goscianska,Adam Mickiewicz University in Poznań
NXY-GuMAAAAJ,oxSvl60AAAAJ,Pedro Atienzar,CSIC-UPV - Instituto de Tecnología Química (ITQ)
NXY-GuMAAAAJ,2e8h6aIAAAAJ,Rezan DEMIR-CAKAN,Professor at Gebze Technical University
NXY-GuMAAAAJ,6pb8u6IAAAAJ,Enrique Rodriguez Castellon,Catedrático de Química Inorgánica
NXY-GuMAAAAJ,tHqQLusAAAAJ,Jose J. Calvino,Universidad de Cádiz
NXY-GuMAAAAJ,5Npd-IUAAAAJ,Jair CC Freitas,Universidade Federal do Espírito Santo
NXY-GuMAAAAJ,X_ZPRsUAAAAJ,Gina Pecchi,University of Concepcion
NXY-GuMAAAAJ,3JMqHFYAAAAJ,Sang-Eon Park,Inha University
NXY-GuMAAAAJ,B_dv3uUAAAAJ,Héctor Mansilla,Professor of organic chemistry
NXY-GuMAAAAJ,FpiO2zIAAAAJ,Patricia Torres Lozada,Profesora Titular - Escuela de Ingeniería de Recursos Naturales y del Ambiente …
NXY-GuMAAAAJ,4xy9-v0AAAAJ,Miguel Angelo Schettino Junior,"Professor de Física, Universidade Federal do Espírito Santo"
NXY-GuMAAAAJ,rgvmeW0AAAAJ,Yesid Sneider Murillo Acevedo,"Profesor TC Departamento de Química, Fundación Universidad de América"
NXY-GuMAAAAJ,s-B_GNMAAAAJ,J. Angel Menéndez,INCAR - CSIC
NXY-GuMAAAAJ,pJitrZcAAAAJ,Ana Arenillas,INCAR - CSIC
NXY-GuMAAAAJ,L7T6XlYAAAAJ,Eduardo Bedê Barros,Universidade Federal do Ceará
NXY-GuMAAAAJ,QnxlQK8AAAAJ,Antonio Gomes Souza Filho,"Professor of Physics, Departamento de Fisica, Universidade Federal do Ceará"
36QrISgAAAAJ,_07ZLa4AAAAJ,Juan Segura Aguilar,"Professor, Molecular & Clinical Pharmacologt, Faculty of Medicine, University of Chile"
pz19DGQAAAAJ,-Chm8jgAAAAJ,Javier Martín,Universidad de Chile
pz19DGQAAAAJ,Mk3UEGQAAAAJ,Osmir Batista de Oliveira Junior,"Professor de Dentística, Universidade Estadual Paulista - Unesp, Faculdade de Odontologia …"
pz19DGQAAAAJ,csI-6uMAAAAJ,Alessandro D Loguercio,State University of Ponta Grossa
pz19DGQAAAAJ,gJU5XZ4AAAAJ,Alessandra Reis,"Professora de Dentística Restauradora, Universidade Estadual de Ponta Grossa"
pz19DGQAAAAJ,khOOmL4AAAAJ,Marcelo Ferrarezi de Andrade,"Professor de Dentística Restauradora, Universidade Estadual de São Paulo, ""Júlio de …"
pz19DGQAAAAJ,qS_XLOEAAAAJ,José Roberto Cury Saad,Professor Adjunto da Faculdade de Odontologia de Araraquara - Universidade Estadual …
pz19DGQAAAAJ,t_eVzKd0gzUC,Janaína Freitas Bortolatto,Postdoctoral Fellow at University of Toronto
pz19DGQAAAAJ,N4xrk8oAAAAJ,Stella Kossatz Pereira,Professora Associada do Departamento de Odontologia da UEPG
pz19DGQAAAAJ,r1_PlvAAAAAJ,Hermes Pretel,Faculdade de Odontologia de Araraquara - UNESP
pz19DGQAAAAJ,K2-0NqgAAAAJ,Rafael R. Moraes,Universidade Federal de Pelotas
pz19DGQAAAAJ,cTdEXM8AAAAJ,Rolando Vernal,Universidad Autónoma de Chile
pz19DGQAAAAJ,WzlpKhIAAAAJ,Matheus Coelho Bandéca,Universidade CEUMA
pz19DGQAAAAJ,xzOZltwAAAAJ,Bas Loomans,"Radboudumc, the Netherlands"
pz19DGQAAAAJ,XHJPFnkAAAAJ,Andréa Abi Rached Dantas,"Professora Assistente Doutora, Universidade Estadual ""Júlio de Mesquita Filho"" , Unesp …"
pz19DGQAAAAJ,PF6W6AgAAAAJ,Lívia Nordi Dovigo,"Professor Assistente Doutor de Bioestatística e Metodologia Científica, Faculdade de …"
pz19DGQAAAAJ,4OjQBUEAAAAJ,Renata Garcia Fonseca,"Associate Professor, Department of Dental Materials and Prosthodontics. Unesp – Univ …"
pz19DGQAAAAJ,5YnfbQwAAAAJ,Rafael Sarkis-Onofre,"Graduate Program in Dentistry/School of Dentistry - Atitus Educação, Passo Fundo, Brazill"
pz19DGQAAAAJ,svgHHAgAAAAJ,Tamara Carolina Trevisan,"Mestre e Doutora em Ciências Odontológicas, área de Dentística Restauradora- FOAr."
pz19DGQAAAAJ,AOVSNXsAAAAJ,Marcelo Carlos  Bortoluzzi,State University of Ponta Grossa
pz19DGQAAAAJ,Y_IW9GwAAAAJ,Fernando Esteban Florez,"Associate Professor at The University of Oklahoma Health Sciences Center, College of …"
pz19DGQAAAAJ,D6KIJ2MAAAAJ,Morgana Oliveira,Araraquara School of Dentistry - Univ Estadual Paulista - Unesp
JIJW4BoAAAAJ,g2xuek0AAAAJ,Clive Dickinson,"Jodrell Bank Centre for Astrophysics, The University of Manchester"
JIJW4BoAAAAJ,gOj959UAAAAJ,Simon Casassus,"Full Professor, Universidad de Chile"
JIJW4BoAAAAJ,ISyTdHEAAAAJ,Michael Peel,Instituto de Astrofísica de Canarias
JIJW4BoAAAAJ,hU7OS70AAAAJ,Adolf N. Witt,University of Toledo
PDhQ8ioAAAAJ,F8HPrcIAAAAJ,Teddy Osmin Tamargo Barbeito,Médico
PDhQ8ioAAAAJ,nRvdl64AAAAJ,Elio Riboli,"Professor of Cancer Epidemiology, Imperial College London"
PDhQ8ioAAAAJ,Bz6_JJsAAAAJ,Vivienne C. Bachelet,"Associate professor, Chair of Evidence-based Medicine, School of Medicine, University of Santiago of"
PDhQ8ioAAAAJ,TssfsHUAAAAJ,Nelsa María Sagaró Del Campo,Profesora e Investigadora Titular Universidad de Ciencias Médicas Santiago de Cuba.
qZNi5VwAAAAJ,YMQZevgAAAAJ,JOSÉ GRANERO-MOLINA,"Investigador Asociado, Universidad Autónoma de Chile"
qZNi5VwAAAAJ,qhb5460AAAAJ,Jose Manuel Hernández-Padilla,"Profesor Titular de Universidad, Universidad de Almería"
qZNi5VwAAAAJ,y54egsYAAAAJ,Gabriel Aguilera-Manrique,Profesor Dpto. Enfermería de la Universidad de Almería/Professor of Nursing
qZNi5VwAAAAJ,O9EoKYgAAAAJ,FRANCISCA ROSA JIMENEZ LOPEZ,"Profesora Contratada Doctora, Universidad de Almería"
qZNi5VwAAAAJ,CNIkMZQAAAAJ,MARIA DEL MAR LOPEZ RODRIGUEZ,Universidad de Almería
qZNi5VwAAAAJ,zcc6_qQAAAAJ,Leonel São Romão Preto,Professor. Instituto Politécnico de Bragança Escola Superior de Saúde de Bragança
qZNi5VwAAAAJ,adPDcjMAAAAJ,CAYETANO JOSE ARANDA TORRES,Catedrático de Filosofía. Universidad de Almería (España)
qZNi5VwAAAAJ,prU9WAEAAAAJ,José María Muñoz Terrón,Profesor de Filosofía
qZNi5VwAAAAJ,NPuRAOgAAAAJ,Alicia Ruiz Muelle,"Enfermera, Universidad de Almería"
brr8gMAAAAAJ,qPbyi4AAAAAJ,JUAN CARLOS ROA,PONTIFICIA UNIVERSIDAD CATOLICA DE CHILE. Professor  and Chair Department  of Pathology.
brr8gMAAAAAJ,uCibJwIAAAAJ,Priscilla Brebi,Universidad de La Frontera
brr8gMAAAAAJ,2EKT_ysAAAAJ,Carmen Gloria Ili,Universidad de La Frontera
brr8gMAAAAAJ,-zkfbiAAAAAJ,Jaime A. Espinoza,"SciLifeLab, Division of Genome Biology, Karolinska Institutet"
brr8gMAAAAAJ,uqj_5YsAAAAJ,Bruno Nervi,"Profesor Asociado, Pontificia Universidad Católica de Chile"
brr8gMAAAAAJ,Ibvv-OoAAAAJ,Lorena Lobos-Gonzalez,"Centro de Medicina Regenerativa, Facultad de Medicina, Clinica Alemana- Universidad del Desarrollo"
brr8gMAAAAAJ,NOwKfokAAAAJ,Iva Polakovicova,"Laboratory of Oncology, Faculty of Medicine, Pontificia Universidad Católica de Chile"
brr8gMAAAAAJ,CM0CWosAAAAJ,Gareth I. Owen,Pontificia Universidad Catolica de Chile
brr8gMAAAAAJ,xLD89i4AAAAJ,Jorge G. Farías,Universidad de La Frontera
brr8gMAAAAAJ,OhuG0FcAAAAJ,"Akhilesh Pandey, M.D., Ph.D.","Professor, Laboratory Medicine and Pathology, Mayo Clinic, Rochester, Minnesota"
brr8gMAAAAAJ,CIiLPmMAAAAJ,Mustafa A. Barbhuiya,"Medical Director of Clinical Chemistry and Point of Care Testing, Department of Pathology"
brr8gMAAAAAJ,8hSvpaIAAAAJ,Juan Francisco Calderón Giadrosic,Centro de Genetica y Genomica - Universidad del Desarrollo
brr8gMAAAAAJ,fPqxTfgAAAAJ,"Francisco Aguayo González, Ph.D.","Associate Professor, Facultad de Medicina, Universidad de Chile"
brr8gMAAAAAJ,sTtUkYQAAAAJ,Catterina Ferreccio,Department of Public Health/School of Medicine/Pontificia Universidad Católica de Chile
brr8gMAAAAAJ,6Em-N4IAAAAJ,V Benedetti,Universidad de Chile
brr8gMAAAAAJ,B-e-_SMAAAAJ,Dr. Alexis Kalergis,Full Professor and Director. Millennium Institute on Immunology. P. Univ. Católica Chile.
brr8gMAAAAAJ,3v8mHCQAAAAJ,"Rodriguez-Sandoval, Eduardo",Profesor Ingenieria Agricola Universidad Nacional de Colombia
lHUldE8AAAAJ,3B5NcP0AAAAJ,Wen-Jun Li,Sun Yat-Sen University
lHUldE8AAAAJ,BqePO9MAAAAJ,Wael N. Hozzein,"Botany and Microbiology , Department, Faculty of Science, Beni-Suef University, Egypt"
lHUldE8AAAAJ,u7nV5iEAAAAJ,Syed Raziuddin Quadri,"Northern Border University, Arar, Northern Borders, Kingdom of Saudi Arabia"
lHUldE8AAAAJ,WmQrSCQAAAAJ,lingappa k,Gulbarga University
lHUldE8AAAAJ,j850pjEAAAAJ,Vivek Babu CS,"Principal Scientist @ CSIR-CFTRI, Mysore"
VacJKywAAAAJ,zD2p9JcAAAAJ,"Muhammad Ikram (M.Ikram), Ph.D.","Prof. of Management, Ranked in Top 2% World's Scientists, Editor: Sustainability, Frontiers …"
VacJKywAAAAJ,SCyTFaYAAAAJ,Sascha Kraus,"Professor, Free University of Bozen-Bolzano"
VacJKywAAAAJ,eBuc8t0AAAAJ,Tatiana Beliaeva,Skopai & KEDGE Business School (France)
VacJKywAAAAJ,3jPG2gsAAAAJ,Qingyu Zhang,"Shenzhen University, Arkansas State University"
VacJKywAAAAJ,E2xDXR0AAAAJ,Miguel Angel del Arco Blanco,"Associate Professor in Contemporary History, University of Granada"
VacJKywAAAAJ,c5C2dPIAAAAJ,Robert Sroufe,Duquesne University
VacJKywAAAAJ,KOmhwVkAAAAJ,Valentina Schmitt,Pontificia Universidad Católica de Valparaíso
VacJKywAAAAJ,8880dV0AAAAJ,Jessika Vasquez,CENTRUM - PUCP
VacJKywAAAAJ,YvrB-OIAAAAJ,Mirza Marvel Cequea,"Académica de ECIEM, Universidad Católica del Norte"
VacJKywAAAAJ,N5ZUeiwAAAAJ,Fernando Antonio Prado Gimenez,"Professor of Innovation and Sustainability, Universidade Federal do Paraná"
VacJKywAAAAJ,Xa16gY4AAAAJ,Thomas Clauß,Witten/Herdecke University
VacJKywAAAAJ,T6rQY3MAAAAJ,Domingo Ribeiro-Soriano,"Professor of Business Administration (University of Alcala, in Madrid)"
VacJKywAAAAJ,5BZ8rMoAAAAJ,Paola Rovelli,Free University of Bozen-Bolzano - Faculty of Economics and Management
VacJKywAAAAJ,rI9Hqv4AAAAJ,"ELOI JUNIOR DAMKE, Ph.D.",Associate Professor at Western Paraná State University - UNIOESTE
VacJKywAAAAJ,OSGk3sQAAAAJ,Donizete Beck,"Nove de Julho University, São Paulo City, São Paulo State, Brazil"
VacJKywAAAAJ,TqVYByQAAAAJ,Gemma Durán,Profesor de Economía. Estructura Económica. Universidad Autónoma de Madrid
VacJKywAAAAJ,QzbUvxsAAAAJ,Nelson Casarotto Filho,"Professor da Engenharia de Produção, Universidade Federal de Santa Catarina"
VacJKywAAAAJ,UM6EQh0AAAAJ,Adriana Takahashi,Universidade Federal do Paraná
VacJKywAAAAJ,2AFgZ38AAAAJ,Alfredo De Massis,"Full Professor, Entrepreneurship & Family Business,Free University of Bolzano & Lancaster …"
VacJKywAAAAJ,HrCFRV8AAAAJ,Adam Sulich,"Wroclaw University of Economics and Business, Faculty of Management"
VacJKywAAAAJ,5BVFqgIAAAAJ,Paul Jones,Professor in Entrepreneurship & Innovation at Swansea University
VacJKywAAAAJ,Ut30CgIAAAAJ,Ana M. Lopez,Universidad Autónoma de Madrid
VacJKywAAAAJ,iSfSPwoAAAAJ,Christophe Garonne,"Assistant Professor, Kedge Business School"
VacJKywAAAAJ,96SCS70AAAAJ,corinne grenier,"professeur, KEDGE Business School"
VacJKywAAAAJ,InUM_xQAAAAJ,Jianzu Wu,"Professor of Management, Lanzhou University"
VacJKywAAAAJ,S0UE8tEAAAAJ,Nabila Abid,PhD (Management & Business Economics)
VacJKywAAAAJ,KxNaFGwAAAAJ,Christine da Silva Schröeder,"Professor, Universidade Federal do Rio Grande do Sul"
VacJKywAAAAJ,CB9f6jkAAAAJ,Márcia Ramos May,Universidade Federal do Paraná
VacJKywAAAAJ,1i0TBMMAAAAJ,Luis Carlos Zucatto,Professor da Universidade Federal de Santa Maria - Campus de Palmeira das Missões
VacJKywAAAAJ,KdMqW_gAAAAJ,Idiano D'Adamo,Sapienza University of Rome
VacJKywAAAAJ,KftxZ5gAAAAJ,Yichen Shen,The Graduate Institute Geneva
VacJKywAAAAJ,bPvtJGsAAAAJ,Letycja Sołoducho-Pelc,Wroclaw University of Economics and Business
VacJKywAAAAJ,AIM3hJoAAAAJ,Dr. Daniel Ogachi (PhD),Hungarian University of Agriculture and Life Science
VacJKywAAAAJ,HvU6z44AAAAJ,Alhamzah Alnoor,"Senior Lecturer, PhD, Strategic Management and Social Commerce at Southern Technical …"
VacJKywAAAAJ,AnWeZ9AAAAAJ,Raj V. Mahto,"Creative Enterprise Endowed Professor, Professor, Univ. of New Mexico"
VacJKywAAAAJ,4G7zd81m5HwC,Alcindo Antônio Ferla,"Professor, Universidade Federal do Rio Grande do Sul"
VacJKywAAAAJ,Lq7LdoQAAAAJ,Lydia Bares Lopez,Universidad de Cádiz
VacJKywAAAAJ,-N11OVoAAAAJ,ARP VICENTE,UFPR
VacJKywAAAAJ,evfoFyAAAAAJ,Thanh Tiep Le,"Philosophy Doctor, Ho Chi Minh City University of Economics and Finance"
VacJKywAAAAJ,0hABxb0AAAAJ,Miguel Blanco Canto,Universidad de Cádiz
VacJKywAAAAJ,v8k0azgAAAAJ,Ana Paula Mussi Cherobim,PPGADM / UFPR
VacJKywAAAAJ,VC5n-IMAAAAJ,Andrzej Sztando,Uniwersytet Ekonomiczny we Wrocławiu [Wrocław University of Economics and Business]
VacJKywAAAAJ,iFX3a7AAAAAJ,Rosa Patricia Larios-Francia,Universidad de Lima - Universidad Peruana de Ciencias Aplicadas
VacJKywAAAAJ,54pvSKcAAAAJ,Paulo Ricardo Silva Oliveira,"Professor at the Economic, Business and Accounting Department of Pontifical Catholic …"
VacJKywAAAAJ,F0gyt_YAAAAJ,Eulálio Gomes Campelo Filho,"professor de engenharia de produção e administração pública, Universidade Federal do …"
VacJKywAAAAJ,z4AqcIAAAAAJ,Douglas Wegner,FDC | Fundação Dom Cabral - Brazil
VacJKywAAAAJ,BBh-JjUAAAAJ,Eduardo Cesar  Dechechi,"Professor de gestão da inovação Tecnológica, Unioeste"
VacJKywAAAAJ,o9wqvG0AAAAJ,Nianxin Wang,Jiangsu University of Science and Technology
VacJKywAAAAJ,lrGffGEAAAAJ,Mehrab Nazir,Ph.D (Marketing Management)
VacJKywAAAAJ,yQpT1VoAAAAJ,Sidney Tshiaba,Jiangsu University of Science and Technology
VacJKywAAAAJ,0Do0vlIAAAAJ,Dr. Shantha Indrajith Hikkaduwa Liyanage,Doctor of Philosophy
VacJKywAAAAJ,IWgYdNYAAAAJ,Cicero Eduardo de Sousa Walter,"Professor of Business and Economics, Federal Institute of Education, Science and …"
VacJKywAAAAJ,r2EJNagAAAAJ,Khai Wah Khaw,Universiti Sains Malaysia
VacJKywAAAAJ,t5ipFJEAAAAJ,Shalimar Gallon,"Docente do PPG em Administração, IMED"
VacJKywAAAAJ,wZRAw_IAAAAJ,Claudia Miranda Veloso,"University of Aveiro, ESTGA, GOVCOPP"
VacJKywAAAAJ,kuqhSVcAAAAJ,Yousif Raad Muhsen,Wasit University
VacJKywAAAAJ,birj8fYAAAAJ,"Hussam Al Halbusi,  Ph.D. (ORCID: 0000-0003-0022-7718)","Department of Management, College of Economics and Political Science, Sultan Qaboos …"
VacJKywAAAAJ,xGU7H1QAAAAJ,Jose Storopoli,Universidade Nove de Julho
VacJKywAAAAJ,iEjy8p4AAAAJ,Eran Vigoda-Gadot,"Professor of Public Administration & Management, University of Haifa, & HSE"
VacJKywAAAAJ,zV15kyAAAAAJ,ARTUR SANTA CATARINA,Universidade Federal de Santa Catarina
VacJKywAAAAJ,Bt52-W0AAAAJ,José Roberto Frega,"Professor Associado, Departamento de Administração Geral e Aplicada, Universidade …"
VacJKywAAAAJ,m4jMydEAAAAJ,Paul Mugambi,Corvinus University of Budapest
VacJKywAAAAJ,7tBO8FAAAAAJ,Bénédicte Aldebert,"Maître de conférences, Aix Marseille University"
VacJKywAAAAJ,xc-BDJYAAAAJ,Robson Tavares da Silva,Professor Universidade Federal Rural do Rio de Janeiro
VacJKywAAAAJ,zwNZLDUAAAAJ,Cleunice Zanella,Docente permanente do mestrado em Ciências Contábeis e Administração da Unochapecó
VacJKywAAAAJ,TAgCZFQAAAAJ,Ali Shakir Zaidan,Iraqi Ministry of Electricity and Renewable Energy and Universiti Sains Malaysia
VacJKywAAAAJ,qY-wQPoAAAAJ,Weber Henrique Radael,Doutorando na Universidade Federal do Paraná
VacJKywAAAAJ,Iy71KN0AAAAJ,Daniel F. Polónia,"Departamento de Economia, Gestão, Engenharia Industrial e Turismo da Universidade de …"
VacJKywAAAAJ,lQj7IhoAAAAJ,Daniel Valotto,Federal University of Paraná
VacJKywAAAAJ,oe2L8YYAAAAJ,Jorge Gomes,"Professor of HRM and OB, ISEG, University of Lisbon"
VacJKywAAAAJ,18Z5hQoAAAAJ,C Costa,"Docente do PPG em Psicologia,  ATITUS Educação"
VacJKywAAAAJ,36Jz12IAAAAJ,Shujahat Ali,University of Science and Technology of China
VacJKywAAAAJ,bU5KgkIAAAAJ,Arbana Sahiti,"Assistant Professor in departmen Finance, University of Pristina"
VacJKywAAAAJ,0NV1ac8AAAAJ,Rosana Córdova Guimarães,"Student, FGV-EAESP"
VacJKywAAAAJ,X_LqPA8AAAAJ,Shakeel Javaid,"AMU, Aligarh"
VacJKywAAAAJ,35Yn170AAAAJ,Zainab Asim,"Research Scolar, Aligarh Muslim University"
VacJKywAAAAJ,l4BiHL4AAAAJ,Thanh Tiep Le,"Philosophy Doctor, Ho Chi Minh city University of Economics and Finance"
V7777OoAAAAJ,tu5tUmgAAAAJ,Antonio Ariza-Montes (ORCID: 0000-0002-5921-0753),Senior full professor - Catedrático Sénior. Universidad Loyola Andalucía
V7777OoAAAAJ,hpIr7f8AAAAJ,Heesup Han,Professor at Sejong University
V7777OoAAAAJ,fsLsAHIAAAAJ,Naveed Ahmad,Department of Business Administration Virtual University of Pakistan
V7777OoAAAAJ,mHixodsAAAAJ,Dr. Asif Mahmood,"Associate Professor, Department Innovation and Technology Innovation, Arabian Gulf …"
V7777OoAAAAJ,LLnt1wsAAAAJ,Joan Boada-Grau,Rovira i Virgili University
V7777OoAAAAJ,ZC-hGWcAAAAJ,Zia Ullah,Lahore Leads University
V7777OoAAAAJ,zAyik1wAAAAJ,Gabriele Giorgi,Università Europea Roma
V7777OoAAAAJ,1fad0-sAAAAJ,Juan Manuel Arjona Fuentes,Profesor Titular del Área de Estadística e Investigación Operativa (Universidad Loyola …
V7777OoAAAAJ,z5WDsbsAAAAJ,Miklas Scholz,"Professor in Civil Engineering, The University of Salford; Professor in Water Resources …"
V7777OoAAAAJ,GWlVjigAAAAJ,Wei Quan,Sejong University
V7777OoAAAAJ,mRMgTLsAAAAJ,Rob Law,University of Macau
V7777OoAAAAJ,0xMwxIkAAAAJ,Paloma Gónzalez Gómez del Miño,Profesor de relaciones internacionales (UCM)
V7777OoAAAAJ,8LkkizgAAAAJ,Amr Al-Ansi,Macau University of Science and Technology
V7777OoAAAAJ,yvoOis0AAAAJ,Jose Manuel Saiz-Alvarez (ORCID: 0000-0001-6435-9600),Universidad Católica de Santiago de Guayaquil (Ecuador)
V7777OoAAAAJ,JV97P7UAAAAJ,Felipe Hernández Perlines (ORCID:0000-0002-6409-5593),Catedrático de Organización de Empresas. Universidad de Castilla-La Mancha
V7777OoAAAAJ,7NSCy9IAAAAJ,abdul hafaz Ngah,Lecturer
V7777OoAAAAJ,zd2Fg_wAAAAJ,Guillermo Bustamante-Pavez,Universidad de Los Andes
V7777OoAAAAJ,Mn_m5kAAAAAJ,Michel  Valdés Montecinos,Académico Universidad de Tarapacá
V7777OoAAAAJ,9oV68QsAAAAJ,Maria Jacqueline Rojas Rios,"académica, Universidad de Playa Ancha"
V7777OoAAAAJ,feRyeYcAAAAJ,Nelson Arellano,Universidad Academia Humanismo Cristiano (UAHC)
mQ-y-DIAAAAJ,b0qmbcEAAAAJ,Leonardo Silva Santos,"Full Professor (Profesor Titular), Instituto de Química de Recursos Naturales, Universidad de Talca"
mQ-y-DIAAAAJ,FuX5t1IAAAAJ,Marcos N. Eberlin,Mackenzie Presbyterian University - School of Engeneering
mQ-y-DIAAAAJ,4d-BTqoAAAAJ,Jairton Dupont,"Professor de Química, UFRGS"
mQ-y-DIAAAAJ,71X5kF4AAAAJ,David Clemmer,"Distinguished Professor of Chemistry, Indiana University"
PvGdjj8AAAAJ,IxhhJ9IAAAAJ,Pedro Delgado Floody,"Departamento de EF, Universidad de La Frontera"
PvGdjj8AAAAJ,jwIedv8AAAAJ,Daniel Jerez Mayorga,"Facultad Ciencias de la Rehabilitación, Universidad Andrés Bello, Santiago, Chile"
PvGdjj8AAAAJ,kMr_yuQAAAAJ,Bastian Carter-Thuillier,"Académico Departamento de Educación, Universidad de Los Lagos (Chile)"
0NAiLN8AAAAJ,xLD89i4AAAAJ,Jorge G. Farías,Universidad de La Frontera
0NAiLN8AAAAJ,qnkab4AAAAAJ,Carolina Andrea Figueroa,"Escuela de Ciencias del Mar, Pontificia Universidad Católica de Valparaíso"
0NAiLN8AAAAJ,2jnPqfMAAAAJ,Rodrigo L. Castillo,"Assistant Professor, Faculty of Medicine, University of Chile"
0NAiLN8AAAAJ,UA0rnLgAAAAJ,Calaf GM,"Universidad de Tarapacá, Arica, Chile"
0NAiLN8AAAAJ,NY6PhTMAAAAJ,Adalberto Pessoa,Professor de Biotecnologia Farmacêutica da Universidade de São Paulo
0NAiLN8AAAAJ,qX4Yub8AAAAJ,Elias Gustavo Figueroa Villalobos,Universidad Católica de Temuco
0NAiLN8AAAAJ,gyv-4eEAAAAJ,Victor M. Pulgar,"Associate Professor of Pharmacology, Campbell University"
0NAiLN8AAAAJ,Guymk-kAAAAJ,Ricardo D Moreno,"Profesor Titular, Pontificia Universidad católica de Chile"
0RTkP8sAAAAJ,vj2_nGcAAAAJ,Romel Ramón González-Díaz (Ph.D),Investigador del Centro Internacional de Investigaciones y Desarrollo
0RTkP8sAAAAJ,bg31FWMAAAAJ,Elena Cachicatari Vargas,profesora de Enfermería
0RTkP8sAAAAJ,ggaBZeMAAAAJ,Elizabeth Emperatriz García-Salirrosas,"Profesora de Administación, UNTELS - UPN"
0RTkP8sAAAAJ,1V5gezcAAAAJ,Santos Lucio Guanilo-Gómez,Profesor de la Universidad Nacional Jorge Basadre Grohmann - Tacna
0RTkP8sAAAAJ,I_k3TvoAAAAJ,Guido Salazar-Sepúlveda,Universidad Católica de la Santísima Concepción
0RTkP8sAAAAJ,1pWfWfwAAAAJ,Sheyla Muller-Pérez,Universidad Andrés Bello
0RTkP8sAAAAJ,v7z-jSUAAAAJ,Víctor Manuel Yáñez Jara,Universidad Andrés Bello
