scholar_id_autor_gs,scholar_id_gs_coauthor,nombre_coauthor,cargo
fmh3SNcAAAAJ,XMwdTIQAAAAJ,David N. Beratan,"RJ Reynolds Professor, Department of Chemistry, Duke University"
fmh3SNcAAAAJ,KmTWAZsAAAAJ,Dr. Parvez Ahmad Alvi,"Associate Professor & Head, Department of Physical Science, Banasthali University …"
fmh3SNcAAAAJ,Rrmc3gcAAAAJ,"Dr. KR Justin Thomas, FRSC","Professor, Department of Chemistry, Indian Institute of Technology Roorkee, Roorkee, India"
fmh3SNcAAAAJ,ijpCwNMAAAAJ,Muhammad Farid Abdul Khalid,"Universiti Teknologi MARA, Malaysia"
fmh3SNcAAAAJ,Z3sHWp0AAAAJ,Savaş Kaya (Assoc. Prof. Dr.),"Sivas Cumhuriyet University, Kaya Research Group"
fmh3SNcAAAAJ,ZKzQpwMAAAAJ,Rodrigo S. Correa,"Departamento de Quimica, Universidade Federal de Ouro Preto"
fmh3SNcAAAAJ,P8zjqREAAAAJ,Javier Ellena,Professor of Instituto de Física de São Carlos -  Universidade de São Paulo
fmh3SNcAAAAJ,Y_LnrX8AAAAJ,Spiros S. Skourtis,Associate Professor of Physics
fmh3SNcAAAAJ,L0KYNOwAAAAJ,Vlasta Bonačić-Koutecký,"Lead scientist, Head of the CoE STIM, University of Split"
fmh3SNcAAAAJ,WzCNy4gAAAAJ,José Rocco,Professor
fmh3SNcAAAAJ,OoOL1qYAAAAJ,Rene Gonçalves,"Professor, ITA"
fmh3SNcAAAAJ,k2QL2A8AAAAJ,Dr. Muhammad Imran Malik,"COMSATS Institute of Information Technology, Pakistan"
fmh3SNcAAAAJ,aW5Z8PQAAAAJ,Alcindo Aparecido dos Santos,Universidade de São Paulo
fmh3SNcAAAAJ,Kv8AxG8AAAAJ,Tianquan (Tim) Lian,"Deaprtment of Chemistry, Emory University"
fmh3SNcAAAAJ,e0MlM6cAAAAJ,Jie Song,Emory University
fmh3SNcAAAAJ,o2KL-QIAAAAJ,Leeor Kronik,Weizmann Institute of Science
fmh3SNcAAAAJ,RN_SHFUAAAAJ,Edson Rodrigues-Filho,Depto de Química - UFSCar
fmh3SNcAAAAJ,uiJU85YAAAAJ,Abdul Rauf Raza,"Professor of Chemistry (Tenured), University of Sargodha"
fmh3SNcAAAAJ,rXuafvUAAAAJ,Dr. Muhammad Usman Khan,"Department of Chemistry, University of Okara, Pakistan"
fmh3SNcAAAAJ,KdV9KUEAAAAJ,Prof. Dr. Ali ERDOĞMUŞ,Yildiz Technical University
fmh3SNcAAAAJ,dTN091wAAAAJ,Emre Güzel,"Sakarya University of Applied Sciences, Department of Engineering Fundamental Sciences"
fmh3SNcAAAAJ,gcz-qLgAAAAJ,Wei Li （李位）,"UMONS, Hunan Agricultural University, Jilin University"
fmh3SNcAAAAJ,YnNTgQMAAAAJ,Alexander Balaeff,Black Diamond Therapeutics
fmh3SNcAAAAJ,ZtufYgUAAAAJ,Alzir Azevedo Batista,"Professor e Pesquisador na área de Química Inorbânica, Universidade Federal de São …"
fmh3SNcAAAAJ,dNO4yPMAAAAJ,Keiji Morokuma,
fmh3SNcAAAAJ,VpwL7UMAAAAJ,Muhammad Ashfaq,"University of Sargodha, Punjab, Pakistan"
mYWIQd4AAAAJ,J9dozzAAAAAJ,JE Valdés,"Professor, Physics Department, Universidad Santa María"
mYWIQd4AAAAJ,TKDdBTkAAAAJ,David Laroze,"Professor of Physics, Universidad de Tarapacá"
mYWIQd4AAAAJ,W_-UyZ8AAAAJ,Eric Suarez Morell,"Professor at Univ. Técn. Federico Santa María/ Recipient M. Zambrano at EPS, Univ. Sevilla"
mYWIQd4AAAAJ,v_u2SesAAAAJ,Pedro Landeros,"Departamento de Física, Universidad Técnica Federico Santa María, Chile"
mYWIQd4AAAAJ,_UkQ7B8AAAAJ,Marcelo Knobel,"Professor, Instituto de Física Gleb Wataghin, Universidade Estadual de Campinas (Unicamp …"
mYWIQd4AAAAJ,AQGsfCIAAAAJ,Juan Escrig,Departamento de Física de la Universidad de Santiago de Chile
mYWIQd4AAAAJ,HyzQZ8gAAAAJ,Américo Cuchillo Flórez,"Instructor, Universidad de Atacama"
mYWIQd4AAAAJ,LphcJRUAAAAJ,Alvaro S.  Nunez,Universidad de Chile
mYWIQd4AAAAJ,k2oQ2A4AAAAJ,Carlos Garcia Garcia,"Universidad Tecnica Federico Santa Maria, Department of Physics, Chile"
mYWIQd4AAAAJ,Q1os61kAAAAJ,Monica Pacheco,"Professor of Theoretical Physics, Universidad Tecnica Federico Santa Maria"
mYWIQd4AAAAJ,cfE92WEAAAAJ,vladimir esaulov,"Institut des Sciences Moléculaires d'Orsay, CNRS & Université Paris Sud"
mYWIQd4AAAAJ,IDZbDcAAAAAJ,Omar Suarez Tamara,Universidad de Sucre
mYWIQd4AAAAJ,VuWbL80AAAAJ,Juan Carlos Retamal,Departamento de Física Universidad de Santiago de Chile
mYWIQd4AAAAJ,Kz4H3ioAAAAJ,Eduardo Cisternas,"Universidad de La Frontera, Temuco, Chile"
mYWIQd4AAAAJ,n1Ina8oAAAAJ,Jorge Augusto Otálora Arias,Universidad Católica del Norte (UCN)
mYWIQd4AAAAJ,akldXJEAAAAJ,Kleber Roberto Pirota,"Professor, Instituto de Física Gleb Wataghin, Universidade Estadual de Campinas (Unicamp …"
mYWIQd4AAAAJ,RRCqUogAAAAJ,Marcos Flores,Universidad de Chile
mYWIQd4AAAAJ,_NBjk50AAAAJ,Shyue Ping Ong,University of California San Diego
mYWIQd4AAAAJ,VfiCFNgAAAAJ,Takeo Fujiwara,"Mathematics and Informatics Center, The University of Tokyo"
mYWIQd4AAAAJ,AXAA84YAAAAJ,Monica Bahiana,"Professor de Física, Universidade Federal do Rio de Janeiro"
mYWIQd4AAAAJ,96J6vbAAAAAJ,Gerbrand Ceder,Professor of Materials Science and Engineering
mYWIQd4AAAAJ,IyLcfaQAAAAJ,Mario N. Baibich,Instituto de Fisica UFRGS
mYWIQd4AAAAJ,fIW_BGIAAAAJ,Luiz Sampaio,Centro Brasileiro de Pesquisas Físicas
F7-FI08AAAAJ,mTVRemMAAAAJ,Bitan Roy,"Assistant Professor, Lehigh University"
F7-FI08AAAAJ,SnqtqRMAAAAJ,Igor Herbut,"Professor of physics, Simon Fraser University"
F7-FI08AAAAJ,LU_C7SMAAAAJ,Robert-Jan Slager,University of Cambridge
F7-FI08AAAAJ,F2HOXmAAAAAJ,CM Smith,"Utrecht University, the Netherlands"
F7-FI08AAAAJ,X6ldIXUAAAAJ,Jan Zaanen,Leiden University
F7-FI08AAAAJ,cZBZo5EAAAAJ,Andrej Mesaros,"Chargé de recherche, CNRS, Laboratoire de Physique des Solides, Université Paris-Saclay …"
F7-FI08AAAAJ,azErFVwAAAAJ,Gerard Barkema,"Professor of Computer science, Utrecht University"
F7-FI08AAAAJ,lw5h5JMAAAAJ,Rodrigo Soto Garrido,"Assistant Professor of Physics, Pontificia Universidad Católica de Chile"
F7-FI08AAAAJ,ufAozSIAAAAJ,A Balatsky,"Nordita, UConn"
F7-FI08AAAAJ,DE8Lg_AAAAAJ,Sandeep Kumar Jain,Shell Technology Center Bangalore
F7-FI08AAAAJ,Xd0nCnEAAAAJ,Lara Benfatto,"Full Professor, Sapienza University, Rome Italy"
F7-FI08AAAAJ,7cfg6_UAAAAJ,Pallab Goswami,"Assistant Professor, Northwestern University"
F7-FI08AAAAJ,2vUWoTAAAAAJ,Tanay Nag,"Postdoc, Uppsala University, Sweden"
F7-FI08AAAAJ,aQXki4MAAAAJ,Ignacio Salazar Landea,Instituto de Física La Plata
F7-FI08AAAAJ,gbyO-O4AAAAJ,Dumitru Calugaru,"Graduate student, Princeton University"
F7-FI08AAAAJ,NInuEVgAAAAJ,Jian-Xin Zhu,Los Alamos National Laboratory
F7-FI08AAAAJ,E8RQ_p8AAAAJ,Adhip Agarwala,Assistant Professor at Indian Insitute of Technology Kanpur
F7-FI08AAAAJ,7T92ZyIAAAAJ,Gordon W. Semenoff,University of British Columbia
F7-FI08AAAAJ,3PiprDsAAAAJ,Enrique Munoz Tavera,"Professor of Theoretical Physics, Pontificia Universidad Catolica de Chile"
F7-FI08AAAAJ,9JaDNBQAAAAJ,R. Matthias Geilhufe,"Assistant professor, Chalmers University of Technology"
F7-FI08AAAAJ,HZsnw5wAAAAJ,Marcello B. Silva Neto,Universidade Federal do Rio de Janeiro
F7-FI08AAAAJ,iF8im5cAAAAJ,Sankar Das Sarma,University of Maryland
F7-FI08AAAAJ,xHFK0CQAAAAJ,Nicolas Grandi,"IFLP-Conicet, Departamento de Física-UNLP"
F7-FI08AAAAJ,pgN4BLIAAAAJ,Junkai Dong,"Graduate Student, Harvard University"
F7-FI08AAAAJ,kbTNxXgAAAAJ,Habib Rostami,"Assistant Professor (Lecturer), University of Bath"
F7-FI08AAAAJ,cSLHjE0AAAAJ,Malcolm Kennett,"Professor of Physics, Simon Fraser University"
F7-FI08AAAAJ,PyFslMQAAAAJ,Kun Yang,"Professor of Physics, Florida State University"
F7-FI08AAAAJ,eUfdZowAAAAJ,Nicola Spaldin,"Professor for Materials Theory, ETH Zurich"
F7-FI08AAAAJ,qJQPJzQAAAAJ,Stefano Bonetti,Stockholm University and Ca' Foscari University of Venice
F7-FI08AAAAJ,vbCcMyUAAAAJ,David Abergel,Nature Physics
F7-FI08AAAAJ,IqaKXFwAAAAJ,Christophe Delerue,"IEMN, CNRS"
F7-FI08AAAAJ,QbVoJeMAAAAJ,Flore Kunst,"Junior Group Leader, Max Planck Institute for the Science of Light"
F7-FI08AAAAJ,5aos6XTCCmQC,Peter H. Jacobse,"Postdoctoral researcher in Physics, University of California, Berkeley"
F7-FI08AAAAJ,5FPqkUgAAAAJ,Francisco Guinea,"Senior Researcher, Imdea Nanoscience"
F7-FI08AAAAJ,6Z-w5S4AAAAJ,Simon Stuij,University of Amsterdam
F7-FI08AAAAJ,7fetV5kAAAAJ,Pavlo Sukhachov,"Yale University, Department of Physics"
F7-FI08AAAAJ,mCjiI38AAAAJ,Federico D'Ambrosio,Utrecht University
F7-FI08AAAAJ,gQeu8aoAAAAJ,Marianne Moore,"Graduate student, MIT"
F7-FI08AAAAJ,iv2yY8EAAAAJ,Piotr Surówka,"Associate Professor, Wrocław University of Science and Technology"
F7-FI08AAAAJ,9HOLS-YAAAAJ,Archisman Panigrahi,Graduate Student of Physics at Massachusetts Institute of Technology
F7-FI08AAAAJ,gz9xwgkAAAAJ,Branislav Sazdovic,"Professor of Physics, Belgrade University"
F7-FI08AAAAJ,3OCgG7wAAAAJ,Pedro Orellana,Universidad Técnica Federico Santa Maria
F7-FI08AAAAJ,ad96hMYAAAAJ,Lars Fritz,"Assistant Professor, Universiteit Utrecht"
F7-FI08AAAAJ,98kgK2UAAAAJ,JP Ramos-Andrade,Universidad de Antofagasta
v_u2SesAAAAJ,XPMLIcgAAAAJ,Rodolfo Gallardo,Universidad Técnica Federico Santa María
v_u2SesAAAAJ,AQGsfCIAAAAJ,Juan Escrig,Departamento de Física de la Universidad de Santiago de Chile
v_u2SesAAAAJ,BJhK_mgAAAAJ,Dora Altbir,"Physics Department, Universidad de Santiago de Chile"
v_u2SesAAAAJ,6yNzJy4AAAAJ,Alejandro Roldán Molina,Universidad de Aysén
v_u2SesAAAAJ,MQwH2wEAAAAJ,Jürgen Fassbender,HZDR
v_u2SesAAAAJ,mYWIQd4AAAAJ,Patricio Vargas,"Professor of Theoretical Physics, Universidad Tecnica Federico Santa Maria"
v_u2SesAAAAJ,80VcItkAAAAJ,David Cortés Ortuño,"Research Fellow, Utrecht University"
v_u2SesAAAAJ,Q34GX34AAAAJ,Attila Kákay,"Scientific staff, Helmholtz-Zentrum Dresden - Rossendorf"
v_u2SesAAAAJ,n1Ina8oAAAAJ,Jorge Augusto Otálora Arias,Universidad Católica del Norte (UCN)
v_u2SesAAAAJ,LphcJRUAAAAJ,Alvaro S.  Nunez,Universidad de Chile
v_u2SesAAAAJ,v5PDL5oAAAAJ,Jorge López,Synopsys
v_u2SesAAAAJ,UpT44I0AAAAJ,Roberto Troncoso,Norwegian University of Science and Technology
v_u2SesAAAAJ,bsyErHsAAAAJ,Andreas Berger,CIC nanoGUNE
v_u2SesAAAAJ,AXAA84YAAAAJ,Monica Bahiana,"Professor de Física, Universidade Federal do Rio de Janeiro"
v_u2SesAAAAJ,JwiLDNEAAAAJ,Sebastián Allende,Universidad de Santiago de Chile
v_u2SesAAAAJ,LrSI-lwAAAAJ,Michael Farle,Universität Duisburg-Essen
v_u2SesAAAAJ,cB0onyUAAAAJ,Gianluca Gubbiotti,Istituto officina dei Materiali- CNR- Perugia (Italy)
v_u2SesAAAAJ,tyCbpHIAAAAJ,Igor Barsukov,University of California Riverside
v_u2SesAAAAJ,jnMMRloAAAAJ,Volker Sluka,
v_u2SesAAAAJ,mI94b0kAAAAJ,Anna Suszka,Dr
v_u2SesAAAAJ,s3pyOM8AAAAJ,Rodriguez-Suarez R,Pontificia Universidad Católica de Chile (PUC)
v_u2SesAAAAJ,sxviK_gAAAAJ,Sergio Machado Rezende,Universidade Federal de Pernambuco
v_u2SesAAAAJ,IDZbDcAAAAAJ,Omar Suarez Tamara,Universidad de Sucre
v_u2SesAAAAJ,TKDdBTkAAAAJ,David Laroze,"Professor of Physics, Universidad de Tarapacá"
v_u2SesAAAAJ,-YSx8xIAAAAJ,Kornelius Nielsch,"Leibniz Institute of Solid State and Materials Research, IFW-Dresden, TU Dresden"
v_u2SesAAAAJ,9KT6JIsAAAAJ,Dr. Denys Makarov,Helmholtz-Zentrum Dresden-Rossendorf eV
v_u2SesAAAAJ,1BqhX5EAAAAJ,Denis Sheka,"Faculty of Radio Physics, Electronics and Computer Systems, Taras Shevchenko National …"
v_u2SesAAAAJ,KlhczFwAAAAJ,Claudio Gonzalez Fuentes,Universidad Tecnica Federico Santa María
v_u2SesAAAAJ,1GBzEswAAAAJ,Martina Ahlberg,University of Gothenburg
v_u2SesAAAAJ,2NBG3P0AAAAJ,Johan Åkerman,"Professor of Experimental Physics (spintronics), University of Gothenburg"
v_u2SesAAAAJ,8HYuY30AAAAJ,silvia tacchi,"Istituto Officina dei Materiali, IOM-CNR"
v_u2SesAAAAJ,CyHp-_MAAAAJ,Marco Madami,"professore associato, Dipartimento di Fisica e Geologia, Università di Perugia"
v_u2SesAAAAJ,xXLi6EsAAAAJ,Paolo Vavassori,"Ikerbasque Research Professor, Ikerbasque Science Foundation and CIC nanoGUNE"
v_u2SesAAAAJ,tpbHROkAAAAJ,Antonio Azevedo,"Professor, Department of Physics, Federal University of Pernambuco"
v_u2SesAAAAJ,FIUpS9gAAAAJ,"Vilela-Leão, Luis H",Federal University of Pernanbuco
v_u2SesAAAAJ,dLe0ywwAAAAJ,Rodrigo E Arias,"Physics Department, Universidad de Chile"
v_u2SesAAAAJ,HQtFn0kAAAAJ,Oleksandr Pylypovskyi,Helmholtz-Zentrum Dresden-Rossendorf eV
v_u2SesAAAAJ,HyzQZ8gAAAAJ,Américo Cuchillo Flórez,"Instructor, Universidad de Atacama"
v_u2SesAAAAJ,NIVtuCQAAAAJ,Andres Felipe Franco Galeano,Universidad Mayor
v_u2SesAAAAJ,VZzKaH0AAAAJ,Heiko Wende,"Professor, Faculty of Physics, University of Duisburg-Essen"
v_u2SesAAAAJ,ZmBhWN0AAAAJ,Zi-An Li,"Faculty of Physics, University of Duisburg-Essen"
v_u2SesAAAAJ,yZ5fWAMAAAAJ,Stefan Facsko,"Research Fellow, Helmholtz-Zentrum Dresden-Rossendorf"
v_u2SesAAAAJ,CwEgtU4AAAAJ,Alberto Passos Guimaraes,Professor at CBPF
v_u2SesAAAAJ,s0RJIvAAAAAJ,Flávio Garcia,Pesquisador do Centro Brasileiro de Pesquisas Físicas
v_u2SesAAAAJ,sAENptEAAAAJ,Christophe Gatel,"Maître de Conférences, Université de Toulouse, CEMES"
v_u2SesAAAAJ,6u2whpQAAAAJ,Jose Maria Porro,"ISIS, Rutherford Appleton Laboratory, STFC"
v_u2SesAAAAJ,CVC56BIAAAAJ,Hans Fangohr,Professor of Computational Modelling
v_u2SesAAAAJ,5xDFeHsAAAAJ,Michael Fitzsimmons,Dept. of Energy Office of Science
v_u2SesAAAAJ,J05j1WsAAAAJ,Ivan K. Schuller,UC San Diego
v_u2SesAAAAJ,QC7O7yUAAAAJ,Xavier Batlle,Universitat de Barcelona
v_u2SesAAAAJ,KnX6kiAAAAAJ,Burkard Hillebrands,"Department of Physics and Research Center OPTIMAS, RPTU Kaiserslautern-Landau"
v_u2SesAAAAJ,EV9ZKZ4AAAAJ,Joaquim Bonfim Santos Mendes,Professor Adjunto no Departamento de Física da Universidade Federal de Viçosa
v_u2SesAAAAJ,GC_d5ogAAAAJ,Maximiliano D. Martins,Centro de Desenvolvimento da Tecnologia Nuclear
v_u2SesAAAAJ,VuWbL80AAAAJ,Juan Carlos Retamal,Departamento de Física Universidad de Santiago de Chile
v_u2SesAAAAJ,TfkZH0YAAAAJ,Luis Ignacio Lizardi Varas,Universidad Técnica Federico Santa María
v_u2SesAAAAJ,sHFnXS8AAAAJ,Stephane Mangin,Institut Jean Lamour /  Universite de Lorraine
v_u2SesAAAAJ,nxWcY5MAAAAJ,Jordan Katine,"Senior Director, Western Digital Research Division"
v_u2SesAAAAJ,lw5h5JMAAAAJ,Rodrigo Soto Garrido,"Assistant Professor of Physics, Pontificia Universidad Católica de Chile"
v_u2SesAAAAJ,k2oQ2A4AAAAJ,Carlos Garcia Garcia,"Universidad Tecnica Federico Santa Maria, Department of Physics, Chile"
v_u2SesAAAAJ,cx6tFdsAAAAJ,N. Vidal-Silva,Universidad de la Frontera
v_u2SesAAAAJ,ZC9EnNFoIRIC,Patricio Guzmán,"Departamento de Matemática, Universidad Técnica Federico Santa María"
mfnr2oEAAAAJ,ZOF0KysAAAAJ,Graham clifford goodwin,Professor university of newcastle Australia
mfnr2oEAAAAJ,wSXnYFYAAAAJ,Juan C. Agüero,Universidad Tecnica Federico Santa Maria (Chile)
mfnr2oEAAAAJ,-0gRNgsAAAAJ,Cesar Silva,"Departamento de Electrónica, Universidad Técnica Federico Santa María, Chile"
mfnr2oEAAAAJ,3itZwbsAAAAJ,Patricio Cortes,"Universidad Tecnica Federico Santa Maria, Chile"
mfnr2oEAAAAJ,27SqpPsAAAAJ,Hector Ramirez Estay,Universidad Tecnica Federico Santa Maria
mfnr2oEAAAAJ,L9US5bgAAAAJ,Ramón A. Delgado Pulgar,Ericsson Research
mfnr2oEAAAAJ,h9hPvFMAAAAJ,Sergio Vazquez,Associate Professor (Universidad de Sevilla)
mfnr2oEAAAAJ,-sul52cAAAAJ,Leopoldo García Franquelo,"Professor Dept. of Electronics Engineering, Universidad de Sevilla (University of Seville) …"
mfnr2oEAAAAJ,kCWdqMcAAAAJ,Luis A. Mora,"Doctoral Student, Universidad Técnica Federico Santa María, Valparaiso, Chile/ Université …"
mfnr2oEAAAAJ,8etJJGoAAAAJ,Hugues Garnier,Professor of Control Engineering
mfnr2oEAAAAJ,umQwjCgAAAAJ,Boris I. Godoy,"Researcher, Lund University, Sweden"
mfnr2oEAAAAJ,Vj4mHpEAAAAJ,Matías Zañartu,"Department of Electronic Engineering, Universidad Técnica Federico Santa María"
mfnr2oEAAAAJ,GBqW8UwAAAAJ,Mauricio Cea Garrido,University of Newcastle
mfnr2oEAAAAJ,lmMiNGgAAAAJ,Arturo Padilla Bernedo,"Universidad de La Frontera, Department of Mechanical Engineering"
mfnr2oEAAAAJ,GfDkTtgAAAAJ,Yann Le Gorrec,Professeur d'Automatique ENSMM
mfnr2oEAAAAJ,7g3r_ykAAAAJ,Rodrigo Carvajal,Pontificia Universidad Católica de Valparaíso
mfnr2oEAAAAJ,ZHrIQB8AAAAJ,Diego S. Carrasco,"University of Newcastle, Australia"
mfnr2oEAAAAJ,G4HdPCsAAAAJ,James Welsh,University of Newcastle
mfnr2oEAAAAJ,XTVe-hUAAAAJ,Torsten Söderström,Uppsala university
mfnr2oEAAAAJ,-pk-IqAAAAAJ,wei tang,northwestern polytechnical university
mfnr2oEAAAAJ,U1_r_C4AAAAJ,Christian Rojas,Universidad Tecnica Federico Santa Maria
mfnr2oEAAAAJ,0tWa-tcAAAAJ,Cristian R. Rojas,"Professor, Division of Decision and Control Systems, KTH Royal Institute of Technology"
mfnr2oEAAAAJ,9vxgNXoAAAAJ,Jose De Dona,TBA
mfnr2oEAAAAJ,l-AttlIAAAAJ,Gabriel E. Galindo,Universidad Técnica Federico Santa María
mfnr2oEAAAAJ,qvHyCsEAAAAJ,Alvaro Prado,Pontificia Universidad Católica del Norte
mfnr2oEAAAAJ,qzUiwgMAAAAJ,Werner Creixell,Universidad Técnica Federico Santa María
mfnr2oEAAAAJ,1pJSaQYAAAAJ,Ricardo P. Aguilera,"Associate Professor, University of Technology Sydney, Australia"
mfnr2oEAAAAJ,gm9zYIkAAAAJ,Maria Seron,"Associate Professor, The University of Newcastle, Australia"
mfnr2oEAAAAJ,NUvFs8gAAAAJ,Javier Gonzalo Gonzalez Fontanet,PhD. Student of Electronic Engineering UTFSM
mfnr2oEAAAAJ,8MJh6JcAAAAJ,Alejandro Rojas,"Universidad de Concepción, Chile"
mfnr2oEAAAAJ,ail54Y8AAAAJ,Arturo Morales,"M.Sc. Student, Universidad Técnica Federico Santa María"
mfnr2oEAAAAJ,TmE2fIIAAAAJ,Gabriel A. Alzamendi,"National Scientific and Technical Research Council, and Universidad Nacional de Entre …"
mfnr2oEAAAAJ,hSLM6owAAAAJ,"Víctor M. Espinoza Catalán, Ph.D.","Associate Professor at the Department of Sound, Universidad de Chile"
mfnr2oEAAAAJ,Gk_by9MAAAAJ,Alejandro Donaire,"The University of Newcastle, Australia"
mfnr2oEAAAAJ,7UWbLKsAAAAJ,B. Maschke,Université de Lyon
mfnr2oEAAAAJ,AHJbufYAAAAJ,Gustavo Scaglia,Instituto de Ing Quimica - UNSJ - CONICET
mfnr2oEAAAAJ,KZ5TMuAAAAAJ,Jose Rodriguez,"Professor, Engineering Faculty, Universidad San Sebastian"
mfnr2oEAAAAJ,nocN5IsAAAAJ,Esteban Fuentes,Widex A/S
mfnr2oEAAAAJ,glxar60AAAAJ,Fernando A. Auat Cheein,
Q1os61kAAAAJ,3OCgG7wAAAAJ,Pedro Orellana,Universidad Técnica Federico Santa Maria
Q1os61kAAAAJ,wrhHynIAAAAJ,A Latge,Universidade Federal Fluminense
Q1os61kAAAAJ,lI527WQAAAAJ,Luis Rosales,"Physics Department, Universidad Técnica Federico Santa María"
Q1os61kAAAAJ,rb_86qoAAAAJ,Julian David Correa Abad,"Full Time Professor,  Universidad   de  Medellin"
Q1os61kAAAAJ,WehFkkAAAAAJ,Leonor Chico,Universidad Complutense de Madrid
Q1os61kAAAAJ,emE-TscAAAAJ,Carlos Duque,"Instituto de Física, Universidad de Antioquia"
Q1os61kAAAAJ,W_-UyZ8AAAAJ,Eric Suarez Morell,"Professor at Univ. Técn. Federico Santa María/ Recipient M. Zambrano at EPS, Univ. Sevilla"
Q1os61kAAAAJ,8HZkOo8AAAAJ,Claudia Gomes da Rocha,"Professor of Physics, University of Calgary"
Q1os61kAAAAJ,AxG8_toAAAAJ,Jhon W. González,"Universidad Técnica Federico Santa María, Valparaiso-Chile"
Q1os61kAAAAJ,mYWIQd4AAAAJ,Patricio Vargas,"Professor of Theoretical Physics, Universidad Tecnica Federico Santa Maria"
Q1os61kAAAAJ,3PiprDsAAAAJ,Enrique Munoz Tavera,"Professor of Theoretical Physics, Pontificia Universidad Catolica de Chile"
Q1os61kAAAAJ,69DAhRQAAAAJ,Hernán Santos,Universidad Rey Juan Carlos
Q1os61kAAAAJ,WuEIl3EAAAAJ,ML Ladrón de Guevara,Universidad Católica del Norte
Q1os61kAAAAJ,BtiRdXgAAAAJ,JH Ojeda,Universidad Pedagógica y Tecnológica de Colombia
Q1os61kAAAAJ,e2nkm_sAAAAJ,Natalia Cortés,Universidad Técnica Federico Santa María
Q1os61kAAAAJ,J_HuGbIAAAAJ,Antonio Jose Roque da Silva,Instituto de Física - Universidade de São Paulo
Q1os61kAAAAJ,cjAgV7IAAAAJ,César Daniel Núñez Ramírez,"PhD. Physics, Universidad Tecnico Federico Santa María"
Q1os61kAAAAJ,c__8k64AAAAJ,George Balster Martins,"Physics Department, Uberlândia Federal University"
Q1os61kAAAAJ,ru9OwLUAAAAJ,Gianaurelio (Giovanni) Cuniberti,TU Dresden; https://ORCID.org/0000-0002-6574-7848
Q1os61kAAAAJ,Oi3Phu8AAAAJ,Luis EF Foa Torres,"Associate Professor, Departamento de Física, FCFM, Universidad de Chile"
Q1os61kAAAAJ,m2KXGP8AAAAJ,Ezequiel Costa Siqueira,Universidade Federal Tecnológica do Paraná - UTFPR
Q1os61kAAAAJ,BJhK_mgAAAAJ,Dora Altbir,"Physics Department, Universidad de Santiago de Chile"
Q1os61kAAAAJ,c_m4HpkAAAAJ,Carolina Garín Correa,"Profesora de Química, Universidad Técnica Federico Santa María"
Q1os61kAAAAJ,fe5EMDAAAAAJ,Walter Orellana,"Associate Professor, Department of Physical Science, Universidad Andres Bello"
Ihz46DUAAAAJ,9iUCEj0AAAAJ,Jorge Rodríguez R.,Khalifa University
SWifA9sAAAAJ,liMYSF8AAAAJ,Jorge Garcia Melian,"Professor of Applied Mathematics, Universidad de La Laguna"
SWifA9sAAAAJ,PohbFlcAAAAJ,Leandro Martin Del Pezzo,IESTA-FCEA-UDELAR
SWifA9sAAAAJ,sod97E8AAAAJ,Salomón Alarcón,"Professor of Mathematics, Universidad Técnica Federico Santa María"
SWifA9sAAAAJ,monudxoAAAAJ,Begoña Barrios Barrera,"""Ramón y Cajal"" researcher. University of La Laguna. Tenerife. Spain"
SWifA9sAAAAJ,vq-QjrYAAAAJ,Aliang Xia,Jiangxi Normal University
SWifA9sAAAAJ,6nqz3rEAAAAJ,Maria J. ESTEBAN,"Directrice de recherche émérite, CNRS & Université Paris-Dauphine"
SWifA9sAAAAJ,uwYhmgoAAAAJ,erwin topp paredes,Universidad de Santiago de Chile
SWifA9sAAAAJ,X-baM4gAAAAJ,Ariel Salort,Universidad de Buenos Aires
SWifA9sAAAAJ,ItSThYIAAAAJ,Leonelo Iturriaga,Universidad Técnica Federico Santa María
SWifA9sAAAAJ,QmoXcJIAAAAJ,Julio Daniel Rossi,Buenos Aires Univ
SWifA9sAAAAJ,HfGj9hsAAAAJ,Alejandro Allendes,"Assistant Professor, Department of Mathematics, Universidad Técnica Federico Santa María"
Vj4mHpEAAAAJ,10Yag9QAAAAJ,"Daryush D. Mehta, PhD","Director of Voice Science and Technology Laboratory, Center for Laryngeal Surgery and Voice"
Vj4mHpEAAAAJ,qjzRrxAAAAAJ,Sean D. Peterson,"Professor of Mechanical Engineering, University of Waterloo"
Vj4mHpEAAAAJ,r9we4h4AAAAJ,Byron D. Erath,"Associate Professor of Mechanical and Aeronautical Engineering, Clarkson University"
Vj4mHpEAAAAJ,TdIKrXMAAAAJ,George R Wodicka,"Vincent P. Reilly Professor, Purdue University"
Vj4mHpEAAAAJ,7pVry2IAAAAJ,Jarrad H Van Stan,"Harvard Medical School, Massachusetts General Hospital, MGH Institute of Health Professions"
Vj4mHpEAAAAJ,hSLM6owAAAAJ,"Víctor M. Espinoza Catalán, Ph.D.","Associate Professor at the Department of Sound, Universidad de Chile"
Vj4mHpEAAAAJ,9RyeFYwAAAAJ,Dr. Marzyeh Ghassemi,"Assistant Professor, EECS.CSAIL/IMES, MIT"
Vj4mHpEAAAAJ,D_o9de0AAAAJ,Pavel Prado,"School of Audiology, Universidad San Sebastián, Chile"
Vj4mHpEAAAAJ,TmE2fIIAAAAJ,Gabriel A. Alzamendi,"National Scientific and Technical Research Council, and Universidad Nacional de Entre Ríos"
Vj4mHpEAAAAJ,rWJtblQAAAAJ,Luc Mongeau,"Professor of Mechanical Engineering, McGill University"
Vj4mHpEAAAAJ,pgMfq_EAAAAJ,Cara E. Stepp (she/her),"Professor, Boston University"
Vj4mHpEAAAAJ,mfnr2oEAAAAJ,Juan I. Yuz,Universidad Tecnica Federico Santa Maria
Vj4mHpEAAAAJ,qMJjd8cAAAAJ,Robert E. Hillman,"Professor of Surgery, Harvard Medical School"
VjmgcGIAAAAJ,KKTR6XsAAAAJ,Paula Rojas S.,Universidad Adolfo Ibañez
VjmgcGIAAAAJ,Gh142QYAAAAJ,I Alfonso,"Institute for Materials Research, National Autonomous University of Mexico"
VjmgcGIAAAAJ,1YL9588AAAAJ,Carola Martinez Ugalde,"Departamento de Ingeniería de Obras Civiles, Universidad de La Frontera"
VjmgcGIAAAAJ,9zkLMvkAAAAJ,Sheila Lascano Farak,Profesor Jornada Completa-Departamento de Ingeniería Mecánica (UTFSM)
VjmgcGIAAAAJ,79bcdT8AAAAJ,Mamie Sancy,Pontificia Universidad Católica de Chile
VjmgcGIAAAAJ,McpBBXgAAAAJ,MANGALARAJA Ramalinga Viswanathan,"Professor of Materials Science and Engineering, University of Adolfo Ibanez, Santiago …"
VjmgcGIAAAAJ,lhd21GcAAAAJ,Christopher Salvo M.,"Departamento de Ingeniería Mecánica, Universidad del Bío-Bío"
VjmgcGIAAAAJ,YcebgwsAAAAJ,Carolina Guerra Figueroa,Pontificia Universidad Católica de Chile
VjmgcGIAAAAJ,94KyQFcAAAAJ,Ignacio A Figueroa,"Professor of Metallurgy, Institute of Materials Research, National Autonomous University of …"
VjmgcGIAAAAJ,vjtvsrAAAAAJ,Vicente Salinas Barrera,"Assistance Profesor, ICQA, Universidad Autónoma de Chile"
VjmgcGIAAAAJ,vtXeD44AAAAJ,Osvaldo Pavez,"Académico, Universidad de Atacama"
VjmgcGIAAAAJ,I2WiYBYAAAAJ,Edgar Pio Lopez,
VjmgcGIAAAAJ,OvObWvMAAAAJ,Carolina Parra González,Universidad Técnica Federico Santa María
VjmgcGIAAAAJ,INLeZ30AAAAJ,Gonzalo Gonzalez,Universidad Nacional Autonoma de Mexico.- Instituto de Investigaciones en Materiales
VjmgcGIAAAAJ,njaa_hsAAAAJ,Rodrigo Espinoza-González,"Depto. de Ingeniería Química Biotecnología y Materiales, FCFM, Universidad de Chile"
VjmgcGIAAAAJ,AHTnmzQAAAAJ,Guilherme Oliveira Neves,Universidad del Bío-Bío
VjmgcGIAAAAJ,gegNgQ0AAAAJ,Thirumurugan M,BS Abdur Rahman Crescent Institute of Science and Technology
VjmgcGIAAAAJ,PCmDwkIAAAAJ,Nicolás Araya,Universidad de Concepción
VjmgcGIAAAAJ,mU1Dyo4AAAAJ,Aloisio Nelmo Klein,Universidade Federal de Santa Catarina
VjmgcGIAAAAJ,j5gip7cAAAAJ,Chicardi,Universidad de Sevilla
VjmgcGIAAAAJ,pMwOQSEAAAAJ,Lisa A. Muñoz,Pontificia Universidad Católica de valparaiso
VjmgcGIAAAAJ,pk2kPoIAAAAJ,Pablo Martin Saint-Laurence,"PhD Student, Technical University of Catalonia"
VjmgcGIAAAAJ,28cOEp4AAAAJ,Henry A. Colorado L.,Universidad de Antioquia (Colombia)
VjmgcGIAAAAJ,iJRulSoAAAAJ,Magdalena Walczak,Pontificia Universidad Católica de Chile
VjmgcGIAAAAJ,o8sCIrkAAAAJ,Karem Tello,Universidad Técnica Federico Santa María
VjmgcGIAAAAJ,yRX5naIAAAAJ,Cristiano Binder,universidade federal de santa catarina
VjmgcGIAAAAJ,uF_kFzYAAAAJ,Nicolas Mujica,Universidad de Chile
VjmgcGIAAAAJ,Jqbocb8AAAAJ,Fernando Lund,
VjmgcGIAAAAJ,7Eg2VYQAAAAJ,Luis Bejar Gomez,UMSNH
VjmgcGIAAAAJ,5wKpfZcAAAAJ,Ariosto Medina Flores,Universidad Michoacana de San Nicolas de Hidalgo
VjmgcGIAAAAJ,68H-jLsAAAAJ,Joel Vargas,Universidad Nacional Autónoma de México
VjmgcGIAAAAJ,Gi--T7MAAAAJ,Luis Pérez Pozo,"Department of Mechanical Engineering, UTFSM, Chile"
VjmgcGIAAAAJ,mSiNrsgAAAAJ,Michel Cassir,Chimie ParisTech
VjmgcGIAAAAJ,1bhriHEAAAAJ,GA Lara-Rodriguez,Técnico Académico titular C de Tiempo Completo
VjmgcGIAAAAJ,4pprLhEAAAAJ,José Daniel Biasoli de Mello,Universidade Federal de Uberlandia Universidade Federal de Santa Catarina
