scholar_id_autor_gs,scholar_id_gs_coauthor,nombre_coauthor,cargo
ZIkl7UgAAAAJ,AlV_fuEAAAAJ,francisco gallardo,Universidad Católica de Chile
ZIkl7UgAAAAJ,rFmauuwAAAAJ,Marcela Sepulveda Retamal,Pontificia Universidad Católica de Chile
ZIkl7UgAAAAJ,JaL6YYIAAAAJ,Martin Giesso,"Senior Instructor, Department of Anthropology, Northeastern Illinois University"
ZIkl7UgAAAAJ,_eK_f0UAAAAJ,Donald Jackson,"Departamento Antropología, Universidad de Chile"
ZIkl7UgAAAAJ,rpd7uCwAAAAJ,Victoria Castro Rojas,Universidad de Chile
3SzLhtAAAAAJ,0tkAf8IAAAAJ,David D. Preiss,"Professor of Psychology, Pontificia Universidad Católica de Chile"
3SzLhtAAAAAJ,sIa8JN8AAAAJ,María Alejandra Energici,Académica Universidad Alberto Hurtado
3SzLhtAAAAAJ,aDuc7eYAAAAJ,Lorena Pía Medina,Pontificia Universidad Católica
3SzLhtAAAAAJ,mcScWqUAAAAJ,Héctor Carvacho,Pontificia Universidad Católica de Chile
cKOW8IEAAAAJ,1_-F8JIAAAAJ,Marcela Román,"Investigadora CIDE- Universidad Alberto Hurtado, Chile"
cKOW8IEAAAAJ,gYbpKlMAAAAJ,Sylvie Didou Aupetit,Investigador
ROCQFAUAAAAJ,onjLq9AAAAAJ,Alejandro Alvarez-Marin,"Departamento de Ingeniería Industrial, Universidad de La Serena"
ROCQFAUAAAAJ,RM0u0yAAAAAJ,Domingo Garcia-Pérez-de-Lema,Profesor de Contabilildad y Finanzas (UPCT)
ROCQFAUAAAAJ,bJpDDeoAAAAJ,Luis Enrique Valdez-Juárez,"Profesor Investigador de Instituto Tecnológico de Sonora, en Guaymas Sonora México"
ROCQFAUAAAAJ,zUMMuRYAAAAJ,Cristian Geldes,Universidad Alberto Hurtado
ROCQFAUAAAAJ,MA4wTfIAAAAJ,Christian Acuña-Opazo,Depto. Ingeniería Industrial - Universidad de La Serena
ROCQFAUAAAAJ,JfWXVVgAAAAJ,J. Ángel Velázquez-Iturbide,Universidad Rey Juan Carlos
V0s0uYUAAAAJ,ZJJ9gOAAAAAJ,Carlos Alberto Cioce Sampaio,FURB. Researcher of the The Brazilian National Council for Scientific and Technological Development
zUMMuRYAAAAJ,lCRutycAAAAJ,Christian Felzensztein,"Chair in Entrepreneurial Leadership, Clarkson University, New York"
zUMMuRYAAAAJ,ROCQFAUAAAAJ,Mauricio Castillo-Vergara,"Facultad de Economía y Negocios, Universidad Alberto Hurtado"
zUMMuRYAAAAJ,cOu6lcEAAAAJ,Javier Palacios Fenech (ORCID: 0000...,
zUMMuRYAAAAJ,TUdwuqoAAAAJ,Marcos Germán Mora González,Universidad de Chile
zUMMuRYAAAAJ,2CanK5wAAAAJ,Aurelia Durand,HEC Montréal
zUMMuRYAAAAJ,OlCoMn0AAAAJ,Ekaterina Turkina,"Professor of business and innovation, HEC Montreal"
zUMMuRYAAAAJ,HMuhIssAAAAJ,Alejandro Jiménez Montecinos,"Facultad de Economía y Negocios, Universidad Alberto Hurtado"
zUMMuRYAAAAJ,onjLq9AAAAAJ,Alejandro Alvarez-Marin,"Departamento de Ingeniería Industrial, Universidad de La Serena"
zUMMuRYAAAAJ,9ONdOmwAAAAJ,Nicolas Magner,UNIVERSIDAD DIEGO PORTALES
zUMMuRYAAAAJ,vtxmrfsAAAAJ,Jaime F. Lavin,"Associate Professor of Finance, Universidad Adolfo Ibañez"
zUMMuRYAAAAJ,ySmLKOQAAAAJ,Mauricio A. Valle,"Associate Professor at Faculty of Economics and Business, Universidad Finis Terrae"
OjP1gWgAAAAJ,OSSLHcAAAAAJ,Emilio Rodríguez Ponce,Profesor Titular - Universidad de Tarapacá (Chile)
OjP1gWgAAAAJ,FgEMtxQAAAAJ,Liliana Pedraja Rejas,Profesora Titular Universidad de Tarapaca
OjP1gWgAAAAJ,ifNdmZ4AAAAJ,Gonzalo Zapata,Pontificia Universidad Católica de Chile
OjP1gWgAAAAJ,5iHOmFEAAAAJ,Felipe Lagos Rojas,International Institute for Philosophy and Social Studies
OjP1gWgAAAAJ,2LtUZRMAAAAJ,Pete Leihy,Universidad Andrés Bello
OjP1gWgAAAAJ,VrB-bOAAAAAJ,Pete Leihy,Universidad Andrés Bello (uncited 2022 works)
OjP1gWgAAAAJ,ZeHHyesAAAAJ,Cristian Pozo,Sociólogo
4S09yXQAAAAJ,UEZIAhQAAAAJ,Johanna Camacho González,Académica
4S09yXQAAAAJ,RpqxmdsAAAAJ,Norman Lederman,"Oregon State University, Illinois Institute of Technology"
MmRz8u0AAAAJ,Zp4cQbMAAAAJ,Dr Sayem Ahmed,University of Glasgow
MmRz8u0AAAAJ,9JZO9S8AAAAJ,Juergen Wasem,"Professor für Medizinmanagement, Universität Duisburg-Essen"
MmRz8u0AAAAJ,u97Fg9IAAAAJ,Randall P Ellis,"Department of Economics, Boston University"
MmRz8u0AAAAJ,8uWxDbAAAAAJ,Camilo Cid Pedraza,Profesor PUC
MmRz8u0AAAAJ,wa4_DhAAAAAJ,Iris Delgado Becerra,"Facultad de Medicina, Clínica Alemana Universidad del Desarrollo"
-Di4rF4AAAAJ,DoFkvIQAAAAJ,Antonio Moreno Jiménez,"Universidad Autónoma de Madrid, Departamento de Geografía"
-Di4rF4AAAAJ,XlcrkMkAAAAJ,Pablo Mansilla Quiñones,Instituto de Geografía. Pontificia Universidad Católica de Valparaíso
wwDBa-oAAAAJ,S-mmGIMAAAAJ,Adolfo Crespo Márquez,Prof. of the Dept. of Industrial Management. University of Sevilla
wwDBa-oAAAAJ,1secGXMAAAAJ,Gaetano Cascini,Full Professor at Politecnico di Milano
wwDBa-oAAAAJ,6DrGR60AAAAJ,Dr. Luis Barberá Martínez,University of Seville
wwDBa-oAAAAJ,haVlSKAAAAAJ,Niccolò Becattini,Associate Professor at Politecnico di Milano
wwDBa-oAAAAJ,frq9QpMAAAAJ,Dr. Vicente González-Prida Díaz,"Universidad de Sevilla & UNED, España"
wwDBa-oAAAAJ,OYYTC30AAAAJ,Serena Graziosi,"Associate Professor, Politecnico di Milano"
wwDBa-oAAAAJ,scSVCioAAAAJ,Marcel Minutolo,Robert Morris University
wwDBa-oAAAAJ,rSW5suMAAAAJ,Sergey Kuleshov,"Universidad Andrés Bello, Santiago, Chile"
YXDSFOAAAAAJ,jPsYze4AAAAJ,Claudio A. Bonilla,University of Chile
YXDSFOAAAAAJ,zJZNPQIAAAAJ,Semei Coronado,San Diego College of Continuing Education
YXDSFOAAAAAJ,XKE-I9MAAAAJ,Francisco Venegas-Martínez,"Investigador Nacional SNI III Emérito, Escuela Superior de Economía, Instituto Politécnico Nacional"
YXDSFOAAAAAJ,Agu27CcAAAAJ,Omar Rojas,"Universidad Panamericana, México"
YXDSFOAAAAAJ,y3jDk8sAAAAJ,Apostolos Serletis,"Professor of Economics, University of Calgary"
iBZGMxkAAAAJ,bN_0ux4AAAAJ,Miguel R. Wilhelmi,Profesor de Didáctica de la Matemática (UPNA)
iBZGMxkAAAAJ,Pl0Q-YQAAAAJ,José Álamos Gómez,Universitat de València
iBZGMxkAAAAJ,GfJSYsIAAAAJ,Dr. Guadalupe López-Íñiguez,"Associate Professor of Music Education, Sibelius Academy - Uniarts, Helsinki"
iBZGMxkAAAAJ,ULax-xQAAAAJ,Gary E McPherson,Ormond Professor of Music
iBZGMxkAAAAJ,XIn6R44AAAAJ,Javier Zarza Alzugaray,University of Zaragoza
iBZGMxkAAAAJ,6dwYgxgAAAAJ,Lauren E Johnson,Universidad de Navarra/Brigham Young University
iBZGMxkAAAAJ,PjeJUmYAAAAJ,Amalia Casas-Mas,Profesora Universidad Complutense de Madrid
_KZs54gAAAAJ,pi6ccTkAAAAJ,Tomás Peters,Universidad de Chile
_KZs54gAAAAJ,OHqf_loAAAAJ,Enedina Ortega Gutierrez,"Profesora_Investigadora (Tecnológico de Monterrey, Departamento Estudios Culturales)"
Nyxl5kwAAAAJ,-Qg9SzEAAAAJ,JUAN PABLO ZAMBRANO TIZNADO,"Académico, Dpto. de Ciencias Jurídicas de la Universidad de La Frontera"
Nyxl5kwAAAAJ,tgRD_30AAAAJ,Carlos Felimer del Valle Rojas,Universidad de La Frontera (UFRO
Nyxl5kwAAAAJ,N9itsfIAAAAJ,Luis Villavicencio Miranda,Centro de Investigaciones de Filosofía del Derecho y Derecho Penal
Nyxl5kwAAAAJ,wFkl5VoAAAAJ,Federico José Arena,"Conicet - U.N.C., Argentina"
Qiq9zKcAAAAJ,mrl2FNUAAAAJ,Malba Barahona,Facultad de Educación
NoSbioAAAAAJ,MggAYt0AAAAJ,Camila Pérez Navarro,"Instituto de Ciencias de la Educación, Universidad de O'Higgins"
NoSbioAAAAAJ,WyRRqBsAAAAJ,Heloisa Helena Pimenta Rocha,Professora na Universidade Estadual de Campinas
NoSbioAAAAAJ,tBm4Pb4AAAAJ,Marcelo Caruso,Humobldt-Universität zu Berlin
kWbb_ukAAAAJ,hlY4cycAAAAJ,Hernan Scholten,Universidad de Buenos Aires
kWbb_ukAAAAJ,YQquucEAAAAJ,Andrea Precht Gandarillas,Universidad Católica del Maule
kWbb_ukAAAAJ,DCe90L4AAAAJ,Wilson López López,Pontificia Universidad Javeriana
kWbb_ukAAAAJ,3SzLhtAAAAAJ,Antonia Larrain (https://orcid.org/0000-...,Universidad Alberto Hurtado
kWbb_ukAAAAJ,feMshoAAAAAJ,"Gonzalo Salas, PhD            (Orcid: 000...","Departamento de Psicología, Universidad Católica del Maule"
kWbb_ukAAAAJ,FVllI3wAAAAJ,Paulina Freire,"Estudiante de Doctorado en Psicología, PUC"
kWbb_ukAAAAJ,sIa8JN8AAAAJ,María Alejandra Energici,Académica Universidad Alberto Hurtado
kWbb_ukAAAAJ,KCwmahUAAAAJ,CHRISTIAN LUIS SEBASTIAN BALMA...,Pontificia Universidad Católica de Chile
kWbb_ukAAAAJ,YzXGVLQAAAAJ,Gonzalo Gallardo,Pontificia Universidad Católica de Chile
5ih2rDYAAAAJ,sm16h74AAAAJ,Ignacio Cabib,"Associate Professor of Sociology and Public Health, Pontificia Universidad Católica de Chile"
TkuKxkUAAAAJ,1pGKw9UAAAAJ,Claudia Mellado,"Profesor de Periodismo, Pontificia Universidad Católica de Valparaíso"
TkuKxkUAAAAJ,3o_C118AAAAJ,Luis Cárcamo Ulloa,Instituto de Comunicación Social. Universidad Austral de Chile.
TkuKxkUAAAAJ,xp0zRBQAAAAJ,María Luisa Humanes,Full Professor (University Rey Juan Carlos- Spain)
TkuKxkUAAAAJ,ljCM--oAAAAJ,Dan Hallin,"Professor of Communication, University of California San Diego"
TkuKxkUAAAAJ,Fq9Ii_IAAAAJ,Mireya Márquez Ramírez,Universidad Iberoamericana Ciudad de México
TkuKxkUAAAAJ,G1qCc7QAAAAJ,Cornelia Mothes,"Macromedia University of Applied Sciences, Leipzig"
TkuKxkUAAAAJ,MMIThe0AAAAJ,Jacques Mick,"Federal University of Santa Catarina, Brazil"
TkuKxkUAAAAJ,XCiUQFIAAAAJ,MAGDALENA CLARO,Pontificia Universidad Católica de Chile
TkuKxkUAAAAJ,AOqp3aQAAAAJ,Macarena Bonhomme,"Assistant Professor, Universidad Autónoma de Chile. Investigadora Adjunta COES. PhD in Sociology"
TkuKxkUAAAAJ,GDB-FJcAAAAJ,Daniel Aguirre Azócar,Arizona State University
TkuKxkUAAAAJ,DkGFz5AAAAAJ,ROSEMBERG FRANCO,pontificia universidad catolica de chile
TkuKxkUAAAAJ,pJn6H7UAAAAJ,Luis E. Santana,Universidad Adolfo Ibañez
TkuKxkUAAAAJ,wo5pqCoAAAAJ,Eileen Hudson,Universidad del Desarrollo
TkuKxkUAAAAJ,yLLppm8AAAAJ,Laura Romero Vara,"phd candidate, Universidad Complutense de Madrid"
TkuKxkUAAAAJ,BUc-k1MAAAAJ,Dante Contreras,Departamento de Economía -  Universidad de Chile
TkuKxkUAAAAJ,sB4rgwUAAAAJ,patricio cabello,Universidad de Chile
TkuKxkUAAAAJ,qcMsaCUAAAAJ,Matías Dodel,"Department of Social Sciences, Universidad Catolica del Uruguay"
Vbua4BUAAAAJ,zY7NxXwAAAAJ,Gaston Llanes,"Assistant Professor of Strategy, Catholic University of Chile"
Vbua4BUAAAAJ,41uEXvgAAAAJ,Eugenio Giolito,Universidad del CEMA
Vbua4BUAAAAJ,VG8BD8oAAAAJ,Rodolfo Stucchi,"IDB Invest, Inter-American Development Bank Group"
h_eQpcAAAAAJ,agqX9ugAAAAJ,Walter Alejandro Imilan,Universidad Central de Chile
syJP-K4AAAAJ,-Di4rF4AAAAJ,Manuel Fuenzalida ,Universidad Alberto Hurtado
om-ISu0AAAAJ,QL-kdkIAAAAJ,Javier Fuenzalida,"Postdoctoral Research Fellow, Blavatnik School of Government, University of Oxford"
om-ISu0AAAAJ,6XHFLYQAAAAJ,Francisca Dussaillant,"Faculty of Government, UDD"
Pp5OczsAAAAJ,_7CvrPUAAAAJ,Francisco Javier Gil Llambias,USACH
Pp5OczsAAAAJ,Ki_VbJ0AAAAJ,Claudio Frites,"PhD, Universidad de Bristol"
XIpXcyIAAAAJ,gnk3CzoAAAAJ,Mauricio Pino-Yancovic,"CIAE, Universidad de Chile"
UhcAJbIAAAAJ,3SzLhtAAAAAJ,Antonia Larrain (https://orcid.org/0000-...,Universidad Alberto Hurtado
UhcAJbIAAAAJ,sonI9rQAAAAJ,Leonardo Soares e Silva,"Instituto Federal de Educação, Ciência e Tecnologia de Pernambuco"
UhcAJbIAAAAJ,b88ez_4AAAAJ,Antonio Mendes,"University of Coimbra, Portugal"
UhcAJbIAAAAJ,rKzDySYAAAAJ,Nancy Lizeth Ramírez Roncancio,"Docente de Psicología, Universidad Pedagógica y Tecnológica de Colombia"
UhcAJbIAAAAJ,c1myhEcAAAAJ,Anabela Gomes,Instituto Politécnico de Coimbra
UhcAJbIAAAAJ,g2x3438AAAAJ,Nadja Maria Vieira da Silva,Ufal
UhcAJbIAAAAJ,3Bm3kF0AAAAJ,Hernan Cofre Mardones,pontificia universidad catolica de valparaiso
UhcAJbIAAAAJ,VVbYroUAAAAJ,Maribel Calderón,Universidad Católica Silva Henriquez
UhcAJbIAAAAJ,ydMmGVsAAAAJ,Ignacio Brescó de Luna,"Ayudante Doctor, Universidad Autónoma de Madrid; External Researcher, Aalborg University"
UhcAJbIAAAAJ,ELFqKQMAAAAJ,João Roberto Ratis Tenório da Silva,"Professor de Química, Universidade Federal de Pernambuco"
UhcAJbIAAAAJ,cWFFzjwAAAAJ,Selma Leitão,"Professora de Psicologia, Universidade Federal de Pernambuco"
hhWf9PoAAAAJ,ExtPES4AAAAJ,Cristhian Figueroa,"CEDEUS, Pontificia Universidad Católica de Chile"
hhWf9PoAAAAJ,TbsLQXAAAAAJ,Loreto Rojas-Symmes,Académica Geografía
hhWf9PoAAAAJ,D89om1sAAAAJ,Daniel MORENO ALBA,
hhWf9PoAAAAJ,LBaWst0AAAAJ,Luis Bernardo Tonon Ordoñez,Universidad del Azuay
hhWf9PoAAAAJ,-xzDYUQAAAAJ,Carla Hermida,Universidad del Azuay
1Ji7xGAAAAAJ,dfLIUBwAAAAJ,Solon Moreira,Fox School of Business
1Ji7xGAAAAAJ,Gls-wooAAAAJ,Ana Burcharth (Ana Luiza Lara de Ara...,"Associate Professor in Innovation Management, Fundação Dom Cabral"
1-7CYlsAAAAJ,BSwQAGsAAAAJ,Daniel E. Finol-González,"Professor, Universidad del Zulia"
1-7CYlsAAAAJ,fhrr2_gAAAAJ,Juan Pablo Diaz Fuenzalida,Universidad Autónoma de Chile
1-7CYlsAAAAJ,Xm_XLgQAAAAJ,Sebastian Bozzo Hauri,"Profesor de derecho civil, Universidad Autónoma de Chile"
1-7CYlsAAAAJ,Nza5d-UAAAAJ,Pablo Contreras,Universidad Central de Chile
1-7CYlsAAAAJ,dj3N_HAAAAAJ,Francisco Javier Bedecarratz Scholz,"Profesor de Derecho penal, Universidad Autónoma de Chile"
1-7CYlsAAAAJ,ZSYUFU0AAAAJ,Salvador Leal W,La Universidad del Zulia- FCJP
WsAt0D8AAAAJ,UknWOrEAAAAJ,Bastián González-Bustamante,University of Oxford
WsAt0D8AAAAJ,CvfC2mMAAAAJ,Jairo Lugo-Ocando,"University of Sharjah, U.A.E."
WsAt0D8AAAAJ,KDyNVWsAAAAJ,Sara García Santamaría,Universitat Oberta de Catalunya
WsAt0D8AAAAJ,xttZAh0AAAAJ,Juan I. Venegas-Muggli,
WsAt0D8AAAAJ,N8qOSpAAAAAJ,Lorena B. Valderrama,Universidad de Santiago de Chile
qaam31UAAAAJ,69DPxiIAAAAJ,Gianinna Muñoz Arce,"Profesora Asociada, Departamento Trabajo Social, Universidad de Chile"
qaam31UAAAAJ,2Luja0YAAAAJ,Cristóbal Villalobos Dintrans,"Centro de Políticas y Prácticas en Educación (CEPPE UC), Pontificia Universidad Católica de Chile"
qaam31UAAAAJ,s-2CFoYAAAAJ,Taly Reininger,"Departamento de Trabajo Social, Universidad de Chile"
qaam31UAAAAJ,h5NgPksAAAAJ,Sandra Iturrieta Olivares,"Postdoctora IDEA- USACH. Doctora en Ciencias Sociales, Magíster en Análisis de Problemas Sociales"
FVIIDnsAAAAJ,p3KzpKsAAAAJ,Katherine Mansilla Obando,Universidad Finis Terrae
FVIIDnsAAAAJ,ESX6HXcAAAAJ,Nataly Guinez Cabrera,Universidad del Bío-Bío
FVIIDnsAAAAJ,Qlo5BzAAAAAJ,Viviana Fernandez,Universidad Adolfo Ibañez
FVIIDnsAAAAJ,ROCQFAUAAAAJ,Mauricio Castillo-Vergara,"Facultad de Economía y Negocios, Universidad Alberto Hurtado"
FVIIDnsAAAAJ,zUMMuRYAAAAJ,Cristian Geldes,Universidad Alberto Hurtado
FVIIDnsAAAAJ,2aJ0XT4AAAAJ,Tiago Alves Ferreira,Universidad Alberto Hurtado
FEvNeq8AAAAJ,eI_qScMAAAAJ,Ignacio Soto Silva,"Doctor en Musicología. Departamento de Humanidades y Artes, Universidad de Los Lagos"
FEvNeq8AAAAJ,PXbEm9UAAAAJ,Alicia Peñalba Acitores,Universidad de Valladolid
FEvNeq8AAAAJ,s0HuPMkAAAAJ,Javier Silva-Zurita,Universidad de Los Lagos
2aJ0XT4AAAAJ,9vHGU5wAAAAJ,Marcelo Pagliarussi,Associate Professor at University of São Paulo
2aJ0XT4AAAAJ,ROCQFAUAAAAJ,Mauricio Castillo-Vergara,"Facultad de Economía y Negocios, Universidad Alberto Hurtado"
2aJ0XT4AAAAJ,zUMMuRYAAAAJ,Cristian Geldes,Universidad Alberto Hurtado
2aJ0XT4AAAAJ,ABf2QTQAAAAJ,Marcelo Ortiz,"Assistant Professor, Universitat Pompeu Fabra"
2aJ0XT4AAAAJ,tW8cPncAAAAJ,Matias Braun,"Professor of Financial Economics, ESE Business School, Universidad de los Andes"
2E-3AeMAAAAJ,xVacvRgAAAAJ,Nicolás Pablo Barrientos Oradini,Universidad Miguel de Cervantes-Universidad Católica Silva Henríquez
2E-3AeMAAAAJ,U2zDNT8AAAAJ,Luis Araya-Castillo,"Decano, Facultad de Ingeniería y Empresa, Universidad Católica Silva Henríquez (UCSH)"
2E-3AeMAAAAJ,yPPAVVMAAAAJ,María Fernanda Juppet Ewing,"Profesor de Derecho, Economía y Mercado, Universidad del Desarrollo"
AEIa8-AAAAAJ,3SzLhtAAAAAJ,Antonia Larrain (https://orcid.org/0000-...,Universidad Alberto Hurtado
AEIa8-AAAAAJ,qbgd8TUAAAAJ,Nicolás Schöngut-Grollmus,Universidad de O'Higgins
AEIa8-AAAAAJ,ex8UIZ4AAAAJ,Alvaro Soto Roy,"Facultad de Psicología, Universidad Alberto Hurtado"
AEIa8-AAAAAJ,sIa8JN8AAAAJ,María Alejandra Energici,Académica Universidad Alberto Hurtado
AEIa8-AAAAAJ,UhcAJbIAAAAJ,Gabriel Fortes,Universidad Alberto Hurtado
