scholar_id_autor_gs,scholar_id_gs_coauthor,nombre_coauthor,cargo
vfBklcMAAAAJ,yKhQtvMAAAAJ,Yugo Hayashi,"Ritsumeikan University, Professor"
piYBGaIAAAAJ,OiAKfW0AAAAJ,Marcio Ajudarte Lopes,"Professor de Odontologia, Universidade Estadual de Campinas"
piYBGaIAAAAJ,YxS4Dj0AAAAJ,Pablo Agustin Vargas,"Professor of Oral Pathology, FRCPath - UNICAMP - Piracicaba - São Paulo State - Brazil"
piYBGaIAAAAJ,fEc2B-QAAAAJ,Ricardo D. Coletta,State University of Campinas
piYBGaIAAAAJ,MNRubfkAAAAJ,Alan Roger Santos-Silva,"Associate Professor in Oral Medicine and Pathology. Piracicaba Dental School, University of …"
piYBGaIAAAAJ,jTK3L6MAAAAJ,Lara Maria Alencar Ramos Innocentini,Cirurgiã-Dentista do Setor de Odontologia e Estomatologia do HCFMRP-USP
piYBGaIAAAAJ,qiiDifIAAAAJ,Pablo Olivero,"Professor (Associate), Universidad de Valparaiso"
piYBGaIAAAAJ,3fWOPJEAAAAJ,César Rivera,"Department of Stomatology, University of Talca, Chile"
piYBGaIAAAAJ,eYe4MxUAAAAJ,Lynne Bingle,"Reader, School of Clinical Dentistry, University of Sheffield"
piYBGaIAAAAJ,EeZqedMAAAAJ,Oslei Paes de Almeida,Professor da Faculdade de Odontologia de Piracicaba UNICAMP
piYBGaIAAAAJ,hezVHVUAAAAJ,Tuula Salo,Universidade Estadual de Campinas (Faculdade de Odontologia de Piracicaba)
piYBGaIAAAAJ,vey-6EgAAAAJ,Adriana Franco Paes Leme,"Group Leader and Head of Proteomics, Brazilian Biosciences National Laboratory, LNBio …"
piYBGaIAAAAJ,6ktrLJcAAAAJ,Andréia Aparecida da Silva,Professora do Programa de Pós Graduação em Biologia Oral da Universidade do Sagrado …
piYBGaIAAAAJ,kiHhY-gAAAAJ,Ciro Dantas Soares,"DDS, MS, PhD, University of Campinas"
piYBGaIAAAAJ,sS3nzYMAAAAJ,Celeste Sánchez Romero,"Profesora adjunta. Área de Patología Molecular. Facultad de Odontología, Universidad de la …"
piYBGaIAAAAJ,Uj-b-hwAAAAJ,Sven Eric Niklander,"Associate Professor, Universidad Andrés Bello"
piYBGaIAAAAJ,elbumr8AAAAJ,Paul M Speight,"School of Clinical Dentistry, University of Sheffield"
piYBGaIAAAAJ,VCUKoQwAAAAJ,Ramón Sotomayor-Zárate,Universidad de Valparaíso
piYBGaIAAAAJ,fwlLxmkAAAAJ,Roman Carlos,"Oral and Maxillofacial Pathologist, Centro Clínico de Cabeza y Cuello, Guatemala"
piYBGaIAAAAJ,PDu-4swAAAAJ,Oslei Paes de Almeida,Professor de Patologia Oral 
piYBGaIAAAAJ,9pK2VZkAAAAJ,Jorge Esquiche León,"Professor Doutor, Patologia Oral, Departamento de Estomatologia, Saúde Coletiva e …"
piYBGaIAAAAJ,oNklzM4AAAAJ,Ariane Fidelis Busso Lopes,UNICAMP
TgcEHCAAAAAJ,6j9txwIAAAAJ,Nico Voigtländer,UCLA Anderson School of Management
TgcEHCAAAAAJ,wQUy7CAAAAAJ,Roberto Álvarez ,University of Chile
TgcEHCAAAAAJ,Z8zHERAAAAAJ,Claudio Bravo-Ortega,"Escuela de Negocios, Universidad Adolfo Ibañez"
TgcEHCAAAAAJ,CUIWcyIAAAAJ,Tim Schmidt-Eisenlohr,Federal Reserve Board
TgcEHCAAAAAJ,gHYMJZ0AAAAJ,William F. Maloney,"Chief Economist for Latin America and the Caribbean, The World Bank"
TgcEHCAAAAAJ,-mTyoWEAAAAJ,Ana Cusolito,World Bank
TgcEHCAAAAAJ,WMXMWYcAAAAJ,Francis Longstaff,UCLA
e_0UrIMAAAAJ,rVVdDTMAAAAJ,luis quezada,Universidad de Santiago
e_0UrIMAAAAJ,Q81kXv4AAAAJ,Pedro Palominos Belmar,University of Santiago of Chile
e_0UrIMAAAAJ,T0dxGFkAAAAJ,Juan Pérez,"Associate Professor, Universidad de Los Andes de Chile"
e_0UrIMAAAAJ,QFM-nmkAAAAJ,Ricardo A. Barros-Castro,"Profesor Asistente, Departamento de Ingeniería Industrial, Pontificia Universidad Javeriana"
e_0UrIMAAAAJ,6vH9bBsAAAAJ,Esneyder Rafael Gonzalez Ponzon,University at Buffalo
e_0UrIMAAAAJ,IP4nq34AAAAJ,Gabriel Zambrano Rey,Full Time Professor at :  Pontificia Universidad Javeriana (grid.41312.35 / ROR 03etyjw28)
e_0UrIMAAAAJ,BbMk4DcAAAAJ,Katherine Palacio,Universidad del Norte
e_0UrIMAAAAJ,dOUSOn4AAAAJ,César Augusto Henao Botero,"Assistant Professor, Universidad del Norte"
e_0UrIMAAAAJ,Ez2lq94AAAAJ,Andrés Felipe Porto Solano,Corporación Universitaria Americana
e_0UrIMAAAAJ,SSSfK8gAAAAJ,Francisco Martinez,"Professor of Civil Engineering, University of Chile"
e_0UrIMAAAAJ,JVw002sAAAAJ,Mauricio Restrepo,Universidad Militar Nueva Granada
e_0UrIMAAAAJ,kn7udTEAAAAJ,Felix Caicedo,UTEC - Universidad de Ingenieria y Tecnologia del Peru
e_0UrIMAAAAJ,061r1QMAAAAJ,Iván Castillo-López,
e_0UrIMAAAAJ,oyu6P04AAAAJ,David Barrera Ferro,Pontificia Universidad Javeriana
e_0UrIMAAAAJ,VgRSHRIAAAAJ,Francisco Sabatini,"Profesor titular, Universidad del Bio Bio, Chile; profesor titular, U. Católica de Chile"
e_0UrIMAAAAJ,sFKzT4IAAAAJ,Alejandra Rasse,Pontificia Unviersidad Católica de Chile
e_0UrIMAAAAJ,1N8BNr8AAAAJ,Juan-Carlos Ferrer O.,Professor
e_0UrIMAAAAJ,4OSVUs0AAAAJ,Virginia I. González,"Profesor Catedrático, Universidad del Norte"
e_0UrIMAAAAJ,xPu0Tx0AAAAJ,Edgar Gutierrez Franco,"Massachusetts Institute of Technology, Engineering Systems Division"
e_0UrIMAAAAJ,oXMek3wAAAAJ,Luz Elena Gutiérrez López,Investigador
e_0UrIMAAAAJ,9BP2YJYAAAAJ,Andrés García Echalar,"Universidad de los Andes, Chile"
e_0UrIMAAAAJ,TGW-auAAAAAJ,Claudio Telha,Universidad de los Andes
e_0UrIMAAAAJ,wwichKMAAAAJ,Ricardo Fuentes Borrero,Universidad de la costa
e_0UrIMAAAAJ,X5TwrswAAAAJ,Victor Cantillo,"Department of Civil and Environmental Engineering, Universidad del Norte"
e_0UrIMAAAAJ,O0V400IAAAAJ,Sergio Llano Aristizábal,Professor
e_0UrIMAAAAJ,9H859BEAAAAJ,Carlos A. Gonzalez-Calderon,"Associate Professor of Transportation Engineering, Universidad Nacional de Colombia"
e_0UrIMAAAAJ,K9GPK0sAAAAJ,Jhan Kevin Gil-Marin,"Graduate Research Assistant, University of Maine"
e_0UrIMAAAAJ,3emwvrkAAAAJ,"Posada-Henao, John Jairo",Universidad Nacional de Colombia
e_0UrIMAAAAJ,eXCDGeIAAAAJ,DIANA PATRICIA MORENO PALACIO,"Cdta Ph.D en Ingenieria Civil, UNAL, Medellín, Colombia. Profesora Facultad de Ingeniería …"
X0HbXjcAAAAJ,INBSXpMAAAAJ,miguel nussbaum,Pontificia Universidad Catolica de Chile
X0HbXjcAAAAJ,Ed_lSQEAAAAJ,Ruben Mitnik,Pontificia Universidad Católica de Chile
X0HbXjcAAAAJ,vfBklcMAAAAJ,Claudio Alvarez,"Associate Professor of Computer Science, Universidad de los Andes, Chile"
7MPNMlkAAAAJ,BamCl30AAAAJ,ALBERTO VERGARA-FERNANDEZ,Universidad de los Andes - Chile
7MPNMlkAAAAJ,wacf2BUAAAAJ,German Aroca,"Professor of Biochemical Engineering, P. Universidad Católica de Valparaíso"
7MPNMlkAAAAJ,C_j2EAIAAAAJ,Patricio Moreno-Casas,Facultad de Ingeniería y Ciencias Aplicadas
7MPNMlkAAAAJ,9yAcyygAAAAJ,"Diaz-Robles, LA","Titular Professor at the Department of Chemical Engineering, University of Santiago of Chile"
7MPNMlkAAAAJ,DUKAx64AAAAJ,Raul Muñoz (ORCID:0000-0003-1207-6275),Universidad de Valladolid
7MPNMlkAAAAJ,a9IzwRQAAAAJ,Carlos Vera,Universidad de Santiago de Chile
7MPNMlkAAAAJ,aEwXKoIAAAAJ,Luz Francy Yañez Meneses,PhD - Universidad de Los Andes - Universidad de Valladolid
7MPNMlkAAAAJ,RXVPYWAAAAAJ,Sergio Revah M,Universidad Autónoma Metropolitana
7MPNMlkAAAAJ,dy058aIAAAAJ,Cecilia Guerrero,Pontificia Universidad Católica de Valparaíso
7MPNMlkAAAAJ,iWXYxnAAAAAJ,Carlos Ariel Cardona,Universidad Nacional de Colombia sede Manizales. Grupo de investigación PQCB …
7MPNMlkAAAAJ,Tk0UCx8AAAAJ,Julián Quintero,Assistant professor
7MPNMlkAAAAJ,xgAAhdUAAAAJ,Manuel O. Caceres,"Centro Atómico Bariloche (CNEA), Instituto Balseiro (Univ. Nac. Cuyo), CONICET"
7MPNMlkAAAAJ,-T_EJhYAAAAJ,José Delpiano,"University of the Andes, Santiago, Chile"
7MPNMlkAAAAJ,V_Uvj-EAAAAJ,David B. Hodge,"Professor, Chemical Engineering, Montana State University"
7MPNMlkAAAAJ,pSbHlisAAAAJ,Muyang Li,Alliance Pharma
7MPNMlkAAAAJ,nT5GXhkAAAAJ,FRANCISCO  CAICEDO,"Profesor Ingeniería Ambiental, Universidad Mariana"
7MPNMlkAAAAJ,mcmCTfQAAAAJ,Jose A. Abell M.,"Universidad de los Andes, Chile"
7MPNMlkAAAAJ,3wdvl_4AAAAJ,Armando González-Sánchez,"UNIVERSIDAD NACIONAL AUTONOMA DE MEXICO, INSTITUTO DE INGENIERIA"
7MPNMlkAAAAJ,3qVOXEIAAAAJ,Kattia Núñez-Montero,"Facultad de Ciencias de la Salud, Universidad Autónoma de Chile"
7MPNMlkAAAAJ,q2ulOOQAAAAJ,Olman Gómez-Espinoza,"Investigador, Universidad de La Frontera"
7MPNMlkAAAAJ,WkGN7u4AAAAJ,Claudia Troncoso Pantoja,Universidad Católica de la Santísima Concepción
7MPNMlkAAAAJ,iitJzzwAAAAJ,Ehecatl Antonio del Río Chanona,"Sargent Centre for Process Systems Engineering, Imperial College London"
7MPNMlkAAAAJ,_HcmJWYAAAAJ,Craig Bakker,Pacific Northwest National Laboratory
7MPNMlkAAAAJ,Zqnrn8AAAAAJ,José A Caballero,University of Alicante
7MPNMlkAAAAJ,VTo6lMwAAAAJ,Ming-Jun Li,Corning Incorporated
7MPNMlkAAAAJ,WCpJcVwAAAAJ,Carlos Vera,"Professor of Chemical Engineering, Universidad Nacional del Litoral"
wwvxqlsAAAAJ,CG1l1VcAAAAJ,Mireia Las Heras,"Leadership Professor, IESE Business School, University of Navarra"
wwvxqlsAAAAJ,pzQhhegAAAAJ,yasin rofcanin,University of Bath School of Management
wwvxqlsAAAAJ,Bci79BUAAAAJ,Jakob Stollberger,Vrije Universiteit Amsterdam
wwvxqlsAAAAJ,Kpqgd78AAAAJ,Elise Marescaux,"Associate Professor HRM, IESEG School of Management, France"
wwvxqlsAAAAJ,ikBS2GkAAAAJ,Farooq Mughal,"Associate Professor, School of Management, University of Bath"
wwvxqlsAAAAJ,g7sYIXcAAAAJ,Chidiebere Ogbonnaya,"Professor of Human Resource Management, University of Kent"
wwvxqlsAAAAJ,dtxAWd8AAAAJ,Ciara Kelly,University of Sheffield
wwvxqlsAAAAJ,0J11CzMAAAAJ,Pablo Cardona Soriano,"Decano Empresa y Comunicación, Universidad Internacional de la Rioja"
wwvxqlsAAAAJ,vD-3LHkAAAAJ,Anneloes Raes,IESE business school
wwvxqlsAAAAJ,NPMNOwkAAAAJ,Marc Grau-Grau,Universitat Internacional de Catalunya
wwvxqlsAAAAJ,qYXxeUIAAAAJ,Marcello Russo,"Full Professor of Organizational Behavior, University of Bologna, Italy"
wwvxqlsAAAAJ,7Ejx47YAAAAJ,Sandra Idrovo Carlier,INALDE Universidad de La Sabana
wwvxqlsAAAAJ,SNM9OtoAAAAJ,Remus Ilies,Bocconi University and National University of Singapore
wwvxqlsAAAAJ,eP6U97MAAAAJ,Geoffrey Wood,Western University
wwvxqlsAAAAJ,giRtLnoAAAAJ,Cristóbal Benavides,Facultad de Comunicación Universidad de los Andes
wwvxqlsAAAAJ,y8wPcloAAAAJ,Sowon Kim,"Associate Prof., EHL, University of Applied Sciences and Arts Western Switzerland"
u4694x0AAAAJ,lr3i9z4AAAAJ,Ehsan Nikbakht,Hofstra University
u4694x0AAAAJ,jPsYze4AAAAJ,Claudio A. Bonilla,University of Chile
u4694x0AAAAJ,y3jDk8sAAAAJ,Apostolos Serletis,"Professor of Economics, University of Calgary"
u4694x0AAAAJ,YXDSFOAAAAAJ,Rafael Romero-Meza,Associate Professor in Finance Universidad Alberto Hurtado
u4694x0AAAAJ,-CVH0b0AAAAJ,Andrew Spieler,"Professor of Finance, Hofstra University"
u4694x0AAAAJ,g9P1Y3YAAAAJ,Stephen B. McKeon,University of Oregon
ORnUW54AAAAJ,6h38AR0AAAAJ,Erica Salvaj,Universidad del Desarrollo (Chile) & Universidad de San Andres (Argentina)
ORnUW54AAAAJ,hDOXQJ0AAAAJ,Cristina Aced,Colaboradora docente en Universitat Oberta de Catalunya
ORnUW54AAAAJ,L4p_QqkAAAAJ,Eva Reinares-Lara [ORCID: 0000-000...,Universidad Rey Carlos
ORnUW54AAAAJ,ben-uhQAAAAJ,Christian Barrot,Kühne Logistics University
ORnUW54AAAAJ,vx6im04AAAAJ,Jan U. Becker,Kühne Logistics University
ORnUW54AAAAJ,Qzl7WeYAAAAJ,Sebastián Maldonado,"Department of Management Control and Information Systems, University of Chile & ISCI"
ORnUW54AAAAJ,3vUZQDkAAAAJ,C. Angelo Guevara,"Associate Professor, Department of Civil Engineering, Universidad de Chile"
VPQYt1IAAAAJ,Qzl7WeYAAAAJ,Sebastián Maldonado,"Department of Management Control and Information Systems, University of Chile & ISCI"
VPQYt1IAAAAJ,7EB5IpEAAAAJ,Julio C. López Luis,"Instituto de Ciencias Básicas, Facultad de Ingeniería y Ciencias, Universidad Diego Portales"
VPQYt1IAAAAJ,MVtcwVwAAAAJ,Rosa Alarcon,"Computer Science Department, Pontificia Universidad Católica de Chile"
VPQYt1IAAAAJ,Rs_HIpMAAAAJ,Rosa G. González-Ramírez,"Universidad de Los Andes, Chile"
VPQYt1IAAAAJ,HULIk-QAAAAJ,Francisco Herrera,"Professor Computer Science and AI, Granada University, Spain"
VPQYt1IAAAAJ,t3pMxGsAAAAJ,Urbieta Matias,
VPQYt1IAAAAJ,yWSPks4AAAAJ,Jesus Edwin Bellido Angulo,Universidad de Ingeniería y Tecnología - UTEC
VPQYt1IAAAAJ,XPVXCCkAAAAJ,Carlos Rodriguez,UCA - UCOM - UNSW Sydney (Visiting Fellow)
VPQYt1IAAAAJ,pZL8Jj8AAAAJ,Florian Daniel,Politecnico di Milano
VPQYt1IAAAAJ,dqZ9o5oAAAAJ,Jorge Saldivar,Pompeu Fabra University
VPQYt1IAAAAJ,eLf2e-gAAAAJ,Fabio Casati,University of Trento
VPQYt1IAAAAJ,uB4MBw4AAAAJ,Ana Moreira,Universidade Nova de Lisboa
VPQYt1IAAAAJ,tP9cyo0AAAAJ,Joao Araujo,"Associate Professor, Universidade Nova de Lisboa"
VPQYt1IAAAAJ,qqgXKN8AAAAJ,Gustavo Rossi,"Professor of Computer Science, LIFIA, F. Informatica,Universidad Nacional de La Plata and …"
VPQYt1IAAAAJ,Ls9Ot_wAAAAJ,Silvia Gordillo,"LIFIA, Facultad de Informatica, UNLP"
VPQYt1IAAAAJ,HBpQRqwAAAAJ,Eugenio Martínez Cámara,"Junior lecturer, Universidad de Jaén"
VPQYt1IAAAAJ,T0dxGFkAAAAJ,Juan Pérez,"Associate Professor, Universidad de Los Andes de Chile"
VPQYt1IAAAAJ,mfk3VKEAAAAJ,Carlos Cares,Professor at University of La Frontera
VPQYt1IAAAAJ,r7ISNNYAAAAJ,Cesare Pautasso,"University of Lugano (USI), Switzerland"
VPQYt1IAAAAJ,0rpoLewAAAAJ,LUIS M. ASCENCIO,Universidad de Los Andes Chile
VPQYt1IAAAAJ,s-0VFjEAAAAJ,J Mar-Ortiz,Professor
VPQYt1IAAAAJ,_cSH2V4AAAAJ,Maria D. Gracia,Universidad Autónoma de Tamaulipas
VPQYt1IAAAAJ,Fk9_zQMAAAAJ,Alejandra Gomez Padilla,Universidad de Guadalajara
VPQYt1IAAAAJ,9RaLGI4AAAAJ,Flavio Soares Correa da Silva,"Professor of Computer Science, University of Sao Paulo"
VPQYt1IAAAAJ,jqF_g6YAAAAJ,Claudia Josimar Abrão de Araújo,USP
VPQYt1IAAAAJ,l7LeMVwAAAAJ,Jorge Hochstetter,Universidad de La Frontera
RqPOQGgAAAAJ,lLupDb8AAAAJ,Ezequiel Molina,"Economist at the Education Global Practice, World Bank"
RqPOQGgAAAAJ,1MprVIsAAAAJ,Pelusa Orellana,Universidad de los Andes
RqPOQGgAAAAJ,3uSYa3wAAAAJ,Bridget Hamre,"Research Associate Professor, University of Virginia"
RqPOQGgAAAAJ,aSrYArEAAAAJ,Sara Schodt,Inter-American Development Bank
RqPOQGgAAAAJ,o8NLdz8AAAAJ,Yyannu Cruz Aguayo,"Senior Economist, Inter-American Development Bank"
RqPOQGgAAAAJ,3Epc-A4AAAAJ,JENNIFER LOCASALE-CROUCH,University of Virginia
RqPOQGgAAAAJ,TKPXmlAAAAAJ,Robert C. Pianta,"Professor of Education, University of Virginia"
RqPOQGgAAAAJ,oxiFUrEAAAAJ,Andrew Ho,"Charles William Eliot Professor of Education, Harvard University"
RqPOQGgAAAAJ,9K0sZpIAAAAJ,Jamie DeCoster,"CASTL, University of Virginia"
RqPOQGgAAAAJ,_GhvGZMAAAAJ,Sonia Q. Cabell,Florida State University
RqPOQGgAAAAJ,INBSXpMAAAAJ,miguel nussbaum,Pontificia Universidad Catolica de Chile
RqPOQGgAAAAJ,6eSydqQAAAAJ,Jill Fitzgerald,The University of North Carolina at Chapel Hill
RqPOQGgAAAAJ,nAclUAEAAAAJ,Paula Baldwin,Western Oregon University
mcmCTfQAAAAJ,eP7ec6sAAAAJ,Federico Pisanò,Manager Offshore Wind USA (NGI) and Associate Professor (TU Delft)
mcmCTfQAAAAJ,qweXZrIAAAAJ,Boris Jeremic,"University of California, Davis; Lawrence Berkeley National Laboratory, Berkeley"
mcmCTfQAAAAJ,elAF1qMAAAAJ,Sumeet Kumar Sinha,"Assistant Professor, IIT Delhi"
mcmCTfQAAAAJ,IBickB0AAAAJ,Haoyuan Liu,Norwegian Geotechnical Institute (NGI)
mcmCTfQAAAAJ,vGe4VTMAAAAJ,Andrea Diambra,University of Bristol
mcmCTfQAAAAJ,PAQpz1kAAAAJ,Yuan FENG,Universit of California Davis
mcmCTfQAAAAJ,udU20S4AAAAJ,Han Yang,"Postdoctoral Researcher at University of California, Davis"
mcmCTfQAAAAJ,xZ-Y9HQAAAAJ,Charles Wicks,US Geological Survey
mcmCTfQAAAAJ,C_j2EAIAAAAJ,Patricio Moreno-Casas,Facultad de Ingeniería y Ciencias Aplicadas
mcmCTfQAAAAJ,ULq5FOMAAAAJ,Evangelos Kementzetzidis,Delft University of Technology
mcmCTfQAAAAJ,GLwW01cAAAAJ,Rodrigo Astroza,"Associate Professor, Universidad de los Andes - Chile"
mcmCTfQAAAAJ,7MPNMlkAAAAJ,Felipe Scott,Universidad de los Andes
mcmCTfQAAAAJ,BamCl30AAAAJ,ALBERTO VERGARA-FERNANDEZ,Universidad de los Andes - Chile
mcmCTfQAAAAJ,-T_EJhYAAAAJ,José Delpiano,"University of the Andes, Santiago, Chile"
mcmCTfQAAAAJ,XqqJ84gAAAAJ,Christian Ledezma,Pontificia Universidad Catolica de Chile
mcmCTfQAAAAJ,VAamLcEAAAAJ,Shideh Dashti,"Assistant Professor of Geotechnical Engineering and Geomechanics, University of Colorado …"
mcmCTfQAAAAJ,X0HbXjcAAAAJ,Matias Recabarren,"Research Professor, Universidad de los Andes, Chile"
mcmCTfQAAAAJ,QLPrt30AAAAJ,Jorge GF Crempien,"Professor of Engineering, Pontificia Universidad Catolica de Chile"
mcmCTfQAAAAJ,lWous8UAAAAJ,César Pastén,Geotechnical Engineer
mcmCTfQAAAAJ,8ZZA-BMAAAAJ,Juan Pablo Toro,Universidad Andres Bello
mcmCTfQAAAAJ,NYctf3QAAAAJ,Joongcheol Paik,Gangneung-Wonju National University
di4ydlEAAAAJ,YrNqhkYAAAAJ,Rodrigo Uribe,universidad de chile
di4ydlEAAAAJ,Hlfb1Q8AAAAJ,Patrick De Pelsmacker,University of Antwerp
di4ydlEAAAAJ,ovf4UnMAAAAJ,Nathalie Dens,"Professor of marketing, University of Antwerp"
di4ydlEAAAAJ,ci5e3CkAAAAJ,Guda van Noort,"Professor, Universiteit van Amsterdam"
di4ydlEAAAAJ,hi0JkZoAAAAJ,Hilde Voorveld,"Associate Professor of Persuasion & New Media Technologies, Amsterdam School of Communication"
di4ydlEAAAAJ,P0LCVa0AAAAJ,Freya De Keyzer,"Erasmus University Rotterdam, University of Antwerp and KU Leuven"
di4ydlEAAAAJ,Cev_0eYAAAAJ,Camilla Barbarossa,Toulouse Business School
di4ydlEAAAAJ,FKk7bw4AAAAJ,ingrid moons,universiteit antwerpen
di4ydlEAAAAJ,NoPu4cYAAAAJ,Ana Isabel Lopes,Vrije Universiteit Amsterdam
JdI1dwwAAAAJ,MxTugE8AAAAJ,Marcelo Giannini,"Professor de Odontologia, Universidade Estadual de Campinas"
JdI1dwwAAAAJ,EBvKaOUAAAAJ,Richard B. Price,"Professor of Prosthodontics, Cross-appointed in Biomedical Engineering,  Dalhousie University"
JdI1dwwAAAAJ,xoCk6DMAAAAJ,Maicon Sebold,"DDS, MSc, PhD Student, University of Campinas"
JdI1dwwAAAAJ,4RJ0QzUAAAAJ,Jorge Soto-Montero,"DDS, MS, MS, PhD. Invited Scholar, Universidad de Costa Rica"
JdI1dwwAAAAJ,mvhbiZMAAAAJ,Carolina Bosso Andre,"D.D.S., M.Sc., Ph.D., Adjunct Professor - UFMG"
JdI1dwwAAAAJ,GiEuzgEAAAAJ,Regina Guenka Palma-Dibb,Universidade de Sao Paulo - FORP
JdI1dwwAAAAJ,9DaYCusAAAAJ,Juliana Jendiroba Faraoni,"Pesquisadora, Universidade de São Paulo"
JdI1dwwAAAAJ,9Ak0bCAAAAAJ,Carlos Tadeu dos Santos Dias,"Professor Titular de Estatística Experimental e Análise Multivariada, Universidade de São Paulo"
JdI1dwwAAAAJ,W82eDhIAAAAJ,Glaucia Bovi Ambrosano,Professora Titular de Bioestatística da FOP/UNICAMP
JdI1dwwAAAAJ,M8Wt5RoAAAAJ,Carlos José Soares,"Professor Odontologia, Faculdade de Odontologia, Universidade Federal de Uberlândia"
JdI1dwwAAAAJ,2Xxd1tsAAAAJ,Simonides Consani,"Professor titular Faculdade de Odontologia de Piracicaba, Unicamp"
JdI1dwwAAAAJ,vB4saPkAAAAJ,Vanessa Cavalli Gobbo,Piracicaba Dental School - University of Campinas
JdI1dwwAAAAJ,P4quyeAAAAAJ,ANA MARIA DIAZ SORIANO,"Profesora de Metodología de la Investigación, UNMSM"
JdI1dwwAAAAJ,jv4m80gAAAAJ,ANTONIA FLORENCIA CASTRO ROD...,Profesora principal de la Facultad de Odontolo{ia de la Universidad Nacional Mayoor de San Marcos
ezuHKksAAAAJ,LYs24xAAAAAJ,María Natalia Castillo Fadic,"Profesora asociada, Pontificia Universidad Católica de Chile"
ezuHKksAAAAJ,lexz9BMAAAAJ,Federico Navarro,Universidad de O'Higgins
ezuHKksAAAAJ,zK3rvY0AAAAJ,Fernanda Uribe Gajardo,Universidad de Chile
ezuHKksAAAAJ,PHAib6MAAAAJ,RENE VENEGAS VELÁSQUEZ,Pontificia Universidad Católica de Valparaíso
ezuHKksAAAAJ,fNdjYCoAAAAJ,José Joaquín Atria,"MPhil/PhD student, University College London"
ezuHKksAAAAJ,DnfIVU0AAAAJ,Paula Morgado Fernández,"Docente de Terminología, Lexicología y Alfabetización Académica"
ezuHKksAAAAJ,vUP5i-IAAAAJ,Fernando Lillo-Fuentes,PUCV
ezuHKksAAAAJ,GgEFmHgAAAAJ,Sofía Zamora Herrera,Pontificia Universidad Católica de Valparaíso
ezuHKksAAAAJ,tiGziuwAAAAJ,Erika Diaz-Suazo,UNIVERSIDAD DE PLAYA ANCHA
Cs5cHQUAAAAJ,i5sBsy0AAAAJ,Mauricio Lopez,Pontificia Universidad Catolica de Chile
Cs5cHQUAAAAJ,lFkrYpwAAAAJ,Kimberly (Kim) Kurtis,"Raymond Allen Jones Chair and Professor, Civil & Environmental Engineering and Materials Science"
Cs5cHQUAAAAJ,OtgBAKAAAAAJ,Mehdi Rashidi,Sublime Systems
Cs5cHQUAAAAJ,5q1HqdwAAAAJ,Laurence J Jacobs,Georgia Institute of Technology
Cs5cHQUAAAAJ,smC3luYAAAAJ,Lawrence Kahn,"Professor Emeritus of Civil Engineering, Georgia Institute of Technology"
Cs5cHQUAAAAJ,l-lr_mQAAAAJ,Felipe Vargas,Universidad Austral de Chile
Cs5cHQUAAAAJ,hc8TtsEAAAAJ,Ivan Navarrete,Pontificia Universidad Católica de Chile
Cs5cHQUAAAAJ,oz4221cAAAAJ,Franco Zunino,"SNSF Ambizione Fellow, Scientist on Ultra-green concrete @ ETH Zürich, Switzerland"
Cs5cHQUAAAAJ,C_j2EAIAAAAJ,Patricio Moreno-Casas,Facultad de Ingeniería y Ciencias Aplicadas
Cs5cHQUAAAAJ,-T_EJhYAAAAJ,José Delpiano,"University of the Andes, Santiago, Chile"
Cs5cHQUAAAAJ,iJRulSoAAAAJ,Magdalena Walczak,Pontificia Universidad Católica de Chile
Cs5cHQUAAAAJ,AqrDFI8AAAAJ,Preet M. Singh,"Professor of Materials Science and Engineering, Georgia Institute of Technology"
Cs5cHQUAAAAJ,VU4YMWcAAAAJ,"Qingxu ""Bill"" Jin","Assistant Professor, Michigan State University"
Cs5cHQUAAAAJ,YcebgwsAAAAJ,Carolina Guerra Figueroa,Pontificia Universidad Católica de Chile
Cs5cHQUAAAAJ,79bcdT8AAAAJ,Mamie Sancy,Pontificia Universidad Católica de Chile
NynEwzEAAAAJ,7T7o27QAAAAJ,Damián Gulich,"Professor, Facultad de Ingeniería - UNLP. CIOp, CONICET"
NynEwzEAAAAJ,4wSoWR8AAAAJ,Luciano Zunino (L. Zunino),"Independent Researcher at CIOp (CONICET - CIC - UNLP), Argentina"
NynEwzEAAAAJ,0W-BzeAAAAAJ,Jaime A. Anguita,"Professor, Universidad de los Andes - Chile"
KC8FCFgAAAAJ,MWpVJsAAAAAJ,Beatriz Eugenia Suarez Lopez,"Profesora de Derecho, Universidad Jorge Tadeo Lozano"
KC8FCFgAAAAJ,orxV15oAAAAJ,Daniel Rivas-Ramírez,Instituto Internacional de Derechos Humanos - Colombia
KC8FCFgAAAAJ,B-QpibgAAAAJ,Luz Eliyer Cárdenas-Contreras,Universidad de los Andes - Chile
KC8FCFgAAAAJ,nn7eeIsAAAAJ,Yenny Andrea Celemin Caicedo,Profesora Universidad de los Andes- Facultad de Derecho
KC8FCFgAAAAJ,-rTqfxIAAAAJ,Rodrigo Andres Poyanco Bugueno,Universidad Finis Terrae
KC8FCFgAAAAJ,93SEyFAAAAAJ,Carolina Rolim Machado Cyrillo da Sil...,"Professora, Universidade Federal do Rio de janeiro"
KC8FCFgAAAAJ,QPgfdpoAAAAJ,Siddharta Legale,Professor de Constitucional da Universidade Federal do Rio de Janeiro (UFRJ)
KC8FCFgAAAAJ,aEVvF-0AAAAJ,Bernardo Abreu de Medeiros,"Pesquisador, Instituto de Pesquisa Economica Aplicada"
KC8FCFgAAAAJ,q0URXIAAAAAJ,Paola Andrea Acosta-Alvarado,"Docente-investigadora, Departamento de Derecho Constitucional, Universidad Externado de Colombia"
KC8FCFgAAAAJ,D9LVr-kAAAAJ,Oscar Mejía Quintana,"Profesor Titular, Facultad de Derecho, Ciencias Políticas y Sociales, Universidad Nacional de Colombia"
KC8FCFgAAAAJ,z1ThmkUAAAAJ,Marcela Ines Peredo Rojas,"Universidad de los Andes, Chile"
KC8FCFgAAAAJ,5l05WV0AAAAJ,Fabia Fernandes Carvalho Veçoso or...,Postdoctoral Fellow with the Laureate Program in International Law at Melbourne Law School
KC8FCFgAAAAJ,YCVEkqUAAAAJ,Iván Garzón Vallejo,Universidad Autónoma de Chile
KC8FCFgAAAAJ,sEtpZgMAAAAJ,Thais Janaina Wenczenovicz,DOCENTE CIENCIAS HUMANAS E SOCIAIS
KC8FCFgAAAAJ,kqKDg1kAAAAJ,Cesar Evangelista Fernandes Bressanin,Historiador; professor de História; Pedagogo
KC8FCFgAAAAJ,aTF8R8kAAAAJ,Samara Taiana de Lima Silva,Universidade Federal da Paraíba (UFPB)
KC8FCFgAAAAJ,WOXFM2cAAAAJ,Razón Crítica - Revista de Estudios Ju...,Universidad de Bogotá Jorge Tadeo Lozano
KC8FCFgAAAAJ,ctABJpEAAAAJ,Hernan Alejandro Olano,Profesor Investigador y Rector
KC8FCFgAAAAJ,exMKlrAAAAAJ,Raúl Gustavo Ferreyra,Universidad de Buenos Aires
ob5lXR0AAAAJ,HI6m-dsAAAAJ,Henry Levin,"Professor of Economics and Education, Teachers College, Columbia University"
ob5lXR0AAAAJ,3Q8fRI8AAAAJ,Fiona Hollands,
ob5lXR0AAAAJ,g5I6UbMAAAAJ,Clive Belfield,"Queens College, City University of New York"
3s5njSoAAAAJ,CZXPau8AAAAJ,Marcela Tenorio,Universidad de los Andes (Chile)
3s5njSoAAAAJ,JGnWbeIAAAAJ,Andrés Aparicio,Millennium Institute for Caregiving Research (MICARE)
3s5njSoAAAAJ,LrxXEa0AAAAJ,Ricardo Rosas,"Professor, School of Psychology, Pontificia Universidad Catolica de Chile"
3s5njSoAAAAJ,PBJdBVsAAAAJ,José- Pablo Escobar,Pontificia Universidad Católica de Chile
3s5njSoAAAAJ,4WVyA4YAAAAJ,Francisco Ceric G.,"Facultad de Psicologia, Laboratorio de Neurociencia Afectiva (CARE), Universidad del Desarrollo"
ZuyDQH4AAAAJ,JufKOBkAAAAJ,Heikki Hämmäinen,"Professor, Aalto University"
ZuyDQH4AAAAJ,beEZ21wAAAAJ,Marja Matinmikko-Blue,"University Researcher, University of Oulu"
ZuyDQH4AAAAJ,AhDz6fEAAAAJ,Varadharajan Sridhar,International Institute of Information Technology Bangalore
ZuyDQH4AAAAJ,d-j2P6cAAAAJ,Benjamin Finley,"Postdoc Researcher, University of Helsinki"
ZuyDQH4AAAAJ,52l_IewAAAAJ,Adrian Kliks,Poznan University of Technology
ZuyDQH4AAAAJ,LsT_G4kAAAAJ,Vladimir Marianov,"Professor, Pontificia Universidad Católica de Chile"
ZuyDQH4AAAAJ,hdxxD_UAAAAJ,ricardo paredes,"Profesor de Economía, PUC"
PDybW_kAAAAJ,1_-UBpIAAAAJ,Alejandro Miranda Montecinos,"Profesor de Filosofía del Derecho, Universidad de los Andes, Chile"
PDybW_kAAAAJ,KEni5cUAAAAJ,Anastasía Assimakópulos,"Profesor de Derecho Canónico, Universidad de los Andes, Chile"
vMCCqa8AAAAJ,UGlSd5kAAAAJ,Sergio Urzua,University of Maryland
0rpoLewAAAAJ,Rs_HIpMAAAAJ,Rosa G. González-Ramírez,"Universidad de Los Andes, Chile"
0rpoLewAAAAJ,yGAw5AoAAAAJ,Frederik Schulte,"Assistant Professor, Delft University of Technology"
0rpoLewAAAAJ,PuMO0YsAAAAJ,Stefan Voß,"Professor of Information Systems, University of Hamburg"
0ngEy-EAAAAJ,hz8HIioAAAAJ,Shinnosuke Takahashi,"Lecturer in Japanese, Victoria University of Wellington"
0ngEy-EAAAAJ,yqBVxFsAAAAJ,Maria Montt Strabucchi,Pontificia Universidad Católica de Chile
0ngEy-EAAAAJ,lNT-rHQAAAAJ,Robert Cribb,"Professor of Asian History, Australian National University"
0ngEy-EAAAAJ,Dl6d1VsAAAAJ,Sidney Xu Lu,Annette and Hugh Gragg Associate Professor of Transnational Asian Studies
0ngEy-EAAAAJ,IUrxgt4AAAAJ,ENRIQUE MUNOZ,Profesor de Filosofía. Pontificia Universidad Católica de Chile
0ngEy-EAAAAJ,8A4JNKQAAAAJ,Patricia Guerrero,Pontificia Universidad Católica de Chile
0ngEy-EAAAAJ,MXJmFVkAAAAJ,Paul D'Arcy,"Associate Professor, Australian National University"
