scholar_id_autor_gs,scholar_id_gs_coauthor,nombre_coauthor,cargo
D2g6y38AAAAJ,RZ3OC74AAAAJ,María Sara Rodríguez,Universidad de los Andes
VLin8zEAAAAJ,Szl5kS4AAAAJ,Elena Carletti,"Professor of Finance, Bocconi University"
VLin8zEAAAAJ,8dlIxRQAAAAJ,Eduardo Borensztein,"Regional Economic Advisor, Inter-American Development Bank"
VLin8zEAAAAJ,G9A1Ls8AAAAJ,"Jun ""QJ"" Qian, Professor of Finance an...","Fanhai International School of Finance, Fudan University"
VLin8zEAAAAJ,yiPXPJ8AAAAJ,Robert Cull,World Bank
VLin8zEAAAAJ,NxIHiFwAAAAJ,Eduardo Cavallo,"Principal Economist, Inter-American Development Bank"
VLin8zEAAAAJ,a7ycdK0AAAAJ,Martin Schindler,International Monetary Fund
VLin8zEAAAAJ,UbBAn7oAAAAJ,Eugenia Andreasen,"Facultad de Economía y Negocios, Universidad de Chile"
VLin8zEAAAAJ,FjUdU10AAAAJ,Ronald Fischer,Universidad de Chile
VLin8zEAAAAJ,Uqkv2roAAAAJ,Florencia Borrescio-Higa,"Associate Professor, Business School, Universidad Adolfo Ibañez"
VLin8zEAAAAJ,ouHUK2gAAAAJ,Hugo Nopo,World Bank
VLin8zEAAAAJ,tW8cPncAAAAJ,Matias Braun,"Professor of Financial Economics, ESE Business School, Universidad de los Andes"
VLin8zEAAAAJ,GkgV_AoAAAAJ,Sofia Johan,"Florida Atlantic University, College of Business"
VLin8zEAAAAJ,YJDPOZoAAAAJ,Sebastian Miller,"Senior Economist, Inter American Development Bank"
VLin8zEAAAAJ,z2qPPbMAAAAJ,Federico Droller,Universidad de Santiago de Chile
VLin8zEAAAAJ,lwA2CEEAAAAJ,Mauricio Larrain,Catholic University of Chile
ur_LhQEAAAAJ,pnVP9X8AAAAJ,Nibaldo C. Inestrosa,Pontificia Universidad Catolica de Chile
ur_LhQEAAAAJ,XoS-UzYAAAAJ,Guojun Bu,"Professor of Neuroscience, Mayo Clinic"
ur_LhQEAAAAJ,R3C1wj0AAAAJ,Ginny G Farías,Dr
ur_LhQEAAAAJ,RDDQKZoAAAAJ,Rodrigo  A Quintanilla,"Associate professor, Centro de Investigación Biomédica, Universidad Autónoma de Chile"
ur_LhQEAAAAJ,9QHKQMMAAAAJ,María Paz Marzolo,"Profesor Titular, Facultad de Ciencias Biológicas, Pontificia Universidad Católica de Chile"
ur_LhQEAAAAJ,sr_eelcAAAAJ,Carlos E. Irarrazabal,Universidad de Los Andes
ur_LhQEAAAAJ,NMyQAh4AAAAJ,Sara E. Miller,"Assistant Professor, University of Missouri - St. Louis"
ur_LhQEAAAAJ,Iq4qgh8AAAAJ,Marc I Diamond,"Center for Alzheimer's and Neurodegenerative Diseases, University of Texas Southwestern Medical"
ur_LhQEAAAAJ,8xv3_MIAAAAJ,Ivan Alfaro Cortez,Universidad del Desarrollo
ur_LhQEAAAAJ,8Dti_swAAAAJ,Waldo Cerpa,"Profesor Asociado, Pontificia Universidad Católica de Chile"
ur_LhQEAAAAJ,utxxkrcAAAAJ,María Inés Barría,"Universidad San Sebastián, Sede de la Patagonia"
ur_LhQEAAAAJ,ONsGb6MAAAAJ,Fernando E. Figueroa,"Universidad de los Andes, Santiago de Chile"
K4UHS-sAAAAJ,KSq8cIUAAAAJ,Silvia Matiacevich,Universidad de Santiago de Chile
K4UHS-sAAAAJ,MRRAHmUAAAAJ,Franco Pedreschi,"Professor od Chemical and Bioprocesess Engineering, Pontificia Universidad Catolica de Chile"
g99obcwAAAAJ,2MYmTJ8AAAAJ,Cristian A. Rojas Barahona,Universidad de Talca
g99obcwAAAAJ,VsNNcp8AAAAJ,Christina Salmivalli,"University of Turku, Finland"
g99obcwAAAAJ,fHdlCr0AAAAJ,Marcelo Demarzo,Associate Professor - Department of Preventive Medicine - Escola Paulista de Medicina - UNIFESP
g99obcwAAAAJ,aE0xK5YAAAAJ,Paul Vöhringer ,"Mood Disorders Program Tufts Medical Center, Hospital Clínico, Facultad Medicina Universidad de"
g99obcwAAAAJ,RUCHz3EAAAAJ,Dheeraj Rai,University of Bristol
g99obcwAAAAJ,7BR-sCoAAAAJ,Saket Girotra,University of Texas Southwestern
g99obcwAAAAJ,r22Ss_gAAAAJ,Glyn Lewis,"Professor of Psychiatric Epidemiology, UCL"
rTDvlSYAAAAJ,z-hPEtoAAAAJ,Maroun Khoury,"Director of Investigation, Universidad de los Andes, Santiago"
rTDvlSYAAAAJ,EydjFV4AAAAJ,Jimena Cuenca Moreno,Universidad de los Andes
rTDvlSYAAAAJ,ONsGb6MAAAAJ,Fernando E. Figueroa,"Universidad de los Andes, Santiago de Chile"
GLwW01cAAAAJ,eiuegycAAAAJ,Joel Conte,"Distinguished Professor, University of California at San Diego"
GLwW01cAAAAJ,OIhak1YAAAAJ,"Hamed Ebrahimian, Ph.D., PE","Assistant Professor, Department of Civil and Environmental Engineering, University of …"
GLwW01cAAAAJ,zqlb6K4AAAAJ,José I. Restrepo,Professor in Structural Engineering
GLwW01cAAAAJ,4nNJYRIAAAAJ,Tara Hutchinson,"University of California, San Diego"
GLwW01cAAAAJ,KTb-I3gAAAAJ,Xiang Wang,"Associate Professor, Sun Yat-Sen University"
GLwW01cAAAAJ,I29cKTsAAAAJ,"Elide Pantoli, PhD, PE","University of California, San Diego"
GLwW01cAAAAJ,5JY047UAAAAJ,"Yong Li, Ph.D., P.Eng.","Assistant Professor, Civil and Environmental Engineering, University of Alberta"
GLwW01cAAAAJ,lWous8UAAAAJ,César Pastén,Geotechnical Engineer
GLwW01cAAAAJ,TtACwrEAAAAJ,Francisco Hernández Prado,University of Chile
GLwW01cAAAAJ,6ir2g-cAAAAJ,Sergio Ruiz,Associated Professor - Director of Geophysics department - Universidad de Chile
GLwW01cAAAAJ,RDf-d68AAAAJ,Costas Papadimitriou,University of Thessaly
GLwW01cAAAAJ,c1bfI5oAAAAJ,Matthew S. Hoehler,National Institute of Standards and Technology
GLwW01cAAAAJ,_2_v4bsAAAAJ,Kenneth Walsh,George Mason University
GLwW01cAAAAJ,22mRRmsAAAAJ,claudia marin,"Ricercatore di Statistica, Università degli Studi di Bari"
GLwW01cAAAAJ,e9NQENsAAAAJ,Felipe Ochoa-Cornejo,"Assistant Professor, University of Chile"
GLwW01cAAAAJ,PF6zTHgAAAAJ,Babak Moaveni,Tufts University
GLwW01cAAAAJ,_o2E2IkAAAAJ,Ramiro Bazaez,"Assistant Professor, Universidad Técnica Federico Santa María"
GLwW01cAAAAJ,MWROEL4AAAAJ,Mukesh Ramancha,"PhD Candidate, University of California San Diego"
GLwW01cAAAAJ,jTAwUOcAAAAJ,Brian Meacham,"Managing Principal, Meacham Associates"
GLwW01cAAAAJ,tFvWwwoAAAAJ,Haejun Park,Oklahoma State University
GLwW01cAAAAJ,VuWSF4QAAAAJ,Ramin Madarshahian,Senior Data Scientist
GLwW01cAAAAJ,0tgkQogAAAAJ,Erick I. Saavedra Flores,"Associate Professor in Structural Engineering - University of Santiago, Chile"
GLwW01cAAAAJ,wcmRU3kAAAAJ,Gerardo Araya-Letelier,"Associate Professor, Pontificia Universidad Católica de Chile"
GLwW01cAAAAJ,p_ryhTMAAAAJ,Mingming Song,"Assistant Professor, Tongji University"
GLwW01cAAAAJ,waXtecAAAAAJ,Rodrigo Morales Vera,"Academic and Researcher Catholic University of Maule, Talca, Chile"
GLwW01cAAAAJ,GVim9eAAAAAJ,Gabriel Felmer,Universidad Católica del Maule
GLwW01cAAAAJ,2ZiXt68AAAAJ,Luan T. Nguyen,"Geotechnical specialist, gbc engineers GmbH"
GLwW01cAAAAJ,lTTfi-wAAAAJ,Tamara Nestrovic,"Professor, Mechanik adaptiver Systeme, Ruhr-Universität Bochum"
GLwW01cAAAAJ,XPntsYwAAAAJ,Yashar (Saeed) Eftekhar Azam,"Assistant Professor, University of New Hampshire"
GLwW01cAAAAJ,cWRPl8IAAAAJ,Daniel Linzell,"Assoc. Dean, Grad & Int'l Pgms, College of Engineering, Univ. of Nebraska-Lincoln"
GLwW01cAAAAJ,goZmkVkAAAAJ,Yuxiang Chen,"Associate Professor of Building Engineering, University of Alberta"
GLwW01cAAAAJ,synlc10AAAAJ,Vicente Mercado,Universidad del Norte
GLwW01cAAAAJ,-LFjHBwAAAAJ,Maureen Puettmann,Woodlife Environmental Consultants
GLwW01cAAAAJ,jbJujt8AAAAJ,Robert Bitmead,Professor of Mechanical & Aerospace Engineering at UCSD
GLwW01cAAAAJ,xcYA4mwAAAAJ,Yehuda Bock,"Distinguished Researcher, Scripps Institution of Oceanography"
GLwW01cAAAAJ,1SHHThYAAAAJ,Marcos Orchard,University of Chile
GLwW01cAAAAJ,djKM0JYAAAAJ,Francisco Jaramillo Montoya,Universidad de Chile
GLwW01cAAAAJ,jzY8TSkAAAAJ,Michael Todd,"Professor of Structural Engineering, University of California San Diego"
GLwW01cAAAAJ,nWPXYg8AAAAJ,Claudia Burbano-García,Sc.D Student at Pontificia Universidad Católica de Chile
GLwW01cAAAAJ,rVqTZFQAAAAJ,Xihong Zhang,"Senior Research Fellow, ARC DECRA Fellow, School of Civil and Mechanical Engineering …"
GLwW01cAAAAJ,XqqJ84gAAAAJ,Christian Ledezma,Pontificia Universidad Catolica de Chile
GLwW01cAAAAJ,pkt3zFQAAAAJ,"Waleed El-Sekelly, PhD, PE",Mansoura University
GLwW01cAAAAJ,voE08ZEAAAAJ,Tarek Abdoun,"Professor of Civil eng., RPI"
GLwW01cAAAAJ,QjrI3-LFm6wC,Dr.Siva Avudaiappan,"Department of Civil Engineering, University of Santiago, Chile"
GLwW01cAAAAJ,WHIlsWgAAAAJ,Yatish Chandra,Swansea University
GLwW01cAAAAJ,BCUkp5MAAAAJ,ikhlas sheet,"Northern Technical University,Iraq"
GLwW01cAAAAJ,dK74n2YAAAAJ,Cristián Sandoval Mandujano,"Pontificia Universidad Católica de Chile, Department of Structural and Geotechnical …"
GLwW01cAAAAJ,fenp_mQAAAAJ,Kenneth Loh,University of California San Diego
GLwW01cAAAAJ,VAamLcEAAAAJ,Shideh Dashti,"Assistant Professor of Geotechnical Engineering and Geomechanics, University of Colorado …"
GLwW01cAAAAJ,zQs7iLsAAAAJ,Felipe Leyton,Universidad de Chile
GLwW01cAAAAJ,YlZ-jMoAAAAJ,Rodrigo Carreño,Aark Engineering
sr_eelcAAAAJ,w1EyGgMAAAAJ,Elisenda Eixarch,"FetalMedicine Research Center, BCNatalHospital Clínic and Hospital Sant Joan de Déu, Universitat de"
sr_eelcAAAAJ,z1vsY2EAAAAJ,Eduard Gratacos,Hospital Clinic & SJD Barcelona Children’s Hospital. University of Barcelona
sr_eelcAAAAJ,0_DTzsoAAAAJ,Natalia I Dmitrieva,National Heart Lung and Blood Institute
sr_eelcAAAAJ,D5VmEGsAAAAJ,Yi-Ling Chen,"Assistant Professor of Global & Area Studies and Geography, University of Wyoming  "
RhG4MfIAAAAJ,hcE7DHsAAAAJ,Alejandra Valencia Váquez,"Profesor Auxiliar.  Escuela de Ingeniería de Transporte. PUCV (Valparaíso, Chile)"
0W-BzeAAAAAJ,dPfqhb0AAAAJ,Ivan B. Djordjevic,"Professor (Tenured), University of Arizona"
0W-BzeAAAAAJ,nIQLgFIAAAAJ,Jaime Cisternas,Universidad de los Andes-Chile
0W-BzeAAAAAJ,NynEwzEAAAAJ,Gustavo Funes,Universidad de los Andes
0W-BzeAAAAAJ,TXmmhvMAAAAJ,Joaquín Herreros,Ingeniero Civil Eléctrico
0W-BzeAAAAAJ,84gcBMgAAAAJ,Eduardo Fabián Peters Rodríguez,"Universidad de los Andes, Chile"
0W-BzeAAAAAJ,-T_EJhYAAAAJ,José Delpiano,"University of the Andes, Santiago, Chile"
0W-BzeAAAAAJ,k4UNBd4AAAAJ,Michael (Misha) Chertkov,"Chair, Program in Applied Mathematics, University of Arizona"
0W-BzeAAAAAJ,jCkHDZ8AAAAJ,Paolo Villoresi,Professor of Experimental Physics - University of Padova
0W-BzeAAAAAJ,cO7xhnMAAAAJ,Giuseppe Vallone,"Associate Professor, Department of Information Engineering, University of Padova"
0W-BzeAAAAAJ,aJHQ4PwAAAAJ,Gustavo Lima,Universidad de Concepción
0W-BzeAAAAAJ,1buc6PMAAAAJ,Aldo Delgado Hidalgo,Universidad de Concepción
0W-BzeAAAAAJ,fkIoMXYAAAAJ,Mujtaba Zahidy,Technical University of Denmark
0W-BzeAAAAAJ,g9RL-QcAAAAJ,Marco Avesani,"Postdoctoral researcher, University of Padova"
CrKpj-gAAAAJ,csI-6uMAAAAJ,Alessandro D Loguercio,State University of Ponta Grossa
CrKpj-gAAAAJ,gJU5XZ4AAAAJ,Alessandra Reis,"Professora de Dentística Restauradora, Universidade Estadual de Ponta Grossa"
CrKpj-gAAAAJ,267siNUAAAAJ,Viviane Hass,"University of Missouri-Kansas City, School of Dentistry"
CrKpj-gAAAAJ,H2ruB_gAAAAJ,Andrés Dávila-Sánchez,Universidad San Francisco de Quito-Odontología
CrKpj-gAAAAJ,78fCsVcAAAAJ,Dr. Jorge Tricio,"University of los Andes, Santiago, Chile"
BamCl30AAAAJ,9yAcyygAAAAJ,"Diaz-Robles, LA","Titular Professor at the Department of Chemical Engineering, University of Santiago of Chile"
BamCl30AAAAJ,7MPNMlkAAAAJ,Felipe Scott,Universidad de los Andes
BamCl30AAAAJ,RXVPYWAAAAAJ,Sergio Revah M,Universidad Autónoma Metropolitana
BamCl30AAAAJ,wacf2BUAAAAJ,German Aroca,"Professor of Biochemical Engineering, P. Universidad Católica de Valparaíso"
BamCl30AAAAJ,C_j2EAIAAAAJ,Patricio Moreno-Casas,Facultad de Ingeniería y Ciencias Aplicadas
BamCl30AAAAJ,DUKAx64AAAAJ,Raul Muñoz (ORCID:0000-0003-1207-6275),Universidad de Valladolid
BamCl30AAAAJ,Q2P4D4wAAAAJ,Francisco Cereceda-Balic,Professor Universidad Tecnica Federico Santa Maria
BamCl30AAAAJ,xJwD06AAAAAJ,JESSICA SAN MARTIN DAVISON,"Facultad de Ingeniería y Ciencias Aplicadas, Universidad de los Andes - Chile"
BamCl30AAAAJ,V1OYFOQAAAAJ,Joshua S. Fu,"Chancellor's Professor, John Tickle/James Gibson Professor of Civil & Environmental …"
BamCl30AAAAJ,gJmOBz8AAAAJ,Tom Harner,Environment Canada
BamCl30AAAAJ,-_urVBUAAAAJ,Ernesto Pino-Cortés,Pontificia Universidad Católica de Valparaíso
BamCl30AAAAJ,aEwXKoIAAAAJ,Luz Francy Yañez Meneses,PhD - Universidad de Los Andes - Universidad de Valladolid
BamCl30AAAAJ,6vyFk4YAAAAJ,Francisco Cubillos,Academico Departamento de Ingeniería Quimica
BamCl30AAAAJ,pg5LQAEAAAAJ,Karla Pozo,Universidad San Sebastian
BamCl30AAAAJ,NKweiVUAAAAJ,Fabián Guerrero C.,Universidad Tecnica Federico Santa Maria
BamCl30AAAAJ,flwle_EAAAAJ,Mercedes Ballesteros,ciemat
BamCl30AAAAJ,-T_EJhYAAAAJ,José Delpiano,"University of the Andes, Santiago, Chile"
BamCl30AAAAJ,Ds5wimgAAAAJ,Heleno Bolfarine,university of sao paulo
BamCl30AAAAJ,tDdKdwkAAAAJ,Diego Ignacio Gallardo Mateluna,Universidad de Atacama
BamCl30AAAAJ,BQ7_uGoAAAAJ,VENEGAS TORRES OSVALDO,"Profesor de matemáticas, Universidad Católica de Temuco"
BamCl30AAAAJ,WtYvpV0AAAAJ,Fidel Vallejo Gallardo,Universidad del Bío-Bío
BamCl30AAAAJ,3xe3SG0AAAAJ,Stefan Pelz,Professor Forest Utilization & Biomass Conversion
BamCl30AAAAJ,nT5GXhkAAAAJ,FRANCISCO  CAICEDO,"Profesor Ingeniería Ambiental, Universidad Mariana"
BamCl30AAAAJ,mcmCTfQAAAAJ,Jose A. Abell M.,"Universidad de los Andes, Chile"
BamCl30AAAAJ,3wdvl_4AAAAJ,Armando González-Sánchez,"UNIVERSIDAD NACIONAL AUTONOMA DE MEXICO, INSTITUTO DE INGENIERIA"
BamCl30AAAAJ,i-_hebMAAAAJ,Gabriela Soreanu,"Assoc.Prof., PhD. Eng., Gheorghe Asachi Technical University of Iasi"
BamCl30AAAAJ,wKWMIT4AAAAJ,Ana Lúcia Leitão,"Professor de Tecnologia e Segurança Alimentar, Faculdade de Ciências e Tecnologia da …"
BamCl30AAAAJ,5uYichoAAAAJ,Ricardo Morales-Rodriguez,Universidad de Guanajuato
BamCl30AAAAJ,fZpiENAAAAAJ,Francisco A. Cubillos,Universidad de Santiago de Chile
RVmOGS0AAAAJ,iAUEZRcAAAAJ,Yan Carrière-Swallow,International Monetary Fund
v91PopMAAAAJ,O51bc7QAAAAJ,"""Kenneth James Sher"" or ""Kenneth J. Sher"" or ""Kenneth Sher"" or ""KJ Sher"" or ""KJ Sher""","Dept. of Psychological Sciences, University of Missouri"
v91PopMAAAAJ,lMpbs7QAAAAJ,Timothy Trull,"Professor of Psychological Sciences, University of Missouri"
v91PopMAAAAJ,RA1WjnIAAAAJ,Andrew Littlefield,Texas Tech University
v91PopMAAAAJ,_hLpZXUAAAAJ,Phillip Karl Wood,"Department of Psychological Sciences, University of Missouri"
v91PopMAAAAJ,3m8xwGEAAAAJ,Douglas Steinley,University of Missouri
v91PopMAAAAJ,J8CywDoAAAAJ,Kristina Jackson,"Professor (Research), Brown University"
v91PopMAAAAJ,cWfHnMIAAAAJ,Natania Crane,University of Illinois at Chicago
v91PopMAAAAJ,PcBKrxcAAAAJ,Scott Langenecker,Professor of Psychiatry
v91PopMAAAAJ,nTvynsMAAAAJ,Jarrod M. Ellingson,"Assistant Professor, University of Colorado School of Medicine"
v91PopMAAAAJ,VQcM9P4AAAAJ,Lisanne Jenkins,Northwestern University
v91PopMAAAAJ,KsD1HKcAAAAJ,Javiera Rosell,Pontificia Universidad Católica de Chile
v91PopMAAAAJ,c-QS9CgAAAAJ,K. Luan Phan,"Professor and Chair of  Psychiatry and Behavioral Health, The Ohio State University"
v91PopMAAAAJ,9Si1UFoAAAAJ,Mario A. Laborda,"Associate Professor, Department of Psychology, Universidad de Chile"
v91PopMAAAAJ,Ba2kwtkAAAAJ,Nick Martin,QIMR Berghofer Medical Research Institute
v91PopMAAAAJ,os8brbkAAAAJ,Kristina Jackson,Brown University
v91PopMAAAAJ,FX-TwXQAAAAJ,I Gotlib,"Professor of Psychology, Stanford University"
v91PopMAAAAJ,Pe0_erMAAAAJ,David Torres Irribarra,Pontificia Universidad Católica de Chile
v91PopMAAAAJ,BF4iO8EAAAAJ,Matthew Martens,University of Missouri
v91PopMAAAAJ,3JxVWa4AAAAJ,Matthew R Lee,University of Missouri-Columbia
v91PopMAAAAJ,O7ifgcoAAAAJ,Angela Haeny,"Postdoctoral Fellow, Yale School of Medicine"
v91PopMAAAAJ,puWpGDgAAAAJ,Annmarie MacNamara,Texas A&M University
v91PopMAAAAJ,S3dpTCgAAAAJ,Sean Patrick Lane,"Assistant Professor, University of Missouri"
v91PopMAAAAJ,OyzOWkMAAAAJ,Denis M McCarthy,University of Missouri
v91PopMAAAAJ,6vzOKGkAAAAJ,Kimberly A. Fleming,Allegheny Health Network
v91PopMAAAAJ,sylLACcAAAAJ,Bruce D. Bartholow,"Professor, Department of Psychological Sciences, University of Missouri"
v91PopMAAAAJ,eY3VhFcAAAAJ,Kenneth Bollen,"Department of Psychology and Neuroscience, Department of Sociology, University of North …"
v91PopMAAAAJ,omZro7UAAAAJ,Matthew Calamia,Louisiana State University
v91PopMAAAAJ,slSlDTYAAAAJ,Cassandra L. Boness,University of New Mexico
v91PopMAAAAJ,DheljD8AAAAJ,Matt G. Kushner,University of Minnesota
v91PopMAAAAJ,c4NLYWEAAAAJ,Brooke J. Arterberry,University of Michigan
S89RtNAAAAAJ,nIQLgFIAAAAJ,Jaime Cisternas,Universidad de los Andes-Chile
S89RtNAAAAAJ,kpJtD3AAAAAJ,Osvaldo Anibal Rosso,"Principal Researcher, CONICET, Argentina"
S89RtNAAAAAJ,0W-BzeAAAAAJ,Jaime A. Anguita,"Professor, Universidad de los Andes - Chile"
S89RtNAAAAAJ,RhG4MfIAAAAJ,RODRIGO FERNANDEZ,"Profesor Titular, Universidad de los Andes (Santiago-Chile)"
Rs_HIpMAAAAJ,a-aOW4oAAAAJ,Neale R. Smith,Tecnologico de Monterrey
Rs_HIpMAAAAJ,PuMO0YsAAAAJ,Stefan Voß,"Professor of Information Systems, University of Hamburg"
Rs_HIpMAAAAJ,IeerooZ_6A0C,José-Fernando Camacho-Vallejo,"Universidad Autónoma de Nuevo León, Facultad de Ciencias Físico-Matemáticas"
Rs_HIpMAAAAJ,_ejcrb8AAAAJ,Ronald Askin,"Professor of Industrial Engineering, Arizona State University"
Rs_HIpMAAAAJ,0rpoLewAAAAJ,LUIS M. ASCENCIO,Universidad de Los Andes Chile
Rs_HIpMAAAAJ,yGAw5AoAAAAJ,Frederik Schulte,"Assistant Professor, Delft University of Technology"
Rs_HIpMAAAAJ,-U39N-wAAAAJ,Miguel Gaston Cedillo-Campos,IMT-National Lab for Transportation & Logistics
Rs_HIpMAAAAJ,HsunjxEAAAAJ,Marcela C. González-Araya,Universidad de Talca
Rs_HIpMAAAAJ,J3dHlkMAAAAJ,Lorena Andrea Bearzotti,"Professor of Construction and Transportation School, PUCV"
Rs_HIpMAAAAJ,Y4cOc34AAAAJ,Eduardo Lalla-Ruiz,"Assistant Professor, University of Twente"
Rs_HIpMAAAAJ,s-0VFjEAAAAJ,J Mar-Ortiz,Professor
Rs_HIpMAAAAJ,_cSH2V4AAAAJ,Maria D. Gracia,Universidad Autónoma de Tamaulipas
Rs_HIpMAAAAJ,xdC-UDMAAAAJ,J. Rene Villalobos,"Associate professor Industrial Engineering, Arizona State University"
Rs_HIpMAAAAJ,Qzl7WeYAAAAJ,Sebastián Maldonado,"Department of Management Control and Information Systems, University of Chile & ISCI"
Rs_HIpMAAAAJ,Yv3jCQkAAAAJ,Adrian Ramirez-Nafarrate,Tecnológico de Monterrey
Rs_HIpMAAAAJ,VPQYt1IAAAAJ,Carla Vairetti,"Universidad de los andes, chile"
Rs_HIpMAAAAJ,3WhioLIAAAAJ,Alice E. Smith,"Joe W. Forehand/Accenture Distinguished Professor of Industrial and Systems Engineering, Auburn"
Rs_HIpMAAAAJ,SbFmCjIAAAAJ,Samuel Moisés Nucamendi Guillén,"Universidad Panamericana, Campus Guadalajara"
eN5q1XMAAAAJ,bbZWdFUAAAAJ,Benjamin Bustos,"Department of Computer Science, University of Chile"
eN5q1XMAAAAJ,9cJsSIIAAAAJ,Tobias Schreck,"Professor of Computer Science, Graz University of Technology"
eN5q1XMAAAAJ,nVHwR8oAAAAJ,Juan Manuel Barrios,Impresee Inc
eN5q1XMAAAAJ,TE1iMxgAAAAJ,"Bo Li,  李波",University of Southern Mississippi
eN5q1XMAAAAJ,HAWI_ogAAAAJ,Henry Johan,Fraunhofer Singapore
eN5q1XMAAAAJ,Vqs4d5UAAAAJ,Afzal Godil,"National Institute of Standards and Technology, Gaithersburg, MD, USA"
eN5q1XMAAAAJ,cpkrT44AAAAJ,Yijuan Lu,"Associate Professor of Computer Science, Texas State University"
eN5q1XMAAAAJ,hif3OgsAAAAJ,Domingo Mery,"Full Professor at Pontificia Universidad Católica de Chile, Computer Science"
eN5q1XMAAAAJ,RZyMS5UAAAAJ,Takahiko Furuya (古屋貴彦),University of Yamanashi
eN5q1XMAAAAJ,-NOU6eYAAAAJ,Ryutarou Ohbuchi （大渕 竜太郎）,University of Yamanashi
eN5q1XMAAAAJ,p7c-LHcAAAAJ,Sandipan Banerjee,Samsung Research America (NEON)
eN5q1XMAAAAJ,FG9meLgAAAAJ,Violeta Chang,Universidad de Santiago de Chile
eN5q1XMAAAAJ,dmafYYgAAAAJ,Nancy Hitschfeld Kahler,"Full Professor at the Computer Science Department, University of Chile"
eN5q1XMAAAAJ,CaWf3qYAAAAJ,Alfredo Ferreira,INESC-ID Lisboa / Instituto Superior Técnico /  University of Lisbon
eN5q1XMAAAAJ,vYss7-cAAAAJ,Manuel J. Fonseca,"LASIGE, Departamento de Informática, Faculdade de Ciências, Universidade de Lisboa"
eN5q1XMAAAAJ,oMgb9jgAAAAJ,Luiz Eduardo S. Oliveira,"Federal University of Parana, Dept of Informatics"
eN5q1XMAAAAJ,pC1AX9AAAAAJ,Dr. Steffen Härtel,"Full Professor, University of Chile"
eN5q1XMAAAAJ,8TZIS0sAAAAJ,Mathias Eitz,Othoz GmbH
eN5q1XMAAAAJ,KNwXLLsAAAAJ,Marc Alexa,"Professor of Computer Science, TU Berlin"
eN5q1XMAAAAJ,6csQ9BMAAAAJ,Ignacio Úbeda,University of Würzburg
eN5q1XMAAAAJ,6zVLPkcAAAAJ,Laurent HEUTTE,"Professor of Computer Science, LITIS lab, University of Rouen, France"
eN5q1XMAAAAJ,Mh4Ac54AAAAJ,Caroline Petitjean,"LITIS EA 4108, Université de Rouen, France"
eN5q1XMAAAAJ,OT776bsAAAAJ,Stéphane Nicolas,"MCF, LITIS, Université de Rouen"
eN5q1XMAAAAJ,bzY8YwEAAAAJ,Florian Kleber,TU Wien
eN5q1XMAAAAJ,K3F9WrQAAAAJ,Markus Diem,"Computer Vision Engineer, Snap Inc."
eN5q1XMAAAAJ,2u2Lmr4AAAAJ,Robert Sablatnig,"Prof. for Computer Vision, TU Wien"
eN5q1XMAAAAJ,TNTgAPQAAAAJ,Nils Murrugarra-Llerena,"Assistant Professor, Weber State University"
eN5q1XMAAAAJ,pbekYw4AAAAJ,Andre Gustavo Hochuli,"Programa de Pós-Graduação em Informática (PPGIa), Pontifícia Universidade Católica do …"
eN5q1XMAAAAJ,pRK8DCUAAAAJ,Alceu de Souza Britto Jr,"Professor of Computer Science, Pontifical Catholic University of Parana"
eN5q1XMAAAAJ,l33dD0wAAAAJ,Robert Sabourin,Professor emeritus @ École de technologie supérieure - LIVIA - REPARTI
eN5q1XMAAAAJ,fKbjgeEAAAAJ,Pablo N. Pizarro,"MSc. Student in Structural Engineering and Computer Science, Universidad de Chile"
eN5q1XMAAAAJ,53Mi3fIAAAAJ,Ivan Sipiran,"Assistant Professor, Department of Computer Science, University of Chile"
eN5q1XMAAAAJ,GaJXFWMAAAAJ,Bo Li,"School of Economics and Management, Tsinghua University"
o2AO2joAAAAJ,or-pWjoAAAAJ,Cristian Medina Valverde,Profesor Investigador Universidad San Sebastian (CHILE)
M3vEKGgAAAAJ,JT06pWYAAAAJ,Patricia Alejandra Luz Crawford,Universida de los Andes
M3vEKGgAAAAJ,ONsGb6MAAAAJ,Fernando E. Figueroa,"Universidad de los Andes, Santiago de Chile"
M3vEKGgAAAAJ,z-hPEtoAAAAJ,Maroun Khoury,"Director of Investigation, Universidad de los Andes, Santiago"
M3vEKGgAAAAJ,AWe-qKcAAAAJ,Flavio Andres Salazar Onfray,"Profesor de Inmunología, Universidad de Chile"
M3vEKGgAAAAJ,ur_LhQEAAAAJ,Rodrigo A. Fuentealba,Assistant Professor - Universidad de los Andes
M3vEKGgAAAAJ,ocQDhzUAAAAJ,Mercedes Natalia López Nitsche,Académica Universidad de Chile
M3vEKGgAAAAJ,T_dpe84AAAAJ,"Maracaja-Coutinho, Vinicius",Universidad de Chile
M3vEKGgAAAAJ,EydjFV4AAAAJ,Jimena Cuenca Moreno,Universidad de los Andes
M3vEKGgAAAAJ,uDODJXkAAAAJ,Farida Djouad,Dr
nIQLgFIAAAAJ,S89RtNAAAAAJ,Orazio Descalzi,Universidad de los Andes - Chile
nIQLgFIAAAAJ,0W-BzeAAAAAJ,Jaime A. Anguita,"Professor, Universidad de los Andes - Chile"
nIQLgFIAAAAJ,N4NN1xwAAAAJ,Ioannis Kevrekidis,Johns Hopkins University
nIQLgFIAAAAJ,LO7LZ3oAAAAJ,Gonzalo Rojas Costa,"Department of Radiology, Clinica Las Condes"
nIQLgFIAAAAJ,whmYKMoAAAAJ,Guenter Radons,"Institute of Physics, Chemnitz University of Technology"
nIQLgFIAAAAJ,ALa6ZuMAAAAJ,M. Cristina Depassier,"Professor of Physics, Pontificia Universidad Catolica de Chile"
nIQLgFIAAAAJ,I2Vbd3YAAAAJ,harm hinrich rotermund,"Professor Emeritus, Physics and Atmospheric Science, Dalhousie University"
nIQLgFIAAAAJ,w_OQZmsAAAAJ,Cristian Fernández-Oto,Universidad de Los Andes
nIQLgFIAAAAJ,fipKUUoAAAAJ,Rafael Benguria,"Professor of Physics, Pontificia Universidad Catolica de Chile"
vfBklcMAAAAJ,INBSXpMAAAAJ,miguel nussbaum,Pontificia Universidad Catolica de Chile
vfBklcMAAAAJ,Ug4b1XQAAAAJ,Gustavo Zurita,"Full Professor, DCS Department, Universidad de Chile"
vfBklcMAAAAJ,ISz4POwAAAAJ,Florencia Gomez Zaccarelli,Pontificia Universidad Católica de Chile
vfBklcMAAAAJ,uEg5T_IAAAAJ,Marcelo Milrad,"Professor of Media Technology, Linnaeus University, Sweden"
vfBklcMAAAAJ,LYlzMIIAAAAJ,Nelson Baloian,"Department of Computer Sciences, Universidad de Chile"
vfBklcMAAAAJ,D0WSvvMAAAAJ,Susana Claro,"Assistant Professor, P. Universidad Católica de Chile"
vfBklcMAAAAJ,MVtcwVwAAAAJ,Rosa Alarcon,"Computer Science Department, Pontificia Universidad Católica de Chile"
vfBklcMAAAAJ,X0HbXjcAAAAJ,Matias Recabarren,"Research Professor, Universidad de los Andes, Chile"
vfBklcMAAAAJ,VPQYt1IAAAAJ,Carla Vairetti,"Universidad de los andes, chile"
vfBklcMAAAAJ,Rs_HIpMAAAAJ,Rosa G. González-Ramírez,"Universidad de Los Andes, Chile"
vfBklcMAAAAJ,Qzl7WeYAAAAJ,Sebastián Maldonado,"Department of Management Control and Information Systems, University of Chile & ISCI"
vfBklcMAAAAJ,1gwPAeMAAAAJ,Sergio Peñafiel,"Departamento de Ciencias de la Computación, Universidad de Chile"
vfBklcMAAAAJ,oJK9RqEAAAAJ,Alyssa Friend Wise,"Professor of Educational Technology & Learning Sciences at NYU | Director, NYU-LEARN …"
vfBklcMAAAAJ,tiQyFSYAAAAJ,Oscar Jerez Yañez,Departamento de Eduación en ciencias de la salud . U Chile
vfBklcMAAAAJ,DinpmCUAAAAJ,A Carvallo,Researcher at CENIA. PhD at Pontificia Universidad Católica de Chile
vfBklcMAAAAJ,_e99_v4AAAAJ,Federico Meza,"Associate Teaching Professor, Computing Engineering Department, Universidad Técnica …"
vfBklcMAAAAJ,0Vmn0QQAAAAJ,Alexander Nolte,"University of Tartu, Carnegie Mellon University"
vfBklcMAAAAJ,vR9b1AwAAAAJ,Irene-Angelica Chounta,"Junior Professor, Computer Science (INKO), University of Duisburg-Essen"
vfBklcMAAAAJ,bb0zCMEAAAAJ,María Jesús Rodríguez-Triana,"Associate Professor, Tallinn University"
vfBklcMAAAAJ,0nHLHCQAAAAJ,Beatriz Hasbún Held,"Centro de Enseñanza y Aprendizaje, Facultad de Economía y Negocios, Universidad de …"
vfBklcMAAAAJ,eNbutSkAAAAJ,Hiroaki Ogata,"Professor at Kyoto Univeristy, Japan"
vfBklcMAAAAJ,mCRIC1cAAAAJ,Tomoo Inoue,"Professor of Faculty of Library, Information and Media Science, University of Tsukuba"
vfBklcMAAAAJ,9XuLJBAAAAAJ,Cesar Collazos - https://orcid.org/0000-0002-7099-8131,"Full Professor, universidad del Cauca-Colombia"
vfBklcMAAAAJ,4yWDZ2YAAAAJ,Cristian Olivares-Rodríguez,"Profesor, Instituto de Informática, Universidad Austral de Chile"
vfBklcMAAAAJ,Pjsr3ZEAAAAJ,Juan Manuel Gonzalez Calleros,Benemérita Universidad Autónoma de Puebla
vfBklcMAAAAJ,1g2VAeYAAAAJ,Pedro G. Campos,Universidad del Bío-Bío
