scholar_id_autor_gs,scholar_id_gs_coauthor,nombre_coauthor,cargo
t6WTsxEAAAAJ,okYv8sQAAAAJ,Helton Saulo,"Assistant Professor of Statistics, University of Brasilia"
t6WTsxEAAAAJ,sbr7vM4AAAAJ,Robert G Aykroyd,University of  Leeds
t6WTsxEAAAAJ,pbGmqDAAAAAJ,Jeremias Leao,Universidade Federal do Amazonas
t6WTsxEAAAAJ,P2llVMQAAAAJ,Ivette Gomes,"CEAUL and DEIO, Faculdade de Ciências, Universidade de Lisboa"
1pGKw9UAAAAJ,xp0zRBQAAAAJ,María Luisa Humanes,Full Professor (University Rey Juan Carlos- Spain)
1pGKw9UAAAAJ,Fq9Ii_IAAAAJ,Mireya Márquez Ramírez,Universidad Iberoamericana Ciudad de México
1pGKw9UAAAAJ,sZGN0FMAAAAJ,Folker Hanusch,"Professor of Journalism, University of Vienna"
1pGKw9UAAAAJ,G1qCc7QAAAAJ,Cornelia Mothes,"Macromedia University of Applied Sciences, Leipzig"
1pGKw9UAAAAJ,r_p1tQoAAAAJ,Sergio Roses,Profesor de Periodismo (UMA)
1pGKw9UAAAAJ,TZWsCvAAAAAJ,Edson C. Tandoc Jr.,"Associate Professor, Nanyang Technological University"
1pGKw9UAAAAJ,ljCM--oAAAAJ,Dan Hallin,"Professor of Communication, University of California San Diego"
1pGKw9UAAAAJ,vtAzpf4AAAAJ,Andrés Scherman,Universidad Adolfo Ibáñez
1pGKw9UAAAAJ,pI4AcZ0AAAAJ,Sallie Hughes,"Associate Professor, Journalism, University of Miami"
1pGKw9UAAAAJ,ETsmEqcAAAAJ,silvio waisbord,George Washington University
1pGKw9UAAAAJ,WPieCDsAAAAJ,Tim P. Vos,"Professor, School of Journalism, Michigan State University"
eWXIjwwAAAAJ,O8xOA28AAAAJ,Fernando Rodriguez-Rodriguez,"Physical Education, Pontificia Universidad Católica de Valparaíso"
eWXIjwwAAAAJ,mBdG3iEAAAAJ,NICOLAS AGUILAR FARIAS,Universidad de La Frontera
eWXIjwwAAAAJ,H7LlKb8AAAAJ,Patricio Solis-Urra,University of Granada
eWXIjwwAAAAJ,DjLPCogAAAAJ,Antonio García-Hermoso (ORCID: 000...,"Navarrabiomed, Universidad Pública de Navarra"
04ZzYdAAAAAJ,c46sIEIAAAAJ,José Sabater Montes,"Postdoctoral Research Associate, University of Edinburgh"
04ZzYdAAAAAJ,5Z5YDDYAAAAJ,Shiyin Shen,Shanghai Astronomical Observatory
04ZzYdAAAAAJ,VluZe6AAAAAJ,Juande Santander-Vela,Joint ALMA Observatory
04ZzYdAAAAAJ,2BSBFeQAAAAJ,Shuai Feng（冯帅）,Hebei Normal University
04ZzYdAAAAAJ,Oi56ZNUAAAAJ,Zhengyi Shao,Shanghai Astronomical Observatory
04ZzYdAAAAAJ,t_AubkAAAAAJ,Min S. Yun,"Professor of Astronomy, University of Massachusetts, Amherst"
04ZzYdAAAAAJ,mrshqEMAAAAJ,Daniel Espada,University of Granada
cUKJtaMAAAAJ,-0WlOaYAAAAJ,Maria Angeles Bilbao,"Profesora, Facultad de Psicología, U. Alberto Hurtado"
cUKJtaMAAAAJ,g_QWxVAAAAAJ,Vicente Sisto,Dr. en Psicología Social. Profesor Titular Pontificia Universidad Católica de Valparaíso. Chile
cUKJtaMAAAAJ,3DJ2obYAAAAJ,Carmen Gloria Núñez,Pontificia Universidad Catolica de Valparaiso
cUKJtaMAAAAJ,UeodjIAAAAAJ,Cristian Bellei,Universidad de Chile: Centro de Investigación Avanzada en Educación y Departamento de Sociología
iC1zxr4AAAAJ,1ULUsmIAAAAJ,Eric Monfroy,"Professor of Computer Science, Université de Nantes"
iC1zxr4AAAAJ,UBd6oewAAAAJ,Franklin Johnson Parejas,Universidad de Playa Ancha
iC1zxr4AAAAJ,AFjvjTgAAAAJ,Sanjay Misra,Østfold University College
iC1zxr4AAAAJ,E-rHSVEAAAAJ,Rodrigo Olivares Ordenes,"Escuela de Ingeniería Informática, Universidad de Valparaíso"
iC1zxr4AAAAJ,BrwIoeIAAAAJ,Cristian Galleguillos,"PhD Student, Pontificia Universidad Católica de Valparaíso"
iC1zxr4AAAAJ,UR6tfqAAAAAJ,Jose Antonio Garcia,"Pontificia Universidad Católica de Valparaíso , Chile"
iC1zxr4AAAAJ,f0ZHmtwAAAAJ,Dr. Jose M. Lanza-Gutierrez,"University of Alcalá, Alcalá de Henares, Madrid, Spain"
iC1zxr4AAAAJ,2_sNXuEAAAAJ,Raphael Chenouard,"Ecole Centrale de Nantes, Université de Nantes"
iC1zxr4AAAAJ,IiBLzvgAAAAJ,Stéphane Caro,CNRS Research Director - LS2N (UMR CNRS 6004)
iC1zxr4AAAAJ,wMZ5XCUAAAAJ,Ignacio Araya,Pontificia Universidad Católica de Valparaíso
iC1zxr4AAAAJ,PbTuJx0AAAAJ,Orlando Duran,Pontificia Universidad Catolica de Valparaiso
iC1zxr4AAAAJ,1oduG-QAAAAJ,Frédéric Lardeux,LERIA - University of Angers
iC1zxr4AAAAJ,knvZjVwAAAAJ,Alexandre Goldsztejn,CNRS
iC1zxr4AAAAJ,tfVkZfkAAAAJ,Philippe Cardou,"Professor of Mechanical Engineering, Laval University"
O8xOA28AAAAJ,eWXIjwwAAAAJ,Carlos Cristi-Montero,Pontificia Universidad Católica de Valparaiso
O8xOA28AAAAJ,XR4vl8cAAAAJ,Carlos Celis-Morales,"Institute of Cardiovascular and Medical Science, Glasgow University, UK"
O8xOA28AAAAJ,H7LlKb8AAAAJ,Patricio Solis-Urra,University of Granada
O8xOA28AAAAJ,Vx7kPp8AAAAJ,Cristian Alvarez,Universidad Andres Bello
O8xOA28AAAAJ,mBdG3iEAAAAJ,NICOLAS AGUILAR FARIAS,Universidad de La Frontera
O8xOA28AAAAJ,RSltLL8AAAAJ,Palma Chillón,"Universidad de Granada, Faculty of Sport Sciences, Granada, Spain"
O8xOA28AAAAJ,eS_SYGMAAAAJ,Fanny Petermann-Rocha,Universidad Diego Portales
O8xOA28AAAAJ,c9vCxn4AAAAJ,Rodrigo Ramirez-Campillo,Exercise and Rehabilitation Sciences Laboratory. School of Physical Therapy. Faculty of
O8xOA28AAAAJ,SUKzSYQAAAAJ,Francisco José Berral de la Rosa,"Catedrático de Universidad, U. Pablo Olavide de Sevilla (ES). https://orcid.org/0000-0003-3552-8262"
O8xOA28AAAAJ,zfQU0XsAAAAJ,Kabir P. Sadarangani,Universidad Diego Portales
O8xOA28AAAAJ,7UeeIB4AAAAJ,"Robinson Ramírez-Vélez, Ph.D (ORCI...","Department of Health Sciences, Public University of Navarra"
O8xOA28AAAAJ,LYXpVoEAAAAJ,Jorge Enrique Correa-Bautista / http://...,Profesor de Carrera. Universidad de Cundinamarca. Facultad de Ciencias del Deporte
O8xOA28AAAAJ,DjLPCogAAAAJ,Antonio García-Hermoso (ORCID: 000...,"Navarrabiomed, Universidad Pública de Navarra"
O8xOA28AAAAJ,6FJnI74AAAAJ,Mikel Izquierdo (ORCID: 0000-0002-1...,"Department of Health Sciences, Public University of Navarra (Full Professor)"
O8xOA28AAAAJ,mmkjGaUAAAAJ,Katherine González-Ruíz,Universidad Santiago de Cali
O8xOA28AAAAJ,POUTm0IAAAAJ,"Felipe Lobelo, MD PhD FAHA","Associate Professor of Global Health, Rollins School of Public Health, Emory University and Program"
O8xOA28AAAAJ,HRHW64gAAAAJ,Dr. Alberto Moreno Doña,Prof. Titular. Universidad de Valparaíso
HTEL8I8AAAAJ,UUfZjBYAAAAJ,Daniel Melnick,Universidad Austral de Chile
HTEL8I8AAAAJ,s3-SqS8AAAAJ,Yuki Sawai,National Institute of Advanced Industrial Science and Technology
HTEL8I8AAAAJ,f6uGyrEAAAAJ,Benjamin P. Horton,"Asian School of the Environment, Nanyang Technological University"
HTEL8I8AAAAJ,dSNBOdMAAAAJ,Cristian Youlton,"Pontificia Universidad Católica de Valparaíso, Escuela de Agronomía"
HTEL8I8AAAAJ,OBVZdTgAAAAJ,Jessica Pilarczyk,Simon Fraser University
HTEL8I8AAAAJ,0LgnrDEAAAAJ,Patricio A. Catalan,Universidad Tecnica Federico Santa Maria
HTEL8I8AAAAJ,i42ekdkAAAAJ,Ed Garrett,"Department of Environment and Geography, University of York"
HTEL8I8AAAAJ,CfL2m4oAAAAJ,James Goff,Honorary Professor of Tsunami Research
HTEL8I8AAAAJ,-xJYq30AAAAJ,Catherine Chagué,"UNSW, Australia & NIWA, New Zealand"
HTEL8I8AAAAJ,AAMayFIAAAAJ,Ricardo O. Barra,"Professor, University of Concepcion, Faculty of Environmental Sciences and EULA CHILE …"
HTEL8I8AAAAJ,4EC0BacAAAAJ,Eko Yulianto,"Research Center for Geotechnology, Indonesian Institute of Science"
HTEL8I8AAAAJ,l6B4VrgAAAAJ,Kruawun Jankaew,Senior Geologist
HTEL8I8AAAAJ,rkEBqQkAAAAJ,Amy L. Prendergast,University of Melbourne
HTEL8I8AAAAJ,pg5LQAEAAAAJ,Karla Pozo,Universidad San Sebastian
HTEL8I8AAAAJ,PybC8dgAAAAJ,Mahdi Motagh,GFZ German Research Center for Geosciences & Leibniz University Hannover
HTEL8I8AAAAJ,aI17no0AAAAJ,Javed Malik,Professor
HTEL8I8AAAAJ,k8IY1iIAAAAJ,Joanne Bourgeois,University of Washington
HTEL8I8AAAAJ,bfvNI5IAAAAJ,Fabiola Cruces,
HTEL8I8AAAAJ,zDV1KNAAAAAJ,Scott L Nichol,Geoscience Australia
HTEL8I8AAAAJ,Zh4GpigAAAAJ,JP Le Roux,Universidad de Chile
HTEL8I8AAAAJ,bRSAEFYAAAAJ,Emma Hocking,"Associate Professor, Northumbria University"
HTEL8I8AAAAJ,NPkdbqcAAAAJ,Jasper Moernaut,University of Innsbruck
HTEL8I8AAAAJ,i9ttSQQAAAAJ,Andrés Tassara,"Associated Professor, Department of Earth Sciences, Universidad de Concepción, Chile"
HTEL8I8AAAAJ,2HWOvCoAAAAJ,Geoffroy Lamarche,Parliamentary Commissioner for the Environment / University of Auckland
HTEL8I8AAAAJ,9ZO9Hq0AAAAJ,"Cronin, Shane J","Professor of Volcanology, University of Auckland, New Zealand"
HTEL8I8AAAAJ,IQPHY_QAAAAJ,Dale Dominey-Howes,The University of Sydney
HTEL8I8AAAAJ,HBF8RPcAAAAJ,Bruce Jaffe,United States Geological Survey
HTEL8I8AAAAJ,mgwOFwgAAAAJ,Iran Correa,"Professor Titular, UFRGS"
HTEL8I8AAAAJ,gombq7IAAAAJ,Sarah Woodroffe,"Department of Geography, Durham University"
HTEL8I8AAAAJ,40JPFiEAAAAJ,Shaoyang Li / 李绍阳,"Institute of Geology and Geophysics, Chinese Academy of Sciences"
HTEL8I8AAAAJ,yjv9clAAAAAJ,Jimmy Pincheira Ulbrich,Universidad Católica de Temuco
HTEL8I8AAAAJ,KPwTDgoAAAAJ,Dallas Abbott,Columbia University and Oregon State and CCNY
HTEL8I8AAAAJ,ahNf5ZEAAAAJ,Harry Yeh,Oregon State University
HTEL8I8AAAAJ,OQ7n4X4AAAAJ,Michael Bevis,"Professor of Geodesy & Geodynamics, Ohio State University"
HTEL8I8AAAAJ,-zBuEakAAAAJ,Seshachalam Srinivasalu,"Anna University, Chennai, India"
HTEL8I8AAAAJ,aTVgKhAAAAAJ,Andrew L Herczeg,Flinders University of South Australia
HTEL8I8AAAAJ,eYMjbhgAAAAJ,Anne Socquet,"Université Grenoble Alpes, CNRS, IRD, ISTerre"
HTEL8I8AAAAJ,nq00-E4AAAAJ,Prof. Dominic A Hodgson,"British Antarctic Survey and Visiting Professor of Geography, University of Durham"
HTEL8I8AAAAJ,N_CGVnwAAAAJ,Robert Wasson,"Adjunct Professor, James Cook University; Emeritus Proefessor, Australian National …"
HTEL8I8AAAAJ,QGC2Jc8AAAAJ,Lucien Hoffmann,Luxembourg Institute of Science and Technology
HTEL8I8AAAAJ,lh7j4-wAAAAJ,Onno Oncken,GeoForschungsZentrum Potsdam
HTEL8I8AAAAJ,6hcC-8sAAAAJ,CP Rajendran,Professor
HTEL8I8AAAAJ,AZyhVtkAAAAJ,Muchammad Husni,"Lecture in Informatics Department, Sepuluh Nopember Institute of Technology , ITS"
HTEL8I8AAAAJ,57dLj8YAAAAJ,Junping Chen,"Professor, Shanghai Astronomical Observatory (SHAO)"
HTEL8I8AAAAJ,s7clkJwAAAAJ,Brian G. McAdoo,"Associate Professor of Earth and Climate Sciences, Duke University"
g_QWxVAAAAAJ,h9ECWD4AAAAJ,Carla Fardella,Universidad Andres Bello
g_QWxVAAAAAJ,cUKJtaMAAAAJ,Verónica López,Pontificia Universidad Católica de Valparaíso
g_QWxVAAAAAJ,Etid-XsAAAAJ,Carmen Montecinos,"Professor of Psychology, Pontificia Universidad Catolica de Valparaiso"
g_QWxVAAAAAJ,v5ktijXFZgQC,Luis Ahumada (orcid.org/0000-0001-5354-9302),"Escuela de Psicología, Pontificia Universidad Católica de Valparaíso, Chile"
g_QWxVAAAAAJ,ImOyMTAAAAAJ,Felipe Jiménez Vargas,PONTIFICA UNIVERSIDAD CATOLICA DE VALPARAISO
g_QWxVAAAAAJ,KA8mx4YAAAAJ,Rodrigo Soto-Lagos,"Universidad de Santiago, Departamento de Gestión y Políticas Públicas"
g_QWxVAAAAAJ,Fh14mpIAAAAJ,Enrique Baleriola (ORCID 0000-0003-2899-6316),"Lecturer, (ROR 01f5wp925) Universitat Oberta de Catalunya, Spain"
g_QWxVAAAAAJ,rFUqIdsAAAAJ,Antonio Stecher,"PROFESOR, FACULTAD DE PSICOLOGIA, UNIVERSIDAD DIEGO PORTALES"
g_QWxVAAAAAJ,8SDLPiUAAAAJ,Nora Gray Gariazzo,Universidad Viña del Mar
g_QWxVAAAAAJ,FGQplIIAAAAJ,Guillermo Rivera-Aguilera,Pontificia Universidad Católica de Valparaíso
g_QWxVAAAAAJ,yCHmDQgAAAAJ,Lorena Ramirez,"Universidad de las Américas, Chile"
g_QWxVAAAAAJ,3DJ2obYAAAAJ,Carmen Gloria Núñez,Pontificia Universidad Catolica de Valparaiso
g_QWxVAAAAAJ,TD41voAAAAAJ,María Isabel Reyes-Espejo,Pontificia Universidad Católica de Valparaíso
g_QWxVAAAAAJ,1R8IohoAAAAJ,Paulina Contreras,Universidad de Chile
g_QWxVAAAAAJ,0gw7DogAAAAJ,Javier Campos-Martinez,Universidad Austral de Chile
g_QWxVAAAAAJ,4bK5XUQAAAAJ,Jenny Assael,"Profesor Asociado de Psicología, Universidad de Chile"
g_QWxVAAAAAJ,3xvKfmYAAAAJ,Herminia Gonzálvez Torralbo,Académica e Investigadora Universidad Central de Chile
g_QWxVAAAAAJ,ZmdjLNEAAAAJ,Hugo Campos Winter,Universidad San Sebastián
g_QWxVAAAAAJ,_BLLLlIAAAAJ,Pedro I. Leiva,"Associate Professor, Faculty of Economics and Bussines, University of Chile"
g_QWxVAAAAAJ,O-K_jJ8AAAAJ,Lupicinio Iñiguez-Rueda (ORCID: 0000-0002-1936-9428),Universitat Autònoma de Barcelona (ROR 052g8jq94)
F4Q6NTsAAAAJ,fcYWVn4AAAAJ,Andrew Hunter,University of Calgary
F4Q6NTsAAAAJ,p8rRO6sAAAAJ,Robert Weibel,"Professor of Geographic Information Science, University of Zurich"
F4Q6NTsAAAAJ,0WWgFiMAAAAJ,Ebrahim Poorazizi,"PhD in Geomatics Engineering, University of Calgary"
F4Q6NTsAAAAJ,P5gBYU8AAAAJ,Dirk Burghardt,Professor of Cartographic Communication
F4Q6NTsAAAAJ,csNbIxYAAAAJ,Geoffrey J. Hay (PhD),"Professor GIScience, University of Calgary"
F4Q6NTsAAAAJ,bFrcF-MAAAAJ,Giovanni Vecchio,"Assistant professor, Pontificia Universidad Católica de Chile"
F4Q6NTsAAAAJ,g76Pn5kAAAAJ,Jonathan R. Barton,"Institute of Geography, Institute for Sustainable Development & CEDEUS, UC Chile"
F4Q6NTsAAAAJ,DTzdaUoAAAAJ,Erwan Bocher,"Directeur de recherche au CNRS, LAB-STICC"
F4Q6NTsAAAAJ,rfDAEqIAAAAJ,Carolina Alejandra Rojas Quezada,Pontificia Universidad Católica de Chile
F4Q6NTsAAAAJ,ejoEeKIAAAAJ,Ignacio Tiznado-Aitken,"Postdoctoral Fellow, Department of Human Geography, University of Toronto"
F4Q6NTsAAAAJ,_jZ6S0UAAAAJ,Francisco de la Barrera,Fac. Ciencias Ambientales (Eula) - Universidad de Concepción & CEDEUS
F4Q6NTsAAAAJ,6lhrINgAAAAJ,Juan Carlos Munoz,Profesor Ingeniería de Transporte y Logística (PUC Chile). CEDEUS
F4Q6NTsAAAAJ,Z_lxQLEAAAAJ,Patrick Taillandier,"Senior researcher, INRAE, MIAT"
F4Q6NTsAAAAJ,ISfefdYAAAAJ,Juan Antonio Carrasco,"Professor, Department of Civil Engineering, Universidad de Concepción, Chile. CEDEUS"
F4Q6NTsAAAAJ,tEodnOcAAAAJ,Alejandra Vives,"Departament of Public Health, Pontificia Universidad Católica de Chile; GREDS-EMCONET …"
F4Q6NTsAAAAJ,cxEGKvUAAAAJ,Juan Carlos Herrera,Pontificia Universidad Católica de Chile
F4Q6NTsAAAAJ,-YdeOGkAAAAJ,Elizabeth Wagemann,Universidad Diego Portales
F4Q6NTsAAAAJ,riucRIsAAAAJ,Pablo A Pastén,Pontificia Universidad Catolica de Chile
F4Q6NTsAAAAJ,I88YCRBpQoMC,Coral Bliss Taylor,"M.Sc. in geomatics engineering, University of Calgary"
F4Q6NTsAAAAJ,XP5lOvcAAAAJ,Lake Sagaris,"Professor of planning and community development, Transport Engineering, Pontificia …"
F4Q6NTsAAAAJ,tCqB0awAAAAJ,Adam Iwaniak,
F4Q6NTsAAAAJ,M7rUGoMAAAAJ,Serena Coetzee,"Professor, Department of Geography, Geoinformatics and Meteorology,University of Pretoria"
F4Q6NTsAAAAJ,rXIJvn0AAAAJ,Samy Katumba,"University of Pretoria, Department of Geography, Geoinformatics and Meteorology"
F4Q6NTsAAAAJ,Cbc_R2IAAAAJ,Guillaume Touya,"LASTIG, IGN, Univ. Gustave Eiffel"
F4Q6NTsAAAAJ,izePJlEAAAAJ,Bénédicte Bucher,"UGE, LASTIG-MEIG, IGN-ENSG"
F4Q6NTsAAAAJ,j_StwEwAAAAJ,Vicente Aprigliano Fernandes,"Profesor Asociado, Escuela de Ingeniería de Construcción y Transporte - PUCV"
F4Q6NTsAAAAJ,zn66C5cAAAAJ,Ehsan Mohammadi,PhD of Geomatics Engineering
F4Q6NTsAAAAJ,mAkyE1sAAAAJ,Steve Liang,"Professor, University of Calgary / CTO, SensorUp"
F4Q6NTsAAAAJ,HeSw0i8AAAAJ,David Avilés,The University of Sydney
F4Q6NTsAAAAJ,sz29sQoAAAAJ,Ricardo Crespo,Universidad de Santiago
F4Q6NTsAAAAJ,iN8m6qsAAAAJ,Ricardo Truffello,"Instituto de Estudios Urbanos y Territoriales, Pontificia Universidad Católica de Chile"
F4Q6NTsAAAAJ,vlOJ_cwAAAAJ,Sonia Reyes-Paecke,Pontificia Universidad Católica de Chile
F4Q6NTsAAAAJ,X0oZ7DoAAAAJ,Felipe Jorquera,Universidad de Concepción
ytVwClgAAAAJ,YJRYlSgAAAAJ,Daniela Constanza Quiñones Otey,Pontificia Universidad Católica de Valparaíso
ytVwClgAAAAJ,9XuLJBAAAAAJ,Cesar Collazos - https://orcid.org/0000...,"Full Professor, universidad del Cauca-Colombia"
ytVwClgAAAAJ,rBCmL3kAAAAJ,Andrés Solano,Universidad Autónoma de Occidente
ytVwClgAAAAJ,uIaiIREAAAAJ,Jose L. Arciniegas H.,Universidad del Cauca
ytVwClgAAAAJ,hIm5j4kAAAAJ,Jaime Díaz-Arancibia,Universidad de la Frontera
ytVwClgAAAAJ,Blduv7EAAAAJ,Dorian Gorgan,"Professor of Computer Science, Technical University of Cluj-Napoca"
ytVwClgAAAAJ,UlF-3osAAAAJ,Jose Antonio Pow-Sang Portillo,Pontificia Universidad Católica del Perú (PUCP)
ytVwClgAAAAJ,G0hQweQAAAAJ,Toni Granollers,GRIHO research group.  University of Lleida
ytVwClgAAAAJ,zUTGlo0AAAAJ,Carina Gonzalez,Full Professor. Computer Engineering Department. Universidad de La Laguna
wacf2BUAAAAJ,BamCl30AAAAJ,ALBERTO VERGARA-FERNANDEZ,Universidad de los Andes - Chile
wacf2BUAAAAJ,7MPNMlkAAAAJ,Felipe Scott,Universidad de los Andes
wacf2BUAAAAJ,sOcK07EAAAAJ,Martín Ramírez Muñoz,Universidad de Cádiz
wacf2BUAAAAJ,fgAc4GIAAAAJ,Domingo Cantero Moreno,Universidad de Cádiz
wacf2BUAAAAJ,PVNVs3wAAAAJ,Jose Manuel Gomez Montes de Oca,"Catedrático de Ingeniería Química, Universidad de Cádiz"
wacf2BUAAAAJ,iWXYxnAAAAAJ,Carlos Ariel Cardona,Universidad Nacional de Colombia sede Manizales. Grupo de investigación PQCB. Departamento de
wacf2BUAAAAJ,KKKK6QsAAAAJ,Solange I. Mussatto,"Technical University of Denmark, Department of Biotechnology and Biomedicine"
tbQtxo4AAAAJ,Hj1s_a4AAAAJ,Claudio Silva Gallinato,"Profesor Asociado, Escuela de Ciencias del Mar, Pontificia Universidad Católica de Valparaíso"
tbQtxo4AAAAJ,Teix9dkAAAAJ,Juan Carlos Gutierrez-Estrada,Universidad de Huelva
tbQtxo4AAAAJ,iSae-WILQ4wC,Angel DelValls,
tbQtxo4AAAAJ,-j7De0gAAAAJ,Inmaculada Pulido-Calvo,Universidad de Huelva
tbQtxo4AAAAJ,AqjpTC8AAAAJ,Cristian M. Canales,"Profesor Asociado Escuela de Ciencias del Mar, Pontificia Universidad Católica de Valparaíso"
tbQtxo4AAAAJ,FNkkn0kAAAAJ,Samuel Hormazabal,"Escuela de Ciencias del Mar, Pontificia Universidad Católica de Valparaíso"
tbQtxo4AAAAJ,RymAZIcAAAAJ,Aldo Montecinos,Universidad de Concepción
tbQtxo4AAAAJ,Bb8bLeEAAAAJ,Oscar Pizarro,"Department of Geophysics, University of Concepcion"
tbQtxo4AAAAJ,I3GzTsgAAAAJ,Nelson Silva,"Escuela de Ciencias del Mar, Pontificia Universidad Católica de Valparaíso"
tbQtxo4AAAAJ,3AaoLVMAAAAJ,Pierre Fréon,"Emeritus research director, IRD, France"
tbQtxo4AAAAJ,TvmFMUUAAAAJ,"Patricio M Arana, P M Arana",Professor
tbQtxo4AAAAJ,pLQd6tQAAAAJ,Luis A. Cubillos,Universidad de Concepción
tbQtxo4AAAAJ,GJ_61yMAAAAJ,Exequiel Gonzalez Poblete,"Escuela de Ciencias del Mar, Pontificia Universidad Católica de Valparaíso"
8qV84A4AAAAJ,4wSoWR8AAAAJ,Luciano Zunino (L. Zunino),"Independent Researcher at CIOp (CONICET - CIC - UNLP), Argentina"
8qV84A4AAAAJ,HgnZguUAAAAJ,Mario Garavaglia,"Profesor de Física, Universidad Nacional de La Plata"
8qV84A4AAAAJ,kpJtD3AAAAAJ,Osvaldo Anibal Rosso,"Principal Researcher, CONICET, Argentina"
8qV84A4AAAAJ,NynEwzEAAAAJ,Gustavo Funes,Universidad de los Andes
8qV84A4AAAAJ,7T7o27QAAAAJ,Damián Gulich,"Professor, Facultad de Ingeniería - UNLP. CIOp, CONICET"
8qV84A4AAAAJ,j_0iv2cAAAAJ,Felipe Olivares,Postdoc IFISC - Plama
8qV84A4AAAAJ,84gcBMgAAAAJ,Eduardo Fabián Peters Rodríguez,"Universidad de los Andes, Chile"
8qV84A4AAAAJ,cw9s6mwAAAAJ,Néstor Bolognini,Centro de Investigaciones Opticas
8qV84A4AAAAJ,IlGf7qsAAAAJ,Regis Barille,"University of Angers, MOLTECH-Anjou"
8qV84A4AAAAJ,orHWtQEAAAAJ,Camilo Weinberger Cerro,Pontificia Universidad Católica de Valparaiso
8qV84A4AAAAJ,vYKvwJ4AAAAJ,Yohann Morille,CNRS
8qV84A4AAAAJ,jk-grE0AAAAJ,Jesús Lancis,"Full professor, Universitat Jaume I"
8qV84A4AAAAJ,wvDwqPQAAAAJ,Enrique Tajahuerce,"Universitat Jaume I, Spain"
8qV84A4AAAAJ,wLoNVa8AAAAJ,Yeraldinne Carrasco Salas,"Postdoctoral Researcher, LIPhy"
8qV84A4AAAAJ,FczfhQcAAAAJ,Myrian C Tebaldi,"Centro de Investigaciones Ópticas(CONICET La Plata, UNLP, CIC) - Uidet OPTIMO, Fac. Ingeniería, UNLP"
8qV84A4AAAAJ,VXpiIywAAAAJ,Roberto Torroba,"Centro de Investigaciones Ópticas (CONICET-CIC-UNLP) y UIDET OPTIMO, Fac Ing. UNLP."
8qV84A4AAAAJ,HXl5sWcAAAAJ,Anabela Catarino Fernandes,"Assistant Professor, Instituto Superior Técnico, Technical University of Lisbon"
B3oMZV0AAAAJ,yx03qdMAAAAJ,Alejandro Rojas-Palma,Unversidad Católica del Maule
B3oMZV0AAAAJ,79lnWZ0AAAAJ,Rodrigo Ramos-Jiliberto,"GEMA Center for Genomics, Ecology & Environment. Universidad Mayor. Chile"
B3oMZV0AAAAJ,IszS248AAAAJ,"Jose D Flores, PhD.","Professor of Mathematics, University of South Dakota"
B3oMZV0AAAAJ,R68RgBQAAAAJ,Pablo Aguirre,Universidad Técnica Federico Santa María
B3oMZV0AAAAJ,8uNTqnAAAAAJ,Fernando Córdova-Lepe,Universidad Católica del Maule (Director of DM2A-UCM)
B3oMZV0AAAAJ,Ce7ty_YAAAAJ,Dr. Claudio Arancibia-Ibarra,Queensland University of Technology (QUT) - Universidad de las Americas
B3oMZV0AAAAJ,JYHEQIwAAAAJ,Jaime A. Huincahue Arcos,Universidad Católica del Maule
B3oMZV0AAAAJ,ViWUN7wAAAAJ,Karina Vilches Ponce,"Académica, Universidad Católica del Maule"
B3oMZV0AAAAJ,Ke-iYUQAAAAJ,soledad torres,"Academica  CIMFAV, Facultad de Ingeniería Universidad de Valparaíso"
B3oMZV0AAAAJ,iLdoEJwAAAAJ,Gonzalo Robledo Veloso,"Universidad de Chile, Facultad de Ciencias, Depto. de Matemáticas"
B3oMZV0AAAAJ,n_eV42sAAAAJ,Manuel Falconi,
B3oMZV0AAAAJ,LXEfgB4AAAAJ,Manuel Pinto,"Profesor Titular, Departamento de Matemáticas U. de Chile"
oTtpxGcAAAAJ,yx03qdMAAAAJ,Alejandro Rojas-Palma,Unversidad Católica del Maule
oTtpxGcAAAAJ,79lnWZ0AAAAJ,Rodrigo Ramos-Jiliberto,"GEMA Center for Genomics, Ecology & Environment. Universidad Mayor. Chile"
oTtpxGcAAAAJ,IszS248AAAAJ,"Jose D Flores, PhD.","Professor of Mathematics, University of South Dakota"
oTtpxGcAAAAJ,R68RgBQAAAAJ,Pablo Aguirre,Universidad Técnica Federico Santa María
oTtpxGcAAAAJ,8uNTqnAAAAAJ,Fernando Córdova-Lepe,Universidad Católica del Maule (Director of DM2A-UCM)
oTtpxGcAAAAJ,Ce7ty_YAAAAJ,Dr. Claudio Arancibia-Ibarra,Queensland University of Technology (QUT) - Universidad de las Americas
oTtpxGcAAAAJ,JYHEQIwAAAAJ,Jaime A. Huincahue Arcos,Universidad Católica del Maule
oTtpxGcAAAAJ,ViWUN7wAAAAJ,Karina Vilches Ponce,"Académica, Universidad Católica del Maule"
oTtpxGcAAAAJ,iLdoEJwAAAAJ,Gonzalo Robledo Veloso,"Universidad de Chile, Facultad de Ciencias, Depto. de Matemáticas"
oTtpxGcAAAAJ,Ke-iYUQAAAAJ,soledad torres,"Academica  CIMFAV, Facultad de Ingeniería Universidad de Valparaíso"
oTtpxGcAAAAJ,n_eV42sAAAAJ,Manuel Falconi,
oTtpxGcAAAAJ,LXEfgB4AAAAJ,Manuel Pinto,"Profesor Titular, Departamento de Matemáticas U. de Chile"
Qpgm5hkAAAAJ,TIK9gKYAAAAJ,Cristian A. Carvajal,"Associate Professor, Endocrinology Department, Medicine, Pontificia Universidad Católica de Chile"
Qpgm5hkAAAAJ,3QjSMq0AAAAJ,Carlos P Vio,Universidad San Sebastian
Qpgm5hkAAAAJ,y-YvXSwAAAAJ,Lara LS,Universidade Federal do Rio de Janeiro
Qpgm5hkAAAAJ,9QBWM9MAAAAJ,Carlos Cespedes Fierro,Universidad San Sebastián
Qpgm5hkAAAAJ,udF2HwUAAAAJ,Liu Liu,Thomas Jefferson University Hospital
Qpgm5hkAAAAJ,qW6f9MwAAAAJ,"Fernando B. Avila Rencoret, M.D., M.R...",Medical Insights & Design Engineering at CDP plc
Qpgm5hkAAAAJ,eyRAxgsAAAAJ,Amparo González-Ferrer,"CSIC, Centro de Ciencias Humanas y Sociales, Instituto Economía, Geografía y Demografía"
CdhGscUAAAAJ,dzPf_h4AAAAJ,Claudio Álvarez,centro de estudios avanzados en zonas aridas
CdhGscUAAAAJ,7x2N9moAAAAJ,Sergio H. Marshall,Profesor Pontificia Universidad Catolica de Valparaiso
CdhGscUAAAAJ,BrEXalEAAAAJ,Ivan Nombela,Charite Universitätsmedizin Berlin
CdhGscUAAAAJ,DxHrqxMAAAAJ,Paula Andrea Santana Sepulveda,"Profesor Asistente, Instituto de Ciencias Químicas Aplicadas. Universidad Autónoma de Chile"
CdhGscUAAAAJ,ZYtA6PwAAAAJ,Lina Jimena Cortés Salinas,Inv. Asociada Laboratorio Genética e Inmunología - Pontificia Universidad Católica de Valparaíso
CdhGscUAAAAJ,VJnyMhUAAAAJ,LUIS PEREZ GARCIA-ESTAÑ,Universidad Miguel Hernández
CdhGscUAAAAJ,8qY2AFAAAAAJ,Katherina Brokordt,"Aquaculture Department - Universidad Catolica del Norte, Chile"
CdhGscUAAAAJ,s3ldiGEAAAAJ,Constanza Cardenas,"Research Associated, NBC Pontificia Universidad Católica de Valparaíso"
CdhGscUAAAAJ,gQHmbqcAAAAJ,Jose Gallardo Matus,"Profesor adjunto, Escuela de Ciencias del Mar, Pontificia Universidad Católica de Valparaíso."
CdhGscUAAAAJ,sQtI8BAAAAAJ,Sebastian Boltana,Universidad de Concepcion
CdhGscUAAAAJ,adtUWGMAAAAJ,Alberto Cuesta  https://orcid.org/ 0000-...,University of Murcia https://ror.org/03p3aeb86
CdhGscUAAAAJ,n0k92DYAAAAJ,Alfredo Molina,universidad andres bello
CdhGscUAAAAJ,QkUJZFgAAAAJ,Rodrigo Zuloaga Royo,Universidad Andres Bello
CdhGscUAAAAJ,w8pGzWIAAAAJ,Marcelo González-Aravena,Instituto Antártico Chileno
CdhGscUAAAAJ,MKDk35YAAAAJ,Manuel A. Bravo M,Pontificia Universidad Católica de Valparaiso
CdhGscUAAAAJ,pVfEeWEAAAAJ,Rafael Diego Rosa,"Professor, Federal University of Santa Catarina"
CdhGscUAAAAJ,9XtOaBUAAAAJ,Waldo Quiroz,Pontificia Universidad Católica de Vaparaíso
q9oUJekAAAAJ,5-Twp4gAAAAJ,GABRIEL JAIME CASTAÑO VILLA,Universidad de Caldas
q9oUJekAAAAJ,UqjRlPUAAAAJ,Jaime E. Jiménez,"Professor of Wildlife Ecology, University of North Texas"
q9oUJekAAAAJ,g7jFEI0AAAAJ,Carezza Botto-Mahan,"Professor, Universidad de Chile"
q9oUJekAAAAJ,m0aNArAAAAAJ,Roberto F Nespolo,Universidad Austral de Chile
q9oUJekAAAAJ,Xa4T9uYAAAAJ,Juan L. Celis-Diez,Pontificia Universidad Católica de Valparaíso
q9oUJekAAAAJ,LHNXo5wAAAAJ,Lorena Vieli del Rio,Universidad de La Frontera
q9oUJekAAAAJ,YrhtpGoAAAAJ,LUIS FLORES PRADO,"Profesor Asociado, Instituto de Entomología Universidad Metropolitana de Ciencias de la …"
q9oUJekAAAAJ,g4Q585k0BUkC,Maureen Murúa Ibarra,"GEMA center: genomics, ecology y enrivonment. Universidad Mayor"
q9oUJekAAAAJ,gWS0_9UAAAAJ,Guillermo C. Amico,Universidad Nacional del Comahue
q9oUJekAAAAJ,wJZsuVsAAAAJ,Francisco Bozinovic,"CAPES & Departamento de Ecología, Universidad Católica de Chile"
q9oUJekAAAAJ,xu-s868AAAAJ,Lida Marcela Franco Pérez,"Facultad de Ciencias Naturales y Matemáticas, Universidad de Ibagué, Carrera 22 Calle 67 …"
q9oUJekAAAAJ,cd7EXMMAAAAJ,Jacques Gardon,Institut de Recherche pour le Développement IRD
q9oUJekAAAAJ,OP0ZdHUAAAAJ,Alejandro Pablo Sabat,"Profesor Titular, Universidad de Chile"
q9oUJekAAAAJ,TrKYqaEAAAAJ,Pedro Jordano,"Professor of Research, Estación Biol. Doñana, CSIC; Univ. Sevilla-https://orcid.org/0000 …"
q9oUJekAAAAJ,GbPdJO4AAAAJ,Gastón O. Carvallo,Pontificia Universidad Católica de Valparaíso
