scholar_id_autor_gs,scholar_id_gs_coauthor,nombre_coauthor,cargo
xmIk_7EAAAAJ,jrzmdcIAAAAJ,Octavio Luiz Franco,"Universidade Católica Dom Bosco, Universidade Catolica de Brasilia, Universidade de Brasilia"
xmIk_7EAAAAJ,K2GfDWQAAAAJ,Sónia Troeira Henriques,"Institute of Health and Biomedical Innovation, Translational Research Institute, QUT"
kLqJUfsAAAAJ,m8StE7MAAAAJ,Astrid Morrison,Secretaria Academica Pedagogia en Ingles sede Talca at Universidad Autonoma de Chile
jimR0lYAAAAJ,cUznvtgAAAAJ,Fabien Le Bonniec,Departamento de Ciencias Sociales de la Universidad de la Frontera
jimR0lYAAAAJ,0C0XnMoAAAAJ,Ricardo Salas astrain,"Profesor de Filosofía, Universidad Católica de Temuco"
jimR0lYAAAAJ,j6JfNhAAAAAJ,Sheila Fernández Miguez,Investigadora Posdoctoral Fondecyt. Doctora por la Universidad Autónoma de Chile y Universidade da
jimR0lYAAAAJ,VIDyMeMAAAAJ,Liz Vallejos Roa,Universidad Autónoma de Chile
jimR0lYAAAAJ,mATNeSoAAAAJ,Elisa Cruz Rueda,Profesora Investigadora Universidad Autónoma de Chiapas
jimR0lYAAAAJ,m6z3534AAAAJ,Ana Luisa Guerrero Guerrero,"Profesor Titular ""A"" de tiempo completo"
z0iM1NkAAAAJ,ryWpeWIAAAAJ,Gino Corsini,Universidad Autónoma de Chile
z0iM1NkAAAAJ,Ukp9znUAAAAJ,Leonardo Pavez,"Universidad de Las Américas, Chile"
z0iM1NkAAAAJ,7mzmAsUAAAAJ,Katherine Garcia,Universidad Autónoma de Chile
z0iM1NkAAAAJ,_UGqWqAAAAAJ,Ana Gutiérrez Moraga,"Directora de Investigación, Universidad Autónoma de Chile"
z0iM1NkAAAAJ,zdIuFAUAAAAJ,Roberto Bastias Romo,Pontificia Universidad Católica de Valparaíso
z0iM1NkAAAAJ,W8THEBcAAAAJ,Nicolás Plaza Morales,Universidad Autónoma de Chile
z0iM1NkAAAAJ,dC9ANWEAAAAJ,Diliana Pérez Reytor,Universidad Autónoma de Chile
z0iM1NkAAAAJ,hcuF20YAAAAJ,Paz Orellana,Universidad Autónoma de Chile
z0iM1NkAAAAJ,6UknP20AAAAJ,Daniel Castillo,"Assistant Professor, Universidad SEK"
z0iM1NkAAAAJ,bvtMvBUAAAAJ,Paola Navarrete,"Associate Professor, INTA, University of Chile"
z0iM1NkAAAAJ,t7pmaZAAAAAJ,lorena salazar,Universidad Autònoma de Chile
z0iM1NkAAAAJ,zrHGPggAAAAJ,sandra cespedes,"Profesor de Microbiología, Universidad Autónoma de Chile"
z0iM1NkAAAAJ,ChnUSJEAAAAJ,Laura Muiño,Universidad Autónoma de Chile
MKHM2loAAAAJ,VvU3h6wAAAAJ,Cecilia Vial,"Associate Professor, Universidad del Desarrollo"
MKHM2loAAAAJ,AWmBPwEAAAAJ,Felipe Benavides,Universidad del Desarrollo
MKHM2loAAAAJ,DGr9pFsAAAAJ,Gabriela Repetto,"Rare Diseases Program, Center for Genetics and Genomics, Facultad de Medicina, Clinica Alemana"
MKHM2loAAAAJ,CstNjqYAAAAJ,Guillermo Lay-Son,"Facultad de Medicina, Pontificia Universidad Católica de Chile"
MKHM2loAAAAJ,NhQRFO8AAAAJ,Daniel E. Almonacid,"CSO, Digbi Health"
3wQIXwYAAAAJ,DZZrf5AAAAAJ,Gerardo Damonte,Pontificia Universidad Católica del Perú. Departamento de Ciencias Sociales. GRADE
3wQIXwYAAAAJ,Zz8E104AAAAJ,Diego Murguía,"Instituto Interdisciplinario Economía Política - FCE/UBA, CONICET"
3wQIXwYAAAAJ,lcwg44UAAAAJ,Catalina Quiroga Manrique,"PhD Student, Lund University"
3wQIXwYAAAAJ,_X9UoJoAAAAJ,Astrid Ulloa,Universidad Nacional de Colombia
3wQIXwYAAAAJ,lnCU8oAAAAAJ,Hayley Stevenson,Universidad Torcuato Di Tella
3wQIXwYAAAAJ,oYSSw-YAAAAJ,Paul Alexander Haslam,"Professor of International Development, University of Ottawa"
3wQIXwYAAAAJ,rDndPygAAAAJ,Manuel Glave,"GRADE, Grupo de Analisis para el Desarrollo, Departamento de Economia de la Pontificia Universidad Catolica del Peru"
NYdp6U4AAAAJ,Z8EkWFQAAAAJ,Marysol Alvear,UNIVERSIDAD DE LA FRONTERA
NYdp6U4AAAAJ,mb_L_nwAAAAJ,Milko A. Jorquera,"Scientific and Technological Bioresource Nucleus (BIOREN), Universidad de La Frontera, Temuco, Chile"
NYdp6U4AAAAJ,rkVR3_kAAAAJ,Michael Sadowsky,University of Minnesota
NYdp6U4AAAAJ,xYoJWMUAAAAJ,Osvaldo Ulloa,"Universidad de Concepción, Chile"
NYdp6U4AAAAJ,6YaAX3sAAAAJ,GIOVANNI ANDRE LARAMA DENIS,Universidad de La Frontera
NYdp6U4AAAAJ,aTaxRcIAAAAJ,Salvador Ramirez-Flandes,Universidad de Concepcion
NYdp6U4AAAAJ,wEkWbTQAAAAJ,edward francis delong,"Professor, University of Hawaii, Manoa"
1D1-MucAAAAJ,VCUKoQwAAAAJ,Ramón Sotomayor-Zárate,Universidad de Valparaíso
1D1-MucAAAAJ,FhUeKWwAAAAJ,Jenny L Fiedler,Laboratorio de Neuroplasticidad y Neurogenética. Facultad de Ciencias Químicas y Farmacéuticas
1D1-MucAAAAJ,er-ceg8AAAAJ,Mauricio D Dorfman,"Research Assistant Professor, Diabetes Institute, University of Washington"
1D1-MucAAAAJ,JfhYiq8AAAAJ,Gonzalo Cruz,"CENFI,Instituto de Fisiología,Universidad de Valparaiso"
1D1-MucAAAAJ,UeZPwPAAAAAJ,Rafael Antoni Barra Pezo,usach
VWePAhoAAAAJ,gMGcPm4AAAAJ,Jorge Nimptsch,Universidad Austral de Chile
VWePAhoAAAAJ,KacGp-QAAAAJ,Víctor Gerding,Universidad Austral de Chile
VWePAhoAAAAJ,Ow0XjtMAAAAJ,Pablo J. Donoso,Professor Universidad Austral de Chile
VWePAhoAAAAJ,5eZSlJwAAAAJ,Ivo Janos Fustos-Toribio,"Departamento en Ingenieria de Obras Civiles, Universidad de la Frontera"
VWePAhoAAAAJ,1LyOmwkAAAAJ,David Fonseca-Luengo,"Universidad Católica de Temuco, Chile"
M1HHaLAAAAAJ,3s6fr_QAAAAJ,Oriol Rios Gonzalez,Professor at Universitat Rovira i Virgili
M1HHaLAAAAAJ,9e0UaL8AAAAJ,Valeria A. Boll Henríquez,"Académica Universidad del Bio Bio, Facultad de Educación y Humanidades, Departamento de Trabajo Social. Concepción, Chile."
M1HHaLAAAAAJ,fNw-xX4AAAAJ,Eduardo Sandoval-Obando,Académico en Universidad Autónoma de Chile
M1HHaLAAAAAJ,xlNX4ocAAAAJ,Maria Teresa Huentequeo Toledo,Docente Investigadora Escuela Trabajo Social Universidad Autónoma de Chile
4SIT6I4AAAAJ,bLjAEcwAAAAJ,Anna Robinson,University of Strathclyde
4SIT6I4AAAAJ,JCQ9j88AAAAJ,Andres Kalawski Isla,Pontificia Universidad Católica de Chile
4SIT6I4AAAAJ,-OlV-4cAAAAJ,Leonor Irarrázaval,Universidad de Chile
gE4aCtEAAAAJ,z-FyS-EAAAAJ,Timothy J. Lee,NASA Ames Research Center
gE4aCtEAAAAJ,a657lGAAAAAJ,Cristian Antonio Linares-Flores,Universidad Autonoma de Chile
gE4aCtEAAAAJ,ce1kvYUAAAAJ,Diego Mardones,"Departamento de Astronomía, Universidad de Chile"
gE4aCtEAAAAJ,GYbT_iIAAAAJ,Ramiro Arratia-Perez,Universidad Andres Bello
gE4aCtEAAAAJ,TRwuGNUAAAAJ,Xinchuan Huang,SETI Institute / NASA Ames Research Center
gE4aCtEAAAAJ,ZFdzVqoAAAAJ,Ryan C. Fortenberry,"Associate Professor of Chemistry, University of Mississippi"
gE4aCtEAAAAJ,VzOkXYQAAAAJ,patricio fuentealba,profesor de fisica Uch
gE4aCtEAAAAJ,H6-Y33AAAAAJ,Santiago Sanchez-Cortes,"Scientific Researcher. Instituto de Estructura de la Materia, CSIC"
1i0V4ToAAAAJ,cykoivsAAAAJ,Rodolfo Figueroa,Universidad de La Frontera
VAZeRyoAAAAJ,jB9gYH4AAAAJ,Sergio L Vargas,University of Chile
VAZeRyoAAAAJ,zPwnpsUAAAAJ,Andrea Méndez,Universidad de las Américas
MuxTFIwAAAAJ,4eTHmnAAAAAJ,R.M.Harrison,"Professor of Environmental Health, University of Birmingham"
MuxTFIwAAAAJ,s2x6-ogAAAAJ,Carola Blazquez,"Professor, Universidad Andres Bello, Chile"
MuxTFIwAAAAJ,zfbYp6gAAAAJ,Pablo Ruiz Rudolph,"Associate Professor of Environmental Health, University of Chile"
MuxTFIwAAAAJ,aWD-shUAAAAJ,Edmundo Muñoz Alvear,Universidad Andrés Bello
MuxTFIwAAAAJ,3KoBmTgAAAAJ,Juana Maria Delgado-Saborit,"Lecturer Environmental Science, University of Birmingham"
MuxTFIwAAAAJ,4VWOKUgAAAAJ,María Elisa Quinteros ORCID iD0000-...,"Public Health Department, Universidad de Talca"
MuxTFIwAAAAJ,FNXzNykAAAAJ,Carlos Rojas G.,"Profesor de Ingeniería Eléctrica, Universidad de Oviedo"
MuxTFIwAAAAJ,QyCzrYcAAAAJ,MARA XIMENA CEA LEMUS,"Profesor Asistente, Universidad de La Frontera"
MuxTFIwAAAAJ,4aycMAcAAAAJ,Alfredo Iriarte,Universidad de Talca
MuxTFIwAAAAJ,cyE5M-0AAAAJ,Juan Carlos Beaumont,"Coordinador de Laboratorio de Eficiencia Energética y docente de Ingeniería en Construcción, Universidad Autónoma de Chile"
MuxTFIwAAAAJ,_87Kn0AAAAAJ,Cristian Araneda,"Associate Professor, Depto. Producción Animal, Universidad de Chile"
39X907EAAAAJ,0rviEIkAAAAJ,Carlos Poblete-Aro,Docente. Universidad de Santiago de Chile
39X907EAAAAJ,DjLPCogAAAAJ,Antonio García-Hermoso (ORCID: 000...,"Navarrabiomed, Universidad Pública de Navarra"
39X907EAAAAJ,t7uOwVEAAAAJ,Cristian Cofre Bolados,Escuela de Ciencias de la Actividad Física Universidad de Santiago
39X907EAAAAJ,e_D6W2MAAAAJ,Tomas Herrera-Valenzuela,"Laboratorio de Ciencias de la Actividad Física, el Deporte y la Salud, Facultad de Ciencias Médicas"
39X907EAAAAJ,7UeeIB4AAAAJ,"Robinson Ramírez-Vélez, Ph.D (ORCI...","Department of Health Sciences, Public University of Navarra"
39X907EAAAAJ,BgXxxS8AAAAJ,Ramón Rodrigo,"Programa de Farmacología Molecular y Clínica, Instituto de Ciencias Biomédicas, Facultad de Medicina, Universidad de Chile"
39X907EAAAAJ,02oA4PoAAAAJ,Borja del Pozo Cruz,University of Cadiz & Southern Denmark University
39X907EAAAAJ,Sq_r16AAAAAJ,Matí­as Monsalves-Alvarez,Universidad de O’ Higgins
39X907EAAAAJ,JfhYiq8AAAAJ,Gonzalo Cruz,"CENFI,Instituto de Fisiología,Universidad de Valparaiso"
39X907EAAAAJ,gUynY7kAAAAJ,Carla Basualto-Alarcón,"Departamento de Ciencias de la Salud, Universidad de Aysén; Departamento de Anatomía y Medicina Legal, Facultad de Medicina, Universidad de Chile"
39X907EAAAAJ,6FJnI74AAAAJ,Mikel Izquierdo (ORCID: 0000-0002-1...,"Department of Health Sciences, Public University of Navarra (Full Professor)"
39X907EAAAAJ,dj0hz_YAAAAJ,Alicia Mª Alonso Martínez,Universidad Pública de Navarra
39X907EAAAAJ,6TOdTtEAAAAJ,Gina Sanchez,Facultad de Medicina Universidad de Chile
39X907EAAAAJ,7OLT3eoAAAAJ,Roberto Meneses Valdes,University of Copenhagen
dC9ANWEAAAAJ,7mzmAsUAAAAJ,Katherine Garcia,Universidad Autónoma de Chile
dC9ANWEAAAAJ,W8THEBcAAAAJ,Nicolás Plaza Morales,Universidad Autónoma de Chile
dC9ANWEAAAAJ,zdIuFAUAAAAJ,Roberto Bastias Romo,Pontificia Universidad Católica de Valparaíso
dC9ANWEAAAAJ,Ukp9znUAAAAJ,Leonardo Pavez,"Universidad de Las Américas, Chile"
dC9ANWEAAAAJ,6UknP20AAAAJ,Daniel Castillo,"Assistant Professor, Universidad SEK"
dC9ANWEAAAAJ,bvtMvBUAAAAJ,Paola Navarrete,"Associate Professor, INTA, University of Chile"
dC9ANWEAAAAJ,eNJwvTwAAAAJ,Eduardo Karahanian,Universidad Autónoma de Chile
dC9ANWEAAAAJ,ryWpeWIAAAAJ,Gino Corsini,Universidad Autónoma de Chile
dC9ANWEAAAAJ,SNz4keUAAAAJ,Carlos J Blondel,Universidad Andres Bello
dC9ANWEAAAAJ,GIB2jSAAAAAJ,Romilio Espejo,"Instituto de Nutrición y Tecnología de los Alimentos, Universidad de Chile"
W8THEBcAAAAJ,7mzmAsUAAAAJ,Katherine Garcia,Universidad Autónoma de Chile
A3EUj6IAAAAJ,DC-1QokAAAAJ,"Pablo Valdés-Badilla, Ph.D.",Universidad Católica del Maule
A3EUj6IAAAAJ,mOV4_qoAAAAJ,Relmu Gedda-Muñoz,Universidad Autónoma de Chile - Universitat Autònoma de Barcelona
A3EUj6IAAAAJ,gy9m39wAAAAJ,Carla Figueroa Saavedra,Universidad Autónoma de Chile
A3EUj6IAAAAJ,ehMuZhIAAAAJ,Noemi Salvador Soler,"Docente investigador, Universidad Autónoma de Chile"
DxHrqxMAAAAJ,CdhGscUAAAAJ,Luis Mercado Vianco,Pontificia Universidad Católica de Valparaíso
DxHrqxMAAAAJ,dzPf_h4AAAAJ,Claudio Álvarez,centro de estudios avanzados en zonas aridas
DxHrqxMAAAAJ,ZYtA6PwAAAAJ,Lina Jimena Cortés Salinas,Inv. Asociada Laboratorio Genética e Inmunología - Pontificia Universidad Católica de Valparaíso
DxHrqxMAAAAJ,PKWdVK4AAAAJ,Juan Carlos Forero Oliveros,MSc. Technological innovation / PhD. Biotechnology
DxHrqxMAAAAJ,m5keN_4AAAAJ,Carolina Castillo Vicencio,Universidad Autónoma de Chile
DxHrqxMAAAAJ,gy6Mxw8AAAAJ,Fernando Albericio,University of KwaZulu-Natal & Universiy of Barcelona
DxHrqxMAAAAJ,mRobyaoAAAAJ,Sebastián Michea Mora,"Académico Investigador, Universidad Autónoma de Chile"
m5YFlA8AAAAJ,LeQUGDIAAAAJ,Salvador Chacón-Moscoso,Universidad de Sevilla/ Universidad Autonoma de Chile
m5YFlA8AAAAJ,mowOHhUAAAAJ,Susana Sanduvete-Chaves,Universidad de Sevilla
m5YFlA8AAAAJ,jnzfqroAAAAJ,Francisco Pablo Holgado Tello,"Catedrático de Universidad, UNED"
m5YFlA8AAAAJ,FUzGALQAAAAJ,Mariona Portell,Universitat Autònoma de Barcelona
m5YFlA8AAAAJ,EzyUQvUAAAAJ,Antonio Aguilera-Jiménez,Profesor de Universidad de Sevilla
m5YFlA8AAAAJ,sa70x3kAAAAJ,josé Luis Losada Lopez,
m5YFlA8AAAAJ,zhEgd7QAAAAJ,Milagrosa Sánchez Martín,Universidad Loyola Andalucía
m5YFlA8AAAAJ,ps6c6HkAAAAJ,Diana Martella,"Docente e Investigador, Universidad Autonoma de Chile"
m5YFlA8AAAAJ,E9iIHWwAAAAJ,Laura Lara,Universidad de Sevilla
m5YFlA8AAAAJ,pWZjC4AAAAAJ,Mahia Saracostti,Universidad de Valparaiso
m5YFlA8AAAAJ,s-2CFoYAAAAJ,Taly Reininger,"Departamento de Trabajo Social, Universidad de Chile"
m5YFlA8AAAAJ,Z5yD7ZYAAAAJ,Jesús Garcia-Martínez,"Profesor Titular. Departamento de Personalidad, Evaluación y Tratamiento Psicológicos. Facultad de"
m5YFlA8AAAAJ,fiEf3XwAAAAJ,M. Teresa Anguera,Universidad de Barcelona
m5YFlA8AAAAJ,BLQQg24AAAAJ,Alma Rosa Rojas Garcia,Docente de la Universidad Autónoma de Nayarit
aX2MaWYAAAAJ,5DHMSXMAAAAJ,Jonas Preposi Cruz,"School of Medicine, Nazarbayev University"
aX2MaWYAAAAJ,ZpLCjVYAAAAJ,Juan Eduardo Ortiz López,Universidad de las Américas
aX2MaWYAAAAJ,JhfCvJEAAAAJ,Kamau S. Macharia,"Lecturer, Nursing sciences"
aX2MaWYAAAAJ,nBDLlDEAAAAJ,Ioanna V. Papathanasiou,"Associate Professor, Nursing Department, University of Thessaly, Greece"
aX2MaWYAAAAJ,9JGraPsAAAAJ,Simon Ching Lam,Tung Wah College
aX2MaWYAAAAJ,zApVn9kAAAAJ,Mohammed Baqer Abbas Al-Jubouri,University of Baghdad - College of Nursing
aX2MaWYAAAAJ,tLdkM3kAAAAJ,Dra. Mirliana  Ramírez-Pereira,"Academica, Departamento de Enfermeria, Universidad de Chile"
aX2MaWYAAAAJ,j92xG_1XaJoC,Paolo C. Colet,
aX2MaWYAAAAJ,Gzqx3AQAAAAJ,Rhea Faye Felicilda Reynaldo,"American Sentinel University, Missouri State University"
aX2MaWYAAAAJ,bCzYRcoAAAAJ,Howieda Fouly,"Associate prof. Assiut University& Assist. prof. KSAU, CON-J."
aX2MaWYAAAAJ,BHXdidoAAAAJ,Glenn Ford  Valdez,"FP- Research, Development  & Community Services -Oman College of Health Sciences …"
aX2MaWYAAAAJ,WLojGIgAAAAJ,Joseph Almazan,Nazarbayev University
aX2MaWYAAAAJ,hd8IxVMAAAAJ,AR Cayaban,"Sultan Qaboos University, College of Nursing"
aX2MaWYAAAAJ,YIIL8LAAAAAJ,Joel Estacio,Don Mariano Marcos Memorial State University
aX2MaWYAAAAJ,gDwxzBYAAAAJ,Norma Raul,Docente en Simulación Clínica
aX2MaWYAAAAJ,Q-D0SWUAAAAJ,Prof Erhabor Sunday Idemudia,North-West University
aX2MaWYAAAAJ,xhkfwOAAAAAJ,Adraa Hussein Shawq,university of Baghdad
aX2MaWYAAAAJ,udMt5aAAAAAJ,Ryan Michael F. Oducado,West Visayas State University
aX2MaWYAAAAJ,eR-XSZIAAAAJ,Diego Andrés Díaz-Guio,VitalCare Centro de Simulación Clínica
aX2MaWYAAAAJ,LoHGqewAAAAJ,Safad R.Isam,Assistant Instructor
aX2MaWYAAAAJ,zvKGPkEAAAAJ,Shaymaa Mohammed Hussein,"An Assistant Instructor of Nursing, University of Baghdad, College of Nursing"
aX2MaWYAAAAJ,39qGq08AAAAJ,Sadeq AL-Fayyadh,"An Associate Professor of Nursing, University of Baghdad,College of Nursing"
aX2MaWYAAAAJ,CGJa3E8AAAAJ,Patience Edoho Samson-Akpan,"Professor of Nursing, University of Calabar"
aX2MaWYAAAAJ,3fO5p1EAAAAJ,Hawa Alabdulaziz,Assistant Professor Paediatric Nursing/ King Abdulaziz University
aX2MaWYAAAAJ,wI86CMgAAAAJ,Matanee Radabutr,"Boromarajonani College of Nursing, Changwat Nonthaburi, Faculty of Nursing …"
aX2MaWYAAAAJ,mE2s-HMAAAAJ,Carlos Canova Barrios,Universidad de Ciencias Empresariales y Sociales
aX2MaWYAAAAJ,Qd4odyUAAAAJ,Ejercito Mangawa Balay-odao,Nazarbayev University
aX2MaWYAAAAJ,3424zYwAAAAJ,Farid Ghrayeb,Al quds University
aX2MaWYAAAAJ,b86nCuMAAAAJ,Mohammed Qtait,nursing
aX2MaWYAAAAJ,4hfH7dgAAAAJ,Xian-Liang Liu,Charles Darwin University
aX2MaWYAAAAJ,xJTEaTAAAAAJ,Patricia Alonso Galbán,Cuban National Center of Medical Sciences Information
aX2MaWYAAAAJ,E4mqqDYAAAAJ,Evanilda Souza de Santana Carvalho,Universidade Estadual de Feira de Santana
aX2MaWYAAAAJ,K5_NHUEAAAAJ,ANDERSON REIS DE SOUSA,Professor de Enfermagem
aX2MaWYAAAAJ,aMKycl4AAAAJ,Carlos Oscar Lepez,Universidad de Buenos Aires
aX2MaWYAAAAJ,u0j7b8AAAAAJ,Jeane Freitas de Oliveira,"Professora de Enfermagem, universidade federal da Bahia"
aX2MaWYAAAAJ,zS5hOtwAAAAJ,Carolina Zapata Aqueveque,"Profesor instructor, Universidad Autónoma de Chile"
aX2MaWYAAAAJ,jhy5kqMAAAAJ,William Castillo-González,Universidad de Buenos Aires; CONICET
aX2MaWYAAAAJ,QpGjibMAAAAJ,Adrián Alejandro Vitón-Castillo,Universidad de Ciencias Médicas de Pinar del Rio
aX2MaWYAAAAJ,sQd7LsMAAAAJ,Javier Gonzalez-Argote,"Fundación Salud, Ciencia y Tecnología, Argentina"
aX2MaWYAAAAJ,vvgDofUAAAAJ,Glauber Weder dos Santos Silva,Universidade Federal do Rio Grande do Norte
aX2MaWYAAAAJ,C7AYBloAAAAJ,Adrián Alejandro Rojas Concepción,
aX2MaWYAAAAJ,AvIzhSwAAAAJ,Evagelos C. Fradelos,"Department of Nursing, University of Thessaly"
aX2MaWYAAAAJ,QiuVs08AAAAJ,Judith B Cornelius,University of North Carolina at Charlotte
aX2MaWYAAAAJ,mJ-ZQ2cAAAAJ,Charlene Downing,"Professor, Department of  Nursing, University of Johannesburg"
aX2MaWYAAAAJ,oTYHdYQAAAAJ,Riksa Wibawa Resna,Sekolah Tinggi Ilmu Kesehatan Banten
aX2MaWYAAAAJ,HB_v1I0AAAAJ,Carlos Alberto Gómez Cano,Corporación Unificada Nacional de Educación Superior - CUN
aX2MaWYAAAAJ,1NKNKNEAAAAJ,"James Montegrico, PhD, RN, CMSRN","Assistant Professor, School of Nursing, University of North Carolina at Charlotte"
aX2MaWYAAAAJ,Z-LZiyMAAAAJ,Dr. Helen shaji,"SRI BALAJI VIDYAPEETH UNIVERSITY, India"
aX2MaWYAAAAJ,DdR0QgIAAAAJ,Nuran Aydin,İstanbul Medipol Üniversitesi
E0Ed58EAAAAJ,b0qmbcEAAAAJ,Leonardo Silva Santos,"Full Professor (Profesor Titular), Instituto de Química de Recursos Naturales, Universidad de Talca"
E0Ed58EAAAAJ,MyFtz2gAAAAJ,Oscar Valdés Lizama,Universidad Católica del Maule
E0Ed58EAAAAJ,G_-vAEcAAAAJ,Diana Abril,Universidad Católica del Maule
E0Ed58EAAAAJ,ADcHrz0AAAAJ,Adolfo Marican,Lecturer Professor
E0Ed58EAAAAJ,-I0-uyMAAAAJ,Felipe Laurie,"Professor of Enology, Universidad de Talca, Chile"
E0Ed58EAAAAJ,VfZDNC4AAAAJ,Mario J. Simirgiotis,"Universidad Austral de Chile, Full professor"
E0Ed58EAAAAJ,kTo3fL4AAAAJ,Alexander F. de la Torre,"Professor of Organic Chemistry, University of Concepcion"
E0Ed58EAAAAJ,qjRgPtkAAAAJ,Dr. N. Shankaraiah,Associate Professor
E0Ed58EAAAAJ,mQ-y-DIAAAAJ,Fabiane Manke Nachtigall,"Profesora de Química, Universidad Autónoma de Chile"
E0Ed58EAAAAJ,arS62x4AAAAJ,Jans Alzate Morales,"Associate Professor, Centro de Bioinformática, Simulación y Modelado (CBSM), University of Talca"
E0Ed58EAAAAJ,iRc-CqIAAAAJ,Julio Caballero,Universidad de Talca
E0Ed58EAAAAJ,8Kw8w_kAAAAJ,Eugênia C. Pereira,"Professor Titular de Geografia, Universidade Federal de Pernambuco, Brasil"
j54GIOQAAAAJ,qarTv4UAAAAJ,Ximena Zarate,"Universidad Autónoma de Chile, Instituto de Ciencias Químicas Aplicadas"
j54GIOQAAAAJ,6FYqjJEAAAAJ,Eduardo Schott,Pontificia Universidad Catolica de Chile
j54GIOQAAAAJ,kMKmPeoAAAAJ,Dayán Páez-Hernández,Universidad Andres Bello
j54GIOQAAAAJ,5Z8nZOwAAAAJ,Yoan Hidalgo-Rosa,Universidad Andrés Bello
j54GIOQAAAAJ,8b5bTQUAAAAJ,Víctor M. Jiménez Pérez,Profesor de Química Inorgánica
j54GIOQAAAAJ,T9PZKRcAAAAJ,Blanca M. Muñoz-Flores,"Profesor Investigador, FCQ-UANL"
j54GIOQAAAAJ,JKFFRjoAAAAJ,Mena-Ulecia Karel,Universidad Católica de Temuco
j54GIOQAAAAJ,kphdIkUAAAAJ,Emilio Lamazares,"PhD, Postdoctoral Universidad de Concepcion"
j54GIOQAAAAJ,VhGIqLkAAAAJ,Elies Molins,"Research Professor, CSIC"
j54GIOQAAAAJ,eKSuPI0AAAAJ,Rafael Quintana Puchol,"Profesor de Química, Universidad Central ""Marta Abreu"" Las Villas"
j54GIOQAAAAJ,PauLrGYAAAAJ,Oscar Martínez Santiago,"Universidad Central ""Marta Abreu"" de las Villas"
j54GIOQAAAAJ,0LMaLAIAAAAJ,Oscar Miguel Rivera Borroto,Researcher
j54GIOQAAAAJ,rsbUYyEAAAAJ,Yovani Marrero-Ponce,"Universidad San Francisco de Quito (USFQ), Quito, Ecuador; Fundación Universitaria …"
j54GIOQAAAAJ,yLInFToAAAAJ,Mauricio E. Orozco-Ugarriza,"Bacteriologo, Docente Investigador."
j54GIOQAAAAJ,wYCT57AAAAAJ,Ricardo Vivas-Reyes,Universidad de Cartagena/  Fundación UniversitariaTecnologico de Comfenalco
j54GIOQAAAAJ,IjmezeoAAAAJ,Yoan Martínez López,Profesor de Informática  ( Universidad de Camaguey)
j54GIOQAAAAJ,eePGXXkAAAAJ,Luis Ernesto Arteaga Pérez,Universidad del Bío-Bío
j54GIOQAAAAJ,wmY9LOQAAAAJ,Lucian Cristian Pop,"Babeș-Bolyai University, Faculty of Chemistry and Chemical Engineering"
j54GIOQAAAAJ,YGl2mXYAAAAJ,Joan Manuel Rodriguez-Diaz,Universidad Técnica de Manabí
j54GIOQAAAAJ,uByy8IsAAAAJ,Adrian Alujas Diaz,"Associate Professor, Universidad Central de Las villas"
vjtvsrAAAAAJ,VjmgcGIAAAAJ,Claudio Eduardo Aguilar Ramírez,Universidad Técnica Federico Santa Maria
vjtvsrAAAAAJ,uF_kFzYAAAAJ,Nicolas Mujica,Universidad de Chile
vjtvsrAAAAAJ,Jqbocb8AAAAJ,Fernando Lund,
vjtvsrAAAAAJ,79bcdT8AAAAJ,Mamie Sancy,Pontificia Universidad Católica de Chile
vjtvsrAAAAAJ,njaa_hsAAAAJ,Rodrigo Espinoza-González,"Depto. de Ingeniería Química Biotecnología y Materiales, FCFM, Universidad de Chile"
vjtvsrAAAAAJ,1YL9588AAAAJ,Carola Martinez Ugalde,"Departamento de Ingeniería de Obras Civiles, Universidad de La Frontera"
vjtvsrAAAAAJ,fWJwF-IAAAAJ,Carolina Espinoza Oñate,"Assistant Professor, Departamento de Sonido, Facultad de Artes, Universidad de Chile"
vjtvsrAAAAAJ,o8sCIrkAAAAJ,Karem Tello,Universidad Técnica Federico Santa María
vjtvsrAAAAAJ,wblKH74AAAAJ,José Ruzzante,"Universidad Nacional de Tres de Febrero. ---Universidad Tecnológica Nacional, Facultad Regional"
vjtvsrAAAAAJ,YcebgwsAAAAJ,Carolina Guerra Figueroa,Pontificia Universidad Católica de Chile
vjtvsrAAAAAJ,0RUmptsAAAAJ,Sebastian Gonzalez,"Researcher Museo del Violino, Cremona"
vjtvsrAAAAAJ,qennmZAAAAAJ,Pablo Gutiérrez,Universidad de O'Higgins - Chile
vjtvsrAAAAAJ,I2WiYBYAAAAJ,Edgar Pio Lopez,
vjtvsrAAAAAJ,Xgy8fzgAAAAJ,Hector Alarcón,Docente Universidad Autónoma de Chile
Lj4DKFoAAAAJ,VDDitGMAAAAJ,Joris Larik,Leiden University
Lj4DKFoAAAAJ,tz5BYnMAAAAJ,Ivette Esis,Universidad Finis Terrae
jnEIqx4AAAAJ,BbRajoQAAAAJ,Cristián A. Amador,Universidad San Sebastian
jnEIqx4AAAAJ,U82L77MAAAAJ,Stefanny M Figueroa,Universidad Autónoma de Chile
jnEIqx4AAAAJ,OtblK5sAAAAJ,Rodrigo Pacheco,Fundación Ciencia & Vida
jnEIqx4AAAAJ,kjhC4cgAAAAJ,Raúl Vinet,Universidad de Valparaíso
jnEIqx4AAAAJ,Qpgm5hkAAAAJ,Alexis A Gonzalez,Pontificia Universidad Católica de Valparaíso
jnEIqx4AAAAJ,1D1-MucAAAAJ,Pablo Jara Picas,"Director Química y Farmacia, Universidad Autónoma de Chile"
jnEIqx4AAAAJ,VCUKoQwAAAAJ,Ramón Sotomayor-Zárate,Universidad de Valparaíso
jnEIqx4AAAAJ,MwEtw2cAAAAJ,Pedro Espinosa,"PhD Student, University of Geneva"
-7Dpc-rakw0C,ACSPASEAAAAJ,M. Olaya Grau,Pontificia Universidad Católica de Chile
-7Dpc-rakw0C,pWZjC4AAAAAJ,Mahia Saracostti,Universidad de Valparaiso
WPV2rOgAAAAJ,vBzjfJQAAAAJ,Francisco Maturana Miranda,"Profesor Asociado, Instituto de Ciencias de la Tierra, Universidad Austral de Chile"
WPV2rOgAAAAJ,Vc_ffpcAAAAJ,David Poblete,"Profesor Adjunto, Universidad de Valparaíso"
_yrO6yQAAAAJ,jRmQ9AkAAAAJ,Alejandro Hernandez,"Professor, physiology, Universidad de Santiago de Chile"
_yrO6yQAAAAJ,eNJwvTwAAAAJ,Eduardo Karahanian,Universidad Autónoma de Chile
_yrO6yQAAAAJ,KqBRfSUAAAAJ,Héctor Núñez,NutriOhm Consulting
_yrO6yQAAAAJ,UeZPwPAAAAAJ,Rafael Antoni Barra Pezo,usach
_yrO6yQAAAAJ,vRYeFjkAAAAJ,Mario Rivera-Meza,"Profesor Asistente, Facultad de Ciencias Químicas y Farmacéuticas, Universidad de Chile"
RcqjyDgAAAAJ,fI9pWd0AAAAJ,Yanyn Aurora Rincón Quintero,"Investigadora Senior - Universidad del Atlántico;Tecnológico de Antioquia, I.U,"
A4p8GnMAAAAJ,em141fUAAAAJ,Lina María Ruiz Hincapié,Universidad Autónoma de Chile
A4p8GnMAAAAJ,ShntkWcAAAAJ,Alvaro A. Elorza,"Full Professor, Institute of Biomedical Sciences, Universidad Andres Bello"
A4p8GnMAAAAJ,PewOAmMAAAAJ,William Tiznado,"Departamento de Ciencias Químicas, Universidad Andres Bello, Chile"
A4p8GnMAAAAJ,XbrgMIYAAAAJ,Marlen Nayibe Barreto Roa,"Profesor Asistente, Universidad Autónoma de Chile"
A4p8GnMAAAAJ,RDDQKZoAAAAJ,Rodrigo  A Quintanilla,"Associate professor, Centro de Investigación Biomédica, Universidad Autónoma de Chile"
A4p8GnMAAAAJ,jUHWJGUAAAAJ,Orian Shirihai,"Professor of Medicine and Molecular and Medical Pharmacology, UCLA"
zaWBEJEAAAAJ,gE7WkkYAAAAJ,Tim Osswald,University of Wisconsin-Madison
zaWBEJEAAAAJ,6if8A1oAAAAJ,Conrado Ramos Moreira Afonso,"Professor de Engenharia de Materiais, Universidade Federal de São Carlos (UFSCar)"
zaWBEJEAAAAJ,DedP_YYAAAAJ,HABIB ZAMBRANO RODRIGUEZ,Universidad del Norte
zaWBEJEAAAAJ,KvyHEaoAAAAJ,Jimy Unfried-Silgado,Full time professor - Mechanical Engineering Department - Universidad de Córdoba
zaWBEJEAAAAJ,Usv4tZoAAAAJ,Lukas Duddleston,University of Wisconsin-Madison
XVMn-TwAAAAJ,HajkarwAAAAJ,Hugo Andres Gutierrez Rojas,Professor. Faculty of Statistics. Universidad Santo Tomás
XVMn-TwAAAAJ,yiPuHu4AAAAJ,Edilberto Cepeda-Cuervo,Universidad Nacional de Colombia
mOV4_qoAAAAJ,DC-1QokAAAAJ,"Pablo Valdés-Badilla, Ph.D.",Universidad Católica del Maule
mOV4_qoAAAAJ,6jbwqtcAAAAJ,Andrés Godoy Cumillaf,"Pedagogía en Educación Física, Facultad de Educación, Universidad Autónoma de Chile."
mOV4_qoAAAAJ,A3EUj6IAAAAJ,Roberto Lagos-Hernández,Universidad Autónoma de Chile
mOV4_qoAAAAJ,e_D6W2MAAAAJ,Tomas Herrera-Valenzuela,"Laboratorio de Ciencias de la Actividad Física, el Deporte y la Salud, Facultad de Ciencias Médicas"
mOV4_qoAAAAJ,Cwx71pYAAAAJ,Eduardo Guzmán Muñoz,"Escuela de Kinesiología, Universidad Santo Tomás, Talca, Chile"
mOV4_qoAAAAJ,Sl208icAAAAJ,Roberto Hernández Sampieri,Director del Centro de Investigación y del Doctorado en Administración de la Universidad de Celaya
zUCqU3YAAAAJ,WpYUEcEAAAAJ,María José Baeza-Rivera,Universidad Católica de Temuco
zUCqU3YAAAAJ,DtOXVPkAAAAJ,Diego Manríquez Robles,Universidad Católica de Temuco
zUCqU3YAAAAJ,8KWEZoYAAAAJ,MARIA FRANCISCA ROMAN MELLA,Universidad de La Frontera
zUCqU3YAAAAJ,nrAZqIIAAAAJ,Natalia Salinas Oñate,Universidad de La Frontera
zUCqU3YAAAAJ,lP-2PEwAAAAJ,José L. Saiz,"Depto. de Psicología, Universidad de La Frontera"
ma1jN6UAAAAJ,k7Es23wAAAAJ,Danilo Díaz-Levicoy,Universidad Católica del Maule
