scholar_id_autor_gs,scholar_id_gs_coauthor,nombre_coauthor,cargo
hDMbFpoAAAAJ,QmtY9h0AAAAJ,Ariel Leiva Lopez,"School of Electrical Engineering, Pontificia Universidad Católica de Valparaíso"
hDMbFpoAAAAJ,6pnDwCEAAAAJ,Mauricio Rodriguez,"Pontificia Universidad Católica de Valparaíso, School of Electrical Engineering"
hDMbFpoAAAAJ,BJgQsScAAAAJ,Sebastian Fingerhuth,"School of Electrical Engineering, Pontificia Universidad Católica de Valparaíso"
hDMbFpoAAAAJ,z15JKugAAAAJ,Daniel Yunge,"Associate Professor, Pontificia Universidad Católica de Valparaíso"
hDMbFpoAAAAJ,ZLx1OT0AAAAJ,Jérôme Sokoloff,Université Paul Sabatier
hDMbFpoAAAAJ,4cGeq0AAAAAJ,Gonzalo Farias,"Pontificia Universidad Catolica de Valparaiso, UNED, CIEMAT"
hDMbFpoAAAAJ,ymoqnSgAAAAJ,Esteban Vera,Pontificia Universidad Catolica de Valparaiso
hDMbFpoAAAAJ,lCma-igAAAAJ,CESAR SAN MARTIN SALAS,Universidad de La Frontera
6pnDwCEAAAAJ,ApQt28MAAAAJ,Reinaldo A. Valenzuela,"Dir. Wireless Comms. Research Dept., Bell Labs, Alcatel-Lucent"
6pnDwCEAAAAJ,iV8ZDF0AAAAJ,Rodolfo Feick,Universidad Tecnica Federico Santa Maria
6pnDwCEAAAAJ,zLUvq0QAAAAJ,Dmitry Chizhik,Nokia Bell Laboratories
6pnDwCEAAAAJ,DM4AQwkAAAAJ,Jinfeng Du,Nokia Bell Labs
6pnDwCEAAAAJ,jJ4ji4EAAAAJ,Guillermo Castro,"Ph.D. Student, University of Southern California"
6pnDwCEAAAAJ,hDMbFpoAAAAJ,Francisco Pizarro Torres,"Associate Professor, Escuela de Ingeniería Eléctrica, Pontificia Universidad Católica de Valparaíso"
6pnDwCEAAAAJ,kNfcNMQAAAAJ,Milan S. Derpich,"Department of Electronic Engineering, Universidad Técnica Federico Santa María, Chile"
6pnDwCEAAAAJ,XxvU534AAAAJ,Eva Rajo,"Professor, University Carlos III of Madrid"
6pnDwCEAAAAJ,nyePoE8AAAAJ,Melissa Eugenia Diago Mosquera,Ph.D. in Engineering Sciences
6pnDwCEAAAAJ,QQtY-7wAAAAJ,Alejandro Aragón Zavala,"Principal Researcher / Lecturer, Tecnológico de Monterrey"
6pnDwCEAAAAJ,RPmhP24AAAAJ,Tingjun Chen,"Assistant Professor of Electrical and Computer Engineering, Duke University"
6pnDwCEAAAAJ,-E5k6m4AAAAJ,Gil Zussman,Columbia University
6pnDwCEAAAAJ,YkBKjBL77NcC,Manav Kohli,Columbia University
6pnDwCEAAAAJ,MKQ1szgAAAAJ,Matilde Sánchez-Fernández,"Associate Professor, University Carlos III Madrid"
ibSma_AAAAAJ,IIRXbfAAAAAJ,Eike Luedeling,"INRES, University of Bonn, Germany"
ibSma_AAAAAJ,MTmTnnsAAAAJ,Erica Fadon,Centro de Investigación y Tecnología agroalimentaria de Aragón (CITA)
ibSma_AAAAAJ,YPIcAA4AAAAJ,Cory Whitney,University of Bonn
ibSma_AAAAAJ,P9Qe1sUAAAAJ,Italo F. Cuneo,Pontificia Universidad Católica de Valparaíso
ibSma_AAAAAJ,gTMaXXEAAAAJ,Patrick H Brown,Professor of Plant Sciences
ibSma_AAAAAJ,j3HkTGcAAAAJ,Emilio Laca,"Professor of Plant Sciences, University of California, Davis"
ibSma_AAAAAJ,qeqqJqwAAAAJ,Maciej Zwieniecki,UC Davis
ibSma_AAAAAJ,ZNvcJJ8AAAAJ,Andreas Buerkert,University of Kassel
ibSma_AAAAAJ,7cmp1KsAAAAJ,Enrique Dapena,Responsable del Programa de Investigación de Fruticultura
ibSma_AAAAAJ,_dIR9PMAAAAJ,Lars Caspersen,University of Bonn
rcaHrLAAAAAJ,7Hhm0PwAAAAJ,Juan A. Tapia,University of Concepcion
rcaHrLAAAAAJ,3IJo-NoAAAAJ,Javier Riedemann,University of Sheffield
rcaHrLAAAAAJ,nbdcrQUAAAAJ,Pyrhönen Juha,Lappeenranta University of Technology
rcaHrLAAAAAJ,6dJyrc0AAAAJ,Pia Lindh,LUT Univeristy
rcaHrLAAAAAJ,IKqMaGUAAAAJ,Gerd Bramerdorfer,Johannes Kepler University Linz
FGQplIIAAAAJ,g_QWxVAAAAAJ,Vicente Sisto,Dr. en Psicología Social. Profesor Titular Pontificia Universidad Católica de Valparaíso. Chile
FGQplIIAAAAJ,THwDS2QAAAAJ,Luis Jimenez Diaz,Pontificia Universidad Católica de Valparaío
FGQplIIAAAAJ,h9ECWD4AAAAJ,Carla Fardella,Universidad Andres Bello
FGQplIIAAAAJ,KA8mx4YAAAAJ,Rodrigo Soto-Lagos,"Universidad de Santiago, Departamento de Gestión y Políticas Públicas"
FGQplIIAAAAJ,4ABMmZMAAAAJ,Miguel Imas,Kingston University
FGQplIIAAAAJ,Ybzw2M8AAAAJ,Oscar Andrés López Cortés,"Docente Investigador, Universidad Libre Colombia"
FGQplIIAAAAJ,AVQV7swAAAAJ,Alvaro Espejo,"ESE Business School, Universidad de Los Andes"
FGQplIIAAAAJ,YVBJgLwAAAAJ,Paula Ascorra,Pontificia Universidad Católica de Valparaíso
FGQplIIAAAAJ,6fbnHhQAAAAJ,Lorena Pérez-Roa,"Profesora Asociada, Facultad de Ciencias Sociales Universidad de Chile"
FGQplIIAAAAJ,wm_hGDsAAAAJ,Ludmila Costhek Abilio,Pesquisadora CESIT Unicamp
FGQplIIAAAAJ,YphStrYAAAAJ,Manuela Garcia Quiroga,"Profesora Asociada Escuela de psicología, Pontificia Universidad Católica de Valparaíso"
FGQplIIAAAAJ,gHH1K4YAAAAJ,Javiera Pavez Mena,Pontificia Universidad Católica de Valparaíso
FGQplIIAAAAJ,8SDLPiUAAAAJ,Nora Gray Gariazzo,Universidad Viña del Mar
FGQplIIAAAAJ,oqXGkyUAAAAJ,Pablo Vommaro,"Universidad de Buenos Aires, CONICET, CLACSO"
FGQplIIAAAAJ,eZfT80cAAAAJ,Cristopher Yáñez-Urbina,Pontificia Universidad Católica de Valparaiso
FGQplIIAAAAJ,TD41voAAAAAJ,María Isabel Reyes-Espejo,Pontificia Universidad Católica de Valparaíso
FGQplIIAAAAJ,cUKJtaMAAAAJ,Verónica López,Pontificia Universidad Católica de Valparaíso
FGQplIIAAAAJ,u9RxxCgAAAAJ,Juan Felipe Espinosa-Cristia [ORCID:...,Universidad Técnica Federico Santa María
FGQplIIAAAAJ,j6KpaQgAAAAJ,Hernan Camilo Pulido Martinez,Pontificia Universidad Javeriana
NEzUmBwAAAAJ,S7GJV4AAAAAJ,Paola Valero,Stockholm University
NEzUmBwAAAAJ,EzxdafEAAAAJ,Mario Sánchez Aguilar,"Programa de Matemática Educativa, CICATA Legaria, Instituto Politécnico Nacional, Mexico"
NEzUmBwAAAAJ,IoEsJgEAAAAJ,Ole Ravn,"Associate Professor, Aalbrog University"
NEzUmBwAAAAJ,jMSZXT0AAAAJ,Prof. Dr. Ricardo Cantoral,"Professor of Mathematics Education, Cinvestav"
NEzUmBwAAAAJ,z2FIvHoAAAAJ,Ayşe Yolcu,Hacettepe University
NEzUmBwAAAAJ,8l_FBJMAAAAJ,Gill Adams,Sheffield Hallam University
NEzUmBwAAAAJ,xV1VcZAAAAAJ,Renato Marcone,unifesp
NEzUmBwAAAAJ,_1w-sRUAAAAJ,Aldo Parra,Universidad del Cauca
NEzUmBwAAAAJ,29Vs_TQAAAAJ,Eva Norén,Stockholm University
NEzUmBwAAAAJ,4HupW8wAAAAJ,Kicki Skog,"Senior Lecturer in Mathematics Education, Stockholm University"
NEzUmBwAAAAJ,QkJ6aM4AAAAJ,Lisa Österling,Stockholm University
NEzUmBwAAAAJ,sLU7iVkAAAAJ,Alex Montecino,
OnBSR_oAAAAJ,9eI25jMAAAAJ,Marcel G. Clerc,"Professor of Physics, FCFM, Department of Physics, University of Chile"
OnBSR_oAAAAJ,sY4n2tEAAAAJ,Saliya Coulibaly,"Laboratoire de Physique des Lasers, atomes et molecules, Université de Lille"
OnBSR_oAAAAJ,rGZuoz0AAAAJ,Juan F. Marín,"Assistant Professor, Universidad Tecnológica Metropolitana - Chile"
OnBSR_oAAAAJ,ZRdkr0cAAAAJ,René Rojas Cortés,"Instituto de Física, Pontificia Universidad Católica de Valparaíso"
OnBSR_oAAAAJ,BgWylwMAAAAJ,Yair Zárate,"PhD Student, Nonlinear Physics Centre, ANU."
OnBSR_oAAAAJ,LxxO4CoAAAAJ,Leonardo Gordillo,Assistant Professor (Universidad de Santiago de Chile)
OnBSR_oAAAAJ,NnSycucAAAAJ,Eric Louvergneaux,"Associate professor, Université de Lille"
OnBSR_oAAAAJ,oYLLopMAAAAJ,Claudio Falcón,"Associate Professor, DFI, FCFM, Universidad de Chile"
OnBSR_oAAAAJ,qDARca0AAAAJ,Michel Ferré Díaz,Ben-Gurion University
OnBSR_oAAAAJ,w_OQZmsAAAAJ,Cristian Fernández-Oto,Universidad de Los Andes
OnBSR_oAAAAJ,y8b-0moAAAAJ,Pio J. Arias,"Professor of Physics, Universidad Central de Venezuela"
OnBSR_oAAAAJ,4a3L2hEAAAAJ,Angel Sánchez,"Grupo Interdisciplinar de Sistemas Complejos (GISC), Matemáticas, Universidad Carlos III de Madrid"
OnBSR_oAAAAJ,W1qfc3oAAAAJ,PVE McClintock,Lancaster University
OnBSR_oAAAAJ,CjnEr_gAAAAJ,Emilio Hernandez-Garcia,"IFISC (UIB-CSIC), Palma de Mallorca, Spain"
7GpPyJgAAAAJ,AYg3HnwAAAAJ,Dibakar Roychowdhury,"Post Doc at Swansea University,UK"
7GpPyJgAAAAJ,AeDZlHMAAAAJ,rabin banerjee,"professor of physics, S.N. Bose center"
7GpPyJgAAAAJ,RKbr0nsAAAAJ,Sunandan Gangopadhyay,"S.N. Bose National Centre for Basic Sciences, Kolkata"
mjJJ5ZQAAAAJ,k099y_MAAAAJ,Yecid P. Jimenez Bellott,Universidad de Antofagasta
hokncNYAAAAJ,1nhhCnEAAAAJ,Maurício Dalri Timm do Valle,"Professor de Direito Tributário, UniCuritiba e Universidade Católica de Brasília"
hokncNYAAAAJ,fzesR0MAAAAJ,Rafael Mellado Silva,"Escuela de Comercio, Pontificia Universidad Católica de Valparaíso"
hokncNYAAAAJ,8WxaU9cAAAAJ,Hanns de la Fuente-Mella,Pontificia Universidad Católica de Valparaíso
hokncNYAAAAJ,P9tWMesAAAAJ,Claudio Alonso Cubillos Figueroa,Pontificia Universidad Católica de Valparaíso
Mbn2AEwAAAAJ,8WxaU9cAAAAJ,Hanns de la Fuente-Mella,Pontificia Universidad Católica de Valparaíso
Mbn2AEwAAAAJ,ZlJxcM0AAAAJ,Hector Allende-Cid,Pontificia Universidad Católica de Valparaíso
Mbn2AEwAAAAJ,1t4y764AAAAJ,Rodrigo Alfaro Arancibia,Pontificia Universidad Católica de Valparaíso
Mbn2AEwAAAAJ,nBLBS7cAAAAJ,Benito Umaña Hermosilla,Universidad del Bìo-Bìo
Mbn2AEwAAAAJ,QgOhYR8AAAAJ,Pedro Antonio Santander Molina,"Profesor de Comunicación, Pontificia Universidad Católica de Valparaiso"
Mbn2AEwAAAAJ,z4ohN_8AAAAJ,Marisela Fonseca Fuentes,Universidad del Bío-Bío
Mbn2AEwAAAAJ,1pGKw9UAAAAJ,Claudia Mellado,"Profesor de Periodismo, Pontificia Universidad Católica de Valparaíso"
Mbn2AEwAAAAJ,sNLA0egAAAAJ,Pablo López-Rabadán (ORCID:0000-...,Universitat Jaume I (Castellón; España)
Mbn2AEwAAAAJ,j2AOTsAAAAAJ,Heitor S. Ramos,"Department of  Computer Science, Universidade Federal de Minas Gerais"
Mbn2AEwAAAAJ,EY-EZTgAAAAJ,Juan Luis Manfredi-Sánchez,Georgetown University
Mbn2AEwAAAAJ,GDB-FJcAAAAJ,Daniel Aguirre Azócar,Arizona State University
Mbn2AEwAAAAJ,rIbm6tMAAAAJ,Miguel Angel Lopez Varas,Instituto de Estudios Internacionales. Universidad de Chile
Mbn2AEwAAAAJ,vMiQiuMAAAAJ,Rafa Rubio,"Professor Constitutional Law, Complutense University"
Mbn2AEwAAAAJ,HA5_6QUAAAAJ,Matthias Erlandsen,Facultad Latinoamericana de Ciencias Sociales - Chile
VtsdDV8AAAAJ,E7BpC24AAAAJ,Juan Carlos Quiroz,"Stock Assessment Department, Fisheries Research Institute (CHILE)"
VtsdDV8AAAAJ,7FNfdxgAAAAJ,Gabriel N. Gatica,"Professor and Researcher, CI²MA and Departamento de Ingenieria Matematica, Universidad de Concepcion"
VtsdDV8AAAAJ,zEcCIHcAAAAJ,Matthias Maischak,Brunel University
VtsdDV8AAAAJ,Lq-XnPgAAAAJ,Rodrigo Wiff,Pontificia Universidad Catolica de Chile
2XUN6-QAAAAJ,1DBDY70AAAAJ,Manuel Contreras-López,
2XUN6-QAAAAJ,aMa0FU0AAAAJ,Cyntia E. Mizobe,Corporación Nacional Forestal de Chile
2XUN6-QAAAAJ,HT29zBsAAAAJ,José Pedro Juárez Sánchez,Profesor Investigador
2XUN6-QAAAAJ,dBaEoEUAAAAJ,Benito Ramírez Valverde,Profesor Investigador Titular
2XUN6-QAAAAJ,nW-mtYkAAAAJ,Patricio Winckler Grez,"Professor of Ocean Engineering, Universidad de Valparaíso"
2XUN6-QAAAAJ,2GHc1AUAAAAJ,Andoni Arenas Martija,Profesor de Geografía
2XUN6-QAAAAJ,8jv1iEgAAAAJ,Fabian  Araya Palacios,Universidad de La Serena
2XUN6-QAAAAJ,-Di4rF4AAAAJ,Manuel Fuenzalida ,Universidad Alberto Hurtado
2XUN6-QAAAAJ,gqFj7SUAAAAJ,Andres Moreira-Munoz,Profesor Investigador Instituto de Geografía PUCV
2XUN6-QAAAAJ,XlcrkMkAAAAJ,Pablo Mansilla Quiñones,Instituto de Geografía. Pontificia Universidad Católica de Valparaíso
2XUN6-QAAAAJ,kjPIwzQAAAAJ,Pablo Eduardo Huerta Ureta,Pontificia Universidad Católica de Valparaíso
2XUN6-QAAAAJ,cgLozS8AAAAJ,Pablo Martínez Riquelme,"Dr. en Geografía. Departamento de Ciencias Sociales, UFRO"
2XUN6-QAAAAJ,garg4-AAAAAJ,ALAN LEONIDAS GARIN CONTRERAS,Universidad de La Frontera
z15JKugAAAAJ,ez7zZa8AAAAJ,Samarjit Chakraborty,"Kenan Professor of Computer Science, The University of North Carolina at Chapel Hill"
z15JKugAAAAJ,3XIV2pgAAAAJ,Philipp H. Kindt,TU Chemnitz
z15JKugAAAAJ,zGA8HWYAAAAJ,Gabriel Hermosilla,"Escuela de Ingeniería Eléctrica, Pontificia Universidad Católica de Valparaíso"
z15JKugAAAAJ,hDMbFpoAAAAJ,Francisco Pizarro Torres,"Associate Professor, Escuela de Ingeniería Eléctrica, Pontificia Universidad Católica de Valparaíso"
z15JKugAAAAJ,QmtY9h0AAAAJ,Ariel Leiva Lopez,"School of Electrical Engineering, Pontificia Universidad Católica de Valparaíso"
z15JKugAAAAJ,6pnDwCEAAAAJ,Mauricio Rodriguez,"Pontificia Universidad Católica de Valparaíso, School of Electrical Engineering"
z15JKugAAAAJ,8IieYrMAAAAJ,Sangyoung Park,"Assistant Professor, Technical University of Berlin, Einstein Center Digital Future"
z15JKugAAAAJ,KgqbLzEAAAAJ,Reinhard Schneider,TU Munich
z15JKugAAAAJ,YcEhSOgAAAAJ,Martin Becker,Technical University of Munich (TUM)
z15JKugAAAAJ,wlE3yvcAAAAJ,Dip Goswami,"Associate Professor, Electrical Engineering, Eindhoven University of Technology (TU/e)"
z15JKugAAAAJ,Gf5YeFIAAAAJ,Graziano Pravadelli,"Full professor, University of Verona, Italy"
1t4y764AAAAJ,ZlJxcM0AAAAJ,Hector Allende-Cid,Pontificia Universidad Católica de Valparaíso
1t4y764AAAAJ,NRSNzP8AAAAJ,Gastón Olivares Fernández,Complex Society Lab
1t4y764AAAAJ,uExkaQYAAAAJ,Grigori Sidorov,"Professor of Computational Linguistics, Centro de Intestigacion en Computacion, IPN, Mexico"
1t4y764AAAAJ,v3eCFg0AAAAJ,David Eduardo Pinto Avendaño (Davi...,"Benemérita universidad autónoma de Puebla, Faculty of Computer Science"
1t4y764AAAAJ,DKpXXTgAAAAJ,Manuel Montes-y-Gómez,"National Institute of Astrophysics, Optics and Electronics"
1t4y764AAAAJ,2D0bmyYAAAAJ,Daniel Goya,"Assistant Professor, School of Business and Economics, Pontificia Universidad Católica de Valparaíso"
1t4y764AAAAJ,VeJEo1AAAAAJ,Horacio Samaniego,"Associate Professor, Universidad Austral de Chile, Valdivia, Chile"
j_StwEwAAAAJ,gbAQ2OQAAAAJ,William Ribeiro da Silva,Professor Associado do Departamento de Geografia da Universidade Federal do Rio de Janeiro
t4ElWvYAAAAJ,k5XUlosAAAAJ,Matheus Munhoz Vieira Franco,Universidade Estadual de Campians (UNICAMP)
t4ElWvYAAAAJ,TYnRaVkAAAAJ,Antonio Batocchio,"Professor of Manufacturing and Management Systems, State University of Campinas"
t4ElWvYAAAAJ,lKkZ9hoAAAAJ,Ruy Quadros,"Unicamp, Departamento de Política Científica e Tecnológica, PPGA/FCA"
t4ElWvYAAAAJ,PbTuJx0AAAAJ,Orlando Duran,Pontificia Universidad Catolica de Valparaiso
t4ElWvYAAAAJ,6wO1Y1EAAAAJ,Rosley Anholon,Professor Universidade Estadual de Campinas
t4ElWvYAAAAJ,ElUSXp4AAAAJ,Izabela Simon Rampasso,Universidad Católica del Norte
t4ElWvYAAAAJ,auPsmhgAAAAJ,Maria Holgado,"Senior Lecturer in Operations Management, University of Sussex"
t4ElWvYAAAAJ,UR6tfqAAAAAJ,Jose Antonio Garcia,"Pontificia Universidad Católica de Valparaíso , Chile"
t4ElWvYAAAAJ,u1fE7loAAAAJ,Paulo Afonso,"Assistant Professor, Dep. of Production and Systems, University of Minho"
L_T6-sAAAAAJ,ewOs_S0AAAAJ,Núria Planas,Universitat Autònoma de Barcelona
L_T6-sAAAAAJ,W_uart8AAAAJ,maria alessandra mariotti,Università di Siena
BrwIoeIAAAAJ,iC1zxr4AAAAJ,Ricardo Soto,Pontificia Universidad Catolica de Valparaiso
BrwIoeIAAAAJ,1ULUsmIAAAAJ,Eric Monfroy,"Professor of Computer Science, Université de Nantes"
BrwIoeIAAAAJ,AFjvjTgAAAAJ,Sanjay Misra,Østfold University College
-_urVBUAAAAJ,9yAcyygAAAAJ,"Diaz-Robles, L.A.","Titular Professor at the Department of Chemical Engineering, University of Santiago of Chile"
-_urVBUAAAAJ,6vyFk4YAAAAJ,Francisco Cubillos,Academico Departamento de Ingeniería Quimica
-_urVBUAAAAJ,WtYvpV0AAAAJ,Fidel Vallejo Gallardo,Universidad del Bío-Bío
-_urVBUAAAAJ,Q2P4D4wAAAAJ,Francisco Cereceda-Balic,Professor Universidad Tecnica Federico Santa Maria
-_urVBUAAAAJ,V1OYFOQAAAAJ,Joshua S. Fu,"Chancellor's Professor, John Tickle/James Gibson Professor of Civil & Environmental Engineering"
-_urVBUAAAAJ,BamCl30AAAAJ,ALBERTO VERGARA-FERNANDEZ,Universidad de los Andes - Chile
-_urVBUAAAAJ,vyRtDw0AAAAJ,Andrea Teresa Espinoza Pérez,"Professor, Universidad de Santiago de Chile"
-_urVBUAAAAJ,3xe3SG0AAAAJ,Stefan Pelz,Professor Forest Utilization & Biomass Conversion
-_urVBUAAAAJ,v_ccF_EAAAAJ,Cesar Huilinir Curio,Universidad de Santiago de Chile
-_urVBUAAAAJ,gSjbjokAAAAJ,Silvio Montalvo,Universidad de Santiago de Chile
oBfUNSYAAAAJ,X5xPjmkAAAAJ,Samir Kouro,Universidad Técnica Federico Santa María
oBfUNSYAAAAJ,4SUUMGIAAAAJ,Hector Young,"Universidad de La Frontera, Temuco, Chile"
oBfUNSYAAAAJ,c9ql-BAAAAAJ,Marcelo A. Perez,Universidad Tecnica Federico Santa Maria
oBfUNSYAAAAJ,ecwhM0oAAAAJ,Roberto Cardenas,"Electrical Engineering Department, University of Chile"
oBfUNSYAAAAJ,9WeLp14AAAAJ,Venkata Yaramasu,"Associate Professor of Electrical Engineering, SICCS, Northern Arizona University, Flagstaff, AZ"
oBfUNSYAAAAJ,7kF1RSMAAAAJ,Sebastian Rivera,Technische Universiteit Delft
oBfUNSYAAAAJ,-0gRNgsAAAAJ,Cesar Silva,"Departamento de Electrónica, Universidad Técnica Federico Santa María, Chile"
ucMmjIoAAAAJ,gbeNVMsAAAAJ,María Francisca Alonso,Universidad de Valparaiso
ucMmjIoAAAAJ,idJQUc8AAAAJ,Carola Alvarado Barra,"Magíster en Lingüística, Pontificia Universidad Católica de Valparaíso"
ucMmjIoAAAAJ,ZlJxcM0AAAAJ,Hector Allende-Cid,Pontificia Universidad Católica de Valparaíso
ucMmjIoAAAAJ,clXFk9YAAAAJ,Juan Zamora,Pontificia Universidad Católica de Valparaíso
ucMmjIoAAAAJ,OJ1rTPsAAAAJ,Ricardo Martinez-Gamboa,Universidad Diego Portales
Ck_ouu4AAAAJ,MwzoKj8AAAAJ,Fabian Andres Aspee Encina,Pontificia Universidad Católica de Valparaíso
Ck_ouu4AAAAJ,WhyWWw4AAAAJ,Jorge Ramos-Aguilar,"Biólogo, Pontificia Universidad Católica de Chile"
mJuWA_sAAAAJ,wacf2BUAAAAJ,German Aroca,"Professor of Biochemical Engineering, P. Universidad Católica de Valparaíso"
mJuWA_sAAAAJ,v8FeGAgAAAAJ,Patricio Oyarzún,"Director de Investigación, Facultad de Ingeniería y Tecnología, Universidad San Sebastián"
mJuWA_sAAAAJ,Tk0UCx8AAAAJ,Julián Quintero,Assistant professor
mJuWA_sAAAAJ,VpP5vZEAAAAJ,Aminael Sanchez-Rodriguez,"Universidad Técnica Particular de Loja, MS2E: Microbial Systems Ecology and Evolution"
mJuWA_sAAAAJ,1JDI7aUAAAAJ,Ernesto Gonzalez,"Professor de Química, Universidade de São Paulo"
mJuWA_sAAAAJ,n0ePHsoAAAAJ,Sabrina Hedrich,TU Bergakademie Freiberg
mJuWA_sAAAAJ,Al8lbOwAAAAJ,Albert Saavedra,YPF Tecnología S.A.
mJuWA_sAAAAJ,-cvUESsAAAAJ,Marcelo Rivas-Astroza,Assistant Professor at Universidad Tecnologica Metropolitana
FMZ_1woAAAAJ,E-pFgYgAAAAJ,Paolo Fino,politecnico di torino
FMZ_1woAAAAJ,tSRFmKEAAAAJ,Carlos Carlesi Jara,Pontificia Universidad Católica de Valparaíso
FMZ_1woAAAAJ,KI0p6S4AAAAJ,Sara Biamino,Politecnico di Torino (DISAT)
FMZ_1woAAAAJ,Q2yHFxYEDLoC,Matteo Pavese,"Assistant professor, Politecnico di Torino, Italy"
FMZ_1woAAAAJ,QGnIJQona2sC,Danilo Carvajal,Universidad de La Serena
FMZ_1woAAAAJ,y0eYpikAAAAJ,Elisa Padovano,Politecnico di Torino
FMZ_1woAAAAJ,TDU8LmcAAAAJ,Samir Bensaid,Politecnico di torino
FMZ_1woAAAAJ,vymT7IIAAAAJ,Alessandro Monteverde Videla,Politecnico di Torino
FMZ_1woAAAAJ,HilfBwMAAAAJ,Jorge Pavez,"Materials Chemistry Department, Universidad de Santiago de Chile"
IGlDpCAAAAAJ,1SZmU0gAAAAJ,Patricio Lazo,Pontificia Universidad Católica de Valparaíso. ORCID 0000-0001-6943-5684
IGlDpCAAAAAJ,SFY5uhcAAAAJ,Maryori Molina Luna,"Professor at University of Los Andes. PhD student at Law Program, PUCV, Valparaíso - Chile"
N9fcmv8AAAAJ,eO6VdggAAAAJ,Boris Villalobos Parada,Universidad de Playa Ancha
N9fcmv8AAAAJ,cUKJtaMAAAAJ,Verónica López,Pontificia Universidad Católica de Valparaíso
N9fcmv8AAAAJ,-0WlOaYAAAAJ,Maria Angeles Bilbao,"Profesora, Facultad de Psicología, U. Alberto Hurtado"
N9fcmv8AAAAJ,1P8QLBoAAAAJ,Carolina Urbina,Universidad Andrés Bello
ZVParzYAAAAJ,LwSrbkkAAAAJ,Yhosvanni Pérez Rodríguez,Universidad de Cienfuegos
ZVParzYAAAAJ,q1CJS3UAAAAJ,Dr. C. Jorge Luis León González,Editorial Exced
ZVParzYAAAAJ,Nko28GUAAAAJ,Roxana González Alvarez,"profesor del departamento de Ingeniería Industrial, Universidad de Cienfuegos"
ZVParzYAAAAJ,bAfAwmsAAAAJ,Javier Leiva Cáceres,"Profesor de Matemática, Universidad de Cienfuegos"
ZVParzYAAAAJ,UgjCFokAAAAJ,Ruben De Leon Rodriguez,Pontificia Universidad Católica del Ecuador
ZVParzYAAAAJ,5zF-hVoAAAAJ,Leonides Castellanos Gonzalez,Profesor
8pYjH_QAAAAJ,1yzDlKsAAAAJ,Victor M. Calo,"John Curtin Distinguished Professor, Professorial Chair in Computational Geoscience …"
8pYjH_QAAAAJ,JblohmAAAAAJ,Ignacio Muga,"Instituto de Matemáticas, Pontificia Universidad Católica de Valparaíso"
8pYjH_QAAAAJ,rIHUmm4AAAAJ,David Pardo,"Ikerbasque, University of the Basque Country (UPV/EHU), and BCAM"
8pYjH_QAAAAJ,zlG_V7IAAAAJ,Roberto J. Cier,SRK Consulting
8pYjH_QAAAAJ,5u0T3NkAAAAJ,Maciej Paszynski,"Institute of Computer Science, AGH University, Krakow"
8pYjH_QAAAAJ,3eJqNc0AAAAJ,Thomas Poulet,CSIRO Mineral Resources
8pYjH_QAAAAJ,9yH5NuMAAAAJ,Manolis Veveakis,Duke University
8pYjH_QAAAAJ,jhrXJRkAAAAJ,Marcin Łoś,AGH University of Science and Technology
8pYjH_QAAAAJ,Imuw5CMAAAAJ,Pouria Behnoudfar,"Mineral Resources, CSIRO"
8pYjH_QAAAAJ,TkRkDX0AAAAJ,Shaaban Ali Bakr,"Associate Professor,  Department of mathematics, University of Assiut, Egypt."
8pYjH_QAAAAJ,6g7374QAAAAJ,Ángel Rodríguez-Rozas,Quant Analyst - Model Validation at Banco Santander | PhD in Computational and Applied …
8pYjH_QAAAAJ,ORy8nKwAAAAJ,Mostafa Shahriari,GE Healthcare
8pYjH_QAAAAJ,yGmQvlcAAAAJ,Rolando Rebolledo,Profesor Titular Universidad de Valparaíso
8pYjH_QAAAAJ,_qRLuzEAAAAJ,Sergio A Navarrete,Pontificia Universidad Catolica de Chile
8pYjH_QAAAAJ,B0JgDB4AAAAJ,Pablo A. Marquet,"Professor of Ecology, Pontificia Universidad Catolica de Chile & The Santa Fe Institute"
8pYjH_QAAAAJ,JcRmX4EAAAAJ,Sonia Kefi,CNRS
8pYjH_QAAAAJ,SLd6rfIAAAAJ,Patrick Vega,"Postdoctoral Researcher, Instituto de Matemáticas, Pontificia Universidad Católica de …"
8pYjH_QAAAAJ,ggDe1t4AAAAJ,Kristoffer G. van der Zee,"Associate Professor, University of Nottingham"
8pYjH_QAAAAJ,PBGaQ44AAAAJ,Quanling Deng (鄧權靈),"Lecturer, School of Computing, Australian National University"
8pYjH_QAAAAJ,JRbB5h8AAAAJ,Mario Manuel Durán Toro,Profesor Asociado del Departamento de Ingeniería de Minería de la Pontificia Universidad …
8pYjH_QAAAAJ,bmx5fOQAAAAJ,Maciej Woźniak,AGH Universuty of Science and Technology
8pYjH_QAAAAJ,9aWMnoEAAAAJ,Witold Dzwinel,AGH University of Science and Technology
8pYjH_QAAAAJ,OwuHvN8AAAAJ,Rafał Grzeszczuk,
8pYjH_QAAAAJ,gD3atdgAAAAJ,Anna Paszynska,"Assistant Professor, Jagiellonian University"
8pYjH_QAAAAJ,8H28DBkAAAAJ,Albert Romkes,South Dakota School of Mines and Technology
pMwOQSEAAAAJ,dG2WqtgAAAAJ,Maritza Paez,UNIVERSIDAD DE SANTIAGO DE CHILE
pMwOQSEAAAAJ,79bcdT8AAAAJ,Mamie Sancy,Pontificia Universidad Católica de Chile
pMwOQSEAAAAJ,hrEenK8AAAAJ,Manuel Ignacio Azocar,Universidad de Santiago de Chile
pMwOQSEAAAAJ,VjmgcGIAAAAJ,Claudio Eduardo Aguilar Ramírez,Universidad Técnica Federico Santa Maria
pMwOQSEAAAAJ,1YL9588AAAAJ,Carola Martinez Ugalde,"Departamento de Ingeniería de Obras Civiles, Universidad de La Frontera"
pMwOQSEAAAAJ,RRCqUogAAAAJ,Marcos Flores,Universidad de Chile
pMwOQSEAAAAJ,y8bQi0AAAAAJ,Laura Tamayo,Universidad de Chile
pMwOQSEAAAAJ,YcebgwsAAAAJ,Carolina Guerra Figueroa,Pontificia Universidad Católica de Chile
pMwOQSEAAAAJ,vjUabgsAAAAJ,José H Zagal  FRSC,"Distinguished Professor, Director, Laboratory of Electrocatalysis, University of Santiago de Chile"
pMwOQSEAAAAJ,XsXknasAAAAJ,G E Thompson,"Professor of Corrosion Science and Engineering, The University of Manchester "
pMwOQSEAAAAJ,ZcIH7msAAAAJ,Marcela Del Pilar Urzúa Acevedo,Universidad de Chile
pMwOQSEAAAAJ,u8ACyDkAAAAJ,Xiaorong Zhou,The University of Manchester
pMwOQSEAAAAJ,mSiNrsgAAAAJ,Michel Cassir,Chimie ParisTech
pMwOQSEAAAAJ,QUrLihYAAAAJ,Xiangdong Zhou,"Professor, School of Computer Science, Fudan University"
pMwOQSEAAAAJ,lc40bLIAAAAJ,Manuel Miguel Jordán Vidal,"GEA- UMH, Departamento de Agroquímica y Medio Ambiente, Universidad Miguel Hernández de Elche"
pMwOQSEAAAAJ,6Wp8hE8AAAAJ,Camila Arcos,Pontificia Universidad Católica de Chile
6D5LcwwAAAAJ,5aMRjWQAAAAJ,Antoine Seguin,Laboratoire FAST - Université Paris-Sud
6D5LcwwAAAAJ,qxOF-q4AAAAJ,Philippe Gondret,"Université Paris-Saclay, Laboratoire FAST, Orsay, France"
6D5LcwwAAAAJ,ueOt2jQAAAAJ,Yann Bertho,"Université Paris-Saclay, Laboratoire FAST"
6D5LcwwAAAAJ,7ytsbQgAAAAJ,Corentin Coulais,University of Amsterdam
6D5LcwwAAAAJ,l2lZppYAAAAJ,Jérôme Crassous,Université Rennes 1
6D5LcwwAAAAJ,9onIHRIAAAAJ,Germán Varas,Pontificia Universidad Católica de Valparaiso
6D5LcwwAAAAJ,nW-mtYkAAAAJ,Patricio Winckler Grez,"Professor of Ocean Engineering, Universidad de Valparaíso"
mewXqZYAAAAJ,PK0GA3EAAAAJ,Rodrigo Hidalgo Dattwyler,"Profesor e Investigador del Instituto de Geografía, UC"
mewXqZYAAAAJ,MGvNVmUAAAAJ,Dahyann Araya-Muñoz,University of Edinburgh
mewXqZYAAAAJ,6jrblr0AAAAJ,Marc Metzger,"professor, university of edinburgh"
mewXqZYAAAAJ,8tyRZeAAAAAJ,carlos valdebenito,Profesor Titular Pontificia Universidad Católica de Valparaíso
mewXqZYAAAAJ,K4AHodcAAAAJ,Gerardo Saelzer,"Profesor Adjunto, Universidad Austral de Chile"
clXFk9YAAAAJ,6LYRTPEAAAAJ,Marcelo Mendoza,"Professor, Pontificia Universidad Católica de Chile, researcher at CENIA and IMFD"
clXFk9YAAAAJ,ZlJxcM0AAAAJ,Hector Allende-Cid,Pontificia Universidad Católica de Valparaíso
clXFk9YAAAAJ,ucMmjIoAAAAJ,Pedro Alfaro Faccio,Pontificia Universidad Católica de Valparaíso
clXFk9YAAAAJ,n1qKMYwAAAAJ,Miguel R. Guevara,"Cs. Department, Universidad de Playa Ancha"
clXFk9YAAAAJ,UhAxK5EAAAAJ,Jérémie Sublime,Associate Professor at ISEP Paris
clXFk9YAAAAJ,ZaqDIPcAAAAJ,Rodrigo Salas,Universidad de Valparaíso
clXFk9YAAAAJ,eq254vUAAAAJ,Alejandro Veloz,"Associate professor, Biomedical Engineering, Universidad de Valparaíso"
fzesR0MAAAAJ,nTp3IiwAAAAJ,Daniel Cabrera Paniagua,"Escuela de Ingeniería Informática, Universidad de Valparaíso"
fzesR0MAAAAJ,HJL0GkYAAAAJ,Enrique Urra,Universidad de Aysén
fzesR0MAAAAJ,hokncNYAAAAJ,Antonio Faundez Ugalde,Pontificia Universidad Católica de Valparaíso
mNJrNGoAAAAJ,Aid1tTUAAAAJ,Aurora Hernandez-Machado,Universitat de Barcelona
mNJrNGoAAAAJ,re0F6GIAAAAJ,Tomas Alarcon (ORCID 0000-0002-85...,"ICREA Research Professor at the Centre de Recerca Matematica, Barcelona, Spain"
mNJrNGoAAAAJ,zI3z__IAAAAJ,Guillermo Abramson,"Statistical and Interdisciplinary Physics Group, Centro Atómico Bariloche, Instituto Balseiro and"
