scholar_id_autor_gs,scholar_id_gs_coauthor,nombre_coauthor,cargo
VjmgcGIAAAAJ,7NWCTAkAAAAJ,Engelbert Huape,Facultad de Ingeniería Mecánica UMSNH
VjmgcGIAAAAJ,XdlwdhoAAAAJ,Abraham Mejia,Universidad Michoacana de San Nicolás de Hidalgo
VjmgcGIAAAAJ,rcGkVrsAAAAJ,Juan Carlos Carranza Garcia,"PhD student, UNAM"
VjmgcGIAAAAJ,A3crKdsAAAAJ,Joaquin Oseguera,Tecnologico de Monterrey
VjmgcGIAAAAJ,dG2WqtgAAAAJ,Maritza Paez,UNIVERSIDAD DE SANTIAGO DE CHILE
wSXnYFYAAAAJ,ZOF0KysAAAAJ,Graham clifford goodwin,Professor university of newcastle Australia
wSXnYFYAAAAJ,7g3r_ykAAAAJ,Rodrigo Carvajal,Pontificia Universidad Católica de Valparaíso
wSXnYFYAAAAJ,mfnr2oEAAAAJ,Juan I. Yuz,Universidad Tecnica Federico Santa Maria
wSXnYFYAAAAJ,umQwjCgAAAAJ,Boris I. Godoy,"Researcher, Lund University, Sweden"
wSXnYFYAAAAJ,L9US5bgAAAAJ,Ramón A. Delgado Pulgar,Ericsson Research
wSXnYFYAAAAJ,0tWa-tcAAAAJ,Cristian R. Rojas,"Professor, Division of Decision and Control Systems, KTH Royal Institute of Technology"
wSXnYFYAAAAJ,Kpo0tOkAAAAJ,Pedro Escárate,"Instituto de Electricidad y Electrónica, Facultad de Ciencias de la Ingeniería, Universidad …"
wSXnYFYAAAAJ,Ah1GGpIAAAAJ,Rafael Orellana,"Doctor in Electronics Engineering, USACH, Chile"
wSXnYFYAAAAJ,G4HdPCsAAAAJ,James Welsh,University of Newcastle
wSXnYFYAAAAJ,mzKYIOgAAAAJ,Maria Coronel,"Aggregate Professor at University of Los Andes. PhD student at Electronic Program, UTFSM …"
wSXnYFYAAAAJ,Gk_by9MAAAAJ,Alejandro Donaire,"The University of Newcastle, Australia"
wSXnYFYAAAAJ,3BapVpYAAAAJ,Steffi Knorn,Technische Universität Berlin
wSXnYFYAAAAJ,XXnd_4YAAAAJ,Richard Middleton,"Professor, University of Newcastle"
wSXnYFYAAAAJ,-0gRNgsAAAAJ,Cesar Silva,"Departamento de Electrónica, Universidad Técnica Federico Santa María, Chile"
wSXnYFYAAAAJ,VUqpHtsAAAAJ,Torbjorn Wigren,"Uppsala University, Sweden"
wSXnYFYAAAAJ,6gOLwhkAAAAJ,Julio H. Braslavsky,"Principal Research Scientist, CSIRO Energy"
wSXnYFYAAAAJ,RYUeTagAAAAJ,Marion Gilson,"Professor, Université de Lorraine"
wSXnYFYAAAAJ,8etJJGoAAAAJ,Hugues Garnier,Professor of Control Engineering
wSXnYFYAAAAJ,oCJiX0QAAAAJ,Fengwei Chen,Wuhan University
wSXnYFYAAAAJ,GBqW8UwAAAAJ,Mauricio Cea Garrido,University of Newcastle
wSXnYFYAAAAJ,1pJSaQYAAAAJ,Ricardo P. Aguilera,"Associate Professor, University of Technology Sydney, Australia"
wSXnYFYAAAAJ,2lo28DgAAAAJ,Lennart Ljung,"Professor of Automatic Control, Linköping University, Sweden"
wSXnYFYAAAAJ,-pk-IqAAAAAJ,wei tang,northwestern polytechnical university
wSXnYFYAAAAJ,FIuFUHkAAAAJ,Damian Marelli,"Research Academic, the University of Newcastle, Australia."
wSXnYFYAAAAJ,F1zySXYAAAAJ,Paul MJ Van den Hof,Professor Eindhoven University of Technology
wSXnYFYAAAAJ,w-UQXmgAAAAJ,Daniel Dolz,Ph.D. researcher
wSXnYFYAAAAJ,KJ0ZW4UAAAAJ,Liu Tao,"Professor, Dalian University of Technology, China"
wSXnYFYAAAAJ,Q3k6Ea4AAAAJ,Sebastián Zúñiga-Fernández,"Post-Doctoral Fellow, ExoTIC Research group, University of Liege"
wSXnYFYAAAAJ,P6dEMBEAAAAJ,Amirnaser Yazdani,"Professor, Ryerson University"
wSXnYFYAAAAJ,yv2nIMoAAAAJ,B Ninness,University of Newcastle Australia
wSXnYFYAAAAJ,BqaS_84AAAAJ,Håkan Hjalmarsson,"Centre for Advanced Bioproduction, Linnaeus Centre ACCESS, School of EE and CS"
wSXnYFYAAAAJ,CO48-XMAAAAJ,Chen Tianshi,"The Chinese University of Hong Kong, Shenzhen, China"
wSXnYFYAAAAJ,q5FRwQcAAAAJ,Katie M. Morzinski,"Steward Observatory, University of Arizona"
wSXnYFYAAAAJ,PLQATwgAAAAJ,Jared Males,"Assistant Astronomer, University of Arizona"
wSXnYFYAAAAJ,aKR7sPQAAAAJ,Laird Close,University of Arizona
wSXnYFYAAAAJ,GK6QjlsAAAAJ,Mazen Alamir,"CNRS, Université de Grenoble"
wSXnYFYAAAAJ,5TaIF90AAAAJ,Kaushik Mahata,"Associate Professor of Electrical Engineering, University of Newcastle, Australia"
wSXnYFYAAAAJ,00L1ivwAAAAJ,Hernan Haimovich,CONICET - UNR
wSXnYFYAAAAJ,gm9zYIkAAAAJ,Maria Seron,"Associate Professor, The University of Newcastle, Australia"
wSXnYFYAAAAJ,8MJh6JcAAAAJ,Alejandro Rojas,"Universidad de Concepción, Chile"
wSXnYFYAAAAJ,Mh6-ZXIAAAAJ,Eduardo MAM Mendes,Professor no Departamento de Engenharia Eletrônica da UFMG
wSXnYFYAAAAJ,VNsnqBUAAAAJ,Mohsen Zamani,University of Newcastle
wSXnYFYAAAAJ,ni_ZrQQAAAAJ,Sean B. Andersson,"Professor of Mechanical Engineering and Systems Engineering, Boston University"
wSXnYFYAAAAJ,ZHrIQB8AAAAJ,Diego S. Carrasco,"University of Newcastle, Australia"
wSXnYFYAAAAJ,qzUiwgMAAAAJ,Werner Creixell,Universidad Técnica Federico Santa María
wSXnYFYAAAAJ,UMbNsJMAAAAJ,Steve Mehrkanoon,"Senior Mathematical-Computational Neuroscientist, Monash University"
wSXnYFYAAAAJ,YjE_T-wAAAAJ,Carolyn L Beck,"Professor of Industrial Engineering, University of Illinois at Urbana-Champaign"
0LgnrDEAAAAJ,Twh1PxcAAAAJ,Rodrigo Cienfuegos,Pontificia Universidad Catolica de Chile - DIHA - CIGIDEN
0LgnrDEAAAAJ,Jje_grYAAAAJ,Rafael Almar,IRD-LEGOS
0LgnrDEAAAAJ,1dFqutgAAAAJ,Merrick Haller,Oregon State University
0LgnrDEAAAAJ,nW-mtYkAAAAJ,Patricio Winckler Grez,"Professor of Ocean Engineering, Universidad de Valparaíso"
0LgnrDEAAAAJ,U3nUrgcAAAAJ,Rafael Aránguiz,"Associate Professor, Universidad Católica de la Ssma Concepción"
0LgnrDEAAAAJ,nWK49RMAAAAJ,Hermann M. Fritz,Georgia Institute of Technology
0LgnrDEAAAAJ,Aamh_acAAAAJ,Matias Carvajal,Pontificia Universidad Católica de Valparaíso
0LgnrDEAAAAJ,f0oaUyUAAAAJ,Chris Blenkinsopp,"WEIR Research Unit, Department of Architecture and Civil Engineering, University of Bath"
sCxmQKQAAAAJ,AJenaYYAAAAJ,Jorge Ramírez,Universidad Santo Tomás
Y12762cAAAAJ,GJWv0uQAAAAJ,Anandan Sambandam,"Professor of Chemistry, National Institute of Technology, Trichy"
Y12762cAAAAJ,euJ90gMAAAAJ,Dr. P. Sathishkumar,"Department of Chemistry, SAS, Vellore Institute of Technology (VIT), University, India"
Y12762cAAAAJ,McpBBXgAAAAJ,MANGALARAJA Ramalinga Viswanathan,"Professor of Materials Science and Engineering, University of Adolfo Ibanez, Santiago …"
Y12762cAAAAJ,3t2bgsAAAAAJ,Sepperumal Murugesan,"Prof & Head, Dept of Inorganic Chemistry, Madurai Kamaraj University"
Y12762cAAAAJ,P50UrFgAAAAJ,Thillaichidambaram Muneeswaran,"Investigator Postdoctoral Researcher, University of Chile, Santiago, Chile"
Y12762cAAAAJ,SA9qAoAAAAAJ,Jerry J. Wu,Feng Chia University
Y12762cAAAAJ,ObrHM1sAAAAJ,Udaya Prakash Nyayiru Kannaian,"Professor, Dept. of Biotechnology, Vels Institute of Science, Technology and Advanced …"
Y12762cAAAAJ,eBO1KGwAAAAJ,Kathiravan Govindarajan,"Assistant professor,  RKM Vivekananda College, Mylapore- chennai- 4"
Y12762cAAAAJ,ly32qYUAAAAJ,Simon Crawford,The University of Melbourne
Y12762cAAAAJ,WIfNhasAAAAJ,Miguel Angel Gracia-Pinilla,"Universidad Autónoma de Nuevo León, CIIDIT, FCFM, CICFIM"
Y12762cAAAAJ,vcUuj9sAAAAJ,Jagannathan Madhavan,"Associate Professor, Dept. of Chemistry, Thiruvalluvar University, Vellore"
Y12762cAAAAJ,mpA0Z0kAAAAJ,Swathy Jakka Ravindran,Research scientist
Y12762cAAAAJ,A6ayiuoAAAAJ,David Contreras,"Full Professor, Universidad de Concepcion"
Y12762cAAAAJ,BSpCwuQAAAAJ,Abdullah M. Asiri,King Abdulaziz University - Chemistry Department - Faculty of Science- Jeddah - Saudi …
Y12762cAAAAJ,DzmAMDQAAAAJ,Boominathan M,"The Madura College, Madurai"
Y12762cAAAAJ,xoj97eEAAAAJ,Soujit Sen Gupta,Scientist at Thermax Ltd.
Y12762cAAAAJ,NRtZ5OUAAAAJ,Anupama Prabhath,"Sr. Scientist, Biomaterials"
Y12762cAAAAJ,OmVqc-IAAAAJ,Detlef Bahnemann,"Professor für Technische Chemie, Leibniz Universität Hannover"
Y12762cAAAAJ,f3U_p4QAAAAJ,Balasubramanian Viswanathan,"Indian Institute of Technology, Madras"
Y12762cAAAAJ,_X1rCRsAAAAJ,RAMKUMAR SEKAR,Dr
Y12762cAAAAJ,m_2ujGoAAAAJ,Jyotirmoy Ghosh,"Postdoctoral Research Associate, Purdue University"
Y12762cAAAAJ,a1lvUncAAAAJ,Sreekumaran Nair,"MRF Limited, R&D Centre, Tiruvottiyur, Chennai 600019."
Y12762cAAAAJ,9fKQvXwAAAAJ,"Deepak Thrithamarassery Gangadharan, Ph.D",Former Research Manager at Solaires Inc and MITACS Post-Doctoral Fellow at University of …
Y12762cAAAAJ,76nWh7YAAAAJ,Indranath Chakraborty,"Assistant Professor, School of Nano Science and Technology, IIT Kharagpur"
Y12762cAAAAJ,B_dv3uUAAAAJ,Héctor Mansilla,Professor of organic chemistry
5gyHl_kAAAAJ,WhBartYAAAAJ,Georgios Ch. Sirakoulis,"Professor, Democritus University of Thrace, Greece"
5gyHl_kAAAAJ,oHGeyDQAAAAJ,Antonio Rubio,Professor of Electrical Engineering (UPC)
5gyHl_kAAAAJ,suo5D8wAAAAJ,Andrew Adamatzky,"Professor in Unconventional Computing, UWE, Bristol"
5gyHl_kAAAAJ,BdCE6vkAAAAJ,Francesc Moll,Universitat Politecnica de Catalunya; Barcelona Supercomputing Center (BSC)
5gyHl_kAAAAJ,dgC6baoAAAAJ,Mattia Frasca,Università di Catania
5gyHl_kAAAAJ,bDYycfQAAAAJ,luigi fortuna,professor of system theory university of catania- Associate CNR IASI Rome
5gyHl_kAAAAJ,La560wQAAAAJ,Said Hamdioui,Delft University of Technology
5gyHl_kAAAAJ,lWuTmpEAAAAJ,Dimitrios Soudris,"Professor, Electrical & Computer Eng., National Technical Univ. of Athens"
5gyHl_kAAAAJ,F_y81tkAAAAJ,Alexandros Bartzas,Software Engineer
5gyHl_kAAAAJ,CeK-UugAAAAJ,Spyridon Nikolaidis,Aristotle University of Thessaloniki
5gyHl_kAAAAJ,-UG3WXoAAAAJ,Nikolaos Mitianoudis,"Associate Professor in Audio and Image Processing, Democritus University of Thrace, Greece"
2m8bkeEAAAAJ,TzubuoF0OCwC,Oscar Corcho,"Ontology Engineering Group, Departamento de Inteligencia Artificial, UPM"
2m8bkeEAAAAJ,YHR0wkkAAAAJ,Marcelo Arenas,"Professor of Computer Science, Pontificia Universidad Católica de Chile and IMFD Chile."
2m8bkeEAAAAJ,Vy7mya4AAAAJ,Jürgen Umbrich,"Onlim GmbH, Austria"
2m8bkeEAAAAJ,P3B2MmwAAAAJ,Jose Manuel Gomez-Perez,Director of Language Technology Research at expert.ai
2m8bkeEAAAAJ,bcReaI0AAAAJ,Pierre-Yves Vandenbussche,eBay
2m8bkeEAAAAJ,R-SmVOYAAAAJ,Axel Polleres,Vienna University of Economics and Business (WU - Wirtschaftsuniversität Wien)
2m8bkeEAAAAJ,vDyk0JgAAAAJ,Maria-Esther Vidal,"Professor Leibniz University of Hannover, TIB, L3S Research Center; Universidad Simon Bolivar"
2m8bkeEAAAAJ,druU9nsAAAAJ,Maribel Acosta,"Assistant Professor, Ruhr University Bochum (RUB)"
T7VDAw4AAAAJ,Wd0iOckAAAAJ,Abner J. Salgado,University of Tennessee
T7VDAw4AAAAJ,HfGj9hsAAAAJ,Alejandro Allendes,"Assistant Professor, Department of Mathematics, Universidad Técnica Federico Santa María"
T7VDAw4AAAAJ,AXOIzmcAAAAJ,Francisco Fuica,"Postdoc, Facultad de Matemáticas, Pontificia Universidad Católica de Chile."
T7VDAw4AAAAJ,QKQeGscAAAAJ,Erwin Hernandez,"Departamento de Matemática, Universidad Técnica Federico Santa María"
T7VDAw4AAAAJ,LhKNyYAAAAAJ,Long Chen,"Professor for Mathematics, University of California at Irvine"
T7VDAw4AAAAJ,LNrrLNwAAAAJ,Richard Rankin,University of Nottingham Ningbo China
T7VDAw4AAAAJ,WRy6gfQAAAAJ,Christian Glusa,Sandia National Laboratories
T7VDAw4AAAAJ,hBAhEFMAAAAJ,Lehel Banjai,"Mathematics Department, Heriot-Watt University, Edinburgh"
T7VDAw4AAAAJ,TyuqUHEAAAAJ,Andrea Bonito,Texas A&M University
T7VDAw4AAAAJ,vpJjg4AAAAAJ,Juan Pablo Borthagaray,"Universidad de la República, Uruguay"
T7VDAw4AAAAJ,wMuMvC8AAAAJ,Felipe Lepe,Universidad del Bío-Bío
T7VDAw4AAAAJ,wNOO-yMAAAAJ,Christoph Schwab,"Professor for Mathematics, ETH Zurich"
T7VDAw4AAAAJ,gBO3kUEAAAAJ,Rodolfo Rodríguez,"Professor Emeritus at Departamento de Ingeniería Matemática, Universidad de Concepción, Chile"
T7VDAw4AAAAJ,Dq5PxJoAAAAJ,Dante Kalise,"Department of Mathematics, Imperial College London"
T7VDAw4AAAAJ,h3Q-aHUAAAAJ,Marta D'Elia,"Principal Scientist, Pasteur Labs | Adj. Professor, Stanford"
T7VDAw4AAAAJ,aB1ioN0AAAAJ,Tran Nhan Tam Quyen,"University of California, Davis Health, USA"
T7VDAw4AAAAJ,6W19REcAAAAJ,Jens Markus Melenk,Vienna University of Technology
T7VDAw4AAAAJ,KjDsV0QAAAAJ,Gabriel Barrenechea,University of Strathclyde
3MsFGHcAAAAJ,OL1VzgEAAAAJ,James McCalley,"Professor of Electrical and Computer Engineering, Iowa State University"
3MsFGHcAAAAJ,_gpcrjYAAAAJ,Ignacio Aravena Solís,Operations Research Engineer at Lawrence Livermore National Laboratory
3MsFGHcAAAAJ,aNuT_FEAAAAJ,Guillermo Gutierrez-Alcaraz,Instituto Tecnologico de Morelia
3MsFGHcAAAAJ,pEaHhtAAAAAJ,Sarah M Ryan,Iowa State University
3MsFGHcAAAAJ,Mbzn2xcAAAAJ,Carlos Valle,Universidad de Playa Ancha
3MsFGHcAAAAJ,pJ4iSkMAAAAJ,Erick López,Pontificia Universidad Católica de Valparaíso
3MsFGHcAAAAJ,-Wv0Vi4AAAAJ,Hugh Rudnick,Professor Pontificia Universidad Católica de Chile
3MsFGHcAAAAJ,eQtibS4AAAAJ,Nestor Gonzalez Cabrera,Universidad Nacional Autónoma de México
3MsFGHcAAAAJ,jwRQrkAAAAAJ,Henrik Madsen,"Professor, PhD, DTU Compute, Technical University of Denmark"
3MsFGHcAAAAJ,1ZoVu1wAAAAJ,Alejandro Angulo,Universidad Técnica Federico Santa María
3MsFGHcAAAAJ,-igK2b8AAAAJ,Tomás Ochoa,Universidad Técnica Federico Santa María
3MsFGHcAAAAJ,6wA_J78AAAAJ,Víctor Hugo Hinojosa M.,Professor in Department of Electrical Engineering
3MsFGHcAAAAJ,5lXOzcIAAAAJ,Sergio A. Diaz,Advanced Center of Electrical and Electronic Engineering
3MsFGHcAAAAJ,-pgMlScAAAAJ,David Watts,Associate Professor at Pontificia Universidad Catolica de Chile
3MsFGHcAAAAJ,ggdN34MAAAAJ,Leigh Tesfatsion,"Research Professor of Economics, Courtesy Research Professor of ECpE, Iowa State University"
3MsFGHcAAAAJ,aXJa1EcAAAAJ,Hector Pulgar,"Associate Professor, Electrical Engineering, University of Tennessee, Knoxville"
3MsFGHcAAAAJ,G29I620AAAAJ,Jorge Moreno,Inodú
3MsFGHcAAAAJ,lSeQWnoAAAAJ,Benjamin Maluenda,MPA candidate at Harvard Kennedy School
3MsFGHcAAAAJ,-XbfL98AAAAJ,Ignacio A. Calle,ignacioa.calle@gmail.com
k2oQ2A4AAAAJ,4dXYfl0AAAAJ,Arcady Zhukov,San Sebastian OR Madrid OR Chernogolovka
k2oQ2A4AAAAJ,ByXAJeEAAAAJ,Julian Gonzalez,"Dpto de Fisica de Materiales, Basque Country University, UPV/EHU, San Sebastian, Spain"
k2oQ2A4AAAAJ,sZCVDR0AAAAJ,Juan María Blanco,Titular de Universidad. Escuela de Ingeniería de Gipuzkoa. UPV/EHU
k2oQ2A4AAAAJ,pli7-48AAAAJ,Valentina Zhukova,"UPV/EHU, Departamento Física de Materiales"
k2oQ2A4AAAAJ,CIkDAkMAAAAJ,Jose Luis Sanchez Llamazares,"Senior Researcher, Instituto Potosino de Investigación Científica y Tecnológica A.C."
k2oQ2A4AAAAJ,9u7o0S8AAAAJ,Chizhik Alexander,Universidad del País Vasco Euskal Herriko Unibertsitatea
k2oQ2A4AAAAJ,MYY9EDoAAAAJ,Victor Manuel de la Prida Pidal,Catedrático de Física Aplicada / Full Professor of Applied Physics (Universidad de Oviedo)
k2oQ2A4AAAAJ,KlhczFwAAAAJ,Claudio Gonzalez Fuentes,Universidad Tecnica Federico Santa María
k2oQ2A4AAAAJ,mYWIQd4AAAAJ,Patricio Vargas,"Professor of Theoretical Physics, Universidad Tecnica Federico Santa Maria"
k2oQ2A4AAAAJ,abNoL48AAAAJ,Igor Stankovic,Institute of Physics Belgrade
k2oQ2A4AAAAJ,XPMLIcgAAAAJ,Rodolfo Gallardo,Universidad Técnica Federico Santa María
k2oQ2A4AAAAJ,NIVtuCQAAAAJ,Andres Felipe Franco Galeano,Universidad Mayor
k2oQ2A4AAAAJ,JbwC8T8AAAAJ,Ufuk Kilic,"Physics Department, Bogazici University"
k2oQ2A4AAAAJ,frZ4KZ0AAAAJ,David Navas,Instituto de Ciencia de Materiales de Madrid (ICMM-CSIC)
k2oQ2A4AAAAJ,v_u2SesAAAAJ,Pedro Landeros,"Departamento de Física, Universidad Técnica Federico Santa María, Chile"
k2oQ2A4AAAAJ,v2QWCzQAAAAJ,Mehmet Cengiz Onbasli,Massachusetts Institute of Technology
FrKvNOYAAAAJ,Fe48yUYAAAAJ,Ricardo Simpson,Universidad Técnica Federico Santa María
FrKvNOYAAAAJ,2YCiYHEAAAAJ,Sergio Almonacid,"UNIVERSIDAD TÉCNICA FEDERICO SANTA MARÍA, Departamento de Ingeniería Química y Ambiental"
FrKvNOYAAAAJ,ZJ8hjhoAAAAJ,Aldonza Jaques,Universidad Tecnica Federico Santa Maria
FrKvNOYAAAAJ,du8HKTQAAAAJ,Vega- Castro Oscar,"Docente Investigador, Universidad de Antioquia. Grupo de Investigación BIOALI"
FrKvNOYAAAAJ,F5J3dj8AAAAJ,Pedro Valencia,Universidad Técnica Federico Santa María
FrKvNOYAAAAJ,OvObWvMAAAAJ,Carolina Parra González,Universidad Técnica Federico Santa María
FrKvNOYAAAAJ,BUZgFMUAAAAJ,Francisco Montero-Silva,ChemNanoChem SpA
FrKvNOYAAAAJ,zGp10LEAAAAJ,Valeria del Campo,Universidad Técnica Federico Santa María
FrKvNOYAAAAJ,gt2aPIgAAAAJ,Noemi Zaritzky,Full Professor Faculty of Engineering Univ. Nacional de La Plata Argentina. Superior Researcher
FrKvNOYAAAAJ,KsLLafwAAAAJ,Michael Seeger,Universidad Tecnica Federico Santa Maria
AxG8_toAAAAJ,6A_d6IAAAAAJ,Joaquín Fernández Rossier,"Researcher,  International Iberian Nanotechnology Laboratory"
AxG8_toAAAAJ,Q1os61kAAAAJ,Monica Pacheco,"Professor of Theoretical Physics, Universidad Tecnica Federico Santa Maria"
AxG8_toAAAAJ,WehFkkAAAAAJ,Leonor Chico,Universidad Complutense de Madrid
AxG8_toAAAAJ,lI527WQAAAAJ,Luis Rosales,"Physics Department, Universidad Técnica Federico Santa María"
AxG8_toAAAAJ,PWlWqTUAAAAJ,Luis Brey,"Instituto de Ciencia de Materiales de Madrid, ICMM, CSIC"
AxG8_toAAAAJ,3OCgG7wAAAAJ,Pedro Orellana,Universidad Técnica Federico Santa Maria
AxG8_toAAAAJ,qUGr93EAAAAJ,Krzysztof Kośmider,International Iberian Nanotechnology Labolatory
AxG8_toAAAAJ,DjLvSiYAAAAJ,F. Aguilera-Granja,Universidad Autonoma de San Luis Potosi
AxG8_toAAAAJ,xb_udD8AAAAJ,Tomas Alonso-Lanza,"PhD, Centro de Física de materiales, San Sebastián, Spain"
AxG8_toAAAAJ,F2kGyfwAAAAJ,FERNANDO DELGADO ACOSTA,"Departamento de Física & Instituto de Estudios Avanzados (IUdEA),  Universidad de La Laguna"
AxG8_toAAAAJ,8HZkOo8AAAAJ,Claudia Gomes da Rocha,"Professor of Physics, University of Calgary"
AxG8_toAAAAJ,W_-UyZ8AAAAJ,Eric Suarez Morell,"Professor at Univ. Técn. Federico Santa María/ Recipient M. Zambrano at EPS, Univ. Sevilla"
AxG8_toAAAAJ,4369OH0AAAAJ,Andrea León,Technische Universität Dresden
AxG8_toAAAAJ,emE-TscAAAAJ,Carlos Duque,"Instituto de Física, Universidad de Antioquia"
AxG8_toAAAAJ,jgNg0WYAAAAJ,Marta Pelc,Nicolaus Copernicus University
AxG8_toAAAAJ,Ns-grioAAAAJ,Jose L. Lado,"Assistant professor, Aalto University, Espoo, Finland"
AxG8_toAAAAJ,5jyIZTIAAAAJ,Thais Chagas,"Postdoctoral researcher, Universität Siegen"
AxG8_toAAAAJ,i3jBmD8AAAAJ,Angelo Malachias,"Professor of Physics, Universidade Federal de Minas Gerais"
AxG8_toAAAAJ,FdPizfoAAAAJ,Rogerio Magalhaes Paniago,"Full Professor, Dept Physics - UFMG"
-Fkz0PwAAAAJ,ecwhM0oAAAAJ,Roberto Cardenas,"Electrical Engineering Department, University of Chile"
-Fkz0PwAAAAJ,-43YaJIAAAAJ,Matías Díaz,University of Santiago of Chile
-Fkz0PwAAAAJ,WLzaK8gAAAAJ,Mauricio Espinoza B.,University of Costa Rica
-Fkz0PwAAAAJ,Vv9IKuoAAAAJ,Felipe Donoso,Siemens
-Fkz0PwAAAAJ,8z38R2MAAAAJ,Pat Wheeler,University of Nottingham
-Fkz0PwAAAAJ,1ZoVu1wAAAAJ,Alejandro Angulo,Universidad Técnica Federico Santa María
-Fkz0PwAAAAJ,ImrRuDsAAAAJ,Pablo Lezana,Universidad Técnica Federico Santa Maria
-Fkz0PwAAAAJ,1pJSaQYAAAAJ,Ricardo P. Aguilera,"Associate Professor, University of Technology Sydney, Australia"
-Fkz0PwAAAAJ,sQbSxDoAAAAJ,Doris Sáez Hueichapan,"Professor, U. Chile"
-Fkz0PwAAAAJ,FOKLmaQAAAAJ,Marco Esteban Rivera Abarca,"Full Professor, Universidad de Talca - University of Nottingham UK"
-Fkz0PwAAAAJ,mCvZPDn8heUC,Jon Clare,"Professor of Power Electronics, Nottingham University"
-Fkz0PwAAAAJ,pySkalUAAAAJ,Enrique Espina,University of Santiago of Chile
-Fkz0PwAAAAJ,miRqj88AAAAJ,Dylan Dah-Chuan Lu,"Professor, University of Technology Sydney, Australia"
-Fkz0PwAAAAJ,-0gRNgsAAAAJ,Cesar Silva,"Departamento de Electrónica, Universidad Técnica Federico Santa María, Chile"
-Fkz0PwAAAAJ,KZ5TMuAAAAAJ,Jose Rodriguez,"Professor, Engineering Faculty, Universidad San Sebastian"
YLin4W4AAAAJ,3ut4Mn0AAAAJ,Roberto Cominetti,Universidad Adolfo Ibáñez (Chile)
YLin4W4AAAAJ,GVmLpu0AAAAJ,Cristian E. Cortes,Universidad de Chile
YLin4W4AAAAJ,A5OrsgQAAAAJ,Nelly Pustelnik,"CNRS researcher, Laboratoire de Physique de l'ENS Lyon"
YLin4W4AAAAJ,0E9plnpntdkC,Jean-Christophe Pesquet,"Distinguished Professor at CentraleSupélec, Université Paris-Saclay"
YLin4W4AAAAJ,Dq5PxJoAAAAJ,Dante Kalise,"Department of Mathematics, Imperial College London"
YLin4W4AAAAJ,gXSDSFsAAAAJ,Mario Bravo,"Faculty of Engineering and Sciences, Universidad Adolfo Ibáñez"
YLin4W4AAAAJ,uGdPyZQAAAAJ,Damek Davis,"Associate Professor, Operations Research and Information Engineering, Cornell"
YLin4W4AAAAJ,6uskEdwAAAAJ,Mathieu Laurière,"Assistant professor of Mathematics and Data Science, NYU Shanghai"
YLin4W4AAAAJ,s6RMliwAAAAJ,Emilie Chouzenoux,"Full researcher, Inria Saclay, France"
YLin4W4AAAAJ,4znhuFcAAAAJ,Giovanni Chierchia,"Assistant professor, Université Paris Est, ESIEE Paris"
27SqpPsAAAAJ,GfDkTtgAAAAJ,Yann Le Gorrec,Professeur d'Automatique ENSMM
27SqpPsAAAAJ,7UWbLKsAAAAJ,B. Maschke,Université de Lyon
27SqpPsAAAAJ,b1UsMiEAAAAJ,Daniel G. Sbarbaro-Hofer,Professor
27SqpPsAAAAJ,HQyYygEAAAAJ,Alessandro Macchelli,University of Bologna
27SqpPsAAAAJ,Dx35WbQAAAAJ,Hans Zwart,Universiteit Twente
27SqpPsAAAAJ,_P-RMtkAAAAJ,Yongxin Wu,"Associate professor, FEMTO-ST, ENSMM"
27SqpPsAAAAJ,kCWdqMcAAAAJ,Luis A. Mora,"Doctoral Student, Universidad Técnica Federico Santa María, Valparaiso, Chile/ Université …"
27SqpPsAAAAJ,mfnr2oEAAAAJ,Juan I. Yuz,Universidad Tecnica Federico Santa Maria
27SqpPsAAAAJ,4-ILJ24AAAAJ,Jesus Toledo Zucco,Postdoctoral researcher
27SqpPsAAAAJ,1jf5n5wAAAAJ,Romeo Ortega,Full Professor at ITAM
27SqpPsAAAAJ,a9gk1msAAAAJ,Paul Kotyczka,"Technical University of Munich, Chair of Automatic Control"
27SqpPsAAAAJ,xZp58v0AAAAJ,Laurent Lefèvre,"Professor of Applied Mathematics and Control, Grenoble Institute of Technology (Grenoble …"
27SqpPsAAAAJ,2IWlgVEAAAAJ,Ning LIU 刘凝,Assistant professor
27SqpPsAAAAJ,-yiWQUQAAAAJ,Andrea Mattioni,Université Grenoble Alpes
27SqpPsAAAAJ,8MJh6JcAAAAJ,Alejandro Rojas,"Universidad de Concepción, Chile"
27SqpPsAAAAJ,Cd6dOG8AAAAJ,Nelson Cisneros,Estudiante PhD femto-st
27SqpPsAAAAJ,ZNQtHXIAAAAJ,Lassi Paunonen,Tampere University
27SqpPsAAAAJ,2rhxNEEAAAAJ,Carles Batlle Arnau,Universitat Politècnica de Catalunya - BarcelonaTech
27SqpPsAAAAJ,hQhwPSUAAAAJ,Weiwei Hu,University of Georgia
27SqpPsAAAAJ,hMOXVDcAAAAJ,Federico Califano,University of Twente
27SqpPsAAAAJ,Vj4mHpEAAAAJ,Matías Zañartu,"Department of Electronic Engineering, Universidad Técnica Federico Santa María"
27SqpPsAAAAJ,sqzMm-cAAAAJ,Ignacio Villalobos Aguilera,Universidad Técnica Federico Santa María
27SqpPsAAAAJ,1i1ScxEAAAAJ,Francisco J Vargas,"Universidad Tecnica Federico Santa Maria, Chile"
27SqpPsAAAAJ,JLGfcAUAAAAJ,Weijun ZHOU,"Assistant Professor, Zhejiang university city college, China"
27SqpPsAAAAJ,7rxoXkEAAAAJ,Cédric Clévy,"Associate Professor, Université Bourgogne Franche-Comté at the FEMTO-ST Institute …"
27SqpPsAAAAJ,AvRIdLcAAAAJ,Bilal Komati,PhD in Automatic Control and Robotics
27SqpPsAAAAJ,XM3-1IQAAAAJ,Arnaud Hubert,"Université de Technologie de Compiègne, France"
27SqpPsAAAAJ,bKWlH0sAAAAJ,Marco Anthony Gordón Almeida,PhD(c) at Federico Santa María Technical University
JtCJHngAAAAJ,ICO5y8gAAAAJ,Rogerio Rosenfeld,"Professor de Física, Instituto de Física Teórica - UNESP"
JtCJHngAAAAJ,9riO8DYAAAAJ,Oscar Castillo-Felisola,"Researcher, High Energy Physics, Universidad Tecnica Federico Santa Maria"
JtCJHngAAAAJ,36upHCQAAAAJ,Bastián Díaz Sáez,"Postdoc, Univeristy of Santiago of Chile"
JtCJHngAAAAJ,XTFQ6zoAAAAJ,Cristobal Corral,"Universidad Arturo Prat, Instituto de Ciencias Exactas y Naturales, Facultad de Ciencias"
JtCJHngAAAAJ,Py3Inx8AAAAJ,Jilberto Antonio Zamora Saá,Universidad Andres Bello
JtCJHngAAAAJ,i22NYHAAAAAJ,Fabrizio Ernesto Canfora Tartaglia,"Profesor titular, CECS, Universidad San Sebastian, Valdivia, Chile"
JtCJHngAAAAJ,vDSwVTsAAAAJ,Alexander Belyaev,University of Southampton
JtCJHngAAAAJ,0FY9s_UAAAAJ,Ivan Schmidt,"Physics Professor (Emeritus), Universidad Tecnica Federico Santa Maria"
JtCJHngAAAAJ,5lZM3HEAAAAJ,Clemencia Mora Herrera,"Professor Adjunto, Universidade do Estado do Rio de Janeiro"
JtCJHngAAAAJ,1L3yV6EAAAAJ,Marcela Paz González,Universidad Técnica Federico Santa María
XPMLIcgAAAAJ,v_u2SesAAAAJ,Pedro Landeros,"Departamento de Física, Universidad Técnica Federico Santa María, Chile"
XPMLIcgAAAAJ,MQwH2wEAAAAJ,Jürgen Fassbender,HZDR
XPMLIcgAAAAJ,6yNzJy4AAAAJ,Alejandro Roldán Molina,Universidad de Aysén
XPMLIcgAAAAJ,jnMMRloAAAAJ,Volker Sluka,
XPMLIcgAAAAJ,KlhczFwAAAAJ,Claudio Gonzalez Fuentes,Universidad Tecnica Federico Santa María
XPMLIcgAAAAJ,9kTGsWcAAAAJ,Ciaran Fowley,Helmholtz-Zentrum Dresden-Rossendorf
XPMLIcgAAAAJ,z84nQU8AAAAJ,Sebastian Wintz,Helmholtz-Zentrum Berlin für Materialien und Energie
K2dY8ckAAAAJ,hw1wn0YAAAAJ,Dirk Praetorius,"Professor of Numerics of PDEs, TU Wien"
K2dY8ckAAAAJ,Z7vx73QAAAAJ,Thomas Führer,Facultad de Matemáticas Pontificia Universidad Católica de Chile
K2dY8ckAAAAJ,WZD9rDgAAAAJ,Norbert Heuer,Pontificia Universidad Católica de Chile
K2dY8ckAAAAJ,boC6R5wAAAAJ,Michael Ebner,Hypervision Surgical Ltd
K2dY8ckAAAAJ,8dHREY4AAAAJ,Francisco-Javier Sayas,"Professor of Mathematics, University of Delaware"
K2dY8ckAAAAJ,gBO3kUEAAAAJ,Rodolfo Rodríguez,"Professor Emeritus at Departamento de Ingeniería Matemática, Universidad de Concepción, Chile"
K2dY8ckAAAAJ,MN7SWg8AAAAJ,Alexander Rieder,"Institut für Analysis and Scientific Computing, Technische Universität Wien"
K2dY8ckAAAAJ,6W19REcAAAAJ,Jens Markus Melenk,Vienna University of Technology
orcNk7gAAAAJ,32ekRVMAAAAJ,Hernan Astudillo,UTFSM (on sabbatical) & UNAB
c_m4HpkAAAAJ,4369OH0AAAAJ,Andrea León,Technische Universität Dresden
c_m4HpkAAAAJ,vrRZUt0AAAAJ,Paula A Zapata Ramírez,Universidad de Santiago de Chile
c_m4HpkAAAAJ,mYWIQd4AAAAJ,Patricio Vargas,"Professor of Theoretical Physics, Universidad Tecnica Federico Santa Maria"
c_m4HpkAAAAJ,KsLLafwAAAAJ,Michael Seeger,Universidad Tecnica Federico Santa Maria
c_m4HpkAAAAJ,yjKDHh0AAAAJ,Toshiaki Enoki,"Professor Emeritus, Tokyo Institute of Technology"
c_m4HpkAAAAJ,EupQix0AAAAJ,Braulio Archanjo,"National Institute of Metrology, Quality and Technology of Brazil"
c_m4HpkAAAAJ,J9sg4EEAAAAJ,Jenaina Ribeiro Soares,"Associate Professor of Physics, Universidade Federal de Lavras - MG - Brazil"
