scholar_id_autor_gs,scholar_id_gs_coauthor,nombre_coauthor,cargo
zdIuFAUAAAAJ,CZpIRdcAAAAJ,Panos G. Kalatzis,"Post doc researcher, University of Copenhagen"
zdIuFAUAAAAJ,DynB0y4AAAAJ,Julio Retamales Lara,"Instituto de Ciencias Naturales, Universidad de las Américas"
zdIuFAUAAAAJ,fmFScgUAAAAJ,Elena Sarrοpoulou,Associate Researcher
PHAib6MAAAAJ,QyYCFvoAAAAJ,Giovanni Parodi,Pontificia Universidad Católica de Valparaíso
PHAib6MAAAAJ,GgEFmHgAAAAJ,Sofía Zamora Herrera,Pontificia Universidad Católica de Valparaíso
PHAib6MAAAAJ,Yf3WaggAAAAJ,Romualdo Ibáñez Orellana,"Director del Doctorado en Lingüística, Pontificia Universidad Católica de Valparaíso"
PHAib6MAAAAJ,JxIHKQkAAAAJ,ANDREA CAROLINA SANTANA COV...,Pontificia Universidad Católica de Valparaíso
PHAib6MAAAAJ,vUP5i-IAAAAJ,Fernando Lillo-Fuentes,PUCV
PHAib6MAAAAJ,W3EpvTUAAAAJ,rosa maria gutierrez barrientos,Profesora
PHAib6MAAAAJ,n_rIulUAAAAJ,Bell Manrique-Losada,Universidad de Medellín
PHAib6MAAAAJ,ZlJxcM0AAAAJ,Hector Allende-Cid,Pontificia Universidad Católica de Valparaíso
52NbiuUAAAAJ,ZEBdZtoAAAAJ,Valentina Haas Prieto,Profesora de la Escuela de Pedagogia PUCV
52NbiuUAAAAJ,DqClkLsAAAAJ,Andrea Veronica Bustos Ibarra,"Doctora en Comprensión de textos y del Discurso. Procesos cognitivos y aplicaciones instruccionales, Pontificia Universidad Católica de Valparaíso."
52NbiuUAAAAJ,bUCzp-0AAAAJ,María Leonor Conejeros Solar,Pontificia Universidad Católica de Valparaíso
52NbiuUAAAAJ,lMgqdO0AAAAJ,Fabiola Otárola Cornejo,Pontificia Universidad Católica de Valparaíso
52NbiuUAAAAJ,dmGmiHYAAAAJ,Giselle Francis Melo Letelier,"Profesora, Universidad Católica de Valparaíso"
52NbiuUAAAAJ,OrnzKYEAAAAJ,René Valdés Morales (ORCID: 0000-0...,Universidad Andrés Bello
52NbiuUAAAAJ,JjC6ElkAAAAJ,Liliana Vásquez-Rocca,"Departamento de Humanidades, Dirección de Formación General, Facultad de Educación y Ciencias"
v5ktijXFZgQC,Etid-XsAAAAJ,Carmen Montecinos,"Professor of Psychology, Pontificia Universidad Catolica de Valparaiso"
v5ktijXFZgQC,gnk3CzoAAAAJ,Mauricio Pino-Yancovic,"CIAE, Universidad de Chile"
v5ktijXFZgQC,g_QWxVAAAAAJ,Vicente Sisto,Dr. en Psicología Social. Profesor Titular Pontificia Universidad Católica de Valparaíso. Chile
v5ktijXFZgQC,ZjM5lxIAAAAJ,Álvaro González,Universidad Católica Silva Henríquez
v5ktijXFZgQC,MFhZZLoAAAAJ,Oscar Maureira Cabrera,Profesor y Doctor en Educación. Universidad Católica Silva Henríquez
v5ktijXFZgQC,cUKJtaMAAAAJ,Verónica López,Pontificia Universidad Católica de Valparaíso
5GR1nDwAAAAJ,E65grJEAAAAJ,Eduardo Muñoz Cartagena,"Profesor Instituto de Química, Pontificia Universidad Católica de Valparaíso"
5GR1nDwAAAAJ,E1t9TM4AAAAJ,Francisco de Paula Martin Jimenez,"Departamento de Ingeniería Química, Universidad de Málaga"
5GR1nDwAAAAJ,6RGCw2oAAAAJ,Regina Cisternas,Universidad Autónoma de Chile
5GR1nDwAAAAJ,_h_Q-D0AAAAJ,Javier Pereyra,"Instituto de Física, Facultad de Ingeniería, Universidad de la República"
5GR1nDwAAAAJ,W5YgIbYAAAAJ,JF Guillemoles,"CNRS, Institut Photovoltaique d'Ile de France"
5GR1nDwAAAAJ,bviQEggAAAAJ,Scholz Fritz,Universität Greifswald
1OGEslwAAAAJ,O3L7tDkAAAAJ,Alex H. Barbat,"Professor Emeritus, Technical University of Catalonia, UPC & CIMNE, Barcelona, Spain"
1OGEslwAAAAJ,dykQ-RkAAAAJ,Sergio Oller,Nat. Sc.& Tech. Res. Counc.(CONICET); Nat. Univ. of Salta (UNSa); Int. Cent. Num. Method (CIMNE)
Rt9jiUAAAAAJ,syuocecAAAAJ,Vicente A. González,"Professor, Department of Civil and Environmental Engineering, University of Alberta"
Rt9jiUAAAAAJ,mlapWLUAAAAJ,Zhenan Feng,"Senior Lecturer in Digital Built Environment, School of Built Environment, Massey University"
Rt9jiUAAAAAJ,WqqlB5oAAAAJ,Robert Amor,"Professor of Computer Science, University of Auckland"
Rt9jiUAAAAAJ,UBd6oewAAAAJ,Franklin Johnson Parejas,Universidad de Playa Ancha
Rt9jiUAAAAAJ,03rvMKoAAAAJ,Ruggiero Lovreglio,Associate Professor
Rt9jiUAAAAAJ,ZOzbAY0AAAAJ,Matthias Ehrgott,Professor in Management Science
Rt9jiUAAAAAJ,iC1zxr4AAAAJ,Ricardo Soto,Pontificia Universidad Catolica de Valparaiso
Rt9jiUAAAAAJ,vB__FMkAAAAJ,Andrea Raith,University of Auckland
PEnGiOsAAAAJ,N_CI-mwAAAAJ,Miguel Urrestarazu,Profesor-Investigador. Universidad de Almeria
PEnGiOsAAAAJ,lE8Y3k4AAAAJ,Silvia Burés,"Dra. Ingeniera Agrónoma, Ph.D. Horticultura"
PEnGiOsAAAAJ,h9Ev4vYAAAAJ,Luisa F. Cabeza,Universitat de Lleida
PEnGiOsAAAAJ,iiBXp3EAAAAJ,Pilar Mazuela,Universidad de Tarapaca
PrIhVAEAAAAJ,skoAD_MAAAAJ,Juan Silva Quiroz,"Académico Departamento de Educación y Director de CIIET, Universidad de Santiago de Chile"
PrIhVAEAAAAJ,Q_h2COAAAAAJ,Begoña Gros,University of Barcelona
PrIhVAEAAAAJ,-8-ZtOEAAAAJ,Jaime Sánchez,Professor of Learning Technologies and Human-Computer Interaction at the University of Chile
PrIhVAEAAAAJ,ZEBdZtoAAAAJ,Valentina Haas Prieto,Profesora de la Escuela de Pedagogia PUCV
PrIhVAEAAAAJ,rdgol-wAAAAJ,Matías Espinoza,"M.Sc. in Computer Science, Department of Computer Science, University of Chile"
PrIhVAEAAAAJ,Ilo_1KcAAAAJ,Christian Miranda,"Titular  Professor of Education, Universidad of Chile"
PrIhVAEAAAAJ,yK5-4MAAAAAJ,Germán Ahumada Albayay,Profesor de Física Pontificia Universidad Católica de Valparaíso
PrIhVAEAAAAJ,ELVFDR4AAAAJ,Roberto Canales Reyes,Profesor Titular A de la Universidad de Los Lagos
PrIhVAEAAAAJ,h48pBSEAAAAJ,Cristian Merino Rubilar,Pontificia Universidad Católica de Valparaíso
oIUIZqcAAAAJ,W9LKwFcAAAAJ,Miguel Lopez Gonzalez,"Escuela de Ingeniería Eléctrica, Pontificia Universidad Católica de Valparaíso"
oIUIZqcAAAAJ,oJMnjNYAAAAJ,Carlos A. Coello Coello,"Professor of Computer Science, CINVESTAV-IPN"
oIUIZqcAAAAJ,4P_HNo4AAAAJ,Philippe Dessante,GeePs Centralesupelec
oIUIZqcAAAAJ,a6-oZHYAAAAJ,Hector Vargas Oyarzun,Pontificia Universidad Catolica de Valparaiso
oIUIZqcAAAAJ,BJgQsScAAAAJ,Sebastian Fingerhuth,"School of Electrical Engineering, Pontificia Universidad Católica de Valparaíso"
oIUIZqcAAAAJ,ymoqnSgAAAAJ,Esteban Vera,Pontificia Universidad Catolica de Valparaiso
8WxaU9cAAAAJ,XCXi7uQAAAAJ,Alexander Paz,Queensland university of technology
8WxaU9cAAAAJ,p8hexIkAAAAJ,Berta Silva Palavecinos,Pontificia Universidad Católica de Valparaíso
8WxaU9cAAAAJ,lHGUwHcAAAAJ,Rolando Rubilar Torrealba,"Departamento de Administración y Economía, Universidad de La Frontera"
8WxaU9cAAAAJ,iC1zxr4AAAAJ,Ricardo Soto,Pontificia Universidad Catolica de Valparaiso
8WxaU9cAAAAJ,sOAKE-wAAAAJ,Ana María Vallina-Hernandez,Pontificia Universidad Católica de Valparaiso
8WxaU9cAAAAJ,t6WTsxEAAAAJ,Victor Leiva. First place ranking mathematics/statistics scientists in Chile/Hispanic America,"Profesor Titular. Escuela de Ingeniería Industrial, Pontificia Universidad Católica de …"
8WxaU9cAAAAJ,M3LYsLIAAAAJ,Naveen Veeramisti,Sr. Transportation Engineer at TRC-UNLV
8WxaU9cAAAAJ,nBLBS7cAAAAJ,Benito Umaña Hermosilla,Universidad del Bìo-Bìo
8WxaU9cAAAAJ,4JzspNgAAAAJ,Courtney Coughenour,"University of Nevada, Las Vegas"
8WxaU9cAAAAJ,nnK1ADQAAAAJ,Rodrigo Fuentes-Solís,Universidad de Talca
8WxaU9cAAAAJ,E-rHSVEAAAAJ,Rodrigo Olivares Ordenes,"Escuela de Ingeniería Informática, Universidad de Valparaíso"
8WxaU9cAAAAJ,jLSr_TYAAAAJ,Marta Pedraja-iglesias,Universidad de Zaragoza
8WxaU9cAAAAJ,7bd7YZoAAAAJ,Gino Astorga,Universidad de Valparaíso
8WxaU9cAAAAJ,ON5lUZkAAAAJ,Broderick Crawford,Pontificia Universidad Católica de Valparaíso
8WxaU9cAAAAJ,q22ammoAAAAJ,Moses Karakouzian,"Professor, Department of Civil Engineering, UNLV"
8WxaU9cAAAAJ,kALpX2wAAAAJ,Daniel Emaasit,"Data Scientist, Haystax Technology"
8WxaU9cAAAAJ,WWQfVd8AAAAJ,Pankaj Maheshwari,Lead Consultant at WSP USA
8WxaU9cAAAAJ,PwmtH_oAAAAJ,Haroon Stephen,"Associate Professor Civil and Environmental Engineering, University of Nevada Las Vegas"
8WxaU9cAAAAJ,gMY0Il8AAAAJ,Pramen P Shrestha,"Professor, Civil & Environmental Engineering & Construction, University of"
8WxaU9cAAAAJ,kWqEkc8AAAAJ,Estela Irene Rodríguez Quezada,Universidad del Bío-Bío
8WxaU9cAAAAJ,1ULUsmIAAAAJ,Eric Monfroy,"Professor of Computer Science, Université de Nantes"
8WxaU9cAAAAJ,uFH3IMwAAAAJ,Brendan Tran Morris,"Associate Professor of Electrical and Computer Engineering, University of Nevada, Las …"
8WxaU9cAAAAJ,f0ZHmtwAAAAJ,Dr. Jose M. Lanza-Gutierrez,"University of Alcalá, Alcalá de Henares, Madrid, Spain"
8WxaU9cAAAAJ,4cGeq0AAAAAJ,Gonzalo Farias,"Pontificia Universidad Catolica de Valparaiso, UNED, CIEMAT"
gQHmbqcAAAAJ,SaoUt94AAAAJ,Juan M. Cancino,Departamento de Ecología Universidad Católica de la Santísima Concepción
gQHmbqcAAAAJ,CdhGscUAAAAJ,Luis Mercado Vianco,Pontificia Universidad Católica de Valparaíso
gQHmbqcAAAAJ,cNlbZlYAAAAJ,Debora Torrealba,Pontificia Universidad Católica de Valparaíso
gQHmbqcAAAAJ,JIalHMAAAAAJ,Brian Dixon,"Professor and Canada Research Chair, University of Waterloo"
gQHmbqcAAAAJ,h_xDYN0AAAAJ,Pablo Conejeros,Universidad de Valparaíso
gQHmbqcAAAAJ,qnkab4AAAAAJ,Carolina Andrea Figueroa,"Escuela de Ciencias del Mar, Pontificia Universidad Católica de Valparaíso"
gQHmbqcAAAAJ,ZizSEH4AAAAJ,Dr. Cristián E. Hernández,"Full Professor, Universidad de Concepción"
gQHmbqcAAAAJ,pTVqu9oAAAAJ,Sergio Contreras,Universidad Catolica de la Santisima Concepcion
gQHmbqcAAAAJ,vWcHDZwAAAAJ,Antonio Brante,Universidad Católica de la Santísima Concepción
gQHmbqcAAAAJ,FOjm5zgAAAAJ,Romina Pedreschi,Pontificia Universidad Católica de Valparaíso
lA_mAN4AAAAJ,H_bG2UIAAAAJ,Felipe Muñoz La Rivera,Pontificia Universidad Católica de Valparaíso
lA_mAN4AAAAJ,DRCC-gMAAAAJ,LUIS F. ALARCON,Pontificia Universidad Catolica de Chile
lA_mAN4AAAAJ,Pn3EyTIAAAAJ,Edison Atencio,Pontificia Universidad Católica de Valparaíso
lA_mAN4AAAAJ,hBw8PTsAAAAJ,Eugenio Pellicer,"Professor (Catedrático), Universitat Politecnica de Valencia"
lA_mAN4AAAAJ,1OGEslwAAAAJ,Juan Carlos Vielma Perez,"Professor of Civil Engineering, Pontificia Universidad Católica de Valparaíso"
lA_mAN4AAAAJ,TJCAkpwAAAAJ,Claudio Mourgues,"Associate Professor of Civil Engineering, Pontificia Universidad Catolica de Chile"
lA_mAN4AAAAJ,bZE9wQkAAAAJ,Omar Giovanny Sánchez Rivera (ORCID 0000-0001-6070-3910),"Professor, Department of Civil Engineering, Pontificia Universidad Javeriana (grid.41312.35 …"
lA_mAN4AAAAJ,Pd2_IvQAAAAJ,Karen Milady Castañeda Parra,"Investigadora, Universidad Industrial de Santander"
lA_mAN4AAAAJ,TvyCATYAAAAJ,Maria Calahorra-Jimenez,"Assistant Professor of Heavy Civil Construction, FresnoState"
lA_mAN4AAAAJ,XFlThqsAAAAJ,Tito Castillo,"Profesor, Facultad de Ingeniería, Universidad Nacional de Chimborazo"
lA_mAN4AAAAJ,ywU52hEAAAAJ,Luis Arturo Salazar,Universidad Técnica Federico Santa María
lA_mAN4AAAAJ,BxT998AAAAAJ,Zulay Giménez,Profesor. Escuela de Construcción Civil. Pontificia Universidad Católica de Chile
lA_mAN4AAAAJ,fXhxN3AAAAAJ,Paz Arroyo,DPR Construction
lA_mAN4AAAAJ,Uc7TJ_oAAAAJ,Clarissa N. Biotto,Federal University of Ceará
lA_mAN4AAAAJ,JMZVRS8AAAAJ,Gino Pannillo,"Profesor, Departamento de Ingenieria Estructural, Decanato de ingenieria Civil,  Ucla"
lA_mAN4AAAAJ,2gppQ_kAAAAJ,Ponz-Tienda; José Luis,Plexos Software
lA_mAN4AAAAJ,5AdKQnQAAAAJ,Miguel A. Gómez,"Profesor Agregado, Pontificia Universidad Católica de Valparaíso"
lA_mAN4AAAAJ,WcGYQNwAAAAJ,Xavier Brioso,Pontificia Universidad Catolica del Peru. Departamento de Ingeniería.
lA_mAN4AAAAJ,jZKJsNwAAAAJ,Bruno Ávila Eça de Matos,"EngD, Eindhoven University of Technology"
lA_mAN4AAAAJ,KBQ7QL0AAAAJ,Cristina Toca Pérez,Federal University of Bahia
lA_mAN4AAAAJ,zWFENfkAAAAJ,Sheyla Mara Baptista Serra,Universidade Federal de São Carlos
lA_mAN4AAAAJ,9aBlz2MAAAAJ,Andrews Alexander Erazo-Rondinel,Facultad de Ingeniería Civil - Universidad Nacional de Ingeniería
lA_mAN4AAAAJ,Mjy3xIIAAAAJ,Alexis Andrade,"Profesor Ingeniería Civil, Universidad Nacional de Chimborazo"
28_k7FIAAAAJ,_ldAmmsAAAAJ,Carolina Luisa Astudillo Castro,Pontificia Universidad Católica de Valparaíso
28_k7FIAAAAJ,dy058aIAAAAJ,Cecilia Guerrero,Pontificia Universidad Católica de Valparaíso
28_k7FIAAAAJ,a9IzwRQAAAAJ,Carlos Vera,Universidad de Santiago de Chile
28_k7FIAAAAJ,QFoAzPwAAAAJ,Carolina Henríquez,Universidad de Valparaíso
28_k7FIAAAAJ,EUSJjuAAAAAJ,LENA GALVEZ RANILLA,Universidad Catolica de Santa Maria
28_k7FIAAAAJ,s5VaMdEAAAAJ,Carmen Soto,Centro Regional de Estudios en Alimentos Saludables
28_k7FIAAAAJ,P_2sS9QAAAAJ,René Ruby-Figueroa,"Programa Institutional de Fomento A la Investigación, Desarrollo e Innovación (PIDi) …"
28_k7FIAAAAJ,6lk-SpwAAAAJ,mariane lutz,Universidad de Valparaiso
28_k7FIAAAAJ,FEWFqnsAAAAJ,Claudia Fuentealba,Pontificia Universidad Católica de Valparaíso
28_k7FIAAAAJ,K4UHS-sAAAAJ,Javier Enrione,Universidad de los Andes
28_k7FIAAAAJ,F5J3dj8AAAAJ,Pedro Valencia,Universidad Técnica Federico Santa María
28_k7FIAAAAJ,2YCiYHEAAAAJ,Sergio Almonacid,"UNIVERSIDAD TÉCNICA FEDERICO SANTA MARÍA, Departamento de Ingeniería Química …"
28_k7FIAAAAJ,EFeBqg4AAAAJ,Lidietta Giorno,"Consiglio Nazionale delle Ricerche, Institute on Membrane Technology, ITM-CNR"
28_k7FIAAAAJ,55WhpmEAAAAJ,Angelica Ganga,USACH
28_k7FIAAAAJ,WnMSRagAAAAJ,Verónica Loewe Muñoz,infor
28_k7FIAAAAJ,IbC4qhMAAAAJ,Adel El-Mowafi,Aquaculture Technology Application Director
28_k7FIAAAAJ,u-DPwqAAAAAJ,Fabian Rico,Program of food engineering at Universidad de Cartagena
28_k7FIAAAAJ,BSxQQbUAAAAJ,Luis Puente,"Universidad de Chile, Facultad de Ciencias Quimicas y Farmaceuticas"
28_k7FIAAAAJ,P9Qe1sUAAAAJ,Italo F. Cuneo,Pontificia Universidad Católica de Valparaíso
28_k7FIAAAAJ,R2SU-tgAAAAJ,Kalidas Shetty,"Professor of Plant Science, North Dakota State University"
28_k7FIAAAAJ,B1zSRk4AAAAJ,Vinka Oyanedel Craver,University of Rhode Island
28_k7FIAAAAJ,ysSBHu4AAAAJ,Rafael Jimenez-Flores,"Endowed Professor, The Ohio State University"
28_k7FIAAAAJ,X2LuiCUAAAAJ,Regis Teixeira Mendonça,Universidad de Concepción
28_k7FIAAAAJ,oN1U2nwAAAAJ,María Elvira Zúñiga Hansen,Pontificia Universidad Católica de Valparaíso
28_k7FIAAAAJ,zQBFJuoAAAAJ,Claudia Victoria Altamirano Gomez,Pontificia Universidad Católica de Valparaiso
28_k7FIAAAAJ,HRc7QnUAAAAJ,Alfredo Cassano,"Consiglio Nazionale delle Ricerche, Istituto per la Tecnologia delle Membrane"
cl7ccZQAAAAJ,EDFKv8gAAAAJ,Jan Clevers,"Associate Professor in Remote Sensing, Wageningen University, the Netherlands"
cl7ccZQAAAAJ,ldF3hbYAAAAJ,Martin Herold,"GFZ Potsdam, University of Potsdam, Wageningen University"
cl7ccZQAAAAJ,94JOMYcAAAAJ,Sergio A Estay,Universidad Austral de Chile
cl7ccZQAAAAJ,0EUiosEAAAAJ,Ariel A. Muñoz,"Profesor Instituto de Geografía, Pontificia Universidad Católica de Valparaiso"
cl7ccZQAAAAJ,W3G8mmgAAAAJ,Ronald Rocco,"labgrs, PUCV"
cl7ccZQAAAAJ,HgAZcHYAAAAJ,Álvaro González-Reyes,"Instituto de Ciencias de la Tierra (ICT), Universidad Austral de Chile"
cl7ccZQAAAAJ,7emBPXYAAAAJ,Mathieu Decuyper,Wageningen University & Research
cl7ccZQAAAAJ,S5ghpBMAAAAJ,Isabella Aguilera-Betti,Pontificia Universidad Católica de Valparaíso
cl7ccZQAAAAJ,Qk3qyJEAAAAJ,Alvaro G. Gutierrez,Universidad de Chile
cl7ccZQAAAAJ,gqFj7SUAAAAJ,Andres Moreira-Munoz,Profesor Investigador Instituto de Geografía PUCV
JblohmAAAAAJ,rIHUmm4AAAAJ,David Pardo,"Ikerbasque, University of the Basque Country (UPV/EHU), and BCAM"
JblohmAAAAAJ,1yzDlKsAAAAJ,Victor M. Calo,"John Curtin Distinguished Professor, Professorial Chair in Computational Geoscience …"
JblohmAAAAAJ,ggDe1t4AAAAJ,Kristoffer G. van der Zee,"Associate Professor, University of Nottingham"
JblohmAAAAAJ,pZcq8a8AAAAJ,Jean-Claude NEDELEC,Professeur émérite CMAP Ecole Polytechnique
JblohmAAAAAJ,OnaO3OAAAAAJ,Leszek Demkowicz,"Professor of Engineering Mechanics and Mathematics, University of Texas at Austin"
JblohmAAAAAJ,JRbB5h8AAAAJ,Mario Manuel Durán Toro,Profesor Asociado del Departamento de Ingeniería de Minería de la Pontificia Universidad …
JblohmAAAAAJ,8pYjH_QAAAAJ,Sergio Rojas Hernández,"Instituto de Matemáticas, Pontificia Universidad Católica de Valparaíso"
JblohmAAAAAJ,PSXpeoYAAAAJ,Jay Gopalakrishnan,"Professor of Mathematics, Portland State University"
JblohmAAAAAJ,jhrXJRkAAAAJ,Marcin Łoś,AGH University of Science and Technology
JblohmAAAAAJ,5u0T3NkAAAAJ,Maciej Paszynski,"Institute of Computer Science, AGH University, Krakow"
JblohmAAAAAJ,KGZHdbAAAAAJ,Ignacio Brevis,"Research Fellow, University of Nottingham"
JblohmAAAAAJ,I-J9Dc8AAAAJ,Carlos Torres-Verdin,"University of Texas at Austin, Cockrell School of Engineering"
JblohmAAAAAJ,qivQkUcAAAAJ,Paweł J. Matuszyk,"RDD Scientist, Baker Hughes Company"
JblohmAAAAAJ,qqCseioAAAAJ,Vincent Darrigrand,CNRS-IRIT-ENSEEIHT
JblohmAAAAAJ,6g7374QAAAAJ,Ángel Rodríguez-Rozas,Quant Analyst - Model Validation at Banco Santander | PhD in Computational and Applied …
JblohmAAAAAJ,-cvJu50AAAAJ,Judit Muñoz-Matute,Basque Center for Applied Mathematics (BCAM)
JblohmAAAAAJ,bE2v0gMAAAAJ,Angel Mora,Tecnológico de Monterrey Campus Querétaro
JblohmAAAAAJ,_TmSJjgAAAAJ,Sarah Roggendorf,University of Cambridge
JblohmAAAAAJ,6e6OE7EAAAAJ,Paul Houston,"Chair in Computational Applied Mathematics, University of Nottingham"
JblohmAAAAAJ,TkRkDX0AAAAJ,Shaaban Ali Bakr,"Associate Professor,  Department of mathematics, University of Assiut, Egypt."
W9LKwFcAAAAJ,oIUIZqcAAAAJ,Jorge Mendoza Baeza,Escuela de Ingeniería Eléctrica - Pontificia Universidad Católica de Valparaíso
-Wl4jzwAAAAJ,Mu_EkRcAAAAJ,Luis Henrique Poersch,Federal University of Rio Grande - FURG
-Wl4jzwAAAAJ,c0artYkAAAAJ,Dariano Krummenauer,"Assistant Research Professor,  Oceanography Institute, Federal University of Rio Grande - FURG"
-Wl4jzwAAAAJ,QqRk8r4AAAAJ,Paulo Cesar Abreu,Institute of Oceanography - Federal University of Rio Grande - FURG
-Wl4jzwAAAAJ,sbApocYAAAAJ,Olivier Decamp,Product Manager - INVE Aquaculture
-Wl4jzwAAAAJ,zFLfRlMAAAAJ,Eduardo Luis Cupertino Ballester,Professor de Carcinicultura - Universidade Federal do Paraná - UFPR
-Wl4jzwAAAAJ,FuyxVJQAAAAJ,Adriana da Silva,"Profesor de Acuicultura, Universidad Autónoma de Yucatán"
XlcrkMkAAAAJ,1C_cImkAAAAJ,Paola Jiron Martinez,"Profesor Asociado, Universidad de Chile"
XlcrkMkAAAAJ,gqFj7SUAAAAJ,Andres Moreira-Munoz,Profesor Investigador Instituto de Geografía PUCV
XlcrkMkAAAAJ,agqX9ugAAAAJ,Walter Alejandro Imilan,Universidad Central de Chile
XlcrkMkAAAAJ,j0jLMmUAAAAJ,Alexander Panez Pinto,Universidad del Bío-Bío
XlcrkMkAAAAJ,GXHHflQAAAAJ,lautaro ojeda,Universidad de Valparaíso
XlcrkMkAAAAJ,-Di4rF4AAAAJ,Manuel Fuenzalida ,Universidad Alberto Hurtado
XlcrkMkAAAAJ,wD3x4a4AAAAJ,Juan Carlos Ramírez Rodríguez,"Profesor, Universidad de Guadalajara"
XlcrkMkAAAAJ,9RBm7SMAAAAJ,Sergio Elías Uribe Sierra,Pontificia Universidad Católica de Valparaíso
XlcrkMkAAAAJ,2XUN6-QAAAAJ,Rodrigo Figueroa Sterquel,Pontificia Universidad Catolica de Valparaiso
XlcrkMkAAAAJ,_avlm5MAAAAJ,SUSANA CORTES,"postdoctoral researcher, Universidad de la Frontera, Temuco"
XlcrkMkAAAAJ,YmhASvkAAAAJ,LETICIA BEATRIZ ARANCIBIA MARTI...,Pontificia Universidad Católica de Valparaíso
XlcrkMkAAAAJ,qvatBgQAAAAJ,Alejandra Toscana Aparicio,"Departamento de Política y Cultura, Universidad Autónoma Metropolitana"
XlcrkMkAAAAJ,SYur3RoAAAAJ,Fernando Venegas Espinoza,Académico Universidad de Concepción
ZRdkr0cAAAAJ,9eI25jMAAAAJ,Marcel G. Clerc,"Professor of Physics, FCFM, Department of Physics, University of Chile"
ZRdkr0cAAAAJ,7qVzqL8AAAAJ,Stefania Residori,CNRS
ZRdkr0cAAAAJ,CB5JkoUAAAAJ,Umberto Bortolozzo,HOASYS
ZRdkr0cAAAAJ,sY4n2tEAAAAJ,Saliya Coulibaly,"Laboratoire de Physique des Lasers, atomes et molecules, Université de Lille"
ZRdkr0cAAAAJ,oYLLopMAAAAJ,Claudio Falcón,"Associate Professor, DFI, FCFM, Universidad de Chile"
ZRdkr0cAAAAJ,lQoIQiAAAAAJ,Mederic Argentina,"Professor, Université Côte d'Azur"
ZRdkr0cAAAAJ,NnSycucAAAAJ,Eric Louvergneaux,"Associate professor, Université de Lille"
ZRdkr0cAAAAJ,TKDdBTkAAAAJ,David Laroze,"Professor of Physics, Universidad de Tarapacá"
ZRdkr0cAAAAJ,UA6ymM4AAAAJ,Javier Martinez,"Professor, P. Universidad Católica de Valparaiso"
miCMtj4AAAAJ,A7TVt0MAAAAJ,Gokul Iyer,"Scientist, Pacific Northwest National Laboratory"
miCMtj4AAAAJ,qhGbW2wAAAAJ,Sriram Sankaranarayanan,"Indian Institute of Management, Ahmedabad"
miCMtj4AAAAJ,D7Ms9fIAAAAJ,Sauleh Siddiqui,"Professor of Environmental Science and Mathematics & Statistics, American University"
miCMtj4AAAAJ,VogbE2sAAAAJ,Marshall Wise,Pacific Northwest National
miCMtj4AAAAJ,0NxGRB51Oj8C,James A. Edmonds,
miCMtj4AAAAJ,QMQA218AAAAJ,Diego A. Martínez,"Assistant Professor of Industrial Engineering, Pontificia Universidad Católica de Valparaíso"
miCMtj4AAAAJ,saTISvkAAAAJ,Charalampos Avraam,"Smart Cities Postdoctoral Associate, New York University"
miCMtj4AAAAJ,qiWtb6oAAAAJ,Daniel Huppmann,International Institute for Applied Systems Analysis (IIASA)
miCMtj4AAAAJ,CWwXkxcAAAAJ,Tapas K. Das,"Professor and Chair of Industrial and Management Systems Engineering, University of South Florida"
miCMtj4AAAAJ,DZsd7B8AAAAJ,Jae Edmonds,Pacific Northwest National Laboratory
zGA8HWYAAAAJ,4cGeq0AAAAAJ,Gonzalo Farias,"Pontificia Universidad Catolica de Valparaiso, UNED, CIEMAT"
zGA8HWYAAAAJ,U0XHBs8AAAAJ,Javier Ruiz-del-Solar,Universidad de Chile
zGA8HWYAAAAJ,Fv1lZNkAAAAJ,Rodrigo Verschae,Universidad de O'Higgins (UOH)
zGA8HWYAAAAJ,mF7oqmcAAAAJ,Mauricio Correa,AMTC - Universidad de Chile
zGA8HWYAAAAJ,hDMbFpoAAAAJ,Francisco Pizarro Torres,"Associate Professor, Escuela de Ingeniería Eléctrica, Pontificia Universidad Católica de Valparaíso"
zGA8HWYAAAAJ,lCma-igAAAAJ,CESAR SAN MARTIN SALAS,Universidad de La Frontera
zGA8HWYAAAAJ,ymoqnSgAAAAJ,Esteban Vera,Pontificia Universidad Catolica de Valparaiso
JGcGLdYAAAAJ,Y2RA_vMAAAAJ,Humberto González Estay,"Universidad Austral de Chile, Instituto de Ciencias Marinas y Limnológicas"
JGcGLdYAAAAJ,37oC8isAAAAJ,Fernando G Taboada,"Program in Atmospheric and Oceanic Sciences, Princeton University"
JGcGLdYAAAAJ,oq4KeeQAAAAJ,Ricardo Giesecke,Profesor Auxiliar Universidad Austral de Chile
JGcGLdYAAAAJ,yNufZM0AAAAJ,Mark Hopwood,"SUSTech, Shenzhen, China"
JGcGLdYAAAAJ,XwWH39QAAAAJ,José Luis Acuña,"Professor of Ecology, University of Oviedo"
JGcGLdYAAAAJ,gQFdnOYAAAAJ,Ricardo Anadon,Universidad de Oviedo - Dep. Biologia de Organismos y Sistemas - Retired
JGcGLdYAAAAJ,6m8XT0EAAAAJ,Mireia Mestre,Centro FONDAP de Investigación en Dinámica de Ecosistemas Marinos de Altas Latitudes (IDEAL)
JGcGLdYAAAAJ,TSEYJykAAAAJ,Axayacatl  Molina-Ramirez,Centre for Environment Fisheries & Aquaculture Science
JGcGLdYAAAAJ,J2WhlKMAAAAJ,Ricardo González-Gil,University of Strathclyde
JGcGLdYAAAAJ,2buCf84AAAAJ,Sonia Romero-Romero,"Postdoctoral Fellow, University of Hawaii at Manoa"
JGcGLdYAAAAJ,bqtkCzMAAAAJ,Lorenz Meire,"Senior Scientist at Greenland Climate Research Centre and NIOZ, Estuarine & Delta research"
JGcGLdYAAAAJ,eYzALc0AAAAJ,Andrea Piñones,Universidad Austral de Chile
JGcGLdYAAAAJ,-_urVBUAAAAJ,Ernesto Pino-Cortés,Pontificia Universidad Católica de Valparaíso
JGcGLdYAAAAJ,qOCXpPMAAAAJ,Carlos Cáceres,"French National Centre for Scientific Research, Observatoire océanologique de Banyuls sur Mer (OOB)"
GbPdJO4AAAAJ,TMyU98QAAAAJ,Pablo C. Guerrero,"Departamento de Botánica, Universidad de Concepción"
GbPdJO4AAAAJ,zhhpuNoAAAAJ,Luis Navarro,"Full Professor of Plant Sciences, University of Vigo"
GbPdJO4AAAAJ,q9oUJekAAAAJ,Francisco E. Fontúrbel,"Facultad de Ciencias, Pontificia Universidad Católica de Valparaíso"
GbPdJO4AAAAJ,qipmXpsAAAAJ,Fernanda Pérez Trautmann,Profesor Departamento de Ecología
GbPdJO4AAAAJ,RLAXrAcAAAAJ,Beatriz M. Meriño,Universidad de Concepción
GbPdJO4AAAAJ,LZd9fu8AAAAJ,Ramiro O Bustamante,"Full Professor, Universidad de Chile"
YXD6KnsAAAAJ,TCz_FngAAAAJ,Cristian Tejos,"Professor, Pontificia Universidad Catolica de Chile"
YXD6KnsAAAAJ,UiSXwdIAAAAJ,Berkin Bilgic,"Massachusetts General Hospital, Harvard Medical School"
YXD6KnsAAAAJ,lQMCl7gAAAAJ,Christian Langkammer,"Department of Neurology, Medical University of Graz, Austria"
YXD6KnsAAAAJ,_-CaQ9wAAAAJ,Julio Acosta-Cabronero,Senior R&D Lead at Luminance Technologies
YXD6KnsAAAAJ,F1ZwUloAAAAJ,José P. Marques,"Associate PI, Radboud University, Nijmegen, The Netherlands"
YXD6KnsAAAAJ,9EM2bHIAAAAJ,Pablo Irarrazaval,Pontificia Universidad Catolica de Chile
YXD6KnsAAAAJ,Qo5PDKIAAAAJ,Karin Shmueli,"Professor of Magnetic Resonance Imaging Physics, UCL Medical Physics & Biomedical Engineering"
YXD6KnsAAAAJ,Zps6LIMAAAAJ,Ferdinand Schweser,"Associate Professor, University at Buffalo, The State University of New York"
YXD6KnsAAAAJ,c1iKsfIAAAAJ,Kristian Bredies,University of Graz
2IrXYCcAAAAJ,P9DAbZoAAAAJ,Irene Renau,Pontificia Universidad Católica de Valparaíso
2IrXYCcAAAAJ,kSyWwEIAAAAJ,Leo Wanner,"ICREA Research Professor, Pompeu Fabra University"
2IrXYCcAAAAJ,07dj2xIAAAAJ,M. Teresa Cabré,"University Institute for Applied Linguistics (IULA), Universitat Pompeu Fabra (UPF)"
2IrXYCcAAAAJ,6eIm55MAAAAJ,Gabriela Ferraro,"CSIRO DATA61 Research Scientists and Adjunct Research Fellow Australian National University, College"
2IrXYCcAAAAJ,0xNdKSAAAAAJ,JORGE VIVALDI PALATRESI,"Researcher at University Institute for Applied Linguistics, Pompeu Fabra University"
2IrXYCcAAAAJ,TW5sjMAAAAAJ,Margarita Alonso-Ramos,Universidade da Coruña
2IrXYCcAAAAJ,YiTQF-YAAAAJ,Hernán Robledo Nakagawa,"Estudiante de Doctorado en Lingüística, Pontificia Universidad Católica de Valparaíso"
2IrXYCcAAAAJ,0P6qA6wAAAAJ,Orsolya Vincze,university of a coruña
2IrXYCcAAAAJ,e5C0wQoAAAAJ,Maria Fuentes Fort,"Language & Speech Technologist at TALP, UPC. Previously, Assistant Professor at UdG"
2IrXYCcAAAAJ,bX1lYWUAAAAJ,Jordi Atserias,Amazon
2IrXYCcAAAAJ,4OZUHj8AAAAJ,Rafael Marin,"CNRS Researcher, Université de Lille, UMR STL (8163)"
2IrXYCcAAAAJ,wygfh0EAAAAJ,David Lindemann,UPV/EHU University of the Basque Country
